"No.","Time","Source","Destination","Protocol","Length","Time delta from previous displayed frame","Signal strength (dBm)","The RTT to ACK the segment was","Info"
"881","4.287694","10.1.0.11","10.1.0.9","TCP","138","0.000000000","-32 dBm","","49161  >  7016 [SYN] Seq=0 Win=65535 Len=0 TSval=4300 TSecr=0 WS=4 SACK_PERM=1"
"884","4.287849","10.1.0.9","10.1.0.11","TCP","138","0.000155000","","0.000155000","7016  >  49161 [SYN, ACK] Seq=0 Ack=1 Win=65535 Len=0 TSval=4300 TSecr=4300 WS=4 SACK_PERM=1"
"887","4.288115","10.1.0.11","10.1.0.9","TCP","134","0.000266000","-32 dBm","0.000266000","49161  >  7016 [ACK] Seq=1 Ack=1 Win=131072 Len=0 TSval=4300 TSecr=4300"
"896","4.288818","10.1.0.9","10.1.0.11","TCP","138","0.000703000","","","49153  >  7017 [SYN] Seq=0 Win=65535 Len=0 TSval=4300 TSecr=0 WS=4 SACK_PERM=1"
"899","4.289093","10.1.0.11","10.1.0.9","TCP","138","0.000275000","-32 dBm","0.000275000","7017  >  49153 [SYN, ACK] Seq=0 Ack=1 Win=65535 Len=0 TSval=4301 TSecr=4300 WS=4 SACK_PERM=1"
"902","4.289266","10.1.0.9","10.1.0.11","TCP","134","0.000173000","","0.000173000","49153  >  7017 [ACK] Seq=1 Ack=1 Win=131072 Len=0 TSval=4301 TSecr=4301"
"1009","4.838953","10.1.0.11","10.1.0.9","TCP","1134","0.549687000","-32 dBm","","49161  >  7016 [ACK] Seq=1 Ack=1 Win=131072 Len=1000 TSval=4851 TSecr=4300"
"1023","4.840017","10.1.0.11","10.1.0.9","TCP","1134","0.001064000","-32 dBm","","49161  >  7016 [ACK] Seq=1001 Ack=1 Win=131072 Len=1000 TSval=4852 TSecr=4300"
"1043","4.841761","10.1.0.11","10.1.0.9","TCP","2224","0.001744000","-32 dBm","","49161  >  7016 [ACK] Seq=3001 Ack=1 Win=131072 Len=1000 TSval=4853 TSecr=4300"
"1063","4.843697","10.1.0.11","10.1.0.9","TCP","3300","0.001936000","-32 dBm","","49161  >  7016 [ACK] Seq=6001 Ack=1 Win=131072 Len=1000 TSval=4856 TSecr=4300"
"1090","4.847401","10.1.0.11","10.1.0.9","TCP","4376","0.003704000","-32 dBm","","49161  >  7016 [ACK] Seq=10001 Ack=1 Win=131072 Len=1000 TSval=4859 TSecr=4300"
"1110","4.849706","10.1.0.11","10.1.0.9","TCP","3300","0.002305000","-32 dBm","","49161  >  7016 [ACK] Seq=13001 Ack=1 Win=131072 Len=1000 TSval=4861 TSecr=4300"
"1127","4.851167","10.1.0.9","10.1.0.11","TCP","6528","0.001461000","","","49153  >  7017 [ACK] Seq=5001 Ack=1 Win=131072 Len=1000 TSval=4856 TSecr=4301"
"1128","4.851167","10.1.0.9","10.1.0.11","TCP","6528","0.000000000","","","49153  >  7017 [ACK] Seq=11001 Ack=1 Win=131072 Len=1000 TSval=4861 TSecr=4301"
"1129","4.851167","10.1.0.9","10.1.0.11","TCP","3300","0.000000000","","","49153  >  7017 [ACK] Seq=14001 Ack=1 Win=131072 Len=1000 TSval=4863 TSecr=4301"
"1153","4.857050","10.1.0.9","10.1.0.11","TCP","604","0.005883000","","0.018097000,0.015289000,0.013353000,0.013353000,0.009649000,0.009649000,0.007344000","7016  >  49161 [ACK] Seq=1 Ack=13001 Win=131072 Len=0 TSval=4862 TSecr=4860"
"1187","4.861166","10.1.0.11","10.1.0.9","TCP","1134","0.004116000","-32 dBm","","49161  >  7016 [ACK] Seq=14001 Ack=1 Win=131072 Len=1000 TSval=4862 TSecr=4300"
"1249","4.868307","10.1.0.9","10.1.0.11","TCP","604","0.007141000","","","7016  >  49161 [ACK] Seq=1 Ack=13001 Win=131072 Len=0 TSval=4862 TSecr=4860"
"1250","4.868307","10.1.0.9","10.1.0.11","TCP","134","0.000000000","","0.007141000","7016  >  49161 [ACK] Seq=1 Ack=15001 Win=131072 Len=0 TSval=4873 TSecr=4861"
"1288","4.872359","10.1.0.9","10.1.0.11","TCP","604","0.004052000","","","7016  >  49161 [ACK] Seq=1 Ack=13001 Win=131072 Len=0 TSval=4862 TSecr=4860"
"1289","4.872359","10.1.0.9","10.1.0.11","TCP","134","0.000000000","","","7016  >  49161 [ACK] Seq=1 Ack=15001 Win=131072 Len=0 TSval=4873 TSecr=4861"
"1302","4.874570","10.1.0.11","10.1.0.9","TCP","6376","0.002211000","-32 dBm","","49161  >  7016 [ACK] Seq=19501 Ack=1 Win=131072 Len=1500 TSval=4884 TSecr=4854"
"1303","4.874570","10.1.0.11","10.1.0.9","TCP","6376","0.000000000","-32 dBm","","49161  >  7016 [ACK] Seq=25501 Ack=1 Win=131072 Len=1500 TSval=4884 TSecr=4856"
"1304","4.874570","10.1.0.11","10.1.0.9","TCP","6376","0.000000000","-32 dBm","","49161  >  7016 [ACK] Seq=31501 Ack=1 Win=131072 Len=1500 TSval=4884 TSecr=4859"
"1305","4.874570","10.1.0.11","10.1.0.9","TCP","6376","0.000000000","-32 dBm","","49161  >  7016 [ACK] Seq=37501 Ack=1 Win=131072 Len=1500 TSval=4884 TSecr=4862"
"1306","4.874570","10.1.0.11","10.1.0.9","TCP","5376","0.000000000","-32 dBm","","49161  >  7016 [ACK] Seq=43001 Ack=1 Win=131072 Len=1000 TSval=4885 TSecr=4873"
"1312","4.875094","10.1.0.11","10.1.0.9","TCP","1134","0.000524000","-32 dBm","","49161  >  7016 [ACK] Seq=44001 Ack=1 Win=131072 Len=1000 TSval=4886 TSecr=4873"
"1341","4.878021","10.1.0.9","10.1.0.11","TCP","832","0.002927000","","0.003451000,0.003451000,0.003451000,0.003451000,0.003451000,0.003451000,0.003451000,0.003451000,0.003451000,0.003451000","7016  >  49161 [ACK] Seq=1 Ack=44001 Win=131072 Len=0 TSval=4887 TSecr=4884"
"1350","4.879095","10.1.0.11","10.1.0.9","TCP","6452","0.001074000","-32 dBm","","49161  >  7016 [ACK] Seq=50001 Ack=1 Win=131072 Len=1000 TSval=4891 TSecr=4887"
"1360","4.879855","10.1.0.11","10.1.0.9","TCP","1134","0.000760000","-32 dBm","","49161  >  7016 [ACK] Seq=51001 Ack=1 Win=131072 Len=1000 TSval=4892 TSecr=4887"
"1394","4.882514","10.1.0.11","10.1.0.9","TCP","3300","0.002659000","-32 dBm","","49161  >  7016 [ACK] Seq=54001 Ack=1 Win=131072 Len=1000 TSval=4894 TSecr=4887"
"1420","4.887014","10.1.0.11","10.1.0.9","TCP","6528","0.004500000","-32 dBm","","49161  >  7016 [ACK] Seq=60001 Ack=1 Win=131072 Len=1000 TSval=4899 TSecr=4887"
"1430","4.888129","10.1.0.11","10.1.0.9","TCP","1134","0.001115000","-32 dBm","","49161  >  7016 [ACK] Seq=61001 Ack=1 Win=131072 Len=1000 TSval=4900 TSecr=4887"
"1438","4.888737","10.1.0.11","10.1.0.9","TCP","1134","0.000608000","-32 dBm","","49161  >  7016 [ACK] Seq=62001 Ack=1 Win=131072 Len=1000 TSval=4900 TSecr=4887"
"1445","4.889196","10.1.0.9","10.1.0.11","TCP","756","0.000459000","","0.010101000,0.010101000,0.010101000,0.006682000,0.006682000,0.002182000,0.002182000,0.002182000,0.000459000","7016  >  49161 [ACK] Seq=1 Ack=63001 Win=131072 Len=0 TSval=4901 TSecr=4900"
"1457","4.890548","10.1.0.11","10.1.0.9","TCP","2224","0.001352000","-32 dBm","","49161  >  7016 [ACK] Seq=64001 Ack=1 Win=131072 Len=1000 TSval=4902 TSecr=4901"
"1475","4.892972","10.1.0.11","10.1.0.9","TCP","3300","0.002424000","-32 dBm","","49161  >  7016 [ACK] Seq=67001 Ack=1 Win=131072 Len=1000 TSval=4904 TSecr=4901"
"1487","4.894236","10.1.0.11","10.1.0.9","TCP","2224","0.001264000","-32 dBm","","49161  >  7016 [ACK] Seq=69001 Ack=1 Win=131072 Len=1000 TSval=4906 TSecr=4901"
"1501","4.895332","10.1.0.11","10.1.0.9","TCP","1134","0.001096000","-32 dBm","","49161  >  7016 [ACK] Seq=70001 Ack=1 Win=131072 Len=1000 TSval=4907 TSecr=4901"
"1514","4.896371","10.1.0.11","10.1.0.9","TCP","1134","0.001039000","-32 dBm","","49161  >  7016 [ACK] Seq=71001 Ack=1 Win=131072 Len=1000 TSval=4908 TSecr=4901"
"1524","4.897164","10.1.0.11","10.1.0.9","TCP","1134","0.000793000","-32 dBm","","49161  >  7016 [ACK] Seq=72001 Ack=1 Win=131072 Len=1000 TSval=4908 TSecr=4901"
"1534","4.897956","10.1.0.11","10.1.0.9","TCP","1134","0.000792000","-32 dBm","","49161  >  7016 [ACK] Seq=73001 Ack=1 Win=131072 Len=1000 TSval=4909 TSecr=4901"
"1544","4.898748","10.1.0.11","10.1.0.9","TCP","1134","0.000792000","-32 dBm","","49161  >  7016 [ACK] Seq=74001 Ack=1 Win=131072 Len=1000 TSval=4910 TSecr=4901"
"1554","4.899508","10.1.0.11","10.1.0.9","TCP","1134","0.000760000","-32 dBm","","49161  >  7016 [ACK] Seq=75001 Ack=1 Win=131072 Len=1000 TSval=4911 TSecr=4901"
"1566","4.900516","10.1.0.11","10.1.0.9","TCP","2224","0.001008000","-32 dBm","","49161  >  7016 [ACK] Seq=77001 Ack=1 Win=131072 Len=1000 TSval=4912 TSecr=4901"
"1584","4.901988","10.1.0.11","10.1.0.9","TCP","1134","0.001472000","-32 dBm","","49161  >  7016 [ACK] Seq=78001 Ack=1 Win=131072 Len=1000 TSval=4913 TSecr=4901"
"1594","4.902780","10.1.0.11","10.1.0.9","TCP","1134","0.000792000","-32 dBm","","49161  >  7016 [ACK] Seq=79001 Ack=1 Win=131072 Len=1000 TSval=4914 TSecr=4901"
"1604","4.903572","10.1.0.11","10.1.0.9","TCP","1134","0.000792000","-32 dBm","","49161  >  7016 [ACK] Seq=80001 Ack=1 Win=131072 Len=1000 TSval=4915 TSecr=4901"
"1614","4.904365","10.1.0.11","10.1.0.9","TCP","1134","0.000793000","-32 dBm","","49161  >  7016 [ACK] Seq=81001 Ack=1 Win=131072 Len=1000 TSval=4916 TSecr=4901"
"1624","4.905157","10.1.0.11","10.1.0.9","TCP","1134","0.000792000","-32 dBm","","49161  >  7016 [ACK] Seq=82001 Ack=1 Win=131072 Len=1000 TSval=4916 TSecr=4901"
"1634","4.905949","10.1.0.11","10.1.0.9","TCP","1134","0.000792000","-32 dBm","","49161  >  7016 [ACK] Seq=83001 Ack=1 Win=131072 Len=1000 TSval=4917 TSecr=4901"
"1645","4.906854","10.1.0.11","10.1.0.9","TCP","2224","0.000905000","-32 dBm","","49161  >  7016 [ACK] Seq=85001 Ack=1 Win=131072 Len=1000 TSval=4919 TSecr=4901"
"1657","4.907926","10.1.0.11","10.1.0.9","TCP","1134","0.001072000","-32 dBm","","49161  >  7016 [ACK] Seq=86001 Ack=1 Win=131072 Len=1000 TSval=4920 TSecr=4901"
"1669","4.908838","10.1.0.11","10.1.0.9","TCP","1134","0.000912000","-32 dBm","","49161  >  7016 [ACK] Seq=87001 Ack=1 Win=131072 Len=1000 TSval=4920 TSecr=4901"
"1681","4.909750","10.1.0.11","10.1.0.9","TCP","1134","0.000912000","-32 dBm","","49161  >  7016 [ACK] Seq=88001 Ack=1 Win=131072 Len=1000 TSval=4921 TSecr=4901"
"1693","4.910662","10.1.0.11","10.1.0.9","TCP","1134","0.000912000","-32 dBm","","49161  >  7016 [ACK] Seq=89001 Ack=1 Win=131072 Len=1000 TSval=4922 TSecr=4901"
"1705","4.911639","10.1.0.11","10.1.0.9","TCP","2224","0.000977000","-32 dBm","","49161  >  7016 [ACK] Seq=91001 Ack=1 Win=131072 Len=1000 TSval=4924 TSecr=4901"
"1709","4.911919","10.1.0.9","10.1.0.11","TCP","1136","0.000280000","","0.021371000,0.018947000,0.017683000,0.016587000,0.014755000,0.013171000,0.011403000,0.009931000,0.008347000,0.006762000,0.005065000,0.003993000,0.002169000,0.000280000","7016  >  49161 [ACK] Seq=1 Ack=91001 Win=131072 Len=0 TSval=4924 TSecr=4922"
"1721","4.913128","10.1.0.11","10.1.0.9","TCP","1134","0.001209000","-32 dBm","","49161  >  7016 [ACK] Seq=92001 Ack=1 Win=131072 Len=1000 TSval=4924 TSecr=4901"
"1729","4.913736","10.1.0.11","10.1.0.9","TCP","1134","0.000608000","-32 dBm","","49161  >  7016 [ACK] Seq=93001 Ack=1 Win=131072 Len=1000 TSval=4925 TSecr=4901"
"1741","4.914648","10.1.0.11","10.1.0.9","TCP","1134","0.000912000","-32 dBm","","49161  >  7016 [ACK] Seq=94001 Ack=1 Win=131072 Len=1000 TSval=4926 TSecr=4901"
"1753","4.915592","10.1.0.11","10.1.0.9","TCP","1134","0.000944000","-32 dBm","","49161  >  7016 [ACK] Seq=95001 Ack=1 Win=131072 Len=1000 TSval=4927 TSecr=4901"
"1763","4.916384","10.1.0.11","10.1.0.9","TCP","1134","0.000792000","-32 dBm","","49161  >  7016 [ACK] Seq=96001 Ack=1 Win=131072 Len=1000 TSval=4928 TSecr=4901"
"1773","4.917176","10.1.0.11","10.1.0.9","TCP","1134","0.000792000","-32 dBm","","49161  >  7016 [ACK] Seq=97001 Ack=1 Win=131072 Len=1000 TSval=4928 TSecr=4901"
"1785","4.918519","10.1.0.11","10.1.0.9","TCP","2224","0.001343000","-32 dBm","","49161  >  7016 [ACK] Seq=99001 Ack=1 Win=131072 Len=1000 TSval=4930 TSecr=4901"
"1797","4.919496","10.1.0.11","10.1.0.9","TCP","1134","0.000977000","-32 dBm","","49161  >  7016 [ACK] Seq=100001 Ack=1 Win=131072 Len=1000 TSval=4931 TSecr=4901"
"1807","4.920256","10.1.0.11","10.1.0.9","TCP","1134","0.000760000","-32 dBm","","49161  >  7016 [ACK] Seq=101001 Ack=1 Win=131072 Len=1000 TSval=4932 TSecr=4901"
"1819","4.921200","10.1.0.11","10.1.0.9","TCP","1134","0.000944000","-32 dBm","","49161  >  7016 [ACK] Seq=102001 Ack=1 Win=131072 Len=1000 TSval=4932 TSecr=4901"
"1827","4.921840","10.1.0.11","10.1.0.9","TCP","1134","0.000640000","-32 dBm","","49161  >  7016 [ACK] Seq=103001 Ack=1 Win=131072 Len=1000 TSval=4933 TSecr=4901"
"1833","4.922296","10.1.0.11","10.1.0.9","TCP","1134","0.000456000","-32 dBm","","49161  >  7016 [ACK] Seq=104001 Ack=1 Win=131072 Len=1000 TSval=4934 TSecr=4901"
"1840","4.922950","10.1.0.9","10.1.0.11","TCP","1136","0.000654000","","","7016  >  49161 [ACK] Seq=1 Ack=91001 Win=131072 Len=0 TSval=4924 TSecr=4922"
"1841","4.922950","10.1.0.9","10.1.0.11","TCP","604","0.000000000","","0.009822000,0.008302000,0.006566000,0.004431000,0.003454000,0.001750000,0.000654000","7016  >  49161 [ACK] Seq=1 Ack=105001 Win=131072 Len=0 TSval=4934 TSecr=4933"
"1844","4.923302","10.1.0.11","10.1.0.9","TCP","680","0.000352000","-32 dBm","0.072135000,0.072135000,0.072135000,0.072135000,0.072135000,0.072135000,0.072135000,0.072135000","7017  >  49153 [ACK] Seq=1 Ack=15001 Win=131072 Len=0 TSval=4864 TSecr=4862"
"1865","4.924672","10.1.0.9","10.1.0.11","TCP","6376","0.001370000","","","49153  >  7017 [ACK] Seq=19501 Ack=1 Win=131072 Len=1500 TSval=4935 TSecr=4863"
"1866","4.924672","10.1.0.9","10.1.0.11","TCP","6376","0.000000000","","","49153  >  7017 [ACK] Seq=25501 Ack=1 Win=131072 Len=1500 TSval=4935 TSecr=4864"
"1867","4.924672","10.1.0.9","10.1.0.11","TCP","6376","0.000000000","","","49153  >  7017 [ACK] Seq=31501 Ack=1 Win=131072 Len=1500 TSval=4935 TSecr=4864"
"1868","4.924672","10.1.0.9","10.1.0.11","TCP","6376","0.000000000","","","49153  >  7017 [ACK] Seq=37501 Ack=1 Win=131072 Len=1500 TSval=4935 TSecr=4864"
"1869","4.924672","10.1.0.9","10.1.0.11","TCP","6376","0.000000000","","","49153  >  7017 [ACK] Seq=43501 Ack=1 Win=131072 Len=1500 TSval=4935 TSecr=4864"
"1901","4.932303","10.1.0.11","10.1.0.9","TCP","6528","0.007631000","-32 dBm","","49161  >  7016 [ACK] Seq=110001 Ack=1 Win=131072 Len=1000 TSval=4939 TSecr=4934"
"1902","4.932303","10.1.0.11","10.1.0.9","TCP","6528","0.000000000","-32 dBm","","49161  >  7016 [ACK] Seq=116001 Ack=1 Win=131072 Len=1000 TSval=4944 TSecr=4934"
"1909","4.933184","10.1.0.11","10.1.0.9","TCP","1134","0.000881000","-32 dBm","","49161  >  7016 [ACK] Seq=117001 Ack=1 Win=131072 Len=1000 TSval=4944 TSecr=4934"
"1913","4.933488","10.1.0.11","10.1.0.9","TCP","1134","0.000304000","-32 dBm","","49161  >  7016 [ACK] Seq=118001 Ack=1 Win=131072 Len=1000 TSval=4945 TSecr=4934"
"1916","4.935004","10.1.0.11","10.1.0.9","TCP","2224","0.001516000","-32 dBm","","49161  >  7016 [ACK] Seq=120001 Ack=1 Win=131072 Len=1000 TSval=4947 TSecr=4934"
"1963","4.941923","10.1.0.11","10.1.0.9","TCP","2224","0.006919000","-32 dBm","","49161  >  7016 [ACK] Seq=122001 Ack=1 Win=131072 Len=1000 TSval=4948 TSecr=4934"
"1964","4.941923","10.1.0.11","10.1.0.9","TCP","6528","0.000000000","-32 dBm","","49161  >  7016 [ACK] Seq=128001 Ack=1 Win=131072 Len=1000 TSval=4953 TSecr=4934"
"1977","4.944279","10.1.0.11","10.1.0.9","TCP","3300","0.002356000","-32 dBm","","49161  >  7016 [ACK] Seq=131001 Ack=1 Win=131072 Len=1000 TSval=4956 TSecr=4934"
"1981","4.944647","10.1.0.11","10.1.0.9","TCP","1134","0.000368000","-32 dBm","","49161  >  7016 [ACK] Seq=132001 Ack=1 Win=131072 Len=1000 TSval=4956 TSecr=4934"
"1986","4.944935","10.1.0.9","10.1.0.11","TCP","6376","0.000288000","","","[TCP Retransmission] [TCP Retransmission] [TCP Retransmission] [TCP Retransmission] 49153  >  7017 [ACK] Seq=19501 Ack=1 Win=131072 Len=1500 TSval=4935 TSecr=4863"
"1987","4.944935","10.1.0.9","10.1.0.11","TCP","6376","0.000000000","","","[TCP Retransmission] [TCP Retransmission] [TCP Retransmission] [TCP Retransmission] 49153  >  7017 [ACK] Seq=25501 Ack=1 Win=131072 Len=1500 TSval=4935 TSecr=4864"
"1988","4.944935","10.1.0.9","10.1.0.11","TCP","6376","0.000000000","","","[TCP Retransmission] [TCP Retransmission] [TCP Retransmission] [TCP Retransmission] 49153  >  7017 [ACK] Seq=31501 Ack=1 Win=131072 Len=1500 TSval=4935 TSecr=4864"
"1989","4.944935","10.1.0.9","10.1.0.11","TCP","6376","0.000000000","","","[TCP Retransmission] [TCP Retransmission] [TCP Retransmission] [TCP Retransmission] 49153  >  7017 [ACK] Seq=37501 Ack=1 Win=131072 Len=1500 TSval=4935 TSecr=4864"
"1990","4.944935","10.1.0.9","10.1.0.11","TCP","6376","0.000000000","","","[TCP Retransmission] [TCP Retransmission] [TCP Retransmission] [TCP Retransmission] 49153  >  7017 [ACK] Seq=43501 Ack=1 Win=131072 Len=1500 TSval=4935 TSecr=4864"
"1993","4.946354","10.1.0.9","10.1.0.11","TCP","1136","0.001419000","","0.014051000,0.014051000,0.014051000,0.014051000,0.014051000,0.014051000,0.012866000,0.011350000,0.004431000,0.004431000,0.004431000,0.004431000,0.002075000,0.001707000","7016  >  49161 [ACK] Seq=1 Ack=133001 Win=131072 Len=0 TSval=4957 TSecr=4956"
"2026","4.950632","10.1.0.11","10.1.0.9","TCP","2224","0.004278000","-32 dBm","","49161  >  7016 [ACK] Seq=134001 Ack=1 Win=131072 Len=1000 TSval=4958 TSecr=4934"
"2027","4.950632","10.1.0.11","10.1.0.9","TCP","5452","0.000000000","-32 dBm","","49161  >  7016 [ACK] Seq=139001 Ack=1 Win=131072 Len=1000 TSval=4962 TSecr=4957"
"2070","4.959206","10.1.0.11","10.1.0.9","TCP","6528","0.008574000","-32 dBm","","49161  >  7016 [ACK] Seq=145001 Ack=1 Win=131072 Len=1000 TSval=4967 TSecr=4957"
"2071","4.959206","10.1.0.11","10.1.0.9","TCP","5452","0.000000000","-32 dBm","","49161  >  7016 [ACK] Seq=150001 Ack=1 Win=131072 Len=1000 TSval=4971 TSecr=4957"
"2082","4.960886","10.1.0.11","10.1.0.9","TCP","2224","0.001680000","-32 dBm","","49161  >  7016 [ACK] Seq=152001 Ack=1 Win=131072 Len=1000 TSval=4972 TSecr=4957"
"2091","4.961804","10.1.0.11","10.1.0.9","TCP","1134","0.000918000","-32 dBm","","49161  >  7016 [ACK] Seq=153001 Ack=1 Win=131072 Len=1000 TSval=4973 TSecr=4957"
"2099","4.962412","10.1.0.11","10.1.0.9","TCP","1134","0.000608000","-32 dBm","","49161  >  7016 [ACK] Seq=154001 Ack=1 Win=131072 Len=1000 TSval=4974 TSecr=4957"
"2107","4.963020","10.1.0.11","10.1.0.9","TCP","1134","0.000608000","-32 dBm","","49161  >  7016 [ACK] Seq=155001 Ack=1 Win=131072 Len=1000 TSval=4975 TSecr=4957"
"2116","4.963723","10.1.0.11","10.1.0.9","TCP","1134","0.000703000","-32 dBm","","49161  >  7016 [ACK] Seq=156001 Ack=1 Win=131072 Len=1000 TSval=4976 TSecr=4957"
"2142","4.966694","10.1.0.11","10.1.0.9","TCP","3300","0.002971000","-32 dBm","","49161  >  7016 [ACK] Seq=159001 Ack=1 Win=131072 Len=1000 TSval=4978 TSecr=4957"
"2163","4.970010","10.1.0.11","10.1.0.9","TCP","4376","0.003316000","-32 dBm","","49161  >  7016 [ACK] Seq=163001 Ack=1 Win=131072 Len=1000 TSval=4981 TSecr=4957"
"2169","4.970581","10.1.0.9","10.1.0.11","TCP","1212","0.000571000","","0.019949000,0.019949000,0.019949000,0.011375000,0.011375000,0.011375000,0.011375000,0.011375000,0.011375000,0.009695000,0.008169000,0.006858000,0.003887000,0.000571000,0.000571000","7016  >  49161 [ACK] Seq=1 Ack=163001 Win=131072 Len=0 TSval=4982 TSecr=4980"
"2178","4.971505","10.1.0.11","10.1.0.9","TCP","2224","0.000924000","-32 dBm","","49161  >  7016 [ACK] Seq=165001 Ack=1 Win=131072 Len=1000 TSval=4983 TSecr=4982"
"2182","4.971809","10.1.0.11","10.1.0.9","TCP","1134","0.000304000","-32 dBm","","49161  >  7016 [ACK] Seq=166001 Ack=1 Win=131072 Len=1000 TSval=4984 TSecr=4982"
"2203","4.974588","10.1.0.11","10.1.0.9","TCP","3300","0.002779000","-32 dBm","","49161  >  7016 [ACK] Seq=169001 Ack=1 Win=131072 Len=1000 TSval=4986 TSecr=4982"
"2209","4.975108","10.1.0.11","10.1.0.9","TCP","1134","0.000520000","-32 dBm","","49161  >  7016 [ACK] Seq=170001 Ack=1 Win=131072 Len=1000 TSval=4987 TSecr=4982"
"2228","4.976617","10.1.0.11","10.1.0.9","TCP","2224","0.001509000","-32 dBm","","49161  >  7016 [ACK] Seq=172001 Ack=1 Win=131072 Len=1000 TSval=4988 TSecr=4982"
"2249","4.979953","10.1.0.11","10.1.0.9","TCP","4376","0.003336000","-32 dBm","","49161  >  7016 [ACK] Seq=176001 Ack=1 Win=131072 Len=1000 TSval=4992 TSecr=4982"
"2257","4.980657","10.1.0.11","10.1.0.9","TCP","1134","0.000704000","-32 dBm","","49161  >  7016 [ACK] Seq=177001 Ack=1 Win=131072 Len=1000 TSval=4992 TSecr=4982"
"2264","4.981116","10.1.0.9","10.1.0.11","TCP","604","0.000459000","","0.009611000,0.009307000,0.006528000,0.006008000,0.004499000,0.001163000,0.001163000","7016  >  49161 [ACK] Seq=1 Ack=177001 Win=131072 Len=0 TSval=4992 TSecr=4991"
"2269","4.981591","10.1.0.11","10.1.0.9","TCP","1134","0.000475000","-32 dBm","","49161  >  7016 [ACK] Seq=178001 Ack=1 Win=131072 Len=1000 TSval=4993 TSecr=4982"
"2277","4.982200","10.1.0.11","10.1.0.9","TCP","1134","0.000609000","-32 dBm","","49161  >  7016 [ACK] Seq=179001 Ack=1 Win=131072 Len=1000 TSval=4994 TSecr=4992"
"2286","4.983090","10.1.0.11","10.1.0.9","TCP","1134","0.000890000","-32 dBm","","49161  >  7016 [ACK] Seq=180001 Ack=1 Win=131072 Len=1000 TSval=4995 TSecr=4992"
"2293","4.983549","10.1.0.9","10.1.0.11","TCP","224","0.000459000","","0.001958000,0.000459000","7016  >  49161 [ACK] Seq=1 Ack=181001 Win=131072 Len=0 TSval=4995 TSecr=4994"
"2299","4.984521","10.1.0.11","10.1.0.9","TCP","2224","0.000972000","-32 dBm","","49161  >  7016 [ACK] Seq=182001 Ack=1 Win=131072 Len=1000 TSval=4996 TSecr=4992"
"2320","4.987661","10.1.0.11","10.1.0.9","TCP","3300","0.003140000","-32 dBm","","49161  >  7016 [ACK] Seq=185001 Ack=1 Win=131072 Len=1000 TSval=4999 TSecr=4992"
"2326","4.988213","10.1.0.11","10.1.0.9","TCP","1134","0.000552000","-32 dBm","","49161  >  7016 [ACK] Seq=186001 Ack=1 Win=131072 Len=1000 TSval=5000 TSecr=4992"
"2332","4.988669","10.1.0.11","10.1.0.9","TCP","1134","0.000456000","-32 dBm","","49161  >  7016 [ACK] Seq=187001 Ack=1 Win=131072 Len=1000 TSval=5000 TSecr=4992"
"2344","4.989824","10.1.0.11","10.1.0.9","TCP","1134","0.001155000","-32 dBm","","49161  >  7016 [ACK] Seq=188001 Ack=1 Win=131072 Len=1000 TSval=5001 TSecr=4992"
"2358","4.991756","10.1.0.11","10.1.0.9","TCP","3300","0.001932000","-32 dBm","","49161  >  7016 [ACK] Seq=191001 Ack=1 Win=131072 Len=1000 TSval=5004 TSecr=4992"
"2372","4.992917","10.1.0.11","10.1.0.9","TCP","1134","0.001161000","-32 dBm","","49161  >  7016 [ACK] Seq=192001 Ack=1 Win=131072 Len=1000 TSval=5004 TSecr=4992"
"2382","4.993677","10.1.0.11","10.1.0.9","TCP","1134","0.000760000","-32 dBm","","49161  >  7016 [ACK] Seq=193001 Ack=1 Win=131072 Len=1000 TSval=5005 TSecr=4992"
"2392","4.994437","10.1.0.11","10.1.0.9","TCP","1134","0.000760000","-32 dBm","","49161  >  7016 [ACK] Seq=194001 Ack=1 Win=131072 Len=1000 TSval=5006 TSecr=4992"
"2401","4.995252","10.1.0.9","10.1.0.11","TCP","224","0.000815000","","","7016  >  49161 [ACK] Seq=1 Ack=181001 Win=131072 Len=0 TSval=4995 TSecr=4994"
"2402","4.995252","10.1.0.9","10.1.0.11","TCP","604","0.000000000","","0.010731000,0.007591000,0.007039000,0.005428000,0.003496000,0.002335000,0.000815000","7016  >  49161 [ACK] Seq=1 Ack=195001 Win=131072 Len=0 TSval=5006 TSecr=5005"
"2411","4.996073","10.1.0.11","10.1.0.9","TCP","2224","0.000821000","-32 dBm","","49161  >  7016 [ACK] Seq=196001 Ack=1 Win=131072 Len=1000 TSval=5008 TSecr=5006"
"2421","4.996929","10.1.0.11","10.1.0.9","TCP","1134","0.000856000","-32 dBm","","49161  >  7016 [ACK] Seq=197001 Ack=1 Win=131072 Len=1000 TSval=5008 TSecr=5006"
"2431","4.997689","10.1.0.11","10.1.0.9","TCP","1134","0.000760000","-32 dBm","","49161  >  7016 [ACK] Seq=198001 Ack=1 Win=131072 Len=1000 TSval=5009 TSecr=5006"
"2441","4.998449","10.1.0.11","10.1.0.9","TCP","1134","0.000760000","-32 dBm","","49161  >  7016 [ACK] Seq=199001 Ack=1 Win=131072 Len=1000 TSval=5010 TSecr=5006"
"2451","4.999209","10.1.0.11","10.1.0.9","TCP","1134","0.000760000","-32 dBm","","49161  >  7016 [ACK] Seq=200001 Ack=1 Win=131072 Len=1000 TSval=5011 TSecr=5006"
"2461","4.999970","10.1.0.11","10.1.0.9","TCP","1134","0.000761000","-32 dBm","","49161  >  7016 [ACK] Seq=201001 Ack=1 Win=131072 Len=1000 TSval=5012 TSecr=5006"
"2471","5.000730","10.1.0.11","10.1.0.9","TCP","1134","0.000760000","-32 dBm","","49161  >  7016 [ACK] Seq=202001 Ack=1 Win=131072 Len=1000 TSval=5012 TSecr=5006"
"2484","5.001580","10.1.0.9","10.1.0.11","TCP","376","0.000850000","","0.005507000,0.003891000,0.002371000,0.000850000","7016  >  49161 [ACK] Seq=1 Ack=203001 Win=131072 Len=0 TSval=5013 TSecr=5012"
"2501","5.003013","10.1.0.11","10.1.0.9","TCP","3300","0.001433000","-32 dBm","","49161  >  7016 [ACK] Seq=205001 Ack=1 Win=131072 Len=1000 TSval=5015 TSecr=5006"
"2529","5.007861","10.1.0.11","10.1.0.9","TCP","3300","0.004848000","-32 dBm","","49161  >  7016 [ACK] Seq=208001 Ack=1 Win=131072 Len=1000 TSval=5017 TSecr=5006"
"2540","5.009378","10.1.0.11","10.1.0.9","TCP","5452","0.001517000","-32 dBm","","49161  >  7016 [ACK] Seq=213001 Ack=1 Win=131072 Len=1000 TSval=5021 TSecr=5006"
"2554","5.010970","10.1.0.11","10.1.0.9","TCP","2224","0.001592000","-32 dBm","","49161  >  7016 [ACK] Seq=215001 Ack=1 Win=131072 Len=1000 TSval=5023 TSecr=5006"
"2572","5.012371","10.1.0.11","10.1.0.9","TCP","1134","0.001401000","-32 dBm","","49161  >  7016 [ACK] Seq=216001 Ack=1 Win=131072 Len=1000 TSval=5024 TSecr=5006"
"2587","5.013914","10.1.0.11","10.1.0.9","TCP","2224","0.001543000","-32 dBm","","49161  >  7016 [ACK] Seq=218001 Ack=1 Win=131072 Len=1000 TSval=5025 TSecr=5006"
"2601","5.015170","10.1.0.11","10.1.0.9","TCP","2224","0.001256000","-32 dBm","","49161  >  7016 [ACK] Seq=220001 Ack=1 Win=131072 Len=1000 TSval=5027 TSecr=5006"
"2613","5.016114","10.1.0.11","10.1.0.9","TCP","1134","0.000944000","-32 dBm","","49161  >  7016 [ACK] Seq=221001 Ack=1 Win=131072 Len=1000 TSval=5028 TSecr=5006"
"2623","5.016874","10.1.0.11","10.1.0.9","TCP","1134","0.000760000","-32 dBm","","49161  >  7016 [ACK] Seq=222001 Ack=1 Win=131072 Len=1000 TSval=5028 TSecr=5006"
"2633","5.017634","10.1.0.11","10.1.0.9","TCP","1134","0.000760000","-32 dBm","","49161  >  7016 [ACK] Seq=223001 Ack=1 Win=131072 Len=1000 TSval=5029 TSecr=5006"
"2643","5.018395","10.1.0.11","10.1.0.9","TCP","1134","0.000761000","-32 dBm","","49161  >  7016 [ACK] Seq=224001 Ack=1 Win=131072 Len=1000 TSval=5030 TSecr=5006"
"2653","5.019155","10.1.0.11","10.1.0.9","TCP","1134","0.000760000","-32 dBm","","49161  >  7016 [ACK] Seq=225001 Ack=1 Win=131072 Len=1000 TSval=5031 TSecr=5006"
"2674","5.021600","10.1.0.11","10.1.0.9","TCP","3300","0.002445000","-32 dBm","","49161  >  7016 [ACK] Seq=228001 Ack=1 Win=131072 Len=1000 TSval=5033 TSecr=5006"
"2701","5.026305","10.1.0.11","10.1.0.9","TCP","6528","0.004705000","-32 dBm","","49161  >  7016 [ACK] Seq=234001 Ack=1 Win=131072 Len=1000 TSval=5038 TSecr=5006"
"2717","5.028097","10.1.0.11","10.1.0.9","TCP","2224","0.001792000","-32 dBm","","49161  >  7016 [ACK] Seq=236001 Ack=1 Win=131072 Len=1000 TSval=5040 TSecr=5006"
"2731","5.029289","10.1.0.11","10.1.0.9","TCP","2224","0.001192000","-32 dBm","","49161  >  7016 [ACK] Seq=238001 Ack=1 Win=131072 Len=1000 TSval=5041 TSecr=5006"
"2747","5.030698","10.1.0.11","10.1.0.9","TCP","1134","0.001409000","-32 dBm","","49161  >  7016 [ACK] Seq=239001 Ack=1 Win=131072 Len=1000 TSval=5042 TSecr=5006"
"2762","5.031843","10.1.0.11","10.1.0.9","TCP","2224","0.001145000","-32 dBm","","49161  >  7016 [ACK] Seq=241001 Ack=1 Win=131072 Len=1000 TSval=5044 TSecr=5006"
"2781","5.034007","10.1.0.11","10.1.0.9","TCP","2224","0.002164000","-32 dBm","","49161  >  7016 [ACK] Seq=243001 Ack=1 Win=131072 Len=1000 TSval=5045 TSecr=5006"
"2797","5.035735","10.1.0.11","10.1.0.9","TCP","3300","0.001728000","-32 dBm","","49161  >  7016 [ACK] Seq=246001 Ack=1 Win=131072 Len=1000 TSval=5048 TSecr=5006"
"2814","5.037155","10.1.0.9","10.1.0.11","TCP","376","0.001420000","","","7016  >  49161 [ACK] Seq=1 Ack=203001 Win=131072 Len=0 TSval=5013 TSecr=5012"
"2815","5.037155","10.1.0.9","10.1.0.11","TCP","1744","0.000000000","","0.034142000,0.029294000,0.029294000,0.027777000,0.027777000,0.026185000,0.024784000,0.023241000,0.021985000,0.020281000,0.018760000,0.015555000,0.015555000,0.010850000,0.010850000,0.010850000,0.009058000,0.007866000,0.005312000,0.003148000,0.001420000,0.001420000","7016  >  49161 [ACK] Seq=1 Ack=247001 Win=131072 Len=0 TSval=5048 TSecr=5047"
"2821","5.037809","10.1.0.11","10.1.0.9","TCP","2224","0.000654000","-32 dBm","","49161  >  7016 [ACK] Seq=248001 Ack=1 Win=131072 Len=1000 TSval=5049 TSecr=5006"
"2835","5.039098","10.1.0.11","10.1.0.9","TCP","2224","0.001289000","-32 dBm","","49161  >  7016 [ACK] Seq=250001 Ack=1 Win=131072 Len=1000 TSval=5051 TSecr=5048"
"2849","5.040354","10.1.0.11","10.1.0.9","TCP","1134","0.001256000","-32 dBm","","49161  >  7016 [ACK] Seq=251001 Ack=1 Win=131072 Len=1000 TSval=5052 TSecr=5048"
"2859","5.041114","10.1.0.11","10.1.0.9","TCP","1134","0.000760000","-32 dBm","","49161  >  7016 [ACK] Seq=252001 Ack=1 Win=131072 Len=1000 TSval=5052 TSecr=5048"
"2873","5.042338","10.1.0.11","10.1.0.9","TCP","2224","0.001224000","-32 dBm","","49161  >  7016 [ACK] Seq=254001 Ack=1 Win=131072 Len=1000 TSval=5054 TSecr=5048"
"2886","5.043368","10.1.0.11","10.1.0.9","TCP","1134","0.001030000","-32 dBm","","49161  >  7016 [ACK] Seq=255001 Ack=1 Win=131072 Len=1000 TSval=5055 TSecr=5048"
"2898","5.044280","10.1.0.11","10.1.0.9","TCP","1134","0.000912000","-32 dBm","","49161  >  7016 [ACK] Seq=256001 Ack=1 Win=131072 Len=1000 TSval=5056 TSecr=5048"
"2910","5.045352","10.1.0.11","10.1.0.9","TCP","2224","0.001072000","-32 dBm","","49161  >  7016 [ACK] Seq=258001 Ack=1 Win=131072 Len=1000 TSval=5057 TSecr=5048"
"2924","5.046417","10.1.0.11","10.1.0.9","TCP","1134","0.001065000","-32 dBm","","49161  >  7016 [ACK] Seq=259001 Ack=1 Win=131072 Len=1000 TSval=5058 TSecr=5048"
"2936","5.047329","10.1.0.11","10.1.0.9","TCP","1134","0.000912000","-32 dBm","","49161  >  7016 [ACK] Seq=260001 Ack=1 Win=131072 Len=1000 TSval=5059 TSecr=5048"
"2948","5.048241","10.1.0.11","10.1.0.9","TCP","1134","0.000912000","-32 dBm","","49161  >  7016 [ACK] Seq=261001 Ack=1 Win=131072 Len=1000 TSval=5060 TSecr=5048"
"2962","5.049726","10.1.0.11","10.1.0.9","TCP","2224","0.001485000","-32 dBm","","49161  >  7016 [ACK] Seq=263001 Ack=1 Win=131072 Len=1000 TSval=5061 TSecr=5048"
"2983","5.053042","10.1.0.11","10.1.0.9","TCP","4376","0.003316000","-32 dBm","","49161  >  7016 [ACK] Seq=267001 Ack=1 Win=131072 Len=1000 TSval=5064 TSecr=5048"
"2991","5.053746","10.1.0.11","10.1.0.9","TCP","1134","0.000704000","-32 dBm","","49161  >  7016 [ACK] Seq=268001 Ack=1 Win=131072 Len=1000 TSval=5065 TSecr=5048"
"2999","5.054354","10.1.0.11","10.1.0.9","TCP","1134","0.000608000","-32 dBm","","49161  >  7016 [ACK] Seq=269001 Ack=1 Win=131072 Len=1000 TSval=5066 TSecr=5048"
"3005","5.054907","10.1.0.9","10.1.0.11","TCP","908","0.000553000","","0.017098000,0.015809000,0.013793000,0.012569000,0.010627000,0.009555000,0.007578000,0.005181000,0.001865000,0.001865000,0.001161000","7016  >  49161 [ACK] Seq=1 Ack=269001 Win=131072 Len=0 TSval=5066 TSecr=5064"
"3015","5.055818","10.1.0.11","10.1.0.9","TCP","2224","0.000911000","-32 dBm","","49161  >  7016 [ACK] Seq=271001 Ack=1 Win=131072 Len=1000 TSval=5068 TSecr=5066"
"3033","5.057924","10.1.0.11","10.1.0.9","TCP","2224","0.002106000","-32 dBm","","49161  >  7016 [ACK] Seq=273001 Ack=1 Win=131072 Len=1000 TSval=5069 TSecr=5066"
"3041","5.058660","10.1.0.11","10.1.0.9","TCP","1134","0.000736000","-32 dBm","","49161  >  7016 [ACK] Seq=274001 Ack=1 Win=131072 Len=1000 TSval=5070 TSecr=5066"
"3047","5.059116","10.1.0.11","10.1.0.9","TCP","1134","0.000456000","-32 dBm","","49161  >  7016 [ACK] Seq=275001 Ack=1 Win=131072 Len=1000 TSval=5071 TSecr=5066"
"3055","5.059724","10.1.0.11","10.1.0.9","TCP","1134","0.000608000","-32 dBm","","49161  >  7016 [ACK] Seq=276001 Ack=1 Win=131072 Len=1000 TSval=5072 TSecr=5066"
"3071","5.060963","10.1.0.9","10.1.0.11","TCP","376","0.001239000","","0.005145000,0.003039000,0.002303000,0.001239000","7016  >  49161 [ACK] Seq=1 Ack=277001 Win=131072 Len=0 TSval=5072 TSecr=5071"
"3096","5.063561","10.1.0.11","10.1.0.9","TCP","4376","0.002598000","-32 dBm","","49161  >  7016 [ACK] Seq=280001 Ack=1 Win=131072 Len=1000 TSval=5075 TSecr=5066"
"3116","5.066729","10.1.0.11","10.1.0.9","TCP","4376","0.003168000","-32 dBm","","49161  >  7016 [ACK] Seq=284001 Ack=1 Win=131072 Len=1000 TSval=5078 TSecr=5066"
"3131","5.068195","10.1.0.11","10.1.0.9","TCP","2224","0.001466000","-32 dBm","","49161  >  7016 [ACK] Seq=286001 Ack=1 Win=131072 Len=1000 TSval=5080 TSecr=5066"
"3143","5.069268","10.1.0.11","10.1.0.9","TCP","2224","0.001073000","-32 dBm","","49161  >  7016 [ACK] Seq=288001 Ack=1 Win=131072 Len=1000 TSval=5081 TSecr=5066"
"3159","5.070548","10.1.0.11","10.1.0.9","TCP","1134","0.001280000","-32 dBm","","49161  >  7016 [ACK] Seq=289001 Ack=1 Win=131072 Len=1000 TSval=5082 TSecr=5066"
"3171","5.071460","10.1.0.11","10.1.0.9","TCP","1134","0.000912000","-32 dBm","","49161  >  7016 [ACK] Seq=290001 Ack=1 Win=131072 Len=1000 TSval=5083 TSecr=5066"
"3183","5.072372","10.1.0.11","10.1.0.9","TCP","1134","0.000912000","-32 dBm","","49161  >  7016 [ACK] Seq=291001 Ack=1 Win=131072 Len=1000 TSval=5084 TSecr=5066"
"3195","5.073493","10.1.0.11","10.1.0.9","TCP","2224","0.001121000","-32 dBm","","49161  >  7016 [ACK] Seq=293001 Ack=1 Win=131072 Len=1000 TSval=5085 TSecr=5066"
"3209","5.074589","10.1.0.11","10.1.0.9","TCP","1134","0.001096000","-32 dBm","","49161  >  7016 [ACK] Seq=294001 Ack=1 Win=131072 Len=1000 TSval=5086 TSecr=5066"
"3221","5.075502","10.1.0.11","10.1.0.9","TCP","1134","0.000913000","-32 dBm","","49161  >  7016 [ACK] Seq=295001 Ack=1 Win=131072 Len=1000 TSval=5087 TSecr=5066"
"3233","5.076446","10.1.0.11","10.1.0.9","TCP","2224","0.000944000","-32 dBm","","49161  >  7016 [ACK] Seq=297001 Ack=1 Win=131072 Len=1000 TSval=5088 TSecr=5066"
"3247","5.077638","10.1.0.11","10.1.0.9","TCP","1134","0.001192000","-32 dBm","","49161  >  7016 [ACK] Seq=298001 Ack=1 Win=131072 Len=1000 TSval=5089 TSecr=5066"
"3259","5.078550","10.1.0.11","10.1.0.9","TCP","1134","0.000912000","-32 dBm","","49161  >  7016 [ACK] Seq=299001 Ack=1 Win=131072 Len=1000 TSval=5090 TSecr=5066"
"3271","5.079489","10.1.0.11","10.1.0.9","TCP","1134","0.000939000","-32 dBm","","49161  >  7016 [ACK] Seq=300001 Ack=1 Win=131072 Len=1000 TSval=5091 TSecr=5066"
"3283","5.080433","10.1.0.11","10.1.0.9","TCP","2224","0.000944000","-32 dBm","","49161  >  7016 [ACK] Seq=302001 Ack=1 Win=131072 Len=1000 TSval=5092 TSecr=5066"
"3299","5.081746","10.1.0.11","10.1.0.9","TCP","1134","0.001313000","-32 dBm","","49161  >  7016 [ACK] Seq=303001 Ack=1 Win=131072 Len=1000 TSval=5093 TSecr=5066"
"3311","5.082658","10.1.0.11","10.1.0.9","TCP","1134","0.000912000","-32 dBm","","49161  >  7016 [ACK] Seq=304001 Ack=1 Win=131072 Len=1000 TSval=5094 TSecr=5066"
"3323","5.083570","10.1.0.11","10.1.0.9","TCP","1134","0.000912000","-32 dBm","","49161  >  7016 [ACK] Seq=305001 Ack=1 Win=131072 Len=1000 TSval=5095 TSecr=5066"
"3342","5.085224","10.1.0.11","10.1.0.9","TCP","2224","0.001654000","-32 dBm","","49161  >  7016 [ACK] Seq=307001 Ack=1 Win=131072 Len=1000 TSval=5096 TSecr=5066"
"3354","5.086328","10.1.0.11","10.1.0.9","TCP","2224","0.001104000","-32 dBm","","49161  >  7016 [ACK] Seq=309001 Ack=1 Win=131072 Len=1000 TSval=5098 TSecr=5066"
"3366","5.087272","10.1.0.11","10.1.0.9","TCP","1134","0.000944000","-32 dBm","","49161  >  7016 [ACK] Seq=310001 Ack=1 Win=131072 Len=1000 TSval=5099 TSecr=5066"
"3378","5.088185","10.1.0.11","10.1.0.9","TCP","1134","0.000913000","-32 dBm","","49161  >  7016 [ACK] Seq=311001 Ack=1 Win=131072 Len=1000 TSval=5100 TSecr=5066"
"3390","5.089097","10.1.0.11","10.1.0.9","TCP","1134","0.000912000","-32 dBm","","49161  >  7016 [ACK] Seq=312001 Ack=1 Win=131072 Len=1000 TSval=5100 TSecr=5066"
"3406","5.090408","10.1.0.11","10.1.0.9","TCP","2224","0.001311000","-32 dBm","","49161  >  7016 [ACK] Seq=314001 Ack=1 Win=131072 Len=1000 TSval=5102 TSecr=5066"
"3429","5.093764","10.1.0.11","10.1.0.9","TCP","4376","0.003356000","-32 dBm","","49161  >  7016 [ACK] Seq=318001 Ack=1 Win=131072 Len=1000 TSval=5105 TSecr=5066"
"3441","5.095284","10.1.0.11","10.1.0.9","TCP","2224","0.001520000","-32 dBm","","49161  >  7016 [ACK] Seq=320001 Ack=1 Win=131072 Len=1000 TSval=5107 TSecr=5066"
"3453","5.096617","10.1.0.11","10.1.0.9","TCP","2224","0.001333000","-32 dBm","","49161  >  7016 [ACK] Seq=322001 Ack=1 Win=131072 Len=1000 TSval=5108 TSecr=5066"
"3465","5.097626","10.1.0.11","10.1.0.9","TCP","1134","0.001009000","-32 dBm","","49161  >  7016 [ACK] Seq=323001 Ack=1 Win=131072 Len=1000 TSval=5109 TSecr=5066"
"3477","5.098538","10.1.0.11","10.1.0.9","TCP","1134","0.000912000","-32 dBm","","49161  >  7016 [ACK] Seq=324001 Ack=1 Win=131072 Len=1000 TSval=5110 TSecr=5066"
"3489","5.099450","10.1.0.11","10.1.0.9","TCP","1134","0.000912000","-32 dBm","","49161  >  7016 [ACK] Seq=325001 Ack=1 Win=131072 Len=1000 TSval=5111 TSecr=5066"
"3501","5.100362","10.1.0.11","10.1.0.9","TCP","1134","0.000912000","-32 dBm","","49161  >  7016 [ACK] Seq=326001 Ack=1 Win=131072 Len=1000 TSval=5112 TSecr=5066"
"3524","5.102691","10.1.0.11","10.1.0.9","TCP","2224","0.002329000","-32 dBm","","49161  >  7016 [ACK] Seq=328001 Ack=1 Win=131072 Len=1000 TSval=5113 TSecr=5066"
"3525","5.102691","10.1.0.11","10.1.0.9","TCP","1134","0.000000000","-32 dBm","","49161  >  7016 [ACK] Seq=329001 Ack=1 Win=131072 Len=1000 TSval=5114 TSecr=5066"
"3548","5.106164","10.1.0.11","10.1.0.9","TCP","5452","0.003473000","-32 dBm","","49161  >  7016 [ACK] Seq=334001 Ack=1 Win=131072 Len=1000 TSval=5118 TSecr=5066"
"3563","5.108054","10.1.0.11","10.1.0.9","TCP","1134","0.001890000","-32 dBm","","49161  >  7016 [ACK] Seq=335001 Ack=1 Win=131072 Len=1000 TSval=5119 TSecr=5066"
"3634","5.113451","10.1.0.9","10.1.0.11","TCP","376","0.005397000","","","7016  >  49161 [ACK] Seq=1 Ack=277001 Win=131072 Len=0 TSval=5072 TSecr=5071"
"3635","5.113451","10.1.0.9","10.1.0.11","TCP","2276","0.000000000","","0.049890000,0.049890000,0.046722000,0.046722000,0.045256000,0.044183000,0.041991000,0.039958000,0.038862000,0.037005000,0.035813000,0.033962000,0.033018000,0.030793000,0.028227000,0.027123000,0.026179000,0.024354000,0.023043000,0.019687000,0.019687000,0.018167000,0.016834000,0.014913000,0.013089000,0.010760000,0.007287000,0.007287000,0.007287000","7016  >  49161 [ACK] Seq=1 Ack=335001 Win=131072 Len=0 TSval=5118 TSecr=5117"
"4704","5.209932","10.1.0.11","10.1.0.9","TCP","832","0.096481000","-32 dBm","0.285260000,0.285260000,0.285260000,0.285260000,0.285260000,0.285260000,0.285260000,0.285260000,0.285260000,0.285260000","7017  >  49153 [ACK] Seq=1 Ack=45001 Win=131072 Len=0 TSval=4958 TSecr=4935"
"4759","5.221142","10.1.0.9","10.1.0.11","TCP","6376","0.011210000","","","49153  >  7017 [ACK] Seq=49501 Ack=1 Win=131072 Len=1500 TSval=5222 TSecr=4957"
"4760","5.221142","10.1.0.9","10.1.0.11","TCP","6376","0.000000000","","","49153  >  7017 [ACK] Seq=55501 Ack=1 Win=131072 Len=1500 TSval=5222 TSecr=4957"
"4761","5.221142","10.1.0.9","10.1.0.11","TCP","6376","0.000000000","","","49153  >  7017 [ACK] Seq=61501 Ack=1 Win=131072 Len=1500 TSval=5222 TSecr=4957"
"4762","5.221142","10.1.0.9","10.1.0.11","TCP","6376","0.000000000","","","49153  >  7017 [ACK] Seq=67501 Ack=1 Win=131072 Len=1500 TSval=5222 TSecr=4957"
"4763","5.221142","10.1.0.9","10.1.0.11","TCP","6376","0.000000000","","","49153  >  7017 [ACK] Seq=73501 Ack=1 Win=131072 Len=1500 TSval=5222 TSecr=4958"
"4764","5.221142","10.1.0.9","10.1.0.11","TCP","6376","0.000000000","","","49153  >  7017 [ACK] Seq=79501 Ack=1 Win=131072 Len=1500 TSval=5222 TSecr=4958"
"4765","5.221142","10.1.0.9","10.1.0.11","TCP","6376","0.000000000","","","49153  >  7017 [ACK] Seq=85501 Ack=1 Win=131072 Len=1500 TSval=5222 TSecr=4958"
"4766","5.221142","10.1.0.9","10.1.0.11","TCP","6376","0.000000000","","","49153  >  7017 [ACK] Seq=91501 Ack=1 Win=131072 Len=1500 TSval=5222 TSecr=4958"
"4767","5.221142","10.1.0.9","10.1.0.11","TCP","6376","0.000000000","","","49153  >  7017 [ACK] Seq=97501 Ack=1 Win=131072 Len=1500 TSval=5222 TSecr=4958"
"4768","5.221142","10.1.0.9","10.1.0.11","TCP","3224","0.000000000","","","49153  >  7017 [ACK] Seq=100501 Ack=1 Win=131072 Len=1500 TSval=5222 TSecr=4958"
"4772","5.223809","10.1.0.9","10.1.0.11","TCP","6376","0.002667000","","","[TCP Retransmission] [TCP Retransmission] [TCP Retransmission] [TCP Retransmission] 49153  >  7017 [ACK] Seq=49501 Ack=1 Win=131072 Len=1500 TSval=5222 TSecr=4957"
"4773","5.223809","10.1.0.9","10.1.0.11","TCP","6376","0.000000000","","","[TCP Retransmission] [TCP Retransmission] [TCP Retransmission] [TCP Retransmission] 49153  >  7017 [ACK] Seq=55501 Ack=1 Win=131072 Len=1500 TSval=5222 TSecr=4957"
