"No.","Time","Source","Destination","Protocol","Length","Time delta from previous displayed frame","Signal strength (dBm)","The RTT to ACK the segment was","Info"
"382","1.887808","10.1.0.11","10.1.0.4","TCP","138","0.000000000","","","49156  >  7006 [SYN] Seq=0 Win=65535 Len=0 TSval=1900 TSecr=0 WS=4 SACK_PERM=1"
"383","1.888055","10.1.0.11","10.1.0.4","TCP","138","0.000247000","","","[TCP Out-Of-Order] [TCP Port numbers reused] 49156  >  7006 [SYN] Seq=0 Win=65535 Len=0 TSval=1900 TSecr=0 WS=4 SACK_PERM=1"
"386","1.888330","10.1.0.4","10.1.0.11","TCP","138","0.000275000","-43 dBm","0.000522000","7006  >  49156 [SYN, ACK] Seq=0 Ack=1 Win=65535 Len=0 TSval=1900 TSecr=1900 WS=4 SACK_PERM=1"
"389","1.888485","10.1.0.11","10.1.0.4","TCP","134","0.000155000","","0.000155000","49156  >  7006 [ACK] Seq=1 Ack=1 Win=131072 Len=0 TSval=1900 TSecr=1900"
"390","1.888660","10.1.0.11","10.1.0.4","TCP","134","0.000175000","","","[TCP Dup ACK 389#1] 49156  >  7006 [ACK] Seq=1 Ack=1 Win=131072 Len=0 TSval=1900 TSecr=1900"
"399","1.889528","10.1.0.4","10.1.0.11","TCP","138","0.000868000","-43 dBm","","49153  >  7007 [SYN] Seq=0 Win=65535 Len=0 TSval=1900 TSecr=0 WS=4 SACK_PERM=1"
"402","1.889683","10.1.0.11","10.1.0.4","TCP","138","0.000155000","","0.000155000","7007  >  49153 [SYN, ACK] Seq=0 Ack=1 Win=65535 Len=0 TSval=1901 TSecr=1900 WS=4 SACK_PERM=1"
"405","1.889994","10.1.0.4","10.1.0.11","TCP","134","0.000311000","-43 dBm","0.000311000","49153  >  7007 [ACK] Seq=1 Ack=1 Win=131072 Len=0 TSval=1901 TSecr=1901"
"1028","4.839629","10.1.0.11","10.1.0.4","TCP","1134","2.949635000","","","49156  >  7006 [ACK] Seq=1 Ack=1 Win=131072 Len=1000 TSval=4851 TSecr=1900"
"1044","4.840845","10.1.0.11","10.1.0.4","TCP","2224","0.001216000","","","49156  >  7006 [ACK] Seq=2001 Ack=1 Win=131072 Len=1000 TSval=4852 TSecr=1900"
"1064","4.842749","10.1.0.11","10.1.0.4","TCP","2224","0.001904000","","","49156  >  7006 [ACK] Seq=4001 Ack=1 Win=131072 Len=1000 TSval=4854 TSecr=1900"
"1091","4.845941","10.1.0.11","10.1.0.4","TCP","4376","0.003192000","","","49156  >  7006 [ACK] Seq=8001 Ack=1 Win=131072 Len=1000 TSval=4857 TSecr=1900"
"1111","4.848533","10.1.0.11","10.1.0.4","TCP","3300","0.002592000","","","49156  >  7006 [ACK] Seq=11001 Ack=1 Win=131072 Len=1000 TSval=4860 TSecr=1900"
"1131","4.850726","10.1.0.11","10.1.0.4","TCP","3300","0.002193000","","","49156  >  7006 [ACK] Seq=14001 Ack=1 Win=131072 Len=1000 TSval=4862 TSecr=1900"
"1170","4.858424","10.1.0.4","10.1.0.11","TCP","6528","0.007698000","-43 dBm","","49153  >  7007 [ACK] Seq=5001 Ack=1 Win=131072 Len=1000 TSval=4856 TSecr=1901"
"1171","4.858424","10.1.0.4","10.1.0.11","TCP","6528","0.000000000","-43 dBm","","49153  >  7007 [ACK] Seq=11001 Ack=1 Win=131072 Len=1000 TSval=4861 TSecr=1901"
"1172","4.858424","10.1.0.4","10.1.0.11","TCP","3300","0.000000000","-43 dBm","","49153  >  7007 [ACK] Seq=14001 Ack=1 Win=131072 Len=1000 TSval=4863 TSecr=1901"
"1218","4.863284","10.1.0.4","10.1.0.11","TCP","680","0.004860000","-43 dBm","0.023655000,0.022439000,0.020535000,0.017343000,0.017343000,0.014751000,0.012558000,0.012558000","7006  >  49156 [ACK] Seq=1 Ack=15001 Win=131072 Len=0 TSval=4863 TSecr=4861"
"1221","4.863430","10.1.0.11","10.1.0.4","TCP","6376","0.000146000","","","49156  >  7006 [ACK] Seq=19501 Ack=1 Win=131072 Len=1500 TSval=4875 TSecr=4853"
"1222","4.863430","10.1.0.11","10.1.0.4","TCP","6376","0.000000000","","","49156  >  7006 [ACK] Seq=25501 Ack=1 Win=131072 Len=1500 TSval=4875 TSecr=4858"
"1223","4.863430","10.1.0.11","10.1.0.4","TCP","4300","0.000000000","","","49156  >  7006 [ACK] Seq=30001 Ack=1 Win=131072 Len=1000 TSval=4875 TSecr=4858"
"1225","4.864098","10.1.0.11","10.1.0.4","TCP","6376","0.000668000","","","[TCP Retransmission] [TCP Retransmission] [TCP Retransmission] [TCP Retransmission] 49156  >  7006 [ACK] Seq=19501 Ack=1 Win=131072 Len=1500 TSval=4875 TSecr=4853"
"1226","4.864098","10.1.0.11","10.1.0.4","TCP","1134","0.000000000","","","49156  >  7006 [ACK] Seq=31001 Ack=1 Win=131072 Len=1000 TSval=4876 TSecr=4863"
"1237","4.865464","10.1.0.11","10.1.0.4","TCP","1134","0.001366000","","","49156  >  7006 [ACK] Seq=32001 Ack=1 Win=131072 Len=1000 TSval=4876 TSecr=4863"
"1239","4.865616","10.1.0.11","10.1.0.4","TCP","1134","0.000152000","","","49156  >  7006 [ACK] Seq=33001 Ack=1 Win=131072 Len=1000 TSval=4877 TSecr=4863"
"1258","4.867972","10.1.0.11","10.1.0.4","TCP","3300","0.002356000","","","49156  >  7006 [ACK] Seq=36001 Ack=1 Win=131072 Len=1000 TSval=4880 TSecr=4863"
"1270","4.869267","10.1.0.11","10.1.0.4","TCP","1134","0.001295000","","","49156  >  7006 [ACK] Seq=37001 Ack=1 Win=131072 Len=1000 TSval=4880 TSecr=4863"
"1273","4.869709","10.1.0.4","10.1.0.11","TCP","756","0.000442000","-43 dBm","0.006279000,0.006279000,0.006279000,0.006279000,0.006279000,0.005611000,0.004093000,0.001737000,0.000442000","7006  >  49156 [ACK] Seq=1 Ack=38001 Win=131072 Len=0 TSval=4881 TSecr=4880"
"1280","4.870159","10.1.0.11","10.1.0.4","TCP","1134","0.000450000","","","49156  >  7006 [ACK] Seq=38001 Ack=1 Win=131072 Len=1000 TSval=4881 TSecr=4863"
"1286","4.870615","10.1.0.11","10.1.0.4","TCP","1134","0.000456000","","","49156  >  7006 [ACK] Seq=39001 Ack=1 Win=131072 Len=1000 TSval=4882 TSecr=4881"
"1300","4.872392","10.1.0.4","10.1.0.11","TCP","134","0.001777000","-43 dBm","0.001777000","7006  >  49156 [ACK] Seq=1 Ack=40001 Win=131072 Len=0 TSval=4882 TSecr=4881"
"1317","4.873582","10.1.0.11","10.1.0.4","TCP","4376","0.001190000","","","49156  >  7006 [ACK] Seq=43001 Ack=1 Win=131072 Len=1000 TSval=4885 TSecr=4882"
"1331","4.875466","10.1.0.11","10.1.0.4","TCP","2224","0.001884000","","","49156  >  7006 [ACK] Seq=45001 Ack=1 Win=131072 Len=1000 TSval=4887 TSecr=4882"
"1342","4.876312","10.1.0.11","10.1.0.4","TCP","1134","0.000846000","","","49156  >  7006 [ACK] Seq=46001 Ack=1 Win=131072 Len=1000 TSval=4888 TSecr=4882"
"1352","4.877796","10.1.0.11","10.1.0.4","TCP","2224","0.001484000","","","49156  >  7006 [ACK] Seq=48001 Ack=1 Win=131072 Len=1000 TSval=4889 TSecr=4882"
"1365","4.878987","10.1.0.11","10.1.0.4","TCP","1134","0.001191000","","","49156  >  7006 [ACK] Seq=49001 Ack=1 Win=131072 Len=1000 TSval=4890 TSecr=4882"
"1373","4.879771","10.1.0.11","10.1.0.4","TCP","1134","0.000784000","","","49156  >  7006 [ACK] Seq=50001 Ack=1 Win=131072 Len=1000 TSval=4891 TSecr=4882"
"1381","4.880379","10.1.0.11","10.1.0.4","TCP","1134","0.000608000","","","49156  >  7006 [ACK] Seq=51001 Ack=1 Win=131072 Len=1000 TSval=4892 TSecr=4882"
"1397","4.881703","10.1.0.4","10.1.0.11","TCP","528","0.001324000","-43 dBm","0.008121000,0.008121000,0.006237000,0.003907000,0.002716000,0.001324000","7006  >  49156 [ACK] Seq=1 Ack=52001 Win=131072 Len=0 TSval=4892 TSecr=4891"
"1416","4.883102","10.1.0.11","10.1.0.4","TCP","3300","0.001399000","","","49156  >  7006 [ACK] Seq=54001 Ack=1 Win=131072 Len=1000 TSval=4894 TSecr=4892"
"1442","4.887714","10.1.0.11","10.1.0.4","TCP","2224","0.004612000","","","49156  >  7006 [ACK] Seq=56001 Ack=1 Win=131072 Len=1000 TSval=4896 TSecr=4892"
"1444","4.887917","10.1.0.11","10.1.0.4","TCP","4376","0.000203000","","","49156  >  7006 [ACK] Seq=60001 Ack=1 Win=131072 Len=1000 TSval=4899 TSecr=4892"
"1452","4.888653","10.1.0.11","10.1.0.4","TCP","1134","0.000736000","","","49156  >  7006 [ACK] Seq=61001 Ack=1 Win=131072 Len=1000 TSval=4900 TSecr=4892"
"1460","4.889261","10.1.0.11","10.1.0.4","TCP","1134","0.000608000","","","49156  >  7006 [ACK] Seq=62001 Ack=1 Win=131072 Len=1000 TSval=4900 TSecr=4892"
"1482","4.891104","10.1.0.11","10.1.0.4","TCP","2224","0.001843000","","","49156  >  7006 [ACK] Seq=64001 Ack=1 Win=131072 Len=1000 TSval=4902 TSecr=4892"
"1500","4.893560","10.1.0.11","10.1.0.4","TCP","4376","0.002456000","","","49156  >  7006 [ACK] Seq=68001 Ack=1 Win=131072 Len=1000 TSval=4905 TSecr=4892"
"1514","4.894944","10.1.0.11","10.1.0.4","TCP","1134","0.001384000","","","49156  >  7006 [ACK] Seq=69001 Ack=1 Win=131072 Len=1000 TSval=4906 TSecr=4892"
"1527","4.895951","10.1.0.11","10.1.0.4","TCP","2224","0.001007000","","","49156  >  7006 [ACK] Seq=71001 Ack=1 Win=131072 Len=1000 TSval=4908 TSecr=4892"
"1547","4.897536","10.1.0.11","10.1.0.4","TCP","2224","0.001585000","","","49156  >  7006 [ACK] Seq=73001 Ack=1 Win=131072 Len=1000 TSval=4909 TSecr=4892"
"1567","4.899120","10.1.0.11","10.1.0.4","TCP","1134","0.001584000","","","49156  >  7006 [ACK] Seq=74001 Ack=1 Win=131072 Len=1000 TSval=4910 TSecr=4892"
"1579","4.900064","10.1.0.11","10.1.0.4","TCP","2224","0.000944000","","","49156  >  7006 [ACK] Seq=76001 Ack=1 Win=131072 Len=1000 TSval=4912 TSecr=4892"
"1597","4.901568","10.1.0.11","10.1.0.4","TCP","2224","0.001504000","","","49156  >  7006 [ACK] Seq=78001 Ack=1 Win=131072 Len=1000 TSval=4913 TSecr=4892"
"1617","4.903152","10.1.0.11","10.1.0.4","TCP","2224","0.001584000","","","49156  >  7006 [ACK] Seq=80001 Ack=1 Win=131072 Len=1000 TSval=4915 TSecr=4892"
"1637","4.904737","10.1.0.11","10.1.0.4","TCP","2224","0.001585000","","","49156  >  7006 [ACK] Seq=82001 Ack=1 Win=131072 Len=1000 TSval=4916 TSecr=4892"
"1657","4.906321","10.1.0.11","10.1.0.4","TCP","1134","0.001584000","","","49156  >  7006 [ACK] Seq=83001 Ack=1 Win=131072 Len=1000 TSval=4917 TSecr=4892"
"1670","4.907410","10.1.0.11","10.1.0.4","TCP","2224","0.001089000","","","49156  >  7006 [ACK] Seq=85001 Ack=1 Win=131072 Len=1000 TSval=4919 TSecr=4892"
"1682","4.908450","10.1.0.11","10.1.0.4","TCP","1134","0.001040000","","","49156  >  7006 [ACK] Seq=86001 Ack=1 Win=131072 Len=1000 TSval=4920 TSecr=4892"
"1694","4.909362","10.1.0.11","10.1.0.4","TCP","1134","0.000912000","","","49156  >  7006 [ACK] Seq=87001 Ack=1 Win=131072 Len=1000 TSval=4920 TSecr=4892"
"1706","4.910274","10.1.0.11","10.1.0.4","TCP","1134","0.000912000","","","49156  >  7006 [ACK] Seq=88001 Ack=1 Win=131072 Len=1000 TSval=4921 TSecr=4892"
"1718","4.911186","10.1.0.11","10.1.0.4","TCP","2224","0.000912000","","","49156  >  7006 [ACK] Seq=90001 Ack=1 Win=131072 Len=1000 TSval=4923 TSecr=4892"
"1740","4.913164","10.1.0.11","10.1.0.4","TCP","2224","0.001978000","","","49156  >  7006 [ACK] Seq=92001 Ack=1 Win=131072 Len=1000 TSval=4924 TSecr=4892"
"1754","4.914260","10.1.0.11","10.1.0.4","TCP","1134","0.001096000","","","49156  >  7006 [ACK] Seq=93001 Ack=1 Win=131072 Len=1000 TSval=4925 TSecr=4892"
"1766","4.915172","10.1.0.11","10.1.0.4","TCP","2224","0.000912000","","","49156  >  7006 [ACK] Seq=95001 Ack=1 Win=131072 Len=1000 TSval=4927 TSecr=4892"
"1786","4.916756","10.1.0.11","10.1.0.4","TCP","2224","0.001584000","","","49156  >  7006 [ACK] Seq=97001 Ack=1 Win=131072 Len=1000 TSval=4928 TSecr=4892"
"1808","4.918891","10.1.0.11","10.1.0.4","TCP","2224","0.002135000","","","49156  >  7006 [ACK] Seq=99001 Ack=1 Win=131072 Len=1000 TSval=4930 TSecr=4892"
"1820","4.919868","10.1.0.11","10.1.0.4","TCP","1134","0.000977000","","","49156  >  7006 [ACK] Seq=100001 Ack=1 Win=131072 Len=1000 TSval=4931 TSecr=4892"
"1832","4.920780","10.1.0.11","10.1.0.4","TCP","2224","0.000912000","","","49156  >  7006 [ACK] Seq=102001 Ack=1 Win=131072 Len=1000 TSval=4932 TSecr=4892"
"1850","4.922212","10.1.0.11","10.1.0.4","TCP","1134","0.001432000","","","49156  >  7006 [ACK] Seq=103001 Ack=1 Win=131072 Len=1000 TSval=4933 TSecr=4892"
"1858","4.922820","10.1.0.11","10.1.0.4","TCP","1134","0.000608000","","","49156  >  7006 [ACK] Seq=104001 Ack=1 Win=131072 Len=1000 TSval=4934 TSecr=4892"
"1874","4.924082","10.1.0.11","10.1.0.4","TCP","680","0.001262000","","0.065658000,0.065658000,0.065658000,0.065658000,0.065658000,0.065658000,0.065658000,0.065658000","7007  >  49153 [ACK] Seq=1 Ack=15001 Win=131072 Len=0 TSval=4870 TSecr=4863"
"1897","4.929755","10.1.0.4","10.1.0.11","TCP","6376","0.005673000","-43 dBm","","49153  >  7007 [ACK] Seq=19501 Ack=1 Win=131072 Len=1500 TSval=4936 TSecr=4870"
"1898","4.929755","10.1.0.4","10.1.0.11","TCP","6376","0.000000000","-43 dBm","","49153  >  7007 [ACK] Seq=25501 Ack=1 Win=131072 Len=1500 TSval=4936 TSecr=4870"
"1899","4.929755","10.1.0.4","10.1.0.11","TCP","6376","0.000000000","-43 dBm","","49153  >  7007 [ACK] Seq=31501 Ack=1 Win=131072 Len=1500 TSval=4936 TSecr=4870"
"1900","4.929755","10.1.0.4","10.1.0.11","TCP","6376","0.000000000","-43 dBm","","49153  >  7007 [ACK] Seq=37501 Ack=1 Win=131072 Len=1500 TSval=4936 TSecr=4870"
"1901","4.929755","10.1.0.4","10.1.0.11","TCP","6376","0.000000000","-43 dBm","","49153  >  7007 [ACK] Seq=43501 Ack=1 Win=131072 Len=1500 TSval=4936 TSecr=4870"
"1923","4.932679","10.1.0.11","10.1.0.4","TCP","6528","0.002924000","","","49156  >  7006 [ACK] Seq=110001 Ack=1 Win=131072 Len=1000 TSval=4939 TSecr=4892"
"1924","4.932679","10.1.0.11","10.1.0.4","TCP","6528","0.000000000","","","49156  >  7006 [ACK] Seq=116001 Ack=1 Win=131072 Len=1000 TSval=4944 TSecr=4892"
"1930","4.933556","10.1.0.11","10.1.0.4","TCP","1134","0.000877000","","","49156  >  7006 [ACK] Seq=117001 Ack=1 Win=131072 Len=1000 TSval=4944 TSecr=4892"
"2210","4.972540","10.1.0.4","10.1.0.11","TCP","1516","0.038984000","-43 dBm","0.089438000,0.084826000,0.084623000,0.084623000,0.083887000,0.081436000,0.078980000,0.078980000,0.077596000,0.076589000,0.075004000,0.072476000,0.070972000,0.069388000,0.067803000,0.066219000,0.065130000,0.063178000,0.061354000","7006  >  49156 [ACK] Seq=1 Ack=90001 Win=131072 Len=0 TSval=4923 TSecr=4921"
"2211","4.972540","10.1.0.4","10.1.0.11","TCP","604","0.000000000","-43 dBm","0.059376000,0.058280000,0.057368000,0.055784000,0.053649000,0.051760000,0.050328000","7006  >  49156 [ACK] Seq=1 Ack=104001 Win=131072 Len=0 TSval=4934 TSecr=4932"
"2212","4.972540","10.1.0.4","10.1.0.11","TCP","604","0.000000000","-43 dBm","0.039861000,0.039861000,0.039861000,0.039861000,0.039861000,0.039861000,0.038984000","7006  >  49156 [ACK] Seq=1 Ack=118001 Win=131072 Len=0 TSval=4945 TSecr=4944"
"2215","4.972708","10.1.0.11","10.1.0.4","TCP","6376","0.000168000","","","49156  >  7006 [ACK] Seq=122501 Ack=1 Win=131072 Len=1500 TSval=4984 TSecr=4900"
"2216","4.972708","10.1.0.11","10.1.0.4","TCP","6376","0.000000000","","","49156  >  7006 [ACK] Seq=128501 Ack=1 Win=131072 Len=1500 TSval=4984 TSecr=4900"
"2217","4.972708","10.1.0.11","10.1.0.4","TCP","6376","0.000000000","","","49156  >  7006 [ACK] Seq=134501 Ack=1 Win=131072 Len=1500 TSval=4984 TSecr=4900"
"2218","4.972708","10.1.0.11","10.1.0.4","TCP","6376","0.000000000","","","49156  >  7006 [ACK] Seq=140501 Ack=1 Win=131072 Len=1500 TSval=4984 TSecr=4903"
"2219","4.972708","10.1.0.11","10.1.0.4","TCP","6376","0.000000000","","","49156  >  7006 [ACK] Seq=146501 Ack=1 Win=131072 Len=1500 TSval=4984 TSecr=4905"
"2220","4.972708","10.1.0.11","10.1.0.4","TCP","6376","0.000000000","","","49156  >  7006 [ACK] Seq=152501 Ack=1 Win=131072 Len=1500 TSval=4984 TSecr=4907"
"2221","4.972708","10.1.0.11","10.1.0.4","TCP","6376","0.000000000","","","49156  >  7006 [ACK] Seq=158501 Ack=1 Win=131072 Len=1500 TSval=4984 TSecr=4909"
"2222","4.972708","10.1.0.11","10.1.0.4","TCP","7452","0.000000000","","","49156  >  7006 [ACK] Seq=166001 Ack=1 Win=131072 Len=1000 TSval=4984 TSecr=4915"
"2228","4.974960","10.1.0.11","10.1.0.4","TCP","3300","0.002252000","","","49156  >  7006 [ACK] Seq=169001 Ack=1 Win=131072 Len=1000 TSval=4986 TSecr=4945"
"2234","4.975480","10.1.0.11","10.1.0.4","TCP","1134","0.000520000","","","49156  >  7006 [ACK] Seq=170001 Ack=1 Win=131072 Len=1000 TSval=4987 TSecr=4945"
"2246","4.976466","10.1.0.4","10.1.0.11","TCP","1440","0.000986000","-43 dBm","0.003758000,0.003758000,0.003758000,0.003758000,0.003758000,0.003758000,0.003758000,0.003758000,0.003758000,0.003758000,0.003758000,0.003758000,0.003758000,0.003758000,0.003758000,0.003758000,0.001506000,0.001506000","7006  >  49156 [ACK] Seq=1 Ack=170001 Win=131072 Len=0 TSval=4987 TSecr=4985"
"2256","4.977417","10.1.0.11","10.1.0.4","TCP","2224","0.000951000","","","49156  >  7006 [ACK] Seq=172001 Ack=1 Win=131072 Len=1000 TSval=4988 TSecr=4987"
"2274","4.980325","10.1.0.11","10.1.0.4","TCP","4376","0.002908000","","","49156  >  7006 [ACK] Seq=176001 Ack=1 Win=131072 Len=1000 TSval=4992 TSecr=4987"
"2282","4.981029","10.1.0.11","10.1.0.4","TCP","1134","0.000704000","","","49156  >  7006 [ACK] Seq=177001 Ack=1 Win=131072 Len=1000 TSval=4992 TSecr=4987"
"2294","4.981963","10.1.0.11","10.1.0.4","TCP","1134","0.000934000","","","49156  >  7006 [ACK] Seq=178001 Ack=1 Win=131072 Len=1000 TSval=4993 TSecr=4987"
"2302","4.982572","10.1.0.11","10.1.0.4","TCP","1134","0.000609000","","","49156  >  7006 [ACK] Seq=179001 Ack=1 Win=131072 Len=1000 TSval=4994 TSecr=4987"
"2311","4.983462","10.1.0.11","10.1.0.4","TCP","1134","0.000890000","","","49156  >  7006 [ACK] Seq=180001 Ack=1 Win=131072 Len=1000 TSval=4995 TSecr=4987"
"2325","4.984893","10.1.0.11","10.1.0.4","TCP","2224","0.001431000","","","49156  >  7006 [ACK] Seq=182001 Ack=1 Win=131072 Len=1000 TSval=4996 TSecr=4987"
"2346","4.988033","10.1.0.11","10.1.0.4","TCP","4376","0.003140000","","","49156  >  7006 [ACK] Seq=186001 Ack=1 Win=131072 Len=1000 TSval=5000 TSecr=4987"
"2358","4.989041","10.1.0.11","10.1.0.4","TCP","1134","0.001008000","","","49156  >  7006 [ACK] Seq=187001 Ack=1 Win=131072 Len=1000 TSval=5000 TSecr=4987"
"2371","4.990196","10.1.0.11","10.1.0.4","TCP","1134","0.001155000","","","49156  >  7006 [ACK] Seq=188001 Ack=1 Win=131072 Len=1000 TSval=5001 TSecr=4987"
"2385","4.992128","10.1.0.11","10.1.0.4","TCP","3300","0.001932000","","","49156  >  7006 [ACK] Seq=191001 Ack=1 Win=131072 Len=1000 TSval=5004 TSecr=4987"
"2399","4.993289","10.1.0.11","10.1.0.4","TCP","1134","0.001161000","","","49156  >  7006 [ACK] Seq=192001 Ack=1 Win=131072 Len=1000 TSval=5004 TSecr=4987"
"2409","4.994049","10.1.0.11","10.1.0.4","TCP","1134","0.000760000","","","49156  >  7006 [ACK] Seq=193001 Ack=1 Win=131072 Len=1000 TSval=5005 TSecr=4987"
"2419","4.994809","10.1.0.11","10.1.0.4","TCP","1134","0.000760000","","","49156  >  7006 [ACK] Seq=194001 Ack=1 Win=131072 Len=1000 TSval=5006 TSecr=4987"
"2439","4.996445","10.1.0.11","10.1.0.4","TCP","2224","0.001636000","","","49156  >  7006 [ACK] Seq=196001 Ack=1 Win=131072 Len=1000 TSval=5008 TSecr=4987"
"2449","4.997301","10.1.0.11","10.1.0.4","TCP","1134","0.000856000","","","49156  >  7006 [ACK] Seq=197001 Ack=1 Win=131072 Len=1000 TSval=5008 TSecr=4987"
"2459","4.998061","10.1.0.11","10.1.0.4","TCP","1134","0.000760000","","","49156  >  7006 [ACK] Seq=198001 Ack=1 Win=131072 Len=1000 TSval=5009 TSecr=4987"
"2469","4.998821","10.1.0.11","10.1.0.4","TCP","1134","0.000760000","","","49156  >  7006 [ACK] Seq=199001 Ack=1 Win=131072 Len=1000 TSval=5010 TSecr=4987"
"2479","4.999582","10.1.0.11","10.1.0.4","TCP","1134","0.000761000","","","49156  >  7006 [ACK] Seq=200001 Ack=1 Win=131072 Len=1000 TSval=5011 TSecr=4987"
"2489","5.000342","10.1.0.11","10.1.0.4","TCP","1134","0.000760000","","","49156  >  7006 [ACK] Seq=201001 Ack=1 Win=131072 Len=1000 TSval=5012 TSecr=4987"
"2499","5.001102","10.1.0.11","10.1.0.4","TCP","1134","0.000760000","","","49156  >  7006 [ACK] Seq=202001 Ack=1 Win=131072 Len=1000 TSval=5012 TSecr=4987"
"2529","5.003385","10.1.0.11","10.1.0.4","TCP","3300","0.002283000","","","49156  >  7006 [ACK] Seq=205001 Ack=1 Win=131072 Len=1000 TSval=5015 TSecr=4987"
"2560","5.008502","10.1.0.11","10.1.0.4","TCP","6528","0.005117000","","","49156  >  7006 [ACK] Seq=211001 Ack=1 Win=131072 Len=1000 TSval=5020 TSecr=4987"
"2574","5.010542","10.1.0.11","10.1.0.4","TCP","3300","0.002040000","","","49156  >  7006 [ACK] Seq=214001 Ack=1 Win=131072 Len=1000 TSval=5022 TSecr=4987"
"2588","5.011831","10.1.0.11","10.1.0.4","TCP","1134","0.001289000","","","49156  >  7006 [ACK] Seq=215001 Ack=1 Win=131072 Len=1000 TSval=5023 TSecr=4987"
"2602","5.012927","10.1.0.11","10.1.0.4","TCP","2224","0.001096000","","","49156  >  7006 [ACK] Seq=217001 Ack=1 Win=131072 Len=1000 TSval=5024 TSecr=4987"
"2617","5.014470","10.1.0.11","10.1.0.4","TCP","2224","0.001543000","","","49156  >  7006 [ACK] Seq=219001 Ack=1 Win=131072 Len=1000 TSval=5026 TSecr=4987"
"2633","5.015878","10.1.0.11","10.1.0.4","TCP","1134","0.001408000","","","49156  >  7006 [ACK] Seq=220001 Ack=1 Win=131072 Len=1000 TSval=5027 TSecr=4987"
"2641","5.016486","10.1.0.11","10.1.0.4","TCP","1134","0.000608000","","","49156  >  7006 [ACK] Seq=221001 Ack=1 Win=131072 Len=1000 TSval=5028 TSecr=4987"
"2651","5.017246","10.1.0.11","10.1.0.4","TCP","1134","0.000760000","","","49156  >  7006 [ACK] Seq=222001 Ack=1 Win=131072 Len=1000 TSval=5028 TSecr=4987"
"2661","5.018006","10.1.0.11","10.1.0.4","TCP","1134","0.000760000","","","49156  >  7006 [ACK] Seq=223001 Ack=1 Win=131072 Len=1000 TSval=5029 TSecr=4987"
"2671","5.018767","10.1.0.11","10.1.0.4","TCP","1134","0.000761000","","","49156  >  7006 [ACK] Seq=224001 Ack=1 Win=131072 Len=1000 TSval=5030 TSecr=4987"
"2682","5.019927","10.1.0.11","10.1.0.4","TCP","1134","0.001160000","","","49156  >  7006 [ACK] Seq=225001 Ack=1 Win=131072 Len=1000 TSval=5031 TSecr=4987"
"2692","5.020888","10.1.0.11","10.1.0.4","TCP","1136","0.000961000","","","[TCP Retransmission] 49156  >  7006 [ACK] Seq=225001 Ack=1 Win=131072 Len=1000 TSval=5031 TSecr=4987"
"2693","5.020888","10.1.0.11","10.1.0.4","TCP","2224","0.000000000","","","49156  >  7006 [ACK] Seq=227001 Ack=1 Win=131072 Len=1000 TSval=5032 TSecr=4987"
"2719","5.025052","10.1.0.11","10.1.0.4","TCP","5452","0.004164000","","","49156  >  7006 [ACK] Seq=232001 Ack=1 Win=131072 Len=1000 TSval=5036 TSecr=4987"
"2734","5.027269","10.1.0.11","10.1.0.4","TCP","3300","0.002217000","","","49156  >  7006 [ACK] Seq=235001 Ack=1 Win=131072 Len=1000 TSval=5039 TSecr=4987"
"2750","5.028837","10.1.0.11","10.1.0.4","TCP","2224","0.001568000","","","49156  >  7006 [ACK] Seq=237001 Ack=1 Win=131072 Len=1000 TSval=5040 TSecr=4987"
"2770","5.030550","10.1.0.11","10.1.0.4","TCP","2224","0.001713000","","","49156  >  7006 [ACK] Seq=239001 Ack=1 Win=131072 Len=1000 TSval=5042 TSecr=4987"
"2793","5.032399","10.1.0.11","10.1.0.4","TCP","2224","0.001849000","","","49156  >  7006 [ACK] Seq=241001 Ack=1 Win=131072 Len=1000 TSval=5044 TSecr=4987"
"2812","5.034595","10.1.0.11","10.1.0.4","TCP","3300","0.002196000","","","49156  >  7006 [ACK] Seq=244001 Ack=1 Win=131072 Len=1000 TSval=5046 TSecr=4987"
"2826","5.036107","10.1.0.11","10.1.0.4","TCP","2224","0.001512000","","","49156  >  7006 [ACK] Seq=246001 Ack=1 Win=131072 Len=1000 TSval=5048 TSecr=4987"
"2850","5.038181","10.1.0.11","10.1.0.4","TCP","2224","0.002074000","","","49156  >  7006 [ACK] Seq=248001 Ack=1 Win=131072 Len=1000 TSval=5049 TSecr=4987"
"2864","5.039470","10.1.0.11","10.1.0.4","TCP","2224","0.001289000","","","49156  >  7006 [ACK] Seq=250001 Ack=1 Win=131072 Len=1000 TSval=5051 TSecr=4987"
"2878","5.040726","10.1.0.11","10.1.0.4","TCP","1134","0.001256000","","","49156  >  7006 [ACK] Seq=251001 Ack=1 Win=131072 Len=1000 TSval=5052 TSecr=4987"
"2890","5.041670","10.1.0.11","10.1.0.4","TCP","2224","0.000944000","","","49156  >  7006 [ACK] Seq=253001 Ack=1 Win=131072 Len=1000 TSval=5053 TSecr=4987"
"2906","5.043046","10.1.0.11","10.1.0.4","TCP","1134","0.001376000","","","49156  >  7006 [ACK] Seq=254001 Ack=1 Win=131072 Len=1000 TSval=5054 TSecr=4987"
"2917","5.043892","10.1.0.11","10.1.0.4","TCP","1134","0.000846000","","","49156  >  7006 [ACK] Seq=255001 Ack=1 Win=131072 Len=1000 TSval=5055 TSecr=4987"
"2929","5.044836","10.1.0.11","10.1.0.4","TCP","2224","0.000944000","","","49156  >  7006 [ACK] Seq=257001 Ack=1 Win=131072 Len=1000 TSval=5056 TSecr=4987"
"2943","5.046029","10.1.0.11","10.1.0.4","TCP","1134","0.001193000","","","49156  >  7006 [ACK] Seq=258001 Ack=1 Win=131072 Len=1000 TSval=5057 TSecr=4987"
"2955","5.046941","10.1.0.11","10.1.0.4","TCP","1134","0.000912000","","","49156  >  7006 [ACK] Seq=259001 Ack=1 Win=131072 Len=1000 TSval=5058 TSecr=4987"
"2967","5.047853","10.1.0.11","10.1.0.4","TCP","1134","0.000912000","","","49156  >  7006 [ACK] Seq=260001 Ack=1 Win=131072 Len=1000 TSval=5059 TSecr=4987"
"3091","5.060639","10.1.0.4","10.1.0.11","TCP","452","0.012786000","-43 dBm","0.083222000,0.080314000,0.080314000,0.079610000,0.078067000","7006  >  49156 [ACK] Seq=1 Ack=180001 Win=131072 Len=0 TSval=4994 TSecr=4993"
"3092","5.060639","10.1.0.4","10.1.0.11","TCP","908","0.000000000","-43 dBm","0.075746000,0.072606000,0.072606000,0.071598000,0.068511000,0.068511000,0.066590000,0.064194000,0.063338000,0.061818000,0.060297000","7006  >  49156 [ACK] Seq=1 Ack=202001 Win=131072 Len=0 TSval=5012 TSecr=5011"
"3093","5.060639","10.1.0.4","10.1.0.11","TCP","2276","0.000000000","-43 dBm","0.057254000,0.057254000,0.052137000,0.052137000,0.052137000,0.050097000,0.048808000,0.047712000,0.046169000,0.044153000,0.042633000,0.040712000,0.039751000,0.035587000,0.035587000,0.033370000,0.033370000,0.031802000,0.030089000,0.028240000,0.026044000,0.024532000,0.022458000,0.021169000,0.019913000,0.018969000,0.016747000,0.015803000,0.013698000","7006  >  49156 [ACK] Seq=1 Ack=260001 Win=131072 Len=0 TSval=5059 TSecr=5057"
"3122","5.062905","10.1.0.11","10.1.0.4","TCP","6376","0.002266000","","","49156  >  7006 [ACK] Seq=265501 Ack=1 Win=131072 Len=1500 TSval=5072 TSecr=4992"
"3123","5.062905","10.1.0.11","10.1.0.4","TCP","6376","0.000000000","","","49156  >  7006 [ACK] Seq=271501 Ack=1 Win=131072 Len=1500 TSval=5072 TSecr=4997"
"3124","5.062905","10.1.0.11","10.1.0.4","TCP","7528","0.000000000","","","49156  >  7006 [ACK] Seq=279001 Ack=1 Win=131072 Len=1000 TSval=5074 TSecr=5059"
"3144","5.066557","10.1.0.11","10.1.0.4","TCP","5452","0.003652000","","","49156  >  7006 [ACK] Seq=284001 Ack=1 Win=131072 Len=1000 TSval=5078 TSecr=5059"
"3163","5.068567","10.1.0.11","10.1.0.4","TCP","2224","0.002010000","","","49156  >  7006 [ACK] Seq=286001 Ack=1 Win=131072 Len=1000 TSval=5080 TSecr=5059"
"3175","5.069640","10.1.0.11","10.1.0.4","TCP","2224","0.001073000","","","49156  >  7006 [ACK] Seq=288001 Ack=1 Win=131072 Len=1000 TSval=5081 TSecr=5059"
"3191","5.070920","10.1.0.11","10.1.0.4","TCP","1134","0.001280000","","","49156  >  7006 [ACK] Seq=289001 Ack=1 Win=131072 Len=1000 TSval=5082 TSecr=5059"
"3203","5.071832","10.1.0.11","10.1.0.4","TCP","1134","0.000912000","","","49156  >  7006 [ACK] Seq=290001 Ack=1 Win=131072 Len=1000 TSval=5083 TSecr=5059"
"3215","5.072744","10.1.0.11","10.1.0.4","TCP","2224","0.000912000","","","49156  >  7006 [ACK] Seq=292001 Ack=1 Win=131072 Len=1000 TSval=5084 TSecr=5059"
"3231","5.074201","10.1.0.11","10.1.0.4","TCP","1134","0.001457000","","","49156  >  7006 [ACK] Seq=293001 Ack=1 Win=131072 Len=1000 TSval=5085 TSecr=5059"
"3241","5.074961","10.1.0.11","10.1.0.4","TCP","1134","0.000760000","","","49156  >  7006 [ACK] Seq=294001 Ack=1 Win=131072 Len=1000 TSval=5086 TSecr=5059"
"3253","5.075874","10.1.0.11","10.1.0.4","TCP","1134","0.000913000","","","49156  >  7006 [ACK] Seq=295001 Ack=1 Win=131072 Len=1000 TSval=5087 TSecr=5059"
"3265","5.076818","10.1.0.11","10.1.0.4","TCP","2224","0.000944000","","","49156  >  7006 [ACK] Seq=297001 Ack=1 Win=131072 Len=1000 TSval=5088 TSecr=5059"
"3279","5.078010","10.1.0.11","10.1.0.4","TCP","1134","0.001192000","","","49156  >  7006 [ACK] Seq=298001 Ack=1 Win=131072 Len=1000 TSval=5089 TSecr=5059"
"3291","5.078949","10.1.0.11","10.1.0.4","TCP","1134","0.000939000","","","49156  >  7006 [ACK] Seq=299001 Ack=1 Win=131072 Len=1000 TSval=5090 TSecr=5059"
"3303","5.079861","10.1.0.11","10.1.0.4","TCP","1134","0.000912000","","","49156  >  7006 [ACK] Seq=300001 Ack=1 Win=131072 Len=1000 TSval=5091 TSecr=5059"
"3315","5.080805","10.1.0.11","10.1.0.4","TCP","2224","0.000944000","","","49156  >  7006 [ACK] Seq=302001 Ack=1 Win=131072 Len=1000 TSval=5092 TSecr=5059"
"3331","5.082118","10.1.0.11","10.1.0.4","TCP","1134","0.001313000","","","49156  >  7006 [ACK] Seq=303001 Ack=1 Win=131072 Len=1000 TSval=5093 TSecr=5059"
"3343","5.083030","10.1.0.11","10.1.0.4","TCP","1134","0.000912000","","","49156  >  7006 [ACK] Seq=304001 Ack=1 Win=131072 Len=1000 TSval=5094 TSecr=5059"
"3355","5.083942","10.1.0.11","10.1.0.4","TCP","2224","0.000912000","","","49156  >  7006 [ACK] Seq=306001 Ack=1 Win=131072 Len=1000 TSval=5096 TSecr=5059"
"3376","5.085780","10.1.0.11","10.1.0.4","TCP","2224","0.001838000","","","49156  >  7006 [ACK] Seq=308001 Ack=1 Win=131072 Len=1000 TSval=5097 TSecr=5059"
"3388","5.086884","10.1.0.11","10.1.0.4","TCP","1134","0.001104000","","","49156  >  7006 [ACK] Seq=309001 Ack=1 Win=131072 Len=1000 TSval=5098 TSecr=5059"
"3398","5.087644","10.1.0.11","10.1.0.4","TCP","1134","0.000760000","","","49156  >  7006 [ACK] Seq=310001 Ack=1 Win=131072 Len=1000 TSval=5099 TSecr=5059"
"3410","5.088557","10.1.0.11","10.1.0.4","TCP","1134","0.000913000","","","49156  >  7006 [ACK] Seq=311001 Ack=1 Win=131072 Len=1000 TSval=5100 TSecr=5059"
"3422","5.089469","10.1.0.11","10.1.0.4","TCP","1134","0.000912000","","","49156  >  7006 [ACK] Seq=312001 Ack=1 Win=131072 Len=1000 TSval=5100 TSecr=5059"
"3438","5.090780","10.1.0.11","10.1.0.4","TCP","2224","0.001311000","","","49156  >  7006 [ACK] Seq=314001 Ack=1 Win=131072 Len=1000 TSval=5102 TSecr=5059"
"3461","5.094136","10.1.0.11","10.1.0.4","TCP","4376","0.003356000","","","49156  >  7006 [ACK] Seq=318001 Ack=1 Win=131072 Len=1000 TSval=5105 TSecr=5059"
"3473","5.095656","10.1.0.11","10.1.0.4","TCP","2224","0.001520000","","","49156  >  7006 [ACK] Seq=320001 Ack=1 Win=131072 Len=1000 TSval=5107 TSecr=5059"
"3485","5.096989","10.1.0.11","10.1.0.4","TCP","2224","0.001333000","","","49156  >  7006 [ACK] Seq=322001 Ack=1 Win=131072 Len=1000 TSval=5108 TSecr=5059"
"3497","5.097998","10.1.0.11","10.1.0.4","TCP","1134","0.001009000","","","49156  >  7006 [ACK] Seq=323001 Ack=1 Win=131072 Len=1000 TSval=5109 TSecr=5059"
"3509","5.098910","10.1.0.11","10.1.0.4","TCP","1134","0.000912000","","","49156  >  7006 [ACK] Seq=324001 Ack=1 Win=131072 Len=1000 TSval=5110 TSecr=5059"
"3521","5.099822","10.1.0.11","10.1.0.4","TCP","1134","0.000912000","","","49156  >  7006 [ACK] Seq=325001 Ack=1 Win=131072 Len=1000 TSval=5111 TSecr=5059"
"3533","5.100734","10.1.0.11","10.1.0.4","TCP","2224","0.000912000","","","49156  >  7006 [ACK] Seq=327001 Ack=1 Win=131072 Len=1000 TSval=5112 TSecr=5059"
"3564","5.103715","10.1.0.11","10.1.0.4","TCP","3300","0.002981000","","","49156  >  7006 [ACK] Seq=330001 Ack=1 Win=131072 Len=1000 TSval=5115 TSecr=5059"
"3587","5.107376","10.1.0.11","10.1.0.4","TCP","5452","0.003661000","","","49156  >  7006 [ACK] Seq=335001 Ack=1 Win=131072 Len=1000 TSval=5119 TSecr=5059"
"3600","5.108762","10.1.0.11","10.1.0.4","TCP","2224","0.001386000","","","49156  >  7006 [ACK] Seq=337001 Ack=1 Win=131072 Len=1000 TSval=5120 TSecr=5059"
"3616","5.110010","10.1.0.11","10.1.0.4","TCP","1134","0.001248000","","","49156  >  7006 [ACK] Seq=338001 Ack=1 Win=131072 Len=1000 TSval=5121 TSecr=5059"
"3626","5.110770","10.1.0.11","10.1.0.4","TCP","1134","0.000760000","","","49156  >  7006 [ACK] Seq=339001 Ack=1 Win=131072 Len=1000 TSval=5122 TSecr=5059"
"3636","5.111530","10.1.0.11","10.1.0.4","TCP","1134","0.000760000","","","49156  >  7006 [ACK] Seq=340001 Ack=1 Win=131072 Len=1000 TSval=5123 TSecr=5059"
"3646","5.112290","10.1.0.11","10.1.0.4","TCP","1134","0.000760000","","","49156  >  7006 [ACK] Seq=341001 Ack=1 Win=131072 Len=1000 TSval=5124 TSecr=5059"
"3656","5.113051","10.1.0.11","10.1.0.4","TCP","1134","0.000761000","","","49156  >  7006 [ACK] Seq=342001 Ack=1 Win=131072 Len=1000 TSval=5124 TSecr=5059"
"3667","5.114267","10.1.0.11","10.1.0.4","TCP","1134","0.001216000","","","49156  >  7006 [ACK] Seq=343001 Ack=1 Win=131072 Len=1000 TSval=5125 TSecr=5059"
"3677","5.115027","10.1.0.11","10.1.0.4","TCP","1134","0.000760000","","","49156  >  7006 [ACK] Seq=344001 Ack=1 Win=131072 Len=1000 TSval=5126 TSecr=5059"
"3687","5.115787","10.1.0.11","10.1.0.4","TCP","1134","0.000760000","","","49156  >  7006 [ACK] Seq=345001 Ack=1 Win=131072 Len=1000 TSval=5127 TSecr=5059"
"3697","5.116547","10.1.0.11","10.1.0.4","TCP","1134","0.000760000","","","49156  >  7006 [ACK] Seq=346001 Ack=1 Win=131072 Len=1000 TSval=5128 TSecr=5059"
"3707","5.117307","10.1.0.11","10.1.0.4","TCP","1134","0.000760000","","","49156  >  7006 [ACK] Seq=347001 Ack=1 Win=131072 Len=1000 TSval=5128 TSecr=5059"
"3717","5.118067","10.1.0.11","10.1.0.4","TCP","1134","0.000760000","","","49156  >  7006 [ACK] Seq=348001 Ack=1 Win=131072 Len=1000 TSval=5129 TSecr=5059"
"3725","5.118675","10.1.0.11","10.1.0.4","TCP","1134","0.000608000","","","49156  >  7006 [ACK] Seq=349001 Ack=1 Win=131072 Len=1000 TSval=5130 TSecr=5059"
"3733","5.119284","10.1.0.11","10.1.0.4","TCP","1134","0.000609000","","","49156  >  7006 [ACK] Seq=350001 Ack=1 Win=131072 Len=1000 TSval=5131 TSecr=5059"
"3750","5.120927","10.1.0.11","10.1.0.4","TCP","2224","0.001643000","","","49156  >  7006 [ACK] Seq=352001 Ack=1 Win=131072 Len=1000 TSval=5132 TSecr=5059"
"3758","5.121567","10.1.0.11","10.1.0.4","TCP","1134","0.000640000","","","49156  >  7006 [ACK] Seq=353001 Ack=1 Win=131072 Len=1000 TSval=5133 TSecr=5059"
"3761","5.121970","10.1.0.4","10.1.0.11","TCP","2428","0.000403000","-43 dBm","0.059065000,0.059065000,0.059065000,0.059065000,0.059065000,0.059065000,0.059065000,0.055413000,0.055413000,0.055413000,0.053403000,0.052330000,0.050138000,0.049226000,0.047009000,0.045152000,0.043960000,0.042109000,0.041165000,0.038940000,0.038028000,0.036190000,0.034326000,0.032501000,0.031190000,0.027834000,0.027834000,0.026314000,0.024981000,0.023060000,0.021236000","7006  >  49156 [ACK] Seq=1 Ack=327001 Win=131072 Len=0 TSval=5113 TSecr=5111"
"3762","5.121970","10.1.0.4","10.1.0.11","TCP","1060","0.000000000","-43 dBm","0.018255000,0.018255000,0.014594000,0.014594000,0.013208000,0.011960000,0.010440000,0.008919000,0.006943000,0.005423000,0.003903000,0.002686000,0.001043000","7006  >  49156 [ACK] Seq=1 Ack=353001 Win=131072 Len=0 TSval=5133 TSecr=5132"
"3771","5.122594","10.1.0.11","10.1.0.4","TCP","1134","0.000624000","","","49156  >  7006 [ACK] Seq=354001 Ack=1 Win=131072 Len=1000 TSval=5134 TSecr=5133"
"3779","5.123202","10.1.0.11","10.1.0.4","TCP","1134","0.000608000","","","49156  >  7006 [ACK] Seq=355001 Ack=1 Win=131072 Len=1000 TSval=5135 TSecr=5133"
"3791","5.124120","10.1.0.11","10.1.0.4","TCP","1134","0.000918000","","","49156  >  7006 [ACK] Seq=356001 Ack=1 Win=131072 Len=1000 TSval=5136 TSecr=5133"
"3814","5.127265","10.1.0.11","10.1.0.4","TCP","4376","0.003145000","","","49156  >  7006 [ACK] Seq=360001 Ack=1 Win=131072 Len=1000 TSval=5139 TSecr=5133"
"3822","5.128258","10.1.0.11","10.1.0.4","TCP","1134","0.000993000","","","49156  >  7006 [ACK] Seq=361001 Ack=1 Win=131072 Len=1000 TSval=5140 TSecr=5133"
"3830","5.128866","10.1.0.11","10.1.0.4","TCP","1134","0.000608000","","","49156  >  7006 [ACK] Seq=362001 Ack=1 Win=131072 Len=1000 TSval=5140 TSecr=5133"
"3834","5.129344","10.1.0.4","10.1.0.11","TCP","452","0.000478000","-43 dBm","0.006750000,0.005224000,0.002079000,0.002079000,0.000478000","7006  >  49156 [ACK] Seq=1 Ack=363001 Win=131072 Len=0 TSval=5141 TSecr=5140"
"3862","5.131630","10.1.0.11","10.1.0.4","TCP","3300","0.002286000","","","49156  >  7006 [ACK] Seq=365001 Ack=1 Win=131072 Len=1000 TSval=5143 TSecr=5141"
"3890","5.136628","10.1.0.11","10.1.0.4","TCP","6528","0.004998000","","","49156  >  7006 [ACK] Seq=371001 Ack=1 Win=131072 Len=1000 TSval=5148 TSecr=5141"
"3905","5.138448","10.1.0.11","10.1.0.4","TCP","3300","0.001820000","","","49156  >  7006 [ACK] Seq=374001 Ack=1 Win=131072 Len=1000 TSval=5150 TSecr=5141"
"3919","5.139673","10.1.0.11","10.1.0.4","TCP","1134","0.001225000","","","49156  >  7006 [ACK] Seq=375001 Ack=1 Win=131072 Len=1000 TSval=5151 TSecr=5141"
"3931","5.140585","10.1.0.11","10.1.0.4","TCP","1134","0.000912000","","","49156  >  7006 [ACK] Seq=376001 Ack=1 Win=131072 Len=1000 TSval=5152 TSecr=5141"
"3943","5.141497","10.1.0.11","10.1.0.4","TCP","1134","0.000912000","","","49156  >  7006 [ACK] Seq=377001 Ack=1 Win=131072 Len=1000 TSval=5152 TSecr=5141"
"3972","5.144798","10.1.0.11","10.1.0.4","TCP","5452","0.003301000","","","49156  >  7006 [ACK] Seq=382001 Ack=1 Win=131072 Len=1000 TSval=5156 TSecr=5141"
"3984","5.146014","10.1.0.11","10.1.0.4","TCP","1134","0.001216000","","","49156  >  7006 [ACK] Seq=383001 Ack=1 Win=131072 Len=1000 TSval=5157 TSecr=5141"
"3996","5.146927","10.1.0.11","10.1.0.4","TCP","1134","0.000913000","","","49156  >  7006 [ACK] Seq=384001 Ack=1 Win=131072 Len=1000 TSval=5158 TSecr=5141"
"4008","5.147839","10.1.0.11","10.1.0.4","TCP","1134","0.000912000","","","49156  >  7006 [ACK] Seq=385001 Ack=1 Win=131072 Len=1000 TSval=5159 TSecr=5141"
"4020","5.148860","10.1.0.11","10.1.0.4","TCP","2224","0.001021000","","","49156  >  7006 [ACK] Seq=387001 Ack=1 Win=131072 Len=1000 TSval=5160 TSecr=5141"
"4032","5.149900","10.1.0.11","10.1.0.4","TCP","1134","0.001040000","","","49156  >  7006 [ACK] Seq=388001 Ack=1 Win=131072 Len=1000 TSval=5161 TSecr=5141"
"4044","5.150812","10.1.0.11","10.1.0.4","TCP","1134","0.000912000","","","49156  >  7006 [ACK] Seq=389001 Ack=1 Win=131072 Len=1000 TSval=5162 TSecr=5141"
"4056","5.151724","10.1.0.11","10.1.0.4","TCP","1134","0.000912000","","","49156  >  7006 [ACK] Seq=390001 Ack=1 Win=131072 Len=1000 TSval=5163 TSecr=5141"
"4068","5.152637","10.1.0.11","10.1.0.4","TCP","1134","0.000913000","","","49156  >  7006 [ACK] Seq=391001 Ack=1 Win=131072 Len=1000 TSval=5164 TSecr=5141"
"4080","5.153613","10.1.0.11","10.1.0.4","TCP","2224","0.000976000","","","49156  >  7006 [ACK] Seq=393001 Ack=1 Win=131072 Len=1000 TSval=5165 TSecr=5141"
"4096","5.154997","10.1.0.11","10.1.0.4","TCP","1134","0.001384000","","","49156  >  7006 [ACK] Seq=394001 Ack=1 Win=131072 Len=1000 TSval=5166 TSecr=5141"
"4108","5.155909","10.1.0.11","10.1.0.4","TCP","1134","0.000912000","","","49156  >  7006 [ACK] Seq=395001 Ack=1 Win=131072 Len=1000 TSval=5167 TSecr=5141"
"4120","5.156917","10.1.0.11","10.1.0.4","TCP","2224","0.001008000","","","49156  >  7006 [ACK] Seq=397001 Ack=1 Win=131072 Len=1000 TSval=5168 TSecr=5141"
"4132","5.157925","10.1.0.11","10.1.0.4","TCP","1134","0.001008000","","","49156  >  7006 [ACK] Seq=398001 Ack=1 Win=131072 Len=1000 TSval=5169 TSecr=5141"
"4144","5.158838","10.1.0.11","10.1.0.4","TCP","1134","0.000913000","","","49156  >  7006 [ACK] Seq=399001 Ack=1 Win=131072 Len=1000 TSval=5170 TSecr=5141"
"4156","5.159750","10.1.0.11","10.1.0.4","TCP","1134","0.000912000","","","49156  >  7006 [ACK] Seq=400001 Ack=1 Win=131072 Len=1000 TSval=5171 TSecr=5141"
"4168","5.160689","10.1.0.11","10.1.0.4","TCP","1134","0.000939000","","","49156  >  7006 [ACK] Seq=401001 Ack=1 Win=131072 Len=1000 TSval=5172 TSecr=5141"
"4180","5.161665","10.1.0.11","10.1.0.4","TCP","2224","0.000976000","","","49156  >  7006 [ACK] Seq=403001 Ack=1 Win=131072 Len=1000 TSval=5173 TSecr=5141"
"4192","5.162705","10.1.0.11","10.1.0.4","TCP","1134","0.001040000","","","49156  >  7006 [ACK] Seq=404001 Ack=1 Win=131072 Len=1000 TSval=5174 TSecr=5141"
"4204","5.163617","10.1.0.11","10.1.0.4","TCP","1134","0.000912000","","","49156  >  7006 [ACK] Seq=405001 Ack=1 Win=131072 Len=1000 TSval=5175 TSecr=5141"
"4216","5.164530","10.1.0.11","10.1.0.4","TCP","1134","0.000913000","","","49156  >  7006 [ACK] Seq=406001 Ack=1 Win=131072 Len=1000 TSval=5176 TSecr=5141"
"4242","5.166888","10.1.0.11","10.1.0.4","TCP","3300","0.002358000","","","49156  >  7006 [ACK] Seq=409001 Ack=1 Win=131072 Len=1000 TSval=5178 TSecr=5141"
"4266","5.170660","10.1.0.11","10.1.0.4","TCP","5452","0.003772000","","","49156  >  7006 [ACK] Seq=414001 Ack=1 Win=131072 Len=1000 TSval=5182 TSecr=5141"
"4288","5.172758","10.1.0.11","10.1.0.4","TCP","3300","0.002098000","","","49156  >  7006 [ACK] Seq=417001 Ack=1 Win=131072 Len=1000 TSval=5184 TSecr=5141"
"4303","5.174387","10.1.0.11","10.1.0.4","TCP","2224","0.001629000","","","49156  >  7006 [ACK] Seq=419001 Ack=1 Win=131072 Len=1000 TSval=5186 TSecr=5141"
"4315","5.175459","10.1.0.11","10.1.0.4","TCP","1134","0.001072000","","","49156  >  7006 [ACK] Seq=420001 Ack=1 Win=131072 Len=1000 TSval=5187 TSecr=5141"
"4327","5.176371","10.1.0.11","10.1.0.4","TCP","1134","0.000912000","","","49156  >  7006 [ACK] Seq=421001 Ack=1 Win=131072 Len=1000 TSval=5188 TSecr=5141"
