"No.","Time","Source","Destination","Protocol","Length","Time delta from previous displayed frame","Signal strength (dBm)","The RTT to ACK the segment was","Info"
"379","1.887803","10.1.0.11","10.1.0.4","TCP","138","0.000000000","-37 dBm","","49156  >  7006 [SYN] Seq=0 Win=65535 Len=0 TSval=1900 TSecr=0 WS=4 SACK_PERM=1"
"382","1.887958","10.1.0.4","10.1.0.11","TCP","138","0.000155000","","0.000155000","7006  >  49156 [SYN, ACK] Seq=0 Ack=1 Win=65535 Len=0 TSval=1900 TSecr=1900 WS=4 SACK_PERM=1"
"386","1.888408","10.1.0.11","10.1.0.4","TCP","134","0.000450000","-37 dBm","0.000450000","49156  >  7006 [ACK] Seq=1 Ack=1 Win=131072 Len=0 TSval=1900 TSecr=1900"
"395","1.889156","10.1.0.4","10.1.0.11","TCP","138","0.000748000","","","49153  >  7007 [SYN] Seq=0 Win=65535 Len=0 TSval=1900 TSecr=0 WS=4 SACK_PERM=1"
"398","1.889431","10.1.0.11","10.1.0.4","TCP","138","0.000275000","-37 dBm","0.000275000","7007  >  49153 [SYN, ACK] Seq=0 Ack=1 Win=65535 Len=0 TSval=1901 TSecr=1900 WS=4 SACK_PERM=1"
"401","1.889622","10.1.0.4","10.1.0.11","TCP","134","0.000191000","","0.000191000","49153  >  7007 [ACK] Seq=1 Ack=1 Win=131072 Len=0 TSval=1901 TSecr=1901"
"1016","4.839409","10.1.0.11","10.1.0.4","TCP","1134","2.949787000","-37 dBm","","49156  >  7006 [ACK] Seq=1 Ack=1 Win=131072 Len=1000 TSval=4851 TSecr=1900"
"1032","4.840657","10.1.0.11","10.1.0.4","TCP","2224","0.001248000","-37 dBm","","49156  >  7006 [ACK] Seq=2001 Ack=1 Win=131072 Len=1000 TSval=4852 TSecr=1900"
"1052","4.842561","10.1.0.11","10.1.0.4","TCP","2224","0.001904000","-37 dBm","","49156  >  7006 [ACK] Seq=4001 Ack=1 Win=131072 Len=1000 TSval=4854 TSecr=1900"
"1079","4.845817","10.1.0.11","10.1.0.4","TCP","4376","0.003256000","-37 dBm","","49156  >  7006 [ACK] Seq=8001 Ack=1 Win=131072 Len=1000 TSval=4857 TSecr=1900"
"1099","4.848378","10.1.0.11","10.1.0.4","TCP","3300","0.002561000","-37 dBm","","49156  >  7006 [ACK] Seq=11001 Ack=1 Win=131072 Len=1000 TSval=4860 TSecr=1900"
"1119","4.850570","10.1.0.11","10.1.0.4","TCP","3300","0.002192000","-37 dBm","","49156  >  7006 [ACK] Seq=14001 Ack=1 Win=131072 Len=1000 TSval=4862 TSecr=1900"
"1144","4.854665","10.1.0.4","10.1.0.11","TCP","6528","0.004095000","","","49153  >  7007 [ACK] Seq=5001 Ack=1 Win=131072 Len=1000 TSval=4856 TSecr=1901"
"1145","4.854665","10.1.0.4","10.1.0.11","TCP","6528","0.000000000","","","49153  >  7007 [ACK] Seq=11001 Ack=1 Win=131072 Len=1000 TSval=4861 TSecr=1901"
"1146","4.854665","10.1.0.4","10.1.0.11","TCP","3300","0.000000000","","","49153  >  7007 [ACK] Seq=14001 Ack=1 Win=131072 Len=1000 TSval=4863 TSecr=1901"
"1160","4.857524","10.1.0.4","10.1.0.11","TCP","6528","0.002859000","","","[TCP Retransmission] [TCP Retransmission] [TCP Retransmission] [TCP Retransmission] [TCP Retransmission] [TCP Retransmission] 49153  >  7007 [ACK] Seq=5001 Ack=1 Win=131072 Len=1000 TSval=4856 TSecr=1901"
"1161","4.857524","10.1.0.4","10.1.0.11","TCP","6528","0.000000000","","","[TCP Retransmission] [TCP Retransmission] [TCP Retransmission] [TCP Retransmission] [TCP Retransmission] [TCP Retransmission] 49153  >  7007 [ACK] Seq=11001 Ack=1 Win=131072 Len=1000 TSval=4861 TSecr=1901"
"1162","4.857524","10.1.0.4","10.1.0.11","TCP","3300","0.000000000","","","[TCP Retransmission] [TCP Retransmission] [TCP Retransmission] 49153  >  7007 [ACK] Seq=14001 Ack=1 Win=131072 Len=1000 TSval=4863 TSecr=1901"
"1207","4.862896","10.1.0.4","10.1.0.11","TCP","680","0.005372000","","0.023487000,0.022239000,0.020335000,0.017079000,0.017079000,0.014518000,0.012326000,0.012326000","7006  >  49156 [ACK] Seq=1 Ack=15001 Win=131072 Len=0 TSval=4863 TSecr=4861"
"1210","4.863722","10.1.0.11","10.1.0.4","TCP","6376","0.000826000","-37 dBm","","[TCP Previous segment not captured] 49156  >  7006 [ACK] Seq=25501 Ack=1 Win=131072 Len=1500 TSval=4875 TSecr=4858"
"1211","4.863722","10.1.0.11","10.1.0.4","TCP","4300","0.000000000","-37 dBm","","49156  >  7006 [ACK] Seq=30001 Ack=1 Win=131072 Len=1000 TSval=4875 TSecr=4858"
"1213","4.864086","10.1.0.11","10.1.0.4","TCP","6376","0.000364000","-37 dBm","","[TCP Out-Of-Order] [TCP Out-Of-Order] [TCP Out-Of-Order] [TCP Out-Of-Order] 49156  >  7006 [ACK] Seq=19501 Ack=1 Win=131072 Len=1500 TSval=4875 TSecr=4853"
"1214","4.864086","10.1.0.11","10.1.0.4","TCP","1134","0.000000000","-37 dBm","","49156  >  7006 [ACK] Seq=31001 Ack=1 Win=131072 Len=1000 TSval=4876 TSecr=4863"
"1225","4.865244","10.1.0.11","10.1.0.4","TCP","1134","0.001158000","-37 dBm","","49156  >  7006 [ACK] Seq=32001 Ack=1 Win=131072 Len=1000 TSval=4876 TSecr=4863"
"1227","4.865396","10.1.0.11","10.1.0.4","TCP","1134","0.000152000","-37 dBm","","49156  >  7006 [ACK] Seq=33001 Ack=1 Win=131072 Len=1000 TSval=4877 TSecr=4863"
"1246","4.867816","10.1.0.11","10.1.0.4","TCP","3300","0.002420000","-37 dBm","","49156  >  7006 [ACK] Seq=36001 Ack=1 Win=131072 Len=1000 TSval=4880 TSecr=4863"
"1257","4.869047","10.1.0.11","10.1.0.4","TCP","1134","0.001231000","-37 dBm","","49156  >  7006 [ACK] Seq=37001 Ack=1 Win=131072 Len=1000 TSval=4880 TSecr=4863"
"1260","4.869321","10.1.0.4","10.1.0.11","TCP","756","0.000274000","","0.005235000,0.005235000,0.005599000,0.005599000,0.005599000,0.005235000,0.003925000,0.001505000,0.000274000","7006  >  49156 [ACK] Seq=1 Ack=38001 Win=131072 Len=0 TSval=4881 TSecr=4880"
"1267","4.869939","10.1.0.11","10.1.0.4","TCP","1134","0.000618000","-37 dBm","","49156  >  7006 [ACK] Seq=38001 Ack=1 Win=131072 Len=1000 TSval=4881 TSecr=4863"
"1273","4.870395","10.1.0.11","10.1.0.4","TCP","1134","0.000456000","-37 dBm","","49156  >  7006 [ACK] Seq=39001 Ack=1 Win=131072 Len=1000 TSval=4882 TSecr=4881"
"1285","4.872020","10.1.0.4","10.1.0.11","TCP","134","0.001625000","","0.001625000","7006  >  49156 [ACK] Seq=1 Ack=40001 Win=131072 Len=0 TSval=4882 TSecr=4881"
"1302","4.873458","10.1.0.11","10.1.0.4","TCP","4376","0.001438000","-37 dBm","","49156  >  7006 [ACK] Seq=43001 Ack=1 Win=131072 Len=1000 TSval=4885 TSecr=4882"
"1316","4.875278","10.1.0.11","10.1.0.4","TCP","2224","0.001820000","-37 dBm","","49156  >  7006 [ACK] Seq=45001 Ack=1 Win=131072 Len=1000 TSval=4887 TSecr=4882"
"1327","4.876092","10.1.0.11","10.1.0.4","TCP","1134","0.000814000","-37 dBm","","49156  >  7006 [ACK] Seq=46001 Ack=1 Win=131072 Len=1000 TSval=4888 TSecr=4882"
"1337","4.877608","10.1.0.11","10.1.0.4","TCP","2224","0.001516000","-37 dBm","","49156  >  7006 [ACK] Seq=48001 Ack=1 Win=131072 Len=1000 TSval=4889 TSecr=4882"
"1350","4.878767","10.1.0.11","10.1.0.4","TCP","1134","0.001159000","-37 dBm","","49156  >  7006 [ACK] Seq=49001 Ack=1 Win=131072 Len=1000 TSval=4890 TSecr=4882"
"1358","4.879551","10.1.0.11","10.1.0.4","TCP","1134","0.000784000","-37 dBm","","49156  >  7006 [ACK] Seq=50001 Ack=1 Win=131072 Len=1000 TSval=4891 TSecr=4882"
"1366","4.880159","10.1.0.11","10.1.0.4","TCP","1134","0.000608000","-37 dBm","","49156  >  7006 [ACK] Seq=51001 Ack=1 Win=131072 Len=1000 TSval=4892 TSecr=4882"
"1381","4.881315","10.1.0.4","10.1.0.11","TCP","528","0.001156000","","0.007857000,0.007857000,0.006037000,0.003707000,0.002548000,0.001156000","7006  >  49156 [ACK] Seq=1 Ack=52001 Win=131072 Len=0 TSval=4892 TSecr=4891"
"1400","4.882946","10.1.0.11","10.1.0.4","TCP","3300","0.001631000","-37 dBm","","49156  >  7006 [ACK] Seq=54001 Ack=1 Win=131072 Len=1000 TSval=4894 TSecr=4892"
"1426","4.887527","10.1.0.11","10.1.0.4","TCP","2224","0.004581000","-37 dBm","","49156  >  7006 [ACK] Seq=56001 Ack=1 Win=131072 Len=1000 TSval=4896 TSecr=4892"
"1428","4.887793","10.1.0.11","10.1.0.4","TCP","4376","0.000266000","-37 dBm","","49156  >  7006 [ACK] Seq=60001 Ack=1 Win=131072 Len=1000 TSval=4899 TSecr=4892"
"1436","4.888433","10.1.0.11","10.1.0.4","TCP","1134","0.000640000","-37 dBm","","49156  >  7006 [ACK] Seq=61001 Ack=1 Win=131072 Len=1000 TSval=4900 TSecr=4892"
"1444","4.889041","10.1.0.11","10.1.0.4","TCP","1134","0.000608000","-37 dBm","","49156  >  7006 [ACK] Seq=62001 Ack=1 Win=131072 Len=1000 TSval=4900 TSecr=4892"
"1464","4.890916","10.1.0.11","10.1.0.4","TCP","2224","0.001875000","-37 dBm","","49156  >  7006 [ACK] Seq=64001 Ack=1 Win=131072 Len=1000 TSval=4902 TSecr=4892"
"1482","4.893436","10.1.0.11","10.1.0.4","TCP","4376","0.002520000","-37 dBm","","49156  >  7006 [ACK] Seq=68001 Ack=1 Win=131072 Len=1000 TSval=4905 TSecr=4892"
"1496","4.894724","10.1.0.11","10.1.0.4","TCP","1134","0.001288000","-37 dBm","","49156  >  7006 [ACK] Seq=69001 Ack=1 Win=131072 Len=1000 TSval=4906 TSecr=4892"
"1509","4.895763","10.1.0.11","10.1.0.4","TCP","2224","0.001039000","-37 dBm","","49156  >  7006 [ACK] Seq=71001 Ack=1 Win=131072 Len=1000 TSval=4908 TSecr=4892"
"1529","4.897348","10.1.0.11","10.1.0.4","TCP","2224","0.001585000","-37 dBm","","49156  >  7006 [ACK] Seq=73001 Ack=1 Win=131072 Len=1000 TSval=4909 TSecr=4892"
"1549","4.898900","10.1.0.11","10.1.0.4","TCP","1134","0.001552000","-37 dBm","","49156  >  7006 [ACK] Seq=74001 Ack=1 Win=131072 Len=1000 TSval=4910 TSecr=4892"
"1561","4.899876","10.1.0.11","10.1.0.4","TCP","2224","0.000976000","-37 dBm","","49156  >  7006 [ACK] Seq=76001 Ack=1 Win=131072 Len=1000 TSval=4912 TSecr=4892"
"1579","4.901380","10.1.0.11","10.1.0.4","TCP","2224","0.001504000","-37 dBm","","49156  >  7006 [ACK] Seq=78001 Ack=1 Win=131072 Len=1000 TSval=4913 TSecr=4892"
"1599","4.902964","10.1.0.11","10.1.0.4","TCP","2224","0.001584000","-37 dBm","","49156  >  7006 [ACK] Seq=80001 Ack=1 Win=131072 Len=1000 TSval=4915 TSecr=4892"
"1619","4.904549","10.1.0.11","10.1.0.4","TCP","2224","0.001585000","-37 dBm","","49156  >  7006 [ACK] Seq=82001 Ack=1 Win=131072 Len=1000 TSval=4916 TSecr=4892"
"1639","4.906101","10.1.0.11","10.1.0.4","TCP","1134","0.001552000","-37 dBm","","49156  >  7006 [ACK] Seq=83001 Ack=1 Win=131072 Len=1000 TSval=4917 TSecr=4892"
"1652","4.907222","10.1.0.11","10.1.0.4","TCP","2224","0.001121000","-37 dBm","","49156  >  7006 [ACK] Seq=85001 Ack=1 Win=131072 Len=1000 TSval=4919 TSecr=4892"
"1664","4.908230","10.1.0.11","10.1.0.4","TCP","1134","0.001008000","-37 dBm","","49156  >  7006 [ACK] Seq=86001 Ack=1 Win=131072 Len=1000 TSval=4920 TSecr=4892"
"1676","4.909142","10.1.0.11","10.1.0.4","TCP","1134","0.000912000","-37 dBm","","49156  >  7006 [ACK] Seq=87001 Ack=1 Win=131072 Len=1000 TSval=4920 TSecr=4892"
"1688","4.910054","10.1.0.11","10.1.0.4","TCP","1134","0.000912000","-37 dBm","","49156  >  7006 [ACK] Seq=88001 Ack=1 Win=131072 Len=1000 TSval=4921 TSecr=4892"
"1700","4.910998","10.1.0.11","10.1.0.4","TCP","2224","0.000944000","-37 dBm","","49156  >  7006 [ACK] Seq=90001 Ack=1 Win=131072 Len=1000 TSval=4923 TSecr=4892"
"1712","4.911919","10.1.0.4","10.1.0.11","TCP","1516","0.000921000","","0.028973000,0.024392000,0.024126000,0.024126000,0.023486000,0.021003000,0.018483000,0.018483000,0.017195000,0.016156000,0.014571000,0.012043000,0.010539000,0.008955000,0.007370000,0.005818000,0.004697000,0.002777000,0.000921000","7006  >  49156 [ACK] Seq=1 Ack=90001 Win=131072 Len=0 TSval=4923 TSecr=4921"
"1722","4.912976","10.1.0.11","10.1.0.4","TCP","2224","0.001057000","-37 dBm","","49156  >  7006 [ACK] Seq=92001 Ack=1 Win=131072 Len=1000 TSval=4924 TSecr=4892"
"1736","4.914040","10.1.0.11","10.1.0.4","TCP","1134","0.001064000","-37 dBm","","49156  >  7006 [ACK] Seq=93001 Ack=1 Win=131072 Len=1000 TSval=4925 TSecr=4892"
"1748","4.914984","10.1.0.11","10.1.0.4","TCP","2224","0.000944000","-37 dBm","","49156  >  7006 [ACK] Seq=95001 Ack=1 Win=131072 Len=1000 TSval=4927 TSecr=4892"
"1768","4.916568","10.1.0.11","10.1.0.4","TCP","2224","0.001584000","-37 dBm","","49156  >  7006 [ACK] Seq=97001 Ack=1 Win=131072 Len=1000 TSval=4928 TSecr=4892"
"1790","4.918703","10.1.0.11","10.1.0.4","TCP","2224","0.002135000","-37 dBm","","49156  >  7006 [ACK] Seq=99001 Ack=1 Win=131072 Len=1000 TSval=4930 TSecr=4892"
"1802","4.919648","10.1.0.11","10.1.0.4","TCP","1134","0.000945000","-37 dBm","","49156  >  7006 [ACK] Seq=100001 Ack=1 Win=131072 Len=1000 TSval=4931 TSecr=4892"
"1814","4.920592","10.1.0.11","10.1.0.4","TCP","2224","0.000944000","-37 dBm","","49156  >  7006 [ACK] Seq=102001 Ack=1 Win=131072 Len=1000 TSval=4932 TSecr=4892"
"1832","4.921992","10.1.0.11","10.1.0.4","TCP","1134","0.001400000","-37 dBm","","49156  >  7006 [ACK] Seq=103001 Ack=1 Win=131072 Len=1000 TSval=4933 TSecr=4892"
"1840","4.922600","10.1.0.11","10.1.0.4","TCP","1134","0.000608000","-37 dBm","","49156  >  7006 [ACK] Seq=104001 Ack=1 Win=131072 Len=1000 TSval=4934 TSecr=4892"
"1843","4.922755","10.1.0.4","10.1.0.11","TCP","1516","0.000155000","","","7006  >  49156 [ACK] Seq=1 Ack=90001 Win=131072 Len=0 TSval=4923 TSecr=4921"
"1844","4.922755","10.1.0.4","10.1.0.11","TCP","604","0.000000000","","0.009779000,0.008715000,0.007771000,0.006187000,0.004052000,0.002163000,0.000763000","7006  >  49156 [ACK] Seq=1 Ack=104001 Win=131072 Len=0 TSval=4934 TSecr=4932"
"1857","4.923846","10.1.0.11","10.1.0.4","TCP","680","0.001091000","-37 dBm","0.069181000,0.069181000,0.069181000,0.069181000,0.069181000,0.069181000,0.069181000,0.069181000","7007  >  49153 [ACK] Seq=1 Ack=15001 Win=131072 Len=0 TSval=4870 TSecr=4863"
"1878","4.928359","10.1.0.4","10.1.0.11","TCP","6376","0.004513000","","","49153  >  7007 [ACK] Seq=19501 Ack=1 Win=131072 Len=1500 TSval=4936 TSecr=4870"
"1879","4.928359","10.1.0.4","10.1.0.11","TCP","6376","0.000000000","","","49153  >  7007 [ACK] Seq=25501 Ack=1 Win=131072 Len=1500 TSval=4936 TSecr=4870"
"1880","4.928359","10.1.0.4","10.1.0.11","TCP","6376","0.000000000","","","49153  >  7007 [ACK] Seq=31501 Ack=1 Win=131072 Len=1500 TSval=4936 TSecr=4870"
"1881","4.928359","10.1.0.4","10.1.0.11","TCP","6376","0.000000000","","","49153  >  7007 [ACK] Seq=37501 Ack=1 Win=131072 Len=1500 TSval=4936 TSecr=4870"
"1882","4.928359","10.1.0.4","10.1.0.11","TCP","6376","0.000000000","","","49153  >  7007 [ACK] Seq=43501 Ack=1 Win=131072 Len=1500 TSval=4936 TSecr=4870"
"1904","4.932844","10.1.0.11","10.1.0.4","TCP","6528","0.004485000","-37 dBm","","49156  >  7006 [ACK] Seq=110001 Ack=1 Win=131072 Len=1000 TSval=4939 TSecr=4892"
"1905","4.932844","10.1.0.11","10.1.0.4","TCP","6528","0.000000000","-37 dBm","","49156  >  7006 [ACK] Seq=116001 Ack=1 Win=131072 Len=1000 TSval=4944 TSecr=4892"
"1911","4.933336","10.1.0.11","10.1.0.4","TCP","1134","0.000492000","-37 dBm","","49156  >  7006 [ACK] Seq=117001 Ack=1 Win=131072 Len=1000 TSval=4944 TSecr=4892"
"2187","4.972088","10.1.0.4","10.1.0.11","TCP","1516","0.038752000","","","7006  >  49156 [ACK] Seq=1 Ack=90001 Win=131072 Len=0 TSval=4923 TSecr=4921"
"2188","4.972088","10.1.0.4","10.1.0.11","TCP","604","0.000000000","","","7006  >  49156 [ACK] Seq=1 Ack=104001 Win=131072 Len=0 TSval=4934 TSecr=4932"
"2189","4.972088","10.1.0.4","10.1.0.11","TCP","604","0.000000000","","0.039244000,0.039244000,0.039244000,0.039244000,0.039244000,0.039244000,0.038752000","7006  >  49156 [ACK] Seq=1 Ack=118001 Win=131072 Len=0 TSval=4945 TSecr=4944"
"2192","4.974152","10.1.0.11","10.1.0.4","TCP","6376","0.002064000","-37 dBm","","49156  >  7006 [ACK] Seq=122501 Ack=1 Win=131072 Len=1500 TSval=4984 TSecr=4900"
"2193","4.974152","10.1.0.11","10.1.0.4","TCP","6376","0.000000000","-37 dBm","","49156  >  7006 [ACK] Seq=128501 Ack=1 Win=131072 Len=1500 TSval=4984 TSecr=4900"
"2194","4.974152","10.1.0.11","10.1.0.4","TCP","6376","0.000000000","-37 dBm","","49156  >  7006 [ACK] Seq=134501 Ack=1 Win=131072 Len=1500 TSval=4984 TSecr=4900"
"2195","4.974152","10.1.0.11","10.1.0.4","TCP","6376","0.000000000","-37 dBm","","49156  >  7006 [ACK] Seq=140501 Ack=1 Win=131072 Len=1500 TSval=4984 TSecr=4903"
"2196","4.974152","10.1.0.11","10.1.0.4","TCP","6376","0.000000000","-37 dBm","","49156  >  7006 [ACK] Seq=146501 Ack=1 Win=131072 Len=1500 TSval=4984 TSecr=4905"
"2197","4.974152","10.1.0.11","10.1.0.4","TCP","6376","0.000000000","-37 dBm","","49156  >  7006 [ACK] Seq=152501 Ack=1 Win=131072 Len=1500 TSval=4984 TSecr=4907"
"2198","4.974152","10.1.0.11","10.1.0.4","TCP","6376","0.000000000","-37 dBm","","49156  >  7006 [ACK] Seq=158501 Ack=1 Win=131072 Len=1500 TSval=4984 TSecr=4909"
"2199","4.974152","10.1.0.11","10.1.0.4","TCP","7452","0.000000000","-37 dBm","","49156  >  7006 [ACK] Seq=166001 Ack=1 Win=131072 Len=1000 TSval=4984 TSecr=4915"
"2205","4.974804","10.1.0.11","10.1.0.4","TCP","3300","0.000652000","-37 dBm","","49156  >  7006 [ACK] Seq=169001 Ack=1 Win=131072 Len=1000 TSval=4986 TSecr=4945"
"2211","4.975260","10.1.0.11","10.1.0.4","TCP","1134","0.000456000","-37 dBm","","49156  >  7006 [ACK] Seq=170001 Ack=1 Win=131072 Len=1000 TSval=4987 TSecr=4945"
"2223","4.976062","10.1.0.4","10.1.0.11","TCP","1440","0.000802000","","0.001910000,0.001910000,0.001910000,0.001910000,0.001910000,0.001910000,0.001910000,0.001910000,0.001910000,0.001910000,0.001910000,0.001910000,0.001910000,0.001910000,0.001910000,0.001910000,0.001258000,0.001258000","7006  >  49156 [ACK] Seq=1 Ack=170001 Win=131072 Len=0 TSval=4987 TSecr=4985"
"2233","4.977229","10.1.0.11","10.1.0.4","TCP","2224","0.001167000","-37 dBm","","49156  >  7006 [ACK] Seq=172001 Ack=1 Win=131072 Len=1000 TSval=4988 TSecr=4987"
"2251","4.980201","10.1.0.11","10.1.0.4","TCP","4376","0.002972000","-37 dBm","","49156  >  7006 [ACK] Seq=176001 Ack=1 Win=131072 Len=1000 TSval=4992 TSecr=4987"
"2259","4.980809","10.1.0.11","10.1.0.4","TCP","1134","0.000608000","-37 dBm","","49156  >  7006 [ACK] Seq=177001 Ack=1 Win=131072 Len=1000 TSval=4992 TSecr=4987"
"2271","4.981743","10.1.0.11","10.1.0.4","TCP","1134","0.000934000","-37 dBm","","49156  >  7006 [ACK] Seq=178001 Ack=1 Win=131072 Len=1000 TSval=4993 TSecr=4987"
"2279","4.982352","10.1.0.11","10.1.0.4","TCP","1134","0.000609000","-37 dBm","","49156  >  7006 [ACK] Seq=179001 Ack=1 Win=131072 Len=1000 TSval=4994 TSecr=4987"
"2284","4.982668","10.1.0.4","10.1.0.11","TCP","452","0.000316000","","0.005439000,0.002467000,0.002467000,0.001859000,0.000316000","7006  >  49156 [ACK] Seq=1 Ack=180001 Win=131072 Len=0 TSval=4994 TSecr=4993"
"2289","4.983242","10.1.0.11","10.1.0.4","TCP","1134","0.000574000","-37 dBm","","49156  >  7006 [ACK] Seq=180001 Ack=1 Win=131072 Len=1000 TSval=4995 TSecr=4987"
"2301","4.984705","10.1.0.11","10.1.0.4","TCP","2224","0.001463000","-37 dBm","","49156  >  7006 [ACK] Seq=182001 Ack=1 Win=131072 Len=1000 TSval=4996 TSecr=4987"
"2322","4.987909","10.1.0.11","10.1.0.4","TCP","4376","0.003204000","-37 dBm","","49156  >  7006 [ACK] Seq=186001 Ack=1 Win=131072 Len=1000 TSval=5000 TSecr=4987"
"2334","4.988821","10.1.0.11","10.1.0.4","TCP","1134","0.000912000","-37 dBm","","49156  >  7006 [ACK] Seq=187001 Ack=1 Win=131072 Len=1000 TSval=5000 TSecr=4987"
"2346","4.989976","10.1.0.11","10.1.0.4","TCP","1134","0.001155000","-37 dBm","","49156  >  7006 [ACK] Seq=188001 Ack=1 Win=131072 Len=1000 TSval=5001 TSecr=4987"
"2360","4.991972","10.1.0.11","10.1.0.4","TCP","3300","0.001996000","-37 dBm","","49156  >  7006 [ACK] Seq=191001 Ack=1 Win=131072 Len=1000 TSval=5004 TSecr=4987"
"2374","4.993069","10.1.0.11","10.1.0.4","TCP","1134","0.001097000","-37 dBm","","49156  >  7006 [ACK] Seq=192001 Ack=1 Win=131072 Len=1000 TSval=5004 TSecr=4987"
"2384","4.993829","10.1.0.11","10.1.0.4","TCP","1134","0.000760000","-37 dBm","","49156  >  7006 [ACK] Seq=193001 Ack=1 Win=131072 Len=1000 TSval=5005 TSecr=4987"
"2394","4.994589","10.1.0.11","10.1.0.4","TCP","1134","0.000760000","-37 dBm","","49156  >  7006 [ACK] Seq=194001 Ack=1 Win=131072 Len=1000 TSval=5006 TSecr=4987"
"2413","4.996257","10.1.0.11","10.1.0.4","TCP","2224","0.001668000","-37 dBm","","49156  >  7006 [ACK] Seq=196001 Ack=1 Win=131072 Len=1000 TSval=5008 TSecr=4987"
"2423","4.997081","10.1.0.11","10.1.0.4","TCP","1134","0.000824000","-37 dBm","","49156  >  7006 [ACK] Seq=197001 Ack=1 Win=131072 Len=1000 TSval=5008 TSecr=4987"
"2433","4.997841","10.1.0.11","10.1.0.4","TCP","1134","0.000760000","-37 dBm","","49156  >  7006 [ACK] Seq=198001 Ack=1 Win=131072 Len=1000 TSval=5009 TSecr=4987"
"2443","4.998601","10.1.0.11","10.1.0.4","TCP","1134","0.000760000","-37 dBm","","49156  >  7006 [ACK] Seq=199001 Ack=1 Win=131072 Len=1000 TSval=5010 TSecr=4987"
"2453","4.999362","10.1.0.11","10.1.0.4","TCP","1134","0.000761000","-37 dBm","","49156  >  7006 [ACK] Seq=200001 Ack=1 Win=131072 Len=1000 TSval=5011 TSecr=4987"
"2463","5.000122","10.1.0.11","10.1.0.4","TCP","1134","0.000760000","-37 dBm","","49156  >  7006 [ACK] Seq=201001 Ack=1 Win=131072 Len=1000 TSval=5012 TSecr=4987"
"2473","5.000882","10.1.0.11","10.1.0.4","TCP","1134","0.000760000","-37 dBm","","49156  >  7006 [ACK] Seq=202001 Ack=1 Win=131072 Len=1000 TSval=5012 TSecr=4987"
"2484","5.001580","10.1.0.4","10.1.0.11","TCP","452","0.000698000","","","7006  >  49156 [ACK] Seq=1 Ack=180001 Win=131072 Len=0 TSval=4994 TSecr=4993"
"2485","5.001580","10.1.0.4","10.1.0.11","TCP","908","0.000000000","","0.016875000,0.013671000,0.013671000,0.012759000,0.009608000,0.009608000,0.007751000,0.005323000,0.004499000,0.002979000,0.001458000","7006  >  49156 [ACK] Seq=1 Ack=202001 Win=131072 Len=0 TSval=5012 TSecr=5011"
"2504","5.003229","10.1.0.11","10.1.0.4","TCP","3300","0.001649000","-37 dBm","","49156  >  7006 [ACK] Seq=205001 Ack=1 Win=131072 Len=1000 TSval=5015 TSecr=4987"
"2535","5.008458","10.1.0.11","10.1.0.4","TCP","6528","0.005229000","-37 dBm","","49156  >  7006 [ACK] Seq=211001 Ack=1 Win=131072 Len=1000 TSval=5020 TSecr=4987"
"2549","5.010386","10.1.0.11","10.1.0.4","TCP","3300","0.001928000","-37 dBm","","49156  >  7006 [ACK] Seq=214001 Ack=1 Win=131072 Len=1000 TSval=5022 TSecr=4987"
"2563","5.011611","10.1.0.11","10.1.0.4","TCP","1134","0.001225000","-37 dBm","","49156  >  7006 [ACK] Seq=215001 Ack=1 Win=131072 Len=1000 TSval=5023 TSecr=4987"
"2577","5.012739","10.1.0.11","10.1.0.4","TCP","2224","0.001128000","-37 dBm","","49156  >  7006 [ACK] Seq=217001 Ack=1 Win=131072 Len=1000 TSval=5024 TSecr=4987"
"2592","5.014282","10.1.0.11","10.1.0.4","TCP","2224","0.001543000","-37 dBm","","49156  >  7006 [ACK] Seq=219001 Ack=1 Win=131072 Len=1000 TSval=5026 TSecr=4987"
"2608","5.015658","10.1.0.11","10.1.0.4","TCP","1134","0.001376000","-37 dBm","","49156  >  7006 [ACK] Seq=220001 Ack=1 Win=131072 Len=1000 TSval=5027 TSecr=4987"
"2616","5.016266","10.1.0.11","10.1.0.4","TCP","1134","0.000608000","-37 dBm","","49156  >  7006 [ACK] Seq=221001 Ack=1 Win=131072 Len=1000 TSval=5028 TSecr=4987"
"2626","5.017026","10.1.0.11","10.1.0.4","TCP","1134","0.000760000","-37 dBm","","49156  >  7006 [ACK] Seq=222001 Ack=1 Win=131072 Len=1000 TSval=5028 TSecr=4987"
"2636","5.017786","10.1.0.11","10.1.0.4","TCP","1134","0.000760000","-37 dBm","","49156  >  7006 [ACK] Seq=223001 Ack=1 Win=131072 Len=1000 TSval=5029 TSecr=4987"
"2646","5.018547","10.1.0.11","10.1.0.4","TCP","1134","0.000761000","-37 dBm","","49156  >  7006 [ACK] Seq=224001 Ack=1 Win=131072 Len=1000 TSval=5030 TSecr=4987"
"2666","5.020732","10.1.0.11","10.1.0.4","TCP","1136","0.002185000","-37 dBm","","49156  >  7006 [ACK] Seq=225001 Ack=1 Win=131072 Len=1000 TSval=5031 TSecr=4987"
"2667","5.020732","10.1.0.11","10.1.0.4","TCP","2224","0.000000000","-37 dBm","","49156  >  7006 [ACK] Seq=227001 Ack=1 Win=131072 Len=1000 TSval=5032 TSecr=4987"
"2693","5.024976","10.1.0.11","10.1.0.4","TCP","5452","0.004244000","-37 dBm","","49156  >  7006 [ACK] Seq=232001 Ack=1 Win=131072 Len=1000 TSval=5036 TSecr=4987"
"2708","5.027113","10.1.0.11","10.1.0.4","TCP","3300","0.002137000","-37 dBm","","49156  >  7006 [ACK] Seq=235001 Ack=1 Win=131072 Len=1000 TSval=5039 TSecr=4987"
"2724","5.028649","10.1.0.11","10.1.0.4","TCP","2224","0.001536000","-37 dBm","","49156  >  7006 [ACK] Seq=237001 Ack=1 Win=131072 Len=1000 TSval=5040 TSecr=4987"
"2744","5.030362","10.1.0.11","10.1.0.4","TCP","2224","0.001713000","-37 dBm","","49156  >  7006 [ACK] Seq=239001 Ack=1 Win=131072 Len=1000 TSval=5042 TSecr=4987"
"2767","5.032211","10.1.0.11","10.1.0.4","TCP","2224","0.001849000","-37 dBm","","49156  >  7006 [ACK] Seq=241001 Ack=1 Win=131072 Len=1000 TSval=5044 TSecr=4987"
"2786","5.034439","10.1.0.11","10.1.0.4","TCP","3300","0.002228000","-37 dBm","","49156  >  7006 [ACK] Seq=244001 Ack=1 Win=131072 Len=1000 TSval=5046 TSecr=4987"
"2800","5.035919","10.1.0.11","10.1.0.4","TCP","2224","0.001480000","-37 dBm","","49156  >  7006 [ACK] Seq=246001 Ack=1 Win=131072 Len=1000 TSval=5048 TSecr=4987"
"2824","5.037994","10.1.0.11","10.1.0.4","TCP","2224","0.002075000","-37 dBm","","49156  >  7006 [ACK] Seq=248001 Ack=1 Win=131072 Len=1000 TSval=5049 TSecr=4987"
"2838","5.039282","10.1.0.11","10.1.0.4","TCP","2224","0.001288000","-37 dBm","","49156  >  7006 [ACK] Seq=250001 Ack=1 Win=131072 Len=1000 TSval=5051 TSecr=4987"
"2852","5.040506","10.1.0.11","10.1.0.4","TCP","1134","0.001224000","-37 dBm","","49156  >  7006 [ACK] Seq=251001 Ack=1 Win=131072 Len=1000 TSval=5052 TSecr=4987"
"2864","5.041482","10.1.0.11","10.1.0.4","TCP","2224","0.000976000","-37 dBm","","49156  >  7006 [ACK] Seq=253001 Ack=1 Win=131072 Len=1000 TSval=5053 TSecr=4987"
"2880","5.042826","10.1.0.11","10.1.0.4","TCP","1134","0.001344000","-37 dBm","","49156  >  7006 [ACK] Seq=254001 Ack=1 Win=131072 Len=1000 TSval=5054 TSecr=4987"
"2891","5.043672","10.1.0.11","10.1.0.4","TCP","1134","0.000846000","-37 dBm","","49156  >  7006 [ACK] Seq=255001 Ack=1 Win=131072 Len=1000 TSval=5055 TSecr=4987"
"2903","5.044648","10.1.0.11","10.1.0.4","TCP","2224","0.000976000","-37 dBm","","49156  >  7006 [ACK] Seq=257001 Ack=1 Win=131072 Len=1000 TSval=5056 TSecr=4987"
"2917","5.045809","10.1.0.11","10.1.0.4","TCP","1134","0.001161000","-37 dBm","","49156  >  7006 [ACK] Seq=258001 Ack=1 Win=131072 Len=1000 TSval=5057 TSecr=4987"
"2929","5.046721","10.1.0.11","10.1.0.4","TCP","1134","0.000912000","-37 dBm","","49156  >  7006 [ACK] Seq=259001 Ack=1 Win=131072 Len=1000 TSval=5058 TSecr=4987"
"2941","5.047633","10.1.0.11","10.1.0.4","TCP","1134","0.000912000","-37 dBm","","49156  >  7006 [ACK] Seq=260001 Ack=1 Win=131072 Len=1000 TSval=5059 TSecr=4987"
"3063","5.060155","10.1.0.4","10.1.0.11","TCP","452","0.012522000","","","7006  >  49156 [ACK] Seq=1 Ack=180001 Win=131072 Len=0 TSval=4994 TSecr=4993"
"3064","5.060155","10.1.0.4","10.1.0.11","TCP","908","0.000000000","","","7006  >  49156 [ACK] Seq=1 Ack=202001 Win=131072 Len=0 TSval=5012 TSecr=5011"
"3065","5.060155","10.1.0.4","10.1.0.11","TCP","2276","0.000000000","","0.056926000,0.056926000,0.051697000,0.051697000,0.051697000,0.049769000,0.048544000,0.047416000,0.045873000,0.043889000,0.042369000,0.039423000,0.039423000,0.035179000,0.035179000,0.033042000,0.033042000,0.031506000,0.029793000,0.027944000,0.025716000,0.024236000,0.022161000,0.020873000,0.019649000,0.018673000,0.016483000,0.015507000,0.013434000","7006  >  49156 [ACK] Seq=1 Ack=260001 Win=131072 Len=0 TSval=5059 TSecr=5057"
"3091","5.063309","10.1.0.11","10.1.0.4","TCP","6376","0.003154000","-37 dBm","","49156  >  7006 [ACK] Seq=265501 Ack=1 Win=131072 Len=1500 TSval=5072 TSecr=4992"
"3092","5.063309","10.1.0.11","10.1.0.4","TCP","6376","0.000000000","-37 dBm","","49156  >  7006 [ACK] Seq=271501 Ack=1 Win=131072 Len=1500 TSval=5072 TSecr=4997"
"3093","5.063309","10.1.0.11","10.1.0.4","TCP","7528","0.000000000","-37 dBm","","49156  >  7006 [ACK] Seq=279001 Ack=1 Win=131072 Len=1000 TSval=5074 TSecr=5059"
"3113","5.066481","10.1.0.11","10.1.0.4","TCP","5452","0.003172000","-37 dBm","","49156  >  7006 [ACK] Seq=284001 Ack=1 Win=131072 Len=1000 TSval=5078 TSecr=5059"
"3132","5.068379","10.1.0.11","10.1.0.4","TCP","2224","0.001898000","-37 dBm","","49156  >  7006 [ACK] Seq=286001 Ack=1 Win=131072 Len=1000 TSval=5080 TSecr=5059"
"3144","5.069452","10.1.0.11","10.1.0.4","TCP","2224","0.001073000","-37 dBm","","49156  >  7006 [ACK] Seq=288001 Ack=1 Win=131072 Len=1000 TSval=5081 TSecr=5059"
"3160","5.070700","10.1.0.11","10.1.0.4","TCP","1134","0.001248000","-37 dBm","","49156  >  7006 [ACK] Seq=289001 Ack=1 Win=131072 Len=1000 TSval=5082 TSecr=5059"
"3172","5.071612","10.1.0.11","10.1.0.4","TCP","1134","0.000912000","-37 dBm","","49156  >  7006 [ACK] Seq=290001 Ack=1 Win=131072 Len=1000 TSval=5083 TSecr=5059"
"3184","5.072556","10.1.0.11","10.1.0.4","TCP","2224","0.000944000","-37 dBm","","49156  >  7006 [ACK] Seq=292001 Ack=1 Win=131072 Len=1000 TSval=5084 TSecr=5059"
"3200","5.073981","10.1.0.11","10.1.0.4","TCP","1134","0.001425000","-37 dBm","","49156  >  7006 [ACK] Seq=293001 Ack=1 Win=131072 Len=1000 TSval=5085 TSecr=5059"
"3210","5.074741","10.1.0.11","10.1.0.4","TCP","1134","0.000760000","-37 dBm","","49156  >  7006 [ACK] Seq=294001 Ack=1 Win=131072 Len=1000 TSval=5086 TSecr=5059"
"3222","5.075654","10.1.0.11","10.1.0.4","TCP","1134","0.000913000","-37 dBm","","49156  >  7006 [ACK] Seq=295001 Ack=1 Win=131072 Len=1000 TSval=5087 TSecr=5059"
"3234","5.076630","10.1.0.11","10.1.0.4","TCP","2224","0.000976000","-37 dBm","","49156  >  7006 [ACK] Seq=297001 Ack=1 Win=131072 Len=1000 TSval=5088 TSecr=5059"
"3248","5.077790","10.1.0.11","10.1.0.4","TCP","1134","0.001160000","-37 dBm","","49156  >  7006 [ACK] Seq=298001 Ack=1 Win=131072 Len=1000 TSval=5089 TSecr=5059"
"3260","5.078729","10.1.0.11","10.1.0.4","TCP","1134","0.000939000","-37 dBm","","49156  >  7006 [ACK] Seq=299001 Ack=1 Win=131072 Len=1000 TSval=5090 TSecr=5059"
"3272","5.079641","10.1.0.11","10.1.0.4","TCP","1134","0.000912000","-37 dBm","","49156  >  7006 [ACK] Seq=300001 Ack=1 Win=131072 Len=1000 TSval=5091 TSecr=5059"
"3284","5.080617","10.1.0.11","10.1.0.4","TCP","2224","0.000976000","-37 dBm","","49156  >  7006 [ACK] Seq=302001 Ack=1 Win=131072 Len=1000 TSval=5092 TSecr=5059"
"3300","5.081898","10.1.0.11","10.1.0.4","TCP","1134","0.001281000","-37 dBm","","49156  >  7006 [ACK] Seq=303001 Ack=1 Win=131072 Len=1000 TSval=5093 TSecr=5059"
"3312","5.082810","10.1.0.11","10.1.0.4","TCP","1134","0.000912000","-37 dBm","","49156  >  7006 [ACK] Seq=304001 Ack=1 Win=131072 Len=1000 TSval=5094 TSecr=5059"
"3324","5.083754","10.1.0.11","10.1.0.4","TCP","2224","0.000944000","-37 dBm","","49156  >  7006 [ACK] Seq=306001 Ack=1 Win=131072 Len=1000 TSval=5096 TSecr=5059"
"3345","5.085592","10.1.0.11","10.1.0.4","TCP","2224","0.001838000","-37 dBm","","49156  >  7006 [ACK] Seq=308001 Ack=1 Win=131072 Len=1000 TSval=5097 TSecr=5059"
"3357","5.086664","10.1.0.11","10.1.0.4","TCP","1134","0.001072000","-37 dBm","","49156  >  7006 [ACK] Seq=309001 Ack=1 Win=131072 Len=1000 TSval=5098 TSecr=5059"
"3367","5.087424","10.1.0.11","10.1.0.4","TCP","1134","0.000760000","-37 dBm","","49156  >  7006 [ACK] Seq=310001 Ack=1 Win=131072 Len=1000 TSval=5099 TSecr=5059"
"3379","5.088337","10.1.0.11","10.1.0.4","TCP","1134","0.000913000","-37 dBm","","49156  >  7006 [ACK] Seq=311001 Ack=1 Win=131072 Len=1000 TSval=5100 TSecr=5059"
"3391","5.089249","10.1.0.11","10.1.0.4","TCP","1134","0.000912000","-37 dBm","","49156  >  7006 [ACK] Seq=312001 Ack=1 Win=131072 Len=1000 TSval=5100 TSecr=5059"
"3407","5.090592","10.1.0.11","10.1.0.4","TCP","2224","0.001343000","-37 dBm","","49156  >  7006 [ACK] Seq=314001 Ack=1 Win=131072 Len=1000 TSval=5102 TSecr=5059"
"3430","5.094012","10.1.0.11","10.1.0.4","TCP","4376","0.003420000","-37 dBm","","49156  >  7006 [ACK] Seq=318001 Ack=1 Win=131072 Len=1000 TSval=5105 TSecr=5059"
"3442","5.095468","10.1.0.11","10.1.0.4","TCP","2224","0.001456000","-37 dBm","","49156  >  7006 [ACK] Seq=320001 Ack=1 Win=131072 Len=1000 TSval=5107 TSecr=5059"
"3454","5.096801","10.1.0.11","10.1.0.4","TCP","2224","0.001333000","-37 dBm","","49156  >  7006 [ACK] Seq=322001 Ack=1 Win=131072 Len=1000 TSval=5108 TSecr=5059"
"3466","5.097778","10.1.0.11","10.1.0.4","TCP","1134","0.000977000","-37 dBm","","49156  >  7006 [ACK] Seq=323001 Ack=1 Win=131072 Len=1000 TSval=5109 TSecr=5059"
"3478","5.098690","10.1.0.11","10.1.0.4","TCP","1134","0.000912000","-37 dBm","","49156  >  7006 [ACK] Seq=324001 Ack=1 Win=131072 Len=1000 TSval=5110 TSecr=5059"
"3490","5.099602","10.1.0.11","10.1.0.4","TCP","1134","0.000912000","-37 dBm","","49156  >  7006 [ACK] Seq=325001 Ack=1 Win=131072 Len=1000 TSval=5111 TSecr=5059"
"3502","5.100546","10.1.0.11","10.1.0.4","TCP","2224","0.000944000","-37 dBm","","49156  >  7006 [ACK] Seq=327001 Ack=1 Win=131072 Len=1000 TSval=5112 TSecr=5059"
"3513","5.101359","10.1.0.4","10.1.0.11","TCP","2428","0.000813000","","0.038050000,0.038050000,0.038050000,0.038050000,0.038050000,0.038050000,0.038050000,0.034878000,0.034878000,0.034878000,0.032980000,0.031907000,0.029747000,0.028803000,0.026618000,0.024729000,0.023569000,0.021718000,0.020742000,0.018549000,0.017605000,0.015767000,0.013935000,0.012110000,0.010767000,0.007347000,0.007347000,0.005891000,0.004558000,0.002669000,0.000813000","7006  >  49156 [ACK] Seq=1 Ack=327001 Win=131072 Len=0 TSval=5113 TSecr=5111"
"3533","5.103559","10.1.0.11","10.1.0.4","TCP","3300","0.002200000","-37 dBm","","49156  >  7006 [ACK] Seq=330001 Ack=1 Win=131072 Len=1000 TSval=5115 TSecr=5059"
"3556","5.107300","10.1.0.11","10.1.0.4","TCP","5452","0.003741000","-37 dBm","","49156  >  7006 [ACK] Seq=335001 Ack=1 Win=131072 Len=1000 TSval=5119 TSecr=5059"
"3569","5.108574","10.1.0.11","10.1.0.4","TCP","2224","0.001274000","-37 dBm","","49156  >  7006 [ACK] Seq=337001 Ack=1 Win=131072 Len=1000 TSval=5120 TSecr=5059"
"3585","5.109790","10.1.0.11","10.1.0.4","TCP","1134","0.001216000","-37 dBm","","49156  >  7006 [ACK] Seq=338001 Ack=1 Win=131072 Len=1000 TSval=5121 TSecr=5059"
"3595","5.110550","10.1.0.11","10.1.0.4","TCP","1134","0.000760000","-37 dBm","","49156  >  7006 [ACK] Seq=339001 Ack=1 Win=131072 Len=1000 TSval=5122 TSecr=5059"
"3605","5.111310","10.1.0.11","10.1.0.4","TCP","1134","0.000760000","-37 dBm","","49156  >  7006 [ACK] Seq=340001 Ack=1 Win=131072 Len=1000 TSval=5123 TSecr=5059"
"3615","5.112070","10.1.0.11","10.1.0.4","TCP","1134","0.000760000","-37 dBm","","49156  >  7006 [ACK] Seq=341001 Ack=1 Win=131072 Len=1000 TSval=5124 TSecr=5059"
"3625","5.112831","10.1.0.11","10.1.0.4","TCP","1134","0.000761000","-37 dBm","","49156  >  7006 [ACK] Seq=342001 Ack=1 Win=131072 Len=1000 TSval=5124 TSecr=5059"
"3636","5.114047","10.1.0.11","10.1.0.4","TCP","1134","0.001216000","-37 dBm","","49156  >  7006 [ACK] Seq=343001 Ack=1 Win=131072 Len=1000 TSval=5125 TSecr=5059"
"3646","5.114807","10.1.0.11","10.1.0.4","TCP","1134","0.000760000","-37 dBm","","49156  >  7006 [ACK] Seq=344001 Ack=1 Win=131072 Len=1000 TSval=5126 TSecr=5059"
"3656","5.115567","10.1.0.11","10.1.0.4","TCP","1134","0.000760000","-37 dBm","","49156  >  7006 [ACK] Seq=345001 Ack=1 Win=131072 Len=1000 TSval=5127 TSecr=5059"
"3666","5.116327","10.1.0.11","10.1.0.4","TCP","1134","0.000760000","-37 dBm","","49156  >  7006 [ACK] Seq=346001 Ack=1 Win=131072 Len=1000 TSval=5128 TSecr=5059"
"3676","5.117087","10.1.0.11","10.1.0.4","TCP","1134","0.000760000","-37 dBm","","49156  >  7006 [ACK] Seq=347001 Ack=1 Win=131072 Len=1000 TSval=5128 TSecr=5059"
"3686","5.117847","10.1.0.11","10.1.0.4","TCP","1134","0.000760000","-37 dBm","","49156  >  7006 [ACK] Seq=348001 Ack=1 Win=131072 Len=1000 TSval=5129 TSecr=5059"
"3694","5.118455","10.1.0.11","10.1.0.4","TCP","1134","0.000608000","-37 dBm","","49156  >  7006 [ACK] Seq=349001 Ack=1 Win=131072 Len=1000 TSval=5130 TSecr=5059"
"3702","5.119064","10.1.0.11","10.1.0.4","TCP","1134","0.000609000","-37 dBm","","49156  >  7006 [ACK] Seq=350001 Ack=1 Win=131072 Len=1000 TSval=5131 TSecr=5059"
"3719","5.120739","10.1.0.11","10.1.0.4","TCP","2224","0.001675000","-37 dBm","","49156  >  7006 [ACK] Seq=352001 Ack=1 Win=131072 Len=1000 TSval=5132 TSecr=5059"
"3727","5.121347","10.1.0.11","10.1.0.4","TCP","1134","0.000608000","-37 dBm","","49156  >  7006 [ACK] Seq=353001 Ack=1 Win=131072 Len=1000 TSval=5133 TSecr=5059"
"3730","5.121502","10.1.0.4","10.1.0.11","TCP","2428","0.000155000","","","7006  >  49156 [ACK] Seq=1 Ack=327001 Win=131072 Len=0 TSval=5113 TSecr=5111"
"3731","5.121502","10.1.0.4","10.1.0.11","TCP","1060","0.000000000","","0.017943000,0.017943000,0.014202000,0.014202000,0.012928000,0.011712000,0.010192000,0.008671000,0.006695000,0.005175000,0.003655000,0.002438000,0.000763000","7006  >  49156 [ACK] Seq=1 Ack=353001 Win=131072 Len=0 TSval=5133 TSecr=5132"
"3740","5.122374","10.1.0.11","10.1.0.4","TCP","1134","0.000872000","-37 dBm","","49156  >  7006 [ACK] Seq=354001 Ack=1 Win=131072 Len=1000 TSval=5134 TSecr=5133"
"3748","5.122982","10.1.0.11","10.1.0.4","TCP","1134","0.000608000","-37 dBm","","49156  >  7006 [ACK] Seq=355001 Ack=1 Win=131072 Len=1000 TSval=5135 TSecr=5133"
"3760","5.123900","10.1.0.11","10.1.0.4","TCP","1134","0.000918000","-37 dBm","","49156  >  7006 [ACK] Seq=356001 Ack=1 Win=131072 Len=1000 TSval=5136 TSecr=5133"
"3783","5.127141","10.1.0.11","10.1.0.4","TCP","4376","0.003241000","-37 dBm","","49156  >  7006 [ACK] Seq=360001 Ack=1 Win=131072 Len=1000 TSval=5139 TSecr=5133"
"3791","5.128038","10.1.0.11","10.1.0.4","TCP","1134","0.000897000","-37 dBm","","49156  >  7006 [ACK] Seq=361001 Ack=1 Win=131072 Len=1000 TSval=5140 TSecr=5133"
"3799","5.128646","10.1.0.11","10.1.0.4","TCP","1134","0.000608000","-37 dBm","","49156  >  7006 [ACK] Seq=362001 Ack=1 Win=131072 Len=1000 TSval=5140 TSecr=5133"
"3802","5.128972","10.1.0.4","10.1.0.11","TCP","452","0.000326000","","0.006598000,0.005072000,0.001831000,0.001831000,0.000326000","7006  >  49156 [ACK] Seq=1 Ack=363001 Win=131072 Len=0 TSval=5141 TSecr=5140"
"3828","5.131474","10.1.0.11","10.1.0.4","TCP","3300","0.002502000","-37 dBm","","49156  >  7006 [ACK] Seq=365001 Ack=1 Win=131072 Len=1000 TSval=5143 TSecr=5141"
"3856","5.136584","10.1.0.11","10.1.0.4","TCP","6528","0.005110000","-37 dBm","","49156  >  7006 [ACK] Seq=371001 Ack=1 Win=131072 Len=1000 TSval=5148 TSecr=5141"
"3871","5.138292","10.1.0.11","10.1.0.4","TCP","3300","0.001708000","-37 dBm","","49156  >  7006 [ACK] Seq=374001 Ack=1 Win=131072 Len=1000 TSval=5150 TSecr=5141"
"3885","5.139453","10.1.0.11","10.1.0.4","TCP","1134","0.001161000","-37 dBm","","49156  >  7006 [ACK] Seq=375001 Ack=1 Win=131072 Len=1000 TSval=5151 TSecr=5141"
"3897","5.140365","10.1.0.11","10.1.0.4","TCP","1134","0.000912000","-37 dBm","","49156  >  7006 [ACK] Seq=376001 Ack=1 Win=131072 Len=1000 TSval=5152 TSecr=5141"
"3909","5.141277","10.1.0.11","10.1.0.4","TCP","1134","0.000912000","-37 dBm","","49156  >  7006 [ACK] Seq=377001 Ack=1 Win=131072 Len=1000 TSval=5152 TSecr=5141"
"3912","5.141592","10.1.0.4","10.1.0.11","TCP","604","0.000315000","","0.010118000,0.005008000,0.005008000,0.005008000,0.003300000,0.003300000,0.001227000","7006  >  49156 [ACK] Seq=1 Ack=377001 Win=131072 Len=0 TSval=5152 TSecr=5151"
"3916","5.142247","10.1.0.4","10.1.0.11","TCP","604","0.000655000","","","7006  >  49156 [ACK] Seq=1 Ack=377001 Win=131072 Len=0 TSval=5152 TSecr=5151"
"3937","5.144722","10.1.0.11","10.1.0.4","TCP","5452","0.002475000","-37 dBm","","49156  >  7006 [ACK] Seq=382001 Ack=1 Win=131072 Len=1000 TSval=5156 TSecr=5141"
"3949","5.145794","10.1.0.11","10.1.0.4","TCP","1134","0.001072000","-37 dBm","","49156  >  7006 [ACK] Seq=383001 Ack=1 Win=131072 Len=1000 TSval=5157 TSecr=5141"
"3961","5.146707","10.1.0.11","10.1.0.4","TCP","1134","0.000913000","-37 dBm","","49156  >  7006 [ACK] Seq=384001 Ack=1 Win=131072 Len=1000 TSval=5158 TSecr=5141"
"3973","5.147619","10.1.0.11","10.1.0.4","TCP","1134","0.000912000","-37 dBm","","49156  >  7006 [ACK] Seq=385001 Ack=1 Win=131072 Len=1000 TSval=5159 TSecr=5141"
"3985","5.148672","10.1.0.11","10.1.0.4","TCP","2224","0.001053000","-37 dBm","","49156  >  7006 [ACK] Seq=387001 Ack=1 Win=131072 Len=1000 TSval=5160 TSecr=5141"
"3997","5.149680","10.1.0.11","10.1.0.4","TCP","1134","0.001008000","-37 dBm","","49156  >  7006 [ACK] Seq=388001 Ack=1 Win=131072 Len=1000 TSval=5161 TSecr=5141"
"4009","5.150592","10.1.0.11","10.1.0.4","TCP","1134","0.000912000","-37 dBm","","49156  >  7006 [ACK] Seq=389001 Ack=1 Win=131072 Len=1000 TSval=5162 TSecr=5141"
"4021","5.151504","10.1.0.11","10.1.0.4","TCP","1134","0.000912000","-37 dBm","","49156  >  7006 [ACK] Seq=390001 Ack=1 Win=131072 Len=1000 TSval=5163 TSecr=5141"
"4033","5.152417","10.1.0.11","10.1.0.4","TCP","1134","0.000913000","-37 dBm","","49156  >  7006 [ACK] Seq=391001 Ack=1 Win=131072 Len=1000 TSval=5164 TSecr=5141"
