"No.","Time","Source","Destination","Protocol","Length","Time delta from previous displayed frame","Signal strength (dBm)","The RTT to ACK the segment was","Info"
"586","2.837809","10.1.0.11","10.1.0.6","TCP","138","0.000000000","","","49158  >  7010 [SYN] Seq=0 Win=65535 Len=0 TSval=2850 TSecr=0 WS=4 SACK_PERM=1"
"587","2.837966","10.1.0.11","10.1.0.6","TCP","138","0.000157000","","","[TCP Out-Of-Order] [TCP Port numbers reused] 49158  >  7010 [SYN] Seq=0 Win=65535 Len=0 TSval=2850 TSecr=0 WS=4 SACK_PERM=1"
"590","2.838241","10.1.0.6","10.1.0.11","TCP","138","0.000275000","-31 dBm","0.000432000","7010  >  49158 [SYN, ACK] Seq=0 Ack=1 Win=65535 Len=0 TSval=2850 TSecr=2850 WS=4 SACK_PERM=1"
"593","2.838387","10.1.0.11","10.1.0.6","TCP","134","0.000146000","","0.000146000","49158  >  7010 [ACK] Seq=1 Ack=1 Win=131072 Len=0 TSval=2850 TSecr=2850"
"602","2.839237","10.1.0.6","10.1.0.11","TCP","138","0.000850000","-31 dBm","","49153  >  7011 [SYN] Seq=0 Win=65535 Len=0 TSval=2850 TSecr=0 WS=4 SACK_PERM=1"
"605","2.839392","10.1.0.11","10.1.0.6","TCP","138","0.000155000","","0.000155000","7011  >  49153 [SYN, ACK] Seq=0 Ack=1 Win=65535 Len=0 TSval=2851 TSecr=2850 WS=4 SACK_PERM=1"
"608","2.839694","10.1.0.6","10.1.0.11","TCP","134","0.000302000","-31 dBm","0.000302000","49153  >  7011 [ACK] Seq=1 Ack=1 Win=131072 Len=0 TSval=2851 TSecr=2851"
"1024","4.839325","10.1.0.11","10.1.0.6","TCP","1134","1.999631000","","","49158  >  7010 [ACK] Seq=1 Ack=1 Win=131072 Len=1000 TSval=4851 TSecr=2850"
"1038","4.840389","10.1.0.11","10.1.0.6","TCP","1134","0.001064000","","","49158  >  7010 [ACK] Seq=1001 Ack=1 Win=131072 Len=1000 TSval=4852 TSecr=2850"
"1058","4.842133","10.1.0.11","10.1.0.6","TCP","2224","0.001744000","","","49158  >  7010 [ACK] Seq=3001 Ack=1 Win=131072 Len=1000 TSval=4853 TSecr=2850"
"1078","4.844069","10.1.0.11","10.1.0.6","TCP","3300","0.001936000","","","49158  >  7010 [ACK] Seq=6001 Ack=1 Win=131072 Len=1000 TSval=4856 TSecr=2850"
"1105","4.847773","10.1.0.11","10.1.0.6","TCP","4376","0.003704000","","","49158  >  7010 [ACK] Seq=10001 Ack=1 Win=131072 Len=1000 TSval=4859 TSecr=2850"
"1125","4.850078","10.1.0.11","10.1.0.6","TCP","3300","0.002305000","","","49158  >  7010 [ACK] Seq=13001 Ack=1 Win=131072 Len=1000 TSval=4861 TSecr=2850"
"1188","4.860436","10.1.0.6","10.1.0.11","TCP","6528","0.010358000","-31 dBm","","49153  >  7011 [ACK] Seq=5001 Ack=1 Win=131072 Len=1000 TSval=4856 TSecr=2851"
"1189","4.860436","10.1.0.6","10.1.0.11","TCP","6528","0.000000000","-31 dBm","","49153  >  7011 [ACK] Seq=11001 Ack=1 Win=131072 Len=1000 TSval=4861 TSecr=2851"
"1190","4.860436","10.1.0.6","10.1.0.11","TCP","3300","0.000000000","-31 dBm","","49153  >  7011 [ACK] Seq=14001 Ack=1 Win=131072 Len=1000 TSval=4863 TSecr=2851"
"1203","4.861538","10.1.0.11","10.1.0.6","TCP","1134","0.001102000","","","49158  >  7010 [ACK] Seq=14001 Ack=1 Win=131072 Len=1000 TSval=4862 TSecr=2850"
"1245","4.866170","10.1.0.6","10.1.0.11","TCP","680","0.004632000","-31 dBm","0.026845000,0.024037000,0.022101000,0.022101000,0.018397000,0.018397000,0.016092000,0.004632000","7010  >  49158 [ACK] Seq=1 Ack=15001 Win=131072 Len=0 TSval=4873 TSecr=4861"
"1253","4.867128","10.1.0.11","10.1.0.6","TCP","6376","0.000958000","","","49158  >  7010 [ACK] Seq=19501 Ack=1 Win=131072 Len=1500 TSval=4878 TSecr=4854"
"1254","4.867128","10.1.0.11","10.1.0.6","TCP","6376","0.000000000","","","49158  >  7010 [ACK] Seq=25501 Ack=1 Win=131072 Len=1500 TSval=4878 TSecr=4856"
"1255","4.867128","10.1.0.11","10.1.0.6","TCP","7452","0.000000000","","","49158  >  7010 [ACK] Seq=33001 Ack=1 Win=131072 Len=1000 TSval=4878 TSecr=4860"
"1256","4.867128","10.1.0.11","10.1.0.6","TCP","2224","0.000000000","","","49158  >  7010 [ACK] Seq=35001 Ack=1 Win=131072 Len=1000 TSval=4879 TSecr=4873"
"1262","4.868372","10.1.0.11","10.1.0.6","TCP","1134","0.001244000","","","49158  >  7010 [ACK] Seq=36001 Ack=1 Win=131072 Len=1000 TSval=4880 TSecr=4873"
"1265","4.868756","10.1.0.11","10.1.0.6","TCP","1134","0.000384000","","","49158  >  7010 [ACK] Seq=37001 Ack=1 Win=131072 Len=1000 TSval=4880 TSecr=4873"
"1266","4.868963","10.1.0.11","10.1.0.6","TCP","1134","0.000207000","","","[TCP Retransmission] 49158  >  7010 [ACK] Seq=37001 Ack=1 Win=131072 Len=1000 TSval=4880 TSecr=4873"
"1276","4.869855","10.1.0.11","10.1.0.6","TCP","1134","0.000892000","","","49158  >  7010 [ACK] Seq=38001 Ack=1 Win=131072 Len=1000 TSval=4881 TSecr=4873"
"1282","4.870311","10.1.0.11","10.1.0.6","TCP","1134","0.000456000","","","49158  >  7010 [ACK] Seq=39001 Ack=1 Win=131072 Len=1000 TSval=4882 TSecr=4873"
"1299","4.872129","10.1.0.11","10.1.0.6","TCP","2224","0.001818000","","","49158  >  7010 [ACK] Seq=41001 Ack=1 Win=131072 Len=1000 TSval=4884 TSecr=4873"
"1309","4.872982","10.1.0.6","10.1.0.11","TCP","756","0.000853000","-31 dBm","0.005854000,0.005854000,0.005854000,0.005854000,0.005854000,0.005854000,0.005854000,0.004610000,0.003127000","7010  >  49158 [ACK] Seq=1 Ack=39001 Win=131072 Len=0 TSval=4882 TSecr=4880"
"1312","4.873146","10.1.0.11","10.1.0.6","TCP","2224","0.000164000","","","[TCP Retransmission] [TCP Retransmission] 49158  >  7010 [ACK] Seq=41001 Ack=1 Win=131072 Len=1000 TSval=4884 TSecr=4873"
"1313","4.873146","10.1.0.11","10.1.0.6","TCP","1134","0.000000000","","","49158  >  7010 [ACK] Seq=42001 Ack=1 Win=131072 Len=1000 TSval=4884 TSecr=4873"
"1325","4.874946","10.1.0.11","10.1.0.6","TCP","2224","0.001800000","","","49158  >  7010 [ACK] Seq=44001 Ack=1 Win=131072 Len=1000 TSval=4886 TSecr=4882"
"1333","4.875650","10.1.0.11","10.1.0.6","TCP","1134","0.000704000","","","49158  >  7010 [ACK] Seq=45001 Ack=1 Win=131072 Len=1000 TSval=4887 TSecr=4882"
"1340","4.876160","10.1.0.11","10.1.0.6","TCP","1134","0.000510000","","","49158  >  7010 [ACK] Seq=46001 Ack=1 Win=131072 Len=1000 TSval=4888 TSecr=4882"
"1350","4.877612","10.1.0.11","10.1.0.6","TCP","2224","0.001452000","","","49158  >  7010 [ACK] Seq=48001 Ack=1 Win=131072 Len=1000 TSval=4889 TSecr=4882"
"1363","4.878835","10.1.0.11","10.1.0.6","TCP","1134","0.001223000","","","49158  >  7010 [ACK] Seq=49001 Ack=1 Win=131072 Len=1000 TSval=4890 TSecr=4882"
"1371","4.879619","10.1.0.11","10.1.0.6","TCP","1134","0.000784000","","","49158  >  7010 [ACK] Seq=50001 Ack=1 Win=131072 Len=1000 TSval=4891 TSecr=4882"
"1379","4.880227","10.1.0.11","10.1.0.6","TCP","1134","0.000608000","","","49158  >  7010 [ACK] Seq=51001 Ack=1 Win=131072 Len=1000 TSval=4892 TSecr=4882"
"1394","4.881463","10.1.0.6","10.1.0.11","TCP","528","0.001236000","-31 dBm","0.009334000,0.008317000,0.006517000,0.005303000,0.003851000,0.001844000","7010  >  49158 [ACK] Seq=1 Ack=51001 Win=131072 Len=0 TSval=4891 TSecr=4890"
"1414","4.882886","10.1.0.11","10.1.0.6","TCP","3300","0.001423000","","","49158  >  7010 [ACK] Seq=54001 Ack=1 Win=131072 Len=1000 TSval=4894 TSecr=4891"
"1440","4.887386","10.1.0.11","10.1.0.6","TCP","6528","0.004500000","","","49158  >  7010 [ACK] Seq=60001 Ack=1 Win=131072 Len=1000 TSval=4899 TSecr=4891"
"1450","4.888501","10.1.0.11","10.1.0.6","TCP","1134","0.001115000","","","49158  >  7010 [ACK] Seq=61001 Ack=1 Win=131072 Len=1000 TSval=4900 TSecr=4891"
"1458","4.889109","10.1.0.11","10.1.0.6","TCP","1134","0.000608000","","","49158  >  7010 [ACK] Seq=62001 Ack=1 Win=131072 Len=1000 TSval=4900 TSecr=4891"
"1480","4.890920","10.1.0.11","10.1.0.6","TCP","2224","0.001811000","","","49158  >  7010 [ACK] Seq=64001 Ack=1 Win=131072 Len=1000 TSval=4902 TSecr=4891"
"1498","4.893344","10.1.0.11","10.1.0.6","TCP","3300","0.002424000","","","49158  >  7010 [ACK] Seq=67001 Ack=1 Win=131072 Len=1000 TSval=4904 TSecr=4891"
"1510","4.894608","10.1.0.11","10.1.0.6","TCP","2224","0.001264000","","","49158  >  7010 [ACK] Seq=69001 Ack=1 Win=131072 Len=1000 TSval=4906 TSecr=4891"
"1525","4.895799","10.1.0.11","10.1.0.6","TCP","1134","0.001191000","","","49158  >  7010 [ACK] Seq=70001 Ack=1 Win=131072 Len=1000 TSval=4907 TSecr=4891"
"1537","4.896743","10.1.0.11","10.1.0.6","TCP","2224","0.000944000","","","49158  >  7010 [ACK] Seq=72001 Ack=1 Win=131072 Len=1000 TSval=4908 TSecr=4891"
"1557","4.898328","10.1.0.11","10.1.0.6","TCP","2224","0.001585000","","","49158  >  7010 [ACK] Seq=74001 Ack=1 Win=131072 Len=1000 TSval=4910 TSecr=4891"
"1577","4.899880","10.1.0.11","10.1.0.6","TCP","2224","0.001552000","","","49158  >  7010 [ACK] Seq=76001 Ack=1 Win=131072 Len=1000 TSval=4912 TSecr=4891"
"1595","4.901416","10.1.0.11","10.1.0.6","TCP","1134","0.001536000","","","49158  >  7010 [ACK] Seq=77001 Ack=1 Win=131072 Len=1000 TSval=4912 TSecr=4891"
"1607","4.902360","10.1.0.11","10.1.0.6","TCP","2224","0.000944000","","","49158  >  7010 [ACK] Seq=79001 Ack=1 Win=131072 Len=1000 TSval=4914 TSecr=4891"
"1627","4.903944","10.1.0.11","10.1.0.6","TCP","2224","0.001584000","","","49158  >  7010 [ACK] Seq=81001 Ack=1 Win=131072 Len=1000 TSval=4916 TSecr=4891"
"1647","4.905529","10.1.0.11","10.1.0.6","TCP","2224","0.001585000","","","49158  >  7010 [ACK] Seq=83001 Ack=1 Win=131072 Len=1000 TSval=4917 TSecr=4891"
"1668","4.907226","10.1.0.11","10.1.0.6","TCP","2224","0.001697000","","","49158  >  7010 [ACK] Seq=85001 Ack=1 Win=131072 Len=1000 TSval=4919 TSecr=4891"
"1680","4.908298","10.1.0.11","10.1.0.6","TCP","1134","0.001072000","","","49158  >  7010 [ACK] Seq=86001 Ack=1 Win=131072 Len=1000 TSval=4920 TSecr=4891"
"1692","4.909210","10.1.0.11","10.1.0.6","TCP","1134","0.000912000","","","49158  >  7010 [ACK] Seq=87001 Ack=1 Win=131072 Len=1000 TSval=4920 TSecr=4891"
"1704","4.910122","10.1.0.11","10.1.0.6","TCP","1134","0.000912000","","","49158  >  7010 [ACK] Seq=88001 Ack=1 Win=131072 Len=1000 TSval=4921 TSecr=4891"
"1716","4.911034","10.1.0.11","10.1.0.6","TCP","1134","0.000912000","","","49158  >  7010 [ACK] Seq=89001 Ack=1 Win=131072 Len=1000 TSval=4922 TSecr=4891"
"1728","4.912011","10.1.0.11","10.1.0.6","TCP","1134","0.000977000","","","49158  >  7010 [ACK] Seq=90001 Ack=1 Win=131072 Len=1000 TSval=4923 TSecr=4891"
"1738","4.912980","10.1.0.11","10.1.0.6","TCP","2224","0.000969000","","","49158  >  7010 [ACK] Seq=92001 Ack=1 Win=131072 Len=1000 TSval=4924 TSecr=4891"
"1752","4.914108","10.1.0.11","10.1.0.6","TCP","1134","0.001128000","","","49158  >  7010 [ACK] Seq=93001 Ack=1 Win=131072 Len=1000 TSval=4925 TSecr=4891"
"1764","4.915020","10.1.0.11","10.1.0.6","TCP","1134","0.000912000","","","49158  >  7010 [ACK] Seq=94001 Ack=1 Win=131072 Len=1000 TSval=4926 TSecr=4891"
"1776","4.915964","10.1.0.11","10.1.0.6","TCP","2224","0.000944000","","","49158  >  7010 [ACK] Seq=96001 Ack=1 Win=131072 Len=1000 TSval=4928 TSecr=4891"
"1796","4.917548","10.1.0.11","10.1.0.6","TCP","2224","0.001584000","","","49158  >  7010 [ACK] Seq=98001 Ack=1 Win=131072 Len=1000 TSval=4929 TSecr=4891"
"1810","4.919075","10.1.0.11","10.1.0.6","TCP","2224","0.001527000","","","49158  >  7010 [ACK] Seq=100001 Ack=1 Win=131072 Len=1000 TSval=4931 TSecr=4891"
"1830","4.920628","10.1.0.11","10.1.0.6","TCP","1134","0.001553000","","","49158  >  7010 [ACK] Seq=101001 Ack=1 Win=131072 Len=1000 TSval=4932 TSecr=4891"
"1842","4.921572","10.1.0.11","10.1.0.6","TCP","2224","0.000944000","","","49158  >  7010 [ACK] Seq=103001 Ack=1 Win=131072 Len=1000 TSval=4933 TSecr=4891"
"1856","4.922668","10.1.0.11","10.1.0.6","TCP","1134","0.001096000","","","49158  >  7010 [ACK] Seq=104001 Ack=1 Win=131072 Len=1000 TSval=4934 TSecr=4891"
"1878","4.924354","10.1.0.11","10.1.0.6","TCP","680","0.001686000","","0.063918000,0.063918000,0.063918000,0.063918000,0.063918000,0.063918000,0.063918000,0.063918000","7011  >  49153 [ACK] Seq=1 Ack=15001 Win=131072 Len=0 TSval=4872 TSecr=4862"
"1940","4.936679","10.1.0.6","10.1.0.11","TCP","6376","0.012325000","-31 dBm","","49153  >  7011 [ACK] Seq=19501 Ack=1 Win=131072 Len=1500 TSval=4936 TSecr=4872"
"1941","4.936679","10.1.0.6","10.1.0.11","TCP","6376","0.000000000","-31 dBm","","49153  >  7011 [ACK] Seq=25501 Ack=1 Win=131072 Len=1500 TSval=4936 TSecr=4872"
"1942","4.936679","10.1.0.6","10.1.0.11","TCP","6376","0.000000000","-31 dBm","","49153  >  7011 [ACK] Seq=31501 Ack=1 Win=131072 Len=1500 TSval=4936 TSecr=4872"
"1943","4.936679","10.1.0.6","10.1.0.11","TCP","6376","0.000000000","-31 dBm","","49153  >  7011 [ACK] Seq=37501 Ack=1 Win=131072 Len=1500 TSval=4936 TSecr=4872"
"1944","4.936679","10.1.0.6","10.1.0.11","TCP","6376","0.000000000","-31 dBm","","49153  >  7011 [ACK] Seq=43501 Ack=1 Win=131072 Len=1500 TSval=4936 TSecr=4872"
"1947","4.936962","10.1.0.6","10.1.0.11","TCP","1668","0.000283000","-31 dBm","0.046042000,0.043618000,0.042354000,0.041163000,0.040219000,0.038634000,0.037082000,0.034602000,0.033018000,0.031433000,0.029736000,0.028664000,0.026840000,0.024951000,0.023982000,0.021942000,0.020998000,0.019414000,0.017887000,0.015390000,0.014294000","7010  >  49158 [ACK] Seq=1 Ack=105001 Win=131072 Len=0 TSval=4934 TSecr=4933"
"1949","4.937102","10.1.0.6","10.1.0.11","TCP","528","0.000140000","-31 dBm","","7010  >  49158 [ACK] Seq=1 Ack=63001 Win=131072 Len=0 TSval=4901 TSecr=4900"
"1986","4.942299","10.1.0.11","10.1.0.6","TCP","6376","0.005197000","","","49158  >  7010 [ACK] Seq=109501 Ack=1 Win=131072 Len=1500 TSval=4949 TSecr=4899"
"1987","4.942299","10.1.0.11","10.1.0.6","TCP","6376","0.000000000","","","49158  >  7010 [ACK] Seq=115501 Ack=1 Win=131072 Len=1500 TSval=4949 TSecr=4901"
"1988","4.942299","10.1.0.11","10.1.0.6","TCP","7452","0.000000000","","","49158  >  7010 [ACK] Seq=123001 Ack=1 Win=131072 Len=1000 TSval=4949 TSecr=4934"
"1989","4.942299","10.1.0.11","10.1.0.6","TCP","6528","0.000000000","","","49158  >  7010 [ACK] Seq=129001 Ack=1 Win=131072 Len=1000 TSval=4954 TSecr=4934"
"1999","4.944651","10.1.0.11","10.1.0.6","TCP","3300","0.002352000","","","49158  >  7010 [ACK] Seq=132001 Ack=1 Win=131072 Len=1000 TSval=4956 TSecr=4934"
"2050","4.951008","10.1.0.11","10.1.0.6","TCP","6528","0.006357000","","","49158  >  7010 [ACK] Seq=138001 Ack=1 Win=131072 Len=1000 TSval=4961 TSecr=4934"
"2051","4.951008","10.1.0.11","10.1.0.6","TCP","1134","0.000000000","","","49158  >  7010 [ACK] Seq=139001 Ack=1 Win=131072 Len=1000 TSval=4962 TSecr=4934"
"2096","4.959582","10.1.0.11","10.1.0.6","TCP","6528","0.008574000","","","49158  >  7010 [ACK] Seq=145001 Ack=1 Win=131072 Len=1000 TSval=4967 TSecr=4934"
"2097","4.959582","10.1.0.11","10.1.0.6","TCP","5452","0.000000000","","","49158  >  7010 [ACK] Seq=150001 Ack=1 Win=131072 Len=1000 TSval=4971 TSecr=4934"
"2107","4.961258","10.1.0.11","10.1.0.6","TCP","2224","0.001676000","","","49158  >  7010 [ACK] Seq=152001 Ack=1 Win=131072 Len=1000 TSval=4972 TSecr=4934"
"2116","4.962176","10.1.0.11","10.1.0.6","TCP","1134","0.000918000","","","49158  >  7010 [ACK] Seq=153001 Ack=1 Win=131072 Len=1000 TSval=4973 TSecr=4934"
"2124","4.962784","10.1.0.11","10.1.0.6","TCP","1134","0.000608000","","","49158  >  7010 [ACK] Seq=154001 Ack=1 Win=131072 Len=1000 TSval=4974 TSecr=4934"
"2132","4.963392","10.1.0.11","10.1.0.6","TCP","1134","0.000608000","","","49158  >  7010 [ACK] Seq=155001 Ack=1 Win=131072 Len=1000 TSval=4975 TSecr=4934"
"2141","4.964095","10.1.0.11","10.1.0.6","TCP","1134","0.000703000","","","49158  >  7010 [ACK] Seq=156001 Ack=1 Win=131072 Len=1000 TSval=4976 TSecr=4934"
"2167","4.967066","10.1.0.11","10.1.0.6","TCP","4376","0.002971000","","","49158  >  7010 [ACK] Seq=160001 Ack=1 Win=131072 Len=1000 TSval=4979 TSecr=4934"
"2197","4.971357","10.1.0.11","10.1.0.6","TCP","1134","0.004291000","","","49158  >  7010 [ACK] Seq=161001 Ack=1 Win=131072 Len=1000 TSval=4980 TSecr=4934"
"2517","5.002629","10.1.0.6","10.1.0.11","TCP","908","0.031272000","-31 dBm","0.060330000,0.060330000,0.060330000,0.060330000,0.060330000,0.060330000,0.060330000,0.060330000,0.060330000,0.057978000,0.057978000","7010  >  49158 [ACK] Seq=1 Ack=133001 Win=131072 Len=0 TSval=4957 TSecr=4956"
"2518","5.002629","10.1.0.6","10.1.0.11","TCP","300","0.000000000","-31 dBm","0.051621000,0.051621000,0.051621000","7010  >  49158 [ACK] Seq=1 Ack=139001 Win=131072 Len=0 TSval=4963 TSecr=4960"
"2519","5.002629","10.1.0.6","10.1.0.11","TCP","908","0.000000000","-31 dBm","0.043047000,0.043047000,0.043047000,0.043047000,0.043047000,0.043047000,0.041371000,0.039845000,0.038534000,0.035563000,0.035563000","7010  >  49158 [ACK] Seq=1 Ack=161001 Win=131072 Len=0 TSval=4979 TSecr=4978"
"2542","5.005605","10.1.0.11","10.1.0.6","TCP","6376","0.002976000","","","49158  >  7010 [ACK] Seq=166501 Ack=1 Win=131072 Len=1500 TSval=5014 TSecr=4954"
"2543","5.005605","10.1.0.11","10.1.0.6","TCP","6376","0.000000000","","","49158  >  7010 [ACK] Seq=172501 Ack=1 Win=131072 Len=1500 TSval=5014 TSecr=4954"
"2544","5.005605","10.1.0.11","10.1.0.6","TCP","6376","0.000000000","","","49158  >  7010 [ACK] Seq=178501 Ack=1 Win=131072 Len=1500 TSval=5014 TSecr=4955"
"2545","5.005605","10.1.0.11","10.1.0.6","TCP","6376","0.000000000","","","49158  >  7010 [ACK] Seq=184501 Ack=1 Win=131072 Len=1500 TSval=5014 TSecr=4955"
"2546","5.005605","10.1.0.11","10.1.0.6","TCP","6376","0.000000000","","","49158  >  7010 [ACK] Seq=190501 Ack=1 Win=131072 Len=1500 TSval=5014 TSecr=4963"
"2547","5.005605","10.1.0.11","10.1.0.6","TCP","6376","0.000000000","","","49158  >  7010 [ACK] Seq=196501 Ack=1 Win=131072 Len=1500 TSval=5014 TSecr=4972"
"2548","5.005605","10.1.0.11","10.1.0.6","TCP","7452","0.000000000","","","49158  >  7010 [ACK] Seq=204001 Ack=1 Win=131072 Len=1000 TSval=5014 TSecr=4972"
"2549","5.005605","10.1.0.11","10.1.0.6","TCP","4376","0.000000000","","","49158  >  7010 [ACK] Seq=208001 Ack=1 Win=131072 Len=1000 TSval=5017 TSecr=4979"
"2568","5.009750","10.1.0.11","10.1.0.6","TCP","5452","0.004145000","","","49158  >  7010 [ACK] Seq=213001 Ack=1 Win=131072 Len=1000 TSval=5021 TSecr=4979"
"2582","5.011342","10.1.0.11","10.1.0.6","TCP","2224","0.001592000","","","49158  >  7010 [ACK] Seq=215001 Ack=1 Win=131072 Len=1000 TSval=5023 TSecr=4979"
"2600","5.012743","10.1.0.11","10.1.0.6","TCP","2224","0.001401000","","","49158  >  7010 [ACK] Seq=217001 Ack=1 Win=131072 Len=1000 TSval=5024 TSecr=4979"
"2615","5.014286","10.1.0.11","10.1.0.6","TCP","2224","0.001543000","","","49158  >  7010 [ACK] Seq=219001 Ack=1 Win=131072 Len=1000 TSval=5026 TSecr=4979"
"2631","5.015726","10.1.0.11","10.1.0.6","TCP","1134","0.001440000","","","49158  >  7010 [ACK] Seq=220001 Ack=1 Win=131072 Len=1000 TSval=5027 TSecr=4979"
"2785","5.031881","10.1.0.6","10.1.0.11","TCP","1668","0.016155000","-31 dBm","0.026276000,0.026276000,0.026276000,0.026276000,0.026276000,0.026276000,0.026276000,0.026276000,0.026276000,0.026276000,0.026276000,0.026276000,0.026276000,0.026276000,0.026276000,0.026276000,0.026276000,0.022131000,0.022131000,0.020539000,0.019138000","7010  >  49158 [ACK] Seq=1 Ack=217001 Win=131072 Len=0 TSval=5025 TSecr=5023"
"2786","5.031881","10.1.0.6","10.1.0.11","TCP","224","0.000000000","-31 dBm","0.017595000,0.016155000","7010  >  49158 [ACK] Seq=1 Ack=221001 Win=131072 Len=0 TSval=5028 TSecr=5026"
"2803","5.033319","10.1.0.11","10.1.0.6","TCP","6376","0.001438000","","","49158  >  7010 [ACK] Seq=225501 Ack=1 Win=131072 Len=1500 TSval=5044 TSecr=5018"
"2804","5.033319","10.1.0.11","10.1.0.6","TCP","6376","0.000000000","","","49158  >  7010 [ACK] Seq=231501 Ack=1 Win=131072 Len=1500 TSval=5044 TSecr=5018"
"2805","5.033319","10.1.0.11","10.1.0.6","TCP","6376","0.000000000","","","49158  >  7010 [ACK] Seq=237501 Ack=1 Win=131072 Len=1500 TSval=5044 TSecr=5018"
"2806","5.033319","10.1.0.11","10.1.0.6","TCP","4300","0.000000000","","","49158  >  7010 [ACK] Seq=242001 Ack=1 Win=131072 Len=1000 TSval=5044 TSecr=5028"
"2822","5.035675","10.1.0.11","10.1.0.6","TCP","3300","0.002356000","","","49158  >  7010 [ACK] Seq=245001 Ack=1 Win=131072 Len=1000 TSval=5047 TSecr=5028"
"2836","5.036995","10.1.0.11","10.1.0.6","TCP","2224","0.001320000","","","49158  >  7010 [ACK] Seq=247001 Ack=1 Win=131072 Len=1000 TSval=5048 TSecr=5028"
"2858","5.038918","10.1.0.11","10.1.0.6","TCP","2224","0.001923000","","","49158  >  7010 [ACK] Seq=249001 Ack=1 Win=131072 Len=1000 TSval=5050 TSecr=5028"
"2872","5.040206","10.1.0.11","10.1.0.6","TCP","2224","0.001288000","","","49158  >  7010 [ACK] Seq=251001 Ack=1 Win=131072 Len=1000 TSval=5052 TSecr=5028"
"2888","5.041486","10.1.0.11","10.1.0.6","TCP","2224","0.001280000","","","49158  >  7010 [ACK] Seq=253001 Ack=1 Win=131072 Len=1000 TSval=5053 TSecr=5028"
"2904","5.042894","10.1.0.11","10.1.0.6","TCP","1134","0.001408000","","","49158  >  7010 [ACK] Seq=254001 Ack=1 Win=131072 Len=1000 TSval=5054 TSecr=5028"
"2915","5.043740","10.1.0.11","10.1.0.6","TCP","1134","0.000846000","","","49158  >  7010 [ACK] Seq=255001 Ack=1 Win=131072 Len=1000 TSval=5055 TSecr=5028"
"2927","5.044652","10.1.0.11","10.1.0.6","TCP","2224","0.000912000","","","49158  >  7010 [ACK] Seq=257001 Ack=1 Win=131072 Len=1000 TSval=5056 TSecr=5028"
"2941","5.045877","10.1.0.11","10.1.0.6","TCP","1134","0.001225000","","","49158  >  7010 [ACK] Seq=258001 Ack=1 Win=131072 Len=1000 TSval=5057 TSecr=5028"
"2953","5.046789","10.1.0.11","10.1.0.6","TCP","1134","0.000912000","","","49158  >  7010 [ACK] Seq=259001 Ack=1 Win=131072 Len=1000 TSval=5058 TSecr=5028"
"2965","5.047701","10.1.0.11","10.1.0.6","TCP","1134","0.000912000","","","49158  >  7010 [ACK] Seq=260001 Ack=1 Win=131072 Len=1000 TSval=5059 TSecr=5028"
"2977","5.048613","10.1.0.11","10.1.0.6","TCP","1134","0.000912000","","","49158  >  7010 [ACK] Seq=261001 Ack=1 Win=131072 Len=1000 TSval=5060 TSecr=5028"
"2992","5.050098","10.1.0.11","10.1.0.6","TCP","2224","0.001485000","","","49158  >  7010 [ACK] Seq=263001 Ack=1 Win=131072 Len=1000 TSval=5061 TSecr=5028"
"3013","5.053414","10.1.0.11","10.1.0.6","TCP","4376","0.003316000","","","49158  >  7010 [ACK] Seq=267001 Ack=1 Win=131072 Len=1000 TSval=5064 TSecr=5028"
"3021","5.054118","10.1.0.11","10.1.0.6","TCP","1134","0.000704000","","","49158  >  7010 [ACK] Seq=268001 Ack=1 Win=131072 Len=1000 TSval=5065 TSecr=5028"
"3030","5.054821","10.1.0.11","10.1.0.6","TCP","1134","0.000703000","","","49158  >  7010 [ACK] Seq=269001 Ack=1 Win=131072 Len=1000 TSval=5066 TSecr=5028"
"3037","5.055450","10.1.0.11","10.1.0.6","TCP","1136","0.000629000","","","[TCP Retransmission] 49158  >  7010 [ACK] Seq=269001 Ack=1 Win=131072 Len=1000 TSval=5066 TSecr=5028"
"3038","5.055450","10.1.0.11","10.1.0.6","TCP","1134","0.000000000","","","49158  >  7010 [ACK] Seq=270001 Ack=1 Win=131072 Len=1000 TSval=5067 TSecr=5028"
"3046","5.056190","10.1.0.11","10.1.0.6","TCP","1134","0.000740000","","","49158  >  7010 [ACK] Seq=271001 Ack=1 Win=131072 Len=1000 TSval=5068 TSecr=5028"
"3064","5.058296","10.1.0.11","10.1.0.6","TCP","3300","0.002106000","","","49158  >  7010 [ACK] Seq=274001 Ack=1 Win=131072 Len=1000 TSval=5070 TSecr=5028"
"3078","5.059488","10.1.0.11","10.1.0.6","TCP","1134","0.001192000","","","49158  >  7010 [ACK] Seq=275001 Ack=1 Win=131072 Len=1000 TSval=5071 TSecr=5028"
"3086","5.060096","10.1.0.11","10.1.0.6","TCP","1134","0.000608000","","","49158  >  7010 [ACK] Seq=276001 Ack=1 Win=131072 Len=1000 TSval=5072 TSecr=5028"
"3128","5.063933","10.1.0.11","10.1.0.6","TCP","5452","0.003837000","","","49158  >  7010 [ACK] Seq=281001 Ack=1 Win=131072 Len=1000 TSval=5076 TSecr=5028"
"3150","5.067349","10.1.0.11","10.1.0.6","TCP","2224","0.003416000","","","49158  >  7010 [ACK] Seq=283001 Ack=1 Win=131072 Len=1000 TSval=5077 TSecr=5028"
"4229","5.165633","10.1.0.6","10.1.0.11","TCP","1896","0.098284000","-31 dBm","0.132314000,0.132314000,0.132314000,0.132314000,0.132314000,0.132314000,0.132314000,0.129958000,0.129958000,0.128638000,0.126715000,0.125427000,0.124147000,0.121893000,0.120981000,0.118844000,0.117020000,0.115535000,0.112219000,0.112219000,0.110812000,0.109443000,0.107337000,0.106145000","7010  >  49158 [ACK] Seq=1 Ack=276001 Win=131072 Len=0 TSval=5071 TSecr=5070"
"4230","5.165633","10.1.0.6","10.1.0.11","TCP","376","0.000000000","-31 dBm","0.101700000,0.101700000,0.101700000,0.098284000","7010  >  49158 [ACK] Seq=1 Ack=284001 Win=131072 Len=0 TSval=5079 TSecr=5076"
"4252","5.167968","10.1.0.11","10.1.0.6","TCP","6376","0.002335000","","","49158  >  7010 [ACK] Seq=288501 Ack=1 Win=131072 Len=1500 TSval=5177 TSecr=5045"
"4253","5.167968","10.1.0.11","10.1.0.6","TCP","6376","0.000000000","","","49158  >  7010 [ACK] Seq=294501 Ack=1 Win=131072 Len=1500 TSval=5177 TSecr=5045"
"4254","5.167968","10.1.0.11","10.1.0.6","TCP","6376","0.000000000","","","49158  >  7010 [ACK] Seq=300501 Ack=1 Win=131072 Len=1500 TSval=5177 TSecr=5046"
"4255","5.167968","10.1.0.11","10.1.0.6","TCP","6376","0.000000000","","","49158  >  7010 [ACK] Seq=306501 Ack=1 Win=131072 Len=1500 TSval=5177 TSecr=5048"
"4256","5.167968","10.1.0.11","10.1.0.6","TCP","6376","0.000000000","","","49158  >  7010 [ACK] Seq=312501 Ack=1 Win=131072 Len=1500 TSval=5177 TSecr=5051"
"4257","5.167968","10.1.0.11","10.1.0.6","TCP","6376","0.000000000","","","49158  >  7010 [ACK] Seq=318501 Ack=1 Win=131072 Len=1500 TSval=5177 TSecr=5056"
"4258","5.167968","10.1.0.11","10.1.0.6","TCP","6376","0.000000000","","","49158  >  7010 [ACK] Seq=324501 Ack=1 Win=131072 Len=1500 TSval=5177 TSecr=5060"
"4259","5.167968","10.1.0.11","10.1.0.6","TCP","6376","0.000000000","","","49158  >  7010 [ACK] Seq=330501 Ack=1 Win=131072 Len=1500 TSval=5177 TSecr=5065"
"4260","5.167968","10.1.0.11","10.1.0.6","TCP","6376","0.000000000","","","49158  >  7010 [ACK] Seq=336501 Ack=1 Win=131072 Len=1500 TSval=5177 TSecr=5070"
"4261","5.167968","10.1.0.11","10.1.0.6","TCP","6376","0.000000000","","","49158  >  7010 [ACK] Seq=342501 Ack=1 Win=131072 Len=1500 TSval=5177 TSecr=5076"
"4262","5.167968","10.1.0.11","10.1.0.6","TCP","6376","0.000000000","","","49158  >  7010 [ACK] Seq=348501 Ack=1 Win=131072 Len=1500 TSval=5177 TSecr=5079"
"4528","5.192152","10.1.0.6","10.1.0.11","TCP","1744","0.024184000","-31 dBm","0.024184000,0.024184000,0.024184000,0.024184000,0.024184000,0.024184000,0.024184000,0.024184000,0.024184000,0.024184000,0.024184000,0.024184000,0.024184000,0.024184000,0.024184000,0.024184000,0.024184000,0.024184000,0.024184000,0.024184000,0.024184000,0.024184000","7010  >  49158 [ACK] Seq=1 Ack=350001 Win=131072 Len=0 TSval=5182 TSecr=5177"
"4542","5.193231","10.1.0.11","10.1.0.6","TCP","6376","0.001079000","","","49158  >  7010 [ACK] Seq=354501 Ack=1 Win=131072 Len=1500 TSval=5204 TSecr=5180"
"4543","5.193231","10.1.0.11","10.1.0.6","TCP","6376","0.000000000","","","49158  >  7010 [ACK] Seq=360501 Ack=1 Win=131072 Len=1500 TSval=5204 TSecr=5180"
"4544","5.193231","10.1.0.11","10.1.0.6","TCP","6376","0.000000000","","","49158  >  7010 [ACK] Seq=366501 Ack=1 Win=131072 Len=1500 TSval=5204 TSecr=5180"
"4545","5.193231","10.1.0.11","10.1.0.6","TCP","6376","0.000000000","","","49158  >  7010 [ACK] Seq=372501 Ack=1 Win=131072 Len=1500 TSval=5204 TSecr=5181"
"4546","5.193231","10.1.0.11","10.1.0.6","TCP","6376","0.000000000","","","49158  >  7010 [ACK] Seq=378501 Ack=1 Win=131072 Len=1500 TSval=5204 TSecr=5181"
"4547","5.193231","10.1.0.11","10.1.0.6","TCP","6452","0.000000000","","","49158  >  7010 [ACK] Seq=385001 Ack=1 Win=131072 Len=1000 TSval=5204 TSecr=5182"
"4555","5.195155","10.1.0.11","10.1.0.6","TCP","3300","0.001924000","","","49158  >  7010 [ACK] Seq=388001 Ack=1 Win=131072 Len=1000 TSval=5207 TSecr=5182"
"4567","5.196355","10.1.0.11","10.1.0.6","TCP","1134","0.001200000","","","49158  >  7010 [ACK] Seq=389001 Ack=1 Win=131072 Len=1000 TSval=5208 TSecr=5182"
"4579","5.197267","10.1.0.11","10.1.0.6","TCP","1134","0.000912000","","","49158  >  7010 [ACK] Seq=390001 Ack=1 Win=131072 Len=1000 TSval=5208 TSecr=5182"
"4595","5.198641","10.1.0.11","10.1.0.6","TCP","2224","0.001374000","","","49158  >  7010 [ACK] Seq=392001 Ack=1 Win=131072 Len=1000 TSval=5210 TSecr=5182"
"4607","5.199650","10.1.0.11","10.1.0.6","TCP","1134","0.001009000","","","49158  >  7010 [ACK] Seq=393001 Ack=1 Win=131072 Len=1000 TSval=5211 TSecr=5182"
"4619","5.200562","10.1.0.11","10.1.0.6","TCP","1134","0.000912000","","","49158  >  7010 [ACK] Seq=394001 Ack=1 Win=131072 Len=1000 TSval=5212 TSecr=5182"
"4631","5.201506","10.1.0.11","10.1.0.6","TCP","2224","0.000944000","","","49158  >  7010 [ACK] Seq=396001 Ack=1 Win=131072 Len=1000 TSval=5213 TSecr=5182"
"4647","5.202818","10.1.0.11","10.1.0.6","TCP","1134","0.001312000","","","49158  >  7010 [ACK] Seq=397001 Ack=1 Win=131072 Len=1000 TSval=5214 TSecr=5182"
"4660","5.203816","10.1.0.11","10.1.0.6","TCP","1134","0.000998000","","","49158  >  7010 [ACK] Seq=398001 Ack=1 Win=131072 Len=1000 TSval=5215 TSecr=5182"
"4672","5.204888","10.1.0.11","10.1.0.6","TCP","2224","0.001072000","","","49158  >  7010 [ACK] Seq=400001 Ack=1 Win=131072 Len=1000 TSval=5216 TSecr=5182"
"4684","5.205832","10.1.0.11","10.1.0.6","TCP","1134","0.000944000","","","49158  >  7010 [ACK] Seq=401001 Ack=1 Win=131072 Len=1000 TSval=5217 TSecr=5182"
"4696","5.206745","10.1.0.11","10.1.0.6","TCP","1134","0.000913000","","","49158  >  7010 [ACK] Seq=402001 Ack=1 Win=131072 Len=1000 TSval=5218 TSecr=5182"
"4708","5.207657","10.1.0.11","10.1.0.6","TCP","1134","0.000912000","","","49158  >  7010 [ACK] Seq=403001 Ack=1 Win=131072 Len=1000 TSval=5219 TSecr=5182"
"4720","5.208569","10.1.0.11","10.1.0.6","TCP","1134","0.000912000","","","49158  >  7010 [ACK] Seq=404001 Ack=1 Win=131072 Len=1000 TSval=5220 TSecr=5182"
"4733","5.209624","10.1.0.11","10.1.0.6","TCP","832","0.001055000","","0.272945000,0.272945000,0.272945000,0.272945000,0.272945000,0.272945000,0.272945000,0.272945000,0.272945000,0.272945000","7011  >  49153 [ACK] Seq=1 Ack=45001 Win=131072 Len=0 TSval=4948 TSecr=4936"
"4748","5.212690","10.1.0.6","10.1.0.11","TCP","6376","0.003066000","-31 dBm","","49153  >  7011 [ACK] Seq=49501 Ack=1 Win=131072 Len=1500 TSval=5221 TSecr=4948"
"4749","5.212690","10.1.0.6","10.1.0.11","TCP","6376","0.000000000","-31 dBm","","49153  >  7011 [ACK] Seq=55501 Ack=1 Win=131072 Len=1500 TSval=5221 TSecr=4948"
"4750","5.212690","10.1.0.6","10.1.0.11","TCP","6376","0.000000000","-31 dBm","","49153  >  7011 [ACK] Seq=61501 Ack=1 Win=131072 Len=1500 TSval=5221 TSecr=4948"
"4751","5.212690","10.1.0.6","10.1.0.11","TCP","6376","0.000000000","-31 dBm","","49153  >  7011 [ACK] Seq=67501 Ack=1 Win=131072 Len=1500 TSval=5221 TSecr=4948"
"4752","5.212690","10.1.0.6","10.1.0.11","TCP","6376","0.000000000","-31 dBm","","49153  >  7011 [ACK] Seq=73501 Ack=1 Win=131072 Len=1500 TSval=5221 TSecr=4948"
"4753","5.212690","10.1.0.6","10.1.0.11","TCP","6376","0.000000000","-31 dBm","","49153  >  7011 [ACK] Seq=79501 Ack=1 Win=131072 Len=1500 TSval=5221 TSecr=4948"
"4754","5.212690","10.1.0.6","10.1.0.11","TCP","6376","0.000000000","-31 dBm","","49153  >  7011 [ACK] Seq=85501 Ack=1 Win=131072 Len=1500 TSval=5221 TSecr=4948"
"4755","5.212690","10.1.0.6","10.1.0.11","TCP","6376","0.000000000","-31 dBm","","49153  >  7011 [ACK] Seq=91501 Ack=1 Win=131072 Len=1500 TSval=5221 TSecr=4948"
"4756","5.212690","10.1.0.6","10.1.0.11","TCP","6376","0.000000000","-31 dBm","","49153  >  7011 [ACK] Seq=97501 Ack=1 Win=131072 Len=1500 TSval=5221 TSecr=4948"
"4757","5.212690","10.1.0.6","10.1.0.11","TCP","3224","0.000000000","-31 dBm","","49153  >  7011 [ACK] Seq=100501 Ack=1 Win=131072 Len=1500 TSval=5221 TSecr=4948"
"4837","5.230545","10.1.0.11","10.1.0.6","TCP","6528","0.017855000","","","49158  >  7010 [ACK] Seq=410001 Ack=1 Win=131072 Len=1000 TSval=5224 TSecr=5182"
"4838","5.230545","10.1.0.11","10.1.0.6","TCP","6528","0.000000000","","","49158  >  7010 [ACK] Seq=416001 Ack=1 Win=131072 Len=1000 TSval=5229 TSecr=5182"
"4839","5.230545","10.1.0.11","10.1.0.6","TCP","2224","0.000000000","","","49158  >  7010 [ACK] Seq=418001 Ack=1 Win=131072 Len=1000 TSval=5231 TSecr=5182"
"4886","5.238445","10.1.0.6","10.1.0.11","TCP","2276","0.007900000","-31 dBm","0.045214000,0.045214000,0.045214000,0.045214000,0.045214000,0.045214000,0.045214000,0.045214000,0.045214000,0.045214000,0.045214000,0.045214000,0.043290000,0.043290000,0.041178000,0.039804000,0.037883000,0.036939000,0.034629000,0.033557000,0.031700000,0.029876000,0.007900000,0.007900000,0.007900000,0.007900000,0.007900000,0.007900000,0.007900000","7010  >  49158 [ACK] Seq=1 Ack=419001 Win=131072 Len=0 TSval=5243 TSecr=5230"
"4903","5.240547","10.1.0.11","10.1.0.6","TCP","6376","0.002102000","","","49158  >  7010 [ACK] Seq=423501 Ack=1 Win=131072 Len=1500 TSval=5250 TSecr=5205"
"4904","5.240547","10.1.0.11","10.1.0.6","TCP","6376","0.000000000","","","49158  >  7010 [ACK] Seq=429501 Ack=1 Win=131072 Len=1500 TSval=5250 TSecr=5205"
"4905","5.240547","10.1.0.11","10.1.0.6","TCP","6376","0.000000000","","","49158  >  7010 [ACK] Seq=435501 Ack=1 Win=131072 Len=1500 TSval=5250 TSecr=5206"
"4906","5.240547","10.1.0.11","10.1.0.6","TCP","7452","0.000000000","","","49158  >  7010 [ACK] Seq=443001 Ack=1 Win=131072 Len=1000 TSval=5251 TSecr=5243"
"4907","5.240547","10.1.0.11","10.1.0.6","TCP","1134","0.000000000","","","49158  >  7010 [ACK] Seq=444001 Ack=1 Win=131072 Len=1000 TSval=5252 TSecr=5243"
"4913","5.241999","10.1.0.11","10.1.0.6","TCP","2224","0.001452000","","","49158  >  7010 [ACK] Seq=446001 Ack=1 Win=131072 Len=1000 TSval=5253 TSecr=5243"
"4919","5.242487","10.1.0.11","10.1.0.6","TCP","1134","0.000488000","","","49158  >  7010 [ACK] Seq=447001 Ack=1 Win=131072 Len=1000 TSval=5254 TSecr=5243"
"4925","5.242981","10.1.0.11","10.1.0.6","TCP","1516","0.000494000","","0.030291000,0.030291000,0.030291000,0.030291000,0.030291000,0.030291000,0.030291000,0.030291000,0.030291000,0.030291000,0.030291000,0.030291000,0.030291000,0.030291000,0.030291000,0.030291000,0.030291000,0.030291000,0.030291000","7011  >  49153 [ACK] Seq=1 Ack=102001 Win=131072 Len=0 TSval=5224 TSecr=5221"
"4986","5.261683","10.1.0.6","10.1.0.11","TCP","6376","0.018702000","-31 dBm","","49153  >  7011 [ACK] Seq=106501 Ack=1 Win=131072 Len=1500 TSval=5255 TSecr=5223"
"4987","5.261683","10.1.0.6","10.1.0.11","TCP","6376","0.000000000","-31 dBm","","49153  >  7011 [ACK] Seq=112501 Ack=1 Win=131072 Len=1500 TSval=5255 TSecr=5223"
"4988","5.261683","10.1.0.6","10.1.0.11","TCP","6376","0.000000000","-31 dBm","","49153  >  7011 [ACK] Seq=118501 Ack=1 Win=131072 Len=1500 TSval=5255 TSecr=5223"
"4989","5.261683","10.1.0.6","10.1.0.11","TCP","6376","0.000000000","-31 dBm","","49153  >  7011 [ACK] Seq=124501 Ack=1 Win=131072 Len=1500 TSval=5255 TSecr=5223"
"4990","5.261683","10.1.0.6","10.1.0.11","TCP","6376","0.000000000","-31 dBm","","49153  >  7011 [ACK] Seq=130501 Ack=1 Win=131072 Len=1500 TSval=5255 TSecr=5223"
"4991","5.261683","10.1.0.6","10.1.0.11","TCP","6376","0.000000000","-31 dBm","","49153  >  7011 [ACK] Seq=136501 Ack=1 Win=131072 Len=1500 TSval=5255 TSecr=5224"
"4992","5.261683","10.1.0.6","10.1.0.11","TCP","6376","0.000000000","-31 dBm","","49153  >  7011 [ACK] Seq=142501 Ack=1 Win=131072 Len=1500 TSval=5255 TSecr=5224"
"4993","5.261683","10.1.0.6","10.1.0.11","TCP","6376","0.000000000","-31 dBm","","49153  >  7011 [ACK] Seq=148501 Ack=1 Win=131072 Len=1500 TSval=5255 TSecr=5224"
"4994","5.261683","10.1.0.6","10.1.0.11","TCP","6376","0.000000000","-31 dBm","","49153  >  7011 [ACK] Seq=154501 Ack=1 Win=131072 Len=1500 TSval=5255 TSecr=5224"
"4995","5.261683","10.1.0.6","10.1.0.11","TCP","6376","0.000000000","-31 dBm","","49153  >  7011 [ACK] Seq=160501 Ack=1 Win=131072 Len=1500 TSval=5255 TSecr=5224"
"5006","5.265192","10.1.0.11","10.1.0.6","TCP","6528","0.003509000","","","49158  >  7010 [ACK] Seq=453001 Ack=1 Win=131072 Len=1000 TSval=5259 TSecr=5243"
"5007","5.265192","10.1.0.11","10.1.0.6","TCP","6528","0.000000000","","","49158  >  7010 [ACK] Seq=459001 Ack=1 Win=131072 Len=1000 TSval=5264 TSecr=5243"
"5008","5.265192","10.1.0.11","10.1.0.6","TCP","6528","0.000000000","","","49158  >  7010 [ACK] Seq=465001 Ack=1 Win=131072 Len=1000 TSval=5268 TSecr=5243"
"5009","5.265192","10.1.0.11","10.1.0.6","TCP","6528","0.000000000","","","49158  >  7010 [ACK] Seq=471001 Ack=1 Win=131072 Len=1000 TSval=5273 TSecr=5243"
"5010","5.265192","10.1.0.11","10.1.0.6","TCP","4376","0.000000000","","","49158  >  7010 [ACK] Seq=475001 Ack=1 Win=131072 Len=1000 TSval=5276 TSecr=5243"
"5017","5.267032","10.1.0.11","10.1.0.6","TCP","2224","0.001840000","","","49158  >  7010 [ACK] Seq=477001 Ack=1 Win=131072 Len=1000 TSval=5278 TSecr=5243"
"5021","5.267368","10.1.0.11","10.1.0.6","TCP","1134","0.000336000","","","49158  >  7010 [ACK] Seq=478001 Ack=1 Win=131072 Len=1000 TSval=5279 TSecr=5243"
"5069","5.275230","10.1.0.11","10.1.0.6","TCP","6528","0.007862000","","","49158  >  7010 [ACK] Seq=484001 Ack=1 Win=131072 Len=1000 TSval=5284 TSecr=5243"
"5070","5.275230","10.1.0.11","10.1.0.6","TCP","4376","0.000000000","","","49158  >  7010 [ACK] Seq=488001 Ack=1 Win=131072 Len=1000 TSval=5287 TSecr=5243"
"5076","5.276010","10.1.0.11","10.1.0.6","TCP","1134","0.000780000","","","49158  >  7010 [ACK] Seq=489001 Ack=1 Win=131072 Len=1000 TSval=5288 TSecr=5243"
"5106","5.280848","10.1.0.11","10.1.0.6","TCP","1134","0.004838000","","","49158  >  7010 [ACK] Seq=490001 Ack=1 Win=131072 Len=1000 TSval=5288 TSecr=5243"
"5184","5.292052","10.1.0.6","10.1.0.11","TCP","2504","0.011204000","-31 dBm","0.051505000,0.051505000,0.051505000,0.051505000,0.051505000,0.051505000,0.051505000,0.051505000,0.051505000,0.050053000,0.026860000,0.026860000,0.026860000,0.026860000,0.026860000,0.026860000,0.026860000,0.026860000,0.026860000,0.026860000,0.026860000,0.026860000,0.026860000,0.026860000,0.025020000,0.024684000,0.016822000,0.016822000,0.016822000,0.016822000,0.016822000,0.011204000","7010  >  49158 [ACK] Seq=1 Ack=491001 Win=131072 Len=0 TSval=5293 TSecr=5288"
"5187","5.292216","10.1.0.11","10.1.0.6","TCP","6376","0.000164000","","","49158  >  7010 [ACK] Seq=495501 Ack=1 Win=131072 Len=1500 TSval=5304 TSecr=5252"
"5188","5.292216","10.1.0.11","10.1.0.6","TCP","6376","0.000000000","","","49158  >  7010 [ACK] Seq=501501 Ack=1 Win=131072 Len=1500 TSval=5304 TSecr=5253"
"5189","5.292216","10.1.0.11","10.1.0.6","TCP","7452","0.000000000","","","49158  >  7010 [ACK] Seq=509001 Ack=1 Win=131072 Len=1000 TSval=5304 TSecr=5253"
"5193","5.293148","10.1.0.11","10.1.0.6","TCP","1134","0.000932000","","","49158  >  7010 [ACK] Seq=510001 Ack=1 Win=131072 Len=1000 TSval=5304 TSecr=5293"
"5197","5.293452","10.1.0.11","10.1.0.6","TCP","1134","0.000304000","","","49158  >  7010 [ACK] Seq=511001 Ack=1 Win=131072 Len=1000 TSval=5305 TSecr=5293"
"5217","5.296633","10.1.0.11","10.1.0.6","TCP","3300","0.003181000","","","49158  >  7010 [ACK] Seq=514001 Ack=1 Win=131072 Len=1000 TSval=5308 TSecr=5293"
"5219","5.296849","10.1.0.11","10.1.0.6","TCP","1134","0.000216000","","","49158  >  7010 [ACK] Seq=515001 Ack=1 Win=131072 Len=1000 TSval=5308 TSecr=5293"
"5222","5.297190","10.1.0.6","10.1.0.11","TCP","756","0.000341000","-31 dBm","0.004974000,0.004974000,0.004974000,0.004974000,0.004974000,0.004974000,0.004042000,0.000557000,0.000557000","7010  >  49158 [ACK] Seq=1 Ack=515001 Win=131072 Len=0 TSval=5308 TSecr=5307"
"5231","5.297716","10.1.0.11","10.1.0.6","TCP","1134","0.000526000","","","49158  >  7010 [ACK] Seq=516001 Ack=1 Win=131072 Len=1000 TSval=5309 TSecr=5308"
"5237","5.298468","10.1.0.11","10.1.0.6","TCP","1134","0.000752000","","","49158  >  7010 [ACK] Seq=517001 Ack=1 Win=131072 Len=1000 TSval=5310 TSecr=5308"
"5251","5.299847","10.1.0.11","10.1.0.6","TCP","2224","0.001379000","","","49158  >  7010 [ACK] Seq=519001 Ack=1 Win=131072 Len=1000 TSval=5312 TSecr=5308"
"5267","5.301083","10.1.0.6","10.1.0.11","TCP","224","0.001236000","-31 dBm","0.003367000,0.001236000","7010  >  49158 [ACK] Seq=1 Ack=519001 Win=131072 Len=0 TSval=5312 TSecr=5310"
"5270","5.301238","10.1.0.11","10.1.0.6","TCP","1134","0.000155000","","","49158  >  7010 [ACK] Seq=520001 Ack=1 Win=131072 Len=1000 TSval=5312 TSecr=5308"
"5287","5.303978","10.1.0.11","10.1.0.6","TCP","4376","0.002740000","","","49158  >  7010 [ACK] Seq=524001 Ack=1 Win=131072 Len=1000 TSval=5316 TSecr=5312"
"5297","5.304898","10.1.0.11","10.1.0.6","TCP","1134","0.000920000","","","49158  >  7010 [ACK] Seq=525001 Ack=1 Win=131072 Len=1000 TSval=5316 TSecr=5312"
