"No.","Time","Source","Destination","Protocol","Length","Time delta from previous displayed frame","Signal strength (dBm)","The RTT to ACK the segment was","Info"
"681","3.337729","10.1.0.11","10.1.0.7","TCP","138","0.000000000","-23 dBm","","49159  >  7012 [SYN] Seq=0 Win=65535 Len=0 TSval=3350 TSecr=0 WS=4 SACK_PERM=1"
"684","3.337884","10.1.0.7","10.1.0.11","TCP","138","0.000155000","","0.000155000","7012  >  49159 [SYN, ACK] Seq=0 Ack=1 Win=65535 Len=0 TSval=3350 TSecr=3350 WS=4 SACK_PERM=1"
"687","3.338159","10.1.0.11","10.1.0.7","TCP","134","0.000275000","-23 dBm","0.000275000","49159  >  7012 [ACK] Seq=1 Ack=1 Win=131072 Len=0 TSval=3350 TSecr=3350"
"696","3.338835","10.1.0.7","10.1.0.11","TCP","138","0.000676000","","","49153  >  7013 [SYN] Seq=0 Win=65535 Len=0 TSval=3350 TSecr=0 WS=4 SACK_PERM=1"
"699","3.339110","10.1.0.11","10.1.0.7","TCP","138","0.000275000","-23 dBm","0.000275000","7013  >  49153 [SYN, ACK] Seq=0 Ack=1 Win=65535 Len=0 TSval=3351 TSecr=3350 WS=4 SACK_PERM=1"
"702","3.339256","10.1.0.7","10.1.0.11","TCP","134","0.000146000","","0.000146000","49153  >  7013 [ACK] Seq=1 Ack=1 Win=131072 Len=0 TSval=3351 TSecr=3351"
"1013","4.839257","10.1.0.11","10.1.0.7","TCP","1134","1.500001000","-23 dBm","","49159  >  7012 [ACK] Seq=1 Ack=1 Win=131072 Len=1000 TSval=4851 TSecr=3350"
"1027","4.840321","10.1.0.11","10.1.0.7","TCP","1134","0.001064000","-23 dBm","","49159  >  7012 [ACK] Seq=1001 Ack=1 Win=131072 Len=1000 TSval=4852 TSecr=3350"
"1047","4.842161","10.1.0.11","10.1.0.7","TCP","3300","0.001840000","-23 dBm","","49159  >  7012 [ACK] Seq=4001 Ack=1 Win=131072 Len=1000 TSval=4854 TSecr=3350"
"1067","4.844097","10.1.0.11","10.1.0.7","TCP","2224","0.001936000","-23 dBm","","49159  >  7012 [ACK] Seq=6001 Ack=1 Win=131072 Len=1000 TSval=4856 TSecr=3350"
"1069","4.844183","10.1.0.7","10.1.0.11","TCP","6528","0.000086000","","","49153  >  7013 [ACK] Seq=5001 Ack=1 Win=131072 Len=1000 TSval=4856 TSecr=3351"
"1094","4.847945","10.1.0.11","10.1.0.7","TCP","5452","0.003762000","-23 dBm","","49159  >  7012 [ACK] Seq=11001 Ack=1 Win=131072 Len=1000 TSval=4860 TSecr=3350"
"1114","4.850138","10.1.0.11","10.1.0.7","TCP","3300","0.002193000","-23 dBm","","49159  >  7012 [ACK] Seq=14001 Ack=1 Win=131072 Len=1000 TSval=4862 TSecr=3350"
"1122","4.850901","10.1.0.11","10.1.0.7","TCP","300","0.000763000","-23 dBm","0.006718000,0.006718000,0.006718000","7013  >  49153 [ACK] Seq=1 Ack=5001 Win=131072 Len=0 TSval=4856 TSecr=4854"
"1137","4.853887","10.1.0.7","10.1.0.11","TCP","6528","0.002986000","","","49153  >  7013 [ACK] Seq=11001 Ack=1 Win=131072 Len=1000 TSval=4861 TSecr=3351"
"1138","4.853887","10.1.0.7","10.1.0.11","TCP","6528","0.000000000","","","49153  >  7013 [ACK] Seq=17001 Ack=1 Win=131072 Len=1000 TSval=4866 TSecr=4856"
"1140","4.854427","10.1.0.7","10.1.0.11","TCP","1134","0.000540000","","","49153  >  7013 [ACK] Seq=18001 Ack=1 Win=131072 Len=1000 TSval=4866 TSecr=4856"
"1150","4.856739","10.1.0.7","10.1.0.11","TCP","3300","0.002312000","","","49153  >  7013 [ACK] Seq=21001 Ack=1 Win=131072 Len=1000 TSval=4869 TSecr=4856"
"1168","4.859124","10.1.0.7","10.1.0.11","TCP","2224","0.002385000","","","49153  >  7013 [ACK] Seq=23001 Ack=1 Win=131072 Len=1000 TSval=4870 TSecr=4856"
"1225","4.865551","10.1.0.7","10.1.0.11","TCP","680","0.006427000","","0.026294000,0.023390000,0.023390000,0.021454000,0.017606000,0.017606000,0.015413000,0.015413000","7012  >  49159 [ACK] Seq=1 Ack=15001 Win=131072 Len=0 TSval=4862 TSecr=4861"
"1231","4.866752","10.1.0.11","10.1.0.7","TCP","6376","0.001201000","-23 dBm","","49159  >  7012 [ACK] Seq=19501 Ack=1 Win=131072 Len=1500 TSval=4878 TSecr=4854"
"1232","4.866752","10.1.0.11","10.1.0.7","TCP","6376","0.000000000","-23 dBm","","49159  >  7012 [ACK] Seq=25501 Ack=1 Win=131072 Len=1500 TSval=4878 TSecr=4856"
"1233","4.866752","10.1.0.11","10.1.0.7","TCP","7452","0.000000000","-23 dBm","","49159  >  7012 [ACK] Seq=33001 Ack=1 Win=131072 Len=1000 TSval=4878 TSecr=4860"
"1234","4.866752","10.1.0.11","10.1.0.7","TCP","1134","0.000000000","-23 dBm","","49159  >  7012 [ACK] Seq=34001 Ack=1 Win=131072 Len=1000 TSval=4878 TSecr=4862"
"1243","4.868000","10.1.0.11","10.1.0.7","TCP","2224","0.001248000","-23 dBm","","49159  >  7012 [ACK] Seq=36001 Ack=1 Win=131072 Len=1000 TSval=4880 TSecr=4862"
"1250","4.868895","10.1.0.11","10.1.0.7","TCP","1134","0.000895000","-23 dBm","","49159  >  7012 [ACK] Seq=37001 Ack=1 Win=131072 Len=1000 TSval=4880 TSecr=4862"
"1255","4.869202","10.1.0.7","10.1.0.11","TCP","680","0.000307000","","0.002450000,0.002450000,0.002450000,0.002450000,0.002450000,0.002450000,0.002450000,0.001202000","7012  >  49159 [ACK] Seq=1 Ack=37001 Win=131072 Len=0 TSval=4880 TSecr=4879"
"1261","4.869787","10.1.0.11","10.1.0.7","TCP","1134","0.000585000","-23 dBm","","49159  >  7012 [ACK] Seq=38001 Ack=1 Win=131072 Len=1000 TSval=4881 TSecr=4862"
"1267","4.870243","10.1.0.11","10.1.0.7","TCP","1134","0.000456000","-23 dBm","","49159  >  7012 [ACK] Seq=39001 Ack=1 Win=131072 Len=1000 TSval=4882 TSecr=4862"
"1296","4.873210","10.1.0.11","10.1.0.7","TCP","3300","0.002967000","-23 dBm","","49159  >  7012 [ACK] Seq=42001 Ack=1 Win=131072 Len=1000 TSval=4884 TSecr=4862"
"1308","4.874942","10.1.0.11","10.1.0.7","TCP","2224","0.001732000","-23 dBm","","49159  >  7012 [ACK] Seq=44001 Ack=1 Win=131072 Len=1000 TSval=4886 TSecr=4862"
"1365","4.880314","10.1.0.7","10.1.0.11","TCP","680","0.005372000","","","7012  >  49159 [ACK] Seq=1 Ack=37001 Win=131072 Len=0 TSval=4880 TSecr=4879"
"1366","4.880314","10.1.0.7","10.1.0.11","TCP","376","0.000000000","","0.010527000,0.007104000,0.007104000,0.005372000","7012  >  49159 [ACK] Seq=1 Ack=45001 Win=131072 Len=0 TSval=4887 TSecr=4885"
"1848","4.923574","10.1.0.11","10.1.0.7","TCP","756","0.043260000","-23 dBm","0.069687000,0.069687000,0.069687000,0.069687000,0.069687000,0.069687000,0.069147000,0.066835000,0.064450000","7013  >  49153 [ACK] Seq=1 Ack=23001 Win=131072 Len=0 TSval=4871 TSecr=4869"
"1865","4.925790","10.1.0.7","10.1.0.11","TCP","6376","0.002216000","","","49153  >  7013 [ACK] Seq=28501 Ack=1 Win=131072 Len=1500 TSval=4936 TSecr=4866"
"1866","4.925790","10.1.0.7","10.1.0.11","TCP","6376","0.000000000","","","49153  >  7013 [ACK] Seq=34501 Ack=1 Win=131072 Len=1500 TSval=4936 TSecr=4866"
"1867","4.925790","10.1.0.7","10.1.0.11","TCP","6376","0.000000000","","","49153  >  7013 [ACK] Seq=40501 Ack=1 Win=131072 Len=1500 TSval=4936 TSecr=4866"
"1868","4.925790","10.1.0.7","10.1.0.11","TCP","6376","0.000000000","","","49153  >  7013 [ACK] Seq=46501 Ack=1 Win=131072 Len=1500 TSval=4936 TSecr=4866"
"1869","4.925790","10.1.0.7","10.1.0.11","TCP","6376","0.000000000","","","49153  >  7013 [ACK] Seq=52501 Ack=1 Win=131072 Len=1500 TSval=4936 TSecr=4869"
"1870","4.925790","10.1.0.7","10.1.0.11","TCP","6376","0.000000000","","","49153  >  7013 [ACK] Seq=58501 Ack=1 Win=131072 Len=1500 TSval=4936 TSecr=4871"
"2215","4.975811","10.1.0.7","10.1.0.11","TCP","680","0.050021000","","","7012  >  49159 [ACK] Seq=1 Ack=37001 Win=131072 Len=0 TSval=4880 TSecr=4879"
"2216","4.975811","10.1.0.7","10.1.0.11","TCP","376","0.000000000","","","7012  >  49159 [ACK] Seq=1 Ack=45001 Win=131072 Len=0 TSval=4887 TSecr=4885"
"2231","4.979205","10.1.0.11","10.1.0.7","TCP","6376","0.003394000","-23 dBm","","49159  >  7012 [ACK] Seq=49501 Ack=1 Win=131072 Len=1500 TSval=4988 TSecr=4878"
"2232","4.979205","10.1.0.11","10.1.0.7","TCP","6376","0.000000000","-23 dBm","","49159  >  7012 [ACK] Seq=55501 Ack=1 Win=131072 Len=1500 TSval=4988 TSecr=4878"
"2233","4.979205","10.1.0.11","10.1.0.7","TCP","6376","0.000000000","-23 dBm","","49159  >  7012 [ACK] Seq=61501 Ack=1 Win=131072 Len=1500 TSval=4988 TSecr=4878"
"2234","4.979205","10.1.0.11","10.1.0.7","TCP","6376","0.000000000","-23 dBm","","49159  >  7012 [ACK] Seq=67501 Ack=1 Win=131072 Len=1500 TSval=4988 TSecr=4878"
"2235","4.979205","10.1.0.11","10.1.0.7","TCP","6376","0.000000000","-23 dBm","","49159  >  7012 [ACK] Seq=73501 Ack=1 Win=131072 Len=1500 TSval=4988 TSecr=4879"
"2236","4.979205","10.1.0.11","10.1.0.7","TCP","6376","0.000000000","-23 dBm","","49159  >  7012 [ACK] Seq=79501 Ack=1 Win=131072 Len=1500 TSval=4988 TSecr=4879"
"2237","4.979205","10.1.0.11","10.1.0.7","TCP","6376","0.000000000","-23 dBm","","49159  >  7012 [ACK] Seq=85501 Ack=1 Win=131072 Len=1500 TSval=4988 TSecr=4880"
"2238","4.979205","10.1.0.11","10.1.0.7","TCP","6376","0.000000000","-23 dBm","","49159  >  7012 [ACK] Seq=91501 Ack=1 Win=131072 Len=1500 TSval=4988 TSecr=4882"
"2239","4.979205","10.1.0.11","10.1.0.7","TCP","6376","0.000000000","-23 dBm","","49159  >  7012 [ACK] Seq=97501 Ack=1 Win=131072 Len=1500 TSval=4988 TSecr=4887"
"2289","4.983953","10.1.0.7","10.1.0.11","TCP","1440","0.004748000","","0.004748000,0.004748000,0.004748000,0.004748000,0.004748000,0.004748000,0.004748000,0.004748000,0.004748000,0.004748000,0.004748000,0.004748000,0.004748000,0.004748000,0.004748000,0.004748000,0.004748000,0.004748000","7012  >  49159 [ACK] Seq=1 Ack=99001 Win=131072 Len=0 TSval=4991 TSecr=4988"
"2300","4.986945","10.1.0.11","10.1.0.7","TCP","6376","0.002992000","-23 dBm","","49159  >  7012 [ACK] Seq=103501 Ack=1 Win=131072 Len=1500 TSval=4996 TSecr=4990"
"2301","4.986945","10.1.0.11","10.1.0.7","TCP","6376","0.000000000","-23 dBm","","49159  >  7012 [ACK] Seq=109501 Ack=1 Win=131072 Len=1500 TSval=4996 TSecr=4990"
"2302","4.986945","10.1.0.11","10.1.0.7","TCP","6376","0.000000000","-23 dBm","","49159  >  7012 [ACK] Seq=115501 Ack=1 Win=131072 Len=1500 TSval=4996 TSecr=4990"
"2303","4.986945","10.1.0.11","10.1.0.7","TCP","6376","0.000000000","-23 dBm","","49159  >  7012 [ACK] Seq=121501 Ack=1 Win=131072 Len=1500 TSval=4996 TSecr=4990"
"2304","4.986945","10.1.0.11","10.1.0.7","TCP","6376","0.000000000","-23 dBm","","49159  >  7012 [ACK] Seq=127501 Ack=1 Win=131072 Len=1500 TSval=4996 TSecr=4990"
"2305","4.986945","10.1.0.11","10.1.0.7","TCP","6376","0.000000000","-23 dBm","","49159  >  7012 [ACK] Seq=133501 Ack=1 Win=131072 Len=1500 TSval=4996 TSecr=4991"
"2306","4.986945","10.1.0.11","10.1.0.7","TCP","6376","0.000000000","-23 dBm","","49159  >  7012 [ACK] Seq=139501 Ack=1 Win=131072 Len=1500 TSval=4996 TSecr=4991"
"2307","4.986945","10.1.0.11","10.1.0.7","TCP","6376","0.000000000","-23 dBm","","49159  >  7012 [ACK] Seq=145501 Ack=1 Win=131072 Len=1500 TSval=4996 TSecr=4991"
"2308","4.986945","10.1.0.11","10.1.0.7","TCP","6376","0.000000000","-23 dBm","","49159  >  7012 [ACK] Seq=151501 Ack=1 Win=131072 Len=1500 TSval=4996 TSecr=4991"
"2309","4.986945","10.1.0.11","10.1.0.7","TCP","3224","0.000000000","-23 dBm","","49159  >  7012 [ACK] Seq=154501 Ack=1 Win=131072 Len=1500 TSval=4996 TSecr=4991"
"2396","4.995057","10.1.0.7","10.1.0.11","TCP","1516","0.008112000","","0.008112000,0.008112000,0.008112000,0.008112000,0.008112000,0.008112000,0.008112000,0.008112000,0.008112000,0.008112000,0.008112000,0.008112000,0.008112000,0.008112000,0.008112000,0.008112000,0.008112000,0.008112000,0.008112000","7012  >  49159 [ACK] Seq=1 Ack=156001 Win=131072 Len=0 TSval=4999 TSecr=4996"
"2582","5.013648","10.1.0.7","10.1.0.11","TCP","1516","0.018591000","","","7012  >  49159 [ACK] Seq=1 Ack=156001 Win=131072 Len=0 TSval=4999 TSecr=4996"
"2949","5.048584","10.1.0.7","10.1.0.11","TCP","1516","0.034936000","","","7012  >  49159 [ACK] Seq=1 Ack=156001 Win=131072 Len=0 TSval=4999 TSecr=4996"
"2962","5.052046","10.1.0.11","10.1.0.7","TCP","6376","0.003462000","-23 dBm","","49159  >  7012 [ACK] Seq=160501 Ack=1 Win=131072 Len=1500 TSval=5061 TSecr=4997"
"2963","5.052046","10.1.0.11","10.1.0.7","TCP","6376","0.000000000","-23 dBm","","49159  >  7012 [ACK] Seq=166501 Ack=1 Win=131072 Len=1500 TSval=5061 TSecr=4997"
"2964","5.052046","10.1.0.11","10.1.0.7","TCP","6376","0.000000000","-23 dBm","","49159  >  7012 [ACK] Seq=172501 Ack=1 Win=131072 Len=1500 TSval=5061 TSecr=4998"
"2965","5.052046","10.1.0.11","10.1.0.7","TCP","6376","0.000000000","-23 dBm","","49159  >  7012 [ACK] Seq=178501 Ack=1 Win=131072 Len=1500 TSval=5061 TSecr=4998"
"2966","5.052046","10.1.0.11","10.1.0.7","TCP","6376","0.000000000","-23 dBm","","49159  >  7012 [ACK] Seq=184501 Ack=1 Win=131072 Len=1500 TSval=5061 TSecr=4998"
"2967","5.052046","10.1.0.11","10.1.0.7","TCP","6376","0.000000000","-23 dBm","","49159  >  7012 [ACK] Seq=190501 Ack=1 Win=131072 Len=1500 TSval=5061 TSecr=4998"
"2968","5.052046","10.1.0.11","10.1.0.7","TCP","6376","0.000000000","-23 dBm","","49159  >  7012 [ACK] Seq=196501 Ack=1 Win=131072 Len=1500 TSval=5061 TSecr=4998"
"2969","5.052046","10.1.0.11","10.1.0.7","TCP","6376","0.000000000","-23 dBm","","49159  >  7012 [ACK] Seq=202501 Ack=1 Win=131072 Len=1500 TSval=5061 TSecr=4999"
"2970","5.052046","10.1.0.11","10.1.0.7","TCP","6376","0.000000000","-23 dBm","","49159  >  7012 [ACK] Seq=208501 Ack=1 Win=131072 Len=1500 TSval=5061 TSecr=4999"
"2971","5.052046","10.1.0.11","10.1.0.7","TCP","4800","0.000000000","-23 dBm","","49159  >  7012 [ACK] Seq=213001 Ack=1 Win=131072 Len=1500 TSval=5061 TSecr=4999"
"3063","5.060486","10.1.0.7","10.1.0.11","TCP","1516","0.008440000","","0.008440000,0.008440000,0.008440000,0.008440000,0.008440000,0.008440000,0.008440000,0.008440000,0.008440000,0.008440000,0.008440000,0.008440000,0.008440000,0.008440000,0.008440000,0.008440000,0.008440000,0.008440000,0.008440000","7012  >  49159 [ACK] Seq=1 Ack=213001 Win=131072 Len=0 TSval=5064 TSecr=5061"
"3399","5.090021","10.1.0.7","10.1.0.11","TCP","1516","0.029535000","","","7012  >  49159 [ACK] Seq=1 Ack=213001 Win=131072 Len=0 TSval=5064 TSecr=5061"
"3414","5.093512","10.1.0.11","10.1.0.7","TCP","6376","0.003491000","-23 dBm","","49159  >  7012 [ACK] Seq=219001 Ack=1 Win=131072 Len=1500 TSval=5102 TSecr=5062"
"3415","5.093512","10.1.0.11","10.1.0.7","TCP","6376","0.000000000","-23 dBm","","49159  >  7012 [ACK] Seq=225001 Ack=1 Win=131072 Len=1500 TSval=5102 TSecr=5062"
"3416","5.093512","10.1.0.11","10.1.0.7","TCP","6376","0.000000000","-23 dBm","","49159  >  7012 [ACK] Seq=231001 Ack=1 Win=131072 Len=1500 TSval=5102 TSecr=5063"
"3417","5.093512","10.1.0.11","10.1.0.7","TCP","6376","0.000000000","-23 dBm","","49159  >  7012 [ACK] Seq=237001 Ack=1 Win=131072 Len=1500 TSval=5102 TSecr=5063"
"3418","5.093512","10.1.0.11","10.1.0.7","TCP","6376","0.000000000","-23 dBm","","49159  >  7012 [ACK] Seq=243001 Ack=1 Win=131072 Len=1500 TSval=5102 TSecr=5063"
"3419","5.093512","10.1.0.11","10.1.0.7","TCP","6376","0.000000000","-23 dBm","","49159  >  7012 [ACK] Seq=249001 Ack=1 Win=131072 Len=1500 TSval=5102 TSecr=5063"
"3420","5.093512","10.1.0.11","10.1.0.7","TCP","6376","0.000000000","-23 dBm","","49159  >  7012 [ACK] Seq=255001 Ack=1 Win=131072 Len=1500 TSval=5102 TSecr=5063"
"3421","5.093512","10.1.0.11","10.1.0.7","TCP","6376","0.000000000","-23 dBm","","49159  >  7012 [ACK] Seq=261001 Ack=1 Win=131072 Len=1500 TSval=5102 TSecr=5064"
"3422","5.093512","10.1.0.11","10.1.0.7","TCP","6376","0.000000000","-23 dBm","","49159  >  7012 [ACK] Seq=267001 Ack=1 Win=131072 Len=1500 TSval=5102 TSecr=5064"
"3423","5.093512","10.1.0.11","10.1.0.7","TCP","6376","0.000000000","-23 dBm","","49159  >  7012 [ACK] Seq=273001 Ack=1 Win=131072 Len=1500 TSval=5102 TSecr=5064"
"3630","5.113451","10.1.0.7","10.1.0.11","TCP","1592","0.019939000","","0.019939000,0.019939000,0.019939000,0.019939000,0.019939000,0.019939000,0.019939000,0.019939000,0.019939000,0.019939000,0.019939000,0.019939000,0.019939000,0.019939000,0.019939000,0.019939000,0.019939000,0.019939000,0.019939000,0.019939000","7012  >  49159 [ACK] Seq=1 Ack=273001 Win=131072 Len=0 TSval=5106 TSecr=5102"
"3812","5.130270","10.1.0.7","10.1.0.11","TCP","1592","0.016819000","","","7012  >  49159 [ACK] Seq=1 Ack=273001 Win=131072 Len=0 TSval=5106 TSecr=5102"
"3836","5.135282","10.1.0.11","10.1.0.7","TCP","6376","0.005012000","-23 dBm","","49159  >  7012 [ACK] Seq=279001 Ack=1 Win=131072 Len=1500 TSval=5142 TSecr=5104"
"3837","5.135282","10.1.0.11","10.1.0.7","TCP","6376","0.000000000","-23 dBm","","49159  >  7012 [ACK] Seq=285001 Ack=1 Win=131072 Len=1500 TSval=5142 TSecr=5104"
"3838","5.135282","10.1.0.11","10.1.0.7","TCP","6376","0.000000000","-23 dBm","","49159  >  7012 [ACK] Seq=291001 Ack=1 Win=131072 Len=1500 TSval=5142 TSecr=5104"
"3839","5.135282","10.1.0.11","10.1.0.7","TCP","6376","0.000000000","-23 dBm","","49159  >  7012 [ACK] Seq=297001 Ack=1 Win=131072 Len=1500 TSval=5142 TSecr=5104"
"3840","5.135282","10.1.0.11","10.1.0.7","TCP","6376","0.000000000","-23 dBm","","49159  >  7012 [ACK] Seq=303001 Ack=1 Win=131072 Len=1500 TSval=5142 TSecr=5104"
"3841","5.135282","10.1.0.11","10.1.0.7","TCP","6376","0.000000000","-23 dBm","","49159  >  7012 [ACK] Seq=309001 Ack=1 Win=131072 Len=1500 TSval=5142 TSecr=5105"
"3842","5.135282","10.1.0.11","10.1.0.7","TCP","6376","0.000000000","-23 dBm","","49159  >  7012 [ACK] Seq=315001 Ack=1 Win=131072 Len=1500 TSval=5142 TSecr=5105"
"3843","5.135282","10.1.0.11","10.1.0.7","TCP","6376","0.000000000","-23 dBm","","49159  >  7012 [ACK] Seq=321001 Ack=1 Win=131072 Len=1500 TSval=5142 TSecr=5105"
"3844","5.135282","10.1.0.11","10.1.0.7","TCP","6376","0.000000000","-23 dBm","","49159  >  7012 [ACK] Seq=327001 Ack=1 Win=131072 Len=1500 TSval=5142 TSecr=5105"
"3845","5.135282","10.1.0.11","10.1.0.7","TCP","7028","0.000000000","-23 dBm","","49159  >  7012 [ACK] Seq=334001 Ack=1 Win=131072 Len=1000 TSval=5144 TSecr=5106"
"3860","5.137428","10.1.0.11","10.1.0.7","TCP","2224","0.002146000","-23 dBm","","49159  >  7012 [ACK] Seq=336001 Ack=1 Win=131072 Len=1000 TSval=5146 TSecr=5106"
"3909","5.141441","10.1.0.7","10.1.0.11","TCP","1744","0.004013000","","0.006159000,0.006159000,0.006159000,0.006159000,0.006159000,0.006159000,0.006159000,0.006159000,0.006159000,0.006159000,0.006159000,0.006159000,0.006159000,0.006159000,0.006159000,0.006159000,0.006159000,0.006159000,0.006159000,0.006159000,0.006159000,0.004013000","7012  >  49159 [ACK] Seq=1 Ack=336001 Win=131072 Len=0 TSval=5149 TSecr=5144"
"4198","5.166172","10.1.0.7","10.1.0.11","TCP","1744","0.024731000","","","7012  >  49159 [ACK] Seq=1 Ack=336001 Win=131072 Len=0 TSval=5149 TSecr=5144"
"4683","5.208960","10.1.0.11","10.1.0.7","TCP","984","0.042788000","-23 dBm","0.283170000,0.283170000,0.283170000,0.283170000,0.283170000,0.283170000,0.283170000,0.283170000,0.283170000,0.283170000,0.283170000,0.283170000","7013  >  49153 [ACK] Seq=1 Ack=58501 Win=131072 Len=0 TSval=4939 TSecr=4936"
"4684","5.208960","10.1.0.11","10.1.0.7","TCP","134","0.000000000","-23 dBm","0.283170000","7013  >  49153 [ACK] Seq=1 Ack=60001 Win=131072 Len=0 TSval=5139 TSecr=4936"
"4741","5.216893","10.1.0.7","10.1.0.11","TCP","6376","0.007933000","","","49153  >  7013 [ACK] Seq=64501 Ack=1 Win=131072 Len=1500 TSval=5221 TSecr=4938"
"4742","5.216893","10.1.0.7","10.1.0.11","TCP","6376","0.000000000","","","49153  >  7013 [ACK] Seq=70501 Ack=1 Win=131072 Len=1500 TSval=5221 TSecr=4938"
"4743","5.216893","10.1.0.7","10.1.0.11","TCP","6376","0.000000000","","","49153  >  7013 [ACK] Seq=76501 Ack=1 Win=131072 Len=1500 TSval=5221 TSecr=4938"
"4744","5.216893","10.1.0.7","10.1.0.11","TCP","6376","0.000000000","","","49153  >  7013 [ACK] Seq=82501 Ack=1 Win=131072 Len=1500 TSval=5221 TSecr=4938"
"4745","5.216893","10.1.0.7","10.1.0.11","TCP","6376","0.000000000","","","49153  >  7013 [ACK] Seq=88501 Ack=1 Win=131072 Len=1500 TSval=5221 TSecr=4938"
"4746","5.216893","10.1.0.7","10.1.0.11","TCP","6376","0.000000000","","","49153  >  7013 [ACK] Seq=94501 Ack=1 Win=131072 Len=1500 TSval=5221 TSecr=4939"
"4747","5.216893","10.1.0.7","10.1.0.11","TCP","6376","0.000000000","","","49153  >  7013 [ACK] Seq=100501 Ack=1 Win=131072 Len=1500 TSval=5221 TSecr=4939"
"4748","5.216893","10.1.0.7","10.1.0.11","TCP","6376","0.000000000","","","49153  >  7013 [ACK] Seq=106501 Ack=1 Win=131072 Len=1500 TSval=5221 TSecr=4939"
"4749","5.216893","10.1.0.7","10.1.0.11","TCP","1634","0.000000000","","","49153  >  7013 [ACK] Seq=108001 Ack=1 Win=131072 Len=1500 TSval=5221 TSecr=5139"
"4814","5.231543","10.1.0.7","10.1.0.11","TCP","6376","0.014650000","","","[TCP Retransmission] [TCP Retransmission] [TCP Retransmission] [TCP Retransmission] 49153  >  7013 [ACK] Seq=64501 Ack=1 Win=131072 Len=1500 TSval=5221 TSecr=4938"
"4815","5.231543","10.1.0.7","10.1.0.11","TCP","6376","0.000000000","","","[TCP Retransmission] [TCP Retransmission] [TCP Retransmission] [TCP Retransmission] 49153  >  7013 [ACK] Seq=70501 Ack=1 Win=131072 Len=1500 TSval=5221 TSecr=4938"
"4816","5.231543","10.1.0.7","10.1.0.11","TCP","6376","0.000000000","","","[TCP Retransmission] [TCP Retransmission] [TCP Retransmission] [TCP Retransmission] 49153  >  7013 [ACK] Seq=76501 Ack=1 Win=131072 Len=1500 TSval=5221 TSecr=4938"
"4817","5.231543","10.1.0.7","10.1.0.11","TCP","6376","0.000000000","","","[TCP Retransmission] [TCP Retransmission] [TCP Retransmission] [TCP Retransmission] 49153  >  7013 [ACK] Seq=82501 Ack=1 Win=131072 Len=1500 TSval=5221 TSecr=4938"
"4818","5.231543","10.1.0.7","10.1.0.11","TCP","6376","0.000000000","","","[TCP Retransmission] [TCP Retransmission] [TCP Retransmission] [TCP Retransmission] 49153  >  7013 [ACK] Seq=88501 Ack=1 Win=131072 Len=1500 TSval=5221 TSecr=4938"
"4819","5.231543","10.1.0.7","10.1.0.11","TCP","6376","0.000000000","","","[TCP Retransmission] [TCP Retransmission] [TCP Retransmission] [TCP Retransmission] 49153  >  7013 [ACK] Seq=94501 Ack=1 Win=131072 Len=1500 TSval=5221 TSecr=4939"
"4820","5.231543","10.1.0.7","10.1.0.11","TCP","6376","0.000000000","","","[TCP Retransmission] [TCP Retransmission] [TCP Retransmission] [TCP Retransmission] 49153  >  7013 [ACK] Seq=100501 Ack=1 Win=131072 Len=1500 TSval=5221 TSecr=4939"
"4821","5.231543","10.1.0.7","10.1.0.11","TCP","6376","0.000000000","","","[TCP Retransmission] [TCP Retransmission] [TCP Retransmission] [TCP Retransmission] 49153  >  7013 [ACK] Seq=106501 Ack=1 Win=131072 Len=1500 TSval=5221 TSecr=4939"
"4822","5.231543","10.1.0.7","10.1.0.11","TCP","1634","0.000000000","","","[TCP Retransmission] 49153  >  7013 [ACK] Seq=108001 Ack=1 Win=131072 Len=1500 TSval=5221 TSecr=5139"
"4900","5.243601","10.1.0.11","10.1.0.7","TCP","1288","0.012058000","-23 dBm","0.026708000,0.026708000,0.026708000,0.026708000,0.026708000,0.026708000,0.026708000,0.026708000,0.026708000,0.026708000,0.026708000,0.026708000,0.026708000,0.026708000,0.026708000,0.026708000","7013  >  49153 [ACK] Seq=1 Ack=108001 Win=131072 Len=0 TSval=5245 TSecr=5221"
"4921","5.250429","10.1.0.7","10.1.0.11","TCP","6376","0.006828000","","","49153  >  7013 [ACK] Seq=114001 Ack=1 Win=131072 Len=1500 TSval=5256 TSecr=5244"
"4922","5.250429","10.1.0.7","10.1.0.11","TCP","6376","0.000000000","","","49153  >  7013 [ACK] Seq=120001 Ack=1 Win=131072 Len=1500 TSval=5256 TSecr=5244"
"4923","5.250429","10.1.0.7","10.1.0.11","TCP","6376","0.000000000","","","49153  >  7013 [ACK] Seq=126001 Ack=1 Win=131072 Len=1500 TSval=5256 TSecr=5244"
"4924","5.250429","10.1.0.7","10.1.0.11","TCP","6376","0.000000000","","","49153  >  7013 [ACK] Seq=132001 Ack=1 Win=131072 Len=1500 TSval=5256 TSecr=5244"
"4925","5.250429","10.1.0.7","10.1.0.11","TCP","6376","0.000000000","","","49153  >  7013 [ACK] Seq=138001 Ack=1 Win=131072 Len=1500 TSval=5256 TSecr=5245"
"4926","5.250429","10.1.0.7","10.1.0.11","TCP","6376","0.000000000","","","49153  >  7013 [ACK] Seq=144001 Ack=1 Win=131072 Len=1500 TSval=5256 TSecr=5245"
"4927","5.250429","10.1.0.7","10.1.0.11","TCP","6376","0.000000000","","","49153  >  7013 [ACK] Seq=150001 Ack=1 Win=131072 Len=1500 TSval=5256 TSecr=5245"
"4928","5.250429","10.1.0.7","10.1.0.11","TCP","6376","0.000000000","","","49153  >  7013 [ACK] Seq=156001 Ack=1 Win=131072 Len=1500 TSval=5256 TSecr=5245"
"4929","5.250429","10.1.0.7","10.1.0.11","TCP","3224","0.000000000","","","49153  >  7013 [ACK] Seq=159001 Ack=1 Win=131072 Len=1500 TSval=5256 TSecr=5245"
"4932","5.252711","10.1.0.7","10.1.0.11","TCP","6376","0.002282000","","","[TCP Retransmission] [TCP Retransmission] [TCP Retransmission] [TCP Retransmission] 49153  >  7013 [ACK] Seq=114001 Ack=1 Win=131072 Len=1500 TSval=5256 TSecr=5244"
"4933","5.252711","10.1.0.7","10.1.0.11","TCP","6376","0.000000000","","","[TCP Retransmission] [TCP Retransmission] [TCP Retransmission] [TCP Retransmission] 49153  >  7013 [ACK] Seq=120001 Ack=1 Win=131072 Len=1500 TSval=5256 TSecr=5244"
"4934","5.252711","10.1.0.7","10.1.0.11","TCP","6376","0.000000000","","","[TCP Retransmission] [TCP Retransmission] [TCP Retransmission] [TCP Retransmission] 49153  >  7013 [ACK] Seq=126001 Ack=1 Win=131072 Len=1500 TSval=5256 TSecr=5244"
"4935","5.252711","10.1.0.7","10.1.0.11","TCP","6376","0.000000000","","","[TCP Retransmission] [TCP Retransmission] [TCP Retransmission] [TCP Retransmission] 49153  >  7013 [ACK] Seq=132001 Ack=1 Win=131072 Len=1500 TSval=5256 TSecr=5244"
"4936","5.252711","10.1.0.7","10.1.0.11","TCP","6376","0.000000000","","","[TCP Retransmission] [TCP Retransmission] [TCP Retransmission] [TCP Retransmission] 49153  >  7013 [ACK] Seq=138001 Ack=1 Win=131072 Len=1500 TSval=5256 TSecr=5245"
"4937","5.252711","10.1.0.7","10.1.0.11","TCP","6376","0.000000000","","","[TCP Retransmission] [TCP Retransmission] [TCP Retransmission] [TCP Retransmission] 49153  >  7013 [ACK] Seq=144001 Ack=1 Win=131072 Len=1500 TSval=5256 TSecr=5245"
"4938","5.252711","10.1.0.7","10.1.0.11","TCP","6376","0.000000000","","","[TCP Retransmission] [TCP Retransmission] [TCP Retransmission] [TCP Retransmission] 49153  >  7013 [ACK] Seq=150001 Ack=1 Win=131072 Len=1500 TSval=5256 TSecr=5245"
"4939","5.252711","10.1.0.7","10.1.0.11","TCP","6376","0.000000000","","","[TCP Retransmission] [TCP Retransmission] [TCP Retransmission] [TCP Retransmission] 49153  >  7013 [ACK] Seq=156001 Ack=1 Win=131072 Len=1500 TSval=5256 TSecr=5245"
"4940","5.252711","10.1.0.7","10.1.0.11","TCP","3224","0.000000000","","","[TCP Retransmission] [TCP Retransmission] 49153  >  7013 [ACK] Seq=159001 Ack=1 Win=131072 Len=1500 TSval=5256 TSecr=5245"
"5053","5.276381","10.1.0.7","10.1.0.11","TCP","1744","0.023670000","","","7012  >  49159 [ACK] Seq=1 Ack=336001 Win=131072 Len=0 TSval=5149 TSecr=5144"
"5169","5.293423","10.1.0.7","10.1.0.11","TCP","1744","0.017042000","","","7012  >  49159 [ACK] Seq=1 Ack=336001 Win=131072 Len=0 TSval=5149 TSecr=5144"
"5172","5.296009","10.1.0.11","10.1.0.7","TCP","6376","0.002586000","-23 dBm","","49159  >  7012 [ACK] Seq=341501 Ack=1 Win=131072 Len=1500 TSval=5306 TSecr=5145"
"5173","5.296009","10.1.0.11","10.1.0.7","TCP","6376","0.000000000","-23 dBm","","49159  >  7012 [ACK] Seq=347501 Ack=1 Win=131072 Len=1500 TSval=5306 TSecr=5146"
"5174","5.296009","10.1.0.11","10.1.0.7","TCP","6376","0.000000000","-23 dBm","","49159  >  7012 [ACK] Seq=353501 Ack=1 Win=131072 Len=1500 TSval=5306 TSecr=5146"
"5175","5.296009","10.1.0.11","10.1.0.7","TCP","6376","0.000000000","-23 dBm","","49159  >  7012 [ACK] Seq=359501 Ack=1 Win=131072 Len=1500 TSval=5306 TSecr=5146"
"5176","5.296009","10.1.0.11","10.1.0.7","TCP","6376","0.000000000","-23 dBm","","49159  >  7012 [ACK] Seq=365501 Ack=1 Win=131072 Len=1500 TSval=5306 TSecr=5146"
"5177","5.296009","10.1.0.11","10.1.0.7","TCP","6376","0.000000000","-23 dBm","","49159  >  7012 [ACK] Seq=371501 Ack=1 Win=131072 Len=1500 TSval=5306 TSecr=5146"
"5178","5.296009","10.1.0.11","10.1.0.7","TCP","6376","0.000000000","-23 dBm","","49159  >  7012 [ACK] Seq=377501 Ack=1 Win=131072 Len=1500 TSval=5306 TSecr=5147"
"5179","5.296009","10.1.0.11","10.1.0.7","TCP","6376","0.000000000","-23 dBm","","49159  >  7012 [ACK] Seq=383501 Ack=1 Win=131072 Len=1500 TSval=5306 TSecr=5147"
"5180","5.296009","10.1.0.11","10.1.0.7","TCP","6376","0.000000000","-23 dBm","","49159  >  7012 [ACK] Seq=389501 Ack=1 Win=131072 Len=1500 TSval=5306 TSecr=5147"
"5181","5.296009","10.1.0.11","10.1.0.7","TCP","6376","0.000000000","-23 dBm","","49159  >  7012 [ACK] Seq=395501 Ack=1 Win=131072 Len=1500 TSval=5306 TSecr=5147"
"5182","5.296009","10.1.0.11","10.1.0.7","TCP","6376","0.000000000","-23 dBm","","49159  >  7012 [ACK] Seq=401501 Ack=1 Win=131072 Len=1500 TSval=5306 TSecr=5149"
"5206","5.297916","10.1.0.7","10.1.0.11","TCP","1744","0.001907000","","0.001907000,0.001907000,0.001907000,0.001907000,0.001907000,0.001907000,0.001907000,0.001907000,0.001907000,0.001907000,0.001907000,0.001907000,0.001907000,0.001907000,0.001907000,0.001907000,0.001907000,0.001907000,0.001907000,0.001907000,0.001907000,0.001907000","7012  >  49159 [ACK] Seq=1 Ack=401501 Win=131072 Len=0 TSval=5308 TSecr=5306"
"5323","5.309369","10.1.0.11","10.1.0.7","TCP","1364","0.011453000","-23 dBm","0.058940000,0.058940000,0.058940000,0.058940000,0.058940000,0.058940000,0.058940000,0.058940000,0.058940000,0.058940000,0.058940000,0.058940000,0.058940000,0.058940000,0.058940000,0.058940000,0.058940000","7013  >  49153 [ACK] Seq=1 Ack=159001 Win=131072 Len=0 TSval=5267 TSecr=5256"
"5371","5.319801","10.1.0.7","10.1.0.11","TCP","6376","0.010432000","","","49153  >  7013 [ACK] Seq=165001 Ack=1 Win=131072 Len=1500 TSval=5321 TSecr=5265"
"5372","5.319801","10.1.0.7","10.1.0.11","TCP","6376","0.000000000","","","49153  >  7013 [ACK] Seq=171001 Ack=1 Win=131072 Len=1500 TSval=5321 TSecr=5265"
"5373","5.319801","10.1.0.7","10.1.0.11","TCP","6376","0.000000000","","","49153  >  7013 [ACK] Seq=177001 Ack=1 Win=131072 Len=1500 TSval=5321 TSecr=5265"
"5374","5.319801","10.1.0.7","10.1.0.11","TCP","6376","0.000000000","","","49153  >  7013 [ACK] Seq=183001 Ack=1 Win=131072 Len=1500 TSval=5321 TSecr=5266"
"5375","5.319801","10.1.0.7","10.1.0.11","TCP","6376","0.000000000","","","49153  >  7013 [ACK] Seq=189001 Ack=1 Win=131072 Len=1500 TSval=5321 TSecr=5266"
"5376","5.319801","10.1.0.7","10.1.0.11","TCP","6376","0.000000000","","","49153  >  7013 [ACK] Seq=195001 Ack=1 Win=131072 Len=1500 TSval=5321 TSecr=5266"
"5377","5.319801","10.1.0.7","10.1.0.11","TCP","6376","0.000000000","","","49153  >  7013 [ACK] Seq=201001 Ack=1 Win=131072 Len=1500 TSval=5321 TSecr=5266"
"5378","5.319801","10.1.0.7","10.1.0.11","TCP","6376","0.000000000","","","49153  >  7013 [ACK] Seq=207001 Ack=1 Win=131072 Len=1500 TSval=5321 TSecr=5266"
"5379","5.319801","10.1.0.7","10.1.0.11","TCP","6376","0.000000000","","","49153  >  7013 [ACK] Seq=213001 Ack=1 Win=131072 Len=1500 TSval=5321 TSecr=5267"
"5452","5.331971","10.1.0.7","10.1.0.11","TCP","6376","0.012170000","","","[TCP Retransmission] [TCP Retransmission] [TCP Retransmission] [TCP Retransmission] 49153  >  7013 [ACK] Seq=165001 Ack=1 Win=131072 Len=1500 TSval=5321 TSecr=5265"
"5453","5.331971","10.1.0.7","10.1.0.11","TCP","6376","0.000000000","","","[TCP Retransmission] [TCP Retransmission] [TCP Retransmission] [TCP Retransmission] 49153  >  7013 [ACK] Seq=171001 Ack=1 Win=131072 Len=1500 TSval=5321 TSecr=5265"
"5454","5.331971","10.1.0.7","10.1.0.11","TCP","6376","0.000000000","","","[TCP Retransmission] [TCP Retransmission] [TCP Retransmission] [TCP Retransmission] 49153  >  7013 [ACK] Seq=177001 Ack=1 Win=131072 Len=1500 TSval=5321 TSecr=5265"
"5455","5.331971","10.1.0.7","10.1.0.11","TCP","6376","0.000000000","","","[TCP Retransmission] [TCP Retransmission] [TCP Retransmission] [TCP Retransmission] 49153  >  7013 [ACK] Seq=183001 Ack=1 Win=131072 Len=1500 TSval=5321 TSecr=5266"
"5456","5.331971","10.1.0.7","10.1.0.11","TCP","6376","0.000000000","","","[TCP Retransmission] [TCP Retransmission] [TCP Retransmission] [TCP Retransmission] 49153  >  7013 [ACK] Seq=189001 Ack=1 Win=131072 Len=1500 TSval=5321 TSecr=5266"
"5457","5.331971","10.1.0.7","10.1.0.11","TCP","6376","0.000000000","","","[TCP Retransmission] [TCP Retransmission] [TCP Retransmission] [TCP Retransmission] 49153  >  7013 [ACK] Seq=195001 Ack=1 Win=131072 Len=1500 TSval=5321 TSecr=5266"
"5458","5.331971","10.1.0.7","10.1.0.11","TCP","6376","0.000000000","","","[TCP Retransmission] [TCP Retransmission] [TCP Retransmission] [TCP Retransmission] 49153  >  7013 [ACK] Seq=201001 Ack=1 Win=131072 Len=1500 TSval=5321 TSecr=5266"
"5459","5.331971","10.1.0.7","10.1.0.11","TCP","6376","0.000000000","","","[TCP Retransmission] [TCP Retransmission] [TCP Retransmission] [TCP Retransmission] 49153  >  7013 [ACK] Seq=207001 Ack=1 Win=131072 Len=1500 TSval=5321 TSecr=5266"
"5460","5.331971","10.1.0.7","10.1.0.11","TCP","6376","0.000000000","","","[TCP Retransmission] [TCP Retransmission] [TCP Retransmission] [TCP Retransmission] 49153  >  7013 [ACK] Seq=213001 Ack=1 Win=131072 Len=1500 TSval=5321 TSecr=5267"
"5503","5.339223","10.1.0.7","10.1.0.11","TCP","1744","0.007252000","","","7012  >  49159 [ACK] Seq=1 Ack=401501 Win=131072 Len=0 TSval=5308 TSecr=5306"
"5624","5.358137","10.1.0.11","10.1.0.7","TCP","1440","0.018914000","-23 dBm","0.038336000,0.038336000,0.038336000,0.038336000,0.038336000,0.038336000,0.038336000,0.038336000,0.038336000,0.038336000,0.038336000,0.038336000,0.038336000,0.038336000,0.038336000,0.038336000,0.038336000,0.038336000","7013  >  49153 [ACK] Seq=1 Ack=213001 Win=131072 Len=0 TSval=5346 TSecr=5321"
"5639","5.359276","10.1.0.7","10.1.0.11","TCP","6376","0.001139000","","","49153  >  7013 [ACK] Seq=219001 Ack=1 Win=131072 Len=1500 TSval=5370 TSecr=5344"
"5640","5.359276","10.1.0.7","10.1.0.11","TCP","6376","0.000000000","","","49153  >  7013 [ACK] Seq=225001 Ack=1 Win=131072 Len=1500 TSval=5370 TSecr=5344"
"5641","5.359276","10.1.0.7","10.1.0.11","TCP","6376","0.000000000","","","49153  >  7013 [ACK] Seq=231001 Ack=1 Win=131072 Len=1500 TSval=5370 TSecr=5345"
"5642","5.359276","10.1.0.7","10.1.0.11","TCP","6376","0.000000000","","","49153  >  7013 [ACK] Seq=237001 Ack=1 Win=131072 Len=1500 TSval=5370 TSecr=5345"
"5643","5.359276","10.1.0.7","10.1.0.11","TCP","6376","0.000000000","","","49153  >  7013 [ACK] Seq=243001 Ack=1 Win=131072 Len=1500 TSval=5370 TSecr=5345"
"5644","5.359276","10.1.0.7","10.1.0.11","TCP","6376","0.000000000","","","49153  >  7013 [ACK] Seq=249001 Ack=1 Win=131072 Len=1500 TSval=5370 TSecr=5345"
"5645","5.359276","10.1.0.7","10.1.0.11","TCP","6376","0.000000000","","","49153  >  7013 [ACK] Seq=255001 Ack=1 Win=131072 Len=1500 TSval=5370 TSecr=5345"
"5646","5.359276","10.1.0.7","10.1.0.11","TCP","6376","0.000000000","","","49153  >  7013 [ACK] Seq=261001 Ack=1 Win=131072 Len=1500 TSval=5370 TSecr=5346"
"5647","5.359276","10.1.0.7","10.1.0.11","TCP","6376","0.000000000","","","49153  >  7013 [ACK] Seq=267001 Ack=1 Win=131072 Len=1500 TSval=5370 TSecr=5346"
"5648","5.359276","10.1.0.7","10.1.0.11","TCP","1634","0.000000000","","","49153  >  7013 [ACK] Seq=268501 Ack=1 Win=131072 Len=1500 TSval=5370 TSecr=5346"
"5780","5.392446","10.1.0.7","10.1.0.11","TCP","6376","0.033170000","","","[TCP Retransmission] [TCP Retransmission] [TCP Retransmission] [TCP Retransmission] 49153  >  7013 [ACK] Seq=219001 Ack=1 Win=131072 Len=1500 TSval=5370 TSecr=5344"
"5781","5.392446","10.1.0.7","10.1.0.11","TCP","6376","0.000000000","","","[TCP Retransmission] [TCP Retransmission] [TCP Retransmission] [TCP Retransmission] 49153  >  7013 [ACK] Seq=225001 Ack=1 Win=131072 Len=1500 TSval=5370 TSecr=5344"
"5782","5.392446","10.1.0.7","10.1.0.11","TCP","6376","0.000000000","","","[TCP Retransmission] [TCP Retransmission] [TCP Retransmission] [TCP Retransmission] 49153  >  7013 [ACK] Seq=231001 Ack=1 Win=131072 Len=1500 TSval=5370 TSecr=5345"
"5783","5.392446","10.1.0.7","10.1.0.11","TCP","6376","0.000000000","","","[TCP Retransmission] [TCP Retransmission] [TCP Retransmission] [TCP Retransmission] 49153  >  7013 [ACK] Seq=237001 Ack=1 Win=131072 Len=1500 TSval=5370 TSecr=5345"
"5784","5.392446","10.1.0.7","10.1.0.11","TCP","6376","0.000000000","","","[TCP Retransmission] [TCP Retransmission] [TCP Retransmission] [TCP Retransmission] 49153  >  7013 [ACK] Seq=243001 Ack=1 Win=131072 Len=1500 TSval=5370 TSecr=5345"
"5785","5.392446","10.1.0.7","10.1.0.11","TCP","6376","0.000000000","","","[TCP Retransmission] [TCP Retransmission] [TCP Retransmission] [TCP Retransmission] 49153  >  7013 [ACK] Seq=249001 Ack=1 Win=131072 Len=1500 TSval=5370 TSecr=5345"
"5786","5.392446","10.1.0.7","10.1.0.11","TCP","6376","0.000000000","","","[TCP Retransmission] [TCP Retransmission] [TCP Retransmission] [TCP Retransmission] 49153  >  7013 [ACK] Seq=255001 Ack=1 Win=131072 Len=1500 TSval=5370 TSecr=5345"
"5787","5.392446","10.1.0.7","10.1.0.11","TCP","6376","0.000000000","","","[TCP Retransmission] [TCP Retransmission] [TCP Retransmission] [TCP Retransmission] 49153  >  7013 [ACK] Seq=261001 Ack=1 Win=131072 Len=1500 TSval=5370 TSecr=5346"
"5788","5.392446","10.1.0.7","10.1.0.11","TCP","6376","0.000000000","","","[TCP Retransmission] [TCP Retransmission] [TCP Retransmission] [TCP Retransmission] 49153  >  7013 [ACK] Seq=267001 Ack=1 Win=131072 Len=1500 TSval=5370 TSecr=5346"
"5789","5.392446","10.1.0.7","10.1.0.11","TCP","1634","0.000000000","","","[TCP Retransmission] 49153  >  7013 [ACK] Seq=268501 Ack=1 Win=131072 Len=1500 TSval=5370 TSecr=5346"
"5816","5.396999","10.1.0.11","10.1.0.7","TCP","1516","0.004553000","-23 dBm","0.037723000,0.037723000,0.037723000,0.037723000,0.037723000,0.037723000,0.037723000,0.037723000,0.037723000,0.037723000,0.037723000,0.037723000,0.037723000,0.037723000,0.037723000,0.037723000,0.037723000,0.037723000,0.037723000","7013  >  49153 [ACK] Seq=1 Ack=270001 Win=131072 Len=0 TSval=5406 TSecr=5370"
"5819","5.397145","10.1.0.7","10.1.0.11","TCP","6376","0.000146000","","","49153  >  7013 [ACK] Seq=274501 Ack=1 Win=131072 Len=1500 TSval=5409 TSecr=5405"
"5820","5.397145","10.1.0.7","10.1.0.11","TCP","6376","0.000000000","","","49153  >  7013 [ACK] Seq=280501 Ack=1 Win=131072 Len=1500 TSval=5409 TSecr=5405"
"5821","5.397145","10.1.0.7","10.1.0.11","TCP","6376","0.000000000","","","49153  >  7013 [ACK] Seq=286501 Ack=1 Win=131072 Len=1500 TSval=5409 TSecr=5405"
"5822","5.397145","10.1.0.7","10.1.0.11","TCP","6376","0.000000000","","","49153  >  7013 [ACK] Seq=292501 Ack=1 Win=131072 Len=1500 TSval=5409 TSecr=5405"
"5823","5.397145","10.1.0.7","10.1.0.11","TCP","6376","0.000000000","","","49153  >  7013 [ACK] Seq=298501 Ack=1 Win=131072 Len=1500 TSval=5409 TSecr=5406"
"5824","5.397145","10.1.0.7","10.1.0.11","TCP","6376","0.000000000","","","49153  >  7013 [ACK] Seq=304501 Ack=1 Win=131072 Len=1500 TSval=5409 TSecr=5406"
"5825","5.397145","10.1.0.7","10.1.0.11","TCP","6376","0.000000000","","","49153  >  7013 [ACK] Seq=310501 Ack=1 Win=131072 Len=1500 TSval=5409 TSecr=5406"
"5826","5.397145","10.1.0.7","10.1.0.11","TCP","6376","0.000000000","","","49153  >  7013 [ACK] Seq=316501 Ack=1 Win=131072 Len=1500 TSval=5409 TSecr=5406"
"5827","5.397145","10.1.0.7","10.1.0.11","TCP","6376","0.000000000","","","49153  >  7013 [ACK] Seq=322501 Ack=1 Win=131072 Len=1500 TSval=5409 TSecr=5406"
"5828","5.397145","10.1.0.7","10.1.0.11","TCP","6376","0.000000000","","","49153  >  7013 [ACK] Seq=328501 Ack=1 Win=131072 Len=1500 TSval=5409 TSecr=5406"
"6034","5.436276","10.1.0.7","10.1.0.11","TCP","6376","0.039131000","","","[TCP Retransmission] [TCP Retransmission] [TCP Retransmission] [TCP Retransmission] 49153  >  7013 [ACK] Seq=274501 Ack=1 Win=131072 Len=1500 TSval=5409 TSecr=5405"
"6035","5.436276","10.1.0.7","10.1.0.11","TCP","6376","0.000000000","","","[TCP Retransmission] [TCP Retransmission] [TCP Retransmission] [TCP Retransmission] 49153  >  7013 [ACK] Seq=280501 Ack=1 Win=131072 Len=1500 TSval=5409 TSecr=5405"
"6036","5.436276","10.1.0.7","10.1.0.11","TCP","6376","0.000000000","","","[TCP Retransmission] [TCP Retransmission] [TCP Retransmission] [TCP Retransmission] 49153  >  7013 [ACK] Seq=286501 Ack=1 Win=131072 Len=1500 TSval=5409 TSecr=5405"
"6037","5.436276","10.1.0.7","10.1.0.11","TCP","6376","0.000000000","","","[TCP Retransmission] [TCP Retransmission] [TCP Retransmission] [TCP Retransmission] 49153  >  7013 [ACK] Seq=292501 Ack=1 Win=131072 Len=1500 TSval=5409 TSecr=5405"
"6038","5.436276","10.1.0.7","10.1.0.11","TCP","6376","0.000000000","","","[TCP Retransmission] [TCP Retransmission] [TCP Retransmission] [TCP Retransmission] 49153  >  7013 [ACK] Seq=298501 Ack=1 Win=131072 Len=1500 TSval=5409 TSecr=5406"
