"No.","Time","Source","Destination","Protocol","Length","Time delta from previous displayed frame","Signal strength (dBm)","The RTT to ACK the segment was","Info"
"688","3.337806","10.1.0.11","10.1.0.7","TCP","138","0.000000000","","","49159  >  7012 [SYN] Seq=0 Win=65535 Len=0 TSval=3350 TSecr=0 WS=4 SACK_PERM=1"
"689","3.337981","10.1.0.11","10.1.0.7","TCP","138","0.000175000","","","[TCP Out-Of-Order] [TCP Port numbers reused] 49159  >  7012 [SYN] Seq=0 Win=65535 Len=0 TSval=3350 TSecr=0 WS=4 SACK_PERM=1"
"692","3.338256","10.1.0.7","10.1.0.11","TCP","138","0.000275000","-29 dBm","0.000450000","7012  >  49159 [SYN, ACK] Seq=0 Ack=1 Win=65535 Len=0 TSval=3350 TSecr=3350 WS=4 SACK_PERM=1"
"695","3.338411","10.1.0.11","10.1.0.7","TCP","134","0.000155000","","0.000155000","49159  >  7012 [ACK] Seq=1 Ack=1 Win=131072 Len=0 TSval=3350 TSecr=3350"
"704","3.339207","10.1.0.7","10.1.0.11","TCP","138","0.000796000","-29 dBm","","49153  >  7013 [SYN] Seq=0 Win=65535 Len=0 TSval=3350 TSecr=0 WS=4 SACK_PERM=1"
"707","3.339362","10.1.0.11","10.1.0.7","TCP","138","0.000155000","","0.000155000","7013  >  49153 [SYN, ACK] Seq=0 Ack=1 Win=65535 Len=0 TSval=3351 TSecr=3350 WS=4 SACK_PERM=1"
"710","3.339628","10.1.0.7","10.1.0.11","TCP","134","0.000266000","-29 dBm","0.000266000","49153  >  7013 [ACK] Seq=1 Ack=1 Win=131072 Len=0 TSval=3351 TSecr=3351"
"1026","4.839477","10.1.0.11","10.1.0.7","TCP","1134","1.499849000","","","49159  >  7012 [ACK] Seq=1 Ack=1 Win=131072 Len=1000 TSval=4851 TSecr=3350"
"1040","4.840541","10.1.0.11","10.1.0.7","TCP","1134","0.001064000","","","49159  >  7012 [ACK] Seq=1001 Ack=1 Win=131072 Len=1000 TSval=4852 TSecr=3350"
"1060","4.842317","10.1.0.11","10.1.0.7","TCP","3300","0.001776000","","","49159  >  7012 [ACK] Seq=4001 Ack=1 Win=131072 Len=1000 TSval=4854 TSecr=3350"
"1080","4.844285","10.1.0.11","10.1.0.7","TCP","2224","0.001968000","","","49159  >  7012 [ACK] Seq=6001 Ack=1 Win=131072 Len=1000 TSval=4856 TSecr=3350"
"1082","4.844763","10.1.0.7","10.1.0.11","TCP","6528","0.000478000","-29 dBm","","49153  >  7013 [ACK] Seq=5001 Ack=1 Win=131072 Len=1000 TSval=4856 TSecr=3351"
"1107","4.848021","10.1.0.11","10.1.0.7","TCP","5452","0.003258000","","","49159  >  7012 [ACK] Seq=11001 Ack=1 Win=131072 Len=1000 TSval=4860 TSecr=3350"
"1127","4.850294","10.1.0.11","10.1.0.7","TCP","3300","0.002273000","","","49159  >  7012 [ACK] Seq=14001 Ack=1 Win=131072 Len=1000 TSval=4862 TSecr=3350"
"1135","4.851153","10.1.0.11","10.1.0.7","TCP","300","0.000859000","","0.006390000,0.006390000,0.006390000","7013  >  49153 [ACK] Seq=1 Ack=5001 Win=131072 Len=0 TSval=4856 TSecr=4854"
"1151","4.854675","10.1.0.7","10.1.0.11","TCP","6528","0.003522000","-29 dBm","","49153  >  7013 [ACK] Seq=11001 Ack=1 Win=131072 Len=1000 TSval=4861 TSecr=3351"
"1152","4.854675","10.1.0.7","10.1.0.11","TCP","6528","0.000000000","-29 dBm","","49153  >  7013 [ACK] Seq=17001 Ack=1 Win=131072 Len=1000 TSval=4866 TSecr=4856"
"1154","4.854831","10.1.0.7","10.1.0.11","TCP","1134","0.000156000","-29 dBm","","49153  >  7013 [ACK] Seq=18001 Ack=1 Win=131072 Len=1000 TSval=4866 TSecr=4856"
"1164","4.857207","10.1.0.7","10.1.0.11","TCP","3300","0.002376000","-29 dBm","","49153  >  7013 [ACK] Seq=21001 Ack=1 Win=131072 Len=1000 TSval=4869 TSecr=4856"
"1183","4.859560","10.1.0.7","10.1.0.11","TCP","2224","0.002353000","-29 dBm","","49153  >  7013 [ACK] Seq=23001 Ack=1 Win=131072 Len=1000 TSval=4870 TSecr=4856"
"1242","4.865939","10.1.0.7","10.1.0.11","TCP","680","0.006379000","-29 dBm","0.026462000,0.023622000,0.023622000,0.021654000,0.017918000,0.017918000,0.015645000,0.015645000","7012  >  49159 [ACK] Seq=1 Ack=15001 Win=131072 Len=0 TSval=4862 TSecr=4861"
"1248","4.866316","10.1.0.11","10.1.0.7","TCP","6376","0.000377000","","","49159  >  7012 [ACK] Seq=19501 Ack=1 Win=131072 Len=1500 TSval=4878 TSecr=4854"
"1249","4.866316","10.1.0.11","10.1.0.7","TCP","6376","0.000000000","","","49159  >  7012 [ACK] Seq=25501 Ack=1 Win=131072 Len=1500 TSval=4878 TSecr=4856"
"1250","4.866316","10.1.0.11","10.1.0.7","TCP","7452","0.000000000","","","49159  >  7012 [ACK] Seq=33001 Ack=1 Win=131072 Len=1000 TSval=4878 TSecr=4860"
"1251","4.866316","10.1.0.11","10.1.0.7","TCP","1134","0.000000000","","","49159  >  7012 [ACK] Seq=34001 Ack=1 Win=131072 Len=1000 TSval=4878 TSecr=4862"
"1260","4.868188","10.1.0.11","10.1.0.7","TCP","2224","0.001872000","","","49159  >  7012 [ACK] Seq=36001 Ack=1 Win=131072 Len=1000 TSval=4880 TSecr=4862"
"1268","4.869115","10.1.0.11","10.1.0.7","TCP","1134","0.000927000","","","49159  >  7012 [ACK] Seq=37001 Ack=1 Win=131072 Len=1000 TSval=4880 TSecr=4862"
"1278","4.870007","10.1.0.11","10.1.0.7","TCP","1134","0.000892000","","","49159  >  7012 [ACK] Seq=38001 Ack=1 Win=131072 Len=1000 TSval=4881 TSecr=4862"
"1284","4.870463","10.1.0.11","10.1.0.7","TCP","1134","0.000456000","","","49159  >  7012 [ACK] Seq=39001 Ack=1 Win=131072 Len=1000 TSval=4882 TSecr=4862"
"1315","4.873366","10.1.0.11","10.1.0.7","TCP","3300","0.002903000","","","49159  >  7012 [ACK] Seq=42001 Ack=1 Win=131072 Len=1000 TSval=4884 TSecr=4862"
"1327","4.875130","10.1.0.11","10.1.0.7","TCP","2224","0.001764000","","","49159  >  7012 [ACK] Seq=44001 Ack=1 Win=131072 Len=1000 TSval=4886 TSecr=4862"
"1870","4.923810","10.1.0.11","10.1.0.7","TCP","756","0.048680000","","0.069135000,0.069135000,0.069135000,0.069135000,0.069135000,0.069135000,0.068979000,0.066603000,0.064250000","7013  >  49153 [ACK] Seq=1 Ack=23001 Win=131072 Len=0 TSval=4871 TSecr=4869"
"1889","4.927394","10.1.0.7","10.1.0.11","TCP","6376","0.003584000","-29 dBm","","49153  >  7013 [ACK] Seq=28501 Ack=1 Win=131072 Len=1500 TSval=4936 TSecr=4866"
"1890","4.927394","10.1.0.7","10.1.0.11","TCP","6376","0.000000000","-29 dBm","","49153  >  7013 [ACK] Seq=34501 Ack=1 Win=131072 Len=1500 TSval=4936 TSecr=4866"
"1891","4.927394","10.1.0.7","10.1.0.11","TCP","6376","0.000000000","-29 dBm","","49153  >  7013 [ACK] Seq=40501 Ack=1 Win=131072 Len=1500 TSval=4936 TSecr=4866"
"1892","4.927394","10.1.0.7","10.1.0.11","TCP","6376","0.000000000","-29 dBm","","49153  >  7013 [ACK] Seq=46501 Ack=1 Win=131072 Len=1500 TSval=4936 TSecr=4866"
"1893","4.927394","10.1.0.7","10.1.0.11","TCP","6376","0.000000000","-29 dBm","","49153  >  7013 [ACK] Seq=52501 Ack=1 Win=131072 Len=1500 TSval=4936 TSecr=4869"
"1894","4.927394","10.1.0.7","10.1.0.11","TCP","6376","0.000000000","-29 dBm","","49153  >  7013 [ACK] Seq=58501 Ack=1 Win=131072 Len=1500 TSval=4936 TSecr=4871"
"2242","4.976215","10.1.0.7","10.1.0.11","TCP","680","0.048821000","-29 dBm","0.109899000,0.109899000,0.109899000,0.109899000,0.109899000,0.109899000,0.109899000,0.108027000","7012  >  49159 [ACK] Seq=1 Ack=37001 Win=131072 Len=0 TSval=4880 TSecr=4879"
"2243","4.976215","10.1.0.7","10.1.0.11","TCP","376","0.000000000","-29 dBm","0.106208000,0.102849000,0.102849000,0.101085000","7012  >  49159 [ACK] Seq=1 Ack=45001 Win=131072 Len=0 TSval=4887 TSecr=4885"
"2258","4.977601","10.1.0.11","10.1.0.7","TCP","6376","0.001386000","","","49159  >  7012 [ACK] Seq=49501 Ack=1 Win=131072 Len=1500 TSval=4988 TSecr=4878"
"2259","4.977601","10.1.0.11","10.1.0.7","TCP","6376","0.000000000","","","49159  >  7012 [ACK] Seq=55501 Ack=1 Win=131072 Len=1500 TSval=4988 TSecr=4878"
"2260","4.977601","10.1.0.11","10.1.0.7","TCP","6376","0.000000000","","","49159  >  7012 [ACK] Seq=61501 Ack=1 Win=131072 Len=1500 TSval=4988 TSecr=4878"
"2261","4.977601","10.1.0.11","10.1.0.7","TCP","6376","0.000000000","","","49159  >  7012 [ACK] Seq=67501 Ack=1 Win=131072 Len=1500 TSval=4988 TSecr=4878"
"2262","4.977601","10.1.0.11","10.1.0.7","TCP","6376","0.000000000","","","49159  >  7012 [ACK] Seq=73501 Ack=1 Win=131072 Len=1500 TSval=4988 TSecr=4879"
"2263","4.977601","10.1.0.11","10.1.0.7","TCP","6376","0.000000000","","","49159  >  7012 [ACK] Seq=79501 Ack=1 Win=131072 Len=1500 TSval=4988 TSecr=4879"
"2264","4.977601","10.1.0.11","10.1.0.7","TCP","6376","0.000000000","","","49159  >  7012 [ACK] Seq=85501 Ack=1 Win=131072 Len=1500 TSval=4988 TSecr=4880"
"2265","4.977601","10.1.0.11","10.1.0.7","TCP","6376","0.000000000","","","49159  >  7012 [ACK] Seq=91501 Ack=1 Win=131072 Len=1500 TSval=4988 TSecr=4882"
"2266","4.977601","10.1.0.11","10.1.0.7","TCP","6376","0.000000000","","","49159  >  7012 [ACK] Seq=97501 Ack=1 Win=131072 Len=1500 TSval=4988 TSecr=4887"
"2316","4.983861","10.1.0.11","10.1.0.7","TCP","984","0.006260000","","0.056467000,0.056467000,0.056467000,0.056467000,0.056467000,0.056467000,0.056467000,0.056467000,0.056467000,0.056467000,0.056467000,0.056467000","7013  >  49153 [ACK] Seq=1 Ack=58501 Win=131072 Len=0 TSval=4939 TSecr=4936"
"2318","4.984357","10.1.0.7","10.1.0.11","TCP","1440","0.000496000","-29 dBm","0.006756000,0.006756000,0.006756000,0.006756000,0.006756000,0.006756000,0.006756000,0.006756000,0.006756000,0.006756000,0.006756000,0.006756000,0.006756000,0.006756000,0.006756000,0.006756000,0.006756000,0.006756000","7012  >  49159 [ACK] Seq=1 Ack=99001 Win=131072 Len=0 TSval=4991 TSecr=4988"
"2329","4.985229","10.1.0.11","10.1.0.7","TCP","6376","0.000872000","","","49159  >  7012 [ACK] Seq=103501 Ack=1 Win=131072 Len=1500 TSval=4996 TSecr=4990"
"2330","4.985229","10.1.0.11","10.1.0.7","TCP","6376","0.000000000","","","49159  >  7012 [ACK] Seq=109501 Ack=1 Win=131072 Len=1500 TSval=4996 TSecr=4990"
"2331","4.985229","10.1.0.11","10.1.0.7","TCP","6376","0.000000000","","","49159  >  7012 [ACK] Seq=115501 Ack=1 Win=131072 Len=1500 TSval=4996 TSecr=4990"
"2332","4.985229","10.1.0.11","10.1.0.7","TCP","6376","0.000000000","","","49159  >  7012 [ACK] Seq=121501 Ack=1 Win=131072 Len=1500 TSval=4996 TSecr=4990"
"2333","4.985229","10.1.0.11","10.1.0.7","TCP","6376","0.000000000","","","49159  >  7012 [ACK] Seq=127501 Ack=1 Win=131072 Len=1500 TSval=4996 TSecr=4990"
"2334","4.985229","10.1.0.11","10.1.0.7","TCP","6376","0.000000000","","","49159  >  7012 [ACK] Seq=133501 Ack=1 Win=131072 Len=1500 TSval=4996 TSecr=4991"
"2335","4.985229","10.1.0.11","10.1.0.7","TCP","6376","0.000000000","","","49159  >  7012 [ACK] Seq=139501 Ack=1 Win=131072 Len=1500 TSval=4996 TSecr=4991"
"2336","4.985229","10.1.0.11","10.1.0.7","TCP","6376","0.000000000","","","49159  >  7012 [ACK] Seq=145501 Ack=1 Win=131072 Len=1500 TSval=4996 TSecr=4991"
"2337","4.985229","10.1.0.11","10.1.0.7","TCP","6376","0.000000000","","","49159  >  7012 [ACK] Seq=151501 Ack=1 Win=131072 Len=1500 TSval=4996 TSecr=4991"
"2338","4.985229","10.1.0.11","10.1.0.7","TCP","3224","0.000000000","","","49159  >  7012 [ACK] Seq=154501 Ack=1 Win=131072 Len=1500 TSval=4996 TSecr=4991"
"2980","5.049004","10.1.0.7","10.1.0.11","TCP","1516","0.063775000","-29 dBm","0.063775000,0.063775000,0.063775000,0.063775000,0.063775000,0.063775000,0.063775000,0.063775000,0.063775000,0.063775000,0.063775000,0.063775000,0.063775000,0.063775000,0.063775000,0.063775000,0.063775000,0.063775000,0.063775000","7012  >  49159 [ACK] Seq=1 Ack=156001 Win=131072 Len=0 TSval=4999 TSecr=4996"
"2994","5.050282","10.1.0.11","10.1.0.7","TCP","6376","0.001278000","","","49159  >  7012 [ACK] Seq=160501 Ack=1 Win=131072 Len=1500 TSval=5061 TSecr=4997"
"2995","5.050282","10.1.0.11","10.1.0.7","TCP","6376","0.000000000","","","49159  >  7012 [ACK] Seq=166501 Ack=1 Win=131072 Len=1500 TSval=5061 TSecr=4997"
"2996","5.050282","10.1.0.11","10.1.0.7","TCP","6376","0.000000000","","","49159  >  7012 [ACK] Seq=172501 Ack=1 Win=131072 Len=1500 TSval=5061 TSecr=4998"
"2997","5.050282","10.1.0.11","10.1.0.7","TCP","6376","0.000000000","","","49159  >  7012 [ACK] Seq=178501 Ack=1 Win=131072 Len=1500 TSval=5061 TSecr=4998"
"2998","5.050282","10.1.0.11","10.1.0.7","TCP","6376","0.000000000","","","49159  >  7012 [ACK] Seq=184501 Ack=1 Win=131072 Len=1500 TSval=5061 TSecr=4998"
"2999","5.050282","10.1.0.11","10.1.0.7","TCP","6376","0.000000000","","","49159  >  7012 [ACK] Seq=190501 Ack=1 Win=131072 Len=1500 TSval=5061 TSecr=4998"
"3000","5.050282","10.1.0.11","10.1.0.7","TCP","6376","0.000000000","","","49159  >  7012 [ACK] Seq=196501 Ack=1 Win=131072 Len=1500 TSval=5061 TSecr=4998"
"3001","5.050282","10.1.0.11","10.1.0.7","TCP","6376","0.000000000","","","49159  >  7012 [ACK] Seq=202501 Ack=1 Win=131072 Len=1500 TSval=5061 TSecr=4999"
"3002","5.050282","10.1.0.11","10.1.0.7","TCP","6376","0.000000000","","","49159  >  7012 [ACK] Seq=208501 Ack=1 Win=131072 Len=1500 TSval=5061 TSecr=4999"
"3003","5.050282","10.1.0.11","10.1.0.7","TCP","4800","0.000000000","","","49159  >  7012 [ACK] Seq=213001 Ack=1 Win=131072 Len=1500 TSval=5061 TSecr=4999"
"3433","5.090441","10.1.0.7","10.1.0.11","TCP","1516","0.040159000","-29 dBm","0.040159000,0.040159000,0.040159000,0.040159000,0.040159000,0.040159000,0.040159000,0.040159000,0.040159000,0.040159000,0.040159000,0.040159000,0.040159000,0.040159000,0.040159000,0.040159000,0.040159000,0.040159000,0.040159000","7012  >  49159 [ACK] Seq=1 Ack=213001 Win=131072 Len=0 TSval=5064 TSecr=5061"
"3448","5.091700","10.1.0.11","10.1.0.7","TCP","6376","0.001259000","","","49159  >  7012 [ACK] Seq=219001 Ack=1 Win=131072 Len=1500 TSval=5102 TSecr=5062"
"3449","5.091700","10.1.0.11","10.1.0.7","TCP","6376","0.000000000","","","49159  >  7012 [ACK] Seq=225001 Ack=1 Win=131072 Len=1500 TSval=5102 TSecr=5062"
"3450","5.091700","10.1.0.11","10.1.0.7","TCP","6376","0.000000000","","","49159  >  7012 [ACK] Seq=231001 Ack=1 Win=131072 Len=1500 TSval=5102 TSecr=5063"
"3451","5.091700","10.1.0.11","10.1.0.7","TCP","6376","0.000000000","","","49159  >  7012 [ACK] Seq=237001 Ack=1 Win=131072 Len=1500 TSval=5102 TSecr=5063"
"3452","5.091700","10.1.0.11","10.1.0.7","TCP","6376","0.000000000","","","49159  >  7012 [ACK] Seq=243001 Ack=1 Win=131072 Len=1500 TSval=5102 TSecr=5063"
"3453","5.091700","10.1.0.11","10.1.0.7","TCP","6376","0.000000000","","","49159  >  7012 [ACK] Seq=249001 Ack=1 Win=131072 Len=1500 TSval=5102 TSecr=5063"
"3454","5.091700","10.1.0.11","10.1.0.7","TCP","6376","0.000000000","","","49159  >  7012 [ACK] Seq=255001 Ack=1 Win=131072 Len=1500 TSval=5102 TSecr=5063"
"3455","5.091700","10.1.0.11","10.1.0.7","TCP","6376","0.000000000","","","49159  >  7012 [ACK] Seq=261001 Ack=1 Win=131072 Len=1500 TSval=5102 TSecr=5064"
"3456","5.091700","10.1.0.11","10.1.0.7","TCP","6376","0.000000000","","","49159  >  7012 [ACK] Seq=267001 Ack=1 Win=131072 Len=1500 TSval=5102 TSecr=5064"
"3457","5.091700","10.1.0.11","10.1.0.7","TCP","6376","0.000000000","","","49159  >  7012 [ACK] Seq=273001 Ack=1 Win=131072 Len=1500 TSval=5102 TSecr=5064"
"3849","5.130690","10.1.0.7","10.1.0.11","TCP","1592","0.038990000","-29 dBm","0.038990000,0.038990000,0.038990000,0.038990000,0.038990000,0.038990000,0.038990000,0.038990000,0.038990000,0.038990000,0.038990000,0.038990000,0.038990000,0.038990000,0.038990000,0.038990000,0.038990000,0.038990000,0.038990000,0.038990000","7012  >  49159 [ACK] Seq=1 Ack=273001 Win=131072 Len=0 TSval=5106 TSecr=5102"
"3873","5.133438","10.1.0.11","10.1.0.7","TCP","6376","0.002748000","","","49159  >  7012 [ACK] Seq=279001 Ack=1 Win=131072 Len=1500 TSval=5142 TSecr=5104"
"3874","5.133438","10.1.0.11","10.1.0.7","TCP","6376","0.000000000","","","49159  >  7012 [ACK] Seq=285001 Ack=1 Win=131072 Len=1500 TSval=5142 TSecr=5104"
"3875","5.133438","10.1.0.11","10.1.0.7","TCP","6376","0.000000000","","","49159  >  7012 [ACK] Seq=291001 Ack=1 Win=131072 Len=1500 TSval=5142 TSecr=5104"
"3876","5.133438","10.1.0.11","10.1.0.7","TCP","6376","0.000000000","","","49159  >  7012 [ACK] Seq=297001 Ack=1 Win=131072 Len=1500 TSval=5142 TSecr=5104"
"3877","5.133438","10.1.0.11","10.1.0.7","TCP","6376","0.000000000","","","49159  >  7012 [ACK] Seq=303001 Ack=1 Win=131072 Len=1500 TSval=5142 TSecr=5104"
"3878","5.133438","10.1.0.11","10.1.0.7","TCP","6376","0.000000000","","","49159  >  7012 [ACK] Seq=309001 Ack=1 Win=131072 Len=1500 TSval=5142 TSecr=5105"
"3879","5.133438","10.1.0.11","10.1.0.7","TCP","6376","0.000000000","","","49159  >  7012 [ACK] Seq=315001 Ack=1 Win=131072 Len=1500 TSval=5142 TSecr=5105"
"3880","5.133438","10.1.0.11","10.1.0.7","TCP","6376","0.000000000","","","49159  >  7012 [ACK] Seq=321001 Ack=1 Win=131072 Len=1500 TSval=5142 TSecr=5105"
"3881","5.133438","10.1.0.11","10.1.0.7","TCP","6376","0.000000000","","","49159  >  7012 [ACK] Seq=327001 Ack=1 Win=131072 Len=1500 TSval=5142 TSecr=5105"
"3882","5.133438","10.1.0.11","10.1.0.7","TCP","7028","0.000000000","","","49159  >  7012 [ACK] Seq=334001 Ack=1 Win=131072 Len=1000 TSval=5144 TSecr=5106"
"3897","5.137616","10.1.0.11","10.1.0.7","TCP","2224","0.004178000","","","49159  >  7012 [ACK] Seq=336001 Ack=1 Win=131072 Len=1000 TSval=5146 TSecr=5106"
"4726","5.209180","10.1.0.11","10.1.0.7","TCP","984","0.071564000","","","7013  >  49153 [ACK] Seq=1 Ack=58501 Win=131072 Len=0 TSval=4939 TSecr=4936"
"4727","5.209180","10.1.0.11","10.1.0.7","TCP","134","0.000000000","","0.281786000","7013  >  49153 [ACK] Seq=1 Ack=60001 Win=131072 Len=0 TSval=5139 TSecr=4936"
"4848","5.233627","10.1.0.7","10.1.0.11","TCP","6376","0.024447000","-29 dBm","","49153  >  7013 [ACK] Seq=64501 Ack=1 Win=131072 Len=1500 TSval=5221 TSecr=4938"
"4849","5.233627","10.1.0.7","10.1.0.11","TCP","6376","0.000000000","-29 dBm","","49153  >  7013 [ACK] Seq=70501 Ack=1 Win=131072 Len=1500 TSval=5221 TSecr=4938"
"4850","5.233627","10.1.0.7","10.1.0.11","TCP","6376","0.000000000","-29 dBm","","49153  >  7013 [ACK] Seq=76501 Ack=1 Win=131072 Len=1500 TSval=5221 TSecr=4938"
"4851","5.233627","10.1.0.7","10.1.0.11","TCP","6376","0.000000000","-29 dBm","","49153  >  7013 [ACK] Seq=82501 Ack=1 Win=131072 Len=1500 TSval=5221 TSecr=4938"
"4852","5.233627","10.1.0.7","10.1.0.11","TCP","6376","0.000000000","-29 dBm","","49153  >  7013 [ACK] Seq=88501 Ack=1 Win=131072 Len=1500 TSval=5221 TSecr=4938"
"4853","5.233627","10.1.0.7","10.1.0.11","TCP","6376","0.000000000","-29 dBm","","49153  >  7013 [ACK] Seq=94501 Ack=1 Win=131072 Len=1500 TSval=5221 TSecr=4939"
"4854","5.233627","10.1.0.7","10.1.0.11","TCP","6376","0.000000000","-29 dBm","","49153  >  7013 [ACK] Seq=100501 Ack=1 Win=131072 Len=1500 TSval=5221 TSecr=4939"
"4855","5.233627","10.1.0.7","10.1.0.11","TCP","6376","0.000000000","-29 dBm","","49153  >  7013 [ACK] Seq=106501 Ack=1 Win=131072 Len=1500 TSval=5221 TSecr=4939"
"4856","5.233627","10.1.0.7","10.1.0.11","TCP","1634","0.000000000","-29 dBm","","49153  >  7013 [ACK] Seq=108001 Ack=1 Win=131072 Len=1500 TSval=5221 TSecr=5139"
"4935","5.243821","10.1.0.11","10.1.0.7","TCP","1288","0.010194000","","0.010194000,0.010194000,0.010194000,0.010194000,0.010194000,0.010194000,0.010194000,0.010194000,0.010194000,0.010194000,0.010194000,0.010194000,0.010194000,0.010194000,0.010194000,0.010194000","7013  >  49153 [ACK] Seq=1 Ack=108001 Win=131072 Len=0 TSval=5245 TSecr=5221"
"4958","5.254843","10.1.0.7","10.1.0.11","TCP","6376","0.011022000","-29 dBm","","49153  >  7013 [ACK] Seq=114001 Ack=1 Win=131072 Len=1500 TSval=5256 TSecr=5244"
"4959","5.254843","10.1.0.7","10.1.0.11","TCP","6376","0.000000000","-29 dBm","","49153  >  7013 [ACK] Seq=120001 Ack=1 Win=131072 Len=1500 TSval=5256 TSecr=5244"
"4960","5.254843","10.1.0.7","10.1.0.11","TCP","6376","0.000000000","-29 dBm","","49153  >  7013 [ACK] Seq=126001 Ack=1 Win=131072 Len=1500 TSval=5256 TSecr=5244"
"4961","5.254843","10.1.0.7","10.1.0.11","TCP","6376","0.000000000","-29 dBm","","49153  >  7013 [ACK] Seq=132001 Ack=1 Win=131072 Len=1500 TSval=5256 TSecr=5244"
"4962","5.254843","10.1.0.7","10.1.0.11","TCP","6376","0.000000000","-29 dBm","","49153  >  7013 [ACK] Seq=138001 Ack=1 Win=131072 Len=1500 TSval=5256 TSecr=5245"
"4963","5.254843","10.1.0.7","10.1.0.11","TCP","6376","0.000000000","-29 dBm","","49153  >  7013 [ACK] Seq=144001 Ack=1 Win=131072 Len=1500 TSval=5256 TSecr=5245"
"4964","5.254843","10.1.0.7","10.1.0.11","TCP","6376","0.000000000","-29 dBm","","49153  >  7013 [ACK] Seq=150001 Ack=1 Win=131072 Len=1500 TSval=5256 TSecr=5245"
"4965","5.254843","10.1.0.7","10.1.0.11","TCP","6376","0.000000000","-29 dBm","","49153  >  7013 [ACK] Seq=156001 Ack=1 Win=131072 Len=1500 TSval=5256 TSecr=5245"
"4966","5.254843","10.1.0.7","10.1.0.11","TCP","3224","0.000000000","-29 dBm","","49153  >  7013 [ACK] Seq=159001 Ack=1 Win=131072 Len=1500 TSval=5256 TSecr=5245"
"5200","5.293843","10.1.0.7","10.1.0.11","TCP","1744","0.039000000","-29 dBm","0.160405000,0.160405000,0.160405000,0.160405000,0.160405000,0.160405000,0.160405000,0.160405000,0.160405000,0.160405000,0.160405000,0.160405000,0.160405000,0.160405000,0.160405000,0.160405000,0.160405000,0.160405000,0.160405000,0.160405000,0.160405000,0.156227000","7012  >  49159 [ACK] Seq=1 Ack=336001 Win=131072 Len=0 TSval=5149 TSecr=5144"
"5203","5.293989","10.1.0.11","10.1.0.7","TCP","6376","0.000146000","","","49159  >  7012 [ACK] Seq=341501 Ack=1 Win=131072 Len=1500 TSval=5306 TSecr=5145"
"5204","5.293989","10.1.0.11","10.1.0.7","TCP","6376","0.000000000","","","49159  >  7012 [ACK] Seq=347501 Ack=1 Win=131072 Len=1500 TSval=5306 TSecr=5146"
"5205","5.293989","10.1.0.11","10.1.0.7","TCP","6376","0.000000000","","","49159  >  7012 [ACK] Seq=353501 Ack=1 Win=131072 Len=1500 TSval=5306 TSecr=5146"
"5206","5.293989","10.1.0.11","10.1.0.7","TCP","6376","0.000000000","","","49159  >  7012 [ACK] Seq=359501 Ack=1 Win=131072 Len=1500 TSval=5306 TSecr=5146"
"5207","5.293989","10.1.0.11","10.1.0.7","TCP","6376","0.000000000","","","49159  >  7012 [ACK] Seq=365501 Ack=1 Win=131072 Len=1500 TSval=5306 TSecr=5146"
"5208","5.293989","10.1.0.11","10.1.0.7","TCP","6376","0.000000000","","","49159  >  7012 [ACK] Seq=371501 Ack=1 Win=131072 Len=1500 TSval=5306 TSecr=5146"
"5209","5.293989","10.1.0.11","10.1.0.7","TCP","6376","0.000000000","","","49159  >  7012 [ACK] Seq=377501 Ack=1 Win=131072 Len=1500 TSval=5306 TSecr=5147"
"5210","5.293989","10.1.0.11","10.1.0.7","TCP","6376","0.000000000","","","49159  >  7012 [ACK] Seq=383501 Ack=1 Win=131072 Len=1500 TSval=5306 TSecr=5147"
"5211","5.293989","10.1.0.11","10.1.0.7","TCP","6376","0.000000000","","","49159  >  7012 [ACK] Seq=389501 Ack=1 Win=131072 Len=1500 TSval=5306 TSecr=5147"
"5212","5.293989","10.1.0.11","10.1.0.7","TCP","6376","0.000000000","","","49159  >  7012 [ACK] Seq=395501 Ack=1 Win=131072 Len=1500 TSval=5306 TSecr=5147"
"5213","5.293989","10.1.0.11","10.1.0.7","TCP","6376","0.000000000","","","49159  >  7012 [ACK] Seq=401501 Ack=1 Win=131072 Len=1500 TSval=5306 TSecr=5149"
"5353","5.309589","10.1.0.11","10.1.0.7","TCP","1364","0.015600000","","0.054746000,0.054746000,0.054746000,0.054746000,0.054746000,0.054746000,0.054746000,0.054746000,0.054746000,0.054746000,0.054746000,0.054746000,0.054746000,0.054746000,0.054746000,0.054746000,0.054746000","7013  >  49153 [ACK] Seq=1 Ack=159001 Win=131072 Len=0 TSval=5267 TSecr=5256"
"5475","5.334199","10.1.0.7","10.1.0.11","TCP","6376","0.024610000","-29 dBm","","49153  >  7013 [ACK] Seq=165001 Ack=1 Win=131072 Len=1500 TSval=5321 TSecr=5265"
"5476","5.334199","10.1.0.7","10.1.0.11","TCP","6376","0.000000000","-29 dBm","","49153  >  7013 [ACK] Seq=171001 Ack=1 Win=131072 Len=1500 TSval=5321 TSecr=5265"
"5477","5.334199","10.1.0.7","10.1.0.11","TCP","6376","0.000000000","-29 dBm","","49153  >  7013 [ACK] Seq=177001 Ack=1 Win=131072 Len=1500 TSval=5321 TSecr=5265"
"5478","5.334199","10.1.0.7","10.1.0.11","TCP","6376","0.000000000","-29 dBm","","49153  >  7013 [ACK] Seq=183001 Ack=1 Win=131072 Len=1500 TSval=5321 TSecr=5266"
"5479","5.334199","10.1.0.7","10.1.0.11","TCP","6376","0.000000000","-29 dBm","","49153  >  7013 [ACK] Seq=189001 Ack=1 Win=131072 Len=1500 TSval=5321 TSecr=5266"
"5480","5.334199","10.1.0.7","10.1.0.11","TCP","6376","0.000000000","-29 dBm","","49153  >  7013 [ACK] Seq=195001 Ack=1 Win=131072 Len=1500 TSval=5321 TSecr=5266"
"5481","5.334199","10.1.0.7","10.1.0.11","TCP","6376","0.000000000","-29 dBm","","49153  >  7013 [ACK] Seq=201001 Ack=1 Win=131072 Len=1500 TSval=5321 TSecr=5266"
"5482","5.334199","10.1.0.7","10.1.0.11","TCP","6376","0.000000000","-29 dBm","","49153  >  7013 [ACK] Seq=207001 Ack=1 Win=131072 Len=1500 TSval=5321 TSecr=5266"
"5483","5.334199","10.1.0.7","10.1.0.11","TCP","6376","0.000000000","-29 dBm","","49153  >  7013 [ACK] Seq=213001 Ack=1 Win=131072 Len=1500 TSval=5321 TSecr=5267"
"5649","5.358357","10.1.0.11","10.1.0.7","TCP","1440","0.024158000","","0.024158000,0.024158000,0.024158000,0.024158000,0.024158000,0.024158000,0.024158000,0.024158000,0.024158000,0.024158000,0.024158000,0.024158000,0.024158000,0.024158000,0.024158000,0.024158000,0.024158000,0.024158000","7013  >  49153 [ACK] Seq=1 Ack=213001 Win=131072 Len=0 TSval=5346 TSecr=5321"
"5801","5.394738","10.1.0.7","10.1.0.11","TCP","6376","0.036381000","-29 dBm","","49153  >  7013 [ACK] Seq=219001 Ack=1 Win=131072 Len=1500 TSval=5370 TSecr=5344"
"5802","5.394738","10.1.0.7","10.1.0.11","TCP","6376","0.000000000","-29 dBm","","49153  >  7013 [ACK] Seq=225001 Ack=1 Win=131072 Len=1500 TSval=5370 TSecr=5344"
"5803","5.394738","10.1.0.7","10.1.0.11","TCP","6376","0.000000000","-29 dBm","","49153  >  7013 [ACK] Seq=231001 Ack=1 Win=131072 Len=1500 TSval=5370 TSecr=5345"
"5804","5.394738","10.1.0.7","10.1.0.11","TCP","6376","0.000000000","-29 dBm","","49153  >  7013 [ACK] Seq=237001 Ack=1 Win=131072 Len=1500 TSval=5370 TSecr=5345"
"5805","5.394738","10.1.0.7","10.1.0.11","TCP","6376","0.000000000","-29 dBm","","49153  >  7013 [ACK] Seq=243001 Ack=1 Win=131072 Len=1500 TSval=5370 TSecr=5345"
"5806","5.394738","10.1.0.7","10.1.0.11","TCP","6376","0.000000000","-29 dBm","","49153  >  7013 [ACK] Seq=249001 Ack=1 Win=131072 Len=1500 TSval=5370 TSecr=5345"
"5807","5.394738","10.1.0.7","10.1.0.11","TCP","6376","0.000000000","-29 dBm","","49153  >  7013 [ACK] Seq=255001 Ack=1 Win=131072 Len=1500 TSval=5370 TSecr=5345"
"5808","5.394738","10.1.0.7","10.1.0.11","TCP","6376","0.000000000","-29 dBm","","49153  >  7013 [ACK] Seq=261001 Ack=1 Win=131072 Len=1500 TSval=5370 TSecr=5346"
"5809","5.394738","10.1.0.7","10.1.0.11","TCP","6376","0.000000000","-29 dBm","","49153  >  7013 [ACK] Seq=267001 Ack=1 Win=131072 Len=1500 TSval=5370 TSecr=5346"
"5810","5.394738","10.1.0.7","10.1.0.11","TCP","1634","0.000000000","-29 dBm","","49153  >  7013 [ACK] Seq=268501 Ack=1 Win=131072 Len=1500 TSval=5370 TSecr=5346"
"5838","5.397203","10.1.0.11","10.1.0.7","TCP","1516","0.002465000","","0.002465000,0.002465000,0.002465000,0.002465000,0.002465000,0.002465000,0.002465000,0.002465000,0.002465000,0.002465000,0.002465000,0.002465000,0.002465000,0.002465000,0.002465000,0.002465000,0.002465000,0.002465000,0.002465000","7013  >  49153 [ACK] Seq=1 Ack=270001 Win=131072 Len=0 TSval=5406 TSecr=5370"
"6049","5.438712","10.1.0.7","10.1.0.11","TCP","6376","0.041509000","-29 dBm","","49153  >  7013 [ACK] Seq=274501 Ack=1 Win=131072 Len=1500 TSval=5409 TSecr=5405"
"6050","5.438712","10.1.0.7","10.1.0.11","TCP","6376","0.000000000","-29 dBm","","49153  >  7013 [ACK] Seq=280501 Ack=1 Win=131072 Len=1500 TSval=5409 TSecr=5405"
"6051","5.438712","10.1.0.7","10.1.0.11","TCP","6376","0.000000000","-29 dBm","","49153  >  7013 [ACK] Seq=286501 Ack=1 Win=131072 Len=1500 TSval=5409 TSecr=5405"
"6052","5.438712","10.1.0.7","10.1.0.11","TCP","6376","0.000000000","-29 dBm","","49153  >  7013 [ACK] Seq=292501 Ack=1 Win=131072 Len=1500 TSval=5409 TSecr=5405"
"6053","5.438712","10.1.0.7","10.1.0.11","TCP","6376","0.000000000","-29 dBm","","49153  >  7013 [ACK] Seq=298501 Ack=1 Win=131072 Len=1500 TSval=5409 TSecr=5406"
"6054","5.438712","10.1.0.7","10.1.0.11","TCP","6376","0.000000000","-29 dBm","","49153  >  7013 [ACK] Seq=304501 Ack=1 Win=131072 Len=1500 TSval=5409 TSecr=5406"
"6055","5.438712","10.1.0.7","10.1.0.11","TCP","6376","0.000000000","-29 dBm","","49153  >  7013 [ACK] Seq=310501 Ack=1 Win=131072 Len=1500 TSval=5409 TSecr=5406"
"6056","5.438712","10.1.0.7","10.1.0.11","TCP","6376","0.000000000","-29 dBm","","49153  >  7013 [ACK] Seq=316501 Ack=1 Win=131072 Len=1500 TSval=5409 TSecr=5406"
"6057","5.438712","10.1.0.7","10.1.0.11","TCP","6376","0.000000000","-29 dBm","","49153  >  7013 [ACK] Seq=322501 Ack=1 Win=131072 Len=1500 TSval=5409 TSecr=5406"
"6058","5.438712","10.1.0.7","10.1.0.11","TCP","6376","0.000000000","-29 dBm","","49153  >  7013 [ACK] Seq=328501 Ack=1 Win=131072 Len=1500 TSval=5409 TSecr=5406"
"6125","5.448401","10.1.0.7","10.1.0.11","TCP","1744","0.009689000","-29 dBm","0.154412000,0.154412000,0.154412000,0.154412000,0.154412000,0.154412000,0.154412000,0.154412000,0.154412000,0.154412000,0.154412000,0.154412000,0.154412000,0.154412000,0.154412000,0.154412000,0.154412000,0.154412000,0.154412000,0.154412000,0.154412000,0.154412000","7012  >  49159 [ACK] Seq=1 Ack=401501 Win=131072 Len=0 TSval=5308 TSecr=5306"
"6130","5.448699","10.1.0.11","10.1.0.7","TCP","6376","0.000298000","","","49159  >  7012 [ACK] Seq=407501 Ack=1 Win=131072 Len=1500 TSval=5460 TSecr=5306"
"6131","5.448699","10.1.0.11","10.1.0.7","TCP","6376","0.000000000","","","49159  >  7012 [ACK] Seq=413501 Ack=1 Win=131072 Len=1500 TSval=5460 TSecr=5306"
"6132","5.448699","10.1.0.11","10.1.0.7","TCP","6376","0.000000000","","","49159  >  7012 [ACK] Seq=419501 Ack=1 Win=131072 Len=1500 TSval=5460 TSecr=5306"
"6133","5.448699","10.1.0.11","10.1.0.7","TCP","6376","0.000000000","","","49159  >  7012 [ACK] Seq=425501 Ack=1 Win=131072 Len=1500 TSval=5460 TSecr=5307"
"6134","5.448699","10.1.0.11","10.1.0.7","TCP","6376","0.000000000","","","49159  >  7012 [ACK] Seq=431501 Ack=1 Win=131072 Len=1500 TSval=5460 TSecr=5307"
"6135","5.448699","10.1.0.11","10.1.0.7","TCP","6376","0.000000000","","","49159  >  7012 [ACK] Seq=437501 Ack=1 Win=131072 Len=1500 TSval=5460 TSecr=5307"
"6136","5.448699","10.1.0.11","10.1.0.7","TCP","6376","0.000000000","","","49159  >  7012 [ACK] Seq=443501 Ack=1 Win=131072 Len=1500 TSval=5460 TSecr=5307"
"6137","5.448699","10.1.0.11","10.1.0.7","TCP","6376","0.000000000","","","49159  >  7012 [ACK] Seq=449501 Ack=1 Win=131072 Len=1500 TSval=5460 TSecr=5307"
"6138","5.448699","10.1.0.11","10.1.0.7","TCP","6376","0.000000000","","","49159  >  7012 [ACK] Seq=455501 Ack=1 Win=131072 Len=1500 TSval=5460 TSecr=5308"
"6139","5.448699","10.1.0.11","10.1.0.7","TCP","6376","0.000000000","","","49159  >  7012 [ACK] Seq=461501 Ack=1 Win=131072 Len=1500 TSval=5460 TSecr=5308"
"6140","5.448699","10.1.0.11","10.1.0.7","TCP","5376","0.000000000","","","49159  >  7012 [ACK] Seq=467001 Ack=1 Win=131072 Len=1000 TSval=5460 TSecr=5308"
"6148","5.451807","10.1.0.11","10.1.0.7","TCP","3300","0.003108000","","","49159  >  7012 [ACK] Seq=470001 Ack=1 Win=131072 Len=1000 TSval=5463 TSecr=5308"
"6154","5.452327","10.1.0.11","10.1.0.7","TCP","1134","0.000520000","","","49159  >  7012 [ACK] Seq=471001 Ack=1 Win=131072 Len=1000 TSval=5464 TSecr=5308"
"6162","5.452935","10.1.0.11","10.1.0.7","TCP","1134","0.000608000","","","49159  >  7012 [ACK] Seq=472001 Ack=1 Win=131072 Len=1000 TSval=5464 TSecr=5308"
"6165","5.453308","10.1.0.7","10.1.0.11","TCP","1972","0.000373000","-29 dBm","0.004609000,0.004609000,0.004609000,0.004609000,0.004609000,0.004609000,0.004609000,0.004609000,0.004609000,0.004609000,0.004609000,0.004609000,0.004609000,0.004609000,0.004609000,0.004609000,0.004609000,0.004609000,0.004609000,0.004609000,0.004609000,0.004609000,0.001501000,0.001501000,0.000373000","7012  >  49159 [ACK] Seq=1 Ack=473001 Win=131072 Len=0 TSval=5465 TSecr=5464"
"6181","5.454642","10.1.0.11","10.1.0.7","TCP","2224","0.001334000","","","49159  >  7012 [ACK] Seq=474001 Ack=1 Win=131072 Len=1000 TSval=5466 TSecr=5465"
"6189","5.455283","10.1.0.11","10.1.0.7","TCP","1134","0.000641000","","","49159  >  7012 [ACK] Seq=475001 Ack=1 Win=131072 Len=1000 TSval=5467 TSecr=5465"
"6201","5.456226","10.1.0.11","10.1.0.7","TCP","1134","0.000943000","","","49159  >  7012 [ACK] Seq=476001 Ack=1 Win=131072 Len=1000 TSval=5468 TSecr=5465"
"6209","5.456834","10.1.0.11","10.1.0.7","TCP","1134","0.000608000","","","49159  >  7012 [ACK] Seq=477001 Ack=1 Win=131072 Len=1000 TSval=5468 TSecr=5465"
"6216","5.457513","10.1.0.7","10.1.0.11","TCP","224","0.000679000","-29 dBm","0.002871000,0.001287000","7012  >  49159 [ACK] Seq=1 Ack=477001 Win=131072 Len=0 TSval=5468 TSecr=5467"
"6229","5.458511","10.1.0.11","10.1.0.7","TCP","2224","0.000998000","","","49159  >  7012 [ACK] Seq=479001 Ack=1 Win=131072 Len=1000 TSval=5470 TSecr=5468"
"6242","5.459515","10.1.0.11","10.1.0.7","TCP","1134","0.001004000","","","49159  >  7012 [ACK] Seq=480001 Ack=1 Win=131072 Len=1000 TSval=5471 TSecr=5468"
"6250","5.460123","10.1.0.11","10.1.0.7","TCP","1134","0.000608000","","","49159  >  7012 [ACK] Seq=481001 Ack=1 Win=131072 Len=1000 TSval=5472 TSecr=5468"
"6259","5.460817","10.1.0.11","10.1.0.7","TCP","1134","0.000694000","","","49159  >  7012 [ACK] Seq=482001 Ack=1 Win=131072 Len=1000 TSval=5472 TSecr=5468"
"6262","5.461133","10.1.0.7","10.1.0.11","TCP","300","0.000316000","-29 dBm","0.002622000,0.001618000,0.000316000","7012  >  49159 [ACK] Seq=1 Ack=483001 Win=131072 Len=0 TSval=5473 TSecr=5472"
"6271","5.461735","10.1.0.11","10.1.0.7","TCP","1134","0.000602000","","","49159  >  7012 [ACK] Seq=483001 Ack=1 Win=131072 Len=1000 TSval=5473 TSecr=5473"
"6280","5.462429","10.1.0.11","10.1.0.7","TCP","1134","0.000694000","","","49159  >  7012 [ACK] Seq=484001 Ack=1 Win=131072 Len=1000 TSval=5474 TSecr=5473"
"6283","5.462754","10.1.0.7","10.1.0.11","TCP","134","0.000325000","-29 dBm","0.000325000","7012  >  49159 [ACK] Seq=1 Ack=485001 Win=131072 Len=0 TSval=5474 TSecr=5473"
"6302","5.464240","10.1.0.11","10.1.0.7","TCP","2224","0.001486000","","","49159  >  7012 [ACK] Seq=486001 Ack=1 Win=131072 Len=1000 TSval=5476 TSecr=5474"
"6310","5.464880","10.1.0.11","10.1.0.7","TCP","1134","0.000640000","","","49159  >  7012 [ACK] Seq=487001 Ack=1 Win=131072 Len=1000 TSval=5476 TSecr=5474"
"6326","5.466150","10.1.0.11","10.1.0.7","TCP","1134","0.001270000","","","49159  >  7012 [ACK] Seq=488001 Ack=1 Win=131072 Len=1000 TSval=5477 TSecr=5474"
"6340","5.467906","10.1.0.11","10.1.0.7","TCP","3300","0.001756000","","","49159  >  7012 [ACK] Seq=491001 Ack=1 Win=131072 Len=1000 TSval=5480 TSecr=5474"
"6352","5.469010","10.1.0.11","10.1.0.7","TCP","1134","0.001104000","","","49159  >  7012 [ACK] Seq=492001 Ack=1 Win=131072 Len=1000 TSval=5480 TSecr=5474"
"6362","5.469770","10.1.0.11","10.1.0.7","TCP","1134","0.000760000","","","49159  >  7012 [ACK] Seq=493001 Ack=1 Win=131072 Len=1000 TSval=5481 TSecr=5474"
"6372","5.470530","10.1.0.11","10.1.0.7","TCP","1134","0.000760000","","","49159  >  7012 [ACK] Seq=494001 Ack=1 Win=131072 Len=1000 TSval=5482 TSecr=5474"
"6383","5.471376","10.1.0.11","10.1.0.7","TCP","1134","0.000846000","","","49159  >  7012 [ACK] Seq=495001 Ack=1 Win=131072 Len=1000 TSval=5483 TSecr=5474"
"6393","5.472136","10.1.0.11","10.1.0.7","TCP","1134","0.000760000","","","49159  >  7012 [ACK] Seq=496001 Ack=1 Win=131072 Len=1000 TSval=5484 TSecr=5474"
"6418","5.474802","10.1.0.11","10.1.0.7","TCP","3300","0.002666000","","","49159  >  7012 [ACK] Seq=499001 Ack=1 Win=131072 Len=1000 TSval=5486 TSecr=5474"
"6430","5.475970","10.1.0.11","10.1.0.7","TCP","2224","0.001168000","","","49159  >  7012 [ACK] Seq=501001 Ack=1 Win=131072 Len=1000 TSval=5488 TSecr=5474"
"6450","5.477555","10.1.0.11","10.1.0.7","TCP","2224","0.001585000","","","49159  >  7012 [ACK] Seq=503001 Ack=1 Win=131072 Len=1000 TSval=5489 TSecr=5474"
"6484","5.480733","10.1.0.11","10.1.0.7","TCP","4376","0.003178000","","","49159  >  7012 [ACK] Seq=507001 Ack=1 Win=131072 Len=1000 TSval=5492 TSecr=5474"
"6498","5.482053","10.1.0.11","10.1.0.7","TCP","1134","0.001320000","","","49159  >  7012 [ACK] Seq=508001 Ack=1 Win=131072 Len=1000 TSval=5493 TSecr=5474"
"6510","5.482965","10.1.0.11","10.1.0.7","TCP","1134","0.000912000","","","49159  >  7012 [ACK] Seq=509001 Ack=1 Win=131072 Len=1000 TSval=5494 TSecr=5474"
"6522","5.483877","10.1.0.11","10.1.0.7","TCP","2224","0.000912000","","","49159  >  7012 [ACK] Seq=511001 Ack=1 Win=131072 Len=1000 TSval=5496 TSecr=5474"
"6535","5.485073","10.1.0.7","10.1.0.11","TCP","1060","0.001196000","-29 dBm","0.020833000,0.018923000,0.017167000,0.016063000,0.014543000,0.012937000,0.010271000,0.009103000,0.007518000,0.004340000,0.004340000,0.003020000,0.001196000","7012  >  49159 [ACK] Seq=1 Ack=511001 Win=131072 Len=0 TSval=5496 TSecr=5494"
"6547","5.485995","10.1.0.11","10.1.0.7","TCP","2224","0.000922000","","","49159  >  7012 [ACK] Seq=513001 Ack=1 Win=131072 Len=1000 TSval=5497 TSecr=5496"
"6559","5.487003","10.1.0.11","10.1.0.7","TCP","1134","0.001008000","","","49159  >  7012 [ACK] Seq=514001 Ack=1 Win=131072 Len=1000 TSval=5498 TSecr=5496"
"6571","5.487947","10.1.0.11","10.1.0.7","TCP","2224","0.000944000","","","49159  >  7012 [ACK] Seq=516001 Ack=1 Win=131072 Len=1000 TSval=5500 TSecr=5496"
"6591","5.489531","10.1.0.11","10.1.0.7","TCP","2224","0.001584000","","","49159  >  7012 [ACK] Seq=518001 Ack=1 Win=131072 Len=1000 TSval=5501 TSecr=5496"
"6612","5.491169","10.1.0.11","10.1.0.7","TCP","2224","0.001638000","","","49159  >  7012 [ACK] Seq=520001 Ack=1 Win=131072 Len=1000 TSval=5503 TSecr=5496"
"6624","5.492273","10.1.0.11","10.1.0.7","TCP","1134","0.001104000","","","49159  >  7012 [ACK] Seq=521001 Ack=1 Win=131072 Len=1000 TSval=5504 TSecr=5496"
"6636","5.493186","10.1.0.11","10.1.0.7","TCP","1134","0.000913000","","","49159  >  7012 [ACK] Seq=522001 Ack=1 Win=131072 Len=1000 TSval=5504 TSecr=5496"
"6648","5.494098","10.1.0.11","10.1.0.7","TCP","1134","0.000912000","","","49159  >  7012 [ACK] Seq=523001 Ack=1 Win=131072 Len=1000 TSval=5505 TSecr=5496"
"6660","5.495010","10.1.0.11","10.1.0.7","TCP","1134","0.000912000","","","49159  >  7012 [ACK] Seq=524001 Ack=1 Win=131072 Len=1000 TSval=5506 TSecr=5496"
"6672","5.495954","10.1.0.11","10.1.0.7","TCP","2224","0.000944000","","","49159  >  7012 [ACK] Seq=526001 Ack=1 Win=131072 Len=1000 TSval=5508 TSecr=5496"
"6690","5.497481","10.1.0.11","10.1.0.7","TCP","2224","0.001527000","","","49159  >  7012 [ACK] Seq=528001 Ack=1 Win=131072 Len=1000 TSval=5509 TSecr=5496"
"6710","5.499033","10.1.0.11","10.1.0.7","TCP","1134","0.001552000","","","49159  >  7012 [ACK] Seq=529001 Ack=1 Win=131072 Len=1000 TSval=5510 TSecr=5496"
"6722","5.499977","10.1.0.11","10.1.0.7","TCP","2224","0.000944000","","","49159  >  7012 [ACK] Seq=531001 Ack=1 Win=131072 Len=1000 TSval=5512 TSecr=5496"
"6742","5.501562","10.1.0.11","10.1.0.7","TCP","2224","0.001585000","","","49159  >  7012 [ACK] Seq=533001 Ack=1 Win=131072 Len=1000 TSval=5513 TSecr=5496"
"6762","5.503182","10.1.0.11","10.1.0.7","TCP","2224","0.001620000","","","49159  >  7012 [ACK] Seq=535001 Ack=1 Win=131072 Len=1000 TSval=5515 TSecr=5496"
"6782","5.504766","10.1.0.11","10.1.0.7","TCP","2224","0.001584000","","","49159  >  7012 [ACK] Seq=537001 Ack=1 Win=131072 Len=1000 TSval=5516 TSecr=5496"
"6802","5.506350","10.1.0.11","10.1.0.7","TCP","2224","0.001584000","","","49159  >  7012 [ACK] Seq=539001 Ack=1 Win=131072 Len=1000 TSval=5518 TSecr=5496"
"6823","5.508147","10.1.0.11","10.1.0.7","TCP","2224","0.001797000","","","49159  >  7012 [ACK] Seq=541001 Ack=1 Win=131072 Len=1000 TSval=5520 TSecr=5496"
"6837","5.509276","10.1.0.11","10.1.0.7","TCP","1134","0.001129000","","","49159  >  7012 [ACK] Seq=542001 Ack=1 Win=131072 Len=1000 TSval=5520 TSecr=5496"
"6849","5.510188","10.1.0.11","10.1.0.7","TCP","1134","0.000912000","","","49159  >  7012 [ACK] Seq=543001 Ack=1 Win=131072 Len=1000 TSval=5521 TSecr=5496"
"6861","5.511132","10.1.0.11","10.1.0.7","TCP","2224","0.000944000","","","49159  >  7012 [ACK] Seq=545001 Ack=1 Win=131072 Len=1000 TSval=5523 TSecr=5496"
"6881","5.512756","10.1.0.11","10.1.0.7","TCP","2224","0.001624000","","","49159  >  7012 [ACK] Seq=547001 Ack=1 Win=131072 Len=1000 TSval=5524 TSecr=5496"
"6893","5.513860","10.1.0.11","10.1.0.7","TCP","1134","0.001104000","","","49159  >  7012 [ACK] Seq=548001 Ack=1 Win=131072 Len=1000 TSval=5525 TSecr=5496"
"6905","5.514772","10.1.0.11","10.1.0.7","TCP","1134","0.000912000","","","49159  >  7012 [ACK] Seq=549001 Ack=1 Win=131072 Len=1000 TSval=5526 TSecr=5496"
"6917","5.515684","10.1.0.11","10.1.0.7","TCP","1134","0.000912000","","","49159  >  7012 [ACK] Seq=550001 Ack=1 Win=131072 Len=1000 TSval=5527 TSecr=5496"
