"No.","Time","Source","Destination","Protocol","Length","Time delta from previous displayed frame","Signal strength (dBm)","The RTT to ACK the segment was","Info"
"790","3.837809","10.1.0.11","10.1.0.8","TCP","138","0.000000000","","","49160  >  7014 [SYN] Seq=0 Win=65535 Len=0 TSval=3850 TSecr=0 WS=4 SACK_PERM=1"
"796","3.838453","10.1.0.11","10.1.0.8","TCP","138","0.000644000","","","[TCP Out-Of-Order] [TCP Port numbers reused] 49160  >  7014 [SYN] Seq=0 Win=65535 Len=0 TSval=3850 TSecr=0 WS=4 SACK_PERM=1"
"799","3.838719","10.1.0.8","10.1.0.11","TCP","138","0.000266000","-43 dBm","","49153  >  7015 [SYN] Seq=0 Win=65535 Len=0 TSval=3850 TSecr=0 WS=4 SACK_PERM=1"
"802","3.838874","10.1.0.11","10.1.0.8","TCP","138","0.000155000","","0.000155000","7015  >  49153 [SYN, ACK] Seq=0 Ack=1 Win=65535 Len=0 TSval=3850 TSecr=3850 WS=4 SACK_PERM=1"
"803","3.839127","10.1.0.8","10.1.0.11","TCP","138","0.000253000","-43 dBm","0.001318000","7014  >  49160 [SYN, ACK] Seq=0 Ack=1 Win=65535 Len=0 TSval=3850 TSecr=3850 WS=4 SACK_PERM=1"
"806","3.839273","10.1.0.11","10.1.0.8","TCP","134","0.000146000","","0.000146000","49160  >  7014 [ACK] Seq=1 Ack=1 Win=131072 Len=0 TSval=3851 TSecr=3850"
"809","3.839587","10.1.0.11","10.1.0.8","TCP","138","0.000314000","","","[TCP Out-Of-Order] 7015  >  49153 [SYN, ACK] Seq=0 Ack=1 Win=65535 Len=0 TSval=3850 TSecr=3850 WS=4 SACK_PERM=1"
"812","3.839853","10.1.0.8","10.1.0.11","TCP","134","0.000266000","-43 dBm","0.000979000","49153  >  7015 [ACK] Seq=1 Ack=1 Win=131072 Len=0 TSval=3851 TSecr=3850"
"1042","4.840693","10.1.0.11","10.1.0.8","TCP","1134","1.000840000","","","49160  >  7014 [ACK] Seq=1 Ack=1 Win=131072 Len=1000 TSval=4852 TSecr=3850"
"1062","4.842533","10.1.0.11","10.1.0.8","TCP","3300","0.001840000","","","49160  >  7014 [ACK] Seq=3001 Ack=1 Win=131072 Len=1000 TSval=4854 TSecr=3850"
"1089","4.845693","10.1.0.11","10.1.0.8","TCP","4376","0.003160000","","","49160  >  7014 [ACK] Seq=7001 Ack=1 Win=131072 Len=1000 TSval=4857 TSecr=3850"
"1109","4.848317","10.1.0.11","10.1.0.8","TCP","3300","0.002624000","","","49160  >  7014 [ACK] Seq=10001 Ack=1 Win=131072 Len=1000 TSval=4860 TSecr=3850"
"1129","4.850510","10.1.0.11","10.1.0.8","TCP","3300","0.002193000","","","49160  >  7014 [ACK] Seq=13001 Ack=1 Win=131072 Len=1000 TSval=4862 TSecr=3850"
"1159","4.856311","10.1.0.8","10.1.0.11","TCP","6528","0.005801000","-43 dBm","","49153  >  7015 [ACK] Seq=5001 Ack=1 Win=131072 Len=1000 TSval=4856 TSecr=3850"
"1160","4.856311","10.1.0.8","10.1.0.11","TCP","6528","0.000000000","-43 dBm","","49153  >  7015 [ACK] Seq=11001 Ack=1 Win=131072 Len=1000 TSval=4861 TSecr=3850"
"1161","4.856311","10.1.0.8","10.1.0.11","TCP","3300","0.000000000","-43 dBm","","49153  >  7015 [ACK] Seq=14001 Ack=1 Win=131072 Len=1000 TSval=4863 TSecr=3850"
"1207","4.861842","10.1.0.11","10.1.0.8","TCP","1134","0.005531000","","","49160  >  7014 [ACK] Seq=14001 Ack=1 Win=131072 Len=1000 TSval=4863 TSecr=3850"
"1872","4.923946","10.1.0.11","10.1.0.8","TCP","680","0.062104000","","0.067635000,0.067635000,0.067635000,0.067635000,0.067635000,0.067635000,0.067635000,0.067635000","7015  >  49153 [ACK] Seq=1 Ack=15001 Win=131072 Len=0 TSval=4868 TSecr=4863"
"1973","4.941522","10.1.0.8","10.1.0.11","TCP","6376","0.017576000","-43 dBm","","49153  >  7015 [ACK] Seq=19501 Ack=1 Win=131072 Len=1500 TSval=4936 TSecr=4868"
"1974","4.941522","10.1.0.8","10.1.0.11","TCP","6376","0.000000000","-43 dBm","","49153  >  7015 [ACK] Seq=25501 Ack=1 Win=131072 Len=1500 TSval=4936 TSecr=4868"
"1975","4.941522","10.1.0.8","10.1.0.11","TCP","6376","0.000000000","-43 dBm","","49153  >  7015 [ACK] Seq=31501 Ack=1 Win=131072 Len=1500 TSval=4936 TSecr=4868"
"1976","4.941522","10.1.0.8","10.1.0.11","TCP","6376","0.000000000","-43 dBm","","49153  >  7015 [ACK] Seq=37501 Ack=1 Win=131072 Len=1500 TSval=4936 TSecr=4868"
"1977","4.941522","10.1.0.8","10.1.0.11","TCP","6376","0.000000000","-43 dBm","","49153  >  7015 [ACK] Seq=43501 Ack=1 Win=131072 Len=1500 TSval=4936 TSecr=4868"
"1980","4.941757","10.1.0.8","10.1.0.11","TCP","680","0.000235000","-43 dBm","0.101064000,0.099224000,0.096064000,0.096064000,0.093440000,0.093440000,0.091247000,0.079915000","7014  >  49160 [ACK] Seq=1 Ack=15001 Win=131072 Len=0 TSval=4874 TSecr=4862"
"1991","4.943287","10.1.0.11","10.1.0.8","TCP","6376","0.001530000","","","49160  >  7014 [ACK] Seq=19501 Ack=1 Win=131072 Len=1500 TSval=4953 TSecr=4854"
"1992","4.943287","10.1.0.11","10.1.0.8","TCP","6376","0.000000000","","","49160  >  7014 [ACK] Seq=25501 Ack=1 Win=131072 Len=1500 TSval=4953 TSecr=4858"
"1993","4.943287","10.1.0.11","10.1.0.8","TCP","6376","0.000000000","","","49160  >  7014 [ACK] Seq=31501 Ack=1 Win=131072 Len=1500 TSval=4953 TSecr=4860"
"1994","4.943287","10.1.0.11","10.1.0.8","TCP","6376","0.000000000","","","49160  >  7014 [ACK] Seq=37501 Ack=1 Win=131072 Len=1500 TSval=4953 TSecr=4862"
"1995","4.943287","10.1.0.11","10.1.0.8","TCP","6376","0.000000000","","","49160  >  7014 [ACK] Seq=43501 Ack=1 Win=131072 Len=1500 TSval=4953 TSecr=4874"
"2041","4.950258","10.1.0.8","10.1.0.11","TCP","832","0.006971000","-43 dBm","0.006971000,0.006971000,0.006971000,0.006971000,0.006971000,0.006971000,0.006971000,0.006971000,0.006971000,0.006971000","7014  >  49160 [ACK] Seq=1 Ack=45001 Win=131072 Len=0 TSval=4956 TSecr=4953"
"2068","4.954277","10.1.0.11","10.1.0.8","TCP","6376","0.004019000","","","49160  >  7014 [ACK] Seq=49501 Ack=1 Win=131072 Len=1500 TSval=4962 TSecr=4955"
"2069","4.954277","10.1.0.11","10.1.0.8","TCP","6376","0.000000000","","","49160  >  7014 [ACK] Seq=55501 Ack=1 Win=131072 Len=1500 TSval=4962 TSecr=4955"
"2070","4.954277","10.1.0.11","10.1.0.8","TCP","6376","0.000000000","","","49160  >  7014 [ACK] Seq=61501 Ack=1 Win=131072 Len=1500 TSval=4962 TSecr=4955"
"2071","4.954277","10.1.0.11","10.1.0.8","TCP","6376","0.000000000","","","49160  >  7014 [ACK] Seq=67501 Ack=1 Win=131072 Len=1500 TSval=4962 TSecr=4955"
"2072","4.954277","10.1.0.11","10.1.0.8","TCP","6376","0.000000000","","","49160  >  7014 [ACK] Seq=73501 Ack=1 Win=131072 Len=1500 TSval=4962 TSecr=4956"
"2073","4.954277","10.1.0.11","10.1.0.8","TCP","6376","0.000000000","","","49160  >  7014 [ACK] Seq=79501 Ack=1 Win=131072 Len=1500 TSval=4962 TSecr=4956"
"2074","4.954277","10.1.0.11","10.1.0.8","TCP","6376","0.000000000","","","49160  >  7014 [ACK] Seq=85501 Ack=1 Win=131072 Len=1500 TSval=4962 TSecr=4956"
"2075","4.954277","10.1.0.11","10.1.0.8","TCP","6376","0.000000000","","","49160  >  7014 [ACK] Seq=91501 Ack=1 Win=131072 Len=1500 TSval=4962 TSecr=4956"
"2077","4.956130","10.1.0.11","10.1.0.8","TCP","6376","0.001853000","","","49160  >  7014 [ACK] Seq=97501 Ack=1 Win=131072 Len=1500 TSval=4962 TSecr=4956"
"2078","4.956130","10.1.0.11","10.1.0.8","TCP","6376","0.000000000","","","49160  >  7014 [ACK] Seq=103501 Ack=1 Win=131072 Len=1500 TSval=4962 TSecr=4956"
"2080","4.956654","10.1.0.11","10.1.0.8","TCP","6376","0.000524000","","","[TCP Out-Of-Order] [TCP Out-Of-Order] [TCP Out-Of-Order] [TCP Out-Of-Order] 49160  >  7014 [ACK] Seq=97501 Ack=1 Win=131072 Len=1500 TSval=4962 TSecr=4956"
"2689","5.020742","10.1.0.8","10.1.0.11","TCP","1592","0.064088000","-43 dBm","0.066465000,0.066465000,0.066465000,0.066465000,0.066465000,0.066465000,0.066465000,0.066465000,0.066465000,0.066465000,0.066465000,0.066465000,0.066465000,0.066465000,0.066465000,0.066465000,0.064612000,0.064612000,0.064612000,0.064612000","7014  >  49160 [ACK] Seq=1 Ack=105001 Win=131072 Len=0 TSval=4969 TSecr=4962"
"2706","5.022400","10.1.0.11","10.1.0.8","TCP","6376","0.001658000","","","49160  >  7014 [ACK] Seq=109501 Ack=1 Win=131072 Len=1500 TSval=5032 TSecr=4966"
"2707","5.022400","10.1.0.11","10.1.0.8","TCP","6376","0.000000000","","","49160  >  7014 [ACK] Seq=115501 Ack=1 Win=131072 Len=1500 TSval=5032 TSecr=4966"
"2708","5.022400","10.1.0.11","10.1.0.8","TCP","6376","0.000000000","","","49160  >  7014 [ACK] Seq=121501 Ack=1 Win=131072 Len=1500 TSval=5032 TSecr=4966"
"2709","5.022400","10.1.0.11","10.1.0.8","TCP","6376","0.000000000","","","49160  >  7014 [ACK] Seq=127501 Ack=1 Win=131072 Len=1500 TSval=5032 TSecr=4966"
"2710","5.022400","10.1.0.11","10.1.0.8","TCP","6376","0.000000000","","","49160  >  7014 [ACK] Seq=133501 Ack=1 Win=131072 Len=1500 TSval=5032 TSecr=4967"
"2711","5.022400","10.1.0.11","10.1.0.8","TCP","6376","0.000000000","","","49160  >  7014 [ACK] Seq=139501 Ack=1 Win=131072 Len=1500 TSval=5032 TSecr=4967"
"2712","5.022400","10.1.0.11","10.1.0.8","TCP","6376","0.000000000","","","49160  >  7014 [ACK] Seq=145501 Ack=1 Win=131072 Len=1500 TSval=5032 TSecr=4967"
"2713","5.022400","10.1.0.11","10.1.0.8","TCP","6376","0.000000000","","","49160  >  7014 [ACK] Seq=151501 Ack=1 Win=131072 Len=1500 TSval=5032 TSecr=4967"
"2714","5.022400","10.1.0.11","10.1.0.8","TCP","6376","0.000000000","","","49160  >  7014 [ACK] Seq=157501 Ack=1 Win=131072 Len=1500 TSval=5032 TSecr=4967"
"2715","5.022400","10.1.0.11","10.1.0.8","TCP","6376","0.000000000","","","49160  >  7014 [ACK] Seq=163501 Ack=1 Win=131072 Len=1500 TSval=5032 TSecr=4967"
"2716","5.022400","10.1.0.11","10.1.0.8","TCP","6376","0.000000000","","","49160  >  7014 [ACK] Seq=169501 Ack=1 Win=131072 Len=1500 TSval=5032 TSecr=4967"
"2717","5.022400","10.1.0.11","10.1.0.8","TCP","7528","0.000000000","","","49160  >  7014 [ACK] Seq=177001 Ack=1 Win=131072 Len=1000 TSval=5034 TSecr=4969"
"2732","5.026973","10.1.0.11","10.1.0.8","TCP","5452","0.004573000","","","49160  >  7014 [ACK] Seq=182001 Ack=1 Win=131072 Len=1000 TSval=5038 TSecr=4969"
"2746","5.028469","10.1.0.11","10.1.0.8","TCP","2224","0.001496000","","","49160  >  7014 [ACK] Seq=184001 Ack=1 Win=131072 Len=1000 TSval=5040 TSecr=4969"
"2760","5.029661","10.1.0.11","10.1.0.8","TCP","2224","0.001192000","","","49160  >  7014 [ACK] Seq=186001 Ack=1 Win=131072 Len=1000 TSval=5041 TSecr=4969"
"2776","5.031070","10.1.0.11","10.1.0.8","TCP","1134","0.001409000","","","49160  >  7014 [ACK] Seq=187001 Ack=1 Win=131072 Len=1000 TSval=5042 TSecr=4969"
"2791","5.032215","10.1.0.11","10.1.0.8","TCP","2224","0.001145000","","","49160  >  7014 [ACK] Seq=189001 Ack=1 Win=131072 Len=1000 TSval=5044 TSecr=4969"
"2810","5.034379","10.1.0.11","10.1.0.8","TCP","3300","0.002164000","","","49160  >  7014 [ACK] Seq=192001 Ack=1 Win=131072 Len=1000 TSval=5046 TSecr=4969"
"4739","5.210032","10.1.0.11","10.1.0.8","TCP","832","0.175653000","","0.268510000,0.268510000,0.268510000,0.268510000,0.268510000,0.268510000,0.268510000,0.268510000,0.268510000,0.268510000","7015  >  49153 [ACK] Seq=1 Ack=45001 Win=131072 Len=0 TSval=4953 TSecr=4936"
"4772","5.217046","10.1.0.8","10.1.0.11","TCP","6376","0.007014000","-43 dBm","","49153  >  7015 [ACK] Seq=49501 Ack=1 Win=131072 Len=1500 TSval=5222 TSecr=4952"
"4773","5.217046","10.1.0.8","10.1.0.11","TCP","6376","0.000000000","-43 dBm","","49153  >  7015 [ACK] Seq=55501 Ack=1 Win=131072 Len=1500 TSval=5222 TSecr=4952"
"4774","5.217046","10.1.0.8","10.1.0.11","TCP","6376","0.000000000","-43 dBm","","49153  >  7015 [ACK] Seq=61501 Ack=1 Win=131072 Len=1500 TSval=5222 TSecr=4953"
"4775","5.217046","10.1.0.8","10.1.0.11","TCP","6376","0.000000000","-43 dBm","","49153  >  7015 [ACK] Seq=67501 Ack=1 Win=131072 Len=1500 TSval=5222 TSecr=4953"
"4776","5.217046","10.1.0.8","10.1.0.11","TCP","6376","0.000000000","-43 dBm","","49153  >  7015 [ACK] Seq=73501 Ack=1 Win=131072 Len=1500 TSval=5222 TSecr=4953"
"4777","5.217046","10.1.0.8","10.1.0.11","TCP","6376","0.000000000","-43 dBm","","49153  >  7015 [ACK] Seq=79501 Ack=1 Win=131072 Len=1500 TSval=5222 TSecr=4953"
"4778","5.217046","10.1.0.8","10.1.0.11","TCP","6376","0.000000000","-43 dBm","","49153  >  7015 [ACK] Seq=85501 Ack=1 Win=131072 Len=1500 TSval=5222 TSecr=4953"
"4779","5.217046","10.1.0.8","10.1.0.11","TCP","6376","0.000000000","-43 dBm","","49153  >  7015 [ACK] Seq=91501 Ack=1 Win=131072 Len=1500 TSval=5222 TSecr=4953"
"4780","5.217046","10.1.0.8","10.1.0.11","TCP","6376","0.000000000","-43 dBm","","49153  >  7015 [ACK] Seq=97501 Ack=1 Win=131072 Len=1500 TSval=5222 TSecr=4953"
"4781","5.217046","10.1.0.8","10.1.0.11","TCP","3224","0.000000000","-43 dBm","","49153  >  7015 [ACK] Seq=100501 Ack=1 Win=131072 Len=1500 TSval=5222 TSecr=4953"
"4929","5.243317","10.1.0.11","10.1.0.8","TCP","1516","0.026271000","","0.026271000,0.026271000,0.026271000,0.026271000,0.026271000,0.026271000,0.026271000,0.026271000,0.026271000,0.026271000,0.026271000,0.026271000,0.026271000,0.026271000,0.026271000,0.026271000,0.026271000,0.026271000,0.026271000","7015  >  49153 [ACK] Seq=1 Ack=102001 Win=131072 Len=0 TSval=5229 TSecr=5222"
"5026","5.269854","10.1.0.8","10.1.0.11","TCP","6376","0.026537000","-43 dBm","","49153  >  7015 [ACK] Seq=106501 Ack=1 Win=131072 Len=1500 TSval=5255 TSecr=5227"
"5027","5.269854","10.1.0.8","10.1.0.11","TCP","6376","0.000000000","-43 dBm","","49153  >  7015 [ACK] Seq=112501 Ack=1 Win=131072 Len=1500 TSval=5255 TSecr=5227"
"5028","5.269854","10.1.0.8","10.1.0.11","TCP","6376","0.000000000","-43 dBm","","49153  >  7015 [ACK] Seq=118501 Ack=1 Win=131072 Len=1500 TSval=5255 TSecr=5227"
"5029","5.269854","10.1.0.8","10.1.0.11","TCP","6376","0.000000000","-43 dBm","","49153  >  7015 [ACK] Seq=124501 Ack=1 Win=131072 Len=1500 TSval=5255 TSecr=5228"
"5030","5.269854","10.1.0.8","10.1.0.11","TCP","6376","0.000000000","-43 dBm","","49153  >  7015 [ACK] Seq=130501 Ack=1 Win=131072 Len=1500 TSval=5255 TSecr=5228"
"5031","5.269854","10.1.0.8","10.1.0.11","TCP","6376","0.000000000","-43 dBm","","49153  >  7015 [ACK] Seq=136501 Ack=1 Win=131072 Len=1500 TSval=5255 TSecr=5228"
"5032","5.269854","10.1.0.8","10.1.0.11","TCP","6376","0.000000000","-43 dBm","","49153  >  7015 [ACK] Seq=142501 Ack=1 Win=131072 Len=1500 TSval=5255 TSecr=5228"
"5033","5.269854","10.1.0.8","10.1.0.11","TCP","6376","0.000000000","-43 dBm","","49153  >  7015 [ACK] Seq=148501 Ack=1 Win=131072 Len=1500 TSval=5255 TSecr=5228"
"5034","5.269854","10.1.0.8","10.1.0.11","TCP","6376","0.000000000","-43 dBm","","49153  >  7015 [ACK] Seq=154501 Ack=1 Win=131072 Len=1500 TSval=5255 TSecr=5229"
"5035","5.269854","10.1.0.8","10.1.0.11","TCP","6376","0.000000000","-43 dBm","","49153  >  7015 [ACK] Seq=160501 Ack=1 Win=131072 Len=1500 TSval=5255 TSecr=5229"
"5359","5.310077","10.1.0.11","10.1.0.8","TCP","1592","0.040223000","","0.040223000,0.040223000,0.040223000,0.040223000,0.040223000,0.040223000,0.040223000,0.040223000,0.040223000,0.040223000,0.040223000,0.040223000,0.040223000,0.040223000,0.040223000,0.040223000,0.040223000,0.040223000,0.040223000,0.040223000","7015  >  49153 [ACK] Seq=1 Ack=162001 Win=131072 Len=0 TSval=5282 TSecr=5255"
"5530","5.342037","10.1.0.8","10.1.0.11","TCP","6376","0.031960000","-43 dBm","","49153  >  7015 [ACK] Seq=166501 Ack=1 Win=131072 Len=1500 TSval=5322 TSecr=5280"
"5531","5.342037","10.1.0.8","10.1.0.11","TCP","6376","0.000000000","-43 dBm","","49153  >  7015 [ACK] Seq=172501 Ack=1 Win=131072 Len=1500 TSval=5322 TSecr=5280"
"5532","5.342037","10.1.0.8","10.1.0.11","TCP","6376","0.000000000","-43 dBm","","49153  >  7015 [ACK] Seq=178501 Ack=1 Win=131072 Len=1500 TSval=5322 TSecr=5280"
"5533","5.342037","10.1.0.8","10.1.0.11","TCP","6376","0.000000000","-43 dBm","","49153  >  7015 [ACK] Seq=184501 Ack=1 Win=131072 Len=1500 TSval=5322 TSecr=5280"
"5534","5.342037","10.1.0.8","10.1.0.11","TCP","6376","0.000000000","-43 dBm","","49153  >  7015 [ACK] Seq=190501 Ack=1 Win=131072 Len=1500 TSval=5322 TSecr=5281"
"5535","5.342037","10.1.0.8","10.1.0.11","TCP","6376","0.000000000","-43 dBm","","49153  >  7015 [ACK] Seq=196501 Ack=1 Win=131072 Len=1500 TSval=5322 TSecr=5281"
"5536","5.342037","10.1.0.8","10.1.0.11","TCP","6376","0.000000000","-43 dBm","","49153  >  7015 [ACK] Seq=202501 Ack=1 Win=131072 Len=1500 TSval=5322 TSecr=5281"
"5537","5.342037","10.1.0.8","10.1.0.11","TCP","6376","0.000000000","-43 dBm","","49153  >  7015 [ACK] Seq=208501 Ack=1 Win=131072 Len=1500 TSval=5322 TSecr=5281"
"5538","5.342037","10.1.0.8","10.1.0.11","TCP","6376","0.000000000","-43 dBm","","49153  >  7015 [ACK] Seq=214501 Ack=1 Win=131072 Len=1500 TSval=5322 TSecr=5281"
"5539","5.342037","10.1.0.8","10.1.0.11","TCP","6376","0.000000000","-43 dBm","","49153  >  7015 [ACK] Seq=220501 Ack=1 Win=131072 Len=1500 TSval=5322 TSecr=5282"
"5540","5.342037","10.1.0.8","10.1.0.11","TCP","3224","0.000000000","-43 dBm","","49153  >  7015 [ACK] Seq=223501 Ack=1 Win=131072 Len=1500 TSval=5322 TSecr=5282"
"5653","5.358677","10.1.0.11","10.1.0.8","TCP","1668","0.016640000","","0.016640000,0.016640000,0.016640000,0.016640000,0.016640000,0.016640000,0.016640000,0.016640000,0.016640000,0.016640000,0.016640000,0.016640000,0.016640000,0.016640000,0.016640000,0.016640000,0.016640000,0.016640000,0.016640000,0.016640000,0.016640000","7015  >  49153 [ACK] Seq=1 Ack=225001 Win=131072 Len=0 TSval=5354 TSecr=5322"
"5771","5.389947","10.1.0.8","10.1.0.11","TCP","6376","0.031270000","-43 dBm","","49153  >  7015 [ACK] Seq=229501 Ack=1 Win=131072 Len=1500 TSval=5370 TSecr=5352"
"5772","5.389947","10.1.0.8","10.1.0.11","TCP","6376","0.000000000","-43 dBm","","49153  >  7015 [ACK] Seq=235501 Ack=1 Win=131072 Len=1500 TSval=5370 TSecr=5352"
"5773","5.389947","10.1.0.8","10.1.0.11","TCP","6376","0.000000000","-43 dBm","","49153  >  7015 [ACK] Seq=241501 Ack=1 Win=131072 Len=1500 TSval=5370 TSecr=5352"
"5774","5.389947","10.1.0.8","10.1.0.11","TCP","6376","0.000000000","-43 dBm","","49153  >  7015 [ACK] Seq=247501 Ack=1 Win=131072 Len=1500 TSval=5370 TSecr=5352"
"5775","5.389947","10.1.0.8","10.1.0.11","TCP","6376","0.000000000","-43 dBm","","49153  >  7015 [ACK] Seq=253501 Ack=1 Win=131072 Len=1500 TSval=5370 TSecr=5353"
"5776","5.389947","10.1.0.8","10.1.0.11","TCP","6376","0.000000000","-43 dBm","","49153  >  7015 [ACK] Seq=259501 Ack=1 Win=131072 Len=1500 TSval=5370 TSecr=5353"
"5777","5.389947","10.1.0.8","10.1.0.11","TCP","6376","0.000000000","-43 dBm","","49153  >  7015 [ACK] Seq=265501 Ack=1 Win=131072 Len=1500 TSval=5370 TSecr=5353"
"5778","5.389947","10.1.0.8","10.1.0.11","TCP","6376","0.000000000","-43 dBm","","49153  >  7015 [ACK] Seq=271501 Ack=1 Win=131072 Len=1500 TSval=5370 TSecr=5353"
"5779","5.389947","10.1.0.8","10.1.0.11","TCP","6376","0.000000000","-43 dBm","","49153  >  7015 [ACK] Seq=277501 Ack=1 Win=131072 Len=1500 TSval=5370 TSecr=5353"
"5780","5.389947","10.1.0.8","10.1.0.11","TCP","6376","0.000000000","-43 dBm","","49153  >  7015 [ACK] Seq=283501 Ack=1 Win=131072 Len=1500 TSval=5370 TSecr=5354"
"5781","5.389947","10.1.0.8","10.1.0.11","TCP","6376","0.000000000","-43 dBm","","49153  >  7015 [ACK] Seq=289501 Ack=1 Win=131072 Len=1500 TSval=5370 TSecr=5354"
"5834","5.396867","10.1.0.11","10.1.0.8","TCP","1744","0.006920000","","0.006920000,0.006920000,0.006920000,0.006920000,0.006920000,0.006920000,0.006920000,0.006920000,0.006920000,0.006920000,0.006920000,0.006920000,0.006920000,0.006920000,0.006920000,0.006920000,0.006920000,0.006920000,0.006920000,0.006920000,0.006920000,0.006920000","7015  >  49153 [ACK] Seq=1 Ack=291001 Win=131072 Len=0 TSval=5402 TSecr=5370"
"6082","5.444710","10.1.0.8","10.1.0.11","TCP","6376","0.047843000","-43 dBm","","49153  >  7015 [ACK] Seq=295501 Ack=1 Win=131072 Len=1500 TSval=5409 TSecr=5400"
"6083","5.444710","10.1.0.8","10.1.0.11","TCP","6376","0.000000000","-43 dBm","","49153  >  7015 [ACK] Seq=301501 Ack=1 Win=131072 Len=1500 TSval=5409 TSecr=5400"
"6084","5.444710","10.1.0.8","10.1.0.11","TCP","6376","0.000000000","-43 dBm","","49153  >  7015 [ACK] Seq=307501 Ack=1 Win=131072 Len=1500 TSval=5409 TSecr=5400"
"6085","5.444710","10.1.0.8","10.1.0.11","TCP","6376","0.000000000","-43 dBm","","49153  >  7015 [ACK] Seq=313501 Ack=1 Win=131072 Len=1500 TSval=5409 TSecr=5400"
"6086","5.444710","10.1.0.8","10.1.0.11","TCP","6376","0.000000000","-43 dBm","","49153  >  7015 [ACK] Seq=319501 Ack=1 Win=131072 Len=1500 TSval=5409 TSecr=5400"
"6087","5.444710","10.1.0.8","10.1.0.11","TCP","6376","0.000000000","-43 dBm","","49153  >  7015 [ACK] Seq=325501 Ack=1 Win=131072 Len=1500 TSval=5409 TSecr=5401"
"6088","5.444710","10.1.0.8","10.1.0.11","TCP","6376","0.000000000","-43 dBm","","49153  >  7015 [ACK] Seq=331501 Ack=1 Win=131072 Len=1500 TSval=5409 TSecr=5401"
"6089","5.444710","10.1.0.8","10.1.0.11","TCP","6376","0.000000000","-43 dBm","","49153  >  7015 [ACK] Seq=337501 Ack=1 Win=131072 Len=1500 TSval=5409 TSecr=5401"
"6090","5.444710","10.1.0.8","10.1.0.11","TCP","6528","0.000000000","-43 dBm","","49153  >  7015 [ACK] Seq=344001 Ack=1 Win=131072 Len=1000 TSval=5411 TSecr=5402"
"6091","5.444710","10.1.0.8","10.1.0.11","TCP","6528","0.000000000","-43 dBm","","49153  >  7015 [ACK] Seq=350001 Ack=1 Win=131072 Len=1000 TSval=5416 TSecr=5402"
"6092","5.444710","10.1.0.8","10.1.0.11","TCP","6528","0.000000000","-43 dBm","","49153  >  7015 [ACK] Seq=356001 Ack=1 Win=131072 Len=1000 TSval=5421 TSecr=5402"
"6093","5.444710","10.1.0.8","10.1.0.11","TCP","2224","0.000000000","-43 dBm","","49153  >  7015 [ACK] Seq=358001 Ack=1 Win=131072 Len=1000 TSval=5423 TSecr=5402"
"6094","5.444710","10.1.0.8","10.1.0.11","TCP","1134","0.000000000","-43 dBm","","49153  >  7015 [ACK] Seq=359001 Ack=1 Win=131072 Len=1000 TSval=5423 TSecr=5402"
"8214","5.623670","10.1.0.8","10.1.0.11","TCP","134","0.178960000","-43 dBm","0.589291000","7014  >  49160 [ACK] Seq=1 Ack=193001 Win=131072 Len=0 TSval=5246 TSecr=5046"
"8243","5.627452","10.1.0.11","10.1.0.8","TCP","6376","0.003782000","","","49160  >  7014 [ACK] Seq=197501 Ack=1 Win=131072 Len=1500 TSval=5635 TSecr=5246"
"8244","5.627452","10.1.0.11","10.1.0.8","TCP","6376","0.000000000","","","49160  >  7014 [ACK] Seq=203501 Ack=1 Win=131072 Len=1500 TSval=5635 TSecr=5246"
"8245","5.627452","10.1.0.11","10.1.0.8","TCP","6376","0.000000000","","","49160  >  7014 [ACK] Seq=209501 Ack=1 Win=131072 Len=1500 TSval=5635 TSecr=5246"
"8246","5.627452","10.1.0.11","10.1.0.8","TCP","6376","0.000000000","","","49160  >  7014 [ACK] Seq=215501 Ack=1 Win=131072 Len=1500 TSval=5635 TSecr=5246"
"8247","5.627452","10.1.0.11","10.1.0.8","TCP","6376","0.000000000","","","49160  >  7014 [ACK] Seq=221501 Ack=1 Win=131072 Len=1500 TSval=5635 TSecr=5246"
"8248","5.627452","10.1.0.11","10.1.0.8","TCP","6376","0.000000000","","","49160  >  7014 [ACK] Seq=227501 Ack=1 Win=131072 Len=1500 TSval=5635 TSecr=5246"
"8249","5.627452","10.1.0.11","10.1.0.8","TCP","7452","0.000000000","","","49160  >  7014 [ACK] Seq=235001 Ack=1 Win=131072 Len=1000 TSval=5635 TSecr=5246"
"8250","5.627452","10.1.0.11","10.1.0.8","TCP","5452","0.000000000","","","49160  >  7014 [ACK] Seq=240001 Ack=1 Win=131072 Len=1000 TSval=5639 TSecr=5246"
"8269","5.631415","10.1.0.11","10.1.0.8","TCP","5452","0.003963000","","","49160  >  7014 [ACK] Seq=245001 Ack=1 Win=131072 Len=1000 TSval=5643 TSecr=5246"
"8285","5.633064","10.1.0.11","10.1.0.8","TCP","2224","0.001649000","","","49160  >  7014 [ACK] Seq=247001 Ack=1 Win=131072 Len=1000 TSval=5644 TSecr=5246"
"8297","5.634072","10.1.0.11","10.1.0.8","TCP","1134","0.001008000","","","49160  >  7014 [ACK] Seq=248001 Ack=1 Win=131072 Len=1000 TSval=5645 TSecr=5246"
"8313","5.635830","10.1.0.11","10.1.0.8","TCP","2224","0.001758000","","","49160  >  7014 [ACK] Seq=250001 Ack=1 Win=131072 Len=1000 TSval=5647 TSecr=5246"
"8325","5.636998","10.1.0.11","10.1.0.8","TCP","2224","0.001168000","","","49160  >  7014 [ACK] Seq=252001 Ack=1 Win=131072 Len=1000 TSval=5648 TSecr=5246"
"8335","5.637790","10.1.0.11","10.1.0.8","TCP","1134","0.000792000","","","49160  >  7014 [ACK] Seq=253001 Ack=1 Win=131072 Len=1000 TSval=5649 TSecr=5246"
"8345","5.638550","10.1.0.11","10.1.0.8","TCP","1134","0.000760000","","","49160  >  7014 [ACK] Seq=254001 Ack=1 Win=131072 Len=1000 TSval=5650 TSecr=5246"
"8356","5.639396","10.1.0.11","10.1.0.8","TCP","1134","0.000846000","","","49160  >  7014 [ACK] Seq=255001 Ack=1 Win=131072 Len=1000 TSval=5651 TSecr=5246"
"8366","5.640157","10.1.0.11","10.1.0.8","TCP","1134","0.000761000","","","49160  >  7014 [ACK] Seq=256001 Ack=1 Win=131072 Len=1000 TSval=5652 TSecr=5246"
"8377","5.641021","10.1.0.11","10.1.0.8","TCP","1134","0.000864000","","","49160  >  7014 [ACK] Seq=257001 Ack=1 Win=131072 Len=1000 TSval=5652 TSecr=5246"
"8387","5.641781","10.1.0.11","10.1.0.8","TCP","1134","0.000760000","","","49160  >  7014 [ACK] Seq=258001 Ack=1 Win=131072 Len=1000 TSval=5653 TSecr=5246"
"8397","5.642541","10.1.0.11","10.1.0.8","TCP","1134","0.000760000","","","49160  >  7014 [ACK] Seq=259001 Ack=1 Win=131072 Len=1000 TSval=5654 TSecr=5246"
"8408","5.643387","10.1.0.11","10.1.0.8","TCP","1134","0.000846000","","","49160  >  7014 [ACK] Seq=260001 Ack=1 Win=131072 Len=1000 TSval=5655 TSecr=5246"
"8419","5.644531","10.1.0.11","10.1.0.8","TCP","1134","0.001144000","","","49160  >  7014 [ACK] Seq=261001 Ack=1 Win=131072 Len=1000 TSval=5656 TSecr=5246"
"8427","5.645139","10.1.0.11","10.1.0.8","TCP","1134","0.000608000","","","49160  >  7014 [ACK] Seq=262001 Ack=1 Win=131072 Len=1000 TSval=5656 TSecr=5246"
"8435","5.645747","10.1.0.11","10.1.0.8","TCP","1134","0.000608000","","","49160  >  7014 [ACK] Seq=263001 Ack=1 Win=131072 Len=1000 TSval=5657 TSecr=5246"
"8458","5.647873","10.1.0.11","10.1.0.8","TCP","2224","0.002126000","","","49160  >  7014 [ACK] Seq=265001 Ack=1 Win=131072 Len=1000 TSval=5659 TSecr=5246"
"8470","5.649153","10.1.0.11","10.1.0.8","TCP","2224","0.001280000","","","49160  >  7014 [ACK] Seq=267001 Ack=1 Win=131072 Len=1000 TSval=5660 TSecr=5246"
"8482","5.650193","10.1.0.11","10.1.0.8","TCP","1134","0.001040000","","","49160  >  7014 [ACK] Seq=268001 Ack=1 Win=131072 Len=1000 TSval=5661 TSecr=5246"
"8492","5.650953","10.1.0.11","10.1.0.8","TCP","1134","0.000760000","","","49160  >  7014 [ACK] Seq=269001 Ack=1 Win=131072 Len=1000 TSval=5662 TSecr=5246"
"8504","5.651865","10.1.0.11","10.1.0.8","TCP","1134","0.000912000","","","49160  >  7014 [ACK] Seq=270001 Ack=1 Win=131072 Len=1000 TSval=5663 TSecr=5246"
"8528","5.654227","10.1.0.11","10.1.0.8","TCP","3300","0.002362000","","","49160  >  7014 [ACK] Seq=273001 Ack=1 Win=131072 Len=1000 TSval=5665 TSecr=5246"
"8540","5.655427","10.1.0.11","10.1.0.8","TCP","2224","0.001200000","","","49160  >  7014 [ACK] Seq=275001 Ack=1 Win=131072 Len=1000 TSval=5667 TSecr=5246"
"8552","5.656371","10.1.0.11","10.1.0.8","TCP","1134","0.000944000","","","49160  >  7014 [ACK] Seq=276001 Ack=1 Win=131072 Len=1000 TSval=5668 TSecr=5246"
"8564","5.657283","10.1.0.11","10.1.0.8","TCP","1134","0.000912000","","","49160  >  7014 [ACK] Seq=277001 Ack=1 Win=131072 Len=1000 TSval=5668 TSecr=5246"
"8576","5.658195","10.1.0.11","10.1.0.8","TCP","1134","0.000912000","","","49160  >  7014 [ACK] Seq=278001 Ack=1 Win=131072 Len=1000 TSval=5669 TSecr=5246"
"8594","5.659701","10.1.0.11","10.1.0.8","TCP","2224","0.001506000","","","49160  >  7014 [ACK] Seq=280001 Ack=1 Win=131072 Len=1000 TSval=5671 TSecr=5246"
"8618","5.663730","10.1.0.11","10.1.0.8","TCP","2224","0.004029000","","","49160  >  7014 [ACK] Seq=282001 Ack=1 Win=131072 Len=1000 TSval=5672 TSecr=5246"
"8627","5.664781","10.1.0.8","10.1.0.11","TCP","2124","0.001051000","-43 dBm","0.037329000,0.037329000,0.037329000,0.037329000,0.037329000,0.037329000,0.037329000,0.037329000,0.037329000,0.037329000,0.037329000,0.037329000,0.037329000,0.037329000,0.037329000,0.037329000,0.037329000,0.033366000,0.033366000,0.031717000,0.030709000,0.028951000,0.027783000,0.026231000,0.024624000,0.023000000,0.021394000","7014  >  49160 [ACK] Seq=1 Ack=261001 Win=131072 Len=0 TSval=5655 TSecr=5654"
"8628","5.664781","10.1.0.8","10.1.0.11","TCP","908","0.000000000","-43 dBm","0.019642000,0.016908000,0.015628000,0.014588000,0.012916000,0.010554000,0.009354000,0.008410000,0.006586000,0.005080000,0.001051000","7014  >  49160 [ACK] Seq=1 Ack=283001 Win=131072 Len=0 TSval=5676 TSecr=5672"
"8650","5.666656","10.1.0.11","10.1.0.8","TCP","7528","0.001875000","","","49160  >  7014 [ACK] Seq=289001 Ack=1 Win=131072 Len=1000 TSval=5678 TSecr=5676"
"8660","5.667784","10.1.0.11","10.1.0.8","TCP","1134","0.001128000","","","49160  >  7014 [ACK] Seq=290001 Ack=1 Win=131072 Len=1000 TSval=5679 TSecr=5676"
"8672","5.668760","10.1.0.11","10.1.0.8","TCP","2224","0.000976000","","","49160  >  7014 [ACK] Seq=292001 Ack=1 Win=131072 Len=1000 TSval=5680 TSecr=5676"
"8690","5.670161","10.1.0.11","10.1.0.8","TCP","1134","0.001401000","","","49160  >  7014 [ACK] Seq=293001 Ack=1 Win=131072 Len=1000 TSval=5681 TSecr=5676"
"8702","5.671073","10.1.0.11","10.1.0.8","TCP","1134","0.000912000","","","49160  >  7014 [ACK] Seq=294001 Ack=1 Win=131072 Len=1000 TSval=5682 TSecr=5676"
"8714","5.672140","10.1.0.11","10.1.0.8","TCP","2224","0.001067000","","","49160  >  7014 [ACK] Seq=296001 Ack=1 Win=131072 Len=1000 TSval=5684 TSecr=5676"
"8728","5.673236","10.1.0.11","10.1.0.8","TCP","1134","0.001096000","","","49160  >  7014 [ACK] Seq=297001 Ack=1 Win=131072 Len=1000 TSval=5684 TSecr=5676"
"8740","5.674148","10.1.0.11","10.1.0.8","TCP","1134","0.000912000","","","49160  >  7014 [ACK] Seq=298001 Ack=1 Win=131072 Len=1000 TSval=5685 TSecr=5676"
"8752","5.675060","10.1.0.11","10.1.0.8","TCP","1134","0.000912000","","","49160  >  7014 [ACK] Seq=299001 Ack=1 Win=131072 Len=1000 TSval=5686 TSecr=5676"
"8764","5.676101","10.1.0.11","10.1.0.8","TCP","2224","0.001041000","","","49160  >  7014 [ACK] Seq=301001 Ack=1 Win=131072 Len=1000 TSval=5688 TSecr=5676"
"8783","5.677752","10.1.0.8","10.1.0.11","TCP","756","0.001651000","-43 dBm","0.011096000,0.011096000,0.011096000,0.008992000,0.007591000,0.005612000,0.004516000,0.002692000,0.001651000","7014  >  49160 [ACK] Seq=1 Ack=302001 Win=131072 Len=0 TSval=5688 TSecr=5687"
"8803","5.679822","10.1.0.11","10.1.0.8","TCP","4376","0.002070000","","","49160  >  7014 [ACK] Seq=305001 Ack=1 Win=131072 Len=1000 TSval=5691 TSecr=5688"
"8820","5.682106","10.1.0.11","10.1.0.8","TCP","3300","0.002284000","","","49160  >  7014 [ACK] Seq=308001 Ack=1 Win=131072 Len=1000 TSval=5693 TSecr=5688"
"8834","5.683490","10.1.0.11","10.1.0.8","TCP","2224","0.001384000","","","49160  >  7014 [ACK] Seq=310001 Ack=1 Win=131072 Len=1000 TSval=5695 TSecr=5688"
"8869","5.686443","10.1.0.11","10.1.0.8","TCP","4376","0.002953000","","","49160  >  7014 [ACK] Seq=314001 Ack=1 Win=131072 Len=1000 TSval=5698 TSecr=5688"
"8908","5.692635","10.1.0.11","10.1.0.8","TCP","6528","0.006192000","","","49160  >  7014 [ACK] Seq=320001 Ack=1 Win=131072 Len=1000 TSval=5703 TSecr=5688"
"8909","5.692635","10.1.0.11","10.1.0.8","TCP","1134","0.000000000","","","49160  >  7014 [ACK] Seq=321001 Ack=1 Win=131072 Len=1000 TSval=5704 TSecr=5688"
"8928","5.695195","10.1.0.11","10.1.0.8","TCP","4376","0.002560000","","","49160  >  7014 [ACK] Seq=325001 Ack=1 Win=131072 Len=1000 TSval=5707 TSecr=5688"
"8948","5.697190","10.1.0.11","10.1.0.8","TCP","2224","0.001995000","","","49160  >  7014 [ACK] Seq=327001 Ack=1 Win=131072 Len=1000 TSval=5708 TSecr=5688"
"8966","5.698879","10.1.0.11","10.1.0.8","TCP","2224","0.001689000","","","49160  >  7014 [ACK] Seq=329001 Ack=1 Win=131072 Len=1000 TSval=5710 TSecr=5688"
"8984","5.700535","10.1.0.11","10.1.0.8","TCP","2224","0.001656000","","","49160  >  7014 [ACK] Seq=331001 Ack=1 Win=131072 Len=1000 TSval=5712 TSecr=5688"
"9002","5.702250","10.1.0.11","10.1.0.8","TCP","2224","0.001715000","","","49160  >  7014 [ACK] Seq=333001 Ack=1 Win=131072 Len=1000 TSval=5713 TSecr=5688"
"9020","5.703938","10.1.0.11","10.1.0.8","TCP","3300","0.001688000","","","49160  >  7014 [ACK] Seq=336001 Ack=1 Win=131072 Len=1000 TSval=5716 TSecr=5688"
"9044","5.706242","10.1.0.11","10.1.0.8","TCP","2224","0.002304000","","","49160  >  7014 [ACK] Seq=338001 Ack=1 Win=131072 Len=1000 TSval=5717 TSecr=5688"
"9072","5.709435","10.1.0.11","10.1.0.8","TCP","4376","0.003193000","","","49160  >  7014 [ACK] Seq=342001 Ack=1 Win=131072 Len=1000 TSval=5720 TSecr=5688"
"9090","5.711379","10.1.0.11","10.1.0.8","TCP","3300","0.001944000","","","49160  >  7014 [ACK] Seq=345001 Ack=1 Win=131072 Len=1000 TSval=5723 TSecr=5688"
"9108","5.713259","10.1.0.11","10.1.0.8","TCP","2224","0.001880000","","","49160  >  7014 [ACK] Seq=347001 Ack=1 Win=131072 Len=1000 TSval=5724 TSecr=5688"
"9116","5.714173","10.1.0.8","10.1.0.11","TCP","1440","0.000914000","-43 dBm","0.034351000,0.034351000,0.032067000,0.030683000,0.027730000,0.027730000,0.021538000,0.021538000,0.021538000,0.021538000,0.018978000,0.018978000,0.016983000,0.015294000,0.013638000,0.011923000,0.010235000,0.007931000","7014  >  49160 [ACK] Seq=1 Ack=338001 Win=131072 Len=0 TSval=5718 TSecr=5716"
"9117","5.714173","10.1.0.8","10.1.0.11","TCP","452","0.000000000","-43 dBm","0.004738000,0.004738000,0.002794000,0.002794000,0.000914000","7014  >  49160 [ACK] Seq=1 Ack=348001 Win=131072 Len=0 TSval=5725 TSecr=5724"
"9136","5.715936","10.1.0.11","10.1.0.8","TCP","4376","0.001763000","","","49160  >  7014 [ACK] Seq=351001 Ack=1 Win=131072 Len=1000 TSval=5728 TSecr=5725"
"9158","5.718297","10.1.0.11","10.1.0.8","TCP","2224","0.002361000","","","49160  >  7014 [ACK] Seq=353001 Ack=1 Win=131072 Len=1000 TSval=5729 TSecr=5725"
"9177","5.720080","10.1.0.11","10.1.0.8","TCP","3300","0.001783000","","","49160  >  7014 [ACK] Seq=356001 Ack=1 Win=131072 Len=1000 TSval=5732 TSecr=5725"
"9178","5.720360","10.1.0.11","10.1.0.8","TCP","3300","0.000280000","","","[TCP Retransmission] [TCP Out-Of-Order] [TCP Out-Of-Order] 49160  >  7014 [ACK] Seq=356001 Ack=1 Win=131072 Len=1000 TSval=5732 TSecr=5725"
"9196","5.722304","10.1.0.11","10.1.0.8","TCP","2224","0.001944000","","","49160  >  7014 [ACK] Seq=358001 Ack=1 Win=131072 Len=1000 TSval=5733 TSecr=5725"
"9214","5.723960","10.1.0.11","10.1.0.8","TCP","3300","0.001656000","","","49160  >  7014 [ACK] Seq=361001 Ack=1 Win=131072 Len=1000 TSval=5736 TSecr=5725"
"9241","5.726568","10.1.0.8","10.1.0.11","TCP","604","0.002608000","-43 dBm","0.010632000,0.010632000,0.008271000,0.006488000,0.004264000,0.002608000,0.002608000","7014  >  49160 [ACK] Seq=1 Ack=362001 Win=131072 Len=0 TSval=5736 TSecr=5735"
"9252","5.727691","10.1.0.11","10.1.0.8","TCP","4376","0.001123000","","","49160  >  7014 [ACK] Seq=365001 Ack=1 Win=131072 Len=1000 TSval=5739 TSecr=5736"
"9270","5.730099","10.1.0.11","10.1.0.8","TCP","3300","0.002408000","","","49160  >  7014 [ACK] Seq=368001 Ack=1 Win=131072 Len=1000 TSval=5741 TSecr=5736"
"9288","5.731883","10.1.0.11","10.1.0.8","TCP","2224","0.001784000","","","49160  >  7014 [ACK] Seq=370001 Ack=1 Win=131072 Len=1000 TSval=5743 TSecr=5736"
"9308","5.733791","10.1.0.11","10.1.0.8","TCP","3300","0.001908000","","","49160  >  7014 [ACK] Seq=373001 Ack=1 Win=131072 Len=1000 TSval=5745 TSecr=5736"
"9326","5.735543","10.1.0.11","10.1.0.8","TCP","2224","0.001752000","","","49160  >  7014 [ACK] Seq=375001 Ack=1 Win=131072 Len=1000 TSval=5747 TSecr=5736"
"9344","5.737232","10.1.0.11","10.1.0.8","TCP","2224","0.001689000","","","49160  >  7014 [ACK] Seq=377001 Ack=1 Win=131072 Len=1000 TSval=5748 TSecr=5736"
"9368","5.739804","10.1.0.11","10.1.0.8","TCP","3300","0.002572000","","","49160  >  7014 [ACK] Seq=380001 Ack=1 Win=131072 Len=1000 TSval=5751 TSecr=5736"
"9384","5.741532","10.1.0.11","10.1.0.8","TCP","3300","0.001728000","","","49160  >  7014 [ACK] Seq=383001 Ack=1 Win=131072 Len=1000 TSval=5753 TSecr=5736"
"9400","5.742972","10.1.0.11","10.1.0.8","TCP","1134","0.001440000","","","49160  >  7014 [ACK] Seq=384001 Ack=1 Win=131072 Len=1000 TSval=5754 TSecr=5736"
"9419","5.744463","10.1.0.11","10.1.0.8","TCP","2224","0.001491000","","","49160  >  7014 [ACK] Seq=386001 Ack=1 Win=131072 Len=1000 TSval=5756 TSecr=5736"
"9420","5.744675","10.1.0.11","10.1.0.8","TCP","2224","0.000212000","","","[TCP Retransmission] [TCP Out-Of-Order] 49160  >  7014 [ACK] Seq=386001 Ack=1 Win=131072 Len=1000 TSval=5756 TSecr=5736"
"9432","5.745811","10.1.0.11","10.1.0.8","TCP","2224","0.001136000","","","49160  >  7014 [ACK] Seq=388001 Ack=1 Win=131072 Len=1000 TSval=5757 TSecr=5736"
"9448","5.747059","10.1.0.11","10.1.0.8","TCP","1134","0.001248000","","","49160  >  7014 [ACK] Seq=389001 Ack=1 Win=131072 Len=1000 TSval=5758 TSecr=5736"
"9460","5.748067","10.1.0.11","10.1.0.8","TCP","2224","0.001008000","","","49160  >  7014 [ACK] Seq=391001 Ack=1 Win=131072 Len=1000 TSval=5760 TSecr=5736"
"9476","5.749315","10.1.0.11","10.1.0.8","TCP","1134","0.001248000","","","49160  >  7014 [ACK] Seq=392001 Ack=1 Win=131072 Len=1000 TSval=5760 TSecr=5736"
"9488","5.750299","10.1.0.11","10.1.0.8","TCP","1134","0.000984000","","","49160  >  7014 [ACK] Seq=393001 Ack=1 Win=131072 Len=1000 TSval=5761 TSecr=5736"
"9500","5.751307","10.1.0.11","10.1.0.8","TCP","2224","0.001008000","","","49160  >  7014 [ACK] Seq=395001 Ack=1 Win=131072 Len=1000 TSval=5763 TSecr=5736"
"9516","5.752556","10.1.0.11","10.1.0.8","TCP","1134","0.001249000","","","49160  >  7014 [ACK] Seq=396001 Ack=1 Win=131072 Len=1000 TSval=5764 TSecr=5736"
"9528","5.753468","10.1.0.11","10.1.0.8","TCP","1134","0.000912000","","","49160  >  7014 [ACK] Seq=397001 Ack=1 Win=131072 Len=1000 TSval=5764 TSecr=5736"
"9540","5.754476","10.1.0.11","10.1.0.8","TCP","2224","0.001008000","","","49160  >  7014 [ACK] Seq=399001 Ack=1 Win=131072 Len=1000 TSval=5766 TSecr=5736"
"9556","5.755805","10.1.0.11","10.1.0.8","TCP","1134","0.001329000","","","49160  >  7014 [ACK] Seq=400001 Ack=1 Win=131072 Len=1000 TSval=5767 TSecr=5736"
"9568","5.756781","10.1.0.11","10.1.0.8","TCP","2224","0.000976000","","","49160  >  7014 [ACK] Seq=402001 Ack=1 Win=131072 Len=1000 TSval=5768 TSecr=5736"
"9586","5.758181","10.1.0.11","10.1.0.8","TCP","1134","0.001400000","","","49160  >  7014 [ACK] Seq=403001 Ack=1 Win=131072 Len=1000 TSval=5769 TSecr=5736"
"9598","5.759158","10.1.0.11","10.1.0.8","TCP","2224","0.000977000","","","49160  >  7014 [ACK] Seq=405001 Ack=1 Win=131072 Len=1000 TSval=5771 TSecr=5736"
"9616","5.760558","10.1.0.11","10.1.0.8","TCP","1134","0.001400000","","","49160  >  7014 [ACK] Seq=406001 Ack=1 Win=131072 Len=1000 TSval=5772 TSecr=5736"
"9647","5.763405","10.1.0.11","10.1.0.8","TCP","4376","0.002847000","","","49160  >  7014 [ACK] Seq=410001 Ack=1 Win=131072 Len=1000 TSval=5775 TSecr=5736"
"9666","5.766089","10.1.0.11","10.1.0.8","TCP","3300","0.002684000","","","49160  >  7014 [ACK] Seq=413001 Ack=1 Win=131072 Len=1000 TSval=5777 TSecr=5736"
"9680","5.767537","10.1.0.11","10.1.0.8","TCP","2224","0.001448000","","","49160  >  7014 [ACK] Seq=415001 Ack=1 Win=131072 Len=1000 TSval=5779 TSecr=5736"
"9695","5.768898","10.1.0.11","10.1.0.8","TCP","2224","0.001361000","","","49160  >  7014 [ACK] Seq=417001 Ack=1 Win=131072 Len=1000 TSval=5780 TSecr=5736"
"9709","5.770154","10.1.0.11","10.1.0.8","TCP","1134","0.001256000","","","49160  >  7014 [ACK] Seq=418001 Ack=1 Win=131072 Len=1000 TSval=5781 TSecr=5736"
"9721","5.771066","10.1.0.11","10.1.0.8","TCP","1134","0.000912000","","","49160  >  7014 [ACK] Seq=419001 Ack=1 Win=131072 Len=1000 TSval=5782 TSecr=5736"
"9735","5.772258","10.1.0.11","10.1.0.8","TCP","2224","0.001192000","","","49160  >  7014 [ACK] Seq=421001 Ack=1 Win=131072 Len=1000 TSval=5784 TSecr=5736"
"9747","5.773266","10.1.0.11","10.1.0.8","TCP","1134","0.001008000","","","49160  >  7014 [ACK] Seq=422001 Ack=1 Win=131072 Len=1000 TSval=5784 TSecr=5736"
"9760","5.774264","10.1.0.11","10.1.0.8","TCP","1134","0.000998000","","","49160  >  7014 [ACK] Seq=423001 Ack=1 Win=131072 Len=1000 TSval=5785 TSecr=5736"
"9772","5.775176","10.1.0.11","10.1.0.8","TCP","2224","0.000912000","","","49160  >  7014 [ACK] Seq=425001 Ack=1 Win=131072 Len=1000 TSval=5787 TSecr=5736"
"9788","5.776521","10.1.0.11","10.1.0.8","TCP","1134","0.001345000","","","49160  >  7014 [ACK] Seq=426001 Ack=1 Win=131072 Len=1000 TSval=5788 TSecr=5736"
"9800","5.777433","10.1.0.11","10.1.0.8","TCP","1134","0.000912000","","","49160  >  7014 [ACK] Seq=427001 Ack=1 Win=131072 Len=1000 TSval=5788 TSecr=5736"
"9812","5.778345","10.1.0.11","10.1.0.8","TCP","2224","0.000912000","","","49160  >  7014 [ACK] Seq=429001 Ack=1 Win=131072 Len=1000 TSval=5790 TSecr=5736"
"9839","5.780946","10.1.0.11","10.1.0.8","TCP","3300","0.002601000","","","49160  >  7014 [ACK] Seq=432001 Ack=1 Win=131072 Len=1000 TSval=5792 TSecr=5736"
