"No.","Time","Source","Destination","Protocol","Length","Time delta from previous displayed frame","Signal strength (dBm)","The RTT to ACK the segment was","Info"
"179","0.937691","10.1.0.11","10.1.0.2","TCP","138","0.000000000","-37 dBm","","49154  >  7002 [SYN] Seq=0 Win=65535 Len=0 TSval=950 TSecr=0 WS=4 SACK_PERM=1"
"182","0.937846","10.1.0.2","10.1.0.11","TCP","138","0.000155000","","0.000155000","7002  >  49154 [SYN, ACK] Seq=0 Ack=1 Win=65535 Len=0 TSval=950 TSecr=950 WS=4 SACK_PERM=1"
"191","0.938720","10.1.0.11","10.1.0.2","TCP","134","0.000874000","-37 dBm","0.000874000","49154  >  7002 [ACK] Seq=1 Ack=1 Win=131072 Len=0 TSval=950 TSecr=950"
"194","0.938866","10.1.0.2","10.1.0.11","TCP","138","0.000146000","","","49153  >  7003 [SYN] Seq=0 Win=65535 Len=0 TSval=950 TSecr=0 WS=4 SACK_PERM=1"
"197","0.939141","10.1.0.11","10.1.0.2","TCP","138","0.000275000","-37 dBm","0.000275000","7003  >  49153 [SYN, ACK] Seq=0 Ack=1 Win=65535 Len=0 TSval=951 TSecr=950 WS=4 SACK_PERM=1"
"200","0.939287","10.1.0.2","10.1.0.11","TCP","134","0.000146000","","0.000146000","49153  >  7003 [ACK] Seq=1 Ack=1 Win=131072 Len=0 TSval=951 TSecr=951"
"1010","4.838801","10.1.0.11","10.1.0.2","TCP","1134","3.899514000","-37 dBm","","49154  >  7002 [ACK] Seq=1 Ack=1 Win=131072 Len=1000 TSval=4851 TSecr=950"
"1024","4.839865","10.1.0.11","10.1.0.2","TCP","1134","0.001064000","-37 dBm","","49154  >  7002 [ACK] Seq=1001 Ack=1 Win=131072 Len=1000 TSval=4852 TSecr=950"
"1044","4.841577","10.1.0.11","10.1.0.2","TCP","2224","0.001712000","-37 dBm","","49154  >  7002 [ACK] Seq=3001 Ack=1 Win=131072 Len=1000 TSval=4853 TSecr=950"
"1064","4.843481","10.1.0.11","10.1.0.2","TCP","2224","0.001904000","-37 dBm","","49154  >  7002 [ACK] Seq=5001 Ack=1 Win=131072 Len=1000 TSval=4855 TSecr=950"
"1079","4.845047","10.1.0.2","10.1.0.11","TCP","6528","0.001566000","","","49153  >  7003 [ACK] Seq=5001 Ack=1 Win=131072 Len=1000 TSval=4856 TSecr=951"
"1080","4.845047","10.1.0.2","10.1.0.11","TCP","1134","0.000000000","","","49153  >  7003 [ACK] Seq=6001 Ack=1 Win=131072 Len=1000 TSval=4857 TSecr=951"
"1093","4.847153","10.1.0.11","10.1.0.2","TCP","5452","0.002106000","-37 dBm","","49154  >  7002 [ACK] Seq=10001 Ack=1 Win=131072 Len=1000 TSval=4859 TSecr=950"
"1113","4.849490","10.1.0.11","10.1.0.2","TCP","3300","0.002337000","-37 dBm","","49154  >  7002 [ACK] Seq=13001 Ack=1 Win=131072 Len=1000 TSval=4861 TSecr=950"
"1163","4.857050","10.1.0.2","10.1.0.11","TCP","604","0.007560000","","0.018249000,0.015473000,0.013569000,0.009897000,0.009897000,0.009897000,0.007560000","7002  >  49154 [ACK] Seq=1 Ack=13001 Win=131072 Len=0 TSval=4862 TSecr=4860"
"1196","4.861014","10.1.0.11","10.1.0.2","TCP","1134","0.003964000","-37 dBm","","49154  >  7002 [ACK] Seq=14001 Ack=1 Win=131072 Len=1000 TSval=4862 TSecr=950"
"1225","4.864414","10.1.0.2","10.1.0.11","TCP","6528","0.003400000","","","[TCP Retransmission] [TCP Retransmission] [TCP Retransmission] [TCP Retransmission] [TCP Retransmission] [TCP Retransmission] 49153  >  7003 [ACK] Seq=5001 Ack=1 Win=131072 Len=1000 TSval=4856 TSecr=951"
"1226","4.864414","10.1.0.2","10.1.0.11","TCP","1136","0.000000000","","","[TCP Retransmission] 49153  >  7003 [ACK] Seq=6001 Ack=1 Win=131072 Len=1000 TSval=4857 TSecr=951"
"1227","4.864414","10.1.0.2","10.1.0.11","TCP","6528","0.000000000","","","49153  >  7003 [ACK] Seq=12001 Ack=1 Win=131072 Len=1000 TSval=4862 TSecr=951"
"1228","4.864414","10.1.0.2","10.1.0.11","TCP","2224","0.000000000","","","49153  >  7003 [ACK] Seq=14001 Ack=1 Win=131072 Len=1000 TSval=4863 TSecr=951"
"1327","4.875621","10.1.0.2","10.1.0.11","TCP","604","0.011207000","","","7002  >  49154 [ACK] Seq=1 Ack=13001 Win=131072 Len=0 TSval=4862 TSecr=4860"
"1328","4.875621","10.1.0.2","10.1.0.11","TCP","134","0.000000000","","0.014607000","7002  >  49154 [ACK] Seq=1 Ack=15001 Win=131072 Len=0 TSval=4873 TSecr=4861"
"1335","4.877236","10.1.0.11","10.1.0.2","TCP","6376","0.001615000","-37 dBm","","49154  >  7002 [ACK] Seq=19501 Ack=1 Win=131072 Len=1500 TSval=4888 TSecr=4854"
"1336","4.877236","10.1.0.11","10.1.0.2","TCP","6376","0.000000000","-37 dBm","","49154  >  7002 [ACK] Seq=25501 Ack=1 Win=131072 Len=1500 TSval=4888 TSecr=4859"
"1337","4.877236","10.1.0.11","10.1.0.2","TCP","6376","0.000000000","-37 dBm","","49154  >  7002 [ACK] Seq=31501 Ack=1 Win=131072 Len=1500 TSval=4888 TSecr=4859"
"1338","4.877236","10.1.0.11","10.1.0.2","TCP","6376","0.000000000","-37 dBm","","49154  >  7002 [ACK] Seq=37501 Ack=1 Win=131072 Len=1500 TSval=4888 TSecr=4862"
"1339","4.877236","10.1.0.11","10.1.0.2","TCP","6376","0.000000000","-37 dBm","","49154  >  7002 [ACK] Seq=43501 Ack=1 Win=131072 Len=1500 TSval=4888 TSecr=4873"
"1346","4.877772","10.1.0.2","10.1.0.11","TCP","832","0.000536000","","0.000536000,0.000536000,0.000536000,0.000536000,0.000536000,0.000536000,0.000536000,0.000536000,0.000536000,0.000536000","7002  >  49154 [ACK] Seq=1 Ack=45001 Win=131072 Len=0 TSval=4889 TSecr=4888"
"1352","4.878463","10.1.0.11","10.1.0.2","TCP","5376","0.000691000","-37 dBm","","49154  >  7002 [ACK] Seq=49001 Ack=1 Win=131072 Len=1000 TSval=4890 TSecr=4889"
"1360","4.879247","10.1.0.11","10.1.0.2","TCP","1134","0.000784000","-37 dBm","","49154  >  7002 [ACK] Seq=50001 Ack=1 Win=131072 Len=1000 TSval=4891 TSecr=4889"
"1366","4.879703","10.1.0.11","10.1.0.2","TCP","1134","0.000456000","-37 dBm","","49154  >  7002 [ACK] Seq=51001 Ack=1 Win=131072 Len=1000 TSval=4892 TSecr=4889"
"1396","4.881932","10.1.0.2","10.1.0.11","TCP","300","0.002229000","","0.003469000,0.003469000,0.002229000","7002  >  49154 [ACK] Seq=1 Ack=52001 Win=131072 Len=0 TSval=4892 TSecr=4891"
"1399","4.882294","10.1.0.11","10.1.0.2","TCP","1136","0.000362000","-37 dBm","","49154  >  7002 [ACK] Seq=52001 Ack=1 Win=131072 Len=1000 TSval=4892 TSecr=4889"
"1400","4.882294","10.1.0.11","10.1.0.2","TCP","2224","0.000000000","-37 dBm","","49154  >  7002 [ACK] Seq=54001 Ack=1 Win=131072 Len=1000 TSval=4894 TSecr=4889"
"1426","4.886686","10.1.0.11","10.1.0.2","TCP","5452","0.004392000","-37 dBm","","49154  >  7002 [ACK] Seq=59001 Ack=1 Win=131072 Len=1000 TSval=4898 TSecr=4892"
"1436","4.887977","10.1.0.11","10.1.0.2","TCP","2224","0.001291000","-37 dBm","","49154  >  7002 [ACK] Seq=61001 Ack=1 Win=131072 Len=1000 TSval=4900 TSecr=4892"
"1444","4.888585","10.1.0.11","10.1.0.2","TCP","1134","0.000608000","-37 dBm","","49154  >  7002 [ACK] Seq=62001 Ack=1 Win=131072 Len=1000 TSval=4900 TSecr=4892"
"1456","4.889427","10.1.0.2","10.1.0.11","TCP","452","0.000842000","","0.007133000,0.002741000,0.002741000,0.002741000,0.001450000","7002  >  49154 [ACK] Seq=1 Ack=62001 Win=131072 Len=0 TSval=4900 TSecr=4899"
"1463","4.890208","10.1.0.11","10.1.0.2","TCP","1134","0.000781000","-37 dBm","","[TCP Previous segment not captured] 49154  >  7002 [ACK] Seq=64001 Ack=1 Win=131072 Len=1000 TSval=4902 TSecr=4892"
"1465","4.890364","10.1.0.11","10.1.0.2","TCP","1134","0.000156000","-37 dBm","","[TCP Out-Of-Order] 49154  >  7002 [ACK] Seq=63001 Ack=1 Win=131072 Len=1000 TSval=4901 TSecr=4892"
"1483","4.892756","10.1.0.11","10.1.0.2","TCP","3300","0.002392000","-37 dBm","","49154  >  7002 [ACK] Seq=67001 Ack=1 Win=131072 Len=1000 TSval=4904 TSecr=4892"
"1495","4.894052","10.1.0.11","10.1.0.2","TCP","2224","0.001296000","-37 dBm","","49154  >  7002 [ACK] Seq=69001 Ack=1 Win=131072 Len=1000 TSval=4906 TSecr=4892"
"1509","4.895180","10.1.0.11","10.1.0.2","TCP","1134","0.001128000","-37 dBm","","49154  >  7002 [ACK] Seq=70001 Ack=1 Win=131072 Len=1000 TSval=4907 TSecr=4892"
"1522","4.896219","10.1.0.11","10.1.0.2","TCP","1134","0.001039000","-37 dBm","","49154  >  7002 [ACK] Seq=71001 Ack=1 Win=131072 Len=1000 TSval=4908 TSecr=4892"
"1532","4.897012","10.1.0.11","10.1.0.2","TCP","1134","0.000793000","-37 dBm","","49154  >  7002 [ACK] Seq=72001 Ack=1 Win=131072 Len=1000 TSval=4908 TSecr=4892"
"1542","4.897804","10.1.0.11","10.1.0.2","TCP","1134","0.000792000","-37 dBm","","49154  >  7002 [ACK] Seq=73001 Ack=1 Win=131072 Len=1000 TSval=4909 TSecr=4892"
"1552","4.898596","10.1.0.11","10.1.0.2","TCP","1134","0.000792000","-37 dBm","","49154  >  7002 [ACK] Seq=74001 Ack=1 Win=131072 Len=1000 TSval=4910 TSecr=4892"
"1562","4.899356","10.1.0.11","10.1.0.2","TCP","1134","0.000760000","-37 dBm","","49154  >  7002 [ACK] Seq=75001 Ack=1 Win=131072 Len=1000 TSval=4911 TSecr=4892"
"1574","4.900332","10.1.0.11","10.1.0.2","TCP","1134","0.000976000","-37 dBm","","49154  >  7002 [ACK] Seq=76001 Ack=1 Win=131072 Len=1000 TSval=4912 TSecr=4892"
"1582","4.901044","10.1.0.11","10.1.0.2","TCP","1134","0.000712000","-37 dBm","","49154  >  7002 [ACK] Seq=77001 Ack=1 Win=131072 Len=1000 TSval=4912 TSecr=4892"
"1592","4.901836","10.1.0.11","10.1.0.2","TCP","1134","0.000792000","-37 dBm","","49154  >  7002 [ACK] Seq=78001 Ack=1 Win=131072 Len=1000 TSval=4913 TSecr=4892"
"1602","4.902628","10.1.0.11","10.1.0.2","TCP","1134","0.000792000","-37 dBm","","49154  >  7002 [ACK] Seq=79001 Ack=1 Win=131072 Len=1000 TSval=4914 TSecr=4892"
"1612","4.903420","10.1.0.11","10.1.0.2","TCP","1134","0.000792000","-37 dBm","","49154  >  7002 [ACK] Seq=80001 Ack=1 Win=131072 Len=1000 TSval=4915 TSecr=4892"
"1622","4.904213","10.1.0.11","10.1.0.2","TCP","1134","0.000793000","-37 dBm","","49154  >  7002 [ACK] Seq=81001 Ack=1 Win=131072 Len=1000 TSval=4916 TSecr=4892"
"1632","4.905005","10.1.0.11","10.1.0.2","TCP","1134","0.000792000","-37 dBm","","49154  >  7002 [ACK] Seq=82001 Ack=1 Win=131072 Len=1000 TSval=4916 TSecr=4892"
"1642","4.905797","10.1.0.11","10.1.0.2","TCP","1134","0.000792000","-37 dBm","","49154  >  7002 [ACK] Seq=83001 Ack=1 Win=131072 Len=1000 TSval=4917 TSecr=4892"
"1653","4.906670","10.1.0.11","10.1.0.2","TCP","1134","0.000873000","-37 dBm","","49154  >  7002 [ACK] Seq=84001 Ack=1 Win=131072 Len=1000 TSval=4918 TSecr=4892"
"1665","4.907774","10.1.0.11","10.1.0.2","TCP","2224","0.001104000","-37 dBm","","49154  >  7002 [ACK] Seq=86001 Ack=1 Win=131072 Len=1000 TSval=4920 TSecr=4892"
"1677","4.908686","10.1.0.11","10.1.0.2","TCP","1134","0.000912000","-37 dBm","","49154  >  7002 [ACK] Seq=87001 Ack=1 Win=131072 Len=1000 TSval=4920 TSecr=4892"
"1689","4.909598","10.1.0.11","10.1.0.2","TCP","1134","0.000912000","-37 dBm","","49154  >  7002 [ACK] Seq=88001 Ack=1 Win=131072 Len=1000 TSval=4921 TSecr=4892"
"1701","4.910510","10.1.0.11","10.1.0.2","TCP","1134","0.000912000","-37 dBm","","49154  >  7002 [ACK] Seq=89001 Ack=1 Win=131072 Len=1000 TSval=4922 TSecr=4892"
"1713","4.911455","10.1.0.11","10.1.0.2","TCP","1134","0.000945000","-37 dBm","","49154  >  7002 [ACK] Seq=90001 Ack=1 Win=131072 Len=1000 TSval=4923 TSecr=4892"
"1724","4.912608","10.1.0.11","10.1.0.2","TCP","2224","0.001153000","-37 dBm","","49154  >  7002 [ACK] Seq=92001 Ack=1 Win=131072 Len=1000 TSval=4924 TSecr=4892"
"1736","4.913584","10.1.0.11","10.1.0.2","TCP","1134","0.000976000","-37 dBm","","49154  >  7002 [ACK] Seq=93001 Ack=1 Win=131072 Len=1000 TSval=4925 TSecr=4892"
"1748","4.914496","10.1.0.11","10.1.0.2","TCP","1134","0.000912000","-37 dBm","","49154  >  7002 [ACK] Seq=94001 Ack=1 Win=131072 Len=1000 TSval=4926 TSecr=4892"
"1760","4.915440","10.1.0.11","10.1.0.2","TCP","1134","0.000944000","-37 dBm","","49154  >  7002 [ACK] Seq=95001 Ack=1 Win=131072 Len=1000 TSval=4927 TSecr=4892"
"1770","4.916232","10.1.0.11","10.1.0.2","TCP","1134","0.000792000","-37 dBm","","49154  >  7002 [ACK] Seq=96001 Ack=1 Win=131072 Len=1000 TSval=4928 TSecr=4892"
"1780","4.917024","10.1.0.11","10.1.0.2","TCP","1134","0.000792000","-37 dBm","","49154  >  7002 [ACK] Seq=97001 Ack=1 Win=131072 Len=1000 TSval=4928 TSecr=4892"
"1792","4.918335","10.1.0.11","10.1.0.2","TCP","2224","0.001311000","-37 dBm","","49154  >  7002 [ACK] Seq=99001 Ack=1 Win=131072 Len=1000 TSval=4930 TSecr=4892"
"1804","4.919344","10.1.0.11","10.1.0.2","TCP","1134","0.001009000","-37 dBm","","49154  >  7002 [ACK] Seq=100001 Ack=1 Win=131072 Len=1000 TSval=4931 TSecr=4892"
"1814","4.920104","10.1.0.11","10.1.0.2","TCP","1134","0.000760000","-37 dBm","","49154  >  7002 [ACK] Seq=101001 Ack=1 Win=131072 Len=1000 TSval=4932 TSecr=4892"
"1826","4.921048","10.1.0.11","10.1.0.2","TCP","1134","0.000944000","-37 dBm","","49154  >  7002 [ACK] Seq=102001 Ack=1 Win=131072 Len=1000 TSval=4932 TSecr=4892"
"1834","4.921688","10.1.0.11","10.1.0.2","TCP","1134","0.000640000","-37 dBm","","49154  >  7002 [ACK] Seq=103001 Ack=1 Win=131072 Len=1000 TSval=4933 TSecr=4892"
"1840","4.922144","10.1.0.11","10.1.0.2","TCP","1134","0.000456000","-37 dBm","","49154  >  7002 [ACK] Seq=104001 Ack=1 Win=131072 Len=1000 TSval=4934 TSecr=4892"
"1869","4.924390","10.1.0.11","10.1.0.2","TCP","680","0.002246000","-37 dBm","0.079343000,0.079343000,0.079343000,0.079343000,0.059976000,0.059976000,0.059976000,0.059976000","7003  >  49153 [ACK] Seq=1 Ack=15001 Win=131072 Len=0 TSval=4877 TSecr=4862"
"1882","4.927232","10.1.0.2","10.1.0.11","TCP","6376","0.002842000","","","49153  >  7003 [ACK] Seq=19501 Ack=1 Win=131072 Len=1500 TSval=4936 TSecr=4877"
"1883","4.927232","10.1.0.2","10.1.0.11","TCP","6376","0.000000000","","","49153  >  7003 [ACK] Seq=25501 Ack=1 Win=131072 Len=1500 TSval=4936 TSecr=4877"
"1884","4.927232","10.1.0.2","10.1.0.11","TCP","6376","0.000000000","","","49153  >  7003 [ACK] Seq=31501 Ack=1 Win=131072 Len=1500 TSval=4936 TSecr=4877"
"1885","4.927232","10.1.0.2","10.1.0.11","TCP","6376","0.000000000","","","49153  >  7003 [ACK] Seq=37501 Ack=1 Win=131072 Len=1500 TSval=4936 TSecr=4877"
"1886","4.927232","10.1.0.2","10.1.0.11","TCP","6376","0.000000000","","","49153  >  7003 [ACK] Seq=43501 Ack=1 Win=131072 Len=1500 TSval=4936 TSecr=4877"
"1905","4.931763","10.1.0.11","10.1.0.2","TCP","1136","0.004531000","-37 dBm","","49154  >  7002 [ACK] Seq=105001 Ack=1 Win=131072 Len=1000 TSval=4935 TSecr=4892"
"1906","4.931763","10.1.0.11","10.1.0.2","TCP","2224","0.000000000","-37 dBm","","49154  >  7002 [ACK] Seq=107001 Ack=1 Win=131072 Len=1000 TSval=4936 TSecr=4892"
"1907","4.931763","10.1.0.11","10.1.0.2","TCP","6528","0.000000000","-37 dBm","","49154  >  7002 [ACK] Seq=113001 Ack=1 Win=131072 Len=1000 TSval=4941 TSecr=4892"
"1908","4.931763","10.1.0.11","10.1.0.2","TCP","2224","0.000000000","-37 dBm","","49154  >  7002 [ACK] Seq=115001 Ack=1 Win=131072 Len=1000 TSval=4943 TSecr=4892"
"1916","4.933032","10.1.0.11","10.1.0.2","TCP","2224","0.001269000","-37 dBm","","49154  >  7002 [ACK] Seq=117001 Ack=1 Win=131072 Len=1000 TSval=4944 TSecr=4892"
"1943","4.937227","10.1.0.2","10.1.0.11","TCP","6376","0.004195000","","","[TCP Retransmission] [TCP Retransmission] [TCP Retransmission] [TCP Retransmission] 49153  >  7003 [ACK] Seq=19501 Ack=1 Win=131072 Len=1500 TSval=4936 TSecr=4877"
"1944","4.937227","10.1.0.2","10.1.0.11","TCP","6376","0.000000000","","","[TCP Retransmission] [TCP Retransmission] [TCP Retransmission] [TCP Retransmission] 49153  >  7003 [ACK] Seq=25501 Ack=1 Win=131072 Len=1500 TSval=4936 TSecr=4877"
"1945","4.937227","10.1.0.2","10.1.0.11","TCP","6376","0.000000000","","","[TCP Retransmission] [TCP Retransmission] [TCP Retransmission] [TCP Retransmission] 49153  >  7003 [ACK] Seq=31501 Ack=1 Win=131072 Len=1500 TSval=4936 TSecr=4877"
"1946","4.937227","10.1.0.2","10.1.0.11","TCP","6376","0.000000000","","","[TCP Retransmission] [TCP Retransmission] [TCP Retransmission] [TCP Retransmission] 49153  >  7003 [ACK] Seq=37501 Ack=1 Win=131072 Len=1500 TSval=4936 TSecr=4877"
"1947","4.937227","10.1.0.2","10.1.0.11","TCP","6376","0.000000000","","","[TCP Retransmission] [TCP Retransmission] [TCP Retransmission] [TCP Retransmission] 49153  >  7003 [ACK] Seq=43501 Ack=1 Win=131072 Len=1500 TSval=4936 TSecr=4877"
"1950","4.938470","10.1.0.2","10.1.0.11","TCP","452","0.001243000","","","7002  >  49154 [ACK] Seq=1 Ack=62001 Win=131072 Len=0 TSval=4900 TSecr=4899"
"1951","4.938470","10.1.0.2","10.1.0.11","TCP","2200","0.000000000","","0.048106000,0.045714000,0.045714000,0.044418000,0.042251000,0.040666000,0.039114000,0.037426000,0.035842000,0.034257000,0.032673000,0.030696000,0.029784000,0.027960000,0.025862000,0.024886000,0.023030000,0.021446000,0.020135000,0.018366000,0.016782000,0.006707000,0.006707000,0.006707000,0.006707000,0.006707000,0.006707000,0.005438000","7002  >  49154 [ACK] Seq=1 Ack=118001 Win=131072 Len=0 TSval=4945 TSecr=4944"
"2134","4.964181","10.1.0.2","10.1.0.11","TCP","452","0.025711000","","","7002  >  49154 [ACK] Seq=1 Ack=62001 Win=131072 Len=0 TSval=4900 TSecr=4899"
"2135","4.964181","10.1.0.2","10.1.0.11","TCP","2200","0.000000000","","","7002  >  49154 [ACK] Seq=1 Ack=118001 Win=131072 Len=0 TSval=4945 TSecr=4944"
"2145","4.966474","10.1.0.11","10.1.0.2","TCP","6376","0.002293000","-37 dBm","","49154  >  7002 [ACK] Seq=122501 Ack=1 Win=131072 Len=1500 TSval=4976 TSecr=4899"
"2146","4.966474","10.1.0.11","10.1.0.2","TCP","6376","0.000000000","-37 dBm","","49154  >  7002 [ACK] Seq=128501 Ack=1 Win=131072 Len=1500 TSval=4976 TSecr=4899"
"2147","4.966474","10.1.0.11","10.1.0.2","TCP","6376","0.000000000","-37 dBm","","49154  >  7002 [ACK] Seq=134501 Ack=1 Win=131072 Len=1500 TSval=4976 TSecr=4900"
"2148","4.966474","10.1.0.11","10.1.0.2","TCP","6376","0.000000000","-37 dBm","","49154  >  7002 [ACK] Seq=140501 Ack=1 Win=131072 Len=1500 TSval=4976 TSecr=4902"
"2149","4.966474","10.1.0.11","10.1.0.2","TCP","6376","0.000000000","-37 dBm","","49154  >  7002 [ACK] Seq=146501 Ack=1 Win=131072 Len=1500 TSval=4976 TSecr=4905"
"2150","4.966474","10.1.0.11","10.1.0.2","TCP","6376","0.000000000","-37 dBm","","49154  >  7002 [ACK] Seq=152501 Ack=1 Win=131072 Len=1500 TSval=4976 TSecr=4906"
"2151","4.966474","10.1.0.11","10.1.0.2","TCP","4300","0.000000000","-37 dBm","","49154  >  7002 [ACK] Seq=157001 Ack=1 Win=131072 Len=1000 TSval=4976 TSecr=4908"
"2172","4.969762","10.1.0.11","10.1.0.2","TCP","6528","0.003288000","-37 dBm","","49154  >  7002 [ACK] Seq=163001 Ack=1 Win=131072 Len=1000 TSval=4981 TSecr=4945"
"2177","4.970174","10.1.0.2","10.1.0.11","TCP","1288","0.000412000","","0.003700000,0.003700000,0.003700000,0.003700000,0.003700000,0.003700000,0.003700000,0.003700000,0.003700000,0.003700000,0.003700000,0.003700000,0.003700000,0.000412000,0.000412000,0.000412000","7002  >  49154 [ACK] Seq=1 Ack=163001 Win=131072 Len=0 TSval=4982 TSecr=4980"
"2187","4.971321","10.1.0.11","10.1.0.2","TCP","2224","0.001147000","-37 dBm","","49154  >  7002 [ACK] Seq=165001 Ack=1 Win=131072 Len=1000 TSval=4983 TSecr=4982"
"2191","4.971657","10.1.0.11","10.1.0.2","TCP","1134","0.000336000","-37 dBm","","49154  >  7002 [ACK] Seq=166001 Ack=1 Win=131072 Len=1000 TSval=4984 TSecr=4982"
"2212","4.974372","10.1.0.11","10.1.0.2","TCP","3300","0.002715000","-37 dBm","","49154  >  7002 [ACK] Seq=169001 Ack=1 Win=131072 Len=1000 TSval=4986 TSecr=4982"
"2218","4.974956","10.1.0.11","10.1.0.2","TCP","1134","0.000584000","-37 dBm","","49154  >  7002 [ACK] Seq=170001 Ack=1 Win=131072 Len=1000 TSval=4987 TSecr=4982"
"2237","4.976433","10.1.0.11","10.1.0.2","TCP","2224","0.001477000","-37 dBm","","49154  >  7002 [ACK] Seq=172001 Ack=1 Win=131072 Len=1000 TSval=4988 TSecr=4982"
"2258","4.979705","10.1.0.11","10.1.0.2","TCP","4376","0.003272000","-37 dBm","","49154  >  7002 [ACK] Seq=176001 Ack=1 Win=131072 Len=1000 TSval=4992 TSecr=4982"
"2266","4.980505","10.1.0.11","10.1.0.2","TCP","1134","0.000800000","-37 dBm","","49154  >  7002 [ACK] Seq=177001 Ack=1 Win=131072 Len=1000 TSval=4992 TSecr=4982"
"2278","4.981439","10.1.0.11","10.1.0.2","TCP","1134","0.000934000","-37 dBm","","49154  >  7002 [ACK] Seq=178001 Ack=1 Win=131072 Len=1000 TSval=4993 TSecr=4982"
"2286","4.982048","10.1.0.11","10.1.0.2","TCP","1134","0.000609000","-37 dBm","","49154  >  7002 [ACK] Seq=179001 Ack=1 Win=131072 Len=1000 TSval=4994 TSecr=4982"
"2295","4.982938","10.1.0.11","10.1.0.2","TCP","1134","0.000890000","-37 dBm","","49154  >  7002 [ACK] Seq=180001 Ack=1 Win=131072 Len=1000 TSval=4995 TSecr=4982"
"2304","4.983728","10.1.0.2","10.1.0.11","TCP","756","0.000790000","","0.012407000,0.012071000,0.009356000,0.008772000,0.007295000,0.004023000,0.004023000,0.002289000,0.000790000","7002  >  49154 [ACK] Seq=1 Ack=181001 Win=131072 Len=0 TSval=4995 TSecr=4994"
"2308","4.984337","10.1.0.11","10.1.0.2","TCP","1134","0.000609000","-37 dBm","","49154  >  7002 [ACK] Seq=181001 Ack=1 Win=131072 Len=1000 TSval=4996 TSecr=4982"
"2327","4.987197","10.1.0.11","10.1.0.2","TCP","4376","0.002860000","-37 dBm","","49154  >  7002 [ACK] Seq=185001 Ack=1 Win=131072 Len=1000 TSval=4999 TSecr=4982"
"2335","4.988061","10.1.0.11","10.1.0.2","TCP","1134","0.000864000","-37 dBm","","49154  >  7002 [ACK] Seq=186001 Ack=1 Win=131072 Len=1000 TSval=5000 TSecr=4982"
"2341","4.988517","10.1.0.11","10.1.0.2","TCP","1134","0.000456000","-37 dBm","","49154  >  7002 [ACK] Seq=187001 Ack=1 Win=131072 Len=1000 TSval=5000 TSecr=4982"
"2353","4.989391","10.1.0.2","10.1.0.11","TCP","756","0.000874000","","","7002  >  49154 [ACK] Seq=1 Ack=181001 Win=131072 Len=0 TSval=4995 TSecr=4994"
"2354","4.989391","10.1.0.2","10.1.0.11","TCP","300","0.000000000","","0.002194000,0.002194000,0.001330000","7002  >  49154 [ACK] Seq=1 Ack=187001 Win=131072 Len=0 TSval=5000 TSecr=4999"
"2355","4.989672","10.1.0.11","10.1.0.2","TCP","1134","0.000281000","-37 dBm","","49154  >  7002 [ACK] Seq=188001 Ack=1 Win=131072 Len=1000 TSval=5001 TSecr=4982"
"2369","4.991540","10.1.0.11","10.1.0.2","TCP","2224","0.001868000","-37 dBm","","49154  >  7002 [ACK] Seq=190001 Ack=1 Win=131072 Len=1000 TSval=5003 TSecr=4982"
"2377","4.992308","10.1.0.11","10.1.0.2","TCP","1134","0.000768000","-37 dBm","","49154  >  7002 [ACK] Seq=191001 Ack=1 Win=131072 Len=1000 TSval=5004 TSecr=4982"
"2383","4.992765","10.1.0.11","10.1.0.2","TCP","1134","0.000457000","-37 dBm","","49154  >  7002 [ACK] Seq=192001 Ack=1 Win=131072 Len=1000 TSval=5004 TSecr=4982"
"2393","4.993525","10.1.0.11","10.1.0.2","TCP","1134","0.000760000","-37 dBm","","49154  >  7002 [ACK] Seq=193001 Ack=1 Win=131072 Len=1000 TSval=5005 TSecr=4982"
"2403","4.994285","10.1.0.11","10.1.0.2","TCP","1134","0.000760000","-37 dBm","","49154  >  7002 [ACK] Seq=194001 Ack=1 Win=131072 Len=1000 TSval=5006 TSecr=4982"
"2421","4.995885","10.1.0.11","10.1.0.2","TCP","1136","0.001600000","-37 dBm","","49154  >  7002 [ACK] Seq=195001 Ack=1 Win=131072 Len=1000 TSval=5007 TSecr=4982"
"2422","4.995885","10.1.0.11","10.1.0.2","TCP","1134","0.000000000","-37 dBm","","49154  >  7002 [ACK] Seq=196001 Ack=1 Win=131072 Len=1000 TSval=5008 TSecr=4982"
"2432","4.996777","10.1.0.11","10.1.0.2","TCP","1134","0.000892000","-37 dBm","","49154  >  7002 [ACK] Seq=197001 Ack=1 Win=131072 Len=1000 TSval=5008 TSecr=4982"
"2442","4.997537","10.1.0.11","10.1.0.2","TCP","1134","0.000760000","-37 dBm","","49154  >  7002 [ACK] Seq=198001 Ack=1 Win=131072 Len=1000 TSval=5009 TSecr=4982"
"2452","4.998297","10.1.0.11","10.1.0.2","TCP","1134","0.000760000","-37 dBm","","49154  >  7002 [ACK] Seq=199001 Ack=1 Win=131072 Len=1000 TSval=5010 TSecr=4982"
"2462","4.999057","10.1.0.11","10.1.0.2","TCP","1134","0.000760000","-37 dBm","","49154  >  7002 [ACK] Seq=200001 Ack=1 Win=131072 Len=1000 TSval=5011 TSecr=4982"
"2472","4.999818","10.1.0.11","10.1.0.2","TCP","1134","0.000761000","-37 dBm","","49154  >  7002 [ACK] Seq=201001 Ack=1 Win=131072 Len=1000 TSval=5012 TSecr=4982"
"2482","5.000578","10.1.0.11","10.1.0.2","TCP","1134","0.000760000","-37 dBm","","49154  >  7002 [ACK] Seq=202001 Ack=1 Win=131072 Len=1000 TSval=5012 TSecr=4982"
"2511","5.002797","10.1.0.11","10.1.0.2","TCP","2224","0.002219000","-37 dBm","","49154  >  7002 [ACK] Seq=204001 Ack=1 Win=131072 Len=1000 TSval=5014 TSecr=4982"
"2539","5.007645","10.1.0.11","10.1.0.2","TCP","6528","0.004848000","-37 dBm","","49154  >  7002 [ACK] Seq=210001 Ack=1 Win=131072 Len=1000 TSval=5019 TSecr=4982"
"2558","5.010170","10.1.0.11","10.1.0.2","TCP","4376","0.002525000","-37 dBm","","49154  >  7002 [ACK] Seq=214001 Ack=1 Win=131072 Len=1000 TSval=5022 TSecr=4982"
"2572","5.011459","10.1.0.11","10.1.0.2","TCP","1134","0.001289000","-37 dBm","","49154  >  7002 [ACK] Seq=215001 Ack=1 Win=131072 Len=1000 TSval=5023 TSecr=4982"
"2582","5.012219","10.1.0.11","10.1.0.2","TCP","1134","0.000760000","-37 dBm","","49154  >  7002 [ACK] Seq=216001 Ack=1 Win=131072 Len=1000 TSval=5024 TSecr=4982"
"2596","5.013475","10.1.0.11","10.1.0.2","TCP","2224","0.001256000","-37 dBm","","49154  >  7002 [ACK] Seq=218001 Ack=1 Win=131072 Len=1000 TSval=5025 TSecr=4982"
"2611","5.014986","10.1.0.11","10.1.0.2","TCP","2224","0.001511000","-37 dBm","","49154  >  7002 [ACK] Seq=220001 Ack=1 Win=131072 Len=1000 TSval=5027 TSecr=4982"
"2623","5.015962","10.1.0.11","10.1.0.2","TCP","1134","0.000976000","-37 dBm","","49154  >  7002 [ACK] Seq=221001 Ack=1 Win=131072 Len=1000 TSval=5028 TSecr=4982"
"2633","5.016722","10.1.0.11","10.1.0.2","TCP","1134","0.000760000","-37 dBm","","49154  >  7002 [ACK] Seq=222001 Ack=1 Win=131072 Len=1000 TSval=5028 TSecr=4982"
"2643","5.017482","10.1.0.11","10.1.0.2","TCP","1134","0.000760000","-37 dBm","","49154  >  7002 [ACK] Seq=223001 Ack=1 Win=131072 Len=1000 TSval=5029 TSecr=4982"
"2653","5.018243","10.1.0.11","10.1.0.2","TCP","1134","0.000761000","-37 dBm","","49154  >  7002 [ACK] Seq=224001 Ack=1 Win=131072 Len=1000 TSval=5030 TSecr=4982"
"2663","5.019003","10.1.0.11","10.1.0.2","TCP","1134","0.000760000","-37 dBm","","49154  >  7002 [ACK] Seq=225001 Ack=1 Win=131072 Len=1000 TSval=5031 TSecr=4982"
"2684","5.021384","10.1.0.11","10.1.0.2","TCP","3300","0.002381000","-37 dBm","","49154  >  7002 [ACK] Seq=228001 Ack=1 Win=131072 Len=1000 TSval=5033 TSecr=4982"
"2710","5.025864","10.1.0.11","10.1.0.2","TCP","5452","0.004480000","-37 dBm","","49154  >  7002 [ACK] Seq=233001 Ack=1 Win=131072 Len=1000 TSval=5037 TSecr=4982"
"2725","5.027729","10.1.0.11","10.1.0.2","TCP","3300","0.001865000","-37 dBm","","49154  >  7002 [ACK] Seq=236001 Ack=1 Win=131072 Len=1000 TSval=5040 TSecr=4982"
"2741","5.029105","10.1.0.11","10.1.0.2","TCP","1134","0.001376000","-37 dBm","","49154  >  7002 [ACK] Seq=237001 Ack=1 Win=131072 Len=1000 TSval=5040 TSecr=4982"
"2753","5.030178","10.1.0.11","10.1.0.2","TCP","2224","0.001073000","-37 dBm","","49154  >  7002 [ACK] Seq=239001 Ack=1 Win=131072 Len=1000 TSval=5042 TSecr=4982"
"2767","5.031306","10.1.0.11","10.1.0.2","TCP","1134","0.001128000","-37 dBm","","49154  >  7002 [ACK] Seq=240001 Ack=1 Win=131072 Len=1000 TSval=5043 TSecr=4982"
"2786","5.032947","10.1.0.11","10.1.0.2","TCP","2224","0.001641000","-37 dBm","","49154  >  7002 [ACK] Seq=242001 Ack=1 Win=131072 Len=1000 TSval=5044 TSecr=4982"
"2805","5.035303","10.1.0.11","10.1.0.2","TCP","3300","0.002356000","-37 dBm","","49154  >  7002 [ACK] Seq=245001 Ack=1 Win=131072 Len=1000 TSval=5047 TSecr=4982"
"2819","5.036623","10.1.0.11","10.1.0.2","TCP","2224","0.001320000","-37 dBm","","49154  >  7002 [ACK] Seq=247001 Ack=1 Win=131072 Len=1000 TSval=5048 TSecr=4982"
"2841","5.038546","10.1.0.11","10.1.0.2","TCP","2224","0.001923000","-37 dBm","","49154  >  7002 [ACK] Seq=249001 Ack=1 Win=131072 Len=1000 TSval=5050 TSecr=4982"
"2855","5.039834","10.1.0.11","10.1.0.2","TCP","2224","0.001288000","-37 dBm","","49154  >  7002 [ACK] Seq=251001 Ack=1 Win=131072 Len=1000 TSval=5052 TSecr=4982"
"2869","5.040962","10.1.0.11","10.1.0.2","TCP","1134","0.001128000","-37 dBm","","49154  >  7002 [ACK] Seq=252001 Ack=1 Win=131072 Len=1000 TSval=5052 TSecr=4982"
"2883","5.042154","10.1.0.11","10.1.0.2","TCP","1134","0.001192000","-37 dBm","","49154  >  7002 [ACK] Seq=253001 Ack=1 Win=131072 Len=1000 TSval=5053 TSecr=4982"
"3093","5.061665","10.1.0.2","10.1.0.11","TCP","756","0.019511000","","","7002  >  49154 [ACK] Seq=1 Ack=181001 Win=131072 Len=0 TSval=4995 TSecr=4994"
"3094","5.061665","10.1.0.2","10.1.0.11","TCP","300","0.000000000","","","7002  >  49154 [ACK] Seq=1 Ack=187001 Win=131072 Len=0 TSval=5000 TSecr=4999"
"3095","5.061665","10.1.0.2","10.1.0.11","TCP","2580","0.000000000","","0.071993000,0.070125000,0.068900000,0.067380000,0.065780000,0.064128000,0.062608000,0.061087000,0.058868000,0.054020000,0.054020000,0.054020000,0.051495000,0.051495000,0.049446000,0.048190000,0.046679000,0.044943000,0.043422000,0.040281000,0.040281000,0.035801000,0.035801000,0.033936000,0.033936000,0.031487000,0.030359000,0.028718000,0.026362000,0.025042000,0.023119000,0.021831000,0.020703000","7002  >  49154 [ACK] Seq=1 Ack=253001 Win=131072 Len=0 TSval=5053 TSecr=5052"
"3116","5.065589","10.1.0.11","10.1.0.2","TCP","6376","0.003924000","-37 dBm","","49154  >  7002 [ACK] Seq=258501 Ack=1 Win=131072 Len=1500 TSval=5074 TSecr=4986"
"3117","5.065589","10.1.0.11","10.1.0.2","TCP","6376","0.000000000","-37 dBm","","49154  >  7002 [ACK] Seq=264501 Ack=1 Win=131072 Len=1500 TSval=5074 TSecr=4992"
"3118","5.065589","10.1.0.11","10.1.0.2","TCP","6376","0.000000000","-37 dBm","","49154  >  7002 [ACK] Seq=270501 Ack=1 Win=131072 Len=1500 TSval=5074 TSecr=4995"
"3119","5.065589","10.1.0.11","10.1.0.2","TCP","7452","0.000000000","-37 dBm","","49154  >  7002 [ACK] Seq=278001 Ack=1 Win=131072 Len=1000 TSval=5074 TSecr=5002"
"3120","5.065589","10.1.0.11","10.1.0.2","TCP","4376","0.000000000","-37 dBm","","49154  >  7002 [ACK] Seq=282001 Ack=1 Win=131072 Len=1000 TSval=5076 TSecr=5053"
"3134","5.067377","10.1.0.11","10.1.0.2","TCP","3300","0.001788000","-37 dBm","","49154  >  7002 [ACK] Seq=285001 Ack=1 Win=131072 Len=1000 TSval=5079 TSecr=5053"
"3149","5.068748","10.1.0.11","10.1.0.2","TCP","2224","0.001371000","-37 dBm","","49154  >  7002 [ACK] Seq=287001 Ack=1 Win=131072 Len=1000 TSval=5080 TSecr=5053"
"3163","5.069940","10.1.0.11","10.1.0.2","TCP","1134","0.001192000","-37 dBm","","49154  >  7002 [ACK] Seq=288001 Ack=1 Win=131072 Len=1000 TSval=5081 TSecr=5053"
"3169","5.070396","10.1.0.11","10.1.0.2","TCP","1134","0.000456000","-37 dBm","","49154  >  7002 [ACK] Seq=289001 Ack=1 Win=131072 Len=1000 TSval=5082 TSecr=5053"
"3181","5.071308","10.1.0.11","10.1.0.2","TCP","1134","0.000912000","-37 dBm","","49154  >  7002 [ACK] Seq=290001 Ack=1 Win=131072 Len=1000 TSval=5083 TSecr=5053"
"3193","5.072220","10.1.0.11","10.1.0.2","TCP","1134","0.000912000","-37 dBm","","49154  >  7002 [ACK] Seq=291001 Ack=1 Win=131072 Len=1000 TSval=5084 TSecr=5053"
"3205","5.073309","10.1.0.11","10.1.0.2","TCP","2224","0.001089000","-37 dBm","","49154  >  7002 [ACK] Seq=293001 Ack=1 Win=131072 Len=1000 TSval=5085 TSecr=5053"
"3219","5.074437","10.1.0.11","10.1.0.2","TCP","1134","0.001128000","-37 dBm","","49154  >  7002 [ACK] Seq=294001 Ack=1 Win=131072 Len=1000 TSval=5086 TSecr=5053"
"3231","5.075350","10.1.0.11","10.1.0.2","TCP","1134","0.000913000","-37 dBm","","49154  >  7002 [ACK] Seq=295001 Ack=1 Win=131072 Len=1000 TSval=5087 TSecr=5053"
"3243","5.076262","10.1.0.11","10.1.0.2","TCP","1134","0.000912000","-37 dBm","","49154  >  7002 [ACK] Seq=296001 Ack=1 Win=131072 Len=1000 TSval=5088 TSecr=5053"
"3255","5.077334","10.1.0.11","10.1.0.2","TCP","2224","0.001072000","-37 dBm","","49154  >  7002 [ACK] Seq=298001 Ack=1 Win=131072 Len=1000 TSval=5089 TSecr=5053"
"3269","5.078398","10.1.0.11","10.1.0.2","TCP","1134","0.001064000","-37 dBm","","49154  >  7002 [ACK] Seq=299001 Ack=1 Win=131072 Len=1000 TSval=5090 TSecr=5053"
"3281","5.079337","10.1.0.11","10.1.0.2","TCP","1134","0.000939000","-37 dBm","","49154  >  7002 [ACK] Seq=300001 Ack=1 Win=131072 Len=1000 TSval=5091 TSecr=5053"
"3293","5.080249","10.1.0.11","10.1.0.2","TCP","1134","0.000912000","-37 dBm","","49154  >  7002 [ACK] Seq=301001 Ack=1 Win=131072 Len=1000 TSval=5092 TSecr=5053"
"3305","5.081290","10.1.0.11","10.1.0.2","TCP","2224","0.001041000","-37 dBm","","49154  >  7002 [ACK] Seq=303001 Ack=1 Win=131072 Len=1000 TSval=5093 TSecr=5053"
"3321","5.082506","10.1.0.11","10.1.0.2","TCP","1134","0.001216000","-37 dBm","","49154  >  7002 [ACK] Seq=304001 Ack=1 Win=131072 Len=1000 TSval=5094 TSecr=5053"
"3333","5.083418","10.1.0.11","10.1.0.2","TCP","1134","0.000912000","-37 dBm","","49154  >  7002 [ACK] Seq=305001 Ack=1 Win=131072 Len=1000 TSval=5095 TSecr=5053"
"3352","5.085040","10.1.0.11","10.1.0.2","TCP","2224","0.001622000","-37 dBm","","49154  >  7002 [ACK] Seq=307001 Ack=1 Win=131072 Len=1000 TSval=5096 TSecr=5053"
"3364","5.086144","10.1.0.11","10.1.0.2","TCP","2224","0.001104000","-37 dBm","","49154  >  7002 [ACK] Seq=309001 Ack=1 Win=131072 Len=1000 TSval=5098 TSecr=5053"
"3376","5.087120","10.1.0.11","10.1.0.2","TCP","1134","0.000976000","-37 dBm","","49154  >  7002 [ACK] Seq=310001 Ack=1 Win=131072 Len=1000 TSval=5099 TSecr=5053"
"3388","5.088033","10.1.0.11","10.1.0.2","TCP","1134","0.000913000","-37 dBm","","49154  >  7002 [ACK] Seq=311001 Ack=1 Win=131072 Len=1000 TSval=5100 TSecr=5053"
"3400","5.088945","10.1.0.11","10.1.0.2","TCP","1134","0.000912000","-37 dBm","","49154  >  7002 [ACK] Seq=312001 Ack=1 Win=131072 Len=1000 TSval=5100 TSecr=5053"
"3412","5.089857","10.1.0.11","10.1.0.2","TCP","1134","0.000912000","-37 dBm","","49154  >  7002 [ACK] Seq=313001 Ack=1 Win=131072 Len=1000 TSval=5101 TSecr=5053"
"3428","5.091328","10.1.0.11","10.1.0.2","TCP","2224","0.001471000","-37 dBm","","49154  >  7002 [ACK] Seq=315001 Ack=1 Win=131072 Len=1000 TSval=5103 TSecr=5053"
"3451","5.095100","10.1.0.11","10.1.0.2","TCP","5452","0.003772000","-37 dBm","","49154  >  7002 [ACK] Seq=320001 Ack=1 Win=131072 Len=1000 TSval=5107 TSecr=5053"
"3463","5.096433","10.1.0.11","10.1.0.2","TCP","2224","0.001333000","-37 dBm","","49154  >  7002 [ACK] Seq=322001 Ack=1 Win=131072 Len=1000 TSval=5108 TSecr=5053"
"3475","5.097474","10.1.0.11","10.1.0.2","TCP","1134","0.001041000","-37 dBm","","49154  >  7002 [ACK] Seq=323001 Ack=1 Win=131072 Len=1000 TSval=5109 TSecr=5053"
"3487","5.098386","10.1.0.11","10.1.0.2","TCP","1134","0.000912000","-37 dBm","","49154  >  7002 [ACK] Seq=324001 Ack=1 Win=131072 Len=1000 TSval=5110 TSecr=5053"
"3499","5.099298","10.1.0.11","10.1.0.2","TCP","1134","0.000912000","-37 dBm","","49154  >  7002 [ACK] Seq=325001 Ack=1 Win=131072 Len=1000 TSval=5111 TSecr=5053"
"3511","5.100210","10.1.0.11","10.1.0.2","TCP","1134","0.000912000","-37 dBm","","49154  >  7002 [ACK] Seq=326001 Ack=1 Win=131072 Len=1000 TSval=5112 TSecr=5053"
"3523","5.101186","10.1.0.11","10.1.0.2","TCP","1134","0.000976000","-37 dBm","","49154  >  7002 [ACK] Seq=327001 Ack=1 Win=131072 Len=1000 TSval=5112 TSecr=5053"
"3529","5.101820","10.1.0.2","10.1.0.11","TCP","2580","0.000634000","","0.036231000,0.036231000,0.036231000,0.036231000,0.036231000,0.036231000,0.036231000,0.036231000,0.036231000,0.036231000,0.036231000,0.034443000,0.033072000,0.031880000,0.030512000,0.028511000,0.027383000,0.025558000,0.024486000,0.022483000,0.020530000,0.019314000,0.016780000,0.015676000,0.014700000,0.012875000,0.010492000,0.006720000,0.006720000,0.006720000,0.005387000,0.003434000,0.001610000","7002  >  49154 [ACK] Seq=1 Ack=327001 Win=131072 Len=0 TSval=5112 TSecr=5111"
"3544","5.103343","10.1.0.11","10.1.0.2","TCP","3300","0.001523000","-37 dBm","","49154  >  7002 [ACK] Seq=330001 Ack=1 Win=131072 Len=1000 TSval=5115 TSecr=5053"
"3567","5.107004","10.1.0.11","10.1.0.2","TCP","5452","0.003661000","-37 dBm","","49154  >  7002 [ACK] Seq=335001 Ack=1 Win=131072 Len=1000 TSval=5119 TSecr=5053"
"3580","5.108390","10.1.0.11","10.1.0.2","TCP","1134","0.001386000","-37 dBm","","49154  >  7002 [ACK] Seq=336001 Ack=1 Win=131072 Len=1000 TSval=5120 TSecr=5053"
"3588","5.109030","10.1.0.11","10.1.0.2","TCP","1134","0.000640000","-37 dBm","","49154  >  7002 [ACK] Seq=337001 Ack=1 Win=131072 Len=1000 TSval=5120 TSecr=5053"
"3596","5.109638","10.1.0.11","10.1.0.2","TCP","1134","0.000608000","-37 dBm","","49154  >  7002 [ACK] Seq=338001 Ack=1 Win=131072 Len=1000 TSval=5121 TSecr=5053"
"3606","5.110398","10.1.0.11","10.1.0.2","TCP","1134","0.000760000","-37 dBm","","49154  >  7002 [ACK] Seq=339001 Ack=1 Win=131072 Len=1000 TSval=5122 TSecr=5053"
"3616","5.111158","10.1.0.11","10.1.0.2","TCP","1134","0.000760000","-37 dBm","","49154  >  7002 [ACK] Seq=340001 Ack=1 Win=131072 Len=1000 TSval=5123 TSecr=5053"
"3626","5.111918","10.1.0.11","10.1.0.2","TCP","1134","0.000760000","-37 dBm","","49154  >  7002 [ACK] Seq=341001 Ack=1 Win=131072 Len=1000 TSval=5124 TSecr=5053"
"3636","5.112679","10.1.0.11","10.1.0.2","TCP","1134","0.000761000","-37 dBm","","49154  >  7002 [ACK] Seq=342001 Ack=1 Win=131072 Len=1000 TSval=5124 TSecr=5053"
"3647","5.113895","10.1.0.11","10.1.0.2","TCP","1134","0.001216000","-37 dBm","","49154  >  7002 [ACK] Seq=343001 Ack=1 Win=131072 Len=1000 TSval=5125 TSecr=5053"
"3657","5.114655","10.1.0.11","10.1.0.2","TCP","1134","0.000760000","-37 dBm","","49154  >  7002 [ACK] Seq=344001 Ack=1 Win=131072 Len=1000 TSval=5126 TSecr=5053"
"3667","5.115415","10.1.0.11","10.1.0.2","TCP","1134","0.000760000","-37 dBm","","49154  >  7002 [ACK] Seq=345001 Ack=1 Win=131072 Len=1000 TSval=5127 TSecr=5053"
"3677","5.116175","10.1.0.11","10.1.0.2","TCP","1134","0.000760000","-37 dBm","","49154  >  7002 [ACK] Seq=346001 Ack=1 Win=131072 Len=1000 TSval=5128 TSecr=5053"
"3687","5.116935","10.1.0.11","10.1.0.2","TCP","1134","0.000760000","-37 dBm","","49154  >  7002 [ACK] Seq=347001 Ack=1 Win=131072 Len=1000 TSval=5128 TSecr=5053"
"3697","5.117695","10.1.0.11","10.1.0.2","TCP","1134","0.000760000","-37 dBm","","49154  >  7002 [ACK] Seq=348001 Ack=1 Win=131072 Len=1000 TSval=5129 TSecr=5053"
"3821","5.129468","10.1.0.2","10.1.0.11","TCP","2580","0.011773000","","","7002  >  49154 [ACK] Seq=1 Ack=327001 Win=131072 Len=0 TSval=5112 TSecr=5111"
"3822","5.129468","10.1.0.2","10.1.0.11","TCP","908","0.000000000","","0.026125000,0.026125000,0.022464000,0.022464000,0.021078000,0.019830000,0.018310000,0.016789000,0.014813000,0.013293000,0.011773000","7002  >  49154 [ACK] Seq=1 Ack=349001 Win=131072 Len=0 TSval=5130 TSecr=5128"
"3848","5.133062","10.1.0.11","10.1.0.2","TCP","6376","0.003594000","-37 dBm","","49154  >  7002 [ACK] Seq=353501 Ack=1 Win=131072 Len=1500 TSval=5142 TSecr=5077"
"3849","5.133062","10.1.0.11","10.1.0.2","TCP","6376","0.000000000","-37 dBm","","49154  >  7002 [ACK] Seq=359501 Ack=1 Win=131072 Len=1500 TSval=5142 TSecr=5077"
"3850","5.133062","10.1.0.11","10.1.0.2","TCP","7528","0.000000000","-37 dBm","","49154  >  7002 [ACK] Seq=367001 Ack=1 Win=131072 Len=1000 TSval=5144 TSecr=5130"
"3874","5.137244","10.1.0.11","10.1.0.2","TCP","5452","0.004182000","-37 dBm","","49154  >  7002 [ACK] Seq=372001 Ack=1 Win=131072 Len=1000 TSval=5148 TSecr=5130"
"3886","5.138476","10.1.0.11","10.1.0.2","TCP","2224","0.001232000","-37 dBm","","49154  >  7002 [ACK] Seq=374001 Ack=1 Win=131072 Len=1000 TSval=5150 TSecr=5130"
"3896","5.139301","10.1.0.11","10.1.0.2","TCP","1134","0.000825000","-37 dBm","","49154  >  7002 [ACK] Seq=375001 Ack=1 Win=131072 Len=1000 TSval=5151 TSecr=5130"
"3908","5.140213","10.1.0.11","10.1.0.2","TCP","1134","0.000912000","-37 dBm","","49154  >  7002 [ACK] Seq=376001 Ack=1 Win=131072 Len=1000 TSval=5152 TSecr=5130"
"3920","5.141125","10.1.0.11","10.1.0.2","TCP","1134","0.000912000","-37 dBm","","49154  >  7002 [ACK] Seq=377001 Ack=1 Win=131072 Len=1000 TSval=5152 TSecr=5130"
"3925","5.141759","10.1.0.2","10.1.0.11","TCP","984","0.000634000","","0.008697000,0.008697000,0.008697000,0.008697000,0.008697000,0.008697000,0.008697000,0.004515000,0.004515000,0.003283000,0.002458000,0.000634000","7002  >  49154 [ACK] Seq=1 Ack=378001 Win=131072 Len=0 TSval=5153 TSecr=5152"
"3946","5.144426","10.1.0.11","10.1.0.2","TCP","4376","0.002667000","-37 dBm","","49154  >  7002 [ACK] Seq=381001 Ack=1 Win=131072 Len=1000 TSval=5156 TSecr=5153"
"3958","5.145642","10.1.0.11","10.1.0.2","TCP","2224","0.001216000","-37 dBm","","49154  >  7002 [ACK] Seq=383001 Ack=1 Win=131072 Len=1000 TSval=5157 TSecr=5153"
"3970","5.146555","10.1.0.11","10.1.0.2","TCP","1134","0.000913000","-37 dBm","","49154  >  7002 [ACK] Seq=384001 Ack=1 Win=131072 Len=1000 TSval=5158 TSecr=5153"
"3982","5.147467","10.1.0.11","10.1.0.2","TCP","1134","0.000912000","-37 dBm","","49154  >  7002 [ACK] Seq=385001 Ack=1 Win=131072 Len=1000 TSval=5159 TSecr=5153"
"3994","5.148443","10.1.0.11","10.1.0.2","TCP","2224","0.000976000","-37 dBm","","49154  >  7002 [ACK] Seq=387001 Ack=1 Win=131072 Len=1000 TSval=5160 TSecr=5153"
