"No.","Time","Source","Destination","Protocol","Length","Time delta from previous displayed frame","Signal strength (dBm)","The RTT to ACK the segment was","Info"
"993","4.787804","10.1.0.11","10.1.0.10","TCP","138","0.000000000","","","49162  >  7018 [SYN] Seq=0 Win=65535 Len=0 TSval=4800 TSecr=0 WS=4 SACK_PERM=1"
"994","4.788060","10.1.0.11","10.1.0.10","TCP","138","0.000256000","","","[TCP Out-Of-Order] [TCP Port numbers reused] 49162  >  7018 [SYN] Seq=0 Win=65535 Len=0 TSval=4800 TSecr=0 WS=4 SACK_PERM=1"
"1003","4.788811","10.1.0.10","10.1.0.11","TCP","138","0.000751000","-38 dBm","0.001007000","7018  >  49162 [SYN, ACK] Seq=0 Ack=1 Win=65535 Len=0 TSval=4800 TSecr=4800 WS=4 SACK_PERM=1"
"1006","4.789026","10.1.0.10","10.1.0.11","TCP","138","0.000215000","-38 dBm","","49153  >  7019 [SYN] Seq=0 Win=65535 Len=0 TSval=4800 TSecr=0 WS=4 SACK_PERM=1"
"1009","4.789181","10.1.0.11","10.1.0.10","TCP","138","0.000155000","","0.000155000","7019  >  49153 [SYN, ACK] Seq=0 Ack=1 Win=65535 Len=0 TSval=4801 TSecr=4800 WS=4 SACK_PERM=1"
"1012","4.789396","10.1.0.11","10.1.0.10","TCP","134","0.000215000","","0.000585000","49162  >  7018 [ACK] Seq=1 Ack=1 Win=131072 Len=0 TSval=4801 TSecr=4800"
"1013","4.789634","10.1.0.11","10.1.0.10","TCP","134","0.000238000","","","[TCP Dup ACK 1012#1] 49162  >  7018 [ACK] Seq=1 Ack=1 Win=131072 Len=0 TSval=4801 TSecr=4800"
"1016","4.789918","10.1.0.10","10.1.0.11","TCP","134","0.000284000","-38 dBm","0.000737000","49153  >  7019 [ACK] Seq=1 Ack=1 Win=131072 Len=0 TSval=4801 TSecr=4801"
"1032","4.839933","10.1.0.11","10.1.0.10","TCP","1134","0.050015000","","","49162  >  7018 [ACK] Seq=1 Ack=1 Win=131072 Len=1000 TSval=4851 TSecr=4800"
"1052","4.841581","10.1.0.11","10.1.0.10","TCP","2224","0.001648000","","","49162  >  7018 [ACK] Seq=2001 Ack=1 Win=131072 Len=1000 TSval=4853 TSecr=4800"
"1072","4.843485","10.1.0.11","10.1.0.10","TCP","2224","0.001904000","","","49162  >  7018 [ACK] Seq=4001 Ack=1 Win=131072 Len=1000 TSval=4855 TSecr=4800"
"1099","4.846933","10.1.0.11","10.1.0.10","TCP","5452","0.003448000","","","49162  >  7018 [ACK] Seq=9001 Ack=1 Win=131072 Len=1000 TSval=4859 TSecr=4800"
"1119","4.849430","10.1.0.11","10.1.0.10","TCP","3300","0.002497000","","","49162  >  7018 [ACK] Seq=12001 Ack=1 Win=131072 Len=1000 TSval=4861 TSecr=4800"
"1197","4.861050","10.1.0.11","10.1.0.10","TCP","2224","0.011620000","","","49162  >  7018 [ACK] Seq=14001 Ack=1 Win=131072 Len=1000 TSval=4863 TSecr=4800"
"1212","4.862792","10.1.0.10","10.1.0.11","TCP","6528","0.001742000","-38 dBm","","49153  >  7019 [ACK] Seq=5001 Ack=1 Win=131072 Len=1000 TSval=4856 TSecr=4801"
"1213","4.862792","10.1.0.10","10.1.0.11","TCP","6528","0.000000000","-38 dBm","","49153  >  7019 [ACK] Seq=11001 Ack=1 Win=131072 Len=1000 TSval=4861 TSecr=4801"
"1214","4.862792","10.1.0.10","10.1.0.11","TCP","3300","0.000000000","-38 dBm","","49153  >  7019 [ACK] Seq=14001 Ack=1 Win=131072 Len=1000 TSval=4863 TSecr=4801"
"1402","4.882085","10.1.0.10","10.1.0.11","TCP","604","0.019293000","-38 dBm","0.042152000,0.040504000,0.038600000,0.035152000,0.035152000,0.032655000,0.032655000","7018  >  49162 [ACK] Seq=1 Ack=13001 Win=131072 Len=0 TSval=4861 TSecr=4860"
"1403","4.882085","10.1.0.10","10.1.0.11","TCP","134","0.000000000","-38 dBm","0.021035000","7018  >  49162 [ACK] Seq=1 Ack=15001 Win=131072 Len=0 TSval=4873 TSecr=4862"
"1430","4.885614","10.1.0.11","10.1.0.10","TCP","6376","0.003529000","","","49162  >  7018 [ACK] Seq=19501 Ack=1 Win=131072 Len=1500 TSval=4894 TSecr=4853"
"1431","4.885614","10.1.0.11","10.1.0.10","TCP","6376","0.000000000","","","49162  >  7018 [ACK] Seq=25501 Ack=1 Win=131072 Len=1500 TSval=4894 TSecr=4859"
"1432","4.885614","10.1.0.11","10.1.0.10","TCP","6376","0.000000000","","","49162  >  7018 [ACK] Seq=31501 Ack=1 Win=131072 Len=1500 TSval=4894 TSecr=4859"
"1433","4.885614","10.1.0.11","10.1.0.10","TCP","6376","0.000000000","","","49162  >  7018 [ACK] Seq=37501 Ack=1 Win=131072 Len=1500 TSval=4894 TSecr=4861"
"1434","4.885614","10.1.0.11","10.1.0.10","TCP","6376","0.000000000","","","49162  >  7018 [ACK] Seq=43501 Ack=1 Win=131072 Len=1500 TSval=4894 TSecr=4873"
"1467","4.890010","10.1.0.10","10.1.0.11","TCP","832","0.004396000","-38 dBm","0.004396000,0.004396000,0.004396000,0.004396000,0.004396000,0.004396000,0.004396000,0.004396000,0.004396000,0.004396000","7018  >  49162 [ACK] Seq=1 Ack=45001 Win=131072 Len=0 TSval=4898 TSecr=4894"
"1484","4.891288","10.1.0.11","10.1.0.10","TCP","6376","0.001278000","","","49162  >  7018 [ACK] Seq=49501 Ack=1 Win=131072 Len=1500 TSval=4902 TSecr=4898"
"1485","4.891288","10.1.0.11","10.1.0.10","TCP","6376","0.000000000","","","49162  >  7018 [ACK] Seq=55501 Ack=1 Win=131072 Len=1500 TSval=4902 TSecr=4898"
"1486","4.891288","10.1.0.11","10.1.0.10","TCP","7452","0.000000000","","","49162  >  7018 [ACK] Seq=63001 Ack=1 Win=131072 Len=1000 TSval=4902 TSecr=4898"
"1487","4.891288","10.1.0.11","10.1.0.10","TCP","1134","0.000000000","","","49162  >  7018 [ACK] Seq=64001 Ack=1 Win=131072 Len=1000 TSval=4903 TSecr=4898"
"1502","4.893808","10.1.0.11","10.1.0.10","TCP","3300","0.002520000","","","49162  >  7018 [ACK] Seq=67001 Ack=1 Win=131072 Len=1000 TSval=4905 TSecr=4898"
"1512","4.894792","10.1.0.11","10.1.0.10","TCP","1134","0.000984000","","","49162  >  7018 [ACK] Seq=68001 Ack=1 Win=131072 Len=1000 TSval=4906 TSecr=4898"
"1518","4.895248","10.1.0.11","10.1.0.10","TCP","1134","0.000456000","","","49162  >  7018 [ACK] Seq=69001 Ack=1 Win=131072 Len=1000 TSval=4907 TSecr=4898"
"1531","4.896287","10.1.0.11","10.1.0.10","TCP","1134","0.001039000","","","49162  >  7018 [ACK] Seq=70001 Ack=1 Win=131072 Len=1000 TSval=4907 TSecr=4898"
"1541","4.897079","10.1.0.11","10.1.0.10","TCP","1134","0.000792000","","","49162  >  7018 [ACK] Seq=71001 Ack=1 Win=131072 Len=1000 TSval=4908 TSecr=4898"
"1551","4.897872","10.1.0.11","10.1.0.10","TCP","1134","0.000793000","","","49162  >  7018 [ACK] Seq=72001 Ack=1 Win=131072 Len=1000 TSval=4909 TSecr=4898"
"1561","4.898664","10.1.0.11","10.1.0.10","TCP","1134","0.000792000","","","49162  >  7018 [ACK] Seq=73001 Ack=1 Win=131072 Len=1000 TSval=4910 TSecr=4898"
"1571","4.899424","10.1.0.11","10.1.0.10","TCP","1134","0.000760000","","","49162  >  7018 [ACK] Seq=74001 Ack=1 Win=131072 Len=1000 TSval=4911 TSecr=4898"
"1583","4.900400","10.1.0.11","10.1.0.10","TCP","1134","0.000976000","","","49162  >  7018 [ACK] Seq=75001 Ack=1 Win=131072 Len=1000 TSval=4911 TSecr=4898"
"1591","4.901040","10.1.0.11","10.1.0.10","TCP","1134","0.000640000","","","49162  >  7018 [ACK] Seq=76001 Ack=1 Win=131072 Len=1000 TSval=4912 TSecr=4898"
"1601","4.901904","10.1.0.11","10.1.0.10","TCP","1134","0.000864000","","","49162  >  7018 [ACK] Seq=77001 Ack=1 Win=131072 Len=1000 TSval=4913 TSecr=4898"
"1611","4.902696","10.1.0.11","10.1.0.10","TCP","1134","0.000792000","","","49162  >  7018 [ACK] Seq=78001 Ack=1 Win=131072 Len=1000 TSval=4914 TSecr=4898"
"1621","4.903488","10.1.0.11","10.1.0.10","TCP","1134","0.000792000","","","49162  >  7018 [ACK] Seq=79001 Ack=1 Win=131072 Len=1000 TSval=4915 TSecr=4898"
"1631","4.904281","10.1.0.11","10.1.0.10","TCP","1134","0.000793000","","","49162  >  7018 [ACK] Seq=80001 Ack=1 Win=131072 Len=1000 TSval=4915 TSecr=4898"
"1641","4.905073","10.1.0.11","10.1.0.10","TCP","1134","0.000792000","","","49162  >  7018 [ACK] Seq=81001 Ack=1 Win=131072 Len=1000 TSval=4916 TSecr=4898"
"1651","4.905865","10.1.0.11","10.1.0.10","TCP","1134","0.000792000","","","49162  >  7018 [ACK] Seq=82001 Ack=1 Win=131072 Len=1000 TSval=4917 TSecr=4898"
"1662","4.906738","10.1.0.11","10.1.0.10","TCP","1134","0.000873000","","","49162  >  7018 [ACK] Seq=83001 Ack=1 Win=131072 Len=1000 TSval=4918 TSecr=4898"
"1674","4.907778","10.1.0.11","10.1.0.10","TCP","2224","0.001040000","","","49162  >  7018 [ACK] Seq=85001 Ack=1 Win=131072 Len=1000 TSval=4919 TSecr=4898"
"1686","4.908754","10.1.0.11","10.1.0.10","TCP","1134","0.000976000","","","49162  >  7018 [ACK] Seq=86001 Ack=1 Win=131072 Len=1000 TSval=4920 TSecr=4898"
"1698","4.909666","10.1.0.11","10.1.0.10","TCP","1134","0.000912000","","","49162  >  7018 [ACK] Seq=87001 Ack=1 Win=131072 Len=1000 TSval=4921 TSecr=4898"
"1710","4.910578","10.1.0.11","10.1.0.10","TCP","1134","0.000912000","","","49162  >  7018 [ACK] Seq=88001 Ack=1 Win=131072 Len=1000 TSval=4922 TSecr=4898"
"1722","4.911523","10.1.0.11","10.1.0.10","TCP","1134","0.000945000","","","49162  >  7018 [ACK] Seq=89001 Ack=1 Win=131072 Len=1000 TSval=4923 TSecr=4898"
"1734","4.912612","10.1.0.11","10.1.0.10","TCP","2224","0.001089000","","","49162  >  7018 [ACK] Seq=91001 Ack=1 Win=131072 Len=1000 TSval=4924 TSecr=4898"
"1746","4.913652","10.1.0.11","10.1.0.10","TCP","1134","0.001040000","","","49162  >  7018 [ACK] Seq=92001 Ack=1 Win=131072 Len=1000 TSval=4925 TSecr=4898"
"1758","4.914564","10.1.0.11","10.1.0.10","TCP","1134","0.000912000","","","49162  >  7018 [ACK] Seq=93001 Ack=1 Win=131072 Len=1000 TSval=4926 TSecr=4898"
"1770","4.915508","10.1.0.11","10.1.0.10","TCP","1134","0.000944000","","","49162  >  7018 [ACK] Seq=94001 Ack=1 Win=131072 Len=1000 TSval=4927 TSecr=4898"
"1780","4.916300","10.1.0.11","10.1.0.10","TCP","1134","0.000792000","","","49162  >  7018 [ACK] Seq=95001 Ack=1 Win=131072 Len=1000 TSval=4927 TSecr=4898"
"1790","4.917092","10.1.0.11","10.1.0.10","TCP","1134","0.000792000","","","49162  >  7018 [ACK] Seq=96001 Ack=1 Win=131072 Len=1000 TSval=4928 TSecr=4898"
"1802","4.918339","10.1.0.11","10.1.0.10","TCP","2224","0.001247000","","","49162  >  7018 [ACK] Seq=98001 Ack=1 Win=131072 Len=1000 TSval=4930 TSecr=4898"
"1814","4.919411","10.1.0.11","10.1.0.10","TCP","1134","0.001072000","","","49162  >  7018 [ACK] Seq=99001 Ack=1 Win=131072 Len=1000 TSval=4931 TSecr=4898"
"1824","4.920172","10.1.0.11","10.1.0.10","TCP","1134","0.000761000","","","49162  >  7018 [ACK] Seq=100001 Ack=1 Win=131072 Len=1000 TSval=4931 TSecr=4898"
"1836","4.921116","10.1.0.11","10.1.0.10","TCP","1134","0.000944000","","","49162  >  7018 [ACK] Seq=101001 Ack=1 Win=131072 Len=1000 TSval=4932 TSecr=4898"
"1880","4.924490","10.1.0.11","10.1.0.10","TCP","680","0.003374000","","0.061698000,0.061698000,0.061698000,0.061698000,0.061698000,0.061698000,0.061698000,0.061698000","7019  >  49153 [ACK] Seq=1 Ack=15001 Win=131072 Len=0 TSval=4874 TSecr=4862"
"2019","4.948112","10.1.0.10","10.1.0.11","TCP","6376","0.023622000","-38 dBm","","49153  >  7019 [ACK] Seq=19501 Ack=1 Win=131072 Len=1500 TSval=4936 TSecr=4874"
"2020","4.948112","10.1.0.10","10.1.0.11","TCP","6376","0.000000000","-38 dBm","","49153  >  7019 [ACK] Seq=25501 Ack=1 Win=131072 Len=1500 TSval=4936 TSecr=4874"
"2021","4.948112","10.1.0.10","10.1.0.11","TCP","6376","0.000000000","-38 dBm","","49153  >  7019 [ACK] Seq=31501 Ack=1 Win=131072 Len=1500 TSval=4936 TSecr=4874"
"2022","4.948112","10.1.0.10","10.1.0.11","TCP","6376","0.000000000","-38 dBm","","49153  >  7019 [ACK] Seq=37501 Ack=1 Win=131072 Len=1500 TSval=4936 TSecr=4874"
"2023","4.948112","10.1.0.10","10.1.0.11","TCP","6376","0.000000000","-38 dBm","","49153  >  7019 [ACK] Seq=43501 Ack=1 Win=131072 Len=1500 TSval=4936 TSecr=4874"
"2038","4.950027","10.1.0.10","10.1.0.11","TCP","1972","0.001915000","-38 dBm","0.058739000,0.058739000,0.058739000,0.058739000,0.058739000,0.058739000,0.058739000,0.056219000,0.055235000,0.053740000,0.052155000,0.050603000,0.048987000,0.047331000,0.045746000,0.044162000,0.042249000,0.041273000,0.039449000,0.037415000,0.036375000,0.034519000,0.032935000,0.031688000,0.029855000","7018  >  49162 [ACK] Seq=1 Ack=101001 Win=131072 Len=0 TSval=4932 TSecr=4931"
"2060","4.952776","10.1.0.11","10.1.0.10","TCP","6376","0.002749000","","","49162  >  7018 [ACK] Seq=106501 Ack=1 Win=131072 Len=1500 TSval=4962 TSecr=4903"
"2061","4.952776","10.1.0.11","10.1.0.10","TCP","6376","0.000000000","","","49162  >  7018 [ACK] Seq=112501 Ack=1 Win=131072 Len=1500 TSval=4962 TSecr=4903"
"2062","4.952776","10.1.0.11","10.1.0.10","TCP","6376","0.000000000","","","49162  >  7018 [ACK] Seq=118501 Ack=1 Win=131072 Len=1500 TSval=4962 TSecr=4904"
"2063","4.952776","10.1.0.11","10.1.0.10","TCP","6376","0.000000000","","","49162  >  7018 [ACK] Seq=124501 Ack=1 Win=131072 Len=1500 TSval=4962 TSecr=4907"
"2064","4.952776","10.1.0.11","10.1.0.10","TCP","6376","0.000000000","","","49162  >  7018 [ACK] Seq=130501 Ack=1 Win=131072 Len=1500 TSval=4962 TSecr=4911"
"2065","4.952776","10.1.0.11","10.1.0.10","TCP","7452","0.000000000","","","49162  >  7018 [ACK] Seq=138001 Ack=1 Win=131072 Len=1000 TSval=4962 TSecr=4916"
"2066","4.952776","10.1.0.11","10.1.0.10","TCP","3300","0.000000000","","","49162  >  7018 [ACK] Seq=141001 Ack=1 Win=131072 Len=1000 TSval=4964 TSecr=4932"
"2102","4.960598","10.1.0.11","10.1.0.10","TCP","6528","0.007822000","","","49162  >  7018 [ACK] Seq=147001 Ack=1 Win=131072 Len=1000 TSval=4969 TSecr=4932"
"2103","4.960598","10.1.0.11","10.1.0.10","TCP","4376","0.000000000","","","49162  >  7018 [ACK] Seq=151001 Ack=1 Win=131072 Len=1000 TSval=4972 TSecr=4932"
"2112","4.961872","10.1.0.11","10.1.0.10","TCP","1134","0.001274000","","","49162  >  7018 [ACK] Seq=152001 Ack=1 Win=131072 Len=1000 TSval=4973 TSecr=4932"
"2120","4.962480","10.1.0.11","10.1.0.10","TCP","1134","0.000608000","","","49162  >  7018 [ACK] Seq=153001 Ack=1 Win=131072 Len=1000 TSval=4974 TSecr=4932"
"2128","4.963088","10.1.0.11","10.1.0.10","TCP","1134","0.000608000","","","49162  >  7018 [ACK] Seq=154001 Ack=1 Win=131072 Len=1000 TSval=4975 TSecr=4932"
"2137","4.963791","10.1.0.11","10.1.0.10","TCP","1134","0.000703000","","","49162  >  7018 [ACK] Seq=155001 Ack=1 Win=131072 Len=1000 TSval=4975 TSecr=4932"
"2155","4.965198","10.1.0.11","10.1.0.10","TCP","1134","0.001407000","","","49162  >  7018 [ACK] Seq=156001 Ack=1 Win=131072 Len=1000 TSval=4976 TSecr=4932"
"2182","4.969622","10.1.0.11","10.1.0.10","TCP","2224","0.004424000","","","49162  >  7018 [ACK] Seq=158001 Ack=1 Win=131072 Len=1000 TSval=4978 TSecr=4932"
"2363","4.989548","10.1.0.10","10.1.0.11","TCP","1820","0.019926000","-38 dBm","0.036772000,0.036772000,0.036772000,0.036772000,0.036772000,0.036772000,0.036772000,0.036772000,0.036772000,0.036772000,0.036772000,0.036772000,0.036772000,0.036772000,0.028950000,0.028950000,0.028950000,0.028950000,0.028950000,0.027676000,0.026460000,0.024350000,0.019926000","7018  >  49162 [ACK] Seq=1 Ack=159001 Win=131072 Len=0 TSval=4981 TSecr=4977"
"2373","4.990348","10.1.0.11","10.1.0.10","TCP","6376","0.000800000","","","49162  >  7018 [ACK] Seq=163501 Ack=1 Win=131072 Len=1500 TSval=5001 TSecr=4965"
"2374","4.990348","10.1.0.11","10.1.0.10","TCP","6376","0.000000000","","","49162  >  7018 [ACK] Seq=169501 Ack=1 Win=131072 Len=1500 TSval=5001 TSecr=4965"
"2375","4.990348","10.1.0.11","10.1.0.10","TCP","6376","0.000000000","","","49162  >  7018 [ACK] Seq=175501 Ack=1 Win=131072 Len=1500 TSval=5001 TSecr=4965"
"2376","4.990348","10.1.0.11","10.1.0.10","TCP","6376","0.000000000","","","49162  >  7018 [ACK] Seq=181501 Ack=1 Win=131072 Len=1500 TSval=5001 TSecr=4965"
"2377","4.990348","10.1.0.11","10.1.0.10","TCP","6452","0.000000000","","","49162  >  7018 [ACK] Seq=188001 Ack=1 Win=131072 Len=1000 TSval=5002 TSecr=4981"
"2387","4.992344","10.1.0.11","10.1.0.10","TCP","2224","0.001996000","","","49162  >  7018 [ACK] Seq=190001 Ack=1 Win=131072 Len=1000 TSval=5003 TSecr=4981"
"2393","4.992833","10.1.0.11","10.1.0.10","TCP","1134","0.000489000","","","49162  >  7018 [ACK] Seq=191001 Ack=1 Win=131072 Len=1000 TSval=5004 TSecr=4981"
"2403","4.993593","10.1.0.11","10.1.0.10","TCP","1134","0.000760000","","","49162  >  7018 [ACK] Seq=192001 Ack=1 Win=131072 Len=1000 TSval=5005 TSecr=4981"
"2413","4.994353","10.1.0.11","10.1.0.10","TCP","1134","0.000760000","","","49162  >  7018 [ACK] Seq=193001 Ack=1 Win=131072 Len=1000 TSval=5006 TSecr=4981"
"2423","4.995113","10.1.0.11","10.1.0.10","TCP","1134","0.000760000","","","49162  >  7018 [ACK] Seq=194001 Ack=1 Win=131072 Len=1000 TSval=5007 TSecr=4981"
"2431","4.995900","10.1.0.10","10.1.0.11","TCP","1060","0.000787000","-38 dBm","0.005552000,0.005552000,0.005552000,0.005552000,0.005552000,0.005552000,0.005552000,0.005552000,0.005552000,0.005552000,0.003556000,0.003067000,0.001547000","7018  >  49162 [ACK] Seq=1 Ack=194001 Win=131072 Len=0 TSval=5006 TSecr=5005"
"2443","4.996813","10.1.0.11","10.1.0.10","TCP","2224","0.000913000","","","49162  >  7018 [ACK] Seq=196001 Ack=1 Win=131072 Len=1000 TSval=5008 TSecr=5006"
"2453","4.997605","10.1.0.11","10.1.0.10","TCP","1134","0.000792000","","","49162  >  7018 [ACK] Seq=197001 Ack=1 Win=131072 Len=1000 TSval=5009 TSecr=5006"
"2463","4.998365","10.1.0.11","10.1.0.10","TCP","1134","0.000760000","","","49162  >  7018 [ACK] Seq=198001 Ack=1 Win=131072 Len=1000 TSval=5010 TSecr=5006"
"2473","4.999125","10.1.0.11","10.1.0.10","TCP","1134","0.000760000","","","49162  >  7018 [ACK] Seq=199001 Ack=1 Win=131072 Len=1000 TSval=5011 TSecr=5006"
"2483","4.999886","10.1.0.11","10.1.0.10","TCP","1134","0.000761000","","","49162  >  7018 [ACK] Seq=200001 Ack=1 Win=131072 Len=1000 TSval=5011 TSecr=5006"
"2493","5.000646","10.1.0.11","10.1.0.10","TCP","1134","0.000760000","","","49162  >  7018 [ACK] Seq=201001 Ack=1 Win=131072 Len=1000 TSval=5012 TSecr=5006"
"2510","5.001892","10.1.0.11","10.1.0.10","TCP","1134","0.001246000","","","49162  >  7018 [ACK] Seq=202001 Ack=1 Win=131072 Len=1000 TSval=5013 TSecr=5006"
"2522","5.002797","10.1.0.11","10.1.0.10","TCP","1136","0.000905000","","","[TCP Retransmission] 49162  >  7018 [ACK] Seq=202001 Ack=1 Win=131072 Len=1000 TSval=5013 TSecr=5006"
"2523","5.002797","10.1.0.11","10.1.0.10","TCP","1134","0.000000000","","","49162  >  7018 [ACK] Seq=203001 Ack=1 Win=131072 Len=1000 TSval=5014 TSecr=5006"
"2551","5.007361","10.1.0.11","10.1.0.10","TCP","6528","0.004564000","","","49162  >  7018 [ACK] Seq=209001 Ack=1 Win=131072 Len=1000 TSval=5019 TSecr=5006"
"2557","5.008356","10.1.0.10","10.1.0.11","TCP","680","0.000995000","-38 dBm","0.011543000,0.010751000,0.009231000,0.007710000,0.005559000,0.000995000,0.000995000,0.000995000","7018  >  49162 [ACK] Seq=1 Ack=210001 Win=131072 Len=0 TSval=5019 TSecr=5018"
"2570","5.010046","10.1.0.11","10.1.0.10","TCP","4376","0.001690000","","","49162  >  7018 [ACK] Seq=213001 Ack=1 Win=131072 Len=1000 TSval=5022 TSecr=5019"
"2584","5.011527","10.1.0.11","10.1.0.10","TCP","1134","0.001481000","","","49162  >  7018 [ACK] Seq=214001 Ack=1 Win=131072 Len=1000 TSval=5023 TSecr=5019"
"2594","5.012287","10.1.0.11","10.1.0.10","TCP","1134","0.000760000","","","49162  >  7018 [ACK] Seq=215001 Ack=1 Win=131072 Len=1000 TSval=5023 TSecr=5019"
"2608","5.013479","10.1.0.11","10.1.0.10","TCP","2224","0.001192000","","","49162  >  7018 [ACK] Seq=217001 Ack=1 Win=131072 Len=1000 TSval=5025 TSecr=5019"
"2623","5.014990","10.1.0.11","10.1.0.10","TCP","2224","0.001511000","","","49162  >  7018 [ACK] Seq=219001 Ack=1 Win=131072 Len=1000 TSval=5027 TSecr=5019"
"2635","5.016030","10.1.0.11","10.1.0.10","TCP","1134","0.001040000","","","49162  >  7018 [ACK] Seq=220001 Ack=1 Win=131072 Len=1000 TSval=5027 TSecr=5019"
"2645","5.016790","10.1.0.11","10.1.0.10","TCP","1134","0.000760000","","","49162  >  7018 [ACK] Seq=221001 Ack=1 Win=131072 Len=1000 TSval=5028 TSecr=5019"
"2655","5.017550","10.1.0.11","10.1.0.10","TCP","1134","0.000760000","","","49162  >  7018 [ACK] Seq=222001 Ack=1 Win=131072 Len=1000 TSval=5029 TSecr=5019"
"2665","5.018310","10.1.0.11","10.1.0.10","TCP","1134","0.000760000","","","49162  >  7018 [ACK] Seq=223001 Ack=1 Win=131072 Len=1000 TSval=5030 TSecr=5019"
"2675","5.019071","10.1.0.11","10.1.0.10","TCP","1134","0.000761000","","","49162  >  7018 [ACK] Seq=224001 Ack=1 Win=131072 Len=1000 TSval=5031 TSecr=5019"
"2686","5.020479","10.1.0.10","10.1.0.11","TCP","604","0.001408000","-38 dBm","0.010433000,0.010433000,0.008192000,0.007000000,0.005489000,0.003689000,0.002169000","7018  >  49162 [ACK] Seq=1 Ack=224001 Win=131072 Len=0 TSval=5030 TSecr=5029"
"2697","5.021324","10.1.0.11","10.1.0.10","TCP","3300","0.000845000","","","49162  >  7018 [ACK] Seq=227001 Ack=1 Win=131072 Len=1000 TSval=5033 TSecr=5030"
"2723","5.025644","10.1.0.11","10.1.0.10","TCP","5452","0.004320000","","","49162  >  7018 [ACK] Seq=232001 Ack=1 Win=131072 Len=1000 TSval=5037 TSecr=5030"
"2738","5.027669","10.1.0.11","10.1.0.10","TCP","3300","0.002025000","","","49162  >  7018 [ACK] Seq=235001 Ack=1 Win=131072 Len=1000 TSval=5039 TSecr=5030"
"2754","5.029173","10.1.0.11","10.1.0.10","TCP","1134","0.001504000","","","49162  >  7018 [ACK] Seq=236001 Ack=1 Win=131072 Len=1000 TSval=5040 TSecr=5030"
"2766","5.030182","10.1.0.11","10.1.0.10","TCP","2224","0.001009000","","","49162  >  7018 [ACK] Seq=238001 Ack=1 Win=131072 Len=1000 TSval=5042 TSecr=5030"
"2780","5.031374","10.1.0.11","10.1.0.10","TCP","1134","0.001192000","","","49162  >  7018 [ACK] Seq=239001 Ack=1 Win=131072 Len=1000 TSval=5043 TSecr=5030"
"2799","5.032951","10.1.0.11","10.1.0.10","TCP","2224","0.001577000","","","49162  >  7018 [ACK] Seq=241001 Ack=1 Win=131072 Len=1000 TSval=5044 TSecr=5030"
"2818","5.035243","10.1.0.11","10.1.0.10","TCP","3300","0.002292000","","","49162  >  7018 [ACK] Seq=244001 Ack=1 Win=131072 Len=1000 TSval=5047 TSecr=5030"
"2832","5.036627","10.1.0.11","10.1.0.10","TCP","2224","0.001384000","","","49162  >  7018 [ACK] Seq=246001 Ack=1 Win=131072 Len=1000 TSval=5048 TSecr=5030"
"2854","5.038550","10.1.0.11","10.1.0.10","TCP","2224","0.001923000","","","49162  >  7018 [ACK] Seq=248001 Ack=1 Win=131072 Len=1000 TSval=5050 TSecr=5030"
"2868","5.039838","10.1.0.11","10.1.0.10","TCP","2224","0.001288000","","","49162  >  7018 [ACK] Seq=250001 Ack=1 Win=131072 Len=1000 TSval=5051 TSecr=5030"
"2882","5.041030","10.1.0.11","10.1.0.10","TCP","1134","0.001192000","","","49162  >  7018 [ACK] Seq=251001 Ack=1 Win=131072 Len=1000 TSval=5052 TSecr=5030"
"2896","5.042190","10.1.0.11","10.1.0.10","TCP","2224","0.001160000","","","49162  >  7018 [ACK] Seq=253001 Ack=1 Win=131072 Len=1000 TSval=5054 TSecr=5030"
"2911","5.043436","10.1.0.11","10.1.0.10","TCP","1134","0.001246000","","","49162  >  7018 [ACK] Seq=254001 Ack=1 Win=131072 Len=1000 TSval=5055 TSecr=5030"
"2923","5.044348","10.1.0.11","10.1.0.10","TCP","1134","0.000912000","","","49162  >  7018 [ACK] Seq=255001 Ack=1 Win=131072 Len=1000 TSval=5055 TSecr=5030"
"2935","5.045356","10.1.0.11","10.1.0.10","TCP","2224","0.001008000","","","49162  >  7018 [ACK] Seq=257001 Ack=1 Win=131072 Len=1000 TSval=5057 TSecr=5030"
"2949","5.046485","10.1.0.11","10.1.0.10","TCP","1134","0.001129000","","","49162  >  7018 [ACK] Seq=258001 Ack=1 Win=131072 Len=1000 TSval=5058 TSecr=5030"
"2961","5.047397","10.1.0.11","10.1.0.10","TCP","1134","0.000912000","","","49162  >  7018 [ACK] Seq=259001 Ack=1 Win=131072 Len=1000 TSval=5059 TSecr=5030"
"2973","5.048309","10.1.0.11","10.1.0.10","TCP","1134","0.000912000","","","49162  >  7018 [ACK] Seq=260001 Ack=1 Win=131072 Len=1000 TSval=5059 TSecr=5030"
"2988","5.049730","10.1.0.11","10.1.0.10","TCP","2224","0.001421000","","","49162  >  7018 [ACK] Seq=262001 Ack=1 Win=131072 Len=1000 TSval=5061 TSecr=5030"
"3009","5.052918","10.1.0.11","10.1.0.10","TCP","4376","0.003188000","","","49162  >  7018 [ACK] Seq=266001 Ack=1 Win=131072 Len=1000 TSval=5064 TSecr=5030"
"3017","5.053814","10.1.0.11","10.1.0.10","TCP","1134","0.000896000","","","49162  >  7018 [ACK] Seq=267001 Ack=1 Win=131072 Len=1000 TSval=5065 TSecr=5030"
"3025","5.054422","10.1.0.11","10.1.0.10","TCP","1134","0.000608000","","","49162  >  7018 [ACK] Seq=268001 Ack=1 Win=131072 Len=1000 TSval=5066 TSecr=5030"
"3031","5.055064","10.1.0.10","10.1.0.11","TCP","1744","0.000642000","-38 dBm","0.033740000,0.033740000,0.029420000,0.029420000,0.027395000,0.027395000,0.024882000,0.023690000,0.022113000,0.019821000,0.018437000,0.016514000,0.015226000,0.014034000,0.012874000,0.010716000,0.009708000,0.007667000,0.005334000,0.002146000,0.002146000,0.001250000","7018  >  49162 [ACK] Seq=1 Ack=268001 Win=131072 Len=0 TSval=5066 TSecr=5064"
"3042","5.055822","10.1.0.11","10.1.0.10","TCP","2224","0.000758000","","","49162  >  7018 [ACK] Seq=270001 Ack=1 Win=131072 Len=1000 TSval=5067 TSecr=5066"
"3054","5.056811","10.1.0.11","10.1.0.10","TCP","1134","0.000989000","","","49162  >  7018 [ACK] Seq=271001 Ack=1 Win=131072 Len=1000 TSval=5068 TSecr=5066"
"3068","5.058696","10.1.0.11","10.1.0.10","TCP","2224","0.001885000","","","49162  >  7018 [ACK] Seq=273001 Ack=1 Win=131072 Len=1000 TSval=5070 TSecr=5066"
"3074","5.059184","10.1.0.11","10.1.0.10","TCP","1134","0.000488000","","","49162  >  7018 [ACK] Seq=274001 Ack=1 Win=131072 Len=1000 TSval=5071 TSecr=5066"
"3082","5.059792","10.1.0.11","10.1.0.10","TCP","1134","0.000608000","","","49162  >  7018 [ACK] Seq=275001 Ack=1 Win=131072 Len=1000 TSval=5071 TSecr=5066"
"3101","5.061438","10.1.0.10","10.1.0.11","TCP","376","0.001646000","-38 dBm","0.005616000,0.004627000,0.002742000,0.001646000","7018  >  49162 [ACK] Seq=1 Ack=276001 Win=131072 Len=0 TSval=5072 TSecr=5071"
"3120","5.062689","10.1.0.11","10.1.0.10","TCP","3300","0.001251000","","","49162  >  7018 [ACK] Seq=278001 Ack=1 Win=131072 Len=1000 TSval=5074 TSecr=5072"
"3142","5.066261","10.1.0.11","10.1.0.10","TCP","5452","0.003572000","","","49162  >  7018 [ACK] Seq=283001 Ack=1 Win=131072 Len=1000 TSval=5078 TSecr=5072"
"3154","5.067869","10.1.0.10","10.1.0.11","TCP","376","0.001608000","-38 dBm","0.005180000,0.001608000,0.001608000,0.001608000","7018  >  49162 [ACK] Seq=1 Ack=284001 Win=131072 Len=0 TSval=5078 TSecr=5077"
"3159","5.068199","10.1.0.11","10.1.0.10","TCP","2224","0.000330000","","","49162  >  7018 [ACK] Seq=285001 Ack=1 Win=131072 Len=1000 TSval=5079 TSecr=5072"
"3171","5.069272","10.1.0.11","10.1.0.10","TCP","2224","0.001073000","","","49162  >  7018 [ACK] Seq=287001 Ack=1 Win=131072 Len=1000 TSval=5081 TSecr=5078"
"3185","5.070464","10.1.0.11","10.1.0.10","TCP","1134","0.001192000","","","49162  >  7018 [ACK] Seq=288001 Ack=1 Win=131072 Len=1000 TSval=5082 TSecr=5078"
"3197","5.071376","10.1.0.11","10.1.0.10","TCP","1134","0.000912000","","","49162  >  7018 [ACK] Seq=289001 Ack=1 Win=131072 Len=1000 TSval=5083 TSecr=5078"
"3209","5.072288","10.1.0.11","10.1.0.10","TCP","1134","0.000912000","","","49162  >  7018 [ACK] Seq=290001 Ack=1 Win=131072 Len=1000 TSval=5083 TSecr=5078"
"3221","5.073232","10.1.0.11","10.1.0.10","TCP","2224","0.000944000","","","49162  >  7018 [ACK] Seq=292001 Ack=1 Win=131072 Len=1000 TSval=5085 TSecr=5078"
"3235","5.074505","10.1.0.11","10.1.0.10","TCP","1134","0.001273000","","","49162  >  7018 [ACK] Seq=293001 Ack=1 Win=131072 Len=1000 TSval=5086 TSecr=5078"
"3247","5.075418","10.1.0.11","10.1.0.10","TCP","1134","0.000913000","","","49162  >  7018 [ACK] Seq=294001 Ack=1 Win=131072 Len=1000 TSval=5087 TSecr=5078"
"3259","5.076330","10.1.0.11","10.1.0.10","TCP","1134","0.000912000","","","49162  >  7018 [ACK] Seq=295001 Ack=1 Win=131072 Len=1000 TSval=5087 TSecr=5078"
"3271","5.077338","10.1.0.11","10.1.0.10","TCP","2224","0.001008000","","","49162  >  7018 [ACK] Seq=297001 Ack=1 Win=131072 Len=1000 TSval=5089 TSecr=5078"
"3285","5.078466","10.1.0.11","10.1.0.10","TCP","1134","0.001128000","","","49162  >  7018 [ACK] Seq=298001 Ack=1 Win=131072 Len=1000 TSval=5090 TSecr=5078"
"3297","5.079405","10.1.0.11","10.1.0.10","TCP","1134","0.000939000","","","49162  >  7018 [ACK] Seq=299001 Ack=1 Win=131072 Len=1000 TSval=5091 TSecr=5078"
"3309","5.080317","10.1.0.11","10.1.0.10","TCP","1134","0.000912000","","","49162  >  7018 [ACK] Seq=300001 Ack=1 Win=131072 Len=1000 TSval=5091 TSecr=5078"
"3321","5.081294","10.1.0.11","10.1.0.10","TCP","2224","0.000977000","","","49162  >  7018 [ACK] Seq=302001 Ack=1 Win=131072 Len=1000 TSval=5093 TSecr=5078"
"3337","5.082574","10.1.0.11","10.1.0.10","TCP","1134","0.001280000","","","49162  >  7018 [ACK] Seq=303001 Ack=1 Win=131072 Len=1000 TSval=5094 TSecr=5078"
"3349","5.083486","10.1.0.11","10.1.0.10","TCP","1134","0.000912000","","","49162  >  7018 [ACK] Seq=304001 Ack=1 Win=131072 Len=1000 TSval=5095 TSecr=5078"
"3363","5.084714","10.1.0.10","10.1.0.11","TCP","832","0.001228000","-38 dBm","0.016515000,0.015442000,0.013338000,0.011482000,0.010209000,0.008384000,0.007376000,0.005309000,0.003420000,0.002140000","7018  >  49162 [ACK] Seq=1 Ack=304001 Win=131072 Len=0 TSval=5094 TSecr=5093"
"3368","5.085044","10.1.0.11","10.1.0.10","TCP","2224","0.000330000","","","49162  >  7018 [ACK] Seq=306001 Ack=1 Win=131072 Len=1000 TSval=5096 TSecr=5078"
"3380","5.086148","10.1.0.11","10.1.0.10","TCP","2224","0.001104000","","","49162  >  7018 [ACK] Seq=308001 Ack=1 Win=131072 Len=1000 TSval=5098 TSecr=5094"
"3392","5.087188","10.1.0.11","10.1.0.10","TCP","1134","0.001040000","","","49162  >  7018 [ACK] Seq=309001 Ack=1 Win=131072 Len=1000 TSval=5099 TSecr=5094"
"3404","5.088101","10.1.0.11","10.1.0.10","TCP","1134","0.000913000","","","49162  >  7018 [ACK] Seq=310001 Ack=1 Win=131072 Len=1000 TSval=5099 TSecr=5094"
"3416","5.089013","10.1.0.11","10.1.0.10","TCP","1134","0.000912000","","","49162  >  7018 [ACK] Seq=311001 Ack=1 Win=131072 Len=1000 TSval=5100 TSecr=5094"
"3428","5.089925","10.1.0.11","10.1.0.10","TCP","1134","0.000912000","","","49162  >  7018 [ACK] Seq=312001 Ack=1 Win=131072 Len=1000 TSval=5101 TSecr=5094"
"3444","5.091332","10.1.0.11","10.1.0.10","TCP","2224","0.001407000","","","49162  >  7018 [ACK] Seq=314001 Ack=1 Win=131072 Len=1000 TSval=5103 TSecr=5094"
"3467","5.094880","10.1.0.11","10.1.0.10","TCP","5452","0.003548000","","","49162  >  7018 [ACK] Seq=319001 Ack=1 Win=131072 Len=1000 TSval=5107 TSecr=5094"
"3479","5.096437","10.1.0.11","10.1.0.10","TCP","2224","0.001557000","","","49162  >  7018 [ACK] Seq=321001 Ack=1 Win=131072 Len=1000 TSval=5108 TSecr=5094"
"3491","5.097541","10.1.0.11","10.1.0.10","TCP","1134","0.001104000","","","49162  >  7018 [ACK] Seq=322001 Ack=1 Win=131072 Len=1000 TSval=5109 TSecr=5094"
"3503","5.098454","10.1.0.11","10.1.0.10","TCP","1134","0.000913000","","","49162  >  7018 [ACK] Seq=323001 Ack=1 Win=131072 Len=1000 TSval=5110 TSecr=5094"
"3515","5.099366","10.1.0.11","10.1.0.10","TCP","1134","0.000912000","","","49162  >  7018 [ACK] Seq=324001 Ack=1 Win=131072 Len=1000 TSval=5111 TSecr=5094"
"3527","5.100278","10.1.0.11","10.1.0.10","TCP","1134","0.000912000","","","49162  >  7018 [ACK] Seq=325001 Ack=1 Win=131072 Len=1000 TSval=5111 TSecr=5094"
"3539","5.101222","10.1.0.11","10.1.0.10","TCP","2224","0.000944000","","","49162  >  7018 [ACK] Seq=327001 Ack=1 Win=131072 Len=1000 TSval=5113 TSecr=5094"
"3566","5.103931","10.1.0.11","10.1.0.10","TCP","3300","0.002709000","","","49162  >  7018 [ACK] Seq=330001 Ack=1 Win=131072 Len=1000 TSval=5115 TSecr=5094"
"3589","5.107672","10.1.0.11","10.1.0.10","TCP","5452","0.003741000","","","49162  >  7018 [ACK] Seq=335001 Ack=1 Win=131072 Len=1000 TSval=5119 TSecr=5094"
"3604","5.109098","10.1.0.11","10.1.0.10","TCP","1134","0.001426000","","","49162  >  7018 [ACK] Seq=336001 Ack=1 Win=131072 Len=1000 TSval=5120 TSecr=5094"
"3612","5.109706","10.1.0.11","10.1.0.10","TCP","1134","0.000608000","","","49162  >  7018 [ACK] Seq=337001 Ack=1 Win=131072 Len=1000 TSval=5121 TSecr=5094"
"3622","5.110466","10.1.0.11","10.1.0.10","TCP","1134","0.000760000","","","49162  >  7018 [ACK] Seq=338001 Ack=1 Win=131072 Len=1000 TSval=5122 TSecr=5094"
"3632","5.111226","10.1.0.11","10.1.0.10","TCP","1134","0.000760000","","","49162  >  7018 [ACK] Seq=339001 Ack=1 Win=131072 Len=1000 TSval=5123 TSecr=5094"
"3642","5.111986","10.1.0.11","10.1.0.10","TCP","1134","0.000760000","","","49162  >  7018 [ACK] Seq=340001 Ack=1 Win=131072 Len=1000 TSval=5123 TSecr=5094"
"3652","5.112746","10.1.0.11","10.1.0.10","TCP","1134","0.000760000","","","49162  >  7018 [ACK] Seq=341001 Ack=1 Win=131072 Len=1000 TSval=5124 TSecr=5094"
"3662","5.113507","10.1.0.11","10.1.0.10","TCP","1134","0.000761000","","","49162  >  7018 [ACK] Seq=342001 Ack=1 Win=131072 Len=1000 TSval=5125 TSecr=5094"
"3673","5.114723","10.1.0.11","10.1.0.10","TCP","1134","0.001216000","","","49162  >  7018 [ACK] Seq=343001 Ack=1 Win=131072 Len=1000 TSval=5126 TSecr=5094"
"3683","5.115483","10.1.0.11","10.1.0.10","TCP","1134","0.000760000","","","49162  >  7018 [ACK] Seq=344001 Ack=1 Win=131072 Len=1000 TSval=5127 TSecr=5094"
"3693","5.116243","10.1.0.11","10.1.0.10","TCP","1134","0.000760000","","","49162  >  7018 [ACK] Seq=345001 Ack=1 Win=131072 Len=1000 TSval=5127 TSecr=5094"
"3703","5.117003","10.1.0.11","10.1.0.10","TCP","1134","0.000760000","","","49162  >  7018 [ACK] Seq=346001 Ack=1 Win=131072 Len=1000 TSval=5128 TSecr=5094"
"3713","5.117763","10.1.0.11","10.1.0.10","TCP","1134","0.000760000","","","49162  >  7018 [ACK] Seq=347001 Ack=1 Win=131072 Len=1000 TSval=5129 TSecr=5094"
"3723","5.118523","10.1.0.11","10.1.0.10","TCP","1134","0.000760000","","","49162  >  7018 [ACK] Seq=348001 Ack=1 Win=131072 Len=1000 TSval=5130 TSecr=5094"
"3731","5.119132","10.1.0.11","10.1.0.10","TCP","1134","0.000609000","","","49162  >  7018 [ACK] Seq=349001 Ack=1 Win=131072 Len=1000 TSval=5131 TSecr=5094"
"3739","5.119879","10.1.0.10","10.1.0.11","TCP","680","0.000747000","-38 dBm","0.034835000,0.033731000,0.032691000,0.030866000,0.028547000,0.024999000,0.024999000,0.024999000","7018  >  49162 [ACK] Seq=1 Ack=320001 Win=131072 Len=0 TSval=5107 TSecr=5106"
"3740","5.119879","10.1.0.10","10.1.0.11","TCP","1212","0.000000000","-38 dBm","0.023442000,0.021425000,0.019601000,0.018657000,0.015948000,0.012207000,0.012207000,0.012207000,0.010173000,0.008653000,0.007133000,0.005156000,0.003636000,0.002116000,0.000747000","7018  >  49162 [ACK] Seq=1 Ack=350001 Win=131072 Len=0 TSval=5131 TSecr=5130"
"3748","5.120743","10.1.0.11","10.1.0.10","TCP","2224","0.000864000","","","49162  >  7018 [ACK] Seq=351001 Ack=1 Win=131072 Len=1000 TSval=5132 TSecr=5131"
"3756","5.121415","10.1.0.11","10.1.0.10","TCP","1134","0.000672000","","","49162  >  7018 [ACK] Seq=352001 Ack=1 Win=131072 Len=1000 TSval=5133 TSecr=5131"
"3769","5.122442","10.1.0.11","10.1.0.10","TCP","1134","0.001027000","","","49162  >  7018 [ACK] Seq=353001 Ack=1 Win=131072 Len=1000 TSval=5134 TSecr=5131"
"3777","5.123050","10.1.0.11","10.1.0.10","TCP","1134","0.000608000","","","49162  >  7018 [ACK] Seq=354001 Ack=1 Win=131072 Len=1000 TSval=5135 TSecr=5131"
"3782","5.123518","10.1.0.10","10.1.0.11","TCP","224","0.000468000","-38 dBm","0.002775000,0.001076000","7018  >  49162 [ACK] Seq=1 Ack=354001 Win=131072 Len=0 TSval=5134 TSecr=5133"
"3789","5.123968","10.1.0.11","10.1.0.10","TCP","1134","0.000450000","","","49162  >  7018 [ACK] Seq=355001 Ack=1 Win=131072 Len=1000 TSval=5135 TSecr=5134"
"3801","5.124925","10.1.0.11","10.1.0.10","TCP","1134","0.000957000","","","49162  >  7018 [ACK] Seq=356001 Ack=1 Win=131072 Len=1000 TSval=5136 TSecr=5134"
"3820","5.128010","10.1.0.11","10.1.0.10","TCP","4376","0.003085000","","","49162  >  7018 [ACK] Seq=360001 Ack=1 Win=131072 Len=1000 TSval=5139 TSecr=5134"
"3828","5.128714","10.1.0.11","10.1.0.10","TCP","1134","0.000704000","","","49162  >  7018 [ACK] Seq=361001 Ack=1 Win=131072 Len=1000 TSval=5140 TSecr=5134"
"3844","5.130155","10.1.0.10","10.1.0.11","TCP","376","0.001441000","-38 dBm","0.006187000,0.002145000,0.002145000,0.001441000","7018  >  49162 [ACK] Seq=1 Ack=362001 Win=131072 Len=0 TSval=5141 TSecr=5139"
"3860","5.131414","10.1.0.11","10.1.0.10","TCP","3300","0.001259000","","","49162  >  7018 [ACK] Seq=364001 Ack=1 Win=131072 Len=1000 TSval=5143 TSecr=5141"
"3888","5.136300","10.1.0.11","10.1.0.10","TCP","6528","0.004886000","","","49162  >  7018 [ACK] Seq=370001 Ack=1 Win=131072 Len=1000 TSval=5147 TSecr=5141"
"3903","5.138232","10.1.0.11","10.1.0.10","TCP","3300","0.001932000","","","49162  >  7018 [ACK] Seq=373001 Ack=1 Win=131072 Len=1000 TSval=5150 TSecr=5141"
"3915","5.139368","10.1.0.11","10.1.0.10","TCP","1134","0.001136000","","","49162  >  7018 [ACK] Seq=374001 Ack=1 Win=131072 Len=1000 TSval=5151 TSecr=5141"
"3927","5.140281","10.1.0.11","10.1.0.10","TCP","1134","0.000913000","","","49162  >  7018 [ACK] Seq=375001 Ack=1 Win=131072 Len=1000 TSval=5151 TSecr=5141"
"3939","5.141193","10.1.0.11","10.1.0.10","TCP","1134","0.000912000","","","49162  >  7018 [ACK] Seq=376001 Ack=1 Win=131072 Len=1000 TSval=5152 TSecr=5141"
"3956","5.143215","10.1.0.10","10.1.0.11","TCP","604","0.002022000","-38 dBm","0.011801000,0.006915000,0.006915000,0.006915000,0.004983000,0.004983000,0.002934000","7018  >  49162 [ACK] Seq=1 Ack=376001 Win=131072 Len=0 TSval=5152 TSecr=5151"
"3968","5.144302","10.1.0.11","10.1.0.10","TCP","4376","0.001087000","","","49162  >  7018 [ACK] Seq=380001 Ack=1 Win=131072 Len=1000 TSval=5155 TSecr=5152"
"3980","5.145646","10.1.0.11","10.1.0.10","TCP","2224","0.001344000","","","49162  >  7018 [ACK] Seq=382001 Ack=1 Win=131072 Len=1000 TSval=5157 TSecr=5152"
"3992","5.146623","10.1.0.11","10.1.0.10","TCP","1134","0.000977000","","","49162  >  7018 [ACK] Seq=383001 Ack=1 Win=131072 Len=1000 TSval=5158 TSecr=5152"
"4004","5.147535","10.1.0.11","10.1.0.10","TCP","1134","0.000912000","","","49162  >  7018 [ACK] Seq=384001 Ack=1 Win=131072 Len=1000 TSval=5159 TSecr=5152"
"4016","5.148447","10.1.0.11","10.1.0.10","TCP","2224","0.000912000","","","49162  >  7018 [ACK] Seq=386001 Ack=1 Win=131072 Len=1000 TSval=5160 TSecr=5152"
"4028","5.149596","10.1.0.11","10.1.0.10","TCP","1134","0.001149000","","","49162  >  7018 [ACK] Seq=387001 Ack=1 Win=131072 Len=1000 TSval=5161 TSecr=5152"
"4040","5.150508","10.1.0.11","10.1.0.10","TCP","1134","0.000912000","","","49162  >  7018 [ACK] Seq=388001 Ack=1 Win=131072 Len=1000 TSval=5162 TSecr=5152"
"4052","5.151420","10.1.0.11","10.1.0.10","TCP","1134","0.000912000","","","49162  >  7018 [ACK] Seq=389001 Ack=1 Win=131072 Len=1000 TSval=5163 TSecr=5152"
"4064","5.152333","10.1.0.11","10.1.0.10","TCP","1134","0.000913000","","","49162  >  7018 [ACK] Seq=390001 Ack=1 Win=131072 Len=1000 TSval=5163 TSecr=5152"
"4076","5.153245","10.1.0.11","10.1.0.10","TCP","2224","0.000912000","","","49162  >  7018 [ACK] Seq=392001 Ack=1 Win=131072 Len=1000 TSval=5165 TSecr=5152"
"4092","5.154693","10.1.0.11","10.1.0.10","TCP","1134","0.001448000","","","49162  >  7018 [ACK] Seq=393001 Ack=1 Win=131072 Len=1000 TSval=5166 TSecr=5152"
"4104","5.155605","10.1.0.11","10.1.0.10","TCP","1134","0.000912000","","","49162  >  7018 [ACK] Seq=394001 Ack=1 Win=131072 Len=1000 TSval=5167 TSecr=5152"
"4116","5.156549","10.1.0.11","10.1.0.10","TCP","2224","0.000944000","","","49162  >  7018 [ACK] Seq=396001 Ack=1 Win=131072 Len=1000 TSval=5168 TSecr=5152"
"4128","5.157621","10.1.0.11","10.1.0.10","TCP","1134","0.001072000","","","49162  >  7018 [ACK] Seq=397001 Ack=1 Win=131072 Len=1000 TSval=5169 TSecr=5152"
"4140","5.158534","10.1.0.11","10.1.0.10","TCP","1134","0.000913000","","","49162  >  7018 [ACK] Seq=398001 Ack=1 Win=131072 Len=1000 TSval=5170 TSecr=5152"
"4152","5.159446","10.1.0.11","10.1.0.10","TCP","1134","0.000912000","","","49162  >  7018 [ACK] Seq=399001 Ack=1 Win=131072 Len=1000 TSval=5171 TSecr=5152"
"4164","5.160385","10.1.0.11","10.1.0.10","TCP","1134","0.000939000","","","49162  >  7018 [ACK] Seq=400001 Ack=1 Win=131072 Len=1000 TSval=5171 TSecr=5152"
"4176","5.161297","10.1.0.11","10.1.0.10","TCP","2224","0.000912000","","","49162  >  7018 [ACK] Seq=402001 Ack=1 Win=131072 Len=1000 TSval=5173 TSecr=5152"
"4188","5.162401","10.1.0.11","10.1.0.10","TCP","1134","0.001104000","","","49162  >  7018 [ACK] Seq=403001 Ack=1 Win=131072 Len=1000 TSval=5174 TSecr=5152"
"4200","5.163313","10.1.0.11","10.1.0.10","TCP","1134","0.000912000","","","49162  >  7018 [ACK] Seq=404001 Ack=1 Win=131072 Len=1000 TSval=5175 TSecr=5152"
"4212","5.164226","10.1.0.11","10.1.0.10","TCP","1134","0.000913000","","","49162  >  7018 [ACK] Seq=405001 Ack=1 Win=131072 Len=1000 TSval=5175 TSecr=5152"
"4224","5.165138","10.1.0.11","10.1.0.10","TCP","1134","0.000912000","","","49162  >  7018 [ACK] Seq=406001 Ack=1 Win=131072 Len=1000 TSval=5176 TSecr=5152"
"4250","5.167720","10.1.0.11","10.1.0.10","TCP","4376","0.002582000","","","49162  >  7018 [ACK] Seq=410001 Ack=1 Win=131072 Len=1000 TSval=5179 TSecr=5152"
