"No.","Time","Source","Destination","Protocol","Length","Time delta from previous displayed frame","Signal strength (dBm)","The RTT to ACK the segment was","Info"
"891","4.287807","10.1.0.11","10.1.0.9","TCP","138","0.000000000","","","49161  >  7016 [SYN] Seq=0 Win=65535 Len=0 TSval=4300 TSecr=0 WS=4 SACK_PERM=1"
"892","4.287946","10.1.0.11","10.1.0.9","TCP","138","0.000139000","","","[TCP Out-Of-Order] [TCP Port numbers reused] 49161  >  7016 [SYN] Seq=0 Win=65535 Len=0 TSval=4300 TSecr=0 WS=4 SACK_PERM=1"
"895","4.288221","10.1.0.9","10.1.0.11","TCP","138","0.000275000","-38 dBm","0.000414000","7016  >  49161 [SYN, ACK] Seq=0 Ack=1 Win=65535 Len=0 TSval=4300 TSecr=4300 WS=4 SACK_PERM=1"
"898","4.288367","10.1.0.11","10.1.0.9","TCP","134","0.000146000","","0.000146000","49161  >  7016 [ACK] Seq=1 Ack=1 Win=131072 Len=0 TSval=4300 TSecr=4300"
"907","4.289190","10.1.0.9","10.1.0.11","TCP","138","0.000823000","-38 dBm","","49153  >  7017 [SYN] Seq=0 Win=65535 Len=0 TSval=4300 TSecr=0 WS=4 SACK_PERM=1"
"910","4.289345","10.1.0.11","10.1.0.9","TCP","138","0.000155000","","0.000155000","7017  >  49153 [SYN, ACK] Seq=0 Ack=1 Win=65535 Len=0 TSval=4301 TSecr=4300 WS=4 SACK_PERM=1"
"913","4.289638","10.1.0.9","10.1.0.11","TCP","134","0.000293000","-38 dBm","0.000293000","49153  >  7017 [ACK] Seq=1 Ack=1 Win=131072 Len=0 TSval=4301 TSecr=4301"
"1022","4.839173","10.1.0.11","10.1.0.9","TCP","1134","0.549535000","","","49161  >  7016 [ACK] Seq=1 Ack=1 Win=131072 Len=1000 TSval=4851 TSecr=4300"
"1036","4.840237","10.1.0.11","10.1.0.9","TCP","1134","0.001064000","","","49161  >  7016 [ACK] Seq=1001 Ack=1 Win=131072 Len=1000 TSval=4852 TSecr=4300"
"1056","4.841949","10.1.0.11","10.1.0.9","TCP","2224","0.001712000","","","49161  >  7016 [ACK] Seq=3001 Ack=1 Win=131072 Len=1000 TSval=4853 TSecr=4300"
"1076","4.843853","10.1.0.11","10.1.0.9","TCP","3300","0.001904000","","","49161  >  7016 [ACK] Seq=6001 Ack=1 Win=131072 Len=1000 TSval=4856 TSecr=4300"
"1103","4.847525","10.1.0.11","10.1.0.9","TCP","4376","0.003672000","","","49161  >  7016 [ACK] Seq=10001 Ack=1 Win=131072 Len=1000 TSval=4859 TSecr=4300"
"1123","4.849862","10.1.0.11","10.1.0.9","TCP","3300","0.002337000","","","49161  >  7016 [ACK] Seq=13001 Ack=1 Win=131072 Len=1000 TSval=4861 TSecr=4300"
"1140","4.852067","10.1.0.9","10.1.0.11","TCP","6528","0.002205000","-38 dBm","","49153  >  7017 [ACK] Seq=5001 Ack=1 Win=131072 Len=1000 TSval=4856 TSecr=4301"
"1141","4.852067","10.1.0.9","10.1.0.11","TCP","6528","0.000000000","-38 dBm","","49153  >  7017 [ACK] Seq=11001 Ack=1 Win=131072 Len=1000 TSval=4861 TSecr=4301"
"1142","4.852067","10.1.0.9","10.1.0.11","TCP","3300","0.000000000","-38 dBm","","49153  >  7017 [ACK] Seq=14001 Ack=1 Win=131072 Len=1000 TSval=4863 TSecr=4301"
"1201","4.861386","10.1.0.11","10.1.0.9","TCP","1134","0.009319000","","","49161  >  7016 [ACK] Seq=14001 Ack=1 Win=131072 Len=1000 TSval=4862 TSecr=4300"
"1217","4.863080","10.1.0.11","10.1.0.9","TCP","680","0.001694000","","0.011013000,0.011013000,0.011013000,0.011013000,0.011013000,0.011013000,0.011013000,0.011013000","7017  >  49153 [ACK] Seq=1 Ack=15001 Win=131072 Len=0 TSval=4864 TSecr=4862"
"1289","4.870871","10.1.0.11","10.1.0.9","TCP","680","0.007791000","","","7017  >  49153 [ACK] Seq=1 Ack=15001 Win=131072 Len=0 TSval=4864 TSecr=4862"
"1305","4.872747","10.1.0.9","10.1.0.11","TCP","604","0.001876000","-38 dBm","0.033574000,0.030798000,0.028894000,0.028894000,0.025222000,0.025222000,0.022885000","7016  >  49161 [ACK] Seq=1 Ack=13001 Win=131072 Len=0 TSval=4862 TSecr=4860"
"1306","4.872747","10.1.0.9","10.1.0.11","TCP","134","0.000000000","-38 dBm","0.011361000","7016  >  49161 [ACK] Seq=1 Ack=15001 Win=131072 Len=0 TSval=4873 TSecr=4861"
"1319","4.873830","10.1.0.11","10.1.0.9","TCP","6376","0.001083000","","","49161  >  7016 [ACK] Seq=19501 Ack=1 Win=131072 Len=1500 TSval=4884 TSecr=4854"
"1320","4.873830","10.1.0.11","10.1.0.9","TCP","6376","0.000000000","","","49161  >  7016 [ACK] Seq=25501 Ack=1 Win=131072 Len=1500 TSval=4884 TSecr=4856"
"1321","4.873830","10.1.0.11","10.1.0.9","TCP","6376","0.000000000","","","49161  >  7016 [ACK] Seq=31501 Ack=1 Win=131072 Len=1500 TSval=4884 TSecr=4859"
"1322","4.873830","10.1.0.11","10.1.0.9","TCP","6376","0.000000000","","","49161  >  7016 [ACK] Seq=37501 Ack=1 Win=131072 Len=1500 TSval=4884 TSecr=4862"
"1323","4.873830","10.1.0.11","10.1.0.9","TCP","5376","0.000000000","","","49161  >  7016 [ACK] Seq=43001 Ack=1 Win=131072 Len=1000 TSval=4885 TSecr=4873"
"1329","4.875314","10.1.0.11","10.1.0.9","TCP","1134","0.001484000","","","49161  >  7016 [ACK] Seq=44001 Ack=1 Win=131072 Len=1000 TSval=4886 TSecr=4873"
"1358","4.878409","10.1.0.9","10.1.0.11","TCP","832","0.003095000","-38 dBm","0.004579000,0.004579000,0.004579000,0.004579000,0.004579000,0.004579000,0.004579000,0.004579000,0.004579000,0.004579000","7016  >  49161 [ACK] Seq=1 Ack=44001 Win=131072 Len=0 TSval=4887 TSecr=4884"
"1367","4.879139","10.1.0.11","10.1.0.9","TCP","6452","0.000730000","","","49161  >  7016 [ACK] Seq=50001 Ack=1 Win=131072 Len=1000 TSval=4891 TSecr=4887"
"1377","4.880075","10.1.0.11","10.1.0.9","TCP","1134","0.000936000","","","49161  >  7016 [ACK] Seq=51001 Ack=1 Win=131072 Len=1000 TSval=4892 TSecr=4887"
"1412","4.882670","10.1.0.11","10.1.0.9","TCP","3300","0.002595000","","","49161  >  7016 [ACK] Seq=54001 Ack=1 Win=131072 Len=1000 TSval=4894 TSecr=4887"
"1438","4.887058","10.1.0.11","10.1.0.9","TCP","6528","0.004388000","","","49161  >  7016 [ACK] Seq=60001 Ack=1 Win=131072 Len=1000 TSval=4899 TSecr=4887"
"1448","4.888349","10.1.0.11","10.1.0.9","TCP","1134","0.001291000","","","49161  >  7016 [ACK] Seq=61001 Ack=1 Win=131072 Len=1000 TSval=4900 TSecr=4887"
"1456","4.888957","10.1.0.11","10.1.0.9","TCP","1134","0.000608000","","","49161  >  7016 [ACK] Seq=62001 Ack=1 Win=131072 Len=1000 TSval=4900 TSecr=4887"
"1463","4.889584","10.1.0.9","10.1.0.11","TCP","756","0.000627000","-38 dBm","0.010445000,0.010445000,0.010445000,0.006914000,0.006914000,0.002526000,0.002526000,0.002526000,0.000627000","7016  >  49161 [ACK] Seq=1 Ack=63001 Win=131072 Len=0 TSval=4901 TSecr=4900"
"1478","4.890736","10.1.0.11","10.1.0.9","TCP","2224","0.001152000","","","49161  >  7016 [ACK] Seq=64001 Ack=1 Win=131072 Len=1000 TSval=4902 TSecr=4901"
"1496","4.893128","10.1.0.11","10.1.0.9","TCP","3300","0.002392000","","","49161  >  7016 [ACK] Seq=67001 Ack=1 Win=131072 Len=1000 TSval=4904 TSecr=4901"
"1508","4.894424","10.1.0.11","10.1.0.9","TCP","2224","0.001296000","","","49161  >  7016 [ACK] Seq=69001 Ack=1 Win=131072 Len=1000 TSval=4906 TSecr=4901"
"1522","4.895552","10.1.0.11","10.1.0.9","TCP","1134","0.001128000","","","49161  >  7016 [ACK] Seq=70001 Ack=1 Win=131072 Len=1000 TSval=4907 TSecr=4901"
"1535","4.896591","10.1.0.11","10.1.0.9","TCP","1134","0.001039000","","","49161  >  7016 [ACK] Seq=71001 Ack=1 Win=131072 Len=1000 TSval=4908 TSecr=4901"
"1545","4.897384","10.1.0.11","10.1.0.9","TCP","1134","0.000793000","","","49161  >  7016 [ACK] Seq=72001 Ack=1 Win=131072 Len=1000 TSval=4908 TSecr=4901"
"1555","4.898176","10.1.0.11","10.1.0.9","TCP","1134","0.000792000","","","49161  >  7016 [ACK] Seq=73001 Ack=1 Win=131072 Len=1000 TSval=4909 TSecr=4901"
"1565","4.898968","10.1.0.11","10.1.0.9","TCP","1134","0.000792000","","","49161  >  7016 [ACK] Seq=74001 Ack=1 Win=131072 Len=1000 TSval=4910 TSecr=4901"
"1575","4.899728","10.1.0.11","10.1.0.9","TCP","1134","0.000760000","","","49161  >  7016 [ACK] Seq=75001 Ack=1 Win=131072 Len=1000 TSval=4911 TSecr=4901"
"1587","4.900704","10.1.0.11","10.1.0.9","TCP","2224","0.000976000","","","49161  >  7016 [ACK] Seq=77001 Ack=1 Win=131072 Len=1000 TSval=4912 TSecr=4901"
"1605","4.902208","10.1.0.11","10.1.0.9","TCP","1134","0.001504000","","","49161  >  7016 [ACK] Seq=78001 Ack=1 Win=131072 Len=1000 TSval=4913 TSecr=4901"
"1615","4.903000","10.1.0.11","10.1.0.9","TCP","1134","0.000792000","","","49161  >  7016 [ACK] Seq=79001 Ack=1 Win=131072 Len=1000 TSval=4914 TSecr=4901"
"1625","4.903792","10.1.0.11","10.1.0.9","TCP","1134","0.000792000","","","49161  >  7016 [ACK] Seq=80001 Ack=1 Win=131072 Len=1000 TSval=4915 TSecr=4901"
"1635","4.904585","10.1.0.11","10.1.0.9","TCP","1134","0.000793000","","","49161  >  7016 [ACK] Seq=81001 Ack=1 Win=131072 Len=1000 TSval=4916 TSecr=4901"
"1645","4.905377","10.1.0.11","10.1.0.9","TCP","1134","0.000792000","","","49161  >  7016 [ACK] Seq=82001 Ack=1 Win=131072 Len=1000 TSval=4916 TSecr=4901"
"1655","4.906169","10.1.0.11","10.1.0.9","TCP","1134","0.000792000","","","49161  >  7016 [ACK] Seq=83001 Ack=1 Win=131072 Len=1000 TSval=4917 TSecr=4901"
"1666","4.907042","10.1.0.11","10.1.0.9","TCP","2224","0.000873000","","","49161  >  7016 [ACK] Seq=85001 Ack=1 Win=131072 Len=1000 TSval=4919 TSecr=4901"
"1678","4.908146","10.1.0.11","10.1.0.9","TCP","1134","0.001104000","","","49161  >  7016 [ACK] Seq=86001 Ack=1 Win=131072 Len=1000 TSval=4920 TSecr=4901"
"1690","4.909058","10.1.0.11","10.1.0.9","TCP","1134","0.000912000","","","49161  >  7016 [ACK] Seq=87001 Ack=1 Win=131072 Len=1000 TSval=4920 TSecr=4901"
"1702","4.909970","10.1.0.11","10.1.0.9","TCP","1134","0.000912000","","","49161  >  7016 [ACK] Seq=88001 Ack=1 Win=131072 Len=1000 TSval=4921 TSecr=4901"
"1714","4.910882","10.1.0.11","10.1.0.9","TCP","1134","0.000912000","","","49161  >  7016 [ACK] Seq=89001 Ack=1 Win=131072 Len=1000 TSval=4922 TSecr=4901"
"1726","4.911827","10.1.0.11","10.1.0.9","TCP","2224","0.000945000","","","49161  >  7016 [ACK] Seq=91001 Ack=1 Win=131072 Len=1000 TSval=4924 TSecr=4901"
"1742","4.913348","10.1.0.11","10.1.0.9","TCP","1134","0.001521000","","","49161  >  7016 [ACK] Seq=92001 Ack=1 Win=131072 Len=1000 TSval=4924 TSecr=4901"
"1750","4.913956","10.1.0.11","10.1.0.9","TCP","1134","0.000608000","","","49161  >  7016 [ACK] Seq=93001 Ack=1 Win=131072 Len=1000 TSval=4925 TSecr=4901"
"1762","4.914868","10.1.0.11","10.1.0.9","TCP","1134","0.000912000","","","49161  >  7016 [ACK] Seq=94001 Ack=1 Win=131072 Len=1000 TSval=4926 TSecr=4901"
"1774","4.915812","10.1.0.11","10.1.0.9","TCP","1134","0.000944000","","","49161  >  7016 [ACK] Seq=95001 Ack=1 Win=131072 Len=1000 TSval=4927 TSecr=4901"
"1784","4.916604","10.1.0.11","10.1.0.9","TCP","1134","0.000792000","","","49161  >  7016 [ACK] Seq=96001 Ack=1 Win=131072 Len=1000 TSval=4928 TSecr=4901"
"1794","4.917396","10.1.0.11","10.1.0.9","TCP","1134","0.000792000","","","49161  >  7016 [ACK] Seq=97001 Ack=1 Win=131072 Len=1000 TSval=4928 TSecr=4901"
"1806","4.918707","10.1.0.11","10.1.0.9","TCP","2224","0.001311000","","","49161  >  7016 [ACK] Seq=99001 Ack=1 Win=131072 Len=1000 TSval=4930 TSecr=4901"
"1818","4.919716","10.1.0.11","10.1.0.9","TCP","1134","0.001009000","","","49161  >  7016 [ACK] Seq=100001 Ack=1 Win=131072 Len=1000 TSval=4931 TSecr=4901"
"1828","4.920476","10.1.0.11","10.1.0.9","TCP","1134","0.000760000","","","49161  >  7016 [ACK] Seq=101001 Ack=1 Win=131072 Len=1000 TSval=4932 TSecr=4901"
"1840","4.921420","10.1.0.11","10.1.0.9","TCP","1134","0.000944000","","","49161  >  7016 [ACK] Seq=102001 Ack=1 Win=131072 Len=1000 TSval=4932 TSecr=4901"
"1848","4.922060","10.1.0.11","10.1.0.9","TCP","1134","0.000640000","","","49161  >  7016 [ACK] Seq=103001 Ack=1 Win=131072 Len=1000 TSval=4933 TSecr=4901"
"1854","4.922516","10.1.0.11","10.1.0.9","TCP","1134","0.000456000","","","49161  >  7016 [ACK] Seq=104001 Ack=1 Win=131072 Len=1000 TSval=4934 TSecr=4901"
"1862","4.923370","10.1.0.9","10.1.0.11","TCP","1136","0.000854000","-38 dBm","0.032634000,0.030242000,0.028946000,0.027818000,0.025986000,0.024402000,0.022666000,0.021162000,0.019578000,0.017993000,0.016328000,0.015224000,0.013400000,0.011543000","7016  >  49161 [ACK] Seq=1 Ack=91001 Win=131072 Len=0 TSval=4924 TSecr=4922"
"1863","4.923370","10.1.0.9","10.1.0.11","TCP","604","0.000000000","-38 dBm","0.010022000,0.008502000,0.006766000,0.004663000,0.003654000,0.001950000,0.000854000","7016  >  49161 [ACK] Seq=1 Ack=105001 Win=131072 Len=0 TSval=4934 TSecr=4933"
"1866","4.923538","10.1.0.11","10.1.0.9","TCP","680","0.000168000","","","7017  >  49153 [ACK] Seq=1 Ack=15001 Win=131072 Len=0 TSval=4864 TSecr=4862"
"1920","4.932139","10.1.0.11","10.1.0.9","TCP","6528","0.008601000","","","49161  >  7016 [ACK] Seq=110001 Ack=1 Win=131072 Len=1000 TSval=4939 TSecr=4934"
"1921","4.932139","10.1.0.11","10.1.0.9","TCP","6528","0.000000000","","","49161  >  7016 [ACK] Seq=116001 Ack=1 Win=131072 Len=1000 TSval=4944 TSecr=4934"
"1928","4.933404","10.1.0.11","10.1.0.9","TCP","1134","0.001265000","","","49161  >  7016 [ACK] Seq=117001 Ack=1 Win=131072 Len=1000 TSval=4944 TSecr=4934"
"1932","4.933708","10.1.0.11","10.1.0.9","TCP","1134","0.000304000","","","49161  >  7016 [ACK] Seq=118001 Ack=1 Win=131072 Len=1000 TSval=4945 TSecr=4934"
"1935","4.935192","10.1.0.11","10.1.0.9","TCP","2224","0.001484000","","","49161  >  7016 [ACK] Seq=120001 Ack=1 Win=131072 Len=1000 TSval=4947 TSecr=4934"
"1952","4.937248","10.1.0.11","10.1.0.9","TCP","2224","0.002056000","","","49161  >  7016 [ACK] Seq=122001 Ack=1 Win=131072 Len=1000 TSval=4948 TSecr=4934"
"1983","4.941903","10.1.0.11","10.1.0.9","TCP","2224","0.004655000","","","[TCP Retransmission] [TCP Retransmission] 49161  >  7016 [ACK] Seq=122001 Ack=1 Win=131072 Len=1000 TSval=4948 TSecr=4934"
"1984","4.941903","10.1.0.11","10.1.0.9","TCP","6528","0.000000000","","","49161  >  7016 [ACK] Seq=128001 Ack=1 Win=131072 Len=1000 TSval=4953 TSecr=4934"
"1997","4.944435","10.1.0.11","10.1.0.9","TCP","3300","0.002532000","","","49161  >  7016 [ACK] Seq=131001 Ack=1 Win=131072 Len=1000 TSval=4956 TSecr=4934"
"2001","4.944867","10.1.0.11","10.1.0.9","TCP","1134","0.000432000","","","49161  >  7016 [ACK] Seq=132001 Ack=1 Win=131072 Len=1000 TSval=4956 TSecr=4934"
"2006","4.946331","10.1.0.9","10.1.0.11","TCP","6376","0.001464000","-38 dBm","","49153  >  7017 [ACK] Seq=19501 Ack=1 Win=131072 Len=1500 TSval=4935 TSecr=4863"
"2007","4.946331","10.1.0.9","10.1.0.11","TCP","6376","0.000000000","-38 dBm","","49153  >  7017 [ACK] Seq=25501 Ack=1 Win=131072 Len=1500 TSval=4935 TSecr=4864"
"2008","4.946331","10.1.0.9","10.1.0.11","TCP","6376","0.000000000","-38 dBm","","49153  >  7017 [ACK] Seq=31501 Ack=1 Win=131072 Len=1500 TSval=4935 TSecr=4864"
"2009","4.946331","10.1.0.9","10.1.0.11","TCP","6376","0.000000000","-38 dBm","","49153  >  7017 [ACK] Seq=37501 Ack=1 Win=131072 Len=1500 TSval=4935 TSecr=4864"
"2010","4.946331","10.1.0.9","10.1.0.11","TCP","6376","0.000000000","-38 dBm","","49153  >  7017 [ACK] Seq=43501 Ack=1 Win=131072 Len=1500 TSval=4935 TSecr=4864"
"2013","4.946490","10.1.0.11","10.1.0.9","TCP","2224","0.000159000","","","49161  >  7016 [ACK] Seq=134001 Ack=1 Win=131072 Len=1000 TSval=4958 TSecr=4934"
"2014","4.946758","10.1.0.9","10.1.0.11","TCP","1136","0.000268000","-38 dBm","0.014619000,0.014619000,0.014619000,0.014619000,0.014619000,0.014619000,0.013050000,0.011566000,0.009510000,0.004855000,0.004855000,0.004855000,0.002323000,0.001891000","7016  >  49161 [ACK] Seq=1 Ack=133001 Win=131072 Len=0 TSval=4957 TSecr=4956"
"2047","4.950644","10.1.0.11","10.1.0.9","TCP","2224","0.003886000","","","[TCP Retransmission] [TCP Retransmission] 49161  >  7016 [ACK] Seq=134001 Ack=1 Win=131072 Len=1000 TSval=4958 TSecr=4934"
"2048","4.950644","10.1.0.11","10.1.0.9","TCP","5452","0.000000000","","","49161  >  7016 [ACK] Seq=139001 Ack=1 Win=131072 Len=1000 TSval=4962 TSecr=4957"
"2093","4.959074","10.1.0.11","10.1.0.9","TCP","6528","0.008430000","","","49161  >  7016 [ACK] Seq=145001 Ack=1 Win=131072 Len=1000 TSval=4967 TSecr=4957"
"2094","4.959074","10.1.0.11","10.1.0.9","TCP","5452","0.000000000","","","49161  >  7016 [ACK] Seq=150001 Ack=1 Win=131072 Len=1000 TSval=4971 TSecr=4957"
"2105","4.961074","10.1.0.11","10.1.0.9","TCP","2224","0.002000000","","","49161  >  7016 [ACK] Seq=152001 Ack=1 Win=131072 Len=1000 TSval=4972 TSecr=4957"
"2114","4.962024","10.1.0.11","10.1.0.9","TCP","1134","0.000950000","","","49161  >  7016 [ACK] Seq=153001 Ack=1 Win=131072 Len=1000 TSval=4973 TSecr=4957"
"2122","4.962632","10.1.0.11","10.1.0.9","TCP","1134","0.000608000","","","49161  >  7016 [ACK] Seq=154001 Ack=1 Win=131072 Len=1000 TSval=4974 TSecr=4957"
"2130","4.963240","10.1.0.11","10.1.0.9","TCP","1134","0.000608000","","","49161  >  7016 [ACK] Seq=155001 Ack=1 Win=131072 Len=1000 TSval=4975 TSecr=4957"
"2139","4.963943","10.1.0.11","10.1.0.9","TCP","1134","0.000703000","","","49161  >  7016 [ACK] Seq=156001 Ack=1 Win=131072 Len=1000 TSval=4976 TSecr=4957"
"2165","4.966850","10.1.0.11","10.1.0.9","TCP","3300","0.002907000","","","49161  >  7016 [ACK] Seq=159001 Ack=1 Win=131072 Len=1000 TSval=4978 TSecr=4957"
"2186","4.970134","10.1.0.11","10.1.0.9","TCP","4376","0.003284000","","","49161  >  7016 [ACK] Seq=163001 Ack=1 Win=131072 Len=1000 TSval=4981 TSecr=4957"
"2192","4.970985","10.1.0.9","10.1.0.11","TCP","1212","0.000851000","-38 dBm","0.024495000,0.020341000,0.020341000,0.011911000,0.011911000,0.011911000,0.011911000,0.011911000,0.011911000,0.009911000,0.008353000,0.007042000,0.004135000,0.000851000,0.000851000","7016  >  49161 [ACK] Seq=1 Ack=163001 Win=131072 Len=0 TSval=4982 TSecr=4980"
"2201","4.971693","10.1.0.11","10.1.0.9","TCP","2224","0.000708000","","","49161  >  7016 [ACK] Seq=165001 Ack=1 Win=131072 Len=1000 TSval=4983 TSecr=4982"
"2205","4.972029","10.1.0.11","10.1.0.9","TCP","1134","0.000336000","","","49161  >  7016 [ACK] Seq=166001 Ack=1 Win=131072 Len=1000 TSval=4984 TSecr=4982"
"2226","4.974744","10.1.0.11","10.1.0.9","TCP","3300","0.002715000","","","49161  >  7016 [ACK] Seq=169001 Ack=1 Win=131072 Len=1000 TSval=4986 TSecr=4982"
"2232","4.975328","10.1.0.11","10.1.0.9","TCP","1134","0.000584000","","","49161  >  7016 [ACK] Seq=170001 Ack=1 Win=131072 Len=1000 TSval=4987 TSecr=4982"
"2251","4.976805","10.1.0.11","10.1.0.9","TCP","2224","0.001477000","","","49161  >  7016 [ACK] Seq=172001 Ack=1 Win=131072 Len=1000 TSval=4988 TSecr=4982"
"2272","4.980077","10.1.0.11","10.1.0.9","TCP","4376","0.003272000","","","49161  >  7016 [ACK] Seq=176001 Ack=1 Win=131072 Len=1000 TSval=4992 TSecr=4982"
"2280","4.980877","10.1.0.11","10.1.0.9","TCP","1134","0.000800000","","","49161  >  7016 [ACK] Seq=177001 Ack=1 Win=131072 Len=1000 TSval=4992 TSecr=4982"
"2287","4.981504","10.1.0.9","10.1.0.11","TCP","604","0.000627000","-38 dBm","0.009811000,0.009475000,0.006760000,0.006176000,0.004699000,0.001427000,0.001427000","7016  >  49161 [ACK] Seq=1 Ack=177001 Win=131072 Len=0 TSval=4992 TSecr=4991"
"2292","4.981811","10.1.0.11","10.1.0.9","TCP","1134","0.000307000","","","49161  >  7016 [ACK] Seq=178001 Ack=1 Win=131072 Len=1000 TSval=4993 TSecr=4982"
"2300","4.982420","10.1.0.11","10.1.0.9","TCP","1134","0.000609000","","","49161  >  7016 [ACK] Seq=179001 Ack=1 Win=131072 Len=1000 TSval=4994 TSecr=4992"
"2309","4.983310","10.1.0.11","10.1.0.9","TCP","1134","0.000890000","","","49161  >  7016 [ACK] Seq=180001 Ack=1 Win=131072 Len=1000 TSval=4995 TSecr=4992"
"2323","4.984709","10.1.0.11","10.1.0.9","TCP","2224","0.001399000","","","49161  >  7016 [ACK] Seq=182001 Ack=1 Win=131072 Len=1000 TSval=4996 TSecr=4992"
"2344","4.987817","10.1.0.11","10.1.0.9","TCP","3300","0.003108000","","","49161  >  7016 [ACK] Seq=185001 Ack=1 Win=131072 Len=1000 TSval=4999 TSecr=4992"
"2350","4.988433","10.1.0.11","10.1.0.9","TCP","1134","0.000616000","","","49161  >  7016 [ACK] Seq=186001 Ack=1 Win=131072 Len=1000 TSval=5000 TSecr=4992"
"2356","4.988889","10.1.0.11","10.1.0.9","TCP","1134","0.000456000","","","49161  >  7016 [ACK] Seq=187001 Ack=1 Win=131072 Len=1000 TSval=5000 TSecr=4992"
"2369","4.990044","10.1.0.11","10.1.0.9","TCP","1134","0.001155000","","","49161  >  7016 [ACK] Seq=188001 Ack=1 Win=131072 Len=1000 TSval=5001 TSecr=4992"
"2383","4.991912","10.1.0.11","10.1.0.9","TCP","3300","0.001868000","","","49161  >  7016 [ACK] Seq=191001 Ack=1 Win=131072 Len=1000 TSval=5004 TSecr=4992"
"2397","4.993137","10.1.0.11","10.1.0.9","TCP","1134","0.001225000","","","49161  >  7016 [ACK] Seq=192001 Ack=1 Win=131072 Len=1000 TSval=5004 TSecr=4992"
"2407","4.993897","10.1.0.11","10.1.0.9","TCP","1134","0.000760000","","","49161  >  7016 [ACK] Seq=193001 Ack=1 Win=131072 Len=1000 TSval=5005 TSecr=4992"
"2417","4.994657","10.1.0.11","10.1.0.9","TCP","1134","0.000760000","","","49161  >  7016 [ACK] Seq=194001 Ack=1 Win=131072 Len=1000 TSval=5006 TSecr=4992"
"2427","4.995640","10.1.0.9","10.1.0.11","TCP","224","0.000983000","-38 dBm","0.013829000,0.012330000","7016  >  49161 [ACK] Seq=1 Ack=181001 Win=131072 Len=0 TSval=4995 TSecr=4994"
"2428","4.995640","10.1.0.9","10.1.0.11","TCP","604","0.000000000","-38 dBm","0.010931000,0.007823000,0.007207000,0.005596000,0.003728000,0.002503000,0.000983000","7016  >  49161 [ACK] Seq=1 Ack=195001 Win=131072 Len=0 TSval=5006 TSecr=5005"
"2437","4.996261","10.1.0.11","10.1.0.9","TCP","2224","0.000621000","","","49161  >  7016 [ACK] Seq=196001 Ack=1 Win=131072 Len=1000 TSval=5008 TSecr=5006"
"2447","4.997149","10.1.0.11","10.1.0.9","TCP","1134","0.000888000","","","49161  >  7016 [ACK] Seq=197001 Ack=1 Win=131072 Len=1000 TSval=5008 TSecr=5006"
"2457","4.997909","10.1.0.11","10.1.0.9","TCP","1134","0.000760000","","","49161  >  7016 [ACK] Seq=198001 Ack=1 Win=131072 Len=1000 TSval=5009 TSecr=5006"
"2467","4.998669","10.1.0.11","10.1.0.9","TCP","1134","0.000760000","","","49161  >  7016 [ACK] Seq=199001 Ack=1 Win=131072 Len=1000 TSval=5010 TSecr=5006"
"2477","4.999429","10.1.0.11","10.1.0.9","TCP","1134","0.000760000","","","49161  >  7016 [ACK] Seq=200001 Ack=1 Win=131072 Len=1000 TSval=5011 TSecr=5006"
"2487","5.000190","10.1.0.11","10.1.0.9","TCP","1134","0.000761000","","","49161  >  7016 [ACK] Seq=201001 Ack=1 Win=131072 Len=1000 TSval=5012 TSecr=5006"
"2497","5.000950","10.1.0.11","10.1.0.9","TCP","1134","0.000760000","","","49161  >  7016 [ACK] Seq=202001 Ack=1 Win=131072 Len=1000 TSval=5012 TSecr=5006"
"2527","5.003169","10.1.0.11","10.1.0.9","TCP","3300","0.002219000","","","49161  >  7016 [ACK] Seq=205001 Ack=1 Win=131072 Len=1000 TSval=5015 TSecr=5006"
"2555","5.008017","10.1.0.11","10.1.0.9","TCP","3300","0.004848000","","","49161  >  7016 [ACK] Seq=208001 Ack=1 Win=131072 Len=1000 TSval=5017 TSecr=5006"
"2566","5.009454","10.1.0.11","10.1.0.9","TCP","5452","0.001437000","","","49161  >  7016 [ACK] Seq=213001 Ack=1 Win=131072 Len=1000 TSval=5021 TSecr=5006"
"2580","5.011158","10.1.0.11","10.1.0.9","TCP","2224","0.001704000","","","49161  >  7016 [ACK] Seq=215001 Ack=1 Win=131072 Len=1000 TSval=5023 TSecr=5006"
"2598","5.012591","10.1.0.11","10.1.0.9","TCP","1134","0.001433000","","","49161  >  7016 [ACK] Seq=216001 Ack=1 Win=131072 Len=1000 TSval=5024 TSecr=5006"
"2613","5.014102","10.1.0.11","10.1.0.9","TCP","2224","0.001511000","","","49161  >  7016 [ACK] Seq=218001 Ack=1 Win=131072 Len=1000 TSval=5025 TSecr=5006"
"2627","5.015358","10.1.0.11","10.1.0.9","TCP","2224","0.001256000","","","49161  >  7016 [ACK] Seq=220001 Ack=1 Win=131072 Len=1000 TSval=5027 TSecr=5006"
"2639","5.016334","10.1.0.11","10.1.0.9","TCP","1134","0.000976000","","","49161  >  7016 [ACK] Seq=221001 Ack=1 Win=131072 Len=1000 TSval=5028 TSecr=5006"
"2649","5.017094","10.1.0.11","10.1.0.9","TCP","1134","0.000760000","","","49161  >  7016 [ACK] Seq=222001 Ack=1 Win=131072 Len=1000 TSval=5028 TSecr=5006"
"2659","5.017854","10.1.0.11","10.1.0.9","TCP","1134","0.000760000","","","49161  >  7016 [ACK] Seq=223001 Ack=1 Win=131072 Len=1000 TSval=5029 TSecr=5006"
"2669","5.018615","10.1.0.11","10.1.0.9","TCP","1134","0.000761000","","","49161  >  7016 [ACK] Seq=224001 Ack=1 Win=131072 Len=1000 TSval=5030 TSecr=5006"
"2679","5.019375","10.1.0.11","10.1.0.9","TCP","1134","0.000760000","","","49161  >  7016 [ACK] Seq=225001 Ack=1 Win=131072 Len=1000 TSval=5031 TSecr=5006"
"2701","5.021756","10.1.0.11","10.1.0.9","TCP","3300","0.002381000","","","49161  >  7016 [ACK] Seq=228001 Ack=1 Win=131072 Len=1000 TSval=5033 TSecr=5006"
"2728","5.026349","10.1.0.11","10.1.0.9","TCP","6528","0.004593000","","","49161  >  7016 [ACK] Seq=234001 Ack=1 Win=131072 Len=1000 TSval=5038 TSecr=5006"
"2744","5.028285","10.1.0.11","10.1.0.9","TCP","2224","0.001936000","","","49161  >  7016 [ACK] Seq=236001 Ack=1 Win=131072 Len=1000 TSval=5040 TSecr=5006"
"2758","5.029477","10.1.0.11","10.1.0.9","TCP","2224","0.001192000","","","49161  >  7016 [ACK] Seq=238001 Ack=1 Win=131072 Len=1000 TSval=5041 TSecr=5006"
"2774","5.030918","10.1.0.11","10.1.0.9","TCP","1134","0.001441000","","","49161  >  7016 [ACK] Seq=239001 Ack=1 Win=131072 Len=1000 TSval=5042 TSecr=5006"
"2789","5.032031","10.1.0.11","10.1.0.9","TCP","2224","0.001113000","","","49161  >  7016 [ACK] Seq=241001 Ack=1 Win=131072 Len=1000 TSval=5044 TSecr=5006"
"2808","5.034195","10.1.0.11","10.1.0.9","TCP","2224","0.002164000","","","49161  >  7016 [ACK] Seq=243001 Ack=1 Win=131072 Len=1000 TSval=5045 TSecr=5006"
"2824","5.035891","10.1.0.11","10.1.0.9","TCP","3300","0.001696000","","","49161  >  7016 [ACK] Seq=246001 Ack=1 Win=131072 Len=1000 TSval=5048 TSecr=5006"
"2841","5.037591","10.1.0.9","10.1.0.11","TCP","376","0.001700000","-38 dBm","0.041330000,0.039682000,0.038162000,0.036641000","7016  >  49161 [ACK] Seq=1 Ack=203001 Win=131072 Len=0 TSval=5013 TSecr=5012"
"2842","5.037591","10.1.0.9","10.1.0.11","TCP","1744","0.000000000","-38 dBm","0.034422000,0.029574000,0.029574000,0.028137000,0.028137000,0.026433000,0.025000000,0.023489000,0.022233000,0.020497000,0.018976000,0.015835000,0.015835000,0.011242000,0.011242000,0.011242000,0.009306000,0.008114000,0.005560000,0.003396000,0.001700000,0.001700000","7016  >  49161 [ACK] Seq=1 Ack=247001 Win=131072 Len=0 TSval=5048 TSecr=5047"
"2848","5.037997","10.1.0.11","10.1.0.9","TCP","2224","0.000406000","","","49161  >  7016 [ACK] Seq=248001 Ack=1 Win=131072 Len=1000 TSval=5049 TSecr=5006"
"2862","5.039286","10.1.0.11","10.1.0.9","TCP","2224","0.001289000","","","49161  >  7016 [ACK] Seq=250001 Ack=1 Win=131072 Len=1000 TSval=5051 TSecr=5048"
"2876","5.040574","10.1.0.11","10.1.0.9","TCP","1134","0.001288000","","","49161  >  7016 [ACK] Seq=251001 Ack=1 Win=131072 Len=1000 TSval=5052 TSecr=5048"
"2886","5.041334","10.1.0.11","10.1.0.9","TCP","1134","0.000760000","","","49161  >  7016 [ACK] Seq=252001 Ack=1 Win=131072 Len=1000 TSval=5052 TSecr=5048"
"2900","5.042526","10.1.0.11","10.1.0.9","TCP","2224","0.001192000","","","49161  >  7016 [ACK] Seq=254001 Ack=1 Win=131072 Len=1000 TSval=5054 TSecr=5048"
"2913","5.043588","10.1.0.11","10.1.0.9","TCP","1134","0.001062000","","","49161  >  7016 [ACK] Seq=255001 Ack=1 Win=131072 Len=1000 TSval=5055 TSecr=5048"
"2925","5.044500","10.1.0.11","10.1.0.9","TCP","1134","0.000912000","","","49161  >  7016 [ACK] Seq=256001 Ack=1 Win=131072 Len=1000 TSval=5056 TSecr=5048"
"2937","5.045540","10.1.0.11","10.1.0.9","TCP","2224","0.001040000","","","49161  >  7016 [ACK] Seq=258001 Ack=1 Win=131072 Len=1000 TSval=5057 TSecr=5048"
"2951","5.046637","10.1.0.11","10.1.0.9","TCP","1134","0.001097000","","","49161  >  7016 [ACK] Seq=259001 Ack=1 Win=131072 Len=1000 TSval=5058 TSecr=5048"
"2963","5.047549","10.1.0.11","10.1.0.9","TCP","1134","0.000912000","","","49161  >  7016 [ACK] Seq=260001 Ack=1 Win=131072 Len=1000 TSval=5059 TSecr=5048"
"2975","5.048461","10.1.0.11","10.1.0.9","TCP","1134","0.000912000","","","49161  >  7016 [ACK] Seq=261001 Ack=1 Win=131072 Len=1000 TSval=5060 TSecr=5048"
"2990","5.049914","10.1.0.11","10.1.0.9","TCP","2224","0.001453000","","","49161  >  7016 [ACK] Seq=263001 Ack=1 Win=131072 Len=1000 TSval=5061 TSecr=5048"
"3011","5.053166","10.1.0.11","10.1.0.9","TCP","4376","0.003252000","","","49161  >  7016 [ACK] Seq=267001 Ack=1 Win=131072 Len=1000 TSval=5064 TSecr=5048"
"3019","5.053966","10.1.0.11","10.1.0.9","TCP","1134","0.000800000","","","49161  >  7016 [ACK] Seq=268001 Ack=1 Win=131072 Len=1000 TSval=5065 TSecr=5048"
"3027","5.054574","10.1.0.11","10.1.0.9","TCP","1134","0.000608000","","","49161  >  7016 [ACK] Seq=269001 Ack=1 Win=131072 Len=1000 TSval=5066 TSecr=5048"
"3034","5.055295","10.1.0.9","10.1.0.11","TCP","908","0.000721000","-38 dBm","0.017298000,0.016009000,0.013961000,0.012769000,0.010795000,0.009755000,0.007746000,0.005381000,0.002129000,0.002129000,0.001329000","7016  >  49161 [ACK] Seq=1 Ack=269001 Win=131072 Len=0 TSval=5066 TSecr=5064"
"3044","5.056006","10.1.0.11","10.1.0.9","TCP","2224","0.000711000","","","49161  >  7016 [ACK] Seq=271001 Ack=1 Win=131072 Len=1000 TSval=5068 TSecr=5066"
"3062","5.058112","10.1.0.11","10.1.0.9","TCP","2224","0.002106000","","","49161  >  7016 [ACK] Seq=273001 Ack=1 Win=131072 Len=1000 TSval=5069 TSecr=5066"
"3070","5.058880","10.1.0.11","10.1.0.9","TCP","1134","0.000768000","","","49161  >  7016 [ACK] Seq=274001 Ack=1 Win=131072 Len=1000 TSval=5070 TSecr=5066"
"3076","5.059336","10.1.0.11","10.1.0.9","TCP","1134","0.000456000","","","49161  >  7016 [ACK] Seq=275001 Ack=1 Win=131072 Len=1000 TSval=5071 TSecr=5066"
"3084","5.059944","10.1.0.11","10.1.0.9","TCP","1134","0.000608000","","","49161  >  7016 [ACK] Seq=276001 Ack=1 Win=131072 Len=1000 TSval=5072 TSecr=5066"
"3126","5.063685","10.1.0.11","10.1.0.9","TCP","4376","0.003741000","","","49161  >  7016 [ACK] Seq=280001 Ack=1 Win=131072 Len=1000 TSval=5075 TSecr=5066"
"3146","5.066853","10.1.0.11","10.1.0.9","TCP","4376","0.003168000","","","49161  >  7016 [ACK] Seq=284001 Ack=1 Win=131072 Len=1000 TSval=5078 TSecr=5066"
"3161","5.068383","10.1.0.11","10.1.0.9","TCP","2224","0.001530000","","","49161  >  7016 [ACK] Seq=286001 Ack=1 Win=131072 Len=1000 TSval=5080 TSecr=5066"
"3173","5.069456","10.1.0.11","10.1.0.9","TCP","2224","0.001073000","","","49161  >  7016 [ACK] Seq=288001 Ack=1 Win=131072 Len=1000 TSval=5081 TSecr=5066"
"3189","5.070768","10.1.0.11","10.1.0.9","TCP","1134","0.001312000","","","49161  >  7016 [ACK] Seq=289001 Ack=1 Win=131072 Len=1000 TSval=5082 TSecr=5066"
"3201","5.071680","10.1.0.11","10.1.0.9","TCP","1134","0.000912000","","","49161  >  7016 [ACK] Seq=290001 Ack=1 Win=131072 Len=1000 TSval=5083 TSecr=5066"
"3213","5.072592","10.1.0.11","10.1.0.9","TCP","1134","0.000912000","","","49161  >  7016 [ACK] Seq=291001 Ack=1 Win=131072 Len=1000 TSval=5084 TSecr=5066"
"3225","5.073681","10.1.0.11","10.1.0.9","TCP","2224","0.001089000","","","49161  >  7016 [ACK] Seq=293001 Ack=1 Win=131072 Len=1000 TSval=5085 TSecr=5066"
"3239","5.074809","10.1.0.11","10.1.0.9","TCP","1134","0.001128000","","","49161  >  7016 [ACK] Seq=294001 Ack=1 Win=131072 Len=1000 TSval=5086 TSecr=5066"
"3251","5.075722","10.1.0.11","10.1.0.9","TCP","1134","0.000913000","","","49161  >  7016 [ACK] Seq=295001 Ack=1 Win=131072 Len=1000 TSval=5087 TSecr=5066"
"3263","5.076634","10.1.0.11","10.1.0.9","TCP","2224","0.000912000","","","49161  >  7016 [ACK] Seq=297001 Ack=1 Win=131072 Len=1000 TSval=5088 TSecr=5066"
"3277","5.077858","10.1.0.11","10.1.0.9","TCP","1134","0.001224000","","","49161  >  7016 [ACK] Seq=298001 Ack=1 Win=131072 Len=1000 TSval=5089 TSecr=5066"
"3289","5.078770","10.1.0.11","10.1.0.9","TCP","1134","0.000912000","","","49161  >  7016 [ACK] Seq=299001 Ack=1 Win=131072 Len=1000 TSval=5090 TSecr=5066"
"3301","5.079709","10.1.0.11","10.1.0.9","TCP","1134","0.000939000","","","49161  >  7016 [ACK] Seq=300001 Ack=1 Win=131072 Len=1000 TSval=5091 TSecr=5066"
"3313","5.080621","10.1.0.11","10.1.0.9","TCP","2224","0.000912000","","","49161  >  7016 [ACK] Seq=302001 Ack=1 Win=131072 Len=1000 TSval=5092 TSecr=5066"
"3329","5.081966","10.1.0.11","10.1.0.9","TCP","1134","0.001345000","","","49161  >  7016 [ACK] Seq=303001 Ack=1 Win=131072 Len=1000 TSval=5093 TSecr=5066"
"3341","5.082878","10.1.0.11","10.1.0.9","TCP","1134","0.000912000","","","49161  >  7016 [ACK] Seq=304001 Ack=1 Win=131072 Len=1000 TSval=5094 TSecr=5066"
"3353","5.083790","10.1.0.11","10.1.0.9","TCP","1134","0.000912000","","","49161  >  7016 [ACK] Seq=305001 Ack=1 Win=131072 Len=1000 TSval=5095 TSecr=5066"
"3372","5.085412","10.1.0.11","10.1.0.9","TCP","2224","0.001622000","","","49161  >  7016 [ACK] Seq=307001 Ack=1 Win=131072 Len=1000 TSval=5096 TSecr=5066"
"3384","5.086516","10.1.0.11","10.1.0.9","TCP","2224","0.001104000","","","49161  >  7016 [ACK] Seq=309001 Ack=1 Win=131072 Len=1000 TSval=5098 TSecr=5066"
"3396","5.087492","10.1.0.11","10.1.0.9","TCP","1134","0.000976000","","","49161  >  7016 [ACK] Seq=310001 Ack=1 Win=131072 Len=1000 TSval=5099 TSecr=5066"
"3408","5.088405","10.1.0.11","10.1.0.9","TCP","1134","0.000913000","","","49161  >  7016 [ACK] Seq=311001 Ack=1 Win=131072 Len=1000 TSval=5100 TSecr=5066"
"3420","5.089317","10.1.0.11","10.1.0.9","TCP","1134","0.000912000","","","49161  >  7016 [ACK] Seq=312001 Ack=1 Win=131072 Len=1000 TSval=5100 TSecr=5066"
"3436","5.090596","10.1.0.11","10.1.0.9","TCP","2224","0.001279000","","","49161  >  7016 [ACK] Seq=314001 Ack=1 Win=131072 Len=1000 TSval=5102 TSecr=5066"
"3459","5.093888","10.1.0.11","10.1.0.9","TCP","4376","0.003292000","","","49161  >  7016 [ACK] Seq=318001 Ack=1 Win=131072 Len=1000 TSval=5105 TSecr=5066"
"3471","5.095472","10.1.0.11","10.1.0.9","TCP","2224","0.001584000","","","49161  >  7016 [ACK] Seq=320001 Ack=1 Win=131072 Len=1000 TSval=5107 TSecr=5066"
"3483","5.096805","10.1.0.11","10.1.0.9","TCP","2224","0.001333000","","","49161  >  7016 [ACK] Seq=322001 Ack=1 Win=131072 Len=1000 TSval=5108 TSecr=5066"
"3495","5.097846","10.1.0.11","10.1.0.9","TCP","1134","0.001041000","","","49161  >  7016 [ACK] Seq=323001 Ack=1 Win=131072 Len=1000 TSval=5109 TSecr=5066"
"3507","5.098758","10.1.0.11","10.1.0.9","TCP","1134","0.000912000","","","49161  >  7016 [ACK] Seq=324001 Ack=1 Win=131072 Len=1000 TSval=5110 TSecr=5066"
"3519","5.099670","10.1.0.11","10.1.0.9","TCP","1134","0.000912000","","","49161  >  7016 [ACK] Seq=325001 Ack=1 Win=131072 Len=1000 TSval=5111 TSecr=5066"
"3531","5.100582","10.1.0.11","10.1.0.9","TCP","1134","0.000912000","","","49161  >  7016 [ACK] Seq=326001 Ack=1 Win=131072 Len=1000 TSval=5112 TSecr=5066"
"3544","5.101671","10.1.0.11","10.1.0.9","TCP","2224","0.001089000","","","49161  >  7016 [ACK] Seq=328001 Ack=1 Win=131072 Len=1000 TSval=5113 TSecr=5066"
"3555","5.102847","10.1.0.11","10.1.0.9","TCP","2224","0.001176000","","","[TCP Retransmission] [TCP Retransmission] 49161  >  7016 [ACK] Seq=328001 Ack=1 Win=131072 Len=1000 TSval=5113 TSecr=5066"
"3556","5.102847","10.1.0.11","10.1.0.9","TCP","1134","0.000000000","","","49161  >  7016 [ACK] Seq=329001 Ack=1 Win=131072 Len=1000 TSval=5114 TSecr=5066"
"3579","5.106240","10.1.0.11","10.1.0.9","TCP","5452","0.003393000","","","49161  >  7016 [ACK] Seq=334001 Ack=1 Win=131072 Len=1000 TSval=5118 TSecr=5066"
"3594","5.108274","10.1.0.11","10.1.0.9","TCP","1134","0.002034000","","","49161  >  7016 [ACK] Seq=335001 Ack=1 Win=131072 Len=1000 TSval=5119 TSecr=5066"
"4741","5.210168","10.1.0.11","10.1.0.9","TCP","832","0.101894000","","0.263837000,0.263837000,0.263837000,0.263837000,0.263837000,0.263837000,0.263837000,0.263837000,0.263837000,0.263837000","7017  >  49153 [ACK] Seq=1 Ack=45001 Win=131072 Len=0 TSval=4958 TSecr=4935"
"4799","5.226149","10.1.0.9","10.1.0.11","TCP","6376","0.015981000","-38 dBm","","49153  >  7017 [ACK] Seq=49501 Ack=1 Win=131072 Len=1500 TSval=5222 TSecr=4957"
"4800","5.226149","10.1.0.9","10.1.0.11","TCP","6376","0.000000000","-38 dBm","","49153  >  7017 [ACK] Seq=55501 Ack=1 Win=131072 Len=1500 TSval=5222 TSecr=4957"
"4801","5.226149","10.1.0.9","10.1.0.11","TCP","6376","0.000000000","-38 dBm","","49153  >  7017 [ACK] Seq=61501 Ack=1 Win=131072 Len=1500 TSval=5222 TSecr=4957"
"4802","5.226149","10.1.0.9","10.1.0.11","TCP","6376","0.000000000","-38 dBm","","49153  >  7017 [ACK] Seq=67501 Ack=1 Win=131072 Len=1500 TSval=5222 TSecr=4957"
"4803","5.226149","10.1.0.9","10.1.0.11","TCP","6376","0.000000000","-38 dBm","","49153  >  7017 [ACK] Seq=73501 Ack=1 Win=131072 Len=1500 TSval=5222 TSecr=4958"
"4804","5.226149","10.1.0.9","10.1.0.11","TCP","6376","0.000000000","-38 dBm","","49153  >  7017 [ACK] Seq=79501 Ack=1 Win=131072 Len=1500 TSval=5222 TSecr=4958"
"4805","5.226149","10.1.0.9","10.1.0.11","TCP","6376","0.000000000","-38 dBm","","49153  >  7017 [ACK] Seq=85501 Ack=1 Win=131072 Len=1500 TSval=5222 TSecr=4958"
"4806","5.226149","10.1.0.9","10.1.0.11","TCP","6376","0.000000000","-38 dBm","","49153  >  7017 [ACK] Seq=91501 Ack=1 Win=131072 Len=1500 TSval=5222 TSecr=4958"
"4807","5.226149","10.1.0.9","10.1.0.11","TCP","6376","0.000000000","-38 dBm","","49153  >  7017 [ACK] Seq=97501 Ack=1 Win=131072 Len=1500 TSval=5222 TSecr=4958"
"4808","5.226149","10.1.0.9","10.1.0.11","TCP","3224","0.000000000","-38 dBm","","49153  >  7017 [ACK] Seq=100501 Ack=1 Win=131072 Len=1500 TSval=5222 TSecr=4958"
"4933","5.243653","10.1.0.11","10.1.0.9","TCP","1516","0.017504000","","0.017504000,0.017504000,0.017504000,0.017504000,0.017504000,0.017504000,0.017504000,0.017504000,0.017504000,0.017504000,0.017504000,0.017504000,0.017504000,0.017504000,0.017504000,0.017504000,0.017504000,0.017504000,0.017504000","7017  >  49153 [ACK] Seq=1 Ack=102001 Win=131072 Len=0 TSval=5238 TSecr=5222"
"5121","5.284271","10.1.0.9","10.1.0.11","TCP","6376","0.040618000","-38 dBm","","49153  >  7017 [ACK] Seq=106501 Ack=1 Win=131072 Len=1500 TSval=5255 TSecr=5236"
"5122","5.284271","10.1.0.9","10.1.0.11","TCP","6376","0.000000000","-38 dBm","","49153  >  7017 [ACK] Seq=112501 Ack=1 Win=131072 Len=1500 TSval=5255 TSecr=5236"
"5123","5.284271","10.1.0.9","10.1.0.11","TCP","6376","0.000000000","-38 dBm","","49153  >  7017 [ACK] Seq=118501 Ack=1 Win=131072 Len=1500 TSval=5255 TSecr=5236"
"5124","5.284271","10.1.0.9","10.1.0.11","TCP","6376","0.000000000","-38 dBm","","49153  >  7017 [ACK] Seq=124501 Ack=1 Win=131072 Len=1500 TSval=5255 TSecr=5237"
"5125","5.284271","10.1.0.9","10.1.0.11","TCP","6376","0.000000000","-38 dBm","","49153  >  7017 [ACK] Seq=130501 Ack=1 Win=131072 Len=1500 TSval=5255 TSecr=5237"
"5126","5.284271","10.1.0.9","10.1.0.11","TCP","6376","0.000000000","-38 dBm","","49153  >  7017 [ACK] Seq=136501 Ack=1 Win=131072 Len=1500 TSval=5255 TSecr=5237"
"5127","5.284271","10.1.0.9","10.1.0.11","TCP","6376","0.000000000","-38 dBm","","49153  >  7017 [ACK] Seq=142501 Ack=1 Win=131072 Len=1500 TSval=5255 TSecr=5237"
"5128","5.284271","10.1.0.9","10.1.0.11","TCP","6376","0.000000000","-38 dBm","","49153  >  7017 [ACK] Seq=148501 Ack=1 Win=131072 Len=1500 TSval=5255 TSecr=5238"
"5129","5.284271","10.1.0.9","10.1.0.11","TCP","6376","0.000000000","-38 dBm","","49153  >  7017 [ACK] Seq=154501 Ack=1 Win=131072 Len=1500 TSval=5255 TSecr=5238"
"5130","5.284271","10.1.0.9","10.1.0.11","TCP","6376","0.000000000","-38 dBm","","49153  >  7017 [ACK] Seq=160501 Ack=1 Win=131072 Len=1500 TSval=5255 TSecr=5238"
"5367","5.310734","10.1.0.11","10.1.0.9","TCP","1592","0.026463000","","0.026463000,0.026463000,0.026463000,0.026463000,0.026463000,0.026463000,0.026463000,0.026463000,0.026463000,0.026463000,0.026463000,0.026463000,0.026463000,0.026463000,0.026463000,0.026463000,0.026463000,0.026463000,0.026463000,0.026463000","7017  >  49153 [ACK] Seq=1 Ack=162001 Win=131072 Len=0 TSval=5296 TSecr=5255"
"5451","5.331009","10.1.0.9","10.1.0.11","TCP","6376","0.020275000","-38 dBm","","49153  >  7017 [ACK] Seq=166501 Ack=1 Win=131072 Len=1500 TSval=5323 TSecr=5294"
"5452","5.331009","10.1.0.9","10.1.0.11","TCP","6376","0.000000000","-38 dBm","","49153  >  7017 [ACK] Seq=172501 Ack=1 Win=131072 Len=1500 TSval=5323 TSecr=5294"
"5453","5.331009","10.1.0.9","10.1.0.11","TCP","6376","0.000000000","-38 dBm","","49153  >  7017 [ACK] Seq=178501 Ack=1 Win=131072 Len=1500 TSval=5323 TSecr=5295"
"5454","5.331009","10.1.0.9","10.1.0.11","TCP","6376","0.000000000","-38 dBm","","49153  >  7017 [ACK] Seq=184501 Ack=1 Win=131072 Len=1500 TSval=5323 TSecr=5295"
"5455","5.331009","10.1.0.9","10.1.0.11","TCP","6376","0.000000000","-38 dBm","","49153  >  7017 [ACK] Seq=190501 Ack=1 Win=131072 Len=1500 TSval=5323 TSecr=5295"
"5456","5.331009","10.1.0.9","10.1.0.11","TCP","6376","0.000000000","-38 dBm","","49153  >  7017 [ACK] Seq=196501 Ack=1 Win=131072 Len=1500 TSval=5323 TSecr=5295"
