"No.","Time","Source","Destination","Protocol","Length","Time delta from previous displayed frame","Signal strength (dBm)","The RTT to ACK the segment was","Info"
"982","4.787808","10.1.0.11","10.1.0.10","TCP","138","0.000000000","-32 dBm","","49162  >  7018 [SYN] Seq=0 Win=65535 Len=0 TSval=4800 TSecr=0 WS=4 SACK_PERM=1"
"991","4.788439","10.1.0.10","10.1.0.11","TCP","138","0.000631000","","0.000631000","7018  >  49162 [SYN, ACK] Seq=0 Ack=1 Win=65535 Len=0 TSval=4800 TSecr=4800 WS=4 SACK_PERM=1"
"994","4.788654","10.1.0.10","10.1.0.11","TCP","138","0.000215000","","","49153  >  7019 [SYN] Seq=0 Win=65535 Len=0 TSval=4800 TSecr=0 WS=4 SACK_PERM=1"
"997","4.788929","10.1.0.11","10.1.0.10","TCP","138","0.000275000","-32 dBm","0.000275000","7019  >  49153 [SYN, ACK] Seq=0 Ack=1 Win=65535 Len=0 TSval=4801 TSecr=4800 WS=4 SACK_PERM=1"
"1000","4.789084","10.1.0.10","10.1.0.11","TCP","134","0.000155000","","0.000155000","49153  >  7019 [ACK] Seq=1 Ack=1 Win=131072 Len=0 TSval=4801 TSecr=4801"
"1001","4.789382","10.1.0.11","10.1.0.10","TCP","134","0.000298000","-32 dBm","0.000943000","49162  >  7018 [ACK] Seq=1 Ack=1 Win=131072 Len=0 TSval=4801 TSecr=4800"
"1004","4.789546","10.1.0.10","10.1.0.11","TCP","134","0.000164000","","","[TCP Dup ACK 1000#1] 49153  >  7019 [ACK] Seq=1 Ack=1 Win=131072 Len=0 TSval=4801 TSecr=4801"
"1020","4.839713","10.1.0.11","10.1.0.10","TCP","1134","0.050167000","-32 dBm","","49162  >  7018 [ACK] Seq=1 Ack=1 Win=131072 Len=1000 TSval=4851 TSecr=4800"
"1040","4.841393","10.1.0.11","10.1.0.10","TCP","2224","0.001680000","-32 dBm","","49162  >  7018 [ACK] Seq=2001 Ack=1 Win=131072 Len=1000 TSval=4853 TSecr=4800"
"1060","4.843297","10.1.0.11","10.1.0.10","TCP","2224","0.001904000","-32 dBm","","49162  >  7018 [ACK] Seq=4001 Ack=1 Win=131072 Len=1000 TSval=4855 TSecr=4800"
"1087","4.846857","10.1.0.11","10.1.0.10","TCP","5452","0.003560000","-32 dBm","","49162  >  7018 [ACK] Seq=9001 Ack=1 Win=131072 Len=1000 TSval=4859 TSecr=4800"
"1107","4.849274","10.1.0.11","10.1.0.10","TCP","3300","0.002417000","-32 dBm","","49162  >  7018 [ACK] Seq=12001 Ack=1 Win=131072 Len=1000 TSval=4861 TSecr=4800"
"1138","4.853265","10.1.0.10","10.1.0.11","TCP","6528","0.003991000","","","49153  >  7019 [ACK] Seq=5001 Ack=1 Win=131072 Len=1000 TSval=4856 TSecr=4801"
"1139","4.853265","10.1.0.10","10.1.0.11","TCP","6528","0.000000000","","","49153  >  7019 [ACK] Seq=11001 Ack=1 Win=131072 Len=1000 TSval=4861 TSecr=4801"
"1140","4.853265","10.1.0.10","10.1.0.11","TCP","3300","0.000000000","","","49153  >  7019 [ACK] Seq=14001 Ack=1 Win=131072 Len=1000 TSval=4863 TSecr=4801"
"1158","4.857290","10.1.0.10","10.1.0.11","TCP","604","0.004025000","","0.017577000,0.015897000,0.013993000,0.010433000,0.010433000,0.008016000,0.008016000","7018  >  49162 [ACK] Seq=1 Ack=13001 Win=131072 Len=0 TSval=4861 TSecr=4860"
"1188","4.860862","10.1.0.11","10.1.0.10","TCP","2224","0.003572000","-32 dBm","","49162  >  7018 [ACK] Seq=14001 Ack=1 Win=131072 Len=1000 TSval=4863 TSecr=4800"
"1203","4.861892","10.1.0.10","10.1.0.11","TCP","6528","0.001030000","","","[TCP Retransmission] [TCP Retransmission] [TCP Retransmission] [TCP Retransmission] [TCP Retransmission] [TCP Retransmission] 49153  >  7019 [ACK] Seq=5001 Ack=1 Win=131072 Len=1000 TSval=4856 TSecr=4801"
"1204","4.861892","10.1.0.10","10.1.0.11","TCP","6528","0.000000000","","","[TCP Retransmission] [TCP Retransmission] [TCP Retransmission] [TCP Retransmission] [TCP Retransmission] [TCP Retransmission] 49153  >  7019 [ACK] Seq=11001 Ack=1 Win=131072 Len=1000 TSval=4861 TSecr=4801"
"1205","4.861892","10.1.0.10","10.1.0.11","TCP","3300","0.000000000","","","[TCP Retransmission] [TCP Retransmission] [TCP Retransmission] 49153  >  7019 [ACK] Seq=14001 Ack=1 Win=131072 Len=1000 TSval=4863 TSecr=4801"
"1254","4.868307","10.1.0.10","10.1.0.11","TCP","604","0.006415000","","","7018  >  49162 [ACK] Seq=1 Ack=13001 Win=131072 Len=0 TSval=4861 TSecr=4860"
"1255","4.868307","10.1.0.10","10.1.0.11","TCP","134","0.000000000","","0.007445000","7018  >  49162 [ACK] Seq=1 Ack=15001 Win=131072 Len=0 TSval=4873 TSecr=4862"
"1389","4.881697","10.1.0.10","10.1.0.11","TCP","604","0.013390000","","","7018  >  49162 [ACK] Seq=1 Ack=13001 Win=131072 Len=0 TSval=4861 TSecr=4860"
"1390","4.881697","10.1.0.10","10.1.0.11","TCP","134","0.000000000","","","7018  >  49162 [ACK] Seq=1 Ack=15001 Win=131072 Len=0 TSval=4873 TSecr=4862"
"1417","4.886386","10.1.0.11","10.1.0.10","TCP","6376","0.004689000","-32 dBm","","49162  >  7018 [ACK] Seq=19501 Ack=1 Win=131072 Len=1500 TSval=4894 TSecr=4853"
"1418","4.886386","10.1.0.11","10.1.0.10","TCP","6376","0.000000000","-32 dBm","","49162  >  7018 [ACK] Seq=25501 Ack=1 Win=131072 Len=1500 TSval=4894 TSecr=4859"
"1419","4.886386","10.1.0.11","10.1.0.10","TCP","6376","0.000000000","-32 dBm","","49162  >  7018 [ACK] Seq=31501 Ack=1 Win=131072 Len=1500 TSval=4894 TSecr=4859"
"1420","4.886386","10.1.0.11","10.1.0.10","TCP","6376","0.000000000","-32 dBm","","49162  >  7018 [ACK] Seq=37501 Ack=1 Win=131072 Len=1500 TSval=4894 TSecr=4861"
"1421","4.886386","10.1.0.11","10.1.0.10","TCP","6376","0.000000000","-32 dBm","","49162  >  7018 [ACK] Seq=43501 Ack=1 Win=131072 Len=1500 TSval=4894 TSecr=4873"
"1453","4.889622","10.1.0.10","10.1.0.11","TCP","832","0.003236000","","0.003236000,0.003236000,0.003236000,0.003236000,0.003236000,0.003236000,0.003236000,0.003236000,0.003236000,0.003236000","7018  >  49162 [ACK] Seq=1 Ack=45001 Win=131072 Len=0 TSval=4898 TSecr=4894"
"1469","4.891724","10.1.0.11","10.1.0.10","TCP","6376","0.002102000","-32 dBm","","49162  >  7018 [ACK] Seq=49501 Ack=1 Win=131072 Len=1500 TSval=4902 TSecr=4898"
"1470","4.891724","10.1.0.11","10.1.0.10","TCP","6376","0.000000000","-32 dBm","","49162  >  7018 [ACK] Seq=55501 Ack=1 Win=131072 Len=1500 TSval=4902 TSecr=4898"
"1471","4.891724","10.1.0.11","10.1.0.10","TCP","7452","0.000000000","-32 dBm","","49162  >  7018 [ACK] Seq=63001 Ack=1 Win=131072 Len=1000 TSval=4902 TSecr=4898"
"1472","4.891724","10.1.0.11","10.1.0.10","TCP","1134","0.000000000","-32 dBm","","49162  >  7018 [ACK] Seq=64001 Ack=1 Win=131072 Len=1000 TSval=4903 TSecr=4898"
"1487","4.893652","10.1.0.11","10.1.0.10","TCP","3300","0.001928000","-32 dBm","","49162  >  7018 [ACK] Seq=67001 Ack=1 Win=131072 Len=1000 TSval=4905 TSecr=4898"
"1497","4.894572","10.1.0.11","10.1.0.10","TCP","1134","0.000920000","-32 dBm","","49162  >  7018 [ACK] Seq=68001 Ack=1 Win=131072 Len=1000 TSval=4906 TSecr=4898"
"1503","4.895028","10.1.0.11","10.1.0.10","TCP","1134","0.000456000","-32 dBm","","49162  >  7018 [ACK] Seq=69001 Ack=1 Win=131072 Len=1000 TSval=4907 TSecr=4898"
"1516","4.896067","10.1.0.11","10.1.0.10","TCP","1134","0.001039000","-32 dBm","","49162  >  7018 [ACK] Seq=70001 Ack=1 Win=131072 Len=1000 TSval=4907 TSecr=4898"
"1526","4.896860","10.1.0.11","10.1.0.10","TCP","1134","0.000793000","-32 dBm","","49162  >  7018 [ACK] Seq=71001 Ack=1 Win=131072 Len=1000 TSval=4908 TSecr=4898"
"1536","4.897652","10.1.0.11","10.1.0.10","TCP","1134","0.000792000","-32 dBm","","49162  >  7018 [ACK] Seq=72001 Ack=1 Win=131072 Len=1000 TSval=4909 TSecr=4898"
"1546","4.898444","10.1.0.11","10.1.0.10","TCP","1134","0.000792000","-32 dBm","","49162  >  7018 [ACK] Seq=73001 Ack=1 Win=131072 Len=1000 TSval=4910 TSecr=4898"
"1556","4.899204","10.1.0.11","10.1.0.10","TCP","1134","0.000760000","-32 dBm","","49162  >  7018 [ACK] Seq=74001 Ack=1 Win=131072 Len=1000 TSval=4911 TSecr=4898"
"1568","4.900180","10.1.0.11","10.1.0.10","TCP","1134","0.000976000","-32 dBm","","49162  >  7018 [ACK] Seq=75001 Ack=1 Win=131072 Len=1000 TSval=4911 TSecr=4898"
"1576","4.900820","10.1.0.11","10.1.0.10","TCP","1134","0.000640000","-32 dBm","","49162  >  7018 [ACK] Seq=76001 Ack=1 Win=131072 Len=1000 TSval=4912 TSecr=4898"
"1586","4.901684","10.1.0.11","10.1.0.10","TCP","1134","0.000864000","-32 dBm","","49162  >  7018 [ACK] Seq=77001 Ack=1 Win=131072 Len=1000 TSval=4913 TSecr=4898"
"1596","4.902476","10.1.0.11","10.1.0.10","TCP","1134","0.000792000","-32 dBm","","49162  >  7018 [ACK] Seq=78001 Ack=1 Win=131072 Len=1000 TSval=4914 TSecr=4898"
"1606","4.903268","10.1.0.11","10.1.0.10","TCP","1134","0.000792000","-32 dBm","","49162  >  7018 [ACK] Seq=79001 Ack=1 Win=131072 Len=1000 TSval=4915 TSecr=4898"
"1616","4.904061","10.1.0.11","10.1.0.10","TCP","1134","0.000793000","-32 dBm","","49162  >  7018 [ACK] Seq=80001 Ack=1 Win=131072 Len=1000 TSval=4915 TSecr=4898"
"1626","4.904853","10.1.0.11","10.1.0.10","TCP","1134","0.000792000","-32 dBm","","49162  >  7018 [ACK] Seq=81001 Ack=1 Win=131072 Len=1000 TSval=4916 TSecr=4898"
"1636","4.905645","10.1.0.11","10.1.0.10","TCP","1134","0.000792000","-32 dBm","","49162  >  7018 [ACK] Seq=82001 Ack=1 Win=131072 Len=1000 TSval=4917 TSecr=4898"
"1647","4.906518","10.1.0.11","10.1.0.10","TCP","1134","0.000873000","-32 dBm","","49162  >  7018 [ACK] Seq=83001 Ack=1 Win=131072 Len=1000 TSval=4918 TSecr=4898"
"1659","4.907590","10.1.0.11","10.1.0.10","TCP","2224","0.001072000","-32 dBm","","49162  >  7018 [ACK] Seq=85001 Ack=1 Win=131072 Len=1000 TSval=4919 TSecr=4898"
"1671","4.908534","10.1.0.11","10.1.0.10","TCP","1134","0.000944000","-32 dBm","","49162  >  7018 [ACK] Seq=86001 Ack=1 Win=131072 Len=1000 TSval=4920 TSecr=4898"
"1683","4.909446","10.1.0.11","10.1.0.10","TCP","1134","0.000912000","-32 dBm","","49162  >  7018 [ACK] Seq=87001 Ack=1 Win=131072 Len=1000 TSval=4921 TSecr=4898"
"1695","4.910358","10.1.0.11","10.1.0.10","TCP","1134","0.000912000","-32 dBm","","49162  >  7018 [ACK] Seq=88001 Ack=1 Win=131072 Len=1000 TSval=4922 TSecr=4898"
"1707","4.911303","10.1.0.11","10.1.0.10","TCP","1134","0.000945000","-32 dBm","","49162  >  7018 [ACK] Seq=89001 Ack=1 Win=131072 Len=1000 TSval=4923 TSecr=4898"
"1718","4.912424","10.1.0.11","10.1.0.10","TCP","2224","0.001121000","-32 dBm","","49162  >  7018 [ACK] Seq=91001 Ack=1 Win=131072 Len=1000 TSval=4924 TSecr=4898"
"1730","4.913432","10.1.0.11","10.1.0.10","TCP","1134","0.001008000","-32 dBm","","49162  >  7018 [ACK] Seq=92001 Ack=1 Win=131072 Len=1000 TSval=4925 TSecr=4898"
"1742","4.914344","10.1.0.11","10.1.0.10","TCP","1134","0.000912000","-32 dBm","","49162  >  7018 [ACK] Seq=93001 Ack=1 Win=131072 Len=1000 TSval=4926 TSecr=4898"
"1754","4.915288","10.1.0.11","10.1.0.10","TCP","1134","0.000944000","-32 dBm","","49162  >  7018 [ACK] Seq=94001 Ack=1 Win=131072 Len=1000 TSval=4927 TSecr=4898"
"1764","4.916080","10.1.0.11","10.1.0.10","TCP","1134","0.000792000","-32 dBm","","49162  >  7018 [ACK] Seq=95001 Ack=1 Win=131072 Len=1000 TSval=4927 TSecr=4898"
"1774","4.916872","10.1.0.11","10.1.0.10","TCP","1134","0.000792000","-32 dBm","","49162  >  7018 [ACK] Seq=96001 Ack=1 Win=131072 Len=1000 TSval=4928 TSecr=4898"
"1786","4.918151","10.1.0.11","10.1.0.10","TCP","2224","0.001279000","-32 dBm","","49162  >  7018 [ACK] Seq=98001 Ack=1 Win=131072 Len=1000 TSval=4930 TSecr=4898"
"1798","4.919191","10.1.0.11","10.1.0.10","TCP","1134","0.001040000","-32 dBm","","49162  >  7018 [ACK] Seq=99001 Ack=1 Win=131072 Len=1000 TSval=4931 TSecr=4898"
"1808","4.919952","10.1.0.11","10.1.0.10","TCP","1134","0.000761000","-32 dBm","","49162  >  7018 [ACK] Seq=100001 Ack=1 Win=131072 Len=1000 TSval=4931 TSecr=4898"
"1820","4.920896","10.1.0.11","10.1.0.10","TCP","1134","0.000944000","-32 dBm","","49162  >  7018 [ACK] Seq=101001 Ack=1 Win=131072 Len=1000 TSval=4932 TSecr=4898"
"1845","4.922755","10.1.0.10","10.1.0.11","TCP","1972","0.001859000","","0.031031000,0.031031000,0.031031000,0.031031000,0.031031000,0.031031000,0.031031000,0.029103000,0.028183000,0.026688000,0.025103000,0.023551000,0.021935000,0.020279000,0.018694000,0.017110000,0.015165000,0.014221000,0.012397000,0.010331000,0.009323000,0.007467000,0.005883000,0.004604000,0.002803000","7018  >  49162 [ACK] Seq=1 Ack=101001 Win=131072 Len=0 TSval=4932 TSecr=4931"
"1864","4.924254","10.1.0.11","10.1.0.10","TCP","680","0.001499000","-32 dBm","0.070989000,0.070989000,0.070989000,0.070989000,0.070989000,0.070989000,0.070989000,0.070989000","7019  >  49153 [ACK] Seq=1 Ack=15001 Win=131072 Len=0 TSval=4874 TSecr=4862"
"1917","4.933634","10.1.0.10","10.1.0.11","TCP","6376","0.009380000","","","49153  >  7019 [ACK] Seq=19501 Ack=1 Win=131072 Len=1500 TSval=4936 TSecr=4874"
"1918","4.933634","10.1.0.10","10.1.0.11","TCP","6376","0.000000000","","","49153  >  7019 [ACK] Seq=25501 Ack=1 Win=131072 Len=1500 TSval=4936 TSecr=4874"
"1919","4.933634","10.1.0.10","10.1.0.11","TCP","6376","0.000000000","","","49153  >  7019 [ACK] Seq=31501 Ack=1 Win=131072 Len=1500 TSval=4936 TSecr=4874"
"1920","4.933634","10.1.0.10","10.1.0.11","TCP","6376","0.000000000","","","49153  >  7019 [ACK] Seq=37501 Ack=1 Win=131072 Len=1500 TSval=4936 TSecr=4874"
"1921","4.933634","10.1.0.10","10.1.0.11","TCP","6376","0.000000000","","","49153  >  7019 [ACK] Seq=43501 Ack=1 Win=131072 Len=1500 TSval=4936 TSecr=4874"
"2004","4.946716","10.1.0.10","10.1.0.11","TCP","6376","0.013082000","","","[TCP Retransmission] [TCP Retransmission] [TCP Retransmission] [TCP Retransmission] 49153  >  7019 [ACK] Seq=19501 Ack=1 Win=131072 Len=1500 TSval=4936 TSecr=4874"
"2005","4.946716","10.1.0.10","10.1.0.11","TCP","6376","0.000000000","","","[TCP Retransmission] [TCP Retransmission] [TCP Retransmission] [TCP Retransmission] 49153  >  7019 [ACK] Seq=25501 Ack=1 Win=131072 Len=1500 TSval=4936 TSecr=4874"
"2006","4.946716","10.1.0.10","10.1.0.11","TCP","6376","0.000000000","","","[TCP Retransmission] [TCP Retransmission] [TCP Retransmission] [TCP Retransmission] 49153  >  7019 [ACK] Seq=31501 Ack=1 Win=131072 Len=1500 TSval=4936 TSecr=4874"
"2007","4.946716","10.1.0.10","10.1.0.11","TCP","6376","0.000000000","","","[TCP Retransmission] [TCP Retransmission] [TCP Retransmission] [TCP Retransmission] 49153  >  7019 [ACK] Seq=37501 Ack=1 Win=131072 Len=1500 TSval=4936 TSecr=4874"
"2008","4.946716","10.1.0.10","10.1.0.11","TCP","6376","0.000000000","","","[TCP Retransmission] [TCP Retransmission] [TCP Retransmission] [TCP Retransmission] 49153  >  7019 [ACK] Seq=43501 Ack=1 Win=131072 Len=1500 TSval=4936 TSecr=4874"
"2023","4.949607","10.1.0.10","10.1.0.11","TCP","1972","0.002891000","","","7018  >  49162 [ACK] Seq=1 Ack=101001 Win=131072 Len=0 TSval=4932 TSecr=4931"
"2045","4.953901","10.1.0.11","10.1.0.10","TCP","6376","0.004294000","-32 dBm","","49162  >  7018 [ACK] Seq=106501 Ack=1 Win=131072 Len=1500 TSval=4962 TSecr=4903"
"2046","4.953901","10.1.0.11","10.1.0.10","TCP","6376","0.000000000","-32 dBm","","49162  >  7018 [ACK] Seq=112501 Ack=1 Win=131072 Len=1500 TSval=4962 TSecr=4903"
"2047","4.953901","10.1.0.11","10.1.0.10","TCP","6376","0.000000000","-32 dBm","","49162  >  7018 [ACK] Seq=118501 Ack=1 Win=131072 Len=1500 TSval=4962 TSecr=4904"
"2048","4.953901","10.1.0.11","10.1.0.10","TCP","6376","0.000000000","-32 dBm","","49162  >  7018 [ACK] Seq=124501 Ack=1 Win=131072 Len=1500 TSval=4962 TSecr=4907"
"2049","4.953901","10.1.0.11","10.1.0.10","TCP","6376","0.000000000","-32 dBm","","49162  >  7018 [ACK] Seq=130501 Ack=1 Win=131072 Len=1500 TSval=4962 TSecr=4911"
"2050","4.953901","10.1.0.11","10.1.0.10","TCP","7452","0.000000000","-32 dBm","","49162  >  7018 [ACK] Seq=138001 Ack=1 Win=131072 Len=1000 TSval=4962 TSecr=4916"
"2051","4.953901","10.1.0.11","10.1.0.10","TCP","3300","0.000000000","-32 dBm","","49162  >  7018 [ACK] Seq=141001 Ack=1 Win=131072 Len=1000 TSval=4964 TSecr=4932"
"2086","4.960698","10.1.0.11","10.1.0.10","TCP","6528","0.006797000","-32 dBm","","49162  >  7018 [ACK] Seq=147001 Ack=1 Win=131072 Len=1000 TSval=4969 TSecr=4932"
"2087","4.960698","10.1.0.11","10.1.0.10","TCP","4376","0.000000000","-32 dBm","","49162  >  7018 [ACK] Seq=151001 Ack=1 Win=131072 Len=1000 TSval=4972 TSecr=4932"
"2096","4.961652","10.1.0.11","10.1.0.10","TCP","1134","0.000954000","-32 dBm","","49162  >  7018 [ACK] Seq=152001 Ack=1 Win=131072 Len=1000 TSval=4973 TSecr=4932"
"2104","4.962260","10.1.0.11","10.1.0.10","TCP","1134","0.000608000","-32 dBm","","49162  >  7018 [ACK] Seq=153001 Ack=1 Win=131072 Len=1000 TSval=4974 TSecr=4932"
"2112","4.962868","10.1.0.11","10.1.0.10","TCP","1134","0.000608000","-32 dBm","","49162  >  7018 [ACK] Seq=154001 Ack=1 Win=131072 Len=1000 TSval=4975 TSecr=4932"
"2121","4.963571","10.1.0.11","10.1.0.10","TCP","1134","0.000703000","-32 dBm","","49162  >  7018 [ACK] Seq=155001 Ack=1 Win=131072 Len=1000 TSval=4975 TSecr=4932"
"2139","4.964978","10.1.0.11","10.1.0.10","TCP","1134","0.001407000","-32 dBm","","49162  >  7018 [ACK] Seq=156001 Ack=1 Win=131072 Len=1000 TSval=4976 TSecr=4932"
"2166","4.969434","10.1.0.11","10.1.0.10","TCP","2224","0.004456000","-32 dBm","","49162  >  7018 [ACK] Seq=158001 Ack=1 Win=131072 Len=1000 TSval=4978 TSecr=4932"
"2176","4.970421","10.1.0.10","10.1.0.11","TCP","1820","0.000987000","","0.016520000,0.016520000,0.016520000,0.016520000,0.016520000,0.016520000,0.016520000,0.016520000,0.016520000,0.016520000,0.016520000,0.016520000,0.016520000,0.016520000,0.009723000,0.009723000,0.009723000,0.009723000,0.009723000,0.008769000,0.007553000,0.005443000,0.000987000","7018  >  49162 [ACK] Seq=1 Ack=159001 Win=131072 Len=0 TSval=4981 TSecr=4977"
"2346","4.989128","10.1.0.10","10.1.0.11","TCP","1820","0.018707000","","","7018  >  49162 [ACK] Seq=1 Ack=159001 Win=131072 Len=0 TSval=4981 TSecr=4977"
"2355","4.991136","10.1.0.11","10.1.0.10","TCP","6376","0.002008000","-32 dBm","","49162  >  7018 [ACK] Seq=163501 Ack=1 Win=131072 Len=1500 TSval=5001 TSecr=4965"
"2356","4.991136","10.1.0.11","10.1.0.10","TCP","6376","0.000000000","-32 dBm","","49162  >  7018 [ACK] Seq=169501 Ack=1 Win=131072 Len=1500 TSval=5001 TSecr=4965"
"2357","4.991136","10.1.0.11","10.1.0.10","TCP","6376","0.000000000","-32 dBm","","49162  >  7018 [ACK] Seq=175501 Ack=1 Win=131072 Len=1500 TSval=5001 TSecr=4965"
"2358","4.991136","10.1.0.11","10.1.0.10","TCP","6376","0.000000000","-32 dBm","","49162  >  7018 [ACK] Seq=181501 Ack=1 Win=131072 Len=1500 TSval=5001 TSecr=4965"
"2359","4.991136","10.1.0.11","10.1.0.10","TCP","6452","0.000000000","-32 dBm","","49162  >  7018 [ACK] Seq=188001 Ack=1 Win=131072 Len=1000 TSval=5002 TSecr=4981"
"2369","4.992156","10.1.0.11","10.1.0.10","TCP","2224","0.001020000","-32 dBm","","49162  >  7018 [ACK] Seq=190001 Ack=1 Win=131072 Len=1000 TSval=5003 TSecr=4981"
"2375","4.992613","10.1.0.11","10.1.0.10","TCP","1134","0.000457000","-32 dBm","","49162  >  7018 [ACK] Seq=191001 Ack=1 Win=131072 Len=1000 TSval=5004 TSecr=4981"
"2385","4.993373","10.1.0.11","10.1.0.10","TCP","1134","0.000760000","-32 dBm","","49162  >  7018 [ACK] Seq=192001 Ack=1 Win=131072 Len=1000 TSval=5005 TSecr=4981"
"2395","4.994133","10.1.0.11","10.1.0.10","TCP","1134","0.000760000","-32 dBm","","49162  >  7018 [ACK] Seq=193001 Ack=1 Win=131072 Len=1000 TSval=5006 TSecr=4981"
"2405","4.994893","10.1.0.11","10.1.0.10","TCP","1134","0.000760000","-32 dBm","","49162  >  7018 [ACK] Seq=194001 Ack=1 Win=131072 Len=1000 TSval=5007 TSecr=4981"
"2412","4.995496","10.1.0.10","10.1.0.11","TCP","1060","0.000603000","","0.004360000,0.004360000,0.004360000,0.004360000,0.004360000,0.004360000,0.004360000,0.004360000,0.004360000,0.004360000,0.003340000,0.002883000,0.001363000","7018  >  49162 [ACK] Seq=1 Ack=194001 Win=131072 Len=0 TSval=5006 TSecr=5005"
"2424","4.996625","10.1.0.11","10.1.0.10","TCP","2224","0.001129000","-32 dBm","","49162  >  7018 [ACK] Seq=196001 Ack=1 Win=131072 Len=1000 TSval=5008 TSecr=5006"
"2434","4.997385","10.1.0.11","10.1.0.10","TCP","1134","0.000760000","-32 dBm","","49162  >  7018 [ACK] Seq=197001 Ack=1 Win=131072 Len=1000 TSval=5009 TSecr=5006"
"2444","4.998145","10.1.0.11","10.1.0.10","TCP","1134","0.000760000","-32 dBm","","49162  >  7018 [ACK] Seq=198001 Ack=1 Win=131072 Len=1000 TSval=5010 TSecr=5006"
"2454","4.998905","10.1.0.11","10.1.0.10","TCP","1134","0.000760000","-32 dBm","","49162  >  7018 [ACK] Seq=199001 Ack=1 Win=131072 Len=1000 TSval=5011 TSecr=5006"
"2464","4.999666","10.1.0.11","10.1.0.10","TCP","1134","0.000761000","-32 dBm","","49162  >  7018 [ACK] Seq=200001 Ack=1 Win=131072 Len=1000 TSval=5011 TSecr=5006"
"2474","5.000426","10.1.0.11","10.1.0.10","TCP","1134","0.000760000","-32 dBm","","49162  >  7018 [ACK] Seq=201001 Ack=1 Win=131072 Len=1000 TSval=5012 TSecr=5006"
"2502","5.002609","10.1.0.11","10.1.0.10","TCP","1136","0.002183000","-32 dBm","","49162  >  7018 [ACK] Seq=202001 Ack=1 Win=131072 Len=1000 TSval=5013 TSecr=5006"
"2503","5.002609","10.1.0.11","10.1.0.10","TCP","1134","0.000000000","-32 dBm","","49162  >  7018 [ACK] Seq=203001 Ack=1 Win=131072 Len=1000 TSval=5014 TSecr=5006"
"2531","5.007317","10.1.0.11","10.1.0.10","TCP","6528","0.004708000","-32 dBm","","49162  >  7018 [ACK] Seq=209001 Ack=1 Win=131072 Len=1000 TSval=5019 TSecr=5006"
"2537","5.007968","10.1.0.10","10.1.0.11","TCP","680","0.000651000","","0.011343000,0.010583000,0.009063000,0.007542000,0.005359000,0.000651000,0.000651000,0.000651000","7018  >  49162 [ACK] Seq=1 Ack=210001 Win=131072 Len=0 TSval=5019 TSecr=5018"
"2550","5.009922","10.1.0.11","10.1.0.10","TCP","4376","0.001954000","-32 dBm","","49162  >  7018 [ACK] Seq=213001 Ack=1 Win=131072 Len=1000 TSval=5022 TSecr=5019"
"2564","5.011307","10.1.0.11","10.1.0.10","TCP","1134","0.001385000","-32 dBm","","49162  >  7018 [ACK] Seq=214001 Ack=1 Win=131072 Len=1000 TSval=5023 TSecr=5019"
"2574","5.012067","10.1.0.11","10.1.0.10","TCP","1134","0.000760000","-32 dBm","","49162  >  7018 [ACK] Seq=215001 Ack=1 Win=131072 Len=1000 TSval=5023 TSecr=5019"
"2588","5.013291","10.1.0.11","10.1.0.10","TCP","2224","0.001224000","-32 dBm","","49162  >  7018 [ACK] Seq=217001 Ack=1 Win=131072 Len=1000 TSval=5025 TSecr=5019"
"2603","5.014802","10.1.0.11","10.1.0.10","TCP","2224","0.001511000","-32 dBm","","49162  >  7018 [ACK] Seq=219001 Ack=1 Win=131072 Len=1000 TSval=5027 TSecr=5019"
"2615","5.015810","10.1.0.11","10.1.0.10","TCP","1134","0.001008000","-32 dBm","","49162  >  7018 [ACK] Seq=220001 Ack=1 Win=131072 Len=1000 TSval=5027 TSecr=5019"
"2625","5.016570","10.1.0.11","10.1.0.10","TCP","1134","0.000760000","-32 dBm","","49162  >  7018 [ACK] Seq=221001 Ack=1 Win=131072 Len=1000 TSval=5028 TSecr=5019"
"2635","5.017330","10.1.0.11","10.1.0.10","TCP","1134","0.000760000","-32 dBm","","49162  >  7018 [ACK] Seq=222001 Ack=1 Win=131072 Len=1000 TSval=5029 TSecr=5019"
"2645","5.018090","10.1.0.11","10.1.0.10","TCP","1134","0.000760000","-32 dBm","","49162  >  7018 [ACK] Seq=223001 Ack=1 Win=131072 Len=1000 TSval=5030 TSecr=5019"
"2655","5.018851","10.1.0.11","10.1.0.10","TCP","1134","0.000761000","-32 dBm","","49162  >  7018 [ACK] Seq=224001 Ack=1 Win=131072 Len=1000 TSval=5031 TSecr=5019"
"2665","5.020091","10.1.0.10","10.1.0.11","TCP","604","0.001240000","","0.010169000,0.010169000,0.008024000,0.006800000,0.005289000,0.003521000,0.002001000","7018  >  49162 [ACK] Seq=1 Ack=224001 Win=131072 Len=0 TSval=5030 TSecr=5029"
"2676","5.021168","10.1.0.11","10.1.0.10","TCP","3300","0.001077000","-32 dBm","","49162  >  7018 [ACK] Seq=227001 Ack=1 Win=131072 Len=1000 TSval=5033 TSecr=5030"
"2702","5.025568","10.1.0.11","10.1.0.10","TCP","5452","0.004400000","-32 dBm","","49162  >  7018 [ACK] Seq=232001 Ack=1 Win=131072 Len=1000 TSval=5037 TSecr=5030"
"2717","5.027513","10.1.0.11","10.1.0.10","TCP","3300","0.001945000","-32 dBm","","49162  >  7018 [ACK] Seq=235001 Ack=1 Win=131072 Len=1000 TSval=5039 TSecr=5030"
"2733","5.028953","10.1.0.11","10.1.0.10","TCP","1134","0.001440000","-32 dBm","","49162  >  7018 [ACK] Seq=236001 Ack=1 Win=131072 Len=1000 TSval=5040 TSecr=5030"
"2745","5.029994","10.1.0.11","10.1.0.10","TCP","2224","0.001041000","-32 dBm","","49162  >  7018 [ACK] Seq=238001 Ack=1 Win=131072 Len=1000 TSval=5042 TSecr=5030"
"2759","5.031154","10.1.0.11","10.1.0.10","TCP","1134","0.001160000","-32 dBm","","49162  >  7018 [ACK] Seq=239001 Ack=1 Win=131072 Len=1000 TSval=5043 TSecr=5030"
"2778","5.032763","10.1.0.11","10.1.0.10","TCP","2224","0.001609000","-32 dBm","","49162  >  7018 [ACK] Seq=241001 Ack=1 Win=131072 Len=1000 TSval=5044 TSecr=5030"
"2797","5.035087","10.1.0.11","10.1.0.10","TCP","3300","0.002324000","-32 dBm","","49162  >  7018 [ACK] Seq=244001 Ack=1 Win=131072 Len=1000 TSval=5047 TSecr=5030"
"2811","5.036439","10.1.0.11","10.1.0.10","TCP","2224","0.001352000","-32 dBm","","49162  >  7018 [ACK] Seq=246001 Ack=1 Win=131072 Len=1000 TSval=5048 TSecr=5030"
"2833","5.038362","10.1.0.11","10.1.0.10","TCP","2224","0.001923000","-32 dBm","","49162  >  7018 [ACK] Seq=248001 Ack=1 Win=131072 Len=1000 TSval=5050 TSecr=5030"
"2847","5.039650","10.1.0.11","10.1.0.10","TCP","2224","0.001288000","-32 dBm","","49162  >  7018 [ACK] Seq=250001 Ack=1 Win=131072 Len=1000 TSval=5051 TSecr=5030"
"2861","5.040810","10.1.0.11","10.1.0.10","TCP","1134","0.001160000","-32 dBm","","49162  >  7018 [ACK] Seq=251001 Ack=1 Win=131072 Len=1000 TSval=5052 TSecr=5030"
"2875","5.042002","10.1.0.11","10.1.0.10","TCP","2224","0.001192000","-32 dBm","","49162  >  7018 [ACK] Seq=253001 Ack=1 Win=131072 Len=1000 TSval=5054 TSecr=5030"
"2890","5.043216","10.1.0.11","10.1.0.10","TCP","1134","0.001214000","-32 dBm","","49162  >  7018 [ACK] Seq=254001 Ack=1 Win=131072 Len=1000 TSval=5055 TSecr=5030"
"2902","5.044128","10.1.0.11","10.1.0.10","TCP","1134","0.000912000","-32 dBm","","49162  >  7018 [ACK] Seq=255001 Ack=1 Win=131072 Len=1000 TSval=5055 TSecr=5030"
"2914","5.045168","10.1.0.11","10.1.0.10","TCP","2224","0.001040000","-32 dBm","","49162  >  7018 [ACK] Seq=257001 Ack=1 Win=131072 Len=1000 TSval=5057 TSecr=5030"
"2928","5.046265","10.1.0.11","10.1.0.10","TCP","1134","0.001097000","-32 dBm","","49162  >  7018 [ACK] Seq=258001 Ack=1 Win=131072 Len=1000 TSval=5058 TSecr=5030"
"2940","5.047177","10.1.0.11","10.1.0.10","TCP","1134","0.000912000","-32 dBm","","49162  >  7018 [ACK] Seq=259001 Ack=1 Win=131072 Len=1000 TSval=5059 TSecr=5030"
"2952","5.048089","10.1.0.11","10.1.0.10","TCP","1134","0.000912000","-32 dBm","","49162  >  7018 [ACK] Seq=260001 Ack=1 Win=131072 Len=1000 TSval=5059 TSecr=5030"
"2966","5.049542","10.1.0.11","10.1.0.10","TCP","2224","0.001453000","-32 dBm","","49162  >  7018 [ACK] Seq=262001 Ack=1 Win=131072 Len=1000 TSval=5061 TSecr=5030"
"2987","5.052794","10.1.0.11","10.1.0.10","TCP","4376","0.003252000","-32 dBm","","49162  >  7018 [ACK] Seq=266001 Ack=1 Win=131072 Len=1000 TSval=5064 TSecr=5030"
"2995","5.053594","10.1.0.11","10.1.0.10","TCP","1134","0.000800000","-32 dBm","","49162  >  7018 [ACK] Seq=267001 Ack=1 Win=131072 Len=1000 TSval=5065 TSecr=5030"
"3003","5.054202","10.1.0.11","10.1.0.10","TCP","1134","0.000608000","-32 dBm","","49162  >  7018 [ACK] Seq=268001 Ack=1 Win=131072 Len=1000 TSval=5066 TSecr=5030"
"3008","5.054644","10.1.0.10","10.1.0.11","TCP","1744","0.000442000","","0.033476000,0.033476000,0.029076000,0.029076000,0.027131000,0.027131000,0.024650000,0.023490000,0.021881000,0.019557000,0.018205000,0.016282000,0.014994000,0.013834000,0.012642000,0.010516000,0.009476000,0.007467000,0.005102000,0.001850000,0.001850000,0.001050000","7018  >  49162 [ACK] Seq=1 Ack=268001 Win=131072 Len=0 TSval=5066 TSecr=5064"
"3019","5.055634","10.1.0.11","10.1.0.10","TCP","2224","0.000990000","-32 dBm","","49162  >  7018 [ACK] Seq=270001 Ack=1 Win=131072 Len=1000 TSval=5067 TSecr=5066"
"3031","5.056591","10.1.0.11","10.1.0.10","TCP","1134","0.000957000","-32 dBm","","49162  >  7018 [ACK] Seq=271001 Ack=1 Win=131072 Len=1000 TSval=5068 TSecr=5066"
"3045","5.058508","10.1.0.11","10.1.0.10","TCP","2224","0.001917000","-32 dBm","","49162  >  7018 [ACK] Seq=273001 Ack=1 Win=131072 Len=1000 TSval=5070 TSecr=5066"
"3051","5.058964","10.1.0.11","10.1.0.10","TCP","1134","0.000456000","-32 dBm","","49162  >  7018 [ACK] Seq=274001 Ack=1 Win=131072 Len=1000 TSval=5071 TSecr=5066"
"3059","5.059572","10.1.0.11","10.1.0.10","TCP","1134","0.000608000","-32 dBm","","49162  >  7018 [ACK] Seq=275001 Ack=1 Win=131072 Len=1000 TSval=5071 TSecr=5066"
"3077","5.061066","10.1.0.10","10.1.0.11","TCP","376","0.001494000","","0.005432000,0.004475000,0.002558000,0.001494000","7018  >  49162 [ACK] Seq=1 Ack=276001 Win=131072 Len=0 TSval=5072 TSecr=5071"
"3095","5.062533","10.1.0.11","10.1.0.10","TCP","3300","0.001467000","-32 dBm","","49162  >  7018 [ACK] Seq=278001 Ack=1 Win=131072 Len=1000 TSval=5074 TSecr=5072"
"3117","5.066185","10.1.0.11","10.1.0.10","TCP","5452","0.003652000","-32 dBm","","49162  >  7018 [ACK] Seq=283001 Ack=1 Win=131072 Len=1000 TSval=5078 TSecr=5072"
"3129","5.067497","10.1.0.10","10.1.0.11","TCP","376","0.001312000","","0.004964000,0.001312000,0.001312000,0.001312000","7018  >  49162 [ACK] Seq=1 Ack=284001 Win=131072 Len=0 TSval=5078 TSecr=5077"
"3134","5.068011","10.1.0.11","10.1.0.10","TCP","2224","0.000514000","-32 dBm","","49162  >  7018 [ACK] Seq=285001 Ack=1 Win=131072 Len=1000 TSval=5079 TSecr=5072"
"3146","5.069084","10.1.0.11","10.1.0.10","TCP","2224","0.001073000","-32 dBm","","49162  >  7018 [ACK] Seq=287001 Ack=1 Win=131072 Len=1000 TSval=5081 TSecr=5078"
"3160","5.070244","10.1.0.11","10.1.0.10","TCP","1134","0.001160000","-32 dBm","","49162  >  7018 [ACK] Seq=288001 Ack=1 Win=131072 Len=1000 TSval=5082 TSecr=5078"
"3172","5.071156","10.1.0.11","10.1.0.10","TCP","1134","0.000912000","-32 dBm","","49162  >  7018 [ACK] Seq=289001 Ack=1 Win=131072 Len=1000 TSval=5083 TSecr=5078"
"3184","5.072068","10.1.0.11","10.1.0.10","TCP","1134","0.000912000","-32 dBm","","49162  >  7018 [ACK] Seq=290001 Ack=1 Win=131072 Len=1000 TSval=5083 TSecr=5078"
"3196","5.073044","10.1.0.11","10.1.0.10","TCP","2224","0.000976000","-32 dBm","","49162  >  7018 [ACK] Seq=292001 Ack=1 Win=131072 Len=1000 TSval=5085 TSecr=5078"
"3210","5.074285","10.1.0.11","10.1.0.10","TCP","1134","0.001241000","-32 dBm","","49162  >  7018 [ACK] Seq=293001 Ack=1 Win=131072 Len=1000 TSval=5086 TSecr=5078"
"3222","5.075198","10.1.0.11","10.1.0.10","TCP","1134","0.000913000","-32 dBm","","49162  >  7018 [ACK] Seq=294001 Ack=1 Win=131072 Len=1000 TSval=5087 TSecr=5078"
"3234","5.076110","10.1.0.11","10.1.0.10","TCP","1134","0.000912000","-32 dBm","","49162  >  7018 [ACK] Seq=295001 Ack=1 Win=131072 Len=1000 TSval=5087 TSecr=5078"
"3246","5.077150","10.1.0.11","10.1.0.10","TCP","2224","0.001040000","-32 dBm","","49162  >  7018 [ACK] Seq=297001 Ack=1 Win=131072 Len=1000 TSval=5089 TSecr=5078"
"3260","5.078246","10.1.0.11","10.1.0.10","TCP","1134","0.001096000","-32 dBm","","49162  >  7018 [ACK] Seq=298001 Ack=1 Win=131072 Len=1000 TSval=5090 TSecr=5078"
"3272","5.079185","10.1.0.11","10.1.0.10","TCP","1134","0.000939000","-32 dBm","","49162  >  7018 [ACK] Seq=299001 Ack=1 Win=131072 Len=1000 TSval=5091 TSecr=5078"
"3284","5.080097","10.1.0.11","10.1.0.10","TCP","1134","0.000912000","-32 dBm","","49162  >  7018 [ACK] Seq=300001 Ack=1 Win=131072 Len=1000 TSval=5091 TSecr=5078"
"3296","5.081106","10.1.0.11","10.1.0.10","TCP","2224","0.001009000","-32 dBm","","49162  >  7018 [ACK] Seq=302001 Ack=1 Win=131072 Len=1000 TSval=5093 TSecr=5078"
"3312","5.082354","10.1.0.11","10.1.0.10","TCP","1134","0.001248000","-32 dBm","","49162  >  7018 [ACK] Seq=303001 Ack=1 Win=131072 Len=1000 TSval=5094 TSecr=5078"
"3324","5.083266","10.1.0.11","10.1.0.10","TCP","1134","0.000912000","-32 dBm","","49162  >  7018 [ACK] Seq=304001 Ack=1 Win=131072 Len=1000 TSval=5095 TSecr=5078"
"3338","5.084326","10.1.0.10","10.1.0.11","TCP","832","0.001060000","","0.016315000,0.015242000,0.013170000,0.011282000,0.010041000,0.008216000,0.007176000,0.005141000,0.003220000,0.001972000","7018  >  49162 [ACK] Seq=1 Ack=304001 Win=131072 Len=0 TSval=5094 TSecr=5093"
"3343","5.084856","10.1.0.11","10.1.0.10","TCP","2224","0.000530000","-32 dBm","","49162  >  7018 [ACK] Seq=306001 Ack=1 Win=131072 Len=1000 TSval=5096 TSecr=5078"
"3355","5.085960","10.1.0.11","10.1.0.10","TCP","2224","0.001104000","-32 dBm","","49162  >  7018 [ACK] Seq=308001 Ack=1 Win=131072 Len=1000 TSval=5098 TSecr=5094"
"3367","5.086968","10.1.0.11","10.1.0.10","TCP","1134","0.001008000","-32 dBm","","49162  >  7018 [ACK] Seq=309001 Ack=1 Win=131072 Len=1000 TSval=5099 TSecr=5094"
"3379","5.087881","10.1.0.11","10.1.0.10","TCP","1134","0.000913000","-32 dBm","","49162  >  7018 [ACK] Seq=310001 Ack=1 Win=131072 Len=1000 TSval=5099 TSecr=5094"
"3391","5.088793","10.1.0.11","10.1.0.10","TCP","1134","0.000912000","-32 dBm","","49162  >  7018 [ACK] Seq=311001 Ack=1 Win=131072 Len=1000 TSval=5100 TSecr=5094"
"3403","5.089705","10.1.0.11","10.1.0.10","TCP","1134","0.000912000","-32 dBm","","49162  >  7018 [ACK] Seq=312001 Ack=1 Win=131072 Len=1000 TSval=5101 TSecr=5094"
"3419","5.091144","10.1.0.11","10.1.0.10","TCP","2224","0.001439000","-32 dBm","","49162  >  7018 [ACK] Seq=314001 Ack=1 Win=131072 Len=1000 TSval=5103 TSecr=5094"
"3442","5.094804","10.1.0.11","10.1.0.10","TCP","5452","0.003660000","-32 dBm","","49162  >  7018 [ACK] Seq=319001 Ack=1 Win=131072 Len=1000 TSval=5107 TSecr=5094"
"3452","5.095767","10.1.0.10","10.1.0.11","TCP","680","0.000963000","","0.010911000,0.009807000,0.008799000,0.006974000,0.004623000,0.000963000,0.000963000,0.000963000","7018  >  49162 [ACK] Seq=1 Ack=320001 Win=131072 Len=0 TSval=5107 TSecr=5106"
"3455","5.096249","10.1.0.11","10.1.0.10","TCP","2224","0.000482000","-32 dBm","","49162  >  7018 [ACK] Seq=321001 Ack=1 Win=131072 Len=1000 TSval=5108 TSecr=5094"
"3467","5.097322","10.1.0.11","10.1.0.10","TCP","1134","0.001073000","-32 dBm","","49162  >  7018 [ACK] Seq=322001 Ack=1 Win=131072 Len=1000 TSval=5109 TSecr=5094"
"3479","5.098234","10.1.0.11","10.1.0.10","TCP","1134","0.000912000","-32 dBm","","49162  >  7018 [ACK] Seq=323001 Ack=1 Win=131072 Len=1000 TSval=5110 TSecr=5094"
"3491","5.099146","10.1.0.11","10.1.0.10","TCP","1134","0.000912000","-32 dBm","","49162  >  7018 [ACK] Seq=324001 Ack=1 Win=131072 Len=1000 TSval=5111 TSecr=5094"
"3503","5.100058","10.1.0.11","10.1.0.10","TCP","1134","0.000912000","-32 dBm","","49162  >  7018 [ACK] Seq=325001 Ack=1 Win=131072 Len=1000 TSval=5111 TSecr=5094"
"3515","5.101034","10.1.0.11","10.1.0.10","TCP","2224","0.000976000","-32 dBm","","49162  >  7018 [ACK] Seq=327001 Ack=1 Win=131072 Len=1000 TSval=5113 TSecr=5094"
"3541","5.103775","10.1.0.11","10.1.0.10","TCP","3300","0.002741000","-32 dBm","","49162  >  7018 [ACK] Seq=330001 Ack=1 Win=131072 Len=1000 TSval=5115 TSecr=5094"
"3564","5.107596","10.1.0.11","10.1.0.10","TCP","5452","0.003821000","-32 dBm","","49162  >  7018 [ACK] Seq=335001 Ack=1 Win=131072 Len=1000 TSval=5119 TSecr=5094"
"3579","5.108878","10.1.0.11","10.1.0.10","TCP","1134","0.001282000","-32 dBm","","49162  >  7018 [ACK] Seq=336001 Ack=1 Win=131072 Len=1000 TSval=5120 TSecr=5094"
"3587","5.109486","10.1.0.11","10.1.0.10","TCP","1134","0.000608000","-32 dBm","","49162  >  7018 [ACK] Seq=337001 Ack=1 Win=131072 Len=1000 TSval=5121 TSecr=5094"
"3597","5.110246","10.1.0.11","10.1.0.10","TCP","1134","0.000760000","-32 dBm","","49162  >  7018 [ACK] Seq=338001 Ack=1 Win=131072 Len=1000 TSval=5122 TSecr=5094"
"3607","5.111006","10.1.0.11","10.1.0.10","TCP","1134","0.000760000","-32 dBm","","49162  >  7018 [ACK] Seq=339001 Ack=1 Win=131072 Len=1000 TSval=5123 TSecr=5094"
"3617","5.111766","10.1.0.11","10.1.0.10","TCP","1134","0.000760000","-32 dBm","","49162  >  7018 [ACK] Seq=340001 Ack=1 Win=131072 Len=1000 TSval=5123 TSecr=5094"
"3627","5.112526","10.1.0.11","10.1.0.10","TCP","1134","0.000760000","-32 dBm","","49162  >  7018 [ACK] Seq=341001 Ack=1 Win=131072 Len=1000 TSval=5124 TSecr=5094"
"3637","5.113287","10.1.0.11","10.1.0.10","TCP","1134","0.000761000","-32 dBm","","49162  >  7018 [ACK] Seq=342001 Ack=1 Win=131072 Len=1000 TSval=5125 TSecr=5094"
"3648","5.114503","10.1.0.11","10.1.0.10","TCP","1134","0.001216000","-32 dBm","","49162  >  7018 [ACK] Seq=343001 Ack=1 Win=131072 Len=1000 TSval=5126 TSecr=5094"
"3658","5.115263","10.1.0.11","10.1.0.10","TCP","1134","0.000760000","-32 dBm","","49162  >  7018 [ACK] Seq=344001 Ack=1 Win=131072 Len=1000 TSval=5127 TSecr=5094"
"3668","5.116023","10.1.0.11","10.1.0.10","TCP","1134","0.000760000","-32 dBm","","49162  >  7018 [ACK] Seq=345001 Ack=1 Win=131072 Len=1000 TSval=5127 TSecr=5094"
"3678","5.116783","10.1.0.11","10.1.0.10","TCP","1134","0.000760000","-32 dBm","","49162  >  7018 [ACK] Seq=346001 Ack=1 Win=131072 Len=1000 TSval=5128 TSecr=5094"
"3688","5.117543","10.1.0.11","10.1.0.10","TCP","1134","0.000760000","-32 dBm","","49162  >  7018 [ACK] Seq=347001 Ack=1 Win=131072 Len=1000 TSval=5129 TSecr=5094"
"3698","5.118303","10.1.0.11","10.1.0.10","TCP","1134","0.000760000","-32 dBm","","49162  >  7018 [ACK] Seq=348001 Ack=1 Win=131072 Len=1000 TSval=5130 TSecr=5094"
"3706","5.118912","10.1.0.11","10.1.0.10","TCP","1134","0.000609000","-32 dBm","","49162  >  7018 [ACK] Seq=349001 Ack=1 Win=131072 Len=1000 TSval=5131 TSecr=5094"
"3714","5.119459","10.1.0.10","10.1.0.11","TCP","680","0.000547000","","","7018  >  49162 [ACK] Seq=1 Ack=320001 Win=131072 Len=0 TSval=5107 TSecr=5106"
"3715","5.119459","10.1.0.10","10.1.0.11","TCP","1212","0.000000000","","0.023210000,0.021225000,0.019401000,0.018425000,0.015684000,0.011863000,0.011863000,0.011863000,0.009973000,0.008453000,0.006933000,0.004956000,0.003436000,0.001916000,0.000547000","7018  >  49162 [ACK] Seq=1 Ack=350001 Win=131072 Len=0 TSval=5131 TSecr=5130"
"3723","5.120555","10.1.0.11","10.1.0.10","TCP","2224","0.001096000","-32 dBm","","49162  >  7018 [ACK] Seq=351001 Ack=1 Win=131072 Len=1000 TSval=5132 TSecr=5131"
"3731","5.121195","10.1.0.11","10.1.0.10","TCP","1134","0.000640000","-32 dBm","","49162  >  7018 [ACK] Seq=352001 Ack=1 Win=131072 Len=1000 TSval=5133 TSecr=5131"
"3744","5.122222","10.1.0.11","10.1.0.10","TCP","1134","0.001027000","-32 dBm","","49162  >  7018 [ACK] Seq=353001 Ack=1 Win=131072 Len=1000 TSval=5134 TSecr=5131"
"3752","5.122830","10.1.0.11","10.1.0.10","TCP","1134","0.000608000","-32 dBm","","49162  >  7018 [ACK] Seq=354001 Ack=1 Win=131072 Len=1000 TSval=5135 TSecr=5131"
"3757","5.123146","10.1.0.10","10.1.0.11","TCP","224","0.000316000","","0.002591000,0.000924000","7018  >  49162 [ACK] Seq=1 Ack=354001 Win=131072 Len=0 TSval=5134 TSecr=5133"
"3764","5.123748","10.1.0.11","10.1.0.10","TCP","1134","0.000602000","-32 dBm","","49162  >  7018 [ACK] Seq=355001 Ack=1 Win=131072 Len=1000 TSval=5135 TSecr=5134"
"3776","5.124705","10.1.0.11","10.1.0.10","TCP","1134","0.000957000","-32 dBm","","49162  >  7018 [ACK] Seq=356001 Ack=1 Win=131072 Len=1000 TSval=5136 TSecr=5134"
"3795","5.127886","10.1.0.11","10.1.0.10","TCP","4376","0.003181000","-32 dBm","","49162  >  7018 [ACK] Seq=360001 Ack=1 Win=131072 Len=1000 TSval=5139 TSecr=5134"
"3803","5.128494","10.1.0.11","10.1.0.10","TCP","1134","0.000608000","-32 dBm","","49162  >  7018 [ACK] Seq=361001 Ack=1 Win=131072 Len=1000 TSval=5140 TSecr=5134"
"3818","5.129783","10.1.0.10","10.1.0.11","TCP","376","0.001289000","","0.006035000,0.001897000,0.001897000,0.001289000","7018  >  49162 [ACK] Seq=1 Ack=362001 Win=131072 Len=0 TSval=5141 TSecr=5139"
"3832","5.131258","10.1.0.11","10.1.0.10","TCP","3300","0.001475000","-32 dBm","","49162  >  7018 [ACK] Seq=364001 Ack=1 Win=131072 Len=1000 TSval=5143 TSecr=5141"
"3860","5.136256","10.1.0.11","10.1.0.10","TCP","6528","0.004998000","-32 dBm","","49162  >  7018 [ACK] Seq=370001 Ack=1 Win=131072 Len=1000 TSval=5147 TSecr=5141"
"3875","5.138076","10.1.0.11","10.1.0.10","TCP","3300","0.001820000","-32 dBm","","49162  >  7018 [ACK] Seq=373001 Ack=1 Win=131072 Len=1000 TSval=5150 TSecr=5141"
"3887","5.139148","10.1.0.11","10.1.0.10","TCP","1134","0.001072000","-32 dBm","","49162  >  7018 [ACK] Seq=374001 Ack=1 Win=131072 Len=1000 TSval=5151 TSecr=5141"
"3899","5.140061","10.1.0.11","10.1.0.10","TCP","1134","0.000913000","-32 dBm","","49162  >  7018 [ACK] Seq=375001 Ack=1 Win=131072 Len=1000 TSval=5151 TSecr=5141"
"3911","5.140973","10.1.0.11","10.1.0.10","TCP","1134","0.000912000","-32 dBm","","49162  >  7018 [ACK] Seq=376001 Ack=1 Win=131072 Len=1000 TSval=5152 TSecr=5141"
"3921","5.142244","10.1.0.10","10.1.0.11","TCP","604","0.001271000","","0.010986000,0.005988000,0.005988000,0.005988000,0.004168000,0.004168000,0.002183000","7018  >  49162 [ACK] Seq=1 Ack=376001 Win=131072 Len=0 TSval=5152 TSecr=5151"
