"No.","Time","Source","Destination","Protocol","Length","Time delta from previous displayed frame","Signal strength (dBm)","The RTT to ACK the segment was","Info"
"480","2.387797","10.1.0.11","10.1.0.5","TCP","138","0.000000000","-36 dBm","","49157  >  7008 [SYN] Seq=0 Win=65535 Len=0 TSval=2400 TSecr=0 WS=4 SACK_PERM=1"
"489","2.388464","10.1.0.5","10.1.0.11","TCP","138","0.000667000","","","49153  >  7009 [SYN] Seq=0 Win=65535 Len=0 TSval=2400 TSecr=0 WS=4 SACK_PERM=1"
"492","2.388739","10.1.0.11","10.1.0.5","TCP","138","0.000275000","-36 dBm","0.000275000","7009  >  49153 [SYN, ACK] Seq=0 Ack=1 Win=65535 Len=0 TSval=2401 TSecr=2400 WS=4 SACK_PERM=1"
"495","2.388885","10.1.0.5","10.1.0.11","TCP","134","0.000146000","","0.000146000","49153  >  7009 [ACK] Seq=1 Ack=1 Win=131072 Len=0 TSval=2401 TSecr=2401"
"498","2.389127","10.1.0.5","10.1.0.11","TCP","138","0.000242000","","0.001330000","7008  >  49157 [SYN, ACK] Seq=0 Ack=1 Win=65535 Len=0 TSval=2400 TSecr=2400 WS=4 SACK_PERM=1"
"501","2.389393","10.1.0.11","10.1.0.5","TCP","134","0.000266000","-36 dBm","0.000266000","49157  >  7008 [ACK] Seq=1 Ack=1 Win=131072 Len=0 TSval=2401 TSecr=2400"
"1035","4.841025","10.1.0.11","10.1.0.5","TCP","2224","2.451632000","-36 dBm","","49157  >  7008 [ACK] Seq=1001 Ack=1 Win=131072 Len=1000 TSval=4853 TSecr=2400"
"1055","4.842929","10.1.0.11","10.1.0.5","TCP","2224","0.001904000","-36 dBm","","49157  >  7008 [ACK] Seq=3001 Ack=1 Win=131072 Len=1000 TSval=4854 TSecr=2400"
"1082","4.846313","10.1.0.11","10.1.0.5","TCP","4376","0.003384000","-36 dBm","","49157  >  7008 [ACK] Seq=7001 Ack=1 Win=131072 Len=1000 TSval=4858 TSecr=2400"
"1102","4.848810","10.1.0.11","10.1.0.5","TCP","3300","0.002497000","-36 dBm","","49157  >  7008 [ACK] Seq=10001 Ack=1 Win=131072 Len=1000 TSval=4860 TSecr=2400"
"1132","4.851905","10.1.0.5","10.1.0.11","TCP","6528","0.003095000","","","49153  >  7009 [ACK] Seq=5001 Ack=1 Win=131072 Len=1000 TSval=4856 TSecr=2401"
"1133","4.851905","10.1.0.5","10.1.0.11","TCP","6528","0.000000000","","","49153  >  7009 [ACK] Seq=11001 Ack=1 Win=131072 Len=1000 TSval=4860 TSecr=2401"
"1134","4.851905","10.1.0.5","10.1.0.11","TCP","3300","0.000000000","","","49153  >  7009 [ACK] Seq=14001 Ack=1 Win=131072 Len=1000 TSval=4863 TSecr=2401"
"1153","4.857290","10.1.0.5","10.1.0.11","TCP","528","0.005385000","","0.016265000,0.014361000,0.010977000,0.010977000,0.008480000,0.008480000","7008  >  49157 [ACK] Seq=1 Ack=11001 Win=131072 Len=0 TSval=4861 TSecr=4859"
"1179","4.860462","10.1.0.11","10.1.0.5","TCP","4376","0.003172000","-36 dBm","","49157  >  7008 [ACK] Seq=14001 Ack=1 Win=131072 Len=1000 TSval=4863 TSecr=2400"
"1249","4.868444","10.1.0.5","10.1.0.11","TCP","528","0.007982000","","","7008  >  49157 [ACK] Seq=1 Ack=11001 Win=131072 Len=0 TSval=4861 TSecr=4859"
"1250","4.868444","10.1.0.5","10.1.0.11","TCP","224","0.000000000","","0.007982000,0.007982000","7008  >  49157 [ACK] Seq=1 Ack=15001 Win=131072 Len=0 TSval=4872 TSecr=4862"
"1373","4.880840","10.1.0.5","10.1.0.11","TCP","528","0.012396000","","","7008  >  49157 [ACK] Seq=1 Ack=11001 Win=131072 Len=0 TSval=4861 TSecr=4859"
"1374","4.880840","10.1.0.5","10.1.0.11","TCP","224","0.000000000","","","7008  >  49157 [ACK] Seq=1 Ack=15001 Win=131072 Len=0 TSval=4872 TSecr=4862"
"1407","4.885238","10.1.0.11","10.1.0.5","TCP","6376","0.004398000","-36 dBm","","49157  >  7008 [ACK] Seq=19501 Ack=1 Win=131072 Len=1500 TSval=4893 TSecr=4855"
"1408","4.885238","10.1.0.11","10.1.0.5","TCP","6376","0.000000000","-36 dBm","","49157  >  7008 [ACK] Seq=25501 Ack=1 Win=131072 Len=1500 TSval=4893 TSecr=4858"
"1409","4.885238","10.1.0.11","10.1.0.5","TCP","6376","0.000000000","-36 dBm","","49157  >  7008 [ACK] Seq=31501 Ack=1 Win=131072 Len=1500 TSval=4893 TSecr=4861"
"1410","4.885238","10.1.0.11","10.1.0.5","TCP","6376","0.000000000","-36 dBm","","49157  >  7008 [ACK] Seq=37501 Ack=1 Win=131072 Len=1500 TSval=4893 TSecr=4872"
"1411","4.885238","10.1.0.11","10.1.0.5","TCP","6376","0.000000000","-36 dBm","","49157  >  7008 [ACK] Seq=43501 Ack=1 Win=131072 Len=1500 TSval=4893 TSecr=4872"
"1449","4.889427","10.1.0.5","10.1.0.11","TCP","832","0.004189000","","0.004189000,0.004189000,0.004189000,0.004189000,0.004189000,0.004189000,0.004189000,0.004189000,0.004189000,0.004189000","7008  >  49157 [ACK] Seq=1 Ack=45001 Win=131072 Len=0 TSval=4897 TSecr=4893"
"1848","4.923438","10.1.0.11","10.1.0.5","TCP","680","0.034011000","-36 dBm","0.071533000,0.071533000,0.071533000,0.071533000,0.071533000,0.071533000,0.071533000,0.071533000","7009  >  49153 [ACK] Seq=1 Ack=15001 Win=131072 Len=0 TSval=4865 TSecr=4862"
"1875","4.927232","10.1.0.5","10.1.0.11","TCP","6376","0.003794000","","","49153  >  7009 [ACK] Seq=19501 Ack=1 Win=131072 Len=1500 TSval=4935 TSecr=4864"
"1876","4.927232","10.1.0.5","10.1.0.11","TCP","6376","0.000000000","","","49153  >  7009 [ACK] Seq=25501 Ack=1 Win=131072 Len=1500 TSval=4935 TSecr=4864"
"1877","4.927232","10.1.0.5","10.1.0.11","TCP","6376","0.000000000","","","49153  >  7009 [ACK] Seq=31501 Ack=1 Win=131072 Len=1500 TSval=4935 TSecr=4864"
"1878","4.927232","10.1.0.5","10.1.0.11","TCP","6376","0.000000000","","","49153  >  7009 [ACK] Seq=37501 Ack=1 Win=131072 Len=1500 TSval=4935 TSecr=4865"
"1879","4.927232","10.1.0.5","10.1.0.11","TCP","6376","0.000000000","","","49153  >  7009 [ACK] Seq=43501 Ack=1 Win=131072 Len=1500 TSval=4935 TSecr=4865"
"1918","4.934761","10.1.0.5","10.1.0.11","TCP","832","0.007529000","","","7008  >  49157 [ACK] Seq=1 Ack=45001 Win=131072 Len=0 TSval=4897 TSecr=4893"
"1946","4.938768","10.1.0.5","10.1.0.11","TCP","6376","0.004007000","","","[TCP Retransmission] [TCP Retransmission] [TCP Retransmission] [TCP Retransmission] 49153  >  7009 [ACK] Seq=19501 Ack=1 Win=131072 Len=1500 TSval=4935 TSecr=4864"
"1947","4.938768","10.1.0.5","10.1.0.11","TCP","6376","0.000000000","","","[TCP Retransmission] [TCP Retransmission] [TCP Retransmission] [TCP Retransmission] 49153  >  7009 [ACK] Seq=25501 Ack=1 Win=131072 Len=1500 TSval=4935 TSecr=4864"
"1948","4.938768","10.1.0.5","10.1.0.11","TCP","6376","0.000000000","","","[TCP Retransmission] [TCP Retransmission] [TCP Retransmission] [TCP Retransmission] 49153  >  7009 [ACK] Seq=31501 Ack=1 Win=131072 Len=1500 TSval=4935 TSecr=4864"
"1949","4.938768","10.1.0.5","10.1.0.11","TCP","6376","0.000000000","","","[TCP Retransmission] [TCP Retransmission] [TCP Retransmission] [TCP Retransmission] 49153  >  7009 [ACK] Seq=37501 Ack=1 Win=131072 Len=1500 TSval=4935 TSecr=4865"
"1950","4.938768","10.1.0.5","10.1.0.11","TCP","6376","0.000000000","","","[TCP Retransmission] [TCP Retransmission] [TCP Retransmission] [TCP Retransmission] 49153  >  7009 [ACK] Seq=43501 Ack=1 Win=131072 Len=1500 TSval=4935 TSecr=4865"
"2025","4.950101","10.1.0.5","10.1.0.11","TCP","832","0.011333000","","","7008  >  49157 [ACK] Seq=1 Ack=45001 Win=131072 Len=0 TSval=4897 TSecr=4893"
"2062","4.958698","10.1.0.11","10.1.0.5","TCP","6376","0.008597000","-36 dBm","","49157  >  7008 [ACK] Seq=49501 Ack=1 Win=131072 Len=1500 TSval=4962 TSecr=4896"
"2063","4.958698","10.1.0.11","10.1.0.5","TCP","6376","0.000000000","-36 dBm","","49157  >  7008 [ACK] Seq=55501 Ack=1 Win=131072 Len=1500 TSval=4962 TSecr=4896"
"2064","4.958698","10.1.0.11","10.1.0.5","TCP","6376","0.000000000","-36 dBm","","49157  >  7008 [ACK] Seq=61501 Ack=1 Win=131072 Len=1500 TSval=4962 TSecr=4897"
"2065","4.958698","10.1.0.11","10.1.0.5","TCP","6376","0.000000000","-36 dBm","","49157  >  7008 [ACK] Seq=67501 Ack=1 Win=131072 Len=1500 TSval=4962 TSecr=4897"
"2066","4.958698","10.1.0.11","10.1.0.5","TCP","6376","0.000000000","-36 dBm","","49157  >  7008 [ACK] Seq=73501 Ack=1 Win=131072 Len=1500 TSval=4962 TSecr=4897"
"2067","4.958698","10.1.0.11","10.1.0.5","TCP","6376","0.000000000","-36 dBm","","49157  >  7008 [ACK] Seq=79501 Ack=1 Win=131072 Len=1500 TSval=4962 TSecr=4897"
"2068","4.958698","10.1.0.11","10.1.0.5","TCP","6376","0.000000000","-36 dBm","","49157  >  7008 [ACK] Seq=85501 Ack=1 Win=131072 Len=1500 TSval=4962 TSecr=4897"
"2069","4.958698","10.1.0.11","10.1.0.5","TCP","6376","0.000000000","-36 dBm","","49157  >  7008 [ACK] Seq=91501 Ack=1 Win=131072 Len=1500 TSval=4962 TSecr=4897"
"2070","4.958698","10.1.0.11","10.1.0.5","TCP","6376","0.000000000","-36 dBm","","49157  >  7008 [ACK] Seq=97501 Ack=1 Win=131072 Len=1500 TSval=4962 TSecr=4897"
"2071","4.958698","10.1.0.11","10.1.0.5","TCP","3224","0.000000000","-36 dBm","","49157  >  7008 [ACK] Seq=100501 Ack=1 Win=131072 Len=1500 TSval=4962 TSecr=4897"
"2130","4.964480","10.1.0.5","10.1.0.11","TCP","1516","0.005782000","","0.005782000,0.005782000,0.005782000,0.005782000,0.005782000,0.005782000,0.005782000,0.005782000,0.005782000,0.005782000,0.005782000,0.005782000,0.005782000,0.005782000,0.005782000,0.005782000,0.005782000,0.005782000,0.005782000","7008  >  49157 [ACK] Seq=1 Ack=102001 Win=131072 Len=0 TSval=4971 TSecr=4962"
"2149","4.969030","10.1.0.11","10.1.0.5","TCP","6376","0.004550000","-36 dBm","","49157  >  7008 [ACK] Seq=106501 Ack=1 Win=131072 Len=1500 TSval=4977 TSecr=4969"
"2150","4.969030","10.1.0.11","10.1.0.5","TCP","6376","0.000000000","-36 dBm","","49157  >  7008 [ACK] Seq=112501 Ack=1 Win=131072 Len=1500 TSval=4977 TSecr=4969"
"2151","4.969030","10.1.0.11","10.1.0.5","TCP","6376","0.000000000","-36 dBm","","49157  >  7008 [ACK] Seq=118501 Ack=1 Win=131072 Len=1500 TSval=4977 TSecr=4969"
"2152","4.969030","10.1.0.11","10.1.0.5","TCP","6376","0.000000000","-36 dBm","","49157  >  7008 [ACK] Seq=124501 Ack=1 Win=131072 Len=1500 TSval=4977 TSecr=4970"
"2153","4.969030","10.1.0.11","10.1.0.5","TCP","6376","0.000000000","-36 dBm","","49157  >  7008 [ACK] Seq=130501 Ack=1 Win=131072 Len=1500 TSval=4977 TSecr=4970"
"2154","4.969030","10.1.0.11","10.1.0.5","TCP","6376","0.000000000","-36 dBm","","49157  >  7008 [ACK] Seq=136501 Ack=1 Win=131072 Len=1500 TSval=4977 TSecr=4970"
"2155","4.969030","10.1.0.11","10.1.0.5","TCP","6376","0.000000000","-36 dBm","","49157  >  7008 [ACK] Seq=142501 Ack=1 Win=131072 Len=1500 TSval=4977 TSecr=4970"
"2156","4.969030","10.1.0.11","10.1.0.5","TCP","6376","0.000000000","-36 dBm","","49157  >  7008 [ACK] Seq=148501 Ack=1 Win=131072 Len=1500 TSval=4977 TSecr=4970"
"2157","4.969030","10.1.0.11","10.1.0.5","TCP","7452","0.000000000","-36 dBm","","49157  >  7008 [ACK] Seq=156001 Ack=1 Win=131072 Len=1000 TSval=4977 TSecr=4971"
"2158","4.969030","10.1.0.11","10.1.0.5","TCP","2224","0.000000000","-36 dBm","","49157  >  7008 [ACK] Seq=158001 Ack=1 Win=131072 Len=1000 TSval=4978 TSecr=4971"
"2175","4.970985","10.1.0.11","10.1.0.5","TCP","3300","0.001955000","-36 dBm","","49157  >  7008 [ACK] Seq=161001 Ack=1 Win=131072 Len=1000 TSval=4981 TSecr=4971"
"2217","4.975424","10.1.0.5","10.1.0.11","TCP","1668","0.004439000","","0.006394000,0.006394000,0.006394000,0.006394000,0.006394000,0.006394000,0.006394000,0.006394000,0.006394000,0.006394000,0.006394000,0.006394000,0.006394000,0.006394000,0.006394000,0.006394000,0.006394000,0.006394000,0.006394000,0.004439000,0.004439000","7008  >  49157 [ACK] Seq=1 Ack=162001 Win=131072 Len=0 TSval=4983 TSecr=4980"
"2233","4.977041","10.1.0.11","10.1.0.5","TCP","6376","0.001617000","-36 dBm","","49157  >  7008 [ACK] Seq=166501 Ack=1 Win=131072 Len=1500 TSval=4988 TSecr=4979"
"2234","4.977041","10.1.0.11","10.1.0.5","TCP","3300","0.000000000","-36 dBm","","49157  >  7008 [ACK] Seq=170001 Ack=1 Win=131072 Len=1000 TSval=4988 TSecr=4983"
"2248","4.979457","10.1.0.11","10.1.0.5","TCP","4376","0.002416000","-36 dBm","","49157  >  7008 [ACK] Seq=174001 Ack=1 Win=131072 Len=1000 TSval=4991 TSecr=4983"
"2256","4.980353","10.1.0.11","10.1.0.5","TCP","1134","0.000896000","-36 dBm","","49157  >  7008 [ACK] Seq=175001 Ack=1 Win=131072 Len=1000 TSval=4992 TSecr=4983"
"2264","4.980961","10.1.0.11","10.1.0.5","TCP","1134","0.000608000","-36 dBm","","49157  >  7008 [ACK] Seq=176001 Ack=1 Win=131072 Len=1000 TSval=4993 TSecr=4983"
"2276","4.981896","10.1.0.11","10.1.0.5","TCP","1134","0.000935000","-36 dBm","","49157  >  7008 [ACK] Seq=177001 Ack=1 Win=131072 Len=1000 TSval=4994 TSecr=4983"
"2284","4.982504","10.1.0.11","10.1.0.5","TCP","1134","0.000608000","-36 dBm","","49157  >  7008 [ACK] Seq=178001 Ack=1 Win=131072 Len=1000 TSval=4994 TSecr=4983"
"2293","4.983394","10.1.0.11","10.1.0.5","TCP","1134","0.000890000","-36 dBm","","49157  >  7008 [ACK] Seq=179001 Ack=1 Win=131072 Len=1000 TSval=4995 TSecr=4983"
"2296","4.983728","10.1.0.5","10.1.0.11","TCP","680","0.000334000","","0.006687000,0.006687000,0.006687000,0.004271000,0.004271000,0.003375000,0.001832000,0.000334000","7008  >  49157 [ACK] Seq=1 Ack=180001 Win=131072 Len=0 TSval=4995 TSecr=4994"
"2306","4.984857","10.1.0.11","10.1.0.5","TCP","1134","0.001129000","-36 dBm","","49157  >  7008 [ACK] Seq=180001 Ack=1 Win=131072 Len=1000 TSval=4996 TSecr=4983"
"2321","4.987445","10.1.0.11","10.1.0.5","TCP","4376","0.002588000","-36 dBm","","49157  >  7008 [ACK] Seq=184001 Ack=1 Win=131072 Len=1000 TSval=4999 TSecr=4983"
"2331","4.988365","10.1.0.11","10.1.0.5","TCP","1134","0.000920000","-36 dBm","","49157  >  7008 [ACK] Seq=185001 Ack=1 Win=131072 Len=1000 TSval=5000 TSecr=4983"
"2339","4.988973","10.1.0.11","10.1.0.5","TCP","1134","0.000608000","-36 dBm","","49157  >  7008 [ACK] Seq=186001 Ack=1 Win=131072 Len=1000 TSval=5001 TSecr=4983"
"2357","4.991356","10.1.0.11","10.1.0.5","TCP","3300","0.002383000","-36 dBm","","49157  >  7008 [ACK] Seq=189001 Ack=1 Win=131072 Len=1000 TSval=5003 TSecr=4983"
"2369","4.992460","10.1.0.11","10.1.0.5","TCP","1134","0.001104000","-36 dBm","","49157  >  7008 [ACK] Seq=190001 Ack=1 Win=131072 Len=1000 TSval=5004 TSecr=4983"
"2379","4.993221","10.1.0.11","10.1.0.5","TCP","1134","0.000761000","-36 dBm","","49157  >  7008 [ACK] Seq=191001 Ack=1 Win=131072 Len=1000 TSval=5005 TSecr=4983"
"2389","4.993981","10.1.0.11","10.1.0.5","TCP","1134","0.000760000","-36 dBm","","49157  >  7008 [ACK] Seq=192001 Ack=1 Win=131072 Len=1000 TSval=5006 TSecr=4983"
"2399","4.994741","10.1.0.11","10.1.0.5","TCP","1134","0.000760000","-36 dBm","","49157  >  7008 [ACK] Seq=193001 Ack=1 Win=131072 Len=1000 TSval=5006 TSecr=4983"
"2418","4.996441","10.1.0.11","10.1.0.5","TCP","2224","0.001700000","-36 dBm","","49157  >  7008 [ACK] Seq=195001 Ack=1 Win=131072 Len=1000 TSval=5008 TSecr=4983"
"2428","4.997233","10.1.0.11","10.1.0.5","TCP","1134","0.000792000","-36 dBm","","49157  >  7008 [ACK] Seq=196001 Ack=1 Win=131072 Len=1000 TSval=5009 TSecr=4983"
"2438","4.997993","10.1.0.11","10.1.0.5","TCP","1134","0.000760000","-36 dBm","","49157  >  7008 [ACK] Seq=197001 Ack=1 Win=131072 Len=1000 TSval=5010 TSecr=4983"
"2448","4.998753","10.1.0.11","10.1.0.5","TCP","1134","0.000760000","-36 dBm","","49157  >  7008 [ACK] Seq=198001 Ack=1 Win=131072 Len=1000 TSval=5010 TSecr=4983"
"2458","4.999514","10.1.0.11","10.1.0.5","TCP","1134","0.000761000","-36 dBm","","49157  >  7008 [ACK] Seq=199001 Ack=1 Win=131072 Len=1000 TSval=5011 TSecr=4983"
"2468","5.000274","10.1.0.11","10.1.0.5","TCP","1134","0.000760000","-36 dBm","","49157  >  7008 [ACK] Seq=200001 Ack=1 Win=131072 Len=1000 TSval=5012 TSecr=4983"
"2478","5.001034","10.1.0.11","10.1.0.5","TCP","1134","0.000760000","-36 dBm","","49157  >  7008 [ACK] Seq=201001 Ack=1 Win=131072 Len=1000 TSval=5013 TSecr=4983"
"2487","5.001793","10.1.0.5","10.1.0.11","TCP","680","0.000759000","","","7008  >  49157 [ACK] Seq=1 Ack=180001 Win=131072 Len=0 TSval=4995 TSecr=4994"
"2488","5.001793","10.1.0.5","10.1.0.11","TCP","908","0.000000000","","0.014348000,0.014348000,0.013428000,0.010437000,0.010437000,0.008572000,0.007052000,0.005352000,0.003800000,0.002279000,0.000759000","7008  >  49157 [ACK] Seq=1 Ack=202001 Win=131072 Len=0 TSval=5013 TSecr=5012"
"2516","5.005233","10.1.0.11","10.1.0.5","TCP","5452","0.003440000","-36 dBm","","49157  >  7008 [ACK] Seq=206001 Ack=1 Win=131072 Len=1000 TSval=5017 TSecr=5013"
"2540","5.009082","10.1.0.11","10.1.0.5","TCP","5452","0.003849000","-36 dBm","","49157  >  7008 [ACK] Seq=211001 Ack=1 Win=131072 Len=1000 TSval=5021 TSecr=5013"
"2554","5.010786","10.1.0.11","10.1.0.5","TCP","2224","0.001704000","-36 dBm","","49157  >  7008 [ACK] Seq=213001 Ack=1 Win=131072 Len=1000 TSval=5022 TSecr=5013"
"2566","5.011763","10.1.0.11","10.1.0.5","TCP","1134","0.000977000","-36 dBm","","49157  >  7008 [ACK] Seq=214001 Ack=1 Win=131072 Len=1000 TSval=5023 TSecr=5013"
"2580","5.012923","10.1.0.11","10.1.0.5","TCP","2224","0.001160000","-36 dBm","","49157  >  7008 [ACK] Seq=216001 Ack=1 Win=131072 Len=1000 TSval=5025 TSecr=5013"
"2595","5.014434","10.1.0.11","10.1.0.5","TCP","1134","0.001511000","-36 dBm","","49157  >  7008 [ACK] Seq=217001 Ack=1 Win=131072 Len=1000 TSval=5026 TSecr=5013"
"2605","5.015354","10.1.0.11","10.1.0.5","TCP","2224","0.000920000","-36 dBm","","49157  >  7008 [ACK] Seq=219001 Ack=1 Win=131072 Len=1000 TSval=5027 TSecr=5013"
"2619","5.016418","10.1.0.11","10.1.0.5","TCP","1134","0.001064000","-36 dBm","","49157  >  7008 [ACK] Seq=220001 Ack=1 Win=131072 Len=1000 TSval=5028 TSecr=5013"
"2629","5.017178","10.1.0.11","10.1.0.5","TCP","1134","0.000760000","-36 dBm","","49157  >  7008 [ACK] Seq=221001 Ack=1 Win=131072 Len=1000 TSval=5029 TSecr=5013"
"2639","5.017938","10.1.0.11","10.1.0.5","TCP","1134","0.000760000","-36 dBm","","49157  >  7008 [ACK] Seq=222001 Ack=1 Win=131072 Len=1000 TSval=5030 TSecr=5013"
"2649","5.018699","10.1.0.11","10.1.0.5","TCP","1134","0.000761000","-36 dBm","","49157  >  7008 [ACK] Seq=223001 Ack=1 Win=131072 Len=1000 TSval=5030 TSecr=5013"
"2658","5.019615","10.1.0.5","10.1.0.11","TCP","908","0.000916000","","0.014382000,0.014382000,0.010533000,0.010533000,0.010533000,0.008829000,0.006692000,0.005181000,0.004261000,0.002437000,0.000916000","7008  >  49157 [ACK] Seq=1 Ack=224001 Win=131072 Len=0 TSval=5031 TSecr=5030"
"2671","5.020952","10.1.0.11","10.1.0.5","TCP","3300","0.001337000","-36 dBm","","49157  >  7008 [ACK] Seq=226001 Ack=1 Win=131072 Len=1000 TSval=5033 TSecr=5013"
"2697","5.025272","10.1.0.11","10.1.0.5","TCP","5452","0.004320000","-36 dBm","","49157  >  7008 [ACK] Seq=231001 Ack=1 Win=131072 Len=1000 TSval=5037 TSecr=5013"
"2712","5.027297","10.1.0.11","10.1.0.5","TCP","2224","0.002025000","-36 dBm","","49157  >  7008 [ACK] Seq=233001 Ack=1 Win=131072 Len=1000 TSval=5038 TSecr=5013"
"2724","5.028465","10.1.0.11","10.1.0.5","TCP","2224","0.001168000","-36 dBm","","49157  >  7008 [ACK] Seq=235001 Ack=1 Win=131072 Len=1000 TSval=5040 TSecr=5013"
"2738","5.029626","10.1.0.11","10.1.0.5","TCP","1134","0.001161000","-36 dBm","","49157  >  7008 [ACK] Seq=236001 Ack=1 Win=131072 Len=1000 TSval=5041 TSecr=5013"
"2748","5.030546","10.1.0.11","10.1.0.5","TCP","2224","0.000920000","-36 dBm","","49157  >  7008 [ACK] Seq=238001 Ack=1 Win=131072 Len=1000 TSval=5042 TSecr=5013"
"2771","5.032395","10.1.0.11","10.1.0.5","TCP","2224","0.001849000","-36 dBm","","49157  >  7008 [ACK] Seq=240001 Ack=1 Win=131072 Len=1000 TSval=5044 TSecr=5013"
"2790","5.034655","10.1.0.11","10.1.0.5","TCP","3300","0.002260000","-36 dBm","","49157  >  7008 [ACK] Seq=243001 Ack=1 Win=131072 Len=1000 TSval=5046 TSecr=5013"
"2804","5.036071","10.1.0.11","10.1.0.5","TCP","1134","0.001416000","-36 dBm","","49157  >  7008 [ACK] Seq=244001 Ack=1 Win=131072 Len=1000 TSval=5047 TSecr=5013"
"2814","5.036991","10.1.0.11","10.1.0.5","TCP","2224","0.000920000","-36 dBm","","49157  >  7008 [ACK] Seq=246001 Ack=1 Win=131072 Len=1000 TSval=5049 TSecr=5013"
"2836","5.038914","10.1.0.11","10.1.0.5","TCP","2224","0.001923000","-36 dBm","","49157  >  7008 [ACK] Seq=248001 Ack=1 Win=131072 Len=1000 TSval=5050 TSecr=5013"
"2850","5.040202","10.1.0.11","10.1.0.5","TCP","2224","0.001288000","-36 dBm","","49157  >  7008 [ACK] Seq=250001 Ack=1 Win=131072 Len=1000 TSval=5052 TSecr=5013"
"2868","5.041634","10.1.0.11","10.1.0.5","TCP","1134","0.001432000","-36 dBm","","49157  >  7008 [ACK] Seq=251001 Ack=1 Win=131072 Len=1000 TSval=5053 TSecr=5013"
"2878","5.042522","10.1.0.11","10.1.0.5","TCP","2224","0.000888000","-36 dBm","","49157  >  7008 [ACK] Seq=253001 Ack=1 Win=131072 Len=1000 TSval=5054 TSecr=5013"
"2895","5.043824","10.1.0.11","10.1.0.5","TCP","1134","0.001302000","-36 dBm","","49157  >  7008 [ACK] Seq=254001 Ack=1 Win=131072 Len=1000 TSval=5055 TSecr=5013"
"2907","5.044800","10.1.0.11","10.1.0.5","TCP","1134","0.000976000","-36 dBm","","49157  >  7008 [ACK] Seq=255001 Ack=1 Win=131072 Len=1000 TSval=5056 TSecr=5013"
"2915","5.045505","10.1.0.11","10.1.0.5","TCP","1134","0.000705000","-36 dBm","","49157  >  7008 [ACK] Seq=256001 Ack=1 Win=131072 Len=1000 TSval=5057 TSecr=5013"
"2921","5.045961","10.1.0.11","10.1.0.5","TCP","1134","0.000456000","-36 dBm","","49157  >  7008 [ACK] Seq=257001 Ack=1 Win=131072 Len=1000 TSval=5058 TSecr=5013"
"2933","5.046873","10.1.0.11","10.1.0.5","TCP","1134","0.000912000","-36 dBm","","49157  >  7008 [ACK] Seq=258001 Ack=1 Win=131072 Len=1000 TSval=5058 TSecr=5013"
"2945","5.047785","10.1.0.11","10.1.0.5","TCP","1134","0.000912000","-36 dBm","","49157  >  7008 [ACK] Seq=259001 Ack=1 Win=131072 Len=1000 TSval=5059 TSecr=5013"
"2959","5.049174","10.1.0.11","10.1.0.5","TCP","2224","0.001389000","-36 dBm","","49157  >  7008 [ACK] Seq=261001 Ack=1 Win=131072 Len=1000 TSval=5061 TSecr=5013"
"2980","5.052298","10.1.0.11","10.1.0.5","TCP","4376","0.003124000","-36 dBm","","49157  >  7008 [ACK] Seq=265001 Ack=1 Win=131072 Len=1000 TSval=5064 TSecr=5013"
"3070","5.060664","10.1.0.5","10.1.0.11","TCP","908","0.008366000","","","7008  >  49157 [ACK] Seq=1 Ack=224001 Win=131072 Len=0 TSval=5031 TSecr=5030"
"3071","5.060664","10.1.0.5","10.1.0.11","TCP","1668","0.000000000","","0.039712000,0.035392000,0.035392000,0.035392000,0.033367000,0.032199000,0.030118000,0.028269000,0.026009000,0.026009000,0.023673000,0.021750000,0.020462000,0.019030000,0.018142000,0.015864000,0.014703000,0.012879000,0.011490000,0.008366000,0.008366000","7008  >  49157 [ACK] Seq=1 Ack=266001 Win=131072 Len=0 TSval=5064 TSecr=5063"
"3102","5.064457","10.1.0.11","10.1.0.5","TCP","6376","0.003793000","-36 dBm","","49157  >  7008 [ACK] Seq=270501 Ack=1 Win=131072 Len=1500 TSval=5073 TSecr=5021"
"3103","5.064457","10.1.0.11","10.1.0.5","TCP","7528","0.000000000","-36 dBm","","49157  >  7008 [ACK] Seq=278001 Ack=1 Win=131072 Len=1000 TSval=5074 TSecr=5064"
"3104","5.064457","10.1.0.11","10.1.0.5","TCP","1134","0.000000000","-36 dBm","","49157  >  7008 [ACK] Seq=279001 Ack=1 Win=131072 Len=1000 TSval=5075 TSecr=5064"
"3120","5.066977","10.1.0.11","10.1.0.5","TCP","4376","0.002520000","-36 dBm","","49157  >  7008 [ACK] Seq=283001 Ack=1 Win=131072 Len=1000 TSval=5078 TSecr=5064"
"3137","5.068564","10.1.0.11","10.1.0.5","TCP","2224","0.001587000","-36 dBm","","49157  >  7008 [ACK] Seq=285001 Ack=1 Win=131072 Len=1000 TSval=5080 TSecr=5064"
"3149","5.069604","10.1.0.11","10.1.0.5","TCP","1134","0.001040000","-36 dBm","","49157  >  7008 [ACK] Seq=286001 Ack=1 Win=131072 Len=1000 TSval=5081 TSecr=5064"
"3155","5.070092","10.1.0.11","10.1.0.5","TCP","1134","0.000488000","-36 dBm","","49157  >  7008 [ACK] Seq=287001 Ack=1 Win=131072 Len=1000 TSval=5082 TSecr=5064"
"3165","5.070852","10.1.0.11","10.1.0.5","TCP","1134","0.000760000","-36 dBm","","49157  >  7008 [ACK] Seq=288001 Ack=1 Win=131072 Len=1000 TSval=5082 TSecr=5064"
"3177","5.071764","10.1.0.11","10.1.0.5","TCP","1134","0.000912000","-36 dBm","","49157  >  7008 [ACK] Seq=289001 Ack=1 Win=131072 Len=1000 TSval=5083 TSecr=5064"
"3189","5.072708","10.1.0.11","10.1.0.5","TCP","1134","0.000944000","-36 dBm","","49157  >  7008 [ACK] Seq=290001 Ack=1 Win=131072 Len=1000 TSval=5084 TSecr=5064"
"3199","5.073645","10.1.0.11","10.1.0.5","TCP","1134","0.000937000","-36 dBm","","49157  >  7008 [ACK] Seq=291001 Ack=1 Win=131072 Len=1000 TSval=5085 TSecr=5064"
"3205","5.074133","10.1.0.11","10.1.0.5","TCP","1134","0.000488000","-36 dBm","","49157  >  7008 [ACK] Seq=292001 Ack=1 Win=131072 Len=1000 TSval=5086 TSecr=5064"
"3215","5.074894","10.1.0.11","10.1.0.5","TCP","1134","0.000761000","-36 dBm","","49157  >  7008 [ACK] Seq=293001 Ack=1 Win=131072 Len=1000 TSval=5086 TSecr=5064"
"3227","5.075806","10.1.0.11","10.1.0.5","TCP","1134","0.000912000","-36 dBm","","49157  >  7008 [ACK] Seq=294001 Ack=1 Win=131072 Len=1000 TSval=5087 TSecr=5064"
"3239","5.076782","10.1.0.11","10.1.0.5","TCP","1134","0.000976000","-36 dBm","","49157  >  7008 [ACK] Seq=295001 Ack=1 Win=131072 Len=1000 TSval=5088 TSecr=5064"
"3247","5.077486","10.1.0.11","10.1.0.5","TCP","1134","0.000704000","-36 dBm","","49157  >  7008 [ACK] Seq=296001 Ack=1 Win=131072 Len=1000 TSval=5089 TSecr=5064"
"3253","5.077942","10.1.0.11","10.1.0.5","TCP","1134","0.000456000","-36 dBm","","49157  >  7008 [ACK] Seq=297001 Ack=1 Win=131072 Len=1000 TSval=5090 TSecr=5064"
"3265","5.078881","10.1.0.11","10.1.0.5","TCP","1134","0.000939000","-36 dBm","","49157  >  7008 [ACK] Seq=298001 Ack=1 Win=131072 Len=1000 TSval=5090 TSecr=5064"
"3277","5.079793","10.1.0.11","10.1.0.5","TCP","1134","0.000912000","-36 dBm","","49157  >  7008 [ACK] Seq=299001 Ack=1 Win=131072 Len=1000 TSval=5091 TSecr=5064"
"3289","5.080769","10.1.0.11","10.1.0.5","TCP","1134","0.000976000","-36 dBm","","49157  >  7008 [ACK] Seq=300001 Ack=1 Win=131072 Len=1000 TSval=5092 TSecr=5064"
"3297","5.081442","10.1.0.11","10.1.0.5","TCP","1134","0.000673000","-36 dBm","","49157  >  7008 [ACK] Seq=301001 Ack=1 Win=131072 Len=1000 TSval=5093 TSecr=5064"
"3305","5.082050","10.1.0.11","10.1.0.5","TCP","1134","0.000608000","-36 dBm","","49157  >  7008 [ACK] Seq=302001 Ack=1 Win=131072 Len=1000 TSval=5094 TSecr=5064"
"3317","5.082962","10.1.0.11","10.1.0.5","TCP","1134","0.000912000","-36 dBm","","49157  >  7008 [ACK] Seq=303001 Ack=1 Win=131072 Len=1000 TSval=5094 TSecr=5064"
"3329","5.083906","10.1.0.11","10.1.0.5","TCP","1134","0.000944000","-36 dBm","","49157  >  7008 [ACK] Seq=304001 Ack=1 Win=131072 Len=1000 TSval=5095 TSecr=5064"
"3346","5.085408","10.1.0.11","10.1.0.5","TCP","2224","0.001502000","-36 dBm","","49157  >  7008 [ACK] Seq=306001 Ack=1 Win=131072 Len=1000 TSval=5097 TSecr=5064"
"3358","5.086512","10.1.0.11","10.1.0.5","TCP","2224","0.001104000","-36 dBm","","49157  >  7008 [ACK] Seq=308001 Ack=1 Win=131072 Len=1000 TSval=5098 TSecr=5064"
"3372","5.087577","10.1.0.11","10.1.0.5","TCP","1134","0.001065000","-36 dBm","","49157  >  7008 [ACK] Seq=309001 Ack=1 Win=131072 Len=1000 TSval=5099 TSecr=5064"
"3384","5.088489","10.1.0.11","10.1.0.5","TCP","1134","0.000912000","-36 dBm","","49157  >  7008 [ACK] Seq=310001 Ack=1 Win=131072 Len=1000 TSval=5100 TSecr=5064"
"3396","5.089401","10.1.0.11","10.1.0.5","TCP","1134","0.000912000","-36 dBm","","49157  >  7008 [ACK] Seq=311001 Ack=1 Win=131072 Len=1000 TSval=5101 TSecr=5064"
"3412","5.090776","10.1.0.11","10.1.0.5","TCP","2224","0.001375000","-36 dBm","","49157  >  7008 [ACK] Seq=313001 Ack=1 Win=131072 Len=1000 TSval=5102 TSecr=5064"
"3435","5.094260","10.1.0.11","10.1.0.5","TCP","4376","0.003484000","-36 dBm","","49157  >  7008 [ACK] Seq=317001 Ack=1 Win=131072 Len=1000 TSval=5106 TSecr=5064"
"3447","5.095652","10.1.0.11","10.1.0.5","TCP","2224","0.001392000","-36 dBm","","49157  >  7008 [ACK] Seq=319001 Ack=1 Win=131072 Len=1000 TSval=5107 TSecr=5064"
"3449","5.095767","10.1.0.5","10.1.0.11","TCP","1972","0.000115000","","0.031310000,0.031310000,0.031310000,0.031310000,0.031310000,0.028790000,0.028790000,0.027203000,0.026163000,0.024915000,0.023059000,0.021634000,0.019961000,0.018281000,0.016886000,0.014998000,0.013717000,0.011861000,0.010359000,0.009255000,0.007278000,0.004991000,0.001507000,0.001507000,0.000115000","7008  >  49157 [ACK] Seq=1 Ack=319001 Win=131072 Len=0 TSval=5108 TSecr=5106"
"3460","5.096985","10.1.0.11","10.1.0.5","TCP","2224","0.001218000","-36 dBm","","49157  >  7008 [ACK] Seq=321001 Ack=1 Win=131072 Len=1000 TSval=5109 TSecr=5064"
"3472","5.097930","10.1.0.11","10.1.0.5","TCP","1134","0.000945000","-36 dBm","","49157  >  7008 [ACK] Seq=322001 Ack=1 Win=131072 Len=1000 TSval=5110 TSecr=5064"
"3484","5.098842","10.1.0.11","10.1.0.5","TCP","1134","0.000912000","-36 dBm","","49157  >  7008 [ACK] Seq=323001 Ack=1 Win=131072 Len=1000 TSval=5110 TSecr=5064"
"3496","5.099754","10.1.0.11","10.1.0.5","TCP","1134","0.000912000","-36 dBm","","49157  >  7008 [ACK] Seq=324001 Ack=1 Win=131072 Len=1000 TSval=5111 TSecr=5064"
"3508","5.100698","10.1.0.11","10.1.0.5","TCP","1134","0.000944000","-36 dBm","","49157  >  7008 [ACK] Seq=325001 Ack=1 Win=131072 Len=1000 TSval=5112 TSecr=5064"
"3520","5.102012","10.1.0.5","10.1.0.11","TCP","1972","0.001314000","","","7008  >  49157 [ACK] Seq=1 Ack=319001 Win=131072 Len=0 TSval=5108 TSecr=5106"
"3521","5.102012","10.1.0.5","10.1.0.11","TCP","300","0.000000000","","0.005027000,0.004082000,0.002258000","7008  >  49157 [ACK] Seq=1 Ack=325001 Win=131072 Len=0 TSval=5112 TSecr=5110"
"3530","5.102911","10.1.0.11","10.1.0.5","TCP","3300","0.000899000","-36 dBm","","49157  >  7008 [ACK] Seq=328001 Ack=1 Win=131072 Len=1000 TSval=5114 TSecr=5112"
"3553","5.106412","10.1.0.11","10.1.0.5","TCP","4376","0.003501000","-36 dBm","","49157  >  7008 [ACK] Seq=332001 Ack=1 Win=131072 Len=1000 TSval=5118 TSecr=5112"
"3563","5.107780","10.1.0.11","10.1.0.5","TCP","2224","0.001368000","-36 dBm","","49157  >  7008 [ACK] Seq=334001 Ack=1 Win=131072 Len=1000 TSval=5119 TSecr=5112"
"3574","5.108726","10.1.0.11","10.1.0.5","TCP","1134","0.000946000","-36 dBm","","49157  >  7008 [ACK] Seq=335001 Ack=1 Win=131072 Len=1000 TSval=5120 TSecr=5112"
"3580","5.109182","10.1.0.11","10.1.0.5","TCP","1134","0.000456000","-36 dBm","","49157  >  7008 [ACK] Seq=336001 Ack=1 Win=131072 Len=1000 TSval=5121 TSecr=5112"
"3590","5.109942","10.1.0.11","10.1.0.5","TCP","1134","0.000760000","-36 dBm","","49157  >  7008 [ACK] Seq=337001 Ack=1 Win=131072 Len=1000 TSval=5122 TSecr=5112"
"3600","5.110702","10.1.0.11","10.1.0.5","TCP","1134","0.000760000","-36 dBm","","49157  >  7008 [ACK] Seq=338001 Ack=1 Win=131072 Len=1000 TSval=5122 TSecr=5112"
"3610","5.111462","10.1.0.11","10.1.0.5","TCP","1134","0.000760000","-36 dBm","","49157  >  7008 [ACK] Seq=339001 Ack=1 Win=131072 Len=1000 TSval=5123 TSecr=5112"
"3620","5.112222","10.1.0.11","10.1.0.5","TCP","1134","0.000760000","-36 dBm","","49157  >  7008 [ACK] Seq=340001 Ack=1 Win=131072 Len=1000 TSval=5124 TSecr=5112"
"3630","5.112983","10.1.0.11","10.1.0.5","TCP","1134","0.000761000","-36 dBm","","49157  >  7008 [ACK] Seq=341001 Ack=1 Win=131072 Len=1000 TSval=5125 TSecr=5112"
"3637","5.113652","10.1.0.5","10.1.0.11","TCP","680","0.000669000","","0.010741000,0.010741000,0.007240000,0.007240000,0.005872000,0.004470000,0.002950000,0.001430000","7008  >  49157 [ACK] Seq=1 Ack=341001 Win=131072 Len=0 TSval=5124 TSecr=5123"
"3642","5.114199","10.1.0.11","10.1.0.5","TCP","1134","0.000547000","-36 dBm","","49157  >  7008 [ACK] Seq=342001 Ack=1 Win=131072 Len=1000 TSval=5126 TSecr=5112"
"3652","5.114959","10.1.0.11","10.1.0.5","TCP","1134","0.000760000","-36 dBm","","49157  >  7008 [ACK] Seq=343001 Ack=1 Win=131072 Len=1000 TSval=5126 TSecr=5112"
"3662","5.115719","10.1.0.11","10.1.0.5","TCP","1134","0.000760000","-36 dBm","","49157  >  7008 [ACK] Seq=344001 Ack=1 Win=131072 Len=1000 TSval=5127 TSecr=5112"
"3672","5.116479","10.1.0.11","10.1.0.5","TCP","1134","0.000760000","-36 dBm","","49157  >  7008 [ACK] Seq=345001 Ack=1 Win=131072 Len=1000 TSval=5128 TSecr=5112"
"3682","5.117239","10.1.0.11","10.1.0.5","TCP","1134","0.000760000","-36 dBm","","49157  >  7008 [ACK] Seq=346001 Ack=1 Win=131072 Len=1000 TSval=5129 TSecr=5112"
"3692","5.117999","10.1.0.11","10.1.0.5","TCP","1134","0.000760000","-36 dBm","","49157  >  7008 [ACK] Seq=347001 Ack=1 Win=131072 Len=1000 TSval=5130 TSecr=5112"
"3700","5.118608","10.1.0.11","10.1.0.5","TCP","1134","0.000609000","-36 dBm","","49157  >  7008 [ACK] Seq=348001 Ack=1 Win=131072 Len=1000 TSval=5130 TSecr=5112"
"3717","5.120187","10.1.0.11","10.1.0.5","TCP","2224","0.001579000","-36 dBm","","49157  >  7008 [ACK] Seq=350001 Ack=1 Win=131072 Len=1000 TSval=5132 TSecr=5112"
"3725","5.120891","10.1.0.11","10.1.0.5","TCP","1134","0.000704000","-36 dBm","","49157  >  7008 [ACK] Seq=351001 Ack=1 Win=131072 Len=1000 TSval=5133 TSecr=5112"
"3738","5.121918","10.1.0.11","10.1.0.5","TCP","1134","0.001027000","-36 dBm","","49157  >  7008 [ACK] Seq=352001 Ack=1 Win=131072 Len=1000 TSval=5134 TSecr=5112"
"3746","5.122526","10.1.0.11","10.1.0.5","TCP","1134","0.000608000","-36 dBm","","49157  >  7008 [ACK] Seq=353001 Ack=1 Win=131072 Len=1000 TSval=5134 TSecr=5112"
"3758","5.123444","10.1.0.11","10.1.0.5","TCP","1134","0.000918000","-36 dBm","","49157  >  7008 [ACK] Seq=354001 Ack=1 Win=131072 Len=1000 TSval=5135 TSecr=5112"
"3770","5.124401","10.1.0.11","10.1.0.5","TCP","1134","0.000957000","-36 dBm","","49157  >  7008 [ACK] Seq=355001 Ack=1 Win=131072 Len=1000 TSval=5136 TSecr=5112"
"3789","5.127390","10.1.0.11","10.1.0.5","TCP","4376","0.002989000","-36 dBm","","49157  >  7008 [ACK] Seq=359001 Ack=1 Win=131072 Len=1000 TSval=5139 TSecr=5112"
"3797","5.128190","10.1.0.11","10.1.0.5","TCP","1134","0.000800000","-36 dBm","","49157  >  7008 [ACK] Seq=360001 Ack=1 Win=131072 Len=1000 TSval=5140 TSecr=5112"
"3824","5.130822","10.1.0.11","10.1.0.5","TCP","1136","0.002632000","-36 dBm","","49157  >  7008 [ACK] Seq=361001 Ack=1 Win=131072 Len=1000 TSval=5141 TSecr=5112"
"3825","5.130822","10.1.0.11","10.1.0.5","TCP","1136","0.000000000","-36 dBm","","49157  >  7008 [ACK] Seq=362001 Ack=1 Win=131072 Len=1000 TSval=5142 TSecr=5112"
"3826","5.130822","10.1.0.11","10.1.0.5","TCP","1134","0.000000000","-36 dBm","","49157  >  7008 [ACK] Seq=363001 Ack=1 Win=131072 Len=1000 TSval=5142 TSecr=5112"
"3854","5.135614","10.1.0.11","10.1.0.5","TCP","6528","0.004792000","-36 dBm","","49157  >  7008 [ACK] Seq=369001 Ack=1 Win=131072 Len=1000 TSval=5147 TSecr=5112"
"3871","5.137860","10.1.0.11","10.1.0.5","TCP","3300","0.002246000","-36 dBm","","49157  >  7008 [ACK] Seq=372001 Ack=1 Win=131072 Len=1000 TSval=5150 TSecr=5112"
"3883","5.138996","10.1.0.11","10.1.0.5","TCP","1134","0.001136000","-36 dBm","","49157  >  7008 [ACK] Seq=373001 Ack=1 Win=131072 Len=1000 TSval=5150 TSecr=5112"
"3893","5.139757","10.1.0.11","10.1.0.5","TCP","1134","0.000761000","-36 dBm","","49157  >  7008 [ACK] Seq=374001 Ack=1 Win=131072 Len=1000 TSval=5151 TSecr=5112"
"3905","5.140669","10.1.0.11","10.1.0.5","TCP","1134","0.000912000","-36 dBm","","49157  >  7008 [ACK] Seq=375001 Ack=1 Win=131072 Len=1000 TSval=5152 TSecr=5112"
"3916","5.141592","10.1.0.5","10.1.0.11","TCP","680","0.000923000","","","7008  >  49157 [ACK] Seq=1 Ack=341001 Win=131072 Len=0 TSval=5124 TSecr=5123"
"3917","5.141592","10.1.0.5","10.1.0.11","TCP","1364","0.000000000","","0.027393000,0.025873000,0.024353000,0.022984000,0.021405000,0.019674000,0.018148000,0.014202000,0.014202000,0.013402000,0.010770000,0.005978000,0.005978000,0.005978000,0.003732000,0.003732000,0.001835000","7008  >  49157 [ACK] Seq=1 Ack=375001 Win=131072 Len=0 TSval=5152 TSecr=5150"
"3923","5.142499","10.1.0.5","10.1.0.11","TCP","680","0.000907000","","","7008  >  49157 [ACK] Seq=1 Ack=341001 Win=131072 Len=0 TSval=5124 TSecr=5123"
"3924","5.142499","10.1.0.5","10.1.0.11","TCP","1364","0.000000000","","","7008  >  49157 [ACK] Seq=1 Ack=375001 Win=131072 Len=0 TSval=5152 TSecr=5150"
"3934","5.143682","10.1.0.11","10.1.0.5","TCP","4376","0.001183000","-36 dBm","","49157  >  7008 [ACK] Seq=379001 Ack=1 Win=131072 Len=1000 TSval=5155 TSecr=5152"
"3946","5.145090","10.1.0.11","10.1.0.5","TCP","2224","0.001408000","-36 dBm","","49157  >  7008 [ACK] Seq=381001 Ack=1 Win=131072 Len=1000 TSval=5157 TSecr=5152"
"3958","5.146099","10.1.0.11","10.1.0.5","TCP","1134","0.001009000","-36 dBm","","49157  >  7008 [ACK] Seq=382001 Ack=1 Win=131072 Len=1000 TSval=5158 TSecr=5152"
"3970","5.147011","10.1.0.11","10.1.0.5","TCP","1134","0.000912000","-36 dBm","","49157  >  7008 [ACK] Seq=383001 Ack=1 Win=131072 Len=1000 TSval=5158 TSecr=5152"
"3982","5.147923","10.1.0.11","10.1.0.5","TCP","1134","0.000912000","-36 dBm","","49157  >  7008 [ACK] Seq=384001 Ack=1 Win=131072 Len=1000 TSval=5159 TSecr=5152"
"3994","5.149040","10.1.0.11","10.1.0.5","TCP","2224","0.001117000","-36 dBm","","49157  >  7008 [ACK] Seq=386001 Ack=1 Win=131072 Len=1000 TSval=5161 TSecr=5152"
"4006","5.149984","10.1.0.11","10.1.0.5","TCP","1134","0.000944000","-36 dBm","","49157  >  7008 [ACK] Seq=387001 Ack=1 Win=131072 Len=1000 TSval=5162 TSecr=5152"
"4018","5.150896","10.1.0.11","10.1.0.5","TCP","1134","0.000912000","-36 dBm","","49157  >  7008 [ACK] Seq=388001 Ack=1 Win=131072 Len=1000 TSval=5162 TSecr=5152"
"4030","5.151809","10.1.0.11","10.1.0.5","TCP","1134","0.000913000","-36 dBm","","49157  >  7008 [ACK] Seq=389001 Ack=1 Win=131072 Len=1000 TSval=5163 TSecr=5152"
"4042","5.152721","10.1.0.11","10.1.0.5","TCP","1134","0.000912000","-36 dBm","","49157  >  7008 [ACK] Seq=390001 Ack=1 Win=131072 Len=1000 TSval=5164 TSecr=5152"
"4054","5.153793","10.1.0.11","10.1.0.5","TCP","2224","0.001072000","-36 dBm","","49157  >  7008 [ACK] Seq=392001 Ack=1 Win=131072 Len=1000 TSval=5166 TSecr=5152"
"4057","5.153975","10.1.0.5","10.1.0.11","TCP","756","0.000182000","","0.010293000,0.010293000,0.008885000,0.007876000,0.006052000,0.004935000,0.003079000,0.001254000,0.000182000","7008  >  49157 [ACK] Seq=1 Ack=393001 Win=131072 Len=0 TSval=5166 TSecr=5165"
"4070","5.155081","10.1.0.11","10.1.0.5","TCP","1134","0.001106000","-36 dBm","","49157  >  7008 [ACK] Seq=393001 Ack=1 Win=131072 Len=1000 TSval=5166 TSecr=5166"
"4082","5.155993","10.1.0.11","10.1.0.5","TCP","1134","0.000912000","-36 dBm","","49157  >  7008 [ACK] Seq=394001 Ack=1 Win=131072 Len=1000 TSval=5167 TSecr=5166"
"4094","5.157097","10.1.0.11","10.1.0.5","TCP","2224","0.001104000","-36 dBm","","49157  >  7008 [ACK] Seq=396001 Ack=1 Win=131072 Len=1000 TSval=5169 TSecr=5166"
"4106","5.158010","10.1.0.11","10.1.0.5","TCP","1134","0.000913000","-36 dBm","","49157  >  7008 [ACK] Seq=397001 Ack=1 Win=131072 Len=1000 TSval=5170 TSecr=5166"
"4118","5.158922","10.1.0.11","10.1.0.5","TCP","1134","0.000912000","-36 dBm","","49157  >  7008 [ACK] Seq=398001 Ack=1 Win=131072 Len=1000 TSval=5170 TSecr=5166"
"4130","5.159861","10.1.0.11","10.1.0.5","TCP","1134","0.000939000","-36 dBm","","49157  >  7008 [ACK] Seq=399001 Ack=1 Win=131072 Len=1000 TSval=5171 TSecr=5166"
"4142","5.160773","10.1.0.11","10.1.0.5","TCP","1134","0.000912000","-36 dBm","","49157  >  7008 [ACK] Seq=400001 Ack=1 Win=131072 Len=1000 TSval=5172 TSecr=5166"
"4154","5.161845","10.1.0.11","10.1.0.5","TCP","2224","0.001072000","-36 dBm","","49157  >  7008 [ACK] Seq=402001 Ack=1 Win=131072 Len=1000 TSval=5174 TSecr=5166"
"4166","5.162789","10.1.0.11","10.1.0.5","TCP","1134","0.000944000","-36 dBm","","49157  >  7008 [ACK] Seq=403001 Ack=1 Win=131072 Len=1000 TSval=5174 TSecr=5166"
"4178","5.163702","10.1.0.11","10.1.0.5","TCP","1134","0.000913000","-36 dBm","","49157  >  7008 [ACK] Seq=404001 Ack=1 Win=131072 Len=1000 TSval=5175 TSecr=5166"
"4190","5.164614","10.1.0.11","10.1.0.5","TCP","1134","0.000912000","-36 dBm","","49157  >  7008 [ACK] Seq=405001 Ack=1 Win=131072 Len=1000 TSval=5176 TSecr=5166"
"4203","5.165914","10.1.0.5","10.1.0.11","TCP","528","0.001300000","","0.009921000,0.008817000,0.006992000,0.005141000,0.004069000,0.002212000","7008  >  49157 [ACK] Seq=1 Ack=405001 Win=131072 Len=0 TSval=5176 TSecr=5174"
"4214","5.167132","10.1.0.11","10.1.0.5","TCP","3300","0.001218000","-36 dBm","","49157  >  7008 [ACK] Seq=408001 Ack=1 Win=131072 Len=1000 TSval=5178 TSecr=5176"
"4236","5.170880","10.1.0.11","10.1.0.5","TCP","5452","0.003748000","-36 dBm","","49157  >  7008 [ACK] Seq=413001 Ack=1 Win=131072 Len=1000 TSval=5182 TSecr=5176"
"4258","5.172786","10.1.0.11","10.1.0.5","TCP","2224","0.001906000","-36 dBm","","49157  >  7008 [ACK] Seq=415001 Ack=1 Win=131072 Len=1000 TSval=5184 TSecr=5176"
"4269","5.174015","10.1.0.11","10.1.0.5","TCP","2224","0.001229000","-36 dBm","","49157  >  7008 [ACK] Seq=417001 Ack=1 Win=131072 Len=1000 TSval=5186 TSecr=5176"
