"No.","Time","Source","Destination","Protocol","Length","Time delta from previous displayed frame","Signal strength (dBm)","The RTT to ACK the segment was","Info"
"790","3.838201","10.1.0.11","10.1.0.8","TCP","138","0.000000000","-37 dBm","","49160  >  7014 [SYN] Seq=0 Win=65535 Len=0 TSval=3850 TSecr=0 WS=4 SACK_PERM=1"
"793","3.838347","10.1.0.8","10.1.0.11","TCP","138","0.000146000","","","49153  >  7015 [SYN] Seq=0 Win=65535 Len=0 TSval=3850 TSecr=0 WS=4 SACK_PERM=1"
"796","3.838562","10.1.0.8","10.1.0.11","TCP","138","0.000215000","","0.000361000","7014  >  49160 [SYN, ACK] Seq=0 Ack=1 Win=65535 Len=0 TSval=3850 TSecr=3850 WS=4 SACK_PERM=1"
"797","3.838755","10.1.0.8","10.1.0.11","TCP","138","0.000193000","","","[TCP Out-Of-Order] 7014  >  49160 [SYN, ACK] Seq=0 Ack=1 Win=65535 Len=0 TSval=3850 TSecr=3850 WS=4 SACK_PERM=1"
"800","3.839021","10.1.0.11","10.1.0.8","TCP","134","0.000266000","-37 dBm","0.000459000","49160  >  7014 [ACK] Seq=1 Ack=1 Win=131072 Len=0 TSval=3851 TSecr=3850"
"803","3.839335","10.1.0.11","10.1.0.8","TCP","138","0.000314000","-37 dBm","0.000988000","7015  >  49153 [SYN, ACK] Seq=0 Ack=1 Win=65535 Len=0 TSval=3850 TSecr=3850 WS=4 SACK_PERM=1"
"806","3.839481","10.1.0.8","10.1.0.11","TCP","134","0.000146000","","0.000146000","49153  >  7015 [ACK] Seq=1 Ack=1 Win=131072 Len=0 TSval=3851 TSecr=3850"
"1033","4.840473","10.1.0.11","10.1.0.8","TCP","1134","1.000992000","-37 dBm","","49160  >  7014 [ACK] Seq=1 Ack=1 Win=131072 Len=1000 TSval=4852 TSecr=3850"
"1053","4.842377","10.1.0.11","10.1.0.8","TCP","3300","0.001904000","-37 dBm","","49160  >  7014 [ACK] Seq=3001 Ack=1 Win=131072 Len=1000 TSval=4854 TSecr=3850"
"1080","4.845569","10.1.0.11","10.1.0.8","TCP","4376","0.003192000","-37 dBm","","49160  >  7014 [ACK] Seq=7001 Ack=1 Win=131072 Len=1000 TSval=4857 TSecr=3850"
"1100","4.848161","10.1.0.11","10.1.0.8","TCP","3300","0.002592000","-37 dBm","","49160  >  7014 [ACK] Seq=10001 Ack=1 Win=131072 Len=1000 TSval=4860 TSecr=3850"
"1120","4.850354","10.1.0.11","10.1.0.8","TCP","3300","0.002193000","-37 dBm","","49160  >  7014 [ACK] Seq=13001 Ack=1 Win=131072 Len=1000 TSval=4862 TSecr=3850"
"1141","4.852643","10.1.0.8","10.1.0.11","TCP","6528","0.002289000","","","49153  >  7015 [ACK] Seq=5001 Ack=1 Win=131072 Len=1000 TSval=4856 TSecr=3850"
"1142","4.852643","10.1.0.8","10.1.0.11","TCP","6528","0.000000000","","","49153  >  7015 [ACK] Seq=11001 Ack=1 Win=131072 Len=1000 TSval=4861 TSecr=3850"
"1143","4.852643","10.1.0.8","10.1.0.11","TCP","3300","0.000000000","","","49153  >  7015 [ACK] Seq=14001 Ack=1 Win=131072 Len=1000 TSval=4863 TSecr=3850"
"1152","4.855411","10.1.0.8","10.1.0.11","TCP","6528","0.002768000","","","[TCP Retransmission] [TCP Retransmission] [TCP Retransmission] [TCP Retransmission] [TCP Retransmission] [TCP Retransmission] 49153  >  7015 [ACK] Seq=5001 Ack=1 Win=131072 Len=1000 TSval=4856 TSecr=3850"
"1153","4.855411","10.1.0.8","10.1.0.11","TCP","6528","0.000000000","","","[TCP Retransmission] [TCP Retransmission] [TCP Retransmission] [TCP Retransmission] [TCP Retransmission] [TCP Retransmission] 49153  >  7015 [ACK] Seq=11001 Ack=1 Win=131072 Len=1000 TSval=4861 TSecr=3850"
"1154","4.855411","10.1.0.8","10.1.0.11","TCP","3300","0.000000000","","","[TCP Retransmission] [TCP Retransmission] [TCP Retransmission] 49153  >  7015 [ACK] Seq=14001 Ack=1 Win=131072 Len=1000 TSval=4863 TSecr=3850"
"1201","4.861622","10.1.0.11","10.1.0.8","TCP","1134","0.006211000","-37 dBm","","49160  >  7014 [ACK] Seq=14001 Ack=1 Win=131072 Len=1000 TSval=4863 TSecr=3850"
"1211","4.862640","10.1.0.8","10.1.0.11","TCP","680","0.001018000","","0.022167000,0.020263000,0.017071000,0.017071000,0.014479000,0.014479000,0.012286000,0.001018000","7014  >  49160 [ACK] Seq=1 Ack=15001 Win=131072 Len=0 TSval=4874 TSecr=4862"
"1263","4.869202","10.1.0.8","10.1.0.11","TCP","680","0.006562000","","","7014  >  49160 [ACK] Seq=1 Ack=15001 Win=131072 Len=0 TSval=4874 TSecr=4862"
"1856","4.923710","10.1.0.11","10.1.0.8","TCP","680","0.054508000","-37 dBm","0.071067000,0.071067000,0.071067000,0.071067000,0.071067000,0.071067000,0.071067000,0.071067000","7015  >  49153 [ACK] Seq=1 Ack=15001 Win=131072 Len=0 TSval=4868 TSecr=4863"
"1879","4.927232","10.1.0.8","10.1.0.11","TCP","6376","0.003522000","","","49153  >  7015 [ACK] Seq=19501 Ack=1 Win=131072 Len=1500 TSval=4936 TSecr=4868"
"1880","4.927232","10.1.0.8","10.1.0.11","TCP","6376","0.000000000","","","49153  >  7015 [ACK] Seq=25501 Ack=1 Win=131072 Len=1500 TSval=4936 TSecr=4868"
"1881","4.927232","10.1.0.8","10.1.0.11","TCP","6376","0.000000000","","","49153  >  7015 [ACK] Seq=31501 Ack=1 Win=131072 Len=1500 TSval=4936 TSecr=4868"
"1882","4.927232","10.1.0.8","10.1.0.11","TCP","6376","0.000000000","","","49153  >  7015 [ACK] Seq=37501 Ack=1 Win=131072 Len=1500 TSval=4936 TSecr=4868"
"1883","4.927232","10.1.0.8","10.1.0.11","TCP","6376","0.000000000","","","49153  >  7015 [ACK] Seq=43501 Ack=1 Win=131072 Len=1500 TSval=4936 TSecr=4868"
"1959","4.940126","10.1.0.8","10.1.0.11","TCP","6376","0.012894000","","","[TCP Retransmission] [TCP Retransmission] [TCP Retransmission] [TCP Retransmission] 49153  >  7015 [ACK] Seq=19501 Ack=1 Win=131072 Len=1500 TSval=4936 TSecr=4868"
"1960","4.940126","10.1.0.8","10.1.0.11","TCP","6376","0.000000000","","","[TCP Retransmission] [TCP Retransmission] [TCP Retransmission] [TCP Retransmission] 49153  >  7015 [ACK] Seq=25501 Ack=1 Win=131072 Len=1500 TSval=4936 TSecr=4868"
"1961","4.940126","10.1.0.8","10.1.0.11","TCP","6376","0.000000000","","","[TCP Retransmission] [TCP Retransmission] [TCP Retransmission] [TCP Retransmission] 49153  >  7015 [ACK] Seq=31501 Ack=1 Win=131072 Len=1500 TSval=4936 TSecr=4868"
"1962","4.940126","10.1.0.8","10.1.0.11","TCP","6376","0.000000000","","","[TCP Retransmission] [TCP Retransmission] [TCP Retransmission] [TCP Retransmission] 49153  >  7015 [ACK] Seq=37501 Ack=1 Win=131072 Len=1500 TSval=4936 TSecr=4868"
"1963","4.940126","10.1.0.8","10.1.0.11","TCP","6376","0.000000000","","","[TCP Retransmission] [TCP Retransmission] [TCP Retransmission] [TCP Retransmission] 49153  >  7015 [ACK] Seq=43501 Ack=1 Win=131072 Len=1500 TSval=4936 TSecr=4868"
"1966","4.941369","10.1.0.8","10.1.0.11","TCP","680","0.001243000","","","7014  >  49160 [ACK] Seq=1 Ack=15001 Win=131072 Len=0 TSval=4874 TSecr=4862"
"1977","4.944059","10.1.0.11","10.1.0.8","TCP","6376","0.002690000","-37 dBm","","49160  >  7014 [ACK] Seq=19501 Ack=1 Win=131072 Len=1500 TSval=4953 TSecr=4854"
"1978","4.944059","10.1.0.11","10.1.0.8","TCP","6376","0.000000000","-37 dBm","","49160  >  7014 [ACK] Seq=25501 Ack=1 Win=131072 Len=1500 TSval=4953 TSecr=4858"
"1979","4.944059","10.1.0.11","10.1.0.8","TCP","6376","0.000000000","-37 dBm","","49160  >  7014 [ACK] Seq=31501 Ack=1 Win=131072 Len=1500 TSval=4953 TSecr=4860"
"1980","4.944059","10.1.0.11","10.1.0.8","TCP","6376","0.000000000","-37 dBm","","49160  >  7014 [ACK] Seq=37501 Ack=1 Win=131072 Len=1500 TSval=4953 TSecr=4862"
"1981","4.944059","10.1.0.11","10.1.0.8","TCP","6376","0.000000000","-37 dBm","","49160  >  7014 [ACK] Seq=43501 Ack=1 Win=131072 Len=1500 TSval=4953 TSecr=4874"
"2026","4.949870","10.1.0.8","10.1.0.11","TCP","832","0.005811000","","0.005811000,0.005811000,0.005811000,0.005811000,0.005811000,0.005811000,0.005811000,0.005811000,0.005811000,0.005811000","7014  >  49160 [ACK] Seq=1 Ack=45001 Win=131072 Len=0 TSval=4956 TSecr=4953"
"2053","4.955673","10.1.0.11","10.1.0.8","TCP","6376","0.005803000","-37 dBm","","49160  >  7014 [ACK] Seq=49501 Ack=1 Win=131072 Len=1500 TSval=4962 TSecr=4955"
"2054","4.955673","10.1.0.11","10.1.0.8","TCP","6376","0.000000000","-37 dBm","","49160  >  7014 [ACK] Seq=55501 Ack=1 Win=131072 Len=1500 TSval=4962 TSecr=4955"
"2055","4.955673","10.1.0.11","10.1.0.8","TCP","6376","0.000000000","-37 dBm","","49160  >  7014 [ACK] Seq=61501 Ack=1 Win=131072 Len=1500 TSval=4962 TSecr=4955"
"2056","4.955673","10.1.0.11","10.1.0.8","TCP","6376","0.000000000","-37 dBm","","49160  >  7014 [ACK] Seq=67501 Ack=1 Win=131072 Len=1500 TSval=4962 TSecr=4955"
"2057","4.955673","10.1.0.11","10.1.0.8","TCP","6376","0.000000000","-37 dBm","","49160  >  7014 [ACK] Seq=73501 Ack=1 Win=131072 Len=1500 TSval=4962 TSecr=4956"
"2058","4.955673","10.1.0.11","10.1.0.8","TCP","6376","0.000000000","-37 dBm","","49160  >  7014 [ACK] Seq=79501 Ack=1 Win=131072 Len=1500 TSval=4962 TSecr=4956"
"2059","4.955673","10.1.0.11","10.1.0.8","TCP","6376","0.000000000","-37 dBm","","49160  >  7014 [ACK] Seq=85501 Ack=1 Win=131072 Len=1500 TSval=4962 TSecr=4956"
"2060","4.955673","10.1.0.11","10.1.0.8","TCP","6376","0.000000000","-37 dBm","","49160  >  7014 [ACK] Seq=91501 Ack=1 Win=131072 Len=1500 TSval=4962 TSecr=4956"
"2062","4.956278","10.1.0.11","10.1.0.8","TCP","6376","0.000605000","-37 dBm","","[TCP Previous segment not captured] 49160  >  7014 [ACK] Seq=103501 Ack=1 Win=131072 Len=1500 TSval=4962 TSecr=4956"
"2064","4.956610","10.1.0.11","10.1.0.8","TCP","6376","0.000332000","-37 dBm","","[TCP Out-Of-Order] [TCP Out-Of-Order] [TCP Out-Of-Order] [TCP Out-Of-Order] 49160  >  7014 [ACK] Seq=97501 Ack=1 Win=131072 Len=1500 TSval=4962 TSecr=4956"
"2094","4.961234","10.1.0.8","10.1.0.11","TCP","1592","0.004624000","","0.005561000,0.005561000,0.005561000,0.005561000,0.005561000,0.005561000,0.005561000,0.005561000,0.005561000,0.005561000,0.005561000,0.005561000,0.005561000,0.005561000,0.005561000,0.005561000,0.004624000,0.004624000,0.004956000,0.004956000","7014  >  49160 [ACK] Seq=1 Ack=105001 Win=131072 Len=0 TSval=4969 TSecr=4962"
"2292","4.982668","10.1.0.8","10.1.0.11","TCP","1592","0.021434000","","","7014  >  49160 [ACK] Seq=1 Ack=105001 Win=131072 Len=0 TSval=4969 TSecr=4962"
"2669","5.020322","10.1.0.8","10.1.0.11","TCP","1592","0.037654000","","","7014  >  49160 [ACK] Seq=1 Ack=105001 Win=131072 Len=0 TSval=4969 TSecr=4962"
"2686","5.024676","10.1.0.11","10.1.0.8","TCP","6376","0.004354000","-37 dBm","","49160  >  7014 [ACK] Seq=109501 Ack=1 Win=131072 Len=1500 TSval=5032 TSecr=4966"
"2687","5.024676","10.1.0.11","10.1.0.8","TCP","6376","0.000000000","-37 dBm","","49160  >  7014 [ACK] Seq=115501 Ack=1 Win=131072 Len=1500 TSval=5032 TSecr=4966"
"2688","5.024676","10.1.0.11","10.1.0.8","TCP","6376","0.000000000","-37 dBm","","49160  >  7014 [ACK] Seq=121501 Ack=1 Win=131072 Len=1500 TSval=5032 TSecr=4966"
"2689","5.024676","10.1.0.11","10.1.0.8","TCP","6376","0.000000000","-37 dBm","","49160  >  7014 [ACK] Seq=127501 Ack=1 Win=131072 Len=1500 TSval=5032 TSecr=4966"
"2690","5.024676","10.1.0.11","10.1.0.8","TCP","6376","0.000000000","-37 dBm","","49160  >  7014 [ACK] Seq=133501 Ack=1 Win=131072 Len=1500 TSval=5032 TSecr=4967"
"2691","5.024676","10.1.0.11","10.1.0.8","TCP","6376","0.000000000","-37 dBm","","49160  >  7014 [ACK] Seq=139501 Ack=1 Win=131072 Len=1500 TSval=5032 TSecr=4967"
"2692","5.024676","10.1.0.11","10.1.0.8","TCP","6376","0.000000000","-37 dBm","","49160  >  7014 [ACK] Seq=145501 Ack=1 Win=131072 Len=1500 TSval=5032 TSecr=4967"
"2693","5.024676","10.1.0.11","10.1.0.8","TCP","6376","0.000000000","-37 dBm","","49160  >  7014 [ACK] Seq=151501 Ack=1 Win=131072 Len=1500 TSval=5032 TSecr=4967"
"2694","5.024676","10.1.0.11","10.1.0.8","TCP","6376","0.000000000","-37 dBm","","49160  >  7014 [ACK] Seq=157501 Ack=1 Win=131072 Len=1500 TSval=5032 TSecr=4967"
"2695","5.024676","10.1.0.11","10.1.0.8","TCP","6376","0.000000000","-37 dBm","","49160  >  7014 [ACK] Seq=163501 Ack=1 Win=131072 Len=1500 TSval=5032 TSecr=4967"
"2696","5.024676","10.1.0.11","10.1.0.8","TCP","6376","0.000000000","-37 dBm","","49160  >  7014 [ACK] Seq=169501 Ack=1 Win=131072 Len=1500 TSval=5032 TSecr=4967"
"2697","5.024676","10.1.0.11","10.1.0.8","TCP","7528","0.000000000","-37 dBm","","49160  >  7014 [ACK] Seq=177001 Ack=1 Win=131072 Len=1000 TSval=5034 TSecr=4969"
"2712","5.026897","10.1.0.11","10.1.0.8","TCP","5452","0.002221000","-37 dBm","","49160  >  7014 [ACK] Seq=182001 Ack=1 Win=131072 Len=1000 TSval=5038 TSecr=4969"
"2726","5.028281","10.1.0.11","10.1.0.8","TCP","2224","0.001384000","-37 dBm","","49160  >  7014 [ACK] Seq=184001 Ack=1 Win=131072 Len=1000 TSval=5040 TSecr=4969"
"2740","5.029474","10.1.0.11","10.1.0.8","TCP","2224","0.001193000","-37 dBm","","49160  >  7014 [ACK] Seq=186001 Ack=1 Win=131072 Len=1000 TSval=5041 TSecr=4969"
"2756","5.030850","10.1.0.11","10.1.0.8","TCP","1134","0.001376000","-37 dBm","","49160  >  7014 [ACK] Seq=187001 Ack=1 Win=131072 Len=1000 TSval=5042 TSecr=4969"
"2771","5.032027","10.1.0.11","10.1.0.8","TCP","2224","0.001177000","-37 dBm","","49160  >  7014 [ACK] Seq=189001 Ack=1 Win=131072 Len=1000 TSval=5044 TSecr=4969"
"2790","5.034223","10.1.0.11","10.1.0.8","TCP","3300","0.002196000","-37 dBm","","49160  >  7014 [ACK] Seq=192001 Ack=1 Win=131072 Len=1000 TSval=5046 TSecr=4969"
"2963","5.048847","10.1.0.8","10.1.0.11","TCP","2504","0.014624000","","0.024171000,0.024171000,0.024171000,0.024171000,0.024171000,0.024171000,0.024171000,0.024171000,0.024171000,0.024171000,0.024171000,0.024171000,0.024171000,0.024171000,0.024171000,0.024171000,0.024171000,0.024171000,0.024171000,0.024171000,0.024171000,0.024171000,0.024171000,0.024171000,0.024171000,0.021950000,0.021950000,0.020566000,0.019373000,0.017997000,0.016820000,0.014624000","7014  >  49160 [ACK] Seq=1 Ack=192001 Win=131072 Len=0 TSval=5046 TSecr=5044"
"3454","5.095767","10.1.0.8","10.1.0.11","TCP","2504","0.046920000","","","7014  >  49160 [ACK] Seq=1 Ack=192001 Win=131072 Len=0 TSval=5046 TSecr=5044"
"3823","5.130007","10.1.0.8","10.1.0.11","TCP","2504","0.034240000","","","7014  >  49160 [ACK] Seq=1 Ack=192001 Win=131072 Len=0 TSval=5046 TSecr=5044"
"4706","5.209796","10.1.0.11","10.1.0.8","TCP","832","0.079789000","-37 dBm","0.282564000,0.282564000,0.282564000,0.282564000,0.282564000,0.282564000,0.282564000,0.282564000,0.282564000,0.282564000","7015  >  49153 [ACK] Seq=1 Ack=45001 Win=131072 Len=0 TSval=4953 TSecr=4936"
"4739","5.214706","10.1.0.8","10.1.0.11","TCP","6376","0.004910000","","","49153  >  7015 [ACK] Seq=49501 Ack=1 Win=131072 Len=1500 TSval=5222 TSecr=4952"
"4740","5.214706","10.1.0.8","10.1.0.11","TCP","6376","0.000000000","","","49153  >  7015 [ACK] Seq=55501 Ack=1 Win=131072 Len=1500 TSval=5222 TSecr=4952"
"4741","5.214706","10.1.0.8","10.1.0.11","TCP","6376","0.000000000","","","49153  >  7015 [ACK] Seq=61501 Ack=1 Win=131072 Len=1500 TSval=5222 TSecr=4953"
"4742","5.214706","10.1.0.8","10.1.0.11","TCP","6376","0.000000000","","","49153  >  7015 [ACK] Seq=67501 Ack=1 Win=131072 Len=1500 TSval=5222 TSecr=4953"
"4743","5.214706","10.1.0.8","10.1.0.11","TCP","6376","0.000000000","","","49153  >  7015 [ACK] Seq=73501 Ack=1 Win=131072 Len=1500 TSval=5222 TSecr=4953"
"4744","5.214706","10.1.0.8","10.1.0.11","TCP","6376","0.000000000","","","49153  >  7015 [ACK] Seq=79501 Ack=1 Win=131072 Len=1500 TSval=5222 TSecr=4953"
"4745","5.214706","10.1.0.8","10.1.0.11","TCP","6376","0.000000000","","","49153  >  7015 [ACK] Seq=85501 Ack=1 Win=131072 Len=1500 TSval=5222 TSecr=4953"
"4746","5.214706","10.1.0.8","10.1.0.11","TCP","6376","0.000000000","","","49153  >  7015 [ACK] Seq=91501 Ack=1 Win=131072 Len=1500 TSval=5222 TSecr=4953"
"4747","5.214706","10.1.0.8","10.1.0.11","TCP","6376","0.000000000","","","49153  >  7015 [ACK] Seq=97501 Ack=1 Win=131072 Len=1500 TSval=5222 TSecr=4953"
"4748","5.214706","10.1.0.8","10.1.0.11","TCP","3224","0.000000000","","","49153  >  7015 [ACK] Seq=100501 Ack=1 Win=131072 Len=1500 TSval=5222 TSecr=4953"
"4888","5.243113","10.1.0.11","10.1.0.8","TCP","1516","0.028407000","-37 dBm","0.028407000,0.028407000,0.028407000,0.028407000,0.028407000,0.028407000,0.028407000,0.028407000,0.028407000,0.028407000,0.028407000,0.028407000,0.028407000,0.028407000,0.028407000,0.028407000,0.028407000,0.028407000,0.028407000","7015  >  49153 [ACK] Seq=1 Ack=102001 Win=131072 Len=0 TSval=5229 TSecr=5222"
"4968","5.261521","10.1.0.8","10.1.0.11","TCP","6376","0.018408000","","","49153  >  7015 [ACK] Seq=106501 Ack=1 Win=131072 Len=1500 TSval=5255 TSecr=5227"
"4969","5.261521","10.1.0.8","10.1.0.11","TCP","6376","0.000000000","","","49153  >  7015 [ACK] Seq=112501 Ack=1 Win=131072 Len=1500 TSval=5255 TSecr=5227"
"4970","5.261521","10.1.0.8","10.1.0.11","TCP","6376","0.000000000","","","49153  >  7015 [ACK] Seq=118501 Ack=1 Win=131072 Len=1500 TSval=5255 TSecr=5227"
"4971","5.261521","10.1.0.8","10.1.0.11","TCP","6376","0.000000000","","","49153  >  7015 [ACK] Seq=124501 Ack=1 Win=131072 Len=1500 TSval=5255 TSecr=5228"
"4972","5.261521","10.1.0.8","10.1.0.11","TCP","6376","0.000000000","","","49153  >  7015 [ACK] Seq=130501 Ack=1 Win=131072 Len=1500 TSval=5255 TSecr=5228"
"4973","5.261521","10.1.0.8","10.1.0.11","TCP","6376","0.000000000","","","49153  >  7015 [ACK] Seq=136501 Ack=1 Win=131072 Len=1500 TSval=5255 TSecr=5228"
"4974","5.261521","10.1.0.8","10.1.0.11","TCP","6376","0.000000000","","","49153  >  7015 [ACK] Seq=142501 Ack=1 Win=131072 Len=1500 TSval=5255 TSecr=5228"
"4975","5.261521","10.1.0.8","10.1.0.11","TCP","6376","0.000000000","","","49153  >  7015 [ACK] Seq=148501 Ack=1 Win=131072 Len=1500 TSval=5255 TSecr=5228"
"4976","5.261521","10.1.0.8","10.1.0.11","TCP","6376","0.000000000","","","49153  >  7015 [ACK] Seq=154501 Ack=1 Win=131072 Len=1500 TSval=5255 TSecr=5229"
"4977","5.261521","10.1.0.8","10.1.0.11","TCP","6376","0.000000000","","","49153  >  7015 [ACK] Seq=160501 Ack=1 Win=131072 Len=1500 TSval=5255 TSecr=5229"
"5006","5.267418","10.1.0.8","10.1.0.11","TCP","6376","0.005897000","","","[TCP Retransmission] [TCP Retransmission] [TCP Retransmission] [TCP Retransmission] 49153  >  7015 [ACK] Seq=106501 Ack=1 Win=131072 Len=1500 TSval=5255 TSecr=5227"
"5007","5.267418","10.1.0.8","10.1.0.11","TCP","6376","0.000000000","","","[TCP Retransmission] [TCP Retransmission] [TCP Retransmission] [TCP Retransmission] 49153  >  7015 [ACK] Seq=112501 Ack=1 Win=131072 Len=1500 TSval=5255 TSecr=5227"
"5008","5.267418","10.1.0.8","10.1.0.11","TCP","6376","0.000000000","","","[TCP Retransmission] [TCP Retransmission] [TCP Retransmission] [TCP Retransmission] 49153  >  7015 [ACK] Seq=118501 Ack=1 Win=131072 Len=1500 TSval=5255 TSecr=5227"
"5009","5.267418","10.1.0.8","10.1.0.11","TCP","6376","0.000000000","","","[TCP Retransmission] [TCP Retransmission] [TCP Retransmission] [TCP Retransmission] 49153  >  7015 [ACK] Seq=124501 Ack=1 Win=131072 Len=1500 TSval=5255 TSecr=5228"
"5010","5.267418","10.1.0.8","10.1.0.11","TCP","6376","0.000000000","","","[TCP Retransmission] [TCP Retransmission] [TCP Retransmission] [TCP Retransmission] 49153  >  7015 [ACK] Seq=130501 Ack=1 Win=131072 Len=1500 TSval=5255 TSecr=5228"
"5011","5.267418","10.1.0.8","10.1.0.11","TCP","6376","0.000000000","","","[TCP Retransmission] [TCP Retransmission] [TCP Retransmission] [TCP Retransmission] 49153  >  7015 [ACK] Seq=136501 Ack=1 Win=131072 Len=1500 TSval=5255 TSecr=5228"
"5012","5.267418","10.1.0.8","10.1.0.11","TCP","6376","0.000000000","","","[TCP Retransmission] [TCP Retransmission] [TCP Retransmission] [TCP Retransmission] 49153  >  7015 [ACK] Seq=142501 Ack=1 Win=131072 Len=1500 TSval=5255 TSecr=5228"
"5013","5.267418","10.1.0.8","10.1.0.11","TCP","6376","0.000000000","","","[TCP Retransmission] [TCP Retransmission] [TCP Retransmission] [TCP Retransmission] 49153  >  7015 [ACK] Seq=148501 Ack=1 Win=131072 Len=1500 TSval=5255 TSecr=5228"
"5014","5.267418","10.1.0.8","10.1.0.11","TCP","6376","0.000000000","","","[TCP Retransmission] [TCP Retransmission] [TCP Retransmission] [TCP Retransmission] 49153  >  7015 [ACK] Seq=154501 Ack=1 Win=131072 Len=1500 TSval=5255 TSecr=5229"
"5015","5.267418","10.1.0.8","10.1.0.11","TCP","6376","0.000000000","","","[TCP Retransmission] [TCP Retransmission] [TCP Retransmission] [TCP Retransmission] 49153  >  7015 [ACK] Seq=160501 Ack=1 Win=131072 Len=1500 TSval=5255 TSecr=5229"
"5125","5.286516","10.1.0.8","10.1.0.11","TCP","2504","0.019098000","","","7014  >  49160 [ACK] Seq=1 Ack=192001 Win=131072 Len=0 TSval=5046 TSecr=5044"
"5126","5.286516","10.1.0.8","10.1.0.11","TCP","134","0.000000000","","0.252293000","7014  >  49160 [ACK] Seq=1 Ack=193001 Win=131072 Len=0 TSval=5246 TSecr=5046"
"5337","5.309873","10.1.0.11","10.1.0.8","TCP","1592","0.023357000","-37 dBm","0.048352000,0.048352000,0.048352000,0.048352000,0.048352000,0.048352000,0.048352000,0.048352000,0.048352000,0.048352000,0.048352000,0.048352000,0.048352000,0.048352000,0.048352000,0.048352000,0.048352000,0.048352000,0.048352000,0.048352000","7015  >  49153 [ACK] Seq=1 Ack=162001 Win=131072 Len=0 TSval=5282 TSecr=5255"
"5379","5.315252","10.1.0.8","10.1.0.11","TCP","6376","0.005379000","","","49153  >  7015 [ACK] Seq=166501 Ack=1 Win=131072 Len=1500 TSval=5322 TSecr=5280"
"5380","5.315252","10.1.0.8","10.1.0.11","TCP","6376","0.000000000","","","49153  >  7015 [ACK] Seq=172501 Ack=1 Win=131072 Len=1500 TSval=5322 TSecr=5280"
"5381","5.315252","10.1.0.8","10.1.0.11","TCP","6376","0.000000000","","","49153  >  7015 [ACK] Seq=178501 Ack=1 Win=131072 Len=1500 TSval=5322 TSecr=5280"
"5382","5.315252","10.1.0.8","10.1.0.11","TCP","6376","0.000000000","","","49153  >  7015 [ACK] Seq=184501 Ack=1 Win=131072 Len=1500 TSval=5322 TSecr=5280"
"5383","5.315252","10.1.0.8","10.1.0.11","TCP","6376","0.000000000","","","49153  >  7015 [ACK] Seq=190501 Ack=1 Win=131072 Len=1500 TSval=5322 TSecr=5281"
"5384","5.315252","10.1.0.8","10.1.0.11","TCP","6376","0.000000000","","","49153  >  7015 [ACK] Seq=196501 Ack=1 Win=131072 Len=1500 TSval=5322 TSecr=5281"
"5385","5.315252","10.1.0.8","10.1.0.11","TCP","6376","0.000000000","","","49153  >  7015 [ACK] Seq=202501 Ack=1 Win=131072 Len=1500 TSval=5322 TSecr=5281"
"5386","5.315252","10.1.0.8","10.1.0.11","TCP","6376","0.000000000","","","49153  >  7015 [ACK] Seq=208501 Ack=1 Win=131072 Len=1500 TSval=5322 TSecr=5281"
"5387","5.315252","10.1.0.8","10.1.0.11","TCP","6376","0.000000000","","","49153  >  7015 [ACK] Seq=214501 Ack=1 Win=131072 Len=1500 TSval=5322 TSecr=5281"
"5388","5.315252","10.1.0.8","10.1.0.11","TCP","6376","0.000000000","","","49153  >  7015 [ACK] Seq=220501 Ack=1 Win=131072 Len=1500 TSval=5322 TSecr=5282"
"5389","5.315252","10.1.0.8","10.1.0.11","TCP","3224","0.000000000","","","49153  >  7015 [ACK] Seq=223501 Ack=1 Win=131072 Len=1500 TSval=5322 TSecr=5282"
"5513","5.339489","10.1.0.8","10.1.0.11","TCP","6376","0.024237000","","","[TCP Retransmission] [TCP Retransmission] [TCP Retransmission] [TCP Retransmission] 49153  >  7015 [ACK] Seq=166501 Ack=1 Win=131072 Len=1500 TSval=5322 TSecr=5280"
"5514","5.339489","10.1.0.8","10.1.0.11","TCP","6376","0.000000000","","","[TCP Retransmission] [TCP Retransmission] [TCP Retransmission] [TCP Retransmission] 49153  >  7015 [ACK] Seq=172501 Ack=1 Win=131072 Len=1500 TSval=5322 TSecr=5280"
"5515","5.339489","10.1.0.8","10.1.0.11","TCP","6376","0.000000000","","","[TCP Retransmission] [TCP Retransmission] [TCP Retransmission] [TCP Retransmission] 49153  >  7015 [ACK] Seq=178501 Ack=1 Win=131072 Len=1500 TSval=5322 TSecr=5280"
"5516","5.339489","10.1.0.8","10.1.0.11","TCP","6376","0.000000000","","","[TCP Retransmission] [TCP Retransmission] [TCP Retransmission] [TCP Retransmission] 49153  >  7015 [ACK] Seq=184501 Ack=1 Win=131072 Len=1500 TSval=5322 TSecr=5280"
"5517","5.339489","10.1.0.8","10.1.0.11","TCP","6376","0.000000000","","","[TCP Retransmission] [TCP Retransmission] [TCP Retransmission] [TCP Retransmission] 49153  >  7015 [ACK] Seq=190501 Ack=1 Win=131072 Len=1500 TSval=5322 TSecr=5281"
"5518","5.339489","10.1.0.8","10.1.0.11","TCP","6376","0.000000000","","","[TCP Retransmission] [TCP Retransmission] [TCP Retransmission] [TCP Retransmission] 49153  >  7015 [ACK] Seq=196501 Ack=1 Win=131072 Len=1500 TSval=5322 TSecr=5281"
"5519","5.339489","10.1.0.8","10.1.0.11","TCP","6376","0.000000000","","","[TCP Retransmission] [TCP Retransmission] [TCP Retransmission] [TCP Retransmission] 49153  >  7015 [ACK] Seq=202501 Ack=1 Win=131072 Len=1500 TSval=5322 TSecr=5281"
"5520","5.339489","10.1.0.8","10.1.0.11","TCP","6376","0.000000000","","","[TCP Retransmission] [TCP Retransmission] [TCP Retransmission] [TCP Retransmission] 49153  >  7015 [ACK] Seq=208501 Ack=1 Win=131072 Len=1500 TSval=5322 TSecr=5281"
"5521","5.339489","10.1.0.8","10.1.0.11","TCP","6376","0.000000000","","","[TCP Retransmission] [TCP Retransmission] [TCP Retransmission] [TCP Retransmission] 49153  >  7015 [ACK] Seq=214501 Ack=1 Win=131072 Len=1500 TSval=5322 TSecr=5281"
"5522","5.339489","10.1.0.8","10.1.0.11","TCP","6376","0.000000000","","","[TCP Retransmission] [TCP Retransmission] [TCP Retransmission] [TCP Retransmission] 49153  >  7015 [ACK] Seq=220501 Ack=1 Win=131072 Len=1500 TSval=5322 TSecr=5282"
"5523","5.339489","10.1.0.8","10.1.0.11","TCP","3224","0.000000000","","","[TCP Retransmission] [TCP Retransmission] 49153  >  7015 [ACK] Seq=223501 Ack=1 Win=131072 Len=1500 TSval=5322 TSecr=5282"
"5633","5.358473","10.1.0.11","10.1.0.8","TCP","1668","0.018984000","-37 dBm","0.043221000,0.043221000,0.043221000,0.043221000,0.043221000,0.043221000,0.043221000,0.043221000,0.043221000,0.043221000,0.043221000,0.043221000,0.043221000,0.043221000,0.043221000,0.043221000,0.043221000,0.043221000,0.043221000,0.043221000,0.043221000","7015  >  49153 [ACK] Seq=1 Ack=225001 Win=131072 Len=0 TSval=5354 TSecr=5322"
"5644","5.361546","10.1.0.8","10.1.0.11","TCP","6376","0.003073000","","","49153  >  7015 [ACK] Seq=229501 Ack=1 Win=131072 Len=1500 TSval=5370 TSecr=5352"
"5645","5.361546","10.1.0.8","10.1.0.11","TCP","6376","0.000000000","","","49153  >  7015 [ACK] Seq=235501 Ack=1 Win=131072 Len=1500 TSval=5370 TSecr=5352"
"5646","5.361546","10.1.0.8","10.1.0.11","TCP","6376","0.000000000","","","49153  >  7015 [ACK] Seq=241501 Ack=1 Win=131072 Len=1500 TSval=5370 TSecr=5352"
"5647","5.361546","10.1.0.8","10.1.0.11","TCP","6376","0.000000000","","","49153  >  7015 [ACK] Seq=247501 Ack=1 Win=131072 Len=1500 TSval=5370 TSecr=5352"
"5648","5.361546","10.1.0.8","10.1.0.11","TCP","6376","0.000000000","","","49153  >  7015 [ACK] Seq=253501 Ack=1 Win=131072 Len=1500 TSval=5370 TSecr=5353"
"5649","5.361546","10.1.0.8","10.1.0.11","TCP","6376","0.000000000","","","49153  >  7015 [ACK] Seq=259501 Ack=1 Win=131072 Len=1500 TSval=5370 TSecr=5353"
"5650","5.361546","10.1.0.8","10.1.0.11","TCP","6376","0.000000000","","","49153  >  7015 [ACK] Seq=265501 Ack=1 Win=131072 Len=1500 TSval=5370 TSecr=5353"
"5651","5.361546","10.1.0.8","10.1.0.11","TCP","6376","0.000000000","","","49153  >  7015 [ACK] Seq=271501 Ack=1 Win=131072 Len=1500 TSval=5370 TSecr=5353"
"5652","5.361546","10.1.0.8","10.1.0.11","TCP","6376","0.000000000","","","49153  >  7015 [ACK] Seq=277501 Ack=1 Win=131072 Len=1500 TSval=5370 TSecr=5353"
"5653","5.361546","10.1.0.8","10.1.0.11","TCP","6376","0.000000000","","","49153  >  7015 [ACK] Seq=283501 Ack=1 Win=131072 Len=1500 TSval=5370 TSecr=5354"
"5654","5.361546","10.1.0.8","10.1.0.11","TCP","6376","0.000000000","","","49153  >  7015 [ACK] Seq=289501 Ack=1 Win=131072 Len=1500 TSval=5370 TSecr=5354"
"5767","5.387303","10.1.0.8","10.1.0.11","TCP","6376","0.025757000","","","[TCP Retransmission] [TCP Retransmission] [TCP Retransmission] [TCP Retransmission] 49153  >  7015 [ACK] Seq=229501 Ack=1 Win=131072 Len=1500 TSval=5370 TSecr=5352"
"5768","5.387303","10.1.0.8","10.1.0.11","TCP","6376","0.000000000","","","[TCP Retransmission] [TCP Retransmission] [TCP Retransmission] [TCP Retransmission] 49153  >  7015 [ACK] Seq=235501 Ack=1 Win=131072 Len=1500 TSval=5370 TSecr=5352"
"5769","5.387303","10.1.0.8","10.1.0.11","TCP","6376","0.000000000","","","[TCP Retransmission] [TCP Retransmission] [TCP Retransmission] [TCP Retransmission] 49153  >  7015 [ACK] Seq=241501 Ack=1 Win=131072 Len=1500 TSval=5370 TSecr=5352"
"5770","5.387303","10.1.0.8","10.1.0.11","TCP","6376","0.000000000","","","[TCP Retransmission] [TCP Retransmission] [TCP Retransmission] [TCP Retransmission] 49153  >  7015 [ACK] Seq=247501 Ack=1 Win=131072 Len=1500 TSval=5370 TSecr=5352"
"5771","5.387303","10.1.0.8","10.1.0.11","TCP","6376","0.000000000","","","[TCP Retransmission] [TCP Retransmission] [TCP Retransmission] [TCP Retransmission] 49153  >  7015 [ACK] Seq=253501 Ack=1 Win=131072 Len=1500 TSval=5370 TSecr=5353"
"5772","5.387303","10.1.0.8","10.1.0.11","TCP","6376","0.000000000","","","[TCP Retransmission] [TCP Retransmission] [TCP Retransmission] [TCP Retransmission] 49153  >  7015 [ACK] Seq=259501 Ack=1 Win=131072 Len=1500 TSval=5370 TSecr=5353"
"5773","5.387303","10.1.0.8","10.1.0.11","TCP","6376","0.000000000","","","[TCP Retransmission] [TCP Retransmission] [TCP Retransmission] [TCP Retransmission] 49153  >  7015 [ACK] Seq=265501 Ack=1 Win=131072 Len=1500 TSval=5370 TSecr=5353"
"5774","5.387303","10.1.0.8","10.1.0.11","TCP","6376","0.000000000","","","[TCP Retransmission] [TCP Retransmission] [TCP Retransmission] [TCP Retransmission] 49153  >  7015 [ACK] Seq=271501 Ack=1 Win=131072 Len=1500 TSval=5370 TSecr=5353"
"5775","5.387303","10.1.0.8","10.1.0.11","TCP","6376","0.000000000","","","[TCP Retransmission] [TCP Retransmission] [TCP Retransmission] [TCP Retransmission] 49153  >  7015 [ACK] Seq=277501 Ack=1 Win=131072 Len=1500 TSval=5370 TSecr=5353"
"5776","5.387303","10.1.0.8","10.1.0.11","TCP","6376","0.000000000","","","[TCP Retransmission] [TCP Retransmission] [TCP Retransmission] [TCP Retransmission] 49153  >  7015 [ACK] Seq=283501 Ack=1 Win=131072 Len=1500 TSval=5370 TSecr=5354"
"5777","5.387303","10.1.0.8","10.1.0.11","TCP","6376","0.000000000","","","[TCP Retransmission] [TCP Retransmission] [TCP Retransmission] [TCP Retransmission] 49153  >  7015 [ACK] Seq=289501 Ack=1 Win=131072 Len=1500 TSval=5370 TSecr=5354"
"5829","5.396663","10.1.0.11","10.1.0.8","TCP","1744","0.009360000","-37 dBm","0.035117000,0.035117000,0.035117000,0.035117000,0.035117000,0.035117000,0.035117000,0.035117000,0.035117000,0.035117000,0.035117000,0.035117000,0.035117000,0.035117000,0.035117000,0.035117000,0.035117000,0.035117000,0.035117000,0.035117000,0.035117000,0.035117000","7015  >  49153 [ACK] Seq=1 Ack=291001 Win=131072 Len=0 TSval=5402 TSecr=5370"
"5899","5.410981","10.1.0.8","10.1.0.11","TCP","6376","0.014318000","","","49153  >  7015 [ACK] Seq=295501 Ack=1 Win=131072 Len=1500 TSval=5409 TSecr=5400"
"5900","5.410981","10.1.0.8","10.1.0.11","TCP","6376","0.000000000","","","49153  >  7015 [ACK] Seq=301501 Ack=1 Win=131072 Len=1500 TSval=5409 TSecr=5400"
"5901","5.410981","10.1.0.8","10.1.0.11","TCP","6376","0.000000000","","","49153  >  7015 [ACK] Seq=307501 Ack=1 Win=131072 Len=1500 TSval=5409 TSecr=5400"
"5902","5.410981","10.1.0.8","10.1.0.11","TCP","6376","0.000000000","","","49153  >  7015 [ACK] Seq=313501 Ack=1 Win=131072 Len=1500 TSval=5409 TSecr=5400"
"5903","5.410981","10.1.0.8","10.1.0.11","TCP","6376","0.000000000","","","49153  >  7015 [ACK] Seq=319501 Ack=1 Win=131072 Len=1500 TSval=5409 TSecr=5400"
"5904","5.410981","10.1.0.8","10.1.0.11","TCP","6376","0.000000000","","","49153  >  7015 [ACK] Seq=325501 Ack=1 Win=131072 Len=1500 TSval=5409 TSecr=5401"
"5905","5.410981","10.1.0.8","10.1.0.11","TCP","6376","0.000000000","","","49153  >  7015 [ACK] Seq=331501 Ack=1 Win=131072 Len=1500 TSval=5409 TSecr=5401"
"5906","5.410981","10.1.0.8","10.1.0.11","TCP","6376","0.000000000","","","49153  >  7015 [ACK] Seq=337501 Ack=1 Win=131072 Len=1500 TSval=5409 TSecr=5401"
"5907","5.410981","10.1.0.8","10.1.0.11","TCP","6528","0.000000000","","","49153  >  7015 [ACK] Seq=344001 Ack=1 Win=131072 Len=1000 TSval=5411 TSecr=5402"
"5908","5.410981","10.1.0.8","10.1.0.11","TCP","6528","0.000000000","","","49153  >  7015 [ACK] Seq=350001 Ack=1 Win=131072 Len=1000 TSval=5416 TSecr=5402"
"5909","5.410981","10.1.0.8","10.1.0.11","TCP","6528","0.000000000","","","49153  >  7015 [ACK] Seq=356001 Ack=1 Win=131072 Len=1000 TSval=5421 TSecr=5402"
"5910","5.410981","10.1.0.8","10.1.0.11","TCP","2224","0.000000000","","","49153  >  7015 [ACK] Seq=358001 Ack=1 Win=131072 Len=1000 TSval=5423 TSecr=5402"
"6077","5.441938","10.1.0.8","10.1.0.11","TCP","6376","0.030957000","","","[TCP Retransmission] [TCP Retransmission] [TCP Retransmission] [TCP Retransmission] 49153  >  7015 [ACK] Seq=295501 Ack=1 Win=131072 Len=1500 TSval=5409 TSecr=5400"
"6078","5.441938","10.1.0.8","10.1.0.11","TCP","6376","0.000000000","","","[TCP Retransmission] [TCP Retransmission] [TCP Retransmission] [TCP Retransmission] 49153  >  7015 [ACK] Seq=301501 Ack=1 Win=131072 Len=1500 TSval=5409 TSecr=5400"
"6079","5.441938","10.1.0.8","10.1.0.11","TCP","6376","0.000000000","","","[TCP Retransmission] [TCP Retransmission] [TCP Retransmission] [TCP Retransmission] 49153  >  7015 [ACK] Seq=307501 Ack=1 Win=131072 Len=1500 TSval=5409 TSecr=5400"
"6080","5.441938","10.1.0.8","10.1.0.11","TCP","6376","0.000000000","","","[TCP Retransmission] [TCP Retransmission] [TCP Retransmission] [TCP Retransmission] 49153  >  7015 [ACK] Seq=313501 Ack=1 Win=131072 Len=1500 TSval=5409 TSecr=5400"
"6081","5.441938","10.1.0.8","10.1.0.11","TCP","6376","0.000000000","","","[TCP Retransmission] [TCP Retransmission] [TCP Retransmission] [TCP Retransmission] 49153  >  7015 [ACK] Seq=319501 Ack=1 Win=131072 Len=1500 TSval=5409 TSecr=5400"
"6082","5.441938","10.1.0.8","10.1.0.11","TCP","6376","0.000000000","","","[TCP Retransmission] [TCP Retransmission] [TCP Retransmission] [TCP Retransmission] 49153  >  7015 [ACK] Seq=325501 Ack=1 Win=131072 Len=1500 TSval=5409 TSecr=5401"
"6083","5.441938","10.1.0.8","10.1.0.11","TCP","6376","0.000000000","","","[TCP Retransmission] [TCP Retransmission] [TCP Retransmission] [TCP Retransmission] 49153  >  7015 [ACK] Seq=331501 Ack=1 Win=131072 Len=1500 TSval=5409 TSecr=5401"
"6084","5.441938","10.1.0.8","10.1.0.11","TCP","6376","0.000000000","","","[TCP Retransmission] [TCP Retransmission] [TCP Retransmission] [TCP Retransmission] 49153  >  7015 [ACK] Seq=337501 Ack=1 Win=131072 Len=1500 TSval=5409 TSecr=5401"
"6085","5.441938","10.1.0.8","10.1.0.11","TCP","6528","0.000000000","","","[TCP Retransmission] [TCP Retransmission] [TCP Retransmission] [TCP Retransmission] [TCP Retransmission] [TCP Retransmission] 49153  >  7015 [ACK] Seq=344001 Ack=1 Win=131072 Len=1000 TSval=5411 TSecr=5402"
"6086","5.441938","10.1.0.8","10.1.0.11","TCP","6528","0.000000000","","","[TCP Retransmission] [TCP Retransmission] [TCP Retransmission] [TCP Retransmission] [TCP Retransmission] [TCP Retransmission] 49153  >  7015 [ACK] Seq=350001 Ack=1 Win=131072 Len=1000 TSval=5416 TSecr=5402"
"6087","5.441938","10.1.0.8","10.1.0.11","TCP","6528","0.000000000","","","[TCP Retransmission] [TCP Retransmission] [TCP Retransmission] [TCP Retransmission] [TCP Retransmission] [TCP Retransmission] 49153  >  7015 [ACK] Seq=356001 Ack=1 Win=131072 Len=1000 TSval=5421 TSecr=5402"
"6088","5.441938","10.1.0.8","10.1.0.11","TCP","2224","0.000000000","","","[TCP Retransmission] [TCP Retransmission] 49153  >  7015 [ACK] Seq=358001 Ack=1 Win=131072 Len=1000 TSval=5423 TSecr=5402"
"6089","5.441938","10.1.0.8","10.1.0.11","TCP","1134","0.000000000","","","49153  >  7015 [ACK] Seq=359001 Ack=1 Win=131072 Len=1000 TSval=5423 TSecr=5402"
"8194","5.623298","10.1.0.8","10.1.0.11","TCP","134","0.181360000","","","[TCP Dup ACK 5126#1] 7014  >  49160 [ACK] Seq=1 Ack=193001 Win=131072 Len=0 TSval=5246 TSecr=5046"
"8223","5.628864","10.1.0.11","10.1.0.8","TCP","6376","0.005566000","-37 dBm","","49160  >  7014 [ACK] Seq=197501 Ack=1 Win=131072 Len=1500 TSval=5635 TSecr=5246"
"8224","5.628864","10.1.0.11","10.1.0.8","TCP","6376","0.000000000","-37 dBm","","49160  >  7014 [ACK] Seq=203501 Ack=1 Win=131072 Len=1500 TSval=5635 TSecr=5246"
"8225","5.628864","10.1.0.11","10.1.0.8","TCP","6376","0.000000000","-37 dBm","","49160  >  7014 [ACK] Seq=209501 Ack=1 Win=131072 Len=1500 TSval=5635 TSecr=5246"
"8226","5.628864","10.1.0.11","10.1.0.8","TCP","6376","0.000000000","-37 dBm","","49160  >  7014 [ACK] Seq=215501 Ack=1 Win=131072 Len=1500 TSval=5635 TSecr=5246"
"8227","5.628864","10.1.0.11","10.1.0.8","TCP","6376","0.000000000","-37 dBm","","49160  >  7014 [ACK] Seq=221501 Ack=1 Win=131072 Len=1500 TSval=5635 TSecr=5246"
"8228","5.628864","10.1.0.11","10.1.0.8","TCP","6376","0.000000000","-37 dBm","","49160  >  7014 [ACK] Seq=227501 Ack=1 Win=131072 Len=1500 TSval=5635 TSecr=5246"
"8229","5.628864","10.1.0.11","10.1.0.8","TCP","7452","0.000000000","-37 dBm","","49160  >  7014 [ACK] Seq=235001 Ack=1 Win=131072 Len=1000 TSval=5635 TSecr=5246"
"8230","5.628864","10.1.0.11","10.1.0.8","TCP","5452","0.000000000","-37 dBm","","49160  >  7014 [ACK] Seq=240001 Ack=1 Win=131072 Len=1000 TSval=5639 TSecr=5246"
"8249","5.631339","10.1.0.11","10.1.0.8","TCP","5452","0.002475000","-37 dBm","","49160  >  7014 [ACK] Seq=245001 Ack=1 Win=131072 Len=1000 TSval=5643 TSecr=5246"
"8265","5.632876","10.1.0.11","10.1.0.8","TCP","2224","0.001537000","-37 dBm","","49160  >  7014 [ACK] Seq=247001 Ack=1 Win=131072 Len=1000 TSval=5644 TSecr=5246"
"8277","5.633852","10.1.0.11","10.1.0.8","TCP","1134","0.000976000","-37 dBm","","49160  >  7014 [ACK] Seq=248001 Ack=1 Win=131072 Len=1000 TSval=5645 TSecr=5246"
"8293","5.635642","10.1.0.11","10.1.0.8","TCP","2224","0.001790000","-37 dBm","","49160  >  7014 [ACK] Seq=250001 Ack=1 Win=131072 Len=1000 TSval=5647 TSecr=5246"
"8305","5.636810","10.1.0.11","10.1.0.8","TCP","2224","0.001168000","-37 dBm","","49160  >  7014 [ACK] Seq=252001 Ack=1 Win=131072 Len=1000 TSval=5648 TSecr=5246"
"8315","5.637570","10.1.0.11","10.1.0.8","TCP","1134","0.000760000","-37 dBm","","49160  >  7014 [ACK] Seq=253001 Ack=1 Win=131072 Len=1000 TSval=5649 TSecr=5246"
"8325","5.638330","10.1.0.11","10.1.0.8","TCP","1134","0.000760000","-37 dBm","","49160  >  7014 [ACK] Seq=254001 Ack=1 Win=131072 Len=1000 TSval=5650 TSecr=5246"
"8336","5.639176","10.1.0.11","10.1.0.8","TCP","1134","0.000846000","-37 dBm","","49160  >  7014 [ACK] Seq=255001 Ack=1 Win=131072 Len=1000 TSval=5651 TSecr=5246"
"8346","5.639937","10.1.0.11","10.1.0.8","TCP","1134","0.000761000","-37 dBm","","49160  >  7014 [ACK] Seq=256001 Ack=1 Win=131072 Len=1000 TSval=5652 TSecr=5246"
"8357","5.640801","10.1.0.11","10.1.0.8","TCP","1134","0.000864000","-37 dBm","","49160  >  7014 [ACK] Seq=257001 Ack=1 Win=131072 Len=1000 TSval=5652 TSecr=5246"
"8367","5.641561","10.1.0.11","10.1.0.8","TCP","1134","0.000760000","-37 dBm","","49160  >  7014 [ACK] Seq=258001 Ack=1 Win=131072 Len=1000 TSval=5653 TSecr=5246"
"8377","5.642321","10.1.0.11","10.1.0.8","TCP","1134","0.000760000","-37 dBm","","49160  >  7014 [ACK] Seq=259001 Ack=1 Win=131072 Len=1000 TSval=5654 TSecr=5246"
"8388","5.643167","10.1.0.11","10.1.0.8","TCP","1134","0.000846000","-37 dBm","","49160  >  7014 [ACK] Seq=260001 Ack=1 Win=131072 Len=1000 TSval=5655 TSecr=5246"
"8393","5.643510","10.1.0.8","10.1.0.11","TCP","2124","0.000343000","","0.014646000,0.014646000,0.014646000,0.014646000,0.014646000,0.014646000,0.014646000,0.014646000,0.014646000,0.014646000,0.014646000,0.014646000,0.014646000,0.014646000,0.014646000,0.014646000,0.014646000,0.012171000,0.012171000,0.010634000,0.009658000,0.007868000,0.006700000,0.005180000,0.003573000,0.001949000,0.000343000","7014  >  49160 [ACK] Seq=1 Ack=261001 Win=131072 Len=0 TSval=5655 TSecr=5654"
"8398","5.644311","10.1.0.11","10.1.0.8","TCP","1134","0.000801000","-37 dBm","","49160  >  7014 [ACK] Seq=261001 Ack=1 Win=131072 Len=1000 TSval=5656 TSecr=5246"
"8406","5.644919","10.1.0.11","10.1.0.8","TCP","1134","0.000608000","-37 dBm","","49160  >  7014 [ACK] Seq=262001 Ack=1 Win=131072 Len=1000 TSval=5656 TSecr=5246"
"8414","5.645527","10.1.0.11","10.1.0.8","TCP","1134","0.000608000","-37 dBm","","49160  >  7014 [ACK] Seq=263001 Ack=1 Win=131072 Len=1000 TSval=5657 TSecr=5246"
"8437","5.647685","10.1.0.11","10.1.0.8","TCP","2224","0.002158000","-37 dBm","","49160  >  7014 [ACK] Seq=265001 Ack=1 Win=131072 Len=1000 TSval=5659 TSecr=5246"
"8449","5.648965","10.1.0.11","10.1.0.8","TCP","2224","0.001280000","-37 dBm","","49160  >  7014 [ACK] Seq=267001 Ack=1 Win=131072 Len=1000 TSval=5660 TSecr=5246"
