"No.","Time","Source","Destination","Protocol","Length","Time delta from previous displayed frame","Signal strength (dBm)","The RTT to ACK the segment was","Info"
"83","0.438191","10.1.0.11","10.1.0.1","TCP","138","0.000000000","","","49153  >  7000 [SYN] Seq=0 Win=65535 Len=0 TSval=450 TSecr=0 WS=4 SACK_PERM=1"
"86","0.438466","10.1.0.1","10.1.0.11","TCP","138","0.000275000","-43 dBm","0.000275000","7000  >  49153 [SYN, ACK] Seq=0 Ack=1 Win=65535 Len=0 TSval=450 TSecr=450 WS=4 SACK_PERM=1"
"89","0.438612","10.1.0.11","10.1.0.1","TCP","134","0.000146000","","0.000146000","49153  >  7000 [ACK] Seq=1 Ack=1 Win=131072 Len=0 TSval=450 TSecr=450"
"90","0.438778","10.1.0.11","10.1.0.1","TCP","134","0.000166000","","","[TCP Dup ACK 89#1] 49153  >  7000 [ACK] Seq=1 Ack=1 Win=131072 Len=0 TSval=450 TSecr=450"
"93","0.439107","10.1.0.1","10.1.0.11","TCP","138","0.000329000","-43 dBm","","49153  >  7001 [SYN] Seq=0 Win=65535 Len=0 TSval=450 TSecr=0 WS=4 SACK_PERM=1"
"96","0.439262","10.1.0.11","10.1.0.1","TCP","138","0.000155000","","0.000155000","7001  >  49153 [SYN, ACK] Seq=0 Ack=1 Win=65535 Len=0 TSval=451 TSecr=450 WS=4 SACK_PERM=1"
"99","0.439528","10.1.0.1","10.1.0.11","TCP","134","0.000266000","-43 dBm","0.000266000","49153  >  7001 [ACK] Seq=1 Ack=1 Win=131072 Len=0 TSval=451 TSecr=451"
"1030","4.839781","10.1.0.11","10.1.0.1","Gryphon","1134","4.400253000","","",""
"1046","4.841029","10.1.0.11","10.1.0.1","Gryphon","2224","0.001248000","","",""
"1066","4.842933","10.1.0.11","10.1.0.1","Gryphon","2224","0.001904000","","",""
"1093","4.846189","10.1.0.11","10.1.0.1","Gryphon","4376","0.003256000","","",""
"1113","4.848750","10.1.0.11","10.1.0.1","Gryphon","3300","0.002561000","","",""
"1133","4.850942","10.1.0.11","10.1.0.1","Gryphon","2224","0.002192000","","",""
"1177","4.859286","10.1.0.1","10.1.0.11","TCP","6528","0.008344000","-43 dBm","","49153  >  7001 [ACK] Seq=5001 Ack=1 Win=131072 Len=1000 TSval=4856 TSecr=451"
"1178","4.859286","10.1.0.1","10.1.0.11","TCP","1136","0.000000000","-43 dBm","","49153  >  7001 [ACK] Seq=6001 Ack=1 Win=131072 Len=1000 TSval=4857 TSecr=451"
"1179","4.859286","10.1.0.1","10.1.0.11","TCP","6528","0.000000000","-43 dBm","","49153  >  7001 [ACK] Seq=12001 Ack=1 Win=131072 Len=1000 TSval=4861 TSecr=451"
"1180","4.859286","10.1.0.1","10.1.0.11","TCP","2224","0.000000000","-43 dBm","","49153  >  7001 [ACK] Seq=14001 Ack=1 Win=131072 Len=1000 TSval=4863 TSecr=451"
"1205","4.861690","10.1.0.11","10.1.0.1","Gryphon","1134","0.002404000","","",""
"1876","4.924218","10.1.0.11","10.1.0.1","TCP","680","0.062528000","","0.064932000,0.064932000,0.064932000,0.064932000,0.064932000,0.064932000,0.064932000,0.064932000","7001  >  49153 [ACK] Seq=1 Ack=15001 Win=131072 Len=0 TSval=4871 TSecr=4862"
"2031","4.949751","10.1.0.1","10.1.0.11","TCP","6376","0.025533000","-43 dBm","","49153  >  7001 [ACK] Seq=19501 Ack=1 Win=131072 Len=1500 TSval=4936 TSecr=4871"
"2032","4.949751","10.1.0.1","10.1.0.11","TCP","6376","0.000000000","-43 dBm","","49153  >  7001 [ACK] Seq=25501 Ack=1 Win=131072 Len=1500 TSval=4936 TSecr=4871"
"2033","4.949751","10.1.0.1","10.1.0.11","TCP","6376","0.000000000","-43 dBm","","49153  >  7001 [ACK] Seq=31501 Ack=1 Win=131072 Len=1500 TSval=4936 TSecr=4871"
"2034","4.949751","10.1.0.1","10.1.0.11","TCP","6376","0.000000000","-43 dBm","","49153  >  7001 [ACK] Seq=37501 Ack=1 Win=131072 Len=1500 TSval=4936 TSecr=4871"
"2035","4.949751","10.1.0.1","10.1.0.11","TCP","6376","0.000000000","-43 dBm","","49153  >  7001 [ACK] Seq=43501 Ack=1 Win=131072 Len=1500 TSval=4936 TSecr=4871"
"3049","5.056513","10.1.0.1","10.1.0.11","TCP","680","0.106762000","-43 dBm","0.216732000,0.215484000,0.213580000,0.210324000,0.210324000,0.207763000,0.205571000,0.194823000","7000  >  49153 [ACK] Seq=1 Ack=15001 Win=131072 Len=0 TSval=4873 TSecr=4861"
"3056","5.056963","10.1.0.11","10.1.0.1","Gryphon","6376","0.000450000","","",""
"3057","5.056963","10.1.0.11","10.1.0.1","Gryphon","6376","0.000000000","","","[TCP Previous segment not captured] "
"3058","5.056963","10.1.0.11","10.1.0.1","Gryphon","6376","0.000000000","","","[TCP Previous segment not captured] "
"3059","5.056963","10.1.0.11","10.1.0.1","Gryphon","6376","0.000000000","","","[TCP Previous segment not captured] "
"3060","5.056963","10.1.0.11","10.1.0.1","Gryphon","6376","0.000000000","","","[TCP Previous segment not captured] "
"3552","5.102701","10.1.0.1","10.1.0.11","TCP","832","0.045738000","-43 dBm","0.045738000,0.045738000,0.045738000,0.045738000,0.045738000","[TCP ACKed unseen segment] [TCP ACKed unseen segment] 7000  >  49153 [ACK] Seq=1 Ack=45001 Win=131072 Len=0 TSval=5070 TSecr=5068"
"3568","5.104147","10.1.0.11","10.1.0.1","Gryphon","6376","0.001446000","","","[TCP Previous segment not captured] "
"3569","5.104147","10.1.0.11","10.1.0.1","Gryphon","6376","0.000000000","","","[TCP Previous segment not captured] "
"3570","5.104147","10.1.0.11","10.1.0.1","Gryphon","6376","0.000000000","","","[TCP Previous segment not captured] "
"3571","5.104147","10.1.0.11","10.1.0.1","Gryphon","6376","0.000000000","","","[TCP Previous segment not captured] "
"3572","5.104147","10.1.0.11","10.1.0.1","Gryphon","6376","0.000000000","","","[TCP Previous segment not captured] "
"3573","5.104147","10.1.0.11","10.1.0.1","Gryphon","6376","0.000000000","","","[TCP Previous segment not captured] "
"3574","5.104147","10.1.0.11","10.1.0.1","Gryphon","6376","0.000000000","","","[TCP Previous segment not captured] "
"3575","5.104147","10.1.0.11","10.1.0.1","Gryphon","6376","0.000000000","","","[TCP Previous segment not captured] "
"3576","5.104147","10.1.0.11","10.1.0.1","Gryphon","6376","0.000000000","","","[TCP Previous segment not captured] "
"3577","5.104147","10.1.0.11","10.1.0.1","Gryphon","3224","0.000000000","","","[TCP Previous segment not captured] "
"3794","5.124475","10.1.0.1","10.1.0.11","TCP","1516","0.020328000","-43 dBm","0.020328000,0.020328000,0.020328000,0.020328000,0.020328000,0.020328000,0.020328000,0.020328000,0.020328000,0.020328000","[TCP ACKed unseen segment] 7000  >  49153 [ACK] Seq=1 Ack=102001 Win=131072 Len=0 TSval=5118 TSecr=5114"
"3803","5.125077","10.1.0.11","10.1.0.1","Gryphon","6376","0.000602000","","",""
"3804","5.125077","10.1.0.11","10.1.0.1","Gryphon","6376","0.000000000","","","[TCP Previous segment not captured] "
"3805","5.125077","10.1.0.11","10.1.0.1","Gryphon","6376","0.000000000","","","[TCP Previous segment not captured] "
"3806","5.125077","10.1.0.11","10.1.0.1","Gryphon","6376","0.000000000","","","[TCP Previous segment not captured] "
"3807","5.125077","10.1.0.11","10.1.0.1","Gryphon","6376","0.000000000","","","[TCP Previous segment not captured] "
"3808","5.125077","10.1.0.11","10.1.0.1","Gryphon","6376","0.000000000","","","[TCP Previous segment not captured] "
"3809","5.125077","10.1.0.11","10.1.0.1","Gryphon","6376","0.000000000","","","[TCP Previous segment not captured] "
"3810","5.125077","10.1.0.11","10.1.0.1","Gryphon","6376","0.000000000","","","[TCP Previous segment not captured] "
"3811","5.125077","10.1.0.11","10.1.0.1","Gryphon","6376","0.000000000","","","[TCP Previous segment not captured] "
"3812","5.125077","10.1.0.11","10.1.0.1","Gryphon","6376","0.000000000","","","[TCP Previous segment not captured] "
"3837","5.129625","10.1.0.1","10.1.0.11","TCP","1592","0.004548000","-43 dBm","0.004548000,0.004548000,0.004548000,0.004548000,0.004548000,0.004548000,0.004548000,0.004548000,0.004548000,0.004548000","[TCP ACKed unseen segment] [TCP ACKed unseen segment] 7000  >  49153 [ACK] Seq=1 Ack=162001 Win=131072 Len=0 TSval=5139 TSecr=5136"
"3864","5.131846","10.1.0.11","10.1.0.1","Gryphon","6376","0.002221000","","","[TCP Previous segment not captured] "
"3865","5.131846","10.1.0.11","10.1.0.1","Gryphon","6376","0.000000000","","","[TCP Previous segment not captured] "
"3866","5.131846","10.1.0.11","10.1.0.1","Gryphon","7528","0.000000000","","","[TCP Previous segment not captured] "
"3867","5.131846","10.1.0.11","10.1.0.1","Gryphon","1134","0.000000000","","","[TCP Previous segment not captured] "
"3892","5.136956","10.1.0.11","10.1.0.1","Gryphon","6528","0.005110000","","",""
"3893","5.136956","10.1.0.11","10.1.0.1","Gryphon","1134","0.000000000","","",""
"3909","5.138848","10.1.0.11","10.1.0.1","Gryphon","2224","0.001892000","","",""
"3921","5.139825","10.1.0.11","10.1.0.1","Gryphon","1134","0.000977000","","",""
"3933","5.140737","10.1.0.11","10.1.0.1","Gryphon","1134","0.000912000","","",""
"3949","5.142302","10.1.0.11","10.1.0.1","Gryphon","2224","0.001565000","","",""
"3959","5.143370","10.1.0.11","10.1.0.1","TCP","2224","0.001068000","","","[TCP Retransmission] [TCP Retransmission] 49153  >  7000 [ACK] Seq=194001 Ack=1 Win=131072 Len=1000 TSval=5153 TSecr=5139"
"3960","5.143370","10.1.0.11","10.1.0.1","Gryphon","2224","0.000000000","","",""
"3962","5.143622","10.1.0.11","10.1.0.1","TCP","2224","0.000252000","","","[TCP Out-Of-Order] [TCP Out-Of-Order] 49153  >  7000 [ACK] Seq=194001 Ack=1 Win=131072 Len=1000 TSval=5153 TSecr=5139"
"3974","5.145094","10.1.0.11","10.1.0.1","Gryphon","2224","0.001472000","","",""
"3986","5.146166","10.1.0.11","10.1.0.1","Gryphon","1134","0.001072000","","",""
"3998","5.147079","10.1.0.11","10.1.0.1","Gryphon","1134","0.000913000","","",""
"4010","5.147991","10.1.0.11","10.1.0.1","Gryphon","1134","0.000912000","","",""
"4022","5.149044","10.1.0.11","10.1.0.1","Gryphon","2224","0.001053000","","",""
"4034","5.150052","10.1.0.11","10.1.0.1","Gryphon","1134","0.001008000","","",""
"4046","5.150964","10.1.0.11","10.1.0.1","Gryphon","1134","0.000912000","","",""
"4058","5.151876","10.1.0.11","10.1.0.1","Gryphon","1134","0.000912000","","",""
"4070","5.152789","10.1.0.11","10.1.0.1","Gryphon","1134","0.000913000","","",""
"4082","5.153797","10.1.0.11","10.1.0.1","Gryphon","2224","0.001008000","","",""
"4098","5.155149","10.1.0.11","10.1.0.1","Gryphon","1134","0.001352000","","",""
"4110","5.156061","10.1.0.11","10.1.0.1","Gryphon","1134","0.000912000","","",""
"4122","5.157101","10.1.0.11","10.1.0.1","Gryphon","2224","0.001040000","","",""
"4134","5.158078","10.1.0.11","10.1.0.1","Gryphon","1134","0.000977000","","",""
"4146","5.158990","10.1.0.11","10.1.0.1","Gryphon","1134","0.000912000","","",""
"4158","5.159929","10.1.0.11","10.1.0.1","Gryphon","1134","0.000939000","","",""
"4170","5.160841","10.1.0.11","10.1.0.1","Gryphon","1134","0.000912000","","",""
"4182","5.161849","10.1.0.11","10.1.0.1","Gryphon","2224","0.001008000","","",""
"4194","5.162857","10.1.0.11","10.1.0.1","Gryphon","1134","0.001008000","","",""
"4206","5.163770","10.1.0.11","10.1.0.1","Gryphon","1134","0.000913000","","",""
"4218","5.164682","10.1.0.11","10.1.0.1","Gryphon","1134","0.000912000","","",""
"4244","5.167104","10.1.0.11","10.1.0.1","Gryphon","2224","0.002422000","","",""
"4281","5.172424","10.1.0.1","10.1.0.11","TCP","1060","0.005320000","-43 dBm","0.040578000,0.040578000,0.040578000,0.035468000,0.035468000,0.035468000,0.035468000,0.033576000,0.031687000","[TCP ACKed unseen segment] 7000  >  49153 [ACK] Seq=1 Ack=193001 Win=131072 Len=0 TSval=5153 TSecr=5151"
"4282","5.172424","10.1.0.1","10.1.0.11","TCP","1212","0.000000000","-43 dBm","0.030122000,0.029054000,0.027330000,0.025345000,0.023380000,0.022372000,0.020548000,0.018627000,0.017275000,0.015323000,0.014346000,0.012495000,0.010575000,0.009567000,0.007742000","7000  >  49153 [ACK] Seq=1 Ack=223001 Win=131072 Len=0 TSval=5176 TSecr=5175"
"4283","5.172424","10.1.0.1","10.1.0.11","TCP","134","0.000000000","-43 dBm","0.005320000","7000  >  49153 [ACK] Seq=1 Ack=225001 Win=131072 Len=0 TSval=5179 TSecr=5177"
"4296","5.173590","10.1.0.11","10.1.0.1","Gryphon","6376","0.001166000","","",""
"4297","5.173590","10.1.0.11","10.1.0.1","Gryphon","3300","0.000000000","","","[TCP Previous segment not captured] "
"4305","5.174571","10.1.0.11","10.1.0.1","Gryphon","2224","0.000981000","","",""
"4317","5.175611","10.1.0.11","10.1.0.1","Gryphon","1134","0.001040000","","",""
"4329","5.176523","10.1.0.11","10.1.0.1","Gryphon","1134","0.000912000","","",""
"4339","5.177283","10.1.0.11","10.1.0.1","Gryphon","1134","0.000760000","","",""
"4350","5.178147","10.1.0.11","10.1.0.1","Gryphon","1134","0.000864000","","",""
"4360","5.178907","10.1.0.11","10.1.0.1","Gryphon","1134","0.000760000","","",""
"4370","5.179667","10.1.0.11","10.1.0.1","Gryphon","1134","0.000760000","","",""
"4380","5.180428","10.1.0.11","10.1.0.1","Gryphon","1134","0.000761000","","",""
"4390","5.181188","10.1.0.11","10.1.0.1","Gryphon","1134","0.000760000","","",""
"4400","5.181948","10.1.0.11","10.1.0.1","Gryphon","1134","0.000760000","","",""
"4410","5.182708","10.1.0.11","10.1.0.1","Gryphon","1134","0.000760000","","",""
"4423","5.183862","10.1.0.1","10.1.0.11","TCP","756","0.001154000","-43 dBm","0.010272000,0.010272000,0.009291000,0.008251000,0.006579000,0.004955000,0.003434000,0.001914000","[TCP ACKed unseen segment] 7000  >  49153 [ACK] Seq=1 Ack=245001 Win=131072 Len=0 TSval=5194 TSecr=5193"
"4429","5.184196","10.1.0.11","10.1.0.1","Gryphon","2224","0.000334000","","",""
"4439","5.185084","10.1.0.11","10.1.0.1","Gryphon","1134","0.000888000","","",""
"4449","5.185845","10.1.0.11","10.1.0.1","Gryphon","1134","0.000761000","","",""
"4459","5.186605","10.1.0.11","10.1.0.1","Gryphon","1134","0.000760000","","",""
"4469","5.187365","10.1.0.11","10.1.0.1","Gryphon","1134","0.000760000","","",""
"4479","5.188125","10.1.0.11","10.1.0.1","Gryphon","1134","0.000760000","","",""
"4490","5.188980","10.1.0.11","10.1.0.1","Gryphon","1134","0.000855000","","",""
"4500","5.189740","10.1.0.11","10.1.0.1","Gryphon","1134","0.000760000","","",""
"4511","5.190586","10.1.0.11","10.1.0.1","Gryphon","1134","0.000846000","","",""
"4521","5.191347","10.1.0.11","10.1.0.1","Gryphon","1134","0.000761000","","",""
"4540","5.193047","10.1.0.11","10.1.0.1","Gryphon","2224","0.001700000","","",""
"4559","5.195587","10.1.0.11","10.1.0.1","Gryphon","3300","0.002540000","","",""
"4571","5.196659","10.1.0.11","10.1.0.1","Gryphon","1134","0.001072000","","",""
"4583","5.197571","10.1.0.11","10.1.0.1","Gryphon","1134","0.000912000","","",""
"4599","5.199009","10.1.0.11","10.1.0.1","Gryphon","2224","0.001438000","","",""
"4611","5.199954","10.1.0.11","10.1.0.1","Gryphon","1134","0.000945000","","",""
"4623","5.200866","10.1.0.11","10.1.0.1","Gryphon","2224","0.000912000","","",""
"4641","5.202362","10.1.0.11","10.1.0.1","Gryphon","1134","0.001496000","","",""
"4651","5.203122","10.1.0.11","10.1.0.1","Gryphon","1134","0.000760000","","",""
"4664","5.204152","10.1.0.11","10.1.0.1","Gryphon","2224","0.001030000","","",""
"4676","5.205224","10.1.0.11","10.1.0.1","Gryphon","1134","0.001072000","","",""
"4688","5.206136","10.1.0.11","10.1.0.1","Gryphon","1134","0.000912000","","",""
"4700","5.207049","10.1.0.11","10.1.0.1","Gryphon","1134","0.000913000","","",""
"4712","5.207961","10.1.0.11","10.1.0.1","Gryphon","1134","0.000912000","","",""
"4725","5.208968","10.1.0.11","10.1.0.1","Gryphon","2224","0.001007000","","",""
"4745","5.210440","10.1.0.11","10.1.0.1","TCP","832","0.001472000","","0.260689000,0.260689000,0.260689000,0.260689000,0.260689000,0.260689000,0.260689000,0.260689000,0.260689000,0.260689000","7001  >  49153 [ACK] Seq=1 Ack=45001 Win=131072 Len=0 TSval=4961 TSecr=4936"
"4760","5.214868","10.1.0.1","10.1.0.11","TCP","6376","0.004428000","-43 dBm","","49153  >  7001 [ACK] Seq=49501 Ack=1 Win=131072 Len=1500 TSval=5222 TSecr=4961"
"4761","5.214868","10.1.0.1","10.1.0.11","TCP","6376","0.000000000","-43 dBm","","49153  >  7001 [ACK] Seq=55501 Ack=1 Win=131072 Len=1500 TSval=5222 TSecr=4961"
"4762","5.214868","10.1.0.1","10.1.0.11","TCP","6376","0.000000000","-43 dBm","","49153  >  7001 [ACK] Seq=61501 Ack=1 Win=131072 Len=1500 TSval=5222 TSecr=4961"
"4763","5.214868","10.1.0.1","10.1.0.11","TCP","6376","0.000000000","-43 dBm","","49153  >  7001 [ACK] Seq=67501 Ack=1 Win=131072 Len=1500 TSval=5222 TSecr=4961"
"4764","5.214868","10.1.0.1","10.1.0.11","TCP","6376","0.000000000","-43 dBm","","49153  >  7001 [ACK] Seq=73501 Ack=1 Win=131072 Len=1500 TSval=5222 TSecr=4961"
"4765","5.214868","10.1.0.1","10.1.0.11","TCP","6376","0.000000000","-43 dBm","","49153  >  7001 [ACK] Seq=79501 Ack=1 Win=131072 Len=1500 TSval=5222 TSecr=4961"
"4766","5.214868","10.1.0.1","10.1.0.11","TCP","6376","0.000000000","-43 dBm","","49153  >  7001 [ACK] Seq=85501 Ack=1 Win=131072 Len=1500 TSval=5222 TSecr=4961"
"4767","5.214868","10.1.0.1","10.1.0.11","TCP","6376","0.000000000","-43 dBm","","49153  >  7001 [ACK] Seq=91501 Ack=1 Win=131072 Len=1500 TSval=5222 TSecr=4961"
"4768","5.214868","10.1.0.1","10.1.0.11","TCP","6376","0.000000000","-43 dBm","","49153  >  7001 [ACK] Seq=97501 Ack=1 Win=131072 Len=1500 TSval=5222 TSecr=4961"
"4769","5.214868","10.1.0.1","10.1.0.11","TCP","3224","0.000000000","-43 dBm","","49153  >  7001 [ACK] Seq=100501 Ack=1 Win=131072 Len=1500 TSval=5222 TSecr=4961"
"4811","5.226308","10.1.0.11","10.1.0.1","TCP","2224","0.011440000","","","[TCP Retransmission] [TCP Retransmission] 49153  >  7000 [ACK] Seq=278001 Ack=1 Win=131072 Len=1000 TSval=5221 TSecr=5194"
"4812","5.226308","10.1.0.11","10.1.0.1","Gryphon","6528","0.000000000","","",""
"4813","5.226308","10.1.0.11","10.1.0.1","Gryphon","6528","0.000000000","","",""
"4814","5.226308","10.1.0.11","10.1.0.1","Gryphon","6528","0.000000000","","",""
"4815","5.226308","10.1.0.11","10.1.0.1","Gryphon","3300","0.000000000","","",""
"4817","5.227248","10.1.0.11","10.1.0.1","TCP","2224","0.000940000","","","[TCP Retransmission] [TCP Retransmission] 49153  >  7000 [ACK] Seq=278001 Ack=1 Win=131072 Len=1000 TSval=5221 TSecr=5194"
"4818","5.227248","10.1.0.11","10.1.0.1","Gryphon","1134","0.000000000","","",""
"4843","5.231317","10.1.0.11","10.1.0.1","Gryphon","6528","0.004069000","","",""
"4901","5.240299","10.1.0.11","10.1.0.1","Gryphon","4376","0.008982000","","",""
"4927","5.243149","10.1.0.11","10.1.0.1","TCP","1516","0.002850000","","0.028281000,0.028281000,0.028281000,0.028281000,0.028281000,0.028281000,0.028281000,0.028281000,0.028281000,0.028281000,0.028281000,0.028281000,0.028281000,0.028281000,0.028281000,0.028281000,0.028281000,0.028281000,0.028281000","7001  >  49153 [ACK] Seq=1 Ack=102001 Win=131072 Len=0 TSval=5227 TSecr=5222"
"4969","5.257126","10.1.0.1","10.1.0.11","TCP","6376","0.013977000","-43 dBm","","49153  >  7001 [ACK] Seq=106501 Ack=1 Win=131072 Len=1500 TSval=5255 TSecr=5225"
"4970","5.257126","10.1.0.1","10.1.0.11","TCP","6376","0.000000000","-43 dBm","","49153  >  7001 [ACK] Seq=112501 Ack=1 Win=131072 Len=1500 TSval=5255 TSecr=5225"
"4971","5.257126","10.1.0.1","10.1.0.11","TCP","6376","0.000000000","-43 dBm","","49153  >  7001 [ACK] Seq=118501 Ack=1 Win=131072 Len=1500 TSval=5255 TSecr=5225"
"4972","5.257126","10.1.0.1","10.1.0.11","TCP","6376","0.000000000","-43 dBm","","49153  >  7001 [ACK] Seq=124501 Ack=1 Win=131072 Len=1500 TSval=5255 TSecr=5225"
"4973","5.257126","10.1.0.1","10.1.0.11","TCP","6376","0.000000000","-43 dBm","","49153  >  7001 [ACK] Seq=130501 Ack=1 Win=131072 Len=1500 TSval=5255 TSecr=5226"
"4974","5.257126","10.1.0.1","10.1.0.11","TCP","6376","0.000000000","-43 dBm","","49153  >  7001 [ACK] Seq=136501 Ack=1 Win=131072 Len=1500 TSval=5255 TSecr=5226"
"4975","5.257126","10.1.0.1","10.1.0.11","TCP","6376","0.000000000","-43 dBm","","49153  >  7001 [ACK] Seq=142501 Ack=1 Win=131072 Len=1500 TSval=5255 TSecr=5226"
"4976","5.257126","10.1.0.1","10.1.0.11","TCP","6376","0.000000000","-43 dBm","","49153  >  7001 [ACK] Seq=148501 Ack=1 Win=131072 Len=1500 TSval=5255 TSecr=5226"
"4977","5.257126","10.1.0.1","10.1.0.11","TCP","6376","0.000000000","-43 dBm","","49153  >  7001 [ACK] Seq=154501 Ack=1 Win=131072 Len=1500 TSval=5255 TSecr=5226"
"4978","5.257126","10.1.0.1","10.1.0.11","TCP","6376","0.000000000","-43 dBm","","49153  >  7001 [ACK] Seq=160501 Ack=1 Win=131072 Len=1500 TSval=5255 TSecr=5227"
"5155","5.287979","10.1.0.1","10.1.0.11","TCP","1288","0.030853000","-43 dBm","0.103783000,0.102895000,0.101374000,0.099854000,0.098239000,0.096632000,0.094932000,0.092392000,0.091320000,0.088970000,0.088025000,0.087113000,0.084857000,0.083827000,0.081843000,0.080018000","7000  >  49153 [ACK] Seq=1 Ack=277001 Win=131072 Len=0 TSval=5220 TSecr=5218"
"5156","5.287979","10.1.0.1","10.1.0.11","TCP","1364","0.000000000","-43 dBm","0.079011000,0.061671000,0.061671000,0.061671000,0.061671000,0.061671000,0.061671000,0.061671000,0.061671000,0.061671000,0.061671000,0.060731000,0.056662000,0.056662000,0.056662000,0.047680000,0.047680000","7000  >  49153 [ACK] Seq=1 Ack=311001 Win=131072 Len=0 TSval=5252 TSecr=5245"
"5159","5.288147","10.1.0.11","10.1.0.1","Gryphon","6376","0.000168000","","",""
"5160","5.288147","10.1.0.11","10.1.0.1","Gryphon","6376","0.000000000","","","[TCP Previous segment not captured] "
"5161","5.288147","10.1.0.11","10.1.0.1","Gryphon","6376","0.000000000","","","[TCP Previous segment not captured] "
"5162","5.288147","10.1.0.11","10.1.0.1","Gryphon","6376","0.000000000","","","[TCP Previous segment not captured] "
"5163","5.288147","10.1.0.11","10.1.0.1","Gryphon","6376","0.000000000","","","[TCP Previous segment not captured] "
"5164","5.288147","10.1.0.11","10.1.0.1","Gryphon","6376","0.000000000","","","[TCP Previous segment not captured] "
"5165","5.288147","10.1.0.11","10.1.0.1","Gryphon","6376","0.000000000","","","[TCP Previous segment not captured] "
"5166","5.288147","10.1.0.11","10.1.0.1","Gryphon","6376","0.000000000","","","[TCP Previous segment not captured] "
"5167","5.288147","10.1.0.11","10.1.0.1","Gryphon","6376","0.000000000","","","[TCP Previous segment not captured] "
"5168","5.288147","10.1.0.11","10.1.0.1","Gryphon","6376","0.000000000","","","[TCP Previous segment not captured] "
"5169","5.288147","10.1.0.11","10.1.0.1","Gryphon","6452","0.000000000","","","[TCP Previous segment not captured] "
"5173","5.290775","10.1.0.11","10.1.0.1","Gryphon","3300","0.002628000","","","[TCP Previous segment not captured] "
"5240","5.298841","10.1.0.1","10.1.0.11","TCP","1896","0.008066000","-43 dBm","0.010694000,0.010694000,0.010694000,0.010694000,0.010694000,0.010694000,0.010694000,0.010694000,0.010694000,0.010694000,0.010694000,0.008066000,0.008066000","[TCP ACKed unseen segment] 7000  >  49153 [ACK] Seq=1 Ack=380001 Win=131072 Len=0 TSval=5303 TSecr=5301"
"5248","5.299354","10.1.0.11","10.1.0.1","Gryphon","6376","0.000513000","","",""
"5249","5.299354","10.1.0.11","10.1.0.1","Gryphon","5376","0.000000000","","","[TCP Previous segment not captured] "
"5255","5.300183","10.1.0.11","10.1.0.1","Gryphon","1134","0.000829000","","",""
"5283","5.303482","10.1.0.11","10.1.0.1","Gryphon","4376","0.003299000","","",""
"5291","5.304442","10.1.0.11","10.1.0.1","Gryphon","1134","0.000960000","","",""
"5299","5.305050","10.1.0.11","10.1.0.1","Gryphon","1134","0.000608000","","",""
"5308","5.305753","10.1.0.11","10.1.0.1","Gryphon","1134","0.000703000","","",""
"5320","5.306867","10.1.0.11","10.1.0.1","Gryphon","1134","0.001114000","","",""
"5328","5.307475","10.1.0.11","10.1.0.1","Gryphon","1134","0.000608000","","",""
"5336","5.308083","10.1.0.11","10.1.0.1","Gryphon","1134","0.000608000","","",""
"5345","5.308941","10.1.0.11","10.1.0.1","Gryphon","1134","0.000858000","","",""
"5355","5.309741","10.1.0.11","10.1.0.1","TCP","1592","0.000800000","","0.052615000,0.052615000,0.052615000,0.052615000,0.052615000,0.052615000,0.052615000,0.052615000,0.052615000,0.052615000,0.052615000,0.052615000,0.052615000,0.052615000,0.052615000,0.052615000,0.052615000,0.052615000,0.052615000,0.052615000","7001  >  49153 [ACK] Seq=1 Ack=162001 Win=131072 Len=0 TSval=5269 TSecr=5255"
"5390","5.314414","10.1.0.11","10.1.0.1","Gryphon","6528","0.004673000","","",""
"5398","5.315294","10.1.0.11","10.1.0.1","Gryphon","2224","0.000880000","","",""
"5404","5.324743","10.1.0.1","10.1.0.11","TCP","6376","0.009449000","-43 dBm","","49153  >  7001 [ACK] Seq=166501 Ack=1 Win=131072 Len=1500 TSval=5322 TSecr=5267"
"5405","5.324743","10.1.0.1","10.1.0.11","TCP","6376","0.000000000","-43 dBm","","49153  >  7001 [ACK] Seq=172501 Ack=1 Win=131072 Len=1500 TSval=5322 TSecr=5267"
"5406","5.324743","10.1.0.1","10.1.0.11","TCP","6376","0.000000000","-43 dBm","","49153  >  7001 [ACK] Seq=178501 Ack=1 Win=131072 Len=1500 TSval=5322 TSecr=5267"
"5407","5.324743","10.1.0.1","10.1.0.11","TCP","6376","0.000000000","-43 dBm","","49153  >  7001 [ACK] Seq=184501 Ack=1 Win=131072 Len=1500 TSval=5322 TSecr=5268"
"5408","5.324743","10.1.0.1","10.1.0.11","TCP","6376","0.000000000","-43 dBm","","49153  >  7001 [ACK] Seq=190501 Ack=1 Win=131072 Len=1500 TSval=5322 TSecr=5268"
"5409","5.324743","10.1.0.1","10.1.0.11","TCP","6376","0.000000000","-43 dBm","","49153  >  7001 [ACK] Seq=196501 Ack=1 Win=131072 Len=1500 TSval=5322 TSecr=5268"
"5410","5.324743","10.1.0.1","10.1.0.11","TCP","6376","0.000000000","-43 dBm","","49153  >  7001 [ACK] Seq=202501 Ack=1 Win=131072 Len=1500 TSval=5322 TSecr=5268"
"5411","5.324743","10.1.0.1","10.1.0.11","TCP","6376","0.000000000","-43 dBm","","49153  >  7001 [ACK] Seq=208501 Ack=1 Win=131072 Len=1500 TSval=5322 TSecr=5268"
"5412","5.324743","10.1.0.1","10.1.0.11","TCP","6376","0.000000000","-43 dBm","","49153  >  7001 [ACK] Seq=214501 Ack=1 Win=131072 Len=1500 TSval=5322 TSecr=5269"
"5413","5.324743","10.1.0.1","10.1.0.11","TCP","6376","0.000000000","-43 dBm","","49153  >  7001 [ACK] Seq=220501 Ack=1 Win=131072 Len=1500 TSval=5322 TSecr=5269"
"5414","5.324743","10.1.0.1","10.1.0.11","TCP","3224","0.000000000","-43 dBm","","49153  >  7001 [ACK] Seq=223501 Ack=1 Win=131072 Len=1500 TSval=5322 TSecr=5269"
"5430","5.326806","10.1.0.11","10.1.0.1","Gryphon","6528","0.002063000","","",""
"5431","5.326806","10.1.0.11","10.1.0.1","Gryphon","6528","0.000000000","","",""
"5432","5.326806","10.1.0.11","10.1.0.1","Gryphon","2224","0.000000000","","",""
"5438","5.327794","10.1.0.11","10.1.0.1","Gryphon","1134","0.000988000","","",""
"5444","5.328250","10.1.0.11","10.1.0.1","Gryphon","1134","0.000456000","","",""
"5466","5.331416","10.1.0.11","10.1.0.1","Gryphon","4376","0.003166000","","",""
"5486","5.334349","10.1.0.11","10.1.0.1","Gryphon","3300","0.002933000","","",""
"5502","5.337067","10.1.0.11","10.1.0.1","TCP","3300","0.002718000","","","[TCP Retransmission] [TCP Retransmission] [TCP Retransmission] 49153  >  7000 [ACK] Seq=433001 Ack=1 Win=131072 Len=1000 TSval=5345 TSecr=5303"
"5503","5.337067","10.1.0.11","10.1.0.1","Gryphon","4376","0.000000000","","",""
"5505","5.337431","10.1.0.11","10.1.0.1","TCP","3300","0.000364000","","","[TCP Out-Of-Order] [TCP Out-Of-Order] [TCP Out-Of-Order] 49153  >  7000 [ACK] Seq=433001 Ack=1 Win=131072 Len=1000 TSval=5345 TSecr=5303"
"5513","5.338376","10.1.0.11","10.1.0.1","Gryphon","1134","0.000945000","","",""
"5519","5.338832","10.1.0.11","10.1.0.1","Gryphon","1134","0.000456000","","",""
"5525","5.339288","10.1.0.11","10.1.0.1","Gryphon","1134","0.000456000","","",""
"5598","5.351170","10.1.0.11","10.1.0.1","Gryphon","6528","0.011882000","","",""
"5599","5.351170","10.1.0.11","10.1.0.1","Gryphon","6528","0.000000000","","",""
"5645","5.358021","10.1.0.11","10.1.0.1","TCP","1668","0.006851000","","0.033278000,0.033278000,0.033278000,0.033278000,0.033278000,0.033278000,0.033278000,0.033278000,0.033278000,0.033278000,0.033278000,0.033278000,0.033278000,0.033278000,0.033278000,0.033278000,0.033278000,0.033278000,0.033278000,0.033278000,0.033278000","7001  >  49153 [ACK] Seq=1 Ack=225001 Win=131072 Len=0 TSval=5336 TSecr=5322"
"5740","5.384538","10.1.0.1","10.1.0.11","TCP","6376","0.026517000","-43 dBm","","49153  >  7001 [ACK] Seq=229501 Ack=1 Win=131072 Len=1500 TSval=5370 TSecr=5334"
"5741","5.384538","10.1.0.1","10.1.0.11","TCP","6376","0.000000000","-43 dBm","","49153  >  7001 [ACK] Seq=235501 Ack=1 Win=131072 Len=1500 TSval=5370 TSecr=5335"
"5742","5.384538","10.1.0.1","10.1.0.11","TCP","6376","0.000000000","-43 dBm","","49153  >  7001 [ACK] Seq=241501 Ack=1 Win=131072 Len=1500 TSval=5370 TSecr=5335"
"5743","5.384538","10.1.0.1","10.1.0.11","TCP","6376","0.000000000","-43 dBm","","49153  >  7001 [ACK] Seq=247501 Ack=1 Win=131072 Len=1500 TSval=5370 TSecr=5335"
"5744","5.384538","10.1.0.1","10.1.0.11","TCP","6376","0.000000000","-43 dBm","","49153  >  7001 [ACK] Seq=253501 Ack=1 Win=131072 Len=1500 TSval=5370 TSecr=5335"
"5745","5.384538","10.1.0.1","10.1.0.11","TCP","6376","0.000000000","-43 dBm","","49153  >  7001 [ACK] Seq=259501 Ack=1 Win=131072 Len=1500 TSval=5370 TSecr=5335"
"5746","5.384538","10.1.0.1","10.1.0.11","TCP","6376","0.000000000","-43 dBm","","49153  >  7001 [ACK] Seq=265501 Ack=1 Win=131072 Len=1500 TSval=5370 TSecr=5336"
"5747","5.384538","10.1.0.1","10.1.0.11","TCP","6376","0.000000000","-43 dBm","","49153  >  7001 [ACK] Seq=271501 Ack=1 Win=131072 Len=1500 TSval=5370 TSecr=5336"
"5748","5.384538","10.1.0.1","10.1.0.11","TCP","6376","0.000000000","-43 dBm","","49153  >  7001 [ACK] Seq=277501 Ack=1 Win=131072 Len=1500 TSval=5370 TSecr=5336"
"5749","5.384538","10.1.0.1","10.1.0.11","TCP","6376","0.000000000","-43 dBm","","49153  >  7001 [ACK] Seq=283501 Ack=1 Win=131072 Len=1500 TSval=5370 TSecr=5336"
"5750","5.384538","10.1.0.1","10.1.0.11","TCP","6376","0.000000000","-43 dBm","","49153  >  7001 [ACK] Seq=289501 Ack=1 Win=131072 Len=1500 TSval=5370 TSecr=5336"
"5830","5.396531","10.1.0.11","10.1.0.1","TCP","1744","0.011993000","","0.011993000,0.011993000,0.011993000,0.011993000,0.011993000,0.011993000,0.011993000,0.011993000,0.011993000,0.011993000,0.011993000,0.011993000,0.011993000,0.011993000,0.011993000,0.011993000,0.011993000,0.011993000,0.011993000,0.011993000,0.011993000,0.011993000","7001  >  49153 [ACK] Seq=1 Ack=291001 Win=131072 Len=0 TSval=5396 TSecr=5370"
"5883","5.407981","10.1.0.1","10.1.0.11","TCP","6376","0.011450000","-43 dBm","","49153  >  7001 [ACK] Seq=295501 Ack=1 Win=131072 Len=1500 TSval=5408 TSecr=5394"
"5884","5.407981","10.1.0.1","10.1.0.11","TCP","6376","0.000000000","-43 dBm","","49153  >  7001 [ACK] Seq=301501 Ack=1 Win=131072 Len=1500 TSval=5408 TSecr=5394"
"5885","5.407981","10.1.0.1","10.1.0.11","TCP","6376","0.000000000","-43 dBm","","49153  >  7001 [ACK] Seq=307501 Ack=1 Win=131072 Len=1500 TSval=5408 TSecr=5395"
"5886","5.407981","10.1.0.1","10.1.0.11","TCP","6376","0.000000000","-43 dBm","","49153  >  7001 [ACK] Seq=313501 Ack=1 Win=131072 Len=1500 TSval=5408 TSecr=5395"
"5887","5.407981","10.1.0.1","10.1.0.11","TCP","6376","0.000000000","-43 dBm","","49153  >  7001 [ACK] Seq=319501 Ack=1 Win=131072 Len=1500 TSval=5408 TSecr=5395"
"5888","5.407981","10.1.0.1","10.1.0.11","TCP","6376","0.000000000","-43 dBm","","49153  >  7001 [ACK] Seq=325501 Ack=1 Win=131072 Len=1500 TSval=5408 TSecr=5395"
"5889","5.407981","10.1.0.1","10.1.0.11","TCP","6376","0.000000000","-43 dBm","","49153  >  7001 [ACK] Seq=331501 Ack=1 Win=131072 Len=1500 TSval=5408 TSecr=5395"
"5890","5.407981","10.1.0.1","10.1.0.11","TCP","6376","0.000000000","-43 dBm","","49153  >  7001 [ACK] Seq=337501 Ack=1 Win=131072 Len=1500 TSval=5408 TSecr=5396"
"5891","5.407981","10.1.0.1","10.1.0.11","TCP","6528","0.000000000","-43 dBm","","49153  >  7001 [ACK] Seq=344001 Ack=1 Win=131072 Len=1000 TSval=5411 TSecr=5396"
"5892","5.407981","10.1.0.1","10.1.0.11","TCP","6528","0.000000000","-43 dBm","","49153  >  7001 [ACK] Seq=350001 Ack=1 Win=131072 Len=1000 TSval=5416 TSecr=5396"
"5893","5.407981","10.1.0.1","10.1.0.11","TCP","2224","0.000000000","-43 dBm","","49153  >  7001 [ACK] Seq=352001 Ack=1 Win=131072 Len=1000 TSval=5417 TSecr=5396"
"5895","5.408169","10.1.0.1","10.1.0.11","TCP","2224","0.000188000","-43 dBm","","49153  >  7001 [ACK] Seq=354001 Ack=1 Win=131072 Len=1000 TSval=5419 TSecr=5396"
"5897","5.408321","10.1.0.1","10.1.0.11","TCP","1134","0.000152000","-43 dBm","","49153  >  7001 [ACK] Seq=355001 Ack=1 Win=131072 Len=1000 TSval=5420 TSecr=5396"
"5971","5.424563","10.1.0.11","10.1.0.1","TCP","1896","0.016242000","","0.016582000,0.016582000,0.016582000,0.016582000,0.016582000,0.016582000,0.016582000,0.016582000,0.016582000,0.016582000,0.016582000,0.016582000,0.016582000,0.016582000,0.016582000,0.016582000,0.016582000,0.016582000,0.016582000,0.016582000,0.016582000,0.016582000,0.016582000,0.016394000","7001  >  49153 [ACK] Seq=1 Ack=355001 Win=131072 Len=0 TSval=5420 TSecr=5418"
"6044","5.436309","10.1.0.1","10.1.0.11","TCP","4376","0.011746000","-43 dBm","","49153  >  7001 [ACK] Seq=359001 Ack=1 Win=131072 Len=1000 TSval=5423 TSecr=5396"
"7245","5.542538","10.1.0.11","10.1.0.1","TCP","1896","0.106229000","","","7001  >  49153 [ACK] Seq=1 Ack=355001 Win=131072 Len=0 TSval=5420 TSecr=5418"
"7246","5.542538","10.1.0.11","10.1.0.1","TCP","224","0.000000000","","0.106229000,0.106229000","7001  >  49153 [ACK] Seq=1 Ack=359001 Win=131072 Len=0 TSval=5448 TSecr=5421"
"8144","5.616342","10.1.0.1","10.1.0.11","TCP","680","0.073804000","-43 dBm","0.316988000,0.316988000,0.316988000,0.312860000,0.312860000,0.311900000,0.310589000","[TCP ACKed unseen segment] 7000  >  49153 [ACK] Seq=1 Ack=399001 Win=131072 Len=0 TSval=5318 TSecr=5317"
"8145","5.616342","10.1.0.1","10.1.0.11","TCP","2124","0.000000000","-43 dBm","0.308867000,0.307401000,0.301928000,0.301928000,0.301928000,0.301048000,0.289536000,0.289536000,0.289536000,0.289536000,0.289536000,0.289536000,0.289536000,0.288092000,0.284926000,0.284926000,0.281993000,0.279275000,0.279275000,0.277966000,0.277054000,0.265172000,0.265172000,0.265172000,0.265172000,0.265172000,0.265172000","7000  >  49153 [ACK] Seq=1 Ack=453001 Win=131072 Len=0 TSval=5363 TSecr=5360"
"8156","5.617196","10.1.0.11","10.1.0.1","Gryphon","6376","0.000854000","","",""
"8157","5.617196","10.1.0.11","10.1.0.1","Gryphon","6376","0.000000000","","","[TCP Previous segment not captured] "
"8158","5.617196","10.1.0.11","10.1.0.1","Gryphon","6376","0.000000000","","","[TCP Previous segment not captured] "
"8159","5.617196","10.1.0.11","10.1.0.1","Gryphon","6376","0.000000000","","","[TCP Previous segment not captured] "
"8160","5.617196","10.1.0.11","10.1.0.1","Gryphon","6376","0.000000000","","","[TCP Previous segment not captured] "
"8161","5.617196","10.1.0.11","10.1.0.1","Gryphon","6376","0.000000000","","","[TCP Previous segment not captured] "
"8162","5.617196","10.1.0.11","10.1.0.1","Gryphon","6376","0.000000000","","","[TCP Previous segment not captured] "
"8163","5.617196","10.1.0.11","10.1.0.1","Gryphon","6376","0.000000000","","","[TCP Previous segment not captured] "
"8164","5.617196","10.1.0.11","10.1.0.1","Gryphon","6376","0.000000000","","","[TCP Previous segment not captured] "
"8165","5.617196","10.1.0.11","10.1.0.1","Gryphon","5376","0.000000000","","","[TCP Previous segment not captured] "
"8177","5.620496","10.1.0.11","10.1.0.1","Gryphon","4376","0.003300000","","",""
"8187","5.621417","10.1.0.11","10.1.0.1","Gryphon","1134","0.000921000","","",""
"8200","5.622766","10.1.0.1","10.1.0.11","TCP","1744","0.001349000","-43 dBm","0.005570000,0.005570000,0.005570000,0.005570000,0.005570000,0.005570000,0.005570000,0.005570000,0.005570000,0.005570000,0.005570000,0.002270000,0.002270000","[TCP ACKed unseen segment] 7000  >  49153 [ACK] Seq=1 Ack=516001 Win=131072 Len=0 TSval=5632 TSecr=5631"
"8225","5.624440","10.1.0.11","10.1.0.1","Gryphon","4376","0.001674000","","",""
"8257","5.629959","10.1.0.11","10.1.0.1","Gryphon","6528","0.005519000","","",""
"8258","5.629959","10.1.0.11","10.1.0.1","Gryphon","1134","0.000000000","","",""
"8275","5.632111","10.1.0.11","10.1.0.1","Gryphon","3300","0.002152000","","",""
"8291","5.633616","10.1.0.11","10.1.0.1","Gryphon","1134","0.001505000","","",""
"8301","5.634376","10.1.0.11","10.1.0.1","Gryphon","1134","0.000760000","","",""
"8306","5.635307","10.1.0.1","10.1.0.11","TCP","680","0.000931000","-43 dBm","0.010867000,0.010867000,0.005348000,0.005348000,0.005348000,0.005348000,0.003196000,0.001691000","7000  >  49153 [ACK] Seq=1 Ack=532001 Win=131072 Len=0 TSval=5645 TSecr=5644"
"8317","5.636230","10.1.0.11","10.1.0.1","Gryphon","3300","0.000923000","","",""
"8329","5.637334","10.1.0.11","10.1.0.1","Gryphon","1134","0.001104000","","",""
"8339","5.638094","10.1.0.11","10.1.0.1","Gryphon","1134","0.000760000","","",""
"8349","5.638854","10.1.0.11","10.1.0.1","Gryphon","1134","0.000760000","","",""
"8360","5.639701","10.1.0.11","10.1.0.1","Gryphon","1134","0.000847000","","",""
"8370","5.640461","10.1.0.11","10.1.0.1","Gryphon","1134","0.000760000","","",""
"8381","5.641325","10.1.0.11","10.1.0.1","Gryphon","1134","0.000864000","","",""
"8391","5.642085","10.1.0.11","10.1.0.1","Gryphon","1134","0.000760000","","",""
"8401","5.642845","10.1.0.11","10.1.0.1","Gryphon","1134","0.000760000","","",""
"8410","5.643539","10.1.0.11","10.1.0.1","Gryphon","1134","0.000694000","","",""
"8421","5.644683","10.1.0.11","10.1.0.1","Gryphon","1134","0.001144000","","",""
"8429","5.645291","10.1.0.11","10.1.0.1","Gryphon","1134","0.000608000","","",""
"8437","5.645899","10.1.0.11","10.1.0.1","Gryphon","1134","0.000608000","","",""
"8460","5.648057","10.1.0.11","10.1.0.1","Gryphon","2224","0.002158000","","",""
"8472","5.649337","10.1.0.11","10.1.0.1","Gryphon","2224","0.001280000","","",""
"8484","5.650345","10.1.0.11","10.1.0.1","Gryphon","1134","0.001008000","","",""
"8496","5.651257","10.1.0.11","10.1.0.1","Gryphon","1134","0.000912000","","",""
"8508","5.652201","10.1.0.11","10.1.0.1","Gryphon","2224","0.000944000","","",""
"8532","5.654659","10.1.0.11","10.1.0.1","Gryphon","3300","0.002458000","","",""
"8544","5.655763","10.1.0.11","10.1.0.1","Gryphon","1134","0.001104000","","",""
"8556","5.656675","10.1.0.11","10.1.0.1","Gryphon","1134","0.000912000","","",""
"8568","5.657587","10.1.0.11","10.1.0.1","Gryphon","1134","0.000912000","","",""
"8580","5.658531","10.1.0.11","10.1.0.1","Gryphon","2224","0.000944000","","",""
"8610","5.662546","10.1.0.11","10.1.0.1","Gryphon","5452","0.004015000","","",""
"8624","5.664346","10.1.0.11","10.1.0.1","Gryphon","2224","0.001800000","","",""
"8638","5.665642","10.1.0.1","10.1.0.11","TCP","528","0.001296000","-43 dBm","0.029412000,0.029412000,0.027548000,0.025941000,0.024317000,0.022797000","7000  >  49153 [ACK] Seq=1 Ack=544001 Win=131072 Len=0 TSval=5655 TSecr=5653"
"8639","5.665642","10.1.0.1","10.1.0.11","TCP","1060","0.000000000","-43 dBm","0.020959000,0.019743000,0.017585000,0.016305000,0.014385000,0.013441000,0.010983000,0.009879000,0.008055000,0.007111000,0.003096000,0.003096000,0.001296000","7000  >  49153 [ACK] Seq=1 Ack=570001 Win=131072 Len=0 TSval=5676 TSecr=5674"
"8652","5.667016","10.1.0.11","10.1.0.1","Gryphon","3300","0.001374000","","",""
"8664","5.668120","10.1.0.11","10.1.0.1","Gryphon","2224","0.001104000","","",""
"8682","5.669552","10.1.0.11","10.1.0.1","Gryphon","1134","0.001432000","","",""
"8694","5.670465","10.1.0.11","10.1.0.1","Gryphon","1134","0.000913000","","",""
"8706","5.671436","10.1.0.11","10.1.0.1","Gryphon","2224","0.000971000","","",""
"8720","5.672628","10.1.0.11","10.1.0.1","Gryphon","1134","0.001192000","","",""
"8732","5.673540","10.1.0.11","10.1.0.1","Gryphon","1134","0.000912000","","",""
"8744","5.674452","10.1.0.11","10.1.0.1","Gryphon","1134","0.000912000","","",""
"8756","5.675396","10.1.0.11","10.1.0.1","Gryphon","2224","0.000944000","","",""
"8782","5.677449","10.1.0.11","10.1.0.1","Gryphon","2224","0.002053000","","",""
"8786","5.678215","10.1.0.1","10.1.0.11","TCP","604","0.000766000","-43 dBm","0.011199000,0.011199000,0.010095000,0.007750000,0.006779000,0.004675000,0.002819000","7000  >  49153 [ACK] Seq=1 Ack=584001 Win=131072 Len=0 TSval=5687 TSecr=5685"
"8792","5.678642","10.1.0.11","10.1.0.1","TCP","2224","0.000427000","","","[TCP Retransmission] [TCP Retransmission] 49153  >  7000 [ACK] Seq=586001 Ack=1 Win=131072 Len=1000 TSval=5689 TSecr=5676"
"8793","5.678642","10.1.0.11","10.1.0.1","Gryphon","2224","0.000000000","","",""
"8795","5.678894","10.1.0.11","10.1.0.1","TCP","2224","0.000252000","","","[TCP Out-Of-Order] [TCP Out-Of-Order] 49153  >  7000 [ACK] Seq=586001 Ack=1 Win=131072 Len=1000 TSval=5689 TSecr=5676"
