"No.","Time","Source","Destination","Protocol","Length","Time delta from previous displayed frame","Signal strength (dBm)","The RTT to ACK the segment was","Info"
"580","2.837714","10.1.0.11","10.1.0.6","TCP","138","0.000000000","-25 dBm","","49158  >  7010 [SYN] Seq=0 Win=65535 Len=0 TSval=2850 TSecr=0 WS=4 SACK_PERM=1"
"583","2.837869","10.1.0.6","10.1.0.11","TCP","138","0.000155000","","0.000155000","7010  >  49158 [SYN, ACK] Seq=0 Ack=1 Win=65535 Len=0 TSval=2850 TSecr=2850 WS=4 SACK_PERM=1"
"586","2.838135","10.1.0.11","10.1.0.6","TCP","134","0.000266000","-25 dBm","0.000266000","49158  >  7010 [ACK] Seq=1 Ack=1 Win=131072 Len=0 TSval=2850 TSecr=2850"
"595","2.838865","10.1.0.6","10.1.0.11","TCP","138","0.000730000","","","49153  >  7011 [SYN] Seq=0 Win=65535 Len=0 TSval=2850 TSecr=0 WS=4 SACK_PERM=1"
"598","2.839140","10.1.0.11","10.1.0.6","TCP","138","0.000275000","-25 dBm","0.000275000","7011  >  49153 [SYN, ACK] Seq=0 Ack=1 Win=65535 Len=0 TSval=2851 TSecr=2850 WS=4 SACK_PERM=1"
"601","2.839322","10.1.0.6","10.1.0.11","TCP","134","0.000182000","","0.000182000","49153  >  7011 [ACK] Seq=1 Ack=1 Win=131072 Len=0 TSval=2851 TSecr=2851"
"1011","4.839105","10.1.0.11","10.1.0.6","TCP","1134","1.999783000","-25 dBm","","49158  >  7010 [ACK] Seq=1 Ack=1 Win=131072 Len=1000 TSval=4851 TSecr=2850"
"1025","4.840169","10.1.0.11","10.1.0.6","TCP","1134","0.001064000","-25 dBm","","49158  >  7010 [ACK] Seq=1001 Ack=1 Win=131072 Len=1000 TSval=4852 TSecr=2850"
"1045","4.841945","10.1.0.11","10.1.0.6","TCP","2224","0.001776000","-25 dBm","","49158  >  7010 [ACK] Seq=3001 Ack=1 Win=131072 Len=1000 TSval=4853 TSecr=2850"
"1065","4.843913","10.1.0.11","10.1.0.6","TCP","3300","0.001968000","-25 dBm","","49158  >  7010 [ACK] Seq=6001 Ack=1 Win=131072 Len=1000 TSval=4856 TSecr=2850"
"1092","4.847649","10.1.0.11","10.1.0.6","TCP","4376","0.003736000","-25 dBm","","49158  >  7010 [ACK] Seq=10001 Ack=1 Win=131072 Len=1000 TSval=4859 TSecr=2850"
"1112","4.849922","10.1.0.11","10.1.0.6","TCP","3300","0.002273000","-25 dBm","","49158  >  7010 [ACK] Seq=13001 Ack=1 Win=131072 Len=1000 TSval=4861 TSecr=2850"
"1137","4.853265","10.1.0.6","10.1.0.11","TCP","6528","0.003343000","","","49153  >  7011 [ACK] Seq=5001 Ack=1 Win=131072 Len=1000 TSval=4856 TSecr=2851"
"1138","4.853265","10.1.0.6","10.1.0.11","TCP","6528","0.000000000","","","49153  >  7011 [ACK] Seq=11001 Ack=1 Win=131072 Len=1000 TSval=4861 TSecr=2851"
"1139","4.853265","10.1.0.6","10.1.0.11","TCP","3300","0.000000000","","","49153  >  7011 [ACK] Seq=14001 Ack=1 Win=131072 Len=1000 TSval=4863 TSecr=2851"
"1176","4.859536","10.1.0.6","10.1.0.11","TCP","6528","0.006271000","","","[TCP Retransmission] [TCP Retransmission] [TCP Retransmission] [TCP Retransmission] [TCP Retransmission] [TCP Retransmission] 49153  >  7011 [ACK] Seq=5001 Ack=1 Win=131072 Len=1000 TSval=4856 TSecr=2851"
"1177","4.859536","10.1.0.6","10.1.0.11","TCP","6528","0.000000000","","","[TCP Retransmission] [TCP Retransmission] [TCP Retransmission] [TCP Retransmission] [TCP Retransmission] [TCP Retransmission] 49153  >  7011 [ACK] Seq=11001 Ack=1 Win=131072 Len=1000 TSval=4861 TSecr=2851"
"1178","4.859536","10.1.0.6","10.1.0.11","TCP","3300","0.000000000","","","[TCP Retransmission] [TCP Retransmission] [TCP Retransmission] 49153  >  7011 [ACK] Seq=14001 Ack=1 Win=131072 Len=1000 TSval=4863 TSecr=2851"
"1191","4.861318","10.1.0.11","10.1.0.6","TCP","1134","0.001782000","-25 dBm","","49158  >  7010 [ACK] Seq=14001 Ack=1 Win=131072 Len=1000 TSval=4862 TSecr=2850"
"1231","4.865782","10.1.0.6","10.1.0.11","TCP","680","0.004464000","","0.026677000,0.023837000,0.021869000,0.021869000,0.018133000,0.018133000,0.015860000,0.004464000","7010  >  49158 [ACK] Seq=1 Ack=15001 Win=131072 Len=0 TSval=4873 TSecr=4861"
"1239","4.867596","10.1.0.11","10.1.0.6","TCP","6376","0.001814000","-25 dBm","","49158  >  7010 [ACK] Seq=19501 Ack=1 Win=131072 Len=1500 TSval=4878 TSecr=4854"
"1240","4.867596","10.1.0.11","10.1.0.6","TCP","6376","0.000000000","-25 dBm","","49158  >  7010 [ACK] Seq=25501 Ack=1 Win=131072 Len=1500 TSval=4878 TSecr=4856"
"1241","4.867596","10.1.0.11","10.1.0.6","TCP","7452","0.000000000","-25 dBm","","49158  >  7010 [ACK] Seq=33001 Ack=1 Win=131072 Len=1000 TSval=4878 TSecr=4860"
"1242","4.867596","10.1.0.11","10.1.0.6","TCP","2224","0.000000000","-25 dBm","","49158  >  7010 [ACK] Seq=35001 Ack=1 Win=131072 Len=1000 TSval=4879 TSecr=4873"
"1248","4.868152","10.1.0.11","10.1.0.6","TCP","1134","0.000556000","-25 dBm","","49158  >  7010 [ACK] Seq=36001 Ack=1 Win=131072 Len=1000 TSval=4880 TSecr=4873"
"1251","4.868743","10.1.0.11","10.1.0.6","TCP","1134","0.000591000","-25 dBm","","49158  >  7010 [ACK] Seq=37001 Ack=1 Win=131072 Len=1000 TSval=4880 TSecr=4873"
"1261","4.869635","10.1.0.11","10.1.0.6","TCP","1134","0.000892000","-25 dBm","","49158  >  7010 [ACK] Seq=38001 Ack=1 Win=131072 Len=1000 TSval=4881 TSecr=4873"
"1267","4.870091","10.1.0.11","10.1.0.6","TCP","1134","0.000456000","-25 dBm","","49158  >  7010 [ACK] Seq=39001 Ack=1 Win=131072 Len=1000 TSval=4882 TSecr=4873"
"1292","4.872594","10.1.0.6","10.1.0.11","TCP","756","0.002503000","","0.004998000,0.004998000,0.004998000,0.004998000,0.004998000,0.004998000,0.004998000,0.004442000,0.002959000","7010  >  49158 [ACK] Seq=1 Ack=39001 Win=131072 Len=0 TSval=4882 TSecr=4880"
"1295","4.872990","10.1.0.11","10.1.0.6","TCP","2224","0.000396000","-25 dBm","","49158  >  7010 [ACK] Seq=41001 Ack=1 Win=131072 Len=1000 TSval=4884 TSecr=4873"
"1296","4.872990","10.1.0.11","10.1.0.6","TCP","1134","0.000000000","-25 dBm","","49158  >  7010 [ACK] Seq=42001 Ack=1 Win=131072 Len=1000 TSval=4884 TSecr=4873"
"1308","4.874758","10.1.0.11","10.1.0.6","TCP","2224","0.001768000","-25 dBm","","49158  >  7010 [ACK] Seq=44001 Ack=1 Win=131072 Len=1000 TSval=4886 TSecr=4882"
"1316","4.875430","10.1.0.11","10.1.0.6","TCP","1134","0.000672000","-25 dBm","","49158  >  7010 [ACK] Seq=45001 Ack=1 Win=131072 Len=1000 TSval=4887 TSecr=4882"
"1323","4.875940","10.1.0.11","10.1.0.6","TCP","1134","0.000510000","-25 dBm","","49158  >  7010 [ACK] Seq=46001 Ack=1 Win=131072 Len=1000 TSval=4888 TSecr=4882"
"1333","4.877424","10.1.0.11","10.1.0.6","TCP","2224","0.001484000","-25 dBm","","49158  >  7010 [ACK] Seq=48001 Ack=1 Win=131072 Len=1000 TSval=4889 TSecr=4882"
"1346","4.878615","10.1.0.11","10.1.0.6","TCP","1134","0.001191000","-25 dBm","","49158  >  7010 [ACK] Seq=49001 Ack=1 Win=131072 Len=1000 TSval=4890 TSecr=4882"
"1354","4.879399","10.1.0.11","10.1.0.6","TCP","1134","0.000784000","-25 dBm","","49158  >  7010 [ACK] Seq=50001 Ack=1 Win=131072 Len=1000 TSval=4891 TSecr=4882"
"1362","4.880007","10.1.0.11","10.1.0.6","TCP","1134","0.000608000","-25 dBm","","49158  >  7010 [ACK] Seq=51001 Ack=1 Win=131072 Len=1000 TSval=4892 TSecr=4882"
"1376","4.881075","10.1.0.6","10.1.0.11","TCP","528","0.001068000","","0.008085000,0.008085000,0.006317000,0.005135000,0.003651000,0.001676000","7010  >  49158 [ACK] Seq=1 Ack=51001 Win=131072 Len=0 TSval=4891 TSecr=4890"
"1396","4.882730","10.1.0.11","10.1.0.6","TCP","3300","0.001655000","-25 dBm","","49158  >  7010 [ACK] Seq=54001 Ack=1 Win=131072 Len=1000 TSval=4894 TSecr=4891"
"1422","4.887342","10.1.0.11","10.1.0.6","TCP","6528","0.004612000","-25 dBm","","49158  >  7010 [ACK] Seq=60001 Ack=1 Win=131072 Len=1000 TSval=4899 TSecr=4891"
"1432","4.888281","10.1.0.11","10.1.0.6","TCP","1134","0.000939000","-25 dBm","","49158  >  7010 [ACK] Seq=61001 Ack=1 Win=131072 Len=1000 TSval=4900 TSecr=4891"
"1440","4.888889","10.1.0.11","10.1.0.6","TCP","1134","0.000608000","-25 dBm","","49158  >  7010 [ACK] Seq=62001 Ack=1 Win=131072 Len=1000 TSval=4900 TSecr=4891"
"1454","4.890084","10.1.0.6","10.1.0.11","TCP","528","0.001195000","","0.007354000,0.007354000,0.002742000,0.002742000,0.002742000,0.001195000","7010  >  49158 [ACK] Seq=1 Ack=63001 Win=131072 Len=0 TSval=4901 TSecr=4900"
"1460","4.890732","10.1.0.11","10.1.0.6","TCP","2224","0.000648000","-25 dBm","","49158  >  7010 [ACK] Seq=64001 Ack=1 Win=131072 Len=1000 TSval=4902 TSecr=4891"
"1478","4.893188","10.1.0.11","10.1.0.6","TCP","3300","0.002456000","-25 dBm","","49158  >  7010 [ACK] Seq=67001 Ack=1 Win=131072 Len=1000 TSval=4904 TSecr=4891"
"1490","4.894420","10.1.0.11","10.1.0.6","TCP","2224","0.001232000","-25 dBm","","49158  >  7010 [ACK] Seq=69001 Ack=1 Win=131072 Len=1000 TSval=4906 TSecr=4891"
"1505","4.895579","10.1.0.11","10.1.0.6","TCP","1134","0.001159000","-25 dBm","","49158  >  7010 [ACK] Seq=70001 Ack=1 Win=131072 Len=1000 TSval=4907 TSecr=4891"
"1517","4.896555","10.1.0.11","10.1.0.6","TCP","2224","0.000976000","-25 dBm","","49158  >  7010 [ACK] Seq=72001 Ack=1 Win=131072 Len=1000 TSval=4908 TSecr=4891"
"1537","4.898140","10.1.0.11","10.1.0.6","TCP","2224","0.001585000","-25 dBm","","49158  >  7010 [ACK] Seq=74001 Ack=1 Win=131072 Len=1000 TSval=4910 TSecr=4891"
"1557","4.899692","10.1.0.11","10.1.0.6","TCP","2224","0.001552000","-25 dBm","","49158  >  7010 [ACK] Seq=76001 Ack=1 Win=131072 Len=1000 TSval=4912 TSecr=4891"
"1575","4.901196","10.1.0.11","10.1.0.6","TCP","1134","0.001504000","-25 dBm","","49158  >  7010 [ACK] Seq=77001 Ack=1 Win=131072 Len=1000 TSval=4912 TSecr=4891"
"1587","4.902172","10.1.0.11","10.1.0.6","TCP","2224","0.000976000","-25 dBm","","49158  >  7010 [ACK] Seq=79001 Ack=1 Win=131072 Len=1000 TSval=4914 TSecr=4891"
"1607","4.903756","10.1.0.11","10.1.0.6","TCP","2224","0.001584000","-25 dBm","","49158  >  7010 [ACK] Seq=81001 Ack=1 Win=131072 Len=1000 TSval=4916 TSecr=4891"
"1627","4.905341","10.1.0.11","10.1.0.6","TCP","2224","0.001585000","-25 dBm","","49158  >  7010 [ACK] Seq=83001 Ack=1 Win=131072 Len=1000 TSval=4917 TSecr=4891"
"1648","4.907038","10.1.0.11","10.1.0.6","TCP","2224","0.001697000","-25 dBm","","49158  >  7010 [ACK] Seq=85001 Ack=1 Win=131072 Len=1000 TSval=4919 TSecr=4891"
"1660","4.908078","10.1.0.11","10.1.0.6","TCP","1134","0.001040000","-25 dBm","","49158  >  7010 [ACK] Seq=86001 Ack=1 Win=131072 Len=1000 TSval=4920 TSecr=4891"
"1672","4.908990","10.1.0.11","10.1.0.6","TCP","1134","0.000912000","-25 dBm","","49158  >  7010 [ACK] Seq=87001 Ack=1 Win=131072 Len=1000 TSval=4920 TSecr=4891"
"1684","4.909902","10.1.0.11","10.1.0.6","TCP","1134","0.000912000","-25 dBm","","49158  >  7010 [ACK] Seq=88001 Ack=1 Win=131072 Len=1000 TSval=4921 TSecr=4891"
"1696","4.910814","10.1.0.11","10.1.0.6","TCP","1134","0.000912000","-25 dBm","","49158  >  7010 [ACK] Seq=89001 Ack=1 Win=131072 Len=1000 TSval=4922 TSecr=4891"
"1708","4.911791","10.1.0.11","10.1.0.6","TCP","1134","0.000977000","-25 dBm","","49158  >  7010 [ACK] Seq=90001 Ack=1 Win=131072 Len=1000 TSval=4923 TSecr=4891"
"1717","4.912792","10.1.0.11","10.1.0.6","TCP","2224","0.001001000","-25 dBm","","49158  >  7010 [ACK] Seq=92001 Ack=1 Win=131072 Len=1000 TSval=4924 TSecr=4891"
"1731","4.913888","10.1.0.11","10.1.0.6","TCP","1134","0.001096000","-25 dBm","","49158  >  7010 [ACK] Seq=93001 Ack=1 Win=131072 Len=1000 TSval=4925 TSecr=4891"
"1743","4.914800","10.1.0.11","10.1.0.6","TCP","1134","0.000912000","-25 dBm","","49158  >  7010 [ACK] Seq=94001 Ack=1 Win=131072 Len=1000 TSval=4926 TSecr=4891"
"1755","4.915776","10.1.0.11","10.1.0.6","TCP","2224","0.000976000","-25 dBm","","49158  >  7010 [ACK] Seq=96001 Ack=1 Win=131072 Len=1000 TSval=4928 TSecr=4891"
"1775","4.917360","10.1.0.11","10.1.0.6","TCP","2224","0.001584000","-25 dBm","","49158  >  7010 [ACK] Seq=98001 Ack=1 Win=131072 Len=1000 TSval=4929 TSecr=4891"
"1789","4.918887","10.1.0.11","10.1.0.6","TCP","2224","0.001527000","-25 dBm","","49158  >  7010 [ACK] Seq=100001 Ack=1 Win=131072 Len=1000 TSval=4931 TSecr=4891"
"1809","4.920408","10.1.0.11","10.1.0.6","TCP","1134","0.001521000","-25 dBm","","49158  >  7010 [ACK] Seq=101001 Ack=1 Win=131072 Len=1000 TSval=4932 TSecr=4891"
"1821","4.921384","10.1.0.11","10.1.0.6","TCP","2224","0.000976000","-25 dBm","","49158  >  7010 [ACK] Seq=103001 Ack=1 Win=131072 Len=1000 TSval=4933 TSecr=4891"
"1835","4.922448","10.1.0.11","10.1.0.6","TCP","1134","0.001064000","-25 dBm","","49158  >  7010 [ACK] Seq=104001 Ack=1 Win=131072 Len=1000 TSval=4934 TSecr=4891"
"1856","4.924118","10.1.0.11","10.1.0.6","TCP","680","0.001670000","-25 dBm","0.070853000,0.070853000,0.070853000,0.070853000,0.070853000,0.070853000,0.070853000,0.070853000","7011  >  49153 [ACK] Seq=1 Ack=15001 Win=131072 Len=0 TSval=4872 TSecr=4862"
"1911","4.933634","10.1.0.6","10.1.0.11","TCP","6376","0.009516000","","","49153  >  7011 [ACK] Seq=19501 Ack=1 Win=131072 Len=1500 TSval=4936 TSecr=4872"
"1912","4.933634","10.1.0.6","10.1.0.11","TCP","6376","0.000000000","","","49153  >  7011 [ACK] Seq=25501 Ack=1 Win=131072 Len=1500 TSval=4936 TSecr=4872"
"1913","4.933634","10.1.0.6","10.1.0.11","TCP","6376","0.000000000","","","49153  >  7011 [ACK] Seq=31501 Ack=1 Win=131072 Len=1500 TSval=4936 TSecr=4872"
"1914","4.933634","10.1.0.6","10.1.0.11","TCP","6376","0.000000000","","","49153  >  7011 [ACK] Seq=37501 Ack=1 Win=131072 Len=1500 TSval=4936 TSecr=4872"
"1915","4.933634","10.1.0.6","10.1.0.11","TCP","6376","0.000000000","","","49153  >  7011 [ACK] Seq=43501 Ack=1 Win=131072 Len=1500 TSval=4936 TSecr=4872"
"1921","4.935283","10.1.0.6","10.1.0.11","TCP","6376","0.001649000","","","[TCP Retransmission] [TCP Retransmission] [TCP Retransmission] [TCP Retransmission] 49153  >  7011 [ACK] Seq=19501 Ack=1 Win=131072 Len=1500 TSval=4936 TSecr=4872"
"1922","4.935283","10.1.0.6","10.1.0.11","TCP","6376","0.000000000","","","[TCP Retransmission] [TCP Retransmission] [TCP Retransmission] [TCP Retransmission] 49153  >  7011 [ACK] Seq=25501 Ack=1 Win=131072 Len=1500 TSval=4936 TSecr=4872"
"1923","4.935283","10.1.0.6","10.1.0.11","TCP","6376","0.000000000","","","[TCP Retransmission] [TCP Retransmission] [TCP Retransmission] [TCP Retransmission] 49153  >  7011 [ACK] Seq=31501 Ack=1 Win=131072 Len=1500 TSval=4936 TSecr=4872"
"1924","4.935283","10.1.0.6","10.1.0.11","TCP","6376","0.000000000","","","[TCP Retransmission] [TCP Retransmission] [TCP Retransmission] [TCP Retransmission] 49153  >  7011 [ACK] Seq=37501 Ack=1 Win=131072 Len=1500 TSval=4936 TSecr=4872"
"1925","4.935283","10.1.0.6","10.1.0.11","TCP","6376","0.000000000","","","[TCP Retransmission] [TCP Retransmission] [TCP Retransmission] [TCP Retransmission] 49153  >  7011 [ACK] Seq=43501 Ack=1 Win=131072 Len=1500 TSval=4936 TSecr=4872"
"1928","4.936526","10.1.0.6","10.1.0.11","TCP","528","0.001243000","","","7010  >  49158 [ACK] Seq=1 Ack=63001 Win=131072 Len=0 TSval=4901 TSecr=4900"
"1929","4.936526","10.1.0.6","10.1.0.11","TCP","1668","0.000000000","","0.045794000,0.043338000,0.042106000,0.040947000,0.039971000,0.038386000,0.036834000,0.034354000,0.032770000,0.031185000,0.029488000,0.028448000,0.026624000,0.024735000,0.023734000,0.021726000,0.020750000,0.019166000,0.017639000,0.015142000,0.014078000","7010  >  49158 [ACK] Seq=1 Ack=105001 Win=131072 Len=0 TSval=4934 TSecr=4933"
"1931","4.936714","10.1.0.6","10.1.0.11","TCP","528","0.000188000","","","7010  >  49158 [ACK] Seq=1 Ack=63001 Win=131072 Len=0 TSval=4901 TSecr=4900"
"1967","4.942911","10.1.0.11","10.1.0.6","TCP","6376","0.006197000","-25 dBm","","49158  >  7010 [ACK] Seq=109501 Ack=1 Win=131072 Len=1500 TSval=4949 TSecr=4899"
"1968","4.942911","10.1.0.11","10.1.0.6","TCP","6376","0.000000000","-25 dBm","","49158  >  7010 [ACK] Seq=115501 Ack=1 Win=131072 Len=1500 TSval=4949 TSecr=4901"
"1969","4.942911","10.1.0.11","10.1.0.6","TCP","7452","0.000000000","-25 dBm","","49158  >  7010 [ACK] Seq=123001 Ack=1 Win=131072 Len=1000 TSval=4949 TSecr=4934"
"1970","4.942911","10.1.0.11","10.1.0.6","TCP","6528","0.000000000","-25 dBm","","49158  >  7010 [ACK] Seq=129001 Ack=1 Win=131072 Len=1000 TSval=4954 TSecr=4934"
"1980","4.944495","10.1.0.11","10.1.0.6","TCP","3300","0.001584000","-25 dBm","","49158  >  7010 [ACK] Seq=132001 Ack=1 Win=131072 Len=1000 TSval=4956 TSecr=4934"
"1994","4.946178","10.1.0.6","10.1.0.11","TCP","908","0.001683000","","0.003267000,0.003267000,0.003267000,0.003267000,0.003267000,0.003267000,0.003267000,0.003267000,0.003267000,0.001683000,0.001683000","7010  >  49158 [ACK] Seq=1 Ack=133001 Win=131072 Len=0 TSval=4957 TSecr=4956"
"2031","4.950996","10.1.0.11","10.1.0.6","TCP","6528","0.004818000","-25 dBm","","49158  >  7010 [ACK] Seq=138001 Ack=1 Win=131072 Len=1000 TSval=4961 TSecr=4934"
"2032","4.950996","10.1.0.11","10.1.0.6","TCP","1134","0.000000000","-25 dBm","","49158  >  7010 [ACK] Seq=139001 Ack=1 Win=131072 Len=1000 TSval=4962 TSecr=4934"
"2058","4.955816","10.1.0.6","10.1.0.11","TCP","908","0.004820000","","","7010  >  49158 [ACK] Seq=1 Ack=133001 Win=131072 Len=0 TSval=4957 TSecr=4956"
"2059","4.955816","10.1.0.6","10.1.0.11","TCP","300","0.000000000","","0.004820000,0.004820000,0.004820000","7010  >  49158 [ACK] Seq=1 Ack=139001 Win=131072 Len=0 TSval=4963 TSecr=4960"
"2077","4.959714","10.1.0.11","10.1.0.6","TCP","6528","0.003898000","-25 dBm","","49158  >  7010 [ACK] Seq=145001 Ack=1 Win=131072 Len=1000 TSval=4967 TSecr=4934"
"2078","4.959714","10.1.0.11","10.1.0.6","TCP","5452","0.000000000","-25 dBm","","49158  >  7010 [ACK] Seq=150001 Ack=1 Win=131072 Len=1000 TSval=4971 TSecr=4934"
"2088","4.961070","10.1.0.11","10.1.0.6","TCP","2224","0.001356000","-25 dBm","","49158  >  7010 [ACK] Seq=152001 Ack=1 Win=131072 Len=1000 TSval=4972 TSecr=4934"
"2097","4.961956","10.1.0.11","10.1.0.6","TCP","1134","0.000886000","-25 dBm","","49158  >  7010 [ACK] Seq=153001 Ack=1 Win=131072 Len=1000 TSval=4973 TSecr=4934"
"2105","4.962564","10.1.0.11","10.1.0.6","TCP","1134","0.000608000","-25 dBm","","49158  >  7010 [ACK] Seq=154001 Ack=1 Win=131072 Len=1000 TSval=4974 TSecr=4934"
"2113","4.963172","10.1.0.11","10.1.0.6","TCP","1134","0.000608000","-25 dBm","","49158  >  7010 [ACK] Seq=155001 Ack=1 Win=131072 Len=1000 TSval=4975 TSecr=4934"
"2122","4.963875","10.1.0.11","10.1.0.6","TCP","1134","0.000703000","-25 dBm","","49158  >  7010 [ACK] Seq=156001 Ack=1 Win=131072 Len=1000 TSval=4976 TSecr=4934"
"2148","4.966942","10.1.0.11","10.1.0.6","TCP","4376","0.003067000","-25 dBm","","49158  >  7010 [ACK] Seq=160001 Ack=1 Win=131072 Len=1000 TSval=4979 TSecr=4934"
"2178","4.971137","10.1.0.11","10.1.0.6","TCP","1134","0.004195000","-25 dBm","","49158  >  7010 [ACK] Seq=161001 Ack=1 Win=131072 Len=1000 TSval=4980 TSecr=4934"
"2493","5.002193","10.1.0.6","10.1.0.11","TCP","908","0.031056000","","","7010  >  49158 [ACK] Seq=1 Ack=133001 Win=131072 Len=0 TSval=4957 TSecr=4956"
"2494","5.002193","10.1.0.6","10.1.0.11","TCP","300","0.000000000","","","7010  >  49158 [ACK] Seq=1 Ack=139001 Win=131072 Len=0 TSval=4963 TSecr=4960"
"2495","5.002193","10.1.0.6","10.1.0.11","TCP","908","0.000000000","","0.042479000,0.042479000,0.042479000,0.042479000,0.042479000,0.042479000,0.041123000,0.039629000,0.038318000,0.035251000,0.035251000","7010  >  49158 [ACK] Seq=1 Ack=161001 Win=131072 Len=0 TSval=4979 TSecr=4978"
"2518","5.006985","10.1.0.11","10.1.0.6","TCP","6376","0.004792000","-25 dBm","","49158  >  7010 [ACK] Seq=166501 Ack=1 Win=131072 Len=1500 TSval=5014 TSecr=4954"
"2519","5.006985","10.1.0.11","10.1.0.6","TCP","6376","0.000000000","-25 dBm","","49158  >  7010 [ACK] Seq=172501 Ack=1 Win=131072 Len=1500 TSval=5014 TSecr=4954"
"2520","5.006985","10.1.0.11","10.1.0.6","TCP","6376","0.000000000","-25 dBm","","49158  >  7010 [ACK] Seq=178501 Ack=1 Win=131072 Len=1500 TSval=5014 TSecr=4955"
"2521","5.006985","10.1.0.11","10.1.0.6","TCP","6376","0.000000000","-25 dBm","","49158  >  7010 [ACK] Seq=184501 Ack=1 Win=131072 Len=1500 TSval=5014 TSecr=4955"
"2522","5.006985","10.1.0.11","10.1.0.6","TCP","6376","0.000000000","-25 dBm","","49158  >  7010 [ACK] Seq=190501 Ack=1 Win=131072 Len=1500 TSval=5014 TSecr=4963"
"2523","5.006985","10.1.0.11","10.1.0.6","TCP","6376","0.000000000","-25 dBm","","49158  >  7010 [ACK] Seq=196501 Ack=1 Win=131072 Len=1500 TSval=5014 TSecr=4972"
"2524","5.006985","10.1.0.11","10.1.0.6","TCP","7452","0.000000000","-25 dBm","","49158  >  7010 [ACK] Seq=204001 Ack=1 Win=131072 Len=1000 TSval=5014 TSecr=4972"
"2525","5.006985","10.1.0.11","10.1.0.6","TCP","4376","0.000000000","-25 dBm","","49158  >  7010 [ACK] Seq=208001 Ack=1 Win=131072 Len=1000 TSval=5017 TSecr=4979"
"2544","5.009674","10.1.0.11","10.1.0.6","TCP","5452","0.002689000","-25 dBm","","49158  >  7010 [ACK] Seq=213001 Ack=1 Win=131072 Len=1000 TSval=5021 TSecr=4979"
"2558","5.011155","10.1.0.11","10.1.0.6","TCP","2224","0.001481000","-25 dBm","","49158  >  7010 [ACK] Seq=215001 Ack=1 Win=131072 Len=1000 TSval=5023 TSecr=4979"
"2576","5.012555","10.1.0.11","10.1.0.6","TCP","2224","0.001400000","-25 dBm","","49158  >  7010 [ACK] Seq=217001 Ack=1 Win=131072 Len=1000 TSval=5024 TSecr=4979"
"2589","5.013648","10.1.0.6","10.1.0.11","TCP","1668","0.001093000","","0.006663000,0.006663000,0.006663000,0.006663000,0.006663000,0.006663000,0.006663000,0.006663000,0.006663000,0.006663000,0.006663000,0.006663000,0.006663000,0.006663000,0.006663000,0.006663000,0.006663000,0.003974000,0.003974000,0.002493000,0.001093000","7010  >  49158 [ACK] Seq=1 Ack=217001 Win=131072 Len=0 TSval=5025 TSecr=5023"
"2592","5.014098","10.1.0.11","10.1.0.6","TCP","2224","0.000450000","-25 dBm","","49158  >  7010 [ACK] Seq=219001 Ack=1 Win=131072 Len=1000 TSval=5026 TSecr=4979"
"2608","5.015506","10.1.0.11","10.1.0.6","TCP","1134","0.001408000","-25 dBm","","49158  >  7010 [ACK] Seq=220001 Ack=1 Win=131072 Len=1000 TSval=5027 TSecr=4979"
"2761","5.031461","10.1.0.6","10.1.0.11","TCP","1668","0.015955000","","","7010  >  49158 [ACK] Seq=1 Ack=217001 Win=131072 Len=0 TSval=5025 TSecr=5023"
"2762","5.031461","10.1.0.6","10.1.0.11","TCP","224","0.000000000","","0.017363000,0.015955000","7010  >  49158 [ACK] Seq=1 Ack=221001 Win=131072 Len=0 TSval=5028 TSecr=5026"
"2779","5.033819","10.1.0.11","10.1.0.6","TCP","6376","0.002358000","-25 dBm","","49158  >  7010 [ACK] Seq=225501 Ack=1 Win=131072 Len=1500 TSval=5044 TSecr=5018"
"2780","5.033819","10.1.0.11","10.1.0.6","TCP","6376","0.000000000","-25 dBm","","49158  >  7010 [ACK] Seq=231501 Ack=1 Win=131072 Len=1500 TSval=5044 TSecr=5018"
"2781","5.033819","10.1.0.11","10.1.0.6","TCP","6376","0.000000000","-25 dBm","","49158  >  7010 [ACK] Seq=237501 Ack=1 Win=131072 Len=1500 TSval=5044 TSecr=5018"
"2782","5.033819","10.1.0.11","10.1.0.6","TCP","4300","0.000000000","-25 dBm","","49158  >  7010 [ACK] Seq=242001 Ack=1 Win=131072 Len=1000 TSval=5044 TSecr=5028"
"2798","5.035519","10.1.0.11","10.1.0.6","TCP","3300","0.001700000","-25 dBm","","49158  >  7010 [ACK] Seq=245001 Ack=1 Win=131072 Len=1000 TSval=5047 TSecr=5028"
"2812","5.036807","10.1.0.11","10.1.0.6","TCP","2224","0.001288000","-25 dBm","","49158  >  7010 [ACK] Seq=247001 Ack=1 Win=131072 Len=1000 TSval=5048 TSecr=5028"
"2834","5.038730","10.1.0.11","10.1.0.6","TCP","2224","0.001923000","-25 dBm","","49158  >  7010 [ACK] Seq=249001 Ack=1 Win=131072 Len=1000 TSval=5050 TSecr=5028"
"2848","5.040018","10.1.0.11","10.1.0.6","TCP","2224","0.001288000","-25 dBm","","49158  >  7010 [ACK] Seq=251001 Ack=1 Win=131072 Len=1000 TSval=5052 TSecr=5028"
"2864","5.041298","10.1.0.11","10.1.0.6","TCP","2224","0.001280000","-25 dBm","","49158  >  7010 [ACK] Seq=253001 Ack=1 Win=131072 Len=1000 TSval=5053 TSecr=5028"
"2880","5.042674","10.1.0.11","10.1.0.6","TCP","1134","0.001376000","-25 dBm","","49158  >  7010 [ACK] Seq=254001 Ack=1 Win=131072 Len=1000 TSval=5054 TSecr=5028"
"2891","5.043520","10.1.0.11","10.1.0.6","TCP","1134","0.000846000","-25 dBm","","49158  >  7010 [ACK] Seq=255001 Ack=1 Win=131072 Len=1000 TSval=5055 TSecr=5028"
"2903","5.044464","10.1.0.11","10.1.0.6","TCP","2224","0.000944000","-25 dBm","","49158  >  7010 [ACK] Seq=257001 Ack=1 Win=131072 Len=1000 TSval=5056 TSecr=5028"
"2917","5.045657","10.1.0.11","10.1.0.6","TCP","1134","0.001193000","-25 dBm","","49158  >  7010 [ACK] Seq=258001 Ack=1 Win=131072 Len=1000 TSval=5057 TSecr=5028"
"2929","5.046569","10.1.0.11","10.1.0.6","TCP","1134","0.000912000","-25 dBm","","49158  >  7010 [ACK] Seq=259001 Ack=1 Win=131072 Len=1000 TSval=5058 TSecr=5028"
"2941","5.047481","10.1.0.11","10.1.0.6","TCP","1134","0.000912000","-25 dBm","","49158  >  7010 [ACK] Seq=260001 Ack=1 Win=131072 Len=1000 TSval=5059 TSecr=5028"
"2953","5.048393","10.1.0.11","10.1.0.6","TCP","1134","0.000912000","-25 dBm","","49158  >  7010 [ACK] Seq=261001 Ack=1 Win=131072 Len=1000 TSval=5060 TSecr=5028"
"2967","5.049910","10.1.0.11","10.1.0.6","TCP","2224","0.001517000","-25 dBm","","49158  >  7010 [ACK] Seq=263001 Ack=1 Win=131072 Len=1000 TSval=5061 TSecr=5028"
"2988","5.053290","10.1.0.11","10.1.0.6","TCP","4376","0.003380000","-25 dBm","","49158  >  7010 [ACK] Seq=267001 Ack=1 Win=131072 Len=1000 TSval=5064 TSecr=5028"
"2996","5.053898","10.1.0.11","10.1.0.6","TCP","1134","0.000608000","-25 dBm","","49158  >  7010 [ACK] Seq=268001 Ack=1 Win=131072 Len=1000 TSval=5065 TSecr=5028"
"3011","5.055262","10.1.0.11","10.1.0.6","TCP","1136","0.001364000","-25 dBm","","49158  >  7010 [ACK] Seq=269001 Ack=1 Win=131072 Len=1000 TSval=5066 TSecr=5028"
"3012","5.055262","10.1.0.11","10.1.0.6","TCP","1134","0.000000000","-25 dBm","","49158  >  7010 [ACK] Seq=270001 Ack=1 Win=131072 Len=1000 TSval=5067 TSecr=5028"
"3020","5.055970","10.1.0.11","10.1.0.6","TCP","1134","0.000708000","-25 dBm","","49158  >  7010 [ACK] Seq=271001 Ack=1 Win=131072 Len=1000 TSval=5068 TSecr=5028"
"3038","5.058140","10.1.0.11","10.1.0.6","TCP","3300","0.002170000","-25 dBm","","49158  >  7010 [ACK] Seq=274001 Ack=1 Win=131072 Len=1000 TSval=5070 TSecr=5028"
"3052","5.059268","10.1.0.11","10.1.0.6","TCP","1134","0.001128000","-25 dBm","","49158  >  7010 [ACK] Seq=275001 Ack=1 Win=131072 Len=1000 TSval=5071 TSecr=5028"
"3060","5.059876","10.1.0.11","10.1.0.6","TCP","1134","0.000608000","-25 dBm","","49158  >  7010 [ACK] Seq=276001 Ack=1 Win=131072 Len=1000 TSval=5072 TSecr=5028"
"3070","5.060486","10.1.0.6","10.1.0.11","TCP","1896","0.000610000","","0.026667000,0.026667000,0.026667000,0.026667000,0.026667000,0.026667000,0.026667000,0.024967000,0.024967000,0.023679000,0.021756000,0.020468000,0.019188000,0.016966000,0.016022000,0.013917000,0.012093000,0.010576000,0.007196000,0.007196000,0.005224000,0.004516000,0.002346000,0.001218000","7010  >  49158 [ACK] Seq=1 Ack=276001 Win=131072 Len=0 TSval=5071 TSecr=5070"
"3101","5.063857","10.1.0.11","10.1.0.6","TCP","5452","0.003371000","-25 dBm","","49158  >  7010 [ACK] Seq=281001 Ack=1 Win=131072 Len=1000 TSval=5076 TSecr=5028"
"3123","5.067161","10.1.0.11","10.1.0.6","TCP","2224","0.003304000","-25 dBm","","49158  >  7010 [ACK] Seq=283001 Ack=1 Win=131072 Len=1000 TSval=5077 TSecr=5028"
"3520","5.101820","10.1.0.6","10.1.0.11","TCP","1896","0.034659000","","","7010  >  49158 [ACK] Seq=1 Ack=276001 Win=131072 Len=0 TSval=5071 TSecr=5070"
"3521","5.101820","10.1.0.6","10.1.0.11","TCP","376","0.000000000","","0.037963000,0.037963000,0.037963000,0.034659000","7010  >  49158 [ACK] Seq=1 Ack=284001 Win=131072 Len=0 TSval=5079 TSecr=5076"
"4198","5.165197","10.1.0.6","10.1.0.11","TCP","1896","0.063377000","","","7010  >  49158 [ACK] Seq=1 Ack=276001 Win=131072 Len=0 TSval=5071 TSecr=5070"
"4199","5.165197","10.1.0.6","10.1.0.11","TCP","376","0.000000000","","","7010  >  49158 [ACK] Seq=1 Ack=284001 Win=131072 Len=0 TSval=5079 TSecr=5076"
"4219","5.169988","10.1.0.11","10.1.0.6","TCP","6376","0.004791000","-25 dBm","","49158  >  7010 [ACK] Seq=288501 Ack=1 Win=131072 Len=1500 TSval=5177 TSecr=5045"
"4220","5.169988","10.1.0.11","10.1.0.6","TCP","6376","0.000000000","-25 dBm","","49158  >  7010 [ACK] Seq=294501 Ack=1 Win=131072 Len=1500 TSval=5177 TSecr=5045"
"4221","5.169988","10.1.0.11","10.1.0.6","TCP","6376","0.000000000","-25 dBm","","49158  >  7010 [ACK] Seq=300501 Ack=1 Win=131072 Len=1500 TSval=5177 TSecr=5046"
"4222","5.169988","10.1.0.11","10.1.0.6","TCP","6376","0.000000000","-25 dBm","","49158  >  7010 [ACK] Seq=306501 Ack=1 Win=131072 Len=1500 TSval=5177 TSecr=5048"
"4223","5.169988","10.1.0.11","10.1.0.6","TCP","6376","0.000000000","-25 dBm","","49158  >  7010 [ACK] Seq=312501 Ack=1 Win=131072 Len=1500 TSval=5177 TSecr=5051"
"4224","5.169988","10.1.0.11","10.1.0.6","TCP","6376","0.000000000","-25 dBm","","49158  >  7010 [ACK] Seq=318501 Ack=1 Win=131072 Len=1500 TSval=5177 TSecr=5056"
"4225","5.169988","10.1.0.11","10.1.0.6","TCP","6376","0.000000000","-25 dBm","","49158  >  7010 [ACK] Seq=324501 Ack=1 Win=131072 Len=1500 TSval=5177 TSecr=5060"
"4226","5.169988","10.1.0.11","10.1.0.6","TCP","6376","0.000000000","-25 dBm","","49158  >  7010 [ACK] Seq=330501 Ack=1 Win=131072 Len=1500 TSval=5177 TSecr=5065"
"4227","5.169988","10.1.0.11","10.1.0.6","TCP","6376","0.000000000","-25 dBm","","49158  >  7010 [ACK] Seq=336501 Ack=1 Win=131072 Len=1500 TSval=5177 TSecr=5070"
"4228","5.169988","10.1.0.11","10.1.0.6","TCP","6376","0.000000000","-25 dBm","","49158  >  7010 [ACK] Seq=342501 Ack=1 Win=131072 Len=1500 TSval=5177 TSecr=5076"
"4229","5.169988","10.1.0.11","10.1.0.6","TCP","6376","0.000000000","-25 dBm","","49158  >  7010 [ACK] Seq=348501 Ack=1 Win=131072 Len=1500 TSval=5177 TSecr=5079"
"4493","5.191732","10.1.0.6","10.1.0.11","TCP","1744","0.021744000","","0.021744000,0.021744000,0.021744000,0.021744000,0.021744000,0.021744000,0.021744000,0.021744000,0.021744000,0.021744000,0.021744000,0.021744000,0.021744000,0.021744000,0.021744000,0.021744000,0.021744000,0.021744000,0.021744000,0.021744000,0.021744000,0.021744000","7010  >  49158 [ACK] Seq=1 Ack=350001 Win=131072 Len=0 TSval=5182 TSecr=5177"
"4507","5.194227","10.1.0.11","10.1.0.6","TCP","6376","0.002495000","-25 dBm","","49158  >  7010 [ACK] Seq=354501 Ack=1 Win=131072 Len=1500 TSval=5204 TSecr=5180"
"4508","5.194227","10.1.0.11","10.1.0.6","TCP","6376","0.000000000","-25 dBm","","49158  >  7010 [ACK] Seq=360501 Ack=1 Win=131072 Len=1500 TSval=5204 TSecr=5180"
"4509","5.194227","10.1.0.11","10.1.0.6","TCP","6376","0.000000000","-25 dBm","","49158  >  7010 [ACK] Seq=366501 Ack=1 Win=131072 Len=1500 TSval=5204 TSecr=5180"
"4510","5.194227","10.1.0.11","10.1.0.6","TCP","6376","0.000000000","-25 dBm","","49158  >  7010 [ACK] Seq=372501 Ack=1 Win=131072 Len=1500 TSval=5204 TSecr=5181"
"4511","5.194227","10.1.0.11","10.1.0.6","TCP","6376","0.000000000","-25 dBm","","49158  >  7010 [ACK] Seq=378501 Ack=1 Win=131072 Len=1500 TSval=5204 TSecr=5181"
"4512","5.194227","10.1.0.11","10.1.0.6","TCP","6452","0.000000000","-25 dBm","","49158  >  7010 [ACK] Seq=385001 Ack=1 Win=131072 Len=1000 TSval=5204 TSecr=5182"
"4520","5.194999","10.1.0.11","10.1.0.6","TCP","3300","0.000772000","-25 dBm","","49158  >  7010 [ACK] Seq=388001 Ack=1 Win=131072 Len=1000 TSval=5207 TSecr=5182"
"4532","5.196135","10.1.0.11","10.1.0.6","TCP","1134","0.001136000","-25 dBm","","49158  >  7010 [ACK] Seq=389001 Ack=1 Win=131072 Len=1000 TSval=5208 TSecr=5182"
"4544","5.197047","10.1.0.11","10.1.0.6","TCP","1134","0.000912000","-25 dBm","","49158  >  7010 [ACK] Seq=390001 Ack=1 Win=131072 Len=1000 TSval=5208 TSecr=5182"
"4560","5.198453","10.1.0.11","10.1.0.6","TCP","2224","0.001406000","-25 dBm","","49158  >  7010 [ACK] Seq=392001 Ack=1 Win=131072 Len=1000 TSval=5210 TSecr=5182"
"4572","5.199430","10.1.0.11","10.1.0.6","TCP","1134","0.000977000","-25 dBm","","49158  >  7010 [ACK] Seq=393001 Ack=1 Win=131072 Len=1000 TSval=5211 TSecr=5182"
"4584","5.200342","10.1.0.11","10.1.0.6","TCP","1134","0.000912000","-25 dBm","","49158  >  7010 [ACK] Seq=394001 Ack=1 Win=131072 Len=1000 TSval=5212 TSecr=5182"
"4596","5.201318","10.1.0.11","10.1.0.6","TCP","2224","0.000976000","-25 dBm","","49158  >  7010 [ACK] Seq=396001 Ack=1 Win=131072 Len=1000 TSval=5213 TSecr=5182"
"4612","5.202598","10.1.0.11","10.1.0.6","TCP","1134","0.001280000","-25 dBm","","49158  >  7010 [ACK] Seq=397001 Ack=1 Win=131072 Len=1000 TSval=5214 TSecr=5182"
"4625","5.203596","10.1.0.11","10.1.0.6","TCP","1134","0.000998000","-25 dBm","","49158  >  7010 [ACK] Seq=398001 Ack=1 Win=131072 Len=1000 TSval=5215 TSecr=5182"
"4637","5.204700","10.1.0.11","10.1.0.6","TCP","2224","0.001104000","-25 dBm","","49158  >  7010 [ACK] Seq=400001 Ack=1 Win=131072 Len=1000 TSval=5216 TSecr=5182"
"4649","5.205612","10.1.0.11","10.1.0.6","TCP","1134","0.000912000","-25 dBm","","49158  >  7010 [ACK] Seq=401001 Ack=1 Win=131072 Len=1000 TSval=5217 TSecr=5182"
"4661","5.206525","10.1.0.11","10.1.0.6","TCP","1134","0.000913000","-25 dBm","","49158  >  7010 [ACK] Seq=402001 Ack=1 Win=131072 Len=1000 TSval=5218 TSecr=5182"
"4673","5.207437","10.1.0.11","10.1.0.6","TCP","1134","0.000912000","-25 dBm","","49158  >  7010 [ACK] Seq=403001 Ack=1 Win=131072 Len=1000 TSval=5219 TSecr=5182"
"4685","5.208349","10.1.0.11","10.1.0.6","TCP","1134","0.000912000","-25 dBm","","49158  >  7010 [ACK] Seq=404001 Ack=1 Win=131072 Len=1000 TSval=5220 TSecr=5182"
"4697","5.209388","10.1.0.11","10.1.0.6","TCP","832","0.001039000","-25 dBm","0.275754000,0.275754000,0.275754000,0.275754000,0.275754000,0.275754000,0.275754000,0.275754000,0.275754000,0.275754000","7011  >  49153 [ACK] Seq=1 Ack=45001 Win=131072 Len=0 TSval=4948 TSecr=4936"
"4712","5.210350","10.1.0.6","10.1.0.11","TCP","6376","0.000962000","","","49153  >  7011 [ACK] Seq=49501 Ack=1 Win=131072 Len=1500 TSval=5221 TSecr=4948"
"4713","5.210350","10.1.0.6","10.1.0.11","TCP","6376","0.000000000","","","49153  >  7011 [ACK] Seq=55501 Ack=1 Win=131072 Len=1500 TSval=5221 TSecr=4948"
"4714","5.210350","10.1.0.6","10.1.0.11","TCP","6376","0.000000000","","","49153  >  7011 [ACK] Seq=61501 Ack=1 Win=131072 Len=1500 TSval=5221 TSecr=4948"
"4715","5.210350","10.1.0.6","10.1.0.11","TCP","6376","0.000000000","","","49153  >  7011 [ACK] Seq=67501 Ack=1 Win=131072 Len=1500 TSval=5221 TSecr=4948"
"4716","5.210350","10.1.0.6","10.1.0.11","TCP","6376","0.000000000","","","49153  >  7011 [ACK] Seq=73501 Ack=1 Win=131072 Len=1500 TSval=5221 TSecr=4948"
"4717","5.210350","10.1.0.6","10.1.0.11","TCP","6376","0.000000000","","","49153  >  7011 [ACK] Seq=79501 Ack=1 Win=131072 Len=1500 TSval=5221 TSecr=4948"
"4718","5.210350","10.1.0.6","10.1.0.11","TCP","6376","0.000000000","","","49153  >  7011 [ACK] Seq=85501 Ack=1 Win=131072 Len=1500 TSval=5221 TSecr=4948"
"4719","5.210350","10.1.0.6","10.1.0.11","TCP","6376","0.000000000","","","49153  >  7011 [ACK] Seq=91501 Ack=1 Win=131072 Len=1500 TSval=5221 TSecr=4948"
"4720","5.210350","10.1.0.6","10.1.0.11","TCP","6376","0.000000000","","","49153  >  7011 [ACK] Seq=97501 Ack=1 Win=131072 Len=1500 TSval=5221 TSecr=4948"
"4721","5.210350","10.1.0.6","10.1.0.11","TCP","3224","0.000000000","","","49153  >  7011 [ACK] Seq=100501 Ack=1 Win=131072 Len=1500 TSval=5221 TSecr=4948"
"4800","5.230789","10.1.0.11","10.1.0.6","TCP","6528","0.020439000","-25 dBm","","49158  >  7010 [ACK] Seq=410001 Ack=1 Win=131072 Len=1000 TSval=5224 TSecr=5182"
"4801","5.230789","10.1.0.11","10.1.0.6","TCP","6528","0.000000000","-25 dBm","","49158  >  7010 [ACK] Seq=416001 Ack=1 Win=131072 Len=1000 TSval=5229 TSecr=5182"
"4802","5.230789","10.1.0.11","10.1.0.6","TCP","2224","0.000000000","-25 dBm","","49158  >  7010 [ACK] Seq=418001 Ack=1 Win=131072 Len=1000 TSval=5231 TSecr=5182"
"4849","5.238009","10.1.0.6","10.1.0.11","TCP","2276","0.007220000","","0.043782000,0.043782000,0.043782000,0.043782000,0.043782000,0.043782000,0.043782000,0.043782000,0.043782000,0.043782000,0.043782000,0.043782000,0.043010000,0.043010000,0.040962000,0.039556000,0.037667000,0.036691000,0.034413000,0.033309000,0.031484000,0.029660000,0.007220000,0.007220000,0.007220000,0.007220000,0.007220000,0.007220000,0.007220000","7010  >  49158 [ACK] Seq=1 Ack=419001 Win=131072 Len=0 TSval=5243 TSecr=5230"
"4865","5.241191","10.1.0.11","10.1.0.6","TCP","6376","0.003182000","-25 dBm","","49158  >  7010 [ACK] Seq=423501 Ack=1 Win=131072 Len=1500 TSval=5250 TSecr=5205"
"4866","5.241191","10.1.0.11","10.1.0.6","TCP","6376","0.000000000","-25 dBm","","49158  >  7010 [ACK] Seq=429501 Ack=1 Win=131072 Len=1500 TSval=5250 TSecr=5205"
"4867","5.241191","10.1.0.11","10.1.0.6","TCP","6376","0.000000000","-25 dBm","","49158  >  7010 [ACK] Seq=435501 Ack=1 Win=131072 Len=1500 TSval=5250 TSecr=5206"
"4868","5.241191","10.1.0.11","10.1.0.6","TCP","7452","0.000000000","-25 dBm","","49158  >  7010 [ACK] Seq=443001 Ack=1 Win=131072 Len=1000 TSval=5251 TSecr=5243"
"4869","5.241191","10.1.0.11","10.1.0.6","TCP","1134","0.000000000","-25 dBm","","49158  >  7010 [ACK] Seq=444001 Ack=1 Win=131072 Len=1000 TSval=5252 TSecr=5243"
"4875","5.241811","10.1.0.11","10.1.0.6","TCP","2224","0.000620000","-25 dBm","","49158  >  7010 [ACK] Seq=446001 Ack=1 Win=131072 Len=1000 TSval=5253 TSecr=5243"
"4881","5.242267","10.1.0.11","10.1.0.6","TCP","1134","0.000456000","-25 dBm","","49158  >  7010 [ACK] Seq=447001 Ack=1 Win=131072 Len=1000 TSval=5254 TSecr=5243"
"4887","5.242777","10.1.0.11","10.1.0.6","TCP","1516","0.000510000","-25 dBm","0.032427000,0.032427000,0.032427000,0.032427000,0.032427000,0.032427000,0.032427000,0.032427000,0.032427000,0.032427000,0.032427000,0.032427000,0.032427000,0.032427000,0.032427000,0.032427000,0.032427000,0.032427000,0.032427000","7011  >  49153 [ACK] Seq=1 Ack=102001 Win=131072 Len=0 TSval=5224 TSecr=5221"
"4904","5.244067","10.1.0.6","10.1.0.11","TCP","6376","0.001290000","","","49153  >  7011 [ACK] Seq=106501 Ack=1 Win=131072 Len=1500 TSval=5255 TSecr=5223"
"4905","5.244067","10.1.0.6","10.1.0.11","TCP","6376","0.000000000","","","49153  >  7011 [ACK] Seq=112501 Ack=1 Win=131072 Len=1500 TSval=5255 TSecr=5223"
"4906","5.244067","10.1.0.6","10.1.0.11","TCP","6376","0.000000000","","","49153  >  7011 [ACK] Seq=118501 Ack=1 Win=131072 Len=1500 TSval=5255 TSecr=5223"
"4907","5.244067","10.1.0.6","10.1.0.11","TCP","6376","0.000000000","","","49153  >  7011 [ACK] Seq=124501 Ack=1 Win=131072 Len=1500 TSval=5255 TSecr=5223"
"4908","5.244067","10.1.0.6","10.1.0.11","TCP","6376","0.000000000","","","49153  >  7011 [ACK] Seq=130501 Ack=1 Win=131072 Len=1500 TSval=5255 TSecr=5223"
"4909","5.244067","10.1.0.6","10.1.0.11","TCP","6376","0.000000000","","","49153  >  7011 [ACK] Seq=136501 Ack=1 Win=131072 Len=1500 TSval=5255 TSecr=5224"
"4910","5.244067","10.1.0.6","10.1.0.11","TCP","6376","0.000000000","","","49153  >  7011 [ACK] Seq=142501 Ack=1 Win=131072 Len=1500 TSval=5255 TSecr=5224"
"4911","5.244067","10.1.0.6","10.1.0.11","TCP","6376","0.000000000","","","49153  >  7011 [ACK] Seq=148501 Ack=1 Win=131072 Len=1500 TSval=5255 TSecr=5224"
"4912","5.244067","10.1.0.6","10.1.0.11","TCP","6376","0.000000000","","","49153  >  7011 [ACK] Seq=154501 Ack=1 Win=131072 Len=1500 TSval=5255 TSecr=5224"
"4913","5.244067","10.1.0.6","10.1.0.11","TCP","6376","0.000000000","","","49153  >  7011 [ACK] Seq=160501 Ack=1 Win=131072 Len=1500 TSval=5255 TSecr=5224"
"4956","5.259247","10.1.0.6","10.1.0.11","TCP","6376","0.015180000","","","[TCP Retransmission] [TCP Retransmission] [TCP Retransmission] [TCP Retransmission] 49153  >  7011 [ACK] Seq=106501 Ack=1 Win=131072 Len=1500 TSval=5255 TSecr=5223"
"4957","5.259247","10.1.0.6","10.1.0.11","TCP","6376","0.000000000","","","[TCP Retransmission] [TCP Retransmission] [TCP Retransmission] [TCP Retransmission] 49153  >  7011 [ACK] Seq=112501 Ack=1 Win=131072 Len=1500 TSval=5255 TSecr=5223"
"4958","5.259247","10.1.0.6","10.1.0.11","TCP","6376","0.000000000","","","[TCP Retransmission] [TCP Retransmission] [TCP Retransmission] [TCP Retransmission] 49153  >  7011 [ACK] Seq=118501 Ack=1 Win=131072 Len=1500 TSval=5255 TSecr=5223"
"4959","5.259247","10.1.0.6","10.1.0.11","TCP","6376","0.000000000","","","[TCP Retransmission] [TCP Retransmission] [TCP Retransmission] [TCP Retransmission] 49153  >  7011 [ACK] Seq=124501 Ack=1 Win=131072 Len=1500 TSval=5255 TSecr=5223"
"4960","5.259247","10.1.0.6","10.1.0.11","TCP","6376","0.000000000","","","[TCP Retransmission] [TCP Retransmission] [TCP Retransmission] [TCP Retransmission] 49153  >  7011 [ACK] Seq=130501 Ack=1 Win=131072 Len=1500 TSval=5255 TSecr=5223"
