"No.","Time","Source","Destination","Protocol","Length","Time delta from previous displayed frame","Signal strength (dBm)","The RTT to ACK the segment was","Info"
"281","1.437703","10.1.0.11","10.1.0.3","TCP","138","0.000000000","-36 dBm","","49155  >  7004 [SYN] Seq=0 Win=65535 Len=0 TSval=1450 TSecr=0 WS=4 SACK_PERM=1"
"290","1.438361","10.1.0.3","10.1.0.11","TCP","138","0.000658000","","","49153  >  7005 [SYN] Seq=0 Win=65535 Len=0 TSval=1450 TSecr=0 WS=4 SACK_PERM=1"
"293","1.438636","10.1.0.11","10.1.0.3","TCP","138","0.000275000","-36 dBm","0.000275000","7005  >  49153 [SYN, ACK] Seq=0 Ack=1 Win=65535 Len=0 TSval=1450 TSecr=1450 WS=4 SACK_PERM=1"
"296","1.438782","10.1.0.3","10.1.0.11","TCP","134","0.000146000","","0.000146000","49153  >  7005 [ACK] Seq=1 Ack=1 Win=131072 Len=0 TSval=1451 TSecr=1450"
"299","1.439177","10.1.0.3","10.1.0.11","TCP","138","0.000395000","","0.001474000","7004  >  49155 [SYN, ACK] Seq=0 Ack=1 Win=65535 Len=0 TSval=1450 TSecr=1450 WS=4 SACK_PERM=1"
"302","1.439443","10.1.0.11","10.1.0.3","TCP","134","0.000266000","-36 dBm","0.000266000","49155  >  7004 [ACK] Seq=1 Ack=1 Win=131072 Len=0 TSval=1451 TSecr=1450"
"1040","4.841209","10.1.0.11","10.1.0.3","TCP","2224","3.401766000","-36 dBm","","49155  >  7004 [ACK] Seq=1001 Ack=1 Win=131072 Len=1000 TSval=4853 TSecr=1450"
"1060","4.843113","10.1.0.11","10.1.0.3","TCP","2224","0.001904000","-36 dBm","","49155  >  7004 [ACK] Seq=3001 Ack=1 Win=131072 Len=1000 TSval=4854 TSecr=1450"
"1075","4.844597","10.1.0.3","10.1.0.11","TCP","6528","0.001484000","","","49153  >  7005 [ACK] Seq=5001 Ack=1 Win=131072 Len=1000 TSval=4855 TSecr=1450"
"1076","4.844597","10.1.0.3","10.1.0.11","TCP","1134","0.000000000","","","49153  >  7005 [ACK] Seq=6001 Ack=1 Win=131072 Len=1000 TSval=4856 TSecr=1450"
"1087","4.846561","10.1.0.11","10.1.0.3","TCP","4376","0.001964000","-36 dBm","","49155  >  7004 [ACK] Seq=7001 Ack=1 Win=131072 Len=1000 TSval=4858 TSecr=1450"
"1107","4.849058","10.1.0.11","10.1.0.3","TCP","4376","0.002497000","-36 dBm","","49155  >  7004 [ACK] Seq=11001 Ack=1 Win=131072 Len=1000 TSval=4861 TSecr=1450"
"1127","4.851021","10.1.0.11","10.1.0.3","TCP","376","0.001963000","-36 dBm","0.006424000,0.006424000,0.006424000,0.006424000","7005  >  49153 [ACK] Seq=1 Ack=7001 Win=131072 Len=0 TSval=4857 TSecr=4855"
"1155","4.856149","10.1.0.3","10.1.0.11","TCP","6528","0.005128000","","","49153  >  7005 [ACK] Seq=12001 Ack=1 Win=131072 Len=1000 TSval=4861 TSecr=1450"
"1156","4.856149","10.1.0.3","10.1.0.11","TCP","6528","0.000000000","","","49153  >  7005 [ACK] Seq=18001 Ack=1 Win=131072 Len=1000 TSval=4866 TSecr=4857"
"1157","4.856149","10.1.0.3","10.1.0.11","TCP","2224","0.000000000","","","49153  >  7005 [ACK] Seq=20001 Ack=1 Win=131072 Len=1000 TSval=4867 TSecr=4857"
"1188","4.860678","10.1.0.11","10.1.0.3","TCP","3300","0.004529000","-36 dBm","","49155  >  7004 [ACK] Seq=14001 Ack=1 Win=131072 Len=1000 TSval=4863 TSecr=1450"
"1281","4.870853","10.1.0.3","10.1.0.11","TCP","6528","0.010175000","","","[TCP Retransmission] [TCP Retransmission] [TCP Retransmission] [TCP Retransmission] [TCP Retransmission] [TCP Retransmission] 49153  >  7005 [ACK] Seq=12001 Ack=1 Win=131072 Len=1000 TSval=4861 TSecr=1450"
"1282","4.870853","10.1.0.3","10.1.0.11","TCP","6528","0.000000000","","","[TCP Retransmission] [TCP Retransmission] [TCP Retransmission] [TCP Retransmission] [TCP Retransmission] [TCP Retransmission] 49153  >  7005 [ACK] Seq=18001 Ack=1 Win=131072 Len=1000 TSval=4866 TSecr=4857"
"1283","4.870853","10.1.0.3","10.1.0.11","TCP","2224","0.000000000","","","[TCP Retransmission] [TCP Retransmission] 49153  >  7005 [ACK] Seq=20001 Ack=1 Win=131072 Len=1000 TSval=4867 TSecr=4857"
"1284","4.870853","10.1.0.3","10.1.0.11","TCP","6528","0.000000000","","","49153  >  7005 [ACK] Seq=26001 Ack=1 Win=131072 Len=1000 TSval=4872 TSecr=4857"
"1285","4.870853","10.1.0.3","10.1.0.11","TCP","1134","0.000000000","","","49153  >  7005 [ACK] Seq=27001 Ack=1 Win=131072 Len=1000 TSval=4873 TSecr=4857"
"1372","4.880485","10.1.0.3","10.1.0.11","TCP","680","0.009632000","","0.039276000,0.037372000,0.033924000,0.033924000,0.031427000,0.031427000,0.019807000,0.019807000","7004  >  49155 [ACK] Seq=1 Ack=15001 Win=131072 Len=0 TSval=4873 TSecr=4862"
"1405","4.884090","10.1.0.11","10.1.0.3","TCP","6376","0.003605000","-36 dBm","","49155  >  7004 [ACK] Seq=19501 Ack=1 Win=131072 Len=1500 TSval=4893 TSecr=4855"
"1406","4.884090","10.1.0.11","10.1.0.3","TCP","6376","0.000000000","-36 dBm","","49155  >  7004 [ACK] Seq=25501 Ack=1 Win=131072 Len=1500 TSval=4893 TSecr=4859"
"1407","4.884090","10.1.0.11","10.1.0.3","TCP","6376","0.000000000","-36 dBm","","49155  >  7004 [ACK] Seq=31501 Ack=1 Win=131072 Len=1500 TSval=4893 TSecr=4861"
"1408","4.884090","10.1.0.11","10.1.0.3","TCP","6376","0.000000000","-36 dBm","","49155  >  7004 [ACK] Seq=37501 Ack=1 Win=131072 Len=1500 TSval=4893 TSecr=4873"
"1409","4.884090","10.1.0.11","10.1.0.3","TCP","6376","0.000000000","-36 dBm","","49155  >  7004 [ACK] Seq=43501 Ack=1 Win=131072 Len=1500 TSval=4893 TSecr=4873"
"1456","4.889853","10.1.0.3","10.1.0.11","TCP","832","0.005763000","","0.005763000,0.005763000,0.005763000,0.005763000,0.005763000,0.005763000,0.005763000,0.005763000,0.005763000,0.005763000","7004  >  49155 [ACK] Seq=1 Ack=45001 Win=131072 Len=0 TSval=4896 TSecr=4893"
"1474","4.892536","10.1.0.11","10.1.0.3","TCP","6376","0.002683000","-36 dBm","","49155  >  7004 [ACK] Seq=49501 Ack=1 Win=131072 Len=1500 TSval=4902 TSecr=4895"
"1475","4.892536","10.1.0.11","10.1.0.3","TCP","6376","0.000000000","-36 dBm","","49155  >  7004 [ACK] Seq=55501 Ack=1 Win=131072 Len=1500 TSval=4902 TSecr=4895"
"1476","4.892536","10.1.0.11","10.1.0.3","TCP","7452","0.000000000","-36 dBm","","49155  >  7004 [ACK] Seq=63001 Ack=1 Win=131072 Len=1000 TSval=4902 TSecr=4896"
"1477","4.892536","10.1.0.11","10.1.0.3","TCP","1134","0.000000000","-36 dBm","","49155  >  7004 [ACK] Seq=64001 Ack=1 Win=131072 Len=1000 TSval=4903 TSecr=4896"
"1489","4.893868","10.1.0.11","10.1.0.3","TCP","3300","0.001332000","-36 dBm","","49155  >  7004 [ACK] Seq=67001 Ack=1 Win=131072 Len=1000 TSval=4906 TSecr=4896"
"1501","4.894876","10.1.0.11","10.1.0.3","TCP","1134","0.001008000","-36 dBm","","49155  >  7004 [ACK] Seq=68001 Ack=1 Win=131072 Len=1000 TSval=4906 TSecr=4896"
"1514","4.895915","10.1.0.11","10.1.0.3","TCP","1134","0.001039000","-36 dBm","","49155  >  7004 [ACK] Seq=69001 Ack=1 Win=131072 Len=1000 TSval=4907 TSecr=4896"
"1524","4.896707","10.1.0.11","10.1.0.3","TCP","1134","0.000792000","-36 dBm","","49155  >  7004 [ACK] Seq=70001 Ack=1 Win=131072 Len=1000 TSval=4908 TSecr=4896"
"1534","4.897500","10.1.0.11","10.1.0.3","TCP","1134","0.000793000","-36 dBm","","49155  >  7004 [ACK] Seq=71001 Ack=1 Win=131072 Len=1000 TSval=4909 TSecr=4896"
"1544","4.898292","10.1.0.11","10.1.0.3","TCP","1134","0.000792000","-36 dBm","","49155  >  7004 [ACK] Seq=72001 Ack=1 Win=131072 Len=1000 TSval=4910 TSecr=4896"
"1554","4.899052","10.1.0.11","10.1.0.3","TCP","1134","0.000760000","-36 dBm","","49155  >  7004 [ACK] Seq=73001 Ack=1 Win=131072 Len=1000 TSval=4910 TSecr=4896"
"1566","4.900028","10.1.0.11","10.1.0.3","TCP","1134","0.000976000","-36 dBm","","49155  >  7004 [ACK] Seq=74001 Ack=1 Win=131072 Len=1000 TSval=4911 TSecr=4896"
"1574","4.900668","10.1.0.11","10.1.0.3","TCP","1134","0.000640000","-36 dBm","","49155  >  7004 [ACK] Seq=75001 Ack=1 Win=131072 Len=1000 TSval=4912 TSecr=4896"
"1584","4.901532","10.1.0.11","10.1.0.3","TCP","1134","0.000864000","-36 dBm","","49155  >  7004 [ACK] Seq=76001 Ack=1 Win=131072 Len=1000 TSval=4913 TSecr=4896"
"1594","4.902324","10.1.0.11","10.1.0.3","TCP","1134","0.000792000","-36 dBm","","49155  >  7004 [ACK] Seq=77001 Ack=1 Win=131072 Len=1000 TSval=4914 TSecr=4896"
"1604","4.903116","10.1.0.11","10.1.0.3","TCP","1134","0.000792000","-36 dBm","","49155  >  7004 [ACK] Seq=78001 Ack=1 Win=131072 Len=1000 TSval=4914 TSecr=4896"
"1614","4.903908","10.1.0.11","10.1.0.3","TCP","1134","0.000792000","-36 dBm","","49155  >  7004 [ACK] Seq=79001 Ack=1 Win=131072 Len=1000 TSval=4915 TSecr=4896"
"1624","4.904701","10.1.0.11","10.1.0.3","TCP","1134","0.000793000","-36 dBm","","49155  >  7004 [ACK] Seq=80001 Ack=1 Win=131072 Len=1000 TSval=4916 TSecr=4896"
"1634","4.905493","10.1.0.11","10.1.0.3","TCP","1134","0.000792000","-36 dBm","","49155  >  7004 [ACK] Seq=81001 Ack=1 Win=131072 Len=1000 TSval=4917 TSecr=4896"
"1644","4.906253","10.1.0.11","10.1.0.3","TCP","1134","0.000760000","-36 dBm","","49155  >  7004 [ACK] Seq=82001 Ack=1 Win=131072 Len=1000 TSval=4918 TSecr=4896"
"1657","4.907406","10.1.0.11","10.1.0.3","TCP","2224","0.001153000","-36 dBm","","49155  >  7004 [ACK] Seq=84001 Ack=1 Win=131072 Len=1000 TSval=4919 TSecr=4896"
"1669","4.908382","10.1.0.11","10.1.0.3","TCP","1134","0.000976000","-36 dBm","","49155  >  7004 [ACK] Seq=85001 Ack=1 Win=131072 Len=1000 TSval=4920 TSecr=4896"
"1681","4.909294","10.1.0.11","10.1.0.3","TCP","1134","0.000912000","-36 dBm","","49155  >  7004 [ACK] Seq=86001 Ack=1 Win=131072 Len=1000 TSval=4921 TSecr=4896"
"1693","4.910206","10.1.0.11","10.1.0.3","TCP","1134","0.000912000","-36 dBm","","49155  >  7004 [ACK] Seq=87001 Ack=1 Win=131072 Len=1000 TSval=4922 TSecr=4896"
"1705","4.911151","10.1.0.11","10.1.0.3","TCP","1134","0.000945000","-36 dBm","","49155  >  7004 [ACK] Seq=88001 Ack=1 Win=131072 Len=1000 TSval=4922 TSecr=4896"
"1715","4.912236","10.1.0.11","10.1.0.3","TCP","1136","0.001085000","-36 dBm","","49155  >  7004 [ACK] Seq=89001 Ack=1 Win=131072 Len=1000 TSval=4923 TSecr=4896"
"1716","4.912236","10.1.0.11","10.1.0.3","TCP","1134","0.000000000","-36 dBm","","49155  >  7004 [ACK] Seq=90001 Ack=1 Win=131072 Len=1000 TSval=4924 TSecr=4896"
"1728","4.913280","10.1.0.11","10.1.0.3","TCP","1134","0.001044000","-36 dBm","","49155  >  7004 [ACK] Seq=91001 Ack=1 Win=131072 Len=1000 TSval=4925 TSecr=4896"
"1740","4.914192","10.1.0.11","10.1.0.3","TCP","1134","0.000912000","-36 dBm","","49155  >  7004 [ACK] Seq=92001 Ack=1 Win=131072 Len=1000 TSval=4926 TSecr=4896"
"1752","4.915136","10.1.0.11","10.1.0.3","TCP","1134","0.000944000","-36 dBm","","49155  >  7004 [ACK] Seq=93001 Ack=1 Win=131072 Len=1000 TSval=4926 TSecr=4896"
"1762","4.915928","10.1.0.11","10.1.0.3","TCP","1134","0.000792000","-36 dBm","","49155  >  7004 [ACK] Seq=94001 Ack=1 Win=131072 Len=1000 TSval=4927 TSecr=4896"
"1772","4.916720","10.1.0.11","10.1.0.3","TCP","1134","0.000792000","-36 dBm","","49155  >  7004 [ACK] Seq=95001 Ack=1 Win=131072 Len=1000 TSval=4928 TSecr=4896"
"1784","4.917967","10.1.0.11","10.1.0.3","TCP","2224","0.001247000","-36 dBm","","49155  >  7004 [ACK] Seq=97001 Ack=1 Win=131072 Len=1000 TSval=4930 TSecr=4896"
"1796","4.919039","10.1.0.11","10.1.0.3","TCP","1134","0.001072000","-36 dBm","","49155  >  7004 [ACK] Seq=98001 Ack=1 Win=131072 Len=1000 TSval=4930 TSecr=4896"
"1806","4.919800","10.1.0.11","10.1.0.3","TCP","1134","0.000761000","-36 dBm","","49155  >  7004 [ACK] Seq=99001 Ack=1 Win=131072 Len=1000 TSval=4931 TSecr=4896"
"1818","4.920744","10.1.0.11","10.1.0.3","TCP","1134","0.000944000","-36 dBm","","49155  >  7004 [ACK] Seq=100001 Ack=1 Win=131072 Len=1000 TSval=4932 TSecr=4896"
"1828","4.921536","10.1.0.11","10.1.0.3","TCP","1134","0.000792000","-36 dBm","","49155  >  7004 [ACK] Seq=101001 Ack=1 Win=131072 Len=1000 TSval=4933 TSecr=4896"
"1845","4.922755","10.1.0.3","10.1.0.11","TCP","1972","0.001219000","","0.030219000,0.030219000,0.030219000,0.030219000,0.030219000,0.030219000,0.030219000,0.028887000,0.027879000,0.026048000,0.024463000,0.022727000,0.021223000,0.019639000,0.018054000,0.016502000,0.015349000,0.013461000,0.011604000,0.010519000,0.008563000,0.006827000,0.004788000,0.003716000,0.002011000","7004  >  49155 [ACK] Seq=1 Ack=101001 Win=131072 Len=0 TSval=4933 TSecr=4931"
"1868","4.924526","10.1.0.11","10.1.0.3","TCP","832","0.001771000","-36 dBm","0.068377000,0.068377000,0.068377000,0.068377000,0.068377000,0.068377000,0.068377000,0.053673000,0.053673000,0.053673000","7005  >  49153 [ACK] Seq=1 Ack=27001 Win=131072 Len=0 TSval=4884 TSecr=4871"
"1886","4.929593","10.1.0.3","10.1.0.11","TCP","6376","0.005067000","","","49153  >  7005 [ACK] Seq=32501 Ack=1 Win=131072 Len=1500 TSval=4937 TSecr=4883"
"1887","4.929593","10.1.0.3","10.1.0.11","TCP","6376","0.000000000","","","49153  >  7005 [ACK] Seq=38501 Ack=1 Win=131072 Len=1500 TSval=4937 TSecr=4883"
"1888","4.929593","10.1.0.3","10.1.0.11","TCP","6376","0.000000000","","","49153  >  7005 [ACK] Seq=44501 Ack=1 Win=131072 Len=1500 TSval=4937 TSecr=4883"
"1889","4.929593","10.1.0.3","10.1.0.11","TCP","6376","0.000000000","","","49153  >  7005 [ACK] Seq=50501 Ack=1 Win=131072 Len=1500 TSval=4937 TSecr=4883"
"1890","4.929593","10.1.0.3","10.1.0.11","TCP","6376","0.000000000","","","49153  >  7005 [ACK] Seq=56501 Ack=1 Win=131072 Len=1500 TSval=4937 TSecr=4884"
"1891","4.929593","10.1.0.3","10.1.0.11","TCP","6376","0.000000000","","","49153  >  7005 [ACK] Seq=62501 Ack=1 Win=131072 Len=1500 TSval=4937 TSecr=4884"
"1892","4.929593","10.1.0.3","10.1.0.11","TCP","4800","0.000000000","","","49153  >  7005 [ACK] Seq=67001 Ack=1 Win=131072 Len=1500 TSval=4937 TSecr=4884"
"2005","4.947977","10.1.0.3","10.1.0.11","TCP","1972","0.018384000","","","7004  >  49155 [ACK] Seq=1 Ack=101001 Win=131072 Len=0 TSval=4933 TSecr=4931"
"2032","4.952400","10.1.0.11","10.1.0.3","TCP","6376","0.004423000","-36 dBm","","49155  >  7004 [ACK] Seq=106501 Ack=1 Win=131072 Len=1500 TSval=4960 TSecr=4904"
"2033","4.952400","10.1.0.11","10.1.0.3","TCP","6376","0.000000000","-36 dBm","","49155  >  7004 [ACK] Seq=112501 Ack=1 Win=131072 Len=1500 TSval=4960 TSecr=4904"
"2034","4.952400","10.1.0.11","10.1.0.3","TCP","6376","0.000000000","-36 dBm","","49155  >  7004 [ACK] Seq=118501 Ack=1 Win=131072 Len=1500 TSval=4960 TSecr=4905"
"2035","4.952400","10.1.0.11","10.1.0.3","TCP","6376","0.000000000","-36 dBm","","49155  >  7004 [ACK] Seq=124501 Ack=1 Win=131072 Len=1500 TSval=4960 TSecr=4907"
"2036","4.952400","10.1.0.11","10.1.0.3","TCP","6376","0.000000000","-36 dBm","","49155  >  7004 [ACK] Seq=130501 Ack=1 Win=131072 Len=1500 TSval=4960 TSecr=4912"
"2037","4.952400","10.1.0.11","10.1.0.3","TCP","7528","0.000000000","-36 dBm","","49155  >  7004 [ACK] Seq=138001 Ack=1 Win=131072 Len=1000 TSval=4962 TSecr=4933"
"2077","4.960222","10.1.0.11","10.1.0.3","TCP","6528","0.007822000","-36 dBm","","49155  >  7004 [ACK] Seq=144001 Ack=1 Win=131072 Len=1000 TSval=4967 TSecr=4933"
"2078","4.960222","10.1.0.11","10.1.0.3","TCP","5452","0.000000000","-36 dBm","","49155  >  7004 [ACK] Seq=149001 Ack=1 Win=131072 Len=1000 TSval=4971 TSecr=4933"
"2088","4.961234","10.1.0.3","10.1.0.11","TCP","1516","0.001012000","","0.008834000,0.008834000,0.008834000,0.008834000,0.008834000,0.008834000,0.008834000,0.008834000,0.008834000,0.008834000,0.008834000,0.008834000,0.008834000,0.001012000,0.001012000,0.001012000,0.001012000,0.001012000,0.001012000","7004  >  49155 [ACK] Seq=1 Ack=150001 Win=131072 Len=0 TSval=4972 TSecr=4970"
"2089","4.961500","10.1.0.11","10.1.0.3","TCP","2224","0.000266000","-36 dBm","","49155  >  7004 [ACK] Seq=151001 Ack=1 Win=131072 Len=1000 TSval=4973 TSecr=4933"
"2097","4.962108","10.1.0.11","10.1.0.3","TCP","1134","0.000608000","-36 dBm","","49155  >  7004 [ACK] Seq=152001 Ack=1 Win=131072 Len=1000 TSval=4974 TSecr=4933"
"2105","4.962716","10.1.0.11","10.1.0.3","TCP","1134","0.000608000","-36 dBm","","49155  >  7004 [ACK] Seq=153001 Ack=1 Win=131072 Len=1000 TSval=4974 TSecr=4933"
"2114","4.963419","10.1.0.11","10.1.0.3","TCP","1134","0.000703000","-36 dBm","","49155  >  7004 [ACK] Seq=154001 Ack=1 Win=131072 Len=1000 TSval=4975 TSecr=4933"
"2132","4.964826","10.1.0.11","10.1.0.3","TCP","1134","0.001407000","-36 dBm","","49155  >  7004 [ACK] Seq=155001 Ack=1 Win=131072 Len=1000 TSval=4976 TSecr=4933"
"2159","4.969250","10.1.0.11","10.1.0.3","TCP","3300","0.004424000","-36 dBm","","49155  >  7004 [ACK] Seq=158001 Ack=1 Win=131072 Len=1000 TSval=4978 TSecr=4933"
"2171","4.970421","10.1.0.3","10.1.0.11","TCP","1516","0.001171000","","","7004  >  49155 [ACK] Seq=1 Ack=150001 Win=131072 Len=0 TSval=4972 TSecr=4970"
"2172","4.970421","10.1.0.3","10.1.0.11","TCP","376","0.000000000","","0.008921000,0.007705000,0.005595000,0.001171000","7004  >  49155 [ACK] Seq=1 Ack=158001 Win=131072 Len=0 TSval=4981 TSecr=4977"
"2483","5.001313","10.1.0.3","10.1.0.11","TCP","1516","0.030892000","","","7004  >  49155 [ACK] Seq=1 Ack=150001 Win=131072 Len=0 TSval=4972 TSecr=4970"
"2484","5.001313","10.1.0.3","10.1.0.11","TCP","376","0.000000000","","","7004  >  49155 [ACK] Seq=1 Ack=158001 Win=131072 Len=0 TSval=4981 TSecr=4977"
"2507","5.004933","10.1.0.11","10.1.0.3","TCP","6376","0.003620000","-36 dBm","","49155  >  7004 [ACK] Seq=163501 Ack=1 Win=131072 Len=1500 TSval=5013 TSecr=4963"
"2508","5.004933","10.1.0.11","10.1.0.3","TCP","6376","0.000000000","-36 dBm","","49155  >  7004 [ACK] Seq=169501 Ack=1 Win=131072 Len=1500 TSval=5013 TSecr=4964"
"2509","5.004933","10.1.0.11","10.1.0.3","TCP","6376","0.000000000","-36 dBm","","49155  >  7004 [ACK] Seq=175501 Ack=1 Win=131072 Len=1500 TSval=5013 TSecr=4964"
"2510","5.004933","10.1.0.11","10.1.0.3","TCP","6376","0.000000000","-36 dBm","","49155  >  7004 [ACK] Seq=181501 Ack=1 Win=131072 Len=1500 TSval=5013 TSecr=4964"
"2511","5.004933","10.1.0.11","10.1.0.3","TCP","6376","0.000000000","-36 dBm","","49155  >  7004 [ACK] Seq=187501 Ack=1 Win=131072 Len=1500 TSval=5013 TSecr=4964"
"2512","5.004933","10.1.0.11","10.1.0.3","TCP","6376","0.000000000","-36 dBm","","49155  >  7004 [ACK] Seq=193501 Ack=1 Win=131072 Len=1500 TSval=5013 TSecr=4964"
"2513","5.004933","10.1.0.11","10.1.0.3","TCP","7452","0.000000000","-36 dBm","","49155  >  7004 [ACK] Seq=201001 Ack=1 Win=131072 Len=1000 TSval=5013 TSecr=4972"
"2514","5.004933","10.1.0.11","10.1.0.3","TCP","3300","0.000000000","-36 dBm","","49155  >  7004 [ACK] Seq=204001 Ack=1 Win=131072 Len=1000 TSval=5015 TSecr=4981"
"2538","5.008786","10.1.0.11","10.1.0.3","TCP","6528","0.003853000","-36 dBm","","49155  >  7004 [ACK] Seq=210001 Ack=1 Win=131072 Len=1000 TSval=5020 TSecr=4981"
"2552","5.010602","10.1.0.11","10.1.0.3","TCP","3300","0.001816000","-36 dBm","","49155  >  7004 [ACK] Seq=213001 Ack=1 Win=131072 Len=1000 TSval=5022 TSecr=4981"
"2568","5.011915","10.1.0.11","10.1.0.3","TCP","1134","0.001313000","-36 dBm","","49155  >  7004 [ACK] Seq=214001 Ack=1 Win=131072 Len=1000 TSval=5023 TSecr=4981"
"2582","5.013107","10.1.0.11","10.1.0.3","TCP","2224","0.001192000","-36 dBm","","49155  >  7004 [ACK] Seq=216001 Ack=1 Win=131072 Len=1000 TSval=5025 TSecr=4981"
"2597","5.014618","10.1.0.11","10.1.0.3","TCP","2224","0.001511000","-36 dBm","","49155  >  7004 [ACK] Seq=218001 Ack=1 Win=131072 Len=1000 TSval=5026 TSecr=4981"
"2658","5.019828","10.1.0.3","10.1.0.11","TCP","1820","0.005210000","","0.014895000,0.014895000,0.014895000,0.014895000,0.014895000,0.014895000,0.014895000,0.014895000,0.014895000,0.014895000,0.014895000,0.014895000,0.014895000,0.014895000,0.014895000,0.014895000,0.011042000,0.011042000,0.011042000,0.009226000,0.009226000,0.006721000,0.005210000","7004  >  49155 [ACK] Seq=1 Ack=218001 Win=131072 Len=0 TSval=5027 TSecr=5025"
"2678","5.022024","10.1.0.11","10.1.0.3","TCP","7452","0.002196000","-36 dBm","","49155  >  7004 [ACK] Seq=225001 Ack=1 Win=131072 Len=1000 TSval=5032 TSecr=5027"
"2679","5.022024","10.1.0.11","10.1.0.3","TCP","2224","0.000000000","-36 dBm","","49155  >  7004 [ACK] Seq=227001 Ack=1 Win=131072 Len=1000 TSval=5034 TSecr=5027"
"2705","5.026601","10.1.0.11","10.1.0.3","TCP","5452","0.004577000","-36 dBm","","49155  >  7004 [ACK] Seq=232001 Ack=1 Win=131072 Len=1000 TSval=5038 TSecr=5027"
"2717","5.027913","10.1.0.11","10.1.0.3","TCP","2224","0.001312000","-36 dBm","","49155  >  7004 [ACK] Seq=234001 Ack=1 Win=131072 Len=1000 TSval=5039 TSecr=5027"
"2727","5.028801","10.1.0.11","10.1.0.3","TCP","1134","0.000888000","-36 dBm","","49155  >  7004 [ACK] Seq=235001 Ack=1 Win=131072 Len=1000 TSval=5040 TSecr=5027"
"2739","5.029810","10.1.0.11","10.1.0.3","TCP","2224","0.001009000","-36 dBm","","49155  >  7004 [ACK] Seq=237001 Ack=1 Win=131072 Len=1000 TSval=5042 TSecr=5027"
"2753","5.031002","10.1.0.11","10.1.0.3","TCP","1134","0.001192000","-36 dBm","","49155  >  7004 [ACK] Seq=238001 Ack=1 Win=131072 Len=1000 TSval=5042 TSecr=5027"
"2772","5.032579","10.1.0.11","10.1.0.3","TCP","2224","0.001577000","-36 dBm","","49155  >  7004 [ACK] Seq=240001 Ack=1 Win=131072 Len=1000 TSval=5044 TSecr=5027"
"2791","5.034871","10.1.0.11","10.1.0.3","TCP","3300","0.002292000","-36 dBm","","49155  >  7004 [ACK] Seq=243001 Ack=1 Win=131072 Len=1000 TSval=5046 TSecr=5027"
"2805","5.036255","10.1.0.11","10.1.0.3","TCP","2224","0.001384000","-36 dBm","","49155  >  7004 [ACK] Seq=245001 Ack=1 Win=131072 Len=1000 TSval=5048 TSecr=5027"
"2820","5.037438","10.1.0.3","10.1.0.11","TCP","1060","0.001183000","","0.015414000,0.015414000,0.015414000,0.015414000,0.010837000,0.010837000,0.009525000,0.008637000,0.007628000,0.004859000,0.002567000,0.002567000,0.001183000","7004  >  49155 [ACK] Seq=1 Ack=246001 Win=131072 Len=0 TSval=5048 TSecr=5047"
"2827","5.038178","10.1.0.11","10.1.0.3","TCP","2224","0.000740000","-36 dBm","","49155  >  7004 [ACK] Seq=247001 Ack=1 Win=131072 Len=1000 TSval=5050 TSecr=5048"
"2841","5.039466","10.1.0.11","10.1.0.3","TCP","2224","0.001288000","-36 dBm","","49155  >  7004 [ACK] Seq=249001 Ack=1 Win=131072 Len=1000 TSval=5051 TSecr=5048"
"2855","5.040658","10.1.0.11","10.1.0.3","TCP","1134","0.001192000","-36 dBm","","49155  >  7004 [ACK] Seq=250001 Ack=1 Win=131072 Len=1000 TSval=5052 TSecr=5048"
"2869","5.041818","10.1.0.11","10.1.0.3","TCP","2224","0.001160000","-36 dBm","","49155  >  7004 [ACK] Seq=252001 Ack=1 Win=131072 Len=1000 TSval=5054 TSecr=5048"
"2883","5.042978","10.1.0.11","10.1.0.3","TCP","1134","0.001160000","-36 dBm","","49155  >  7004 [ACK] Seq=253001 Ack=1 Win=131072 Len=1000 TSval=5054 TSecr=5048"
"2896","5.043976","10.1.0.11","10.1.0.3","TCP","1134","0.000998000","-36 dBm","","49155  >  7004 [ACK] Seq=254001 Ack=1 Win=131072 Len=1000 TSval=5055 TSecr=5048"
"2908","5.044984","10.1.0.11","10.1.0.3","TCP","2224","0.001008000","-36 dBm","","49155  >  7004 [ACK] Seq=256001 Ack=1 Win=131072 Len=1000 TSval=5057 TSecr=5048"
"2922","5.046113","10.1.0.11","10.1.0.3","TCP","1134","0.001129000","-36 dBm","","49155  >  7004 [ACK] Seq=257001 Ack=1 Win=131072 Len=1000 TSval=5058 TSecr=5048"
"2934","5.047025","10.1.0.11","10.1.0.3","TCP","1134","0.000912000","-36 dBm","","49155  >  7004 [ACK] Seq=258001 Ack=1 Win=131072 Len=1000 TSval=5058 TSecr=5048"
"2946","5.047937","10.1.0.11","10.1.0.3","TCP","1134","0.000912000","-36 dBm","","49155  >  7004 [ACK] Seq=259001 Ack=1 Win=131072 Len=1000 TSval=5059 TSecr=5048"
"2960","5.049358","10.1.0.11","10.1.0.3","TCP","2224","0.001421000","-36 dBm","","49155  >  7004 [ACK] Seq=261001 Ack=1 Win=131072 Len=1000 TSval=5061 TSecr=5048"
"2981","5.052546","10.1.0.11","10.1.0.3","TCP","4376","0.003188000","-36 dBm","","49155  >  7004 [ACK] Seq=265001 Ack=1 Win=131072 Len=1000 TSval=5064 TSecr=5048"
"2989","5.053442","10.1.0.11","10.1.0.3","TCP","1134","0.000896000","-36 dBm","","49155  >  7004 [ACK] Seq=266001 Ack=1 Win=131072 Len=1000 TSval=5065 TSecr=5048"
"2997","5.054050","10.1.0.11","10.1.0.3","TCP","1134","0.000608000","-36 dBm","","49155  >  7004 [ACK] Seq=267001 Ack=1 Win=131072 Len=1000 TSval=5066 TSecr=5048"
"3004","5.054509","10.1.0.3","10.1.0.11","TCP","908","0.000459000","","0.016331000,0.015043000,0.012691000,0.011531000,0.009525000,0.008396000,0.006572000,0.005151000,0.001963000,0.001963000,0.000459000","7004  >  49155 [ACK] Seq=1 Ack=268001 Win=131072 Len=0 TSval=5066 TSecr=5065"
"3014","5.055450","10.1.0.11","10.1.0.3","TCP","2224","0.000941000","-36 dBm","","49155  >  7004 [ACK] Seq=269001 Ack=1 Win=131072 Len=1000 TSval=5067 TSecr=5048"
"3026","5.056439","10.1.0.11","10.1.0.3","TCP","1134","0.000989000","-36 dBm","","49155  >  7004 [ACK] Seq=270001 Ack=1 Win=131072 Len=1000 TSval=5068 TSecr=5048"
"3040","5.058324","10.1.0.11","10.1.0.3","TCP","2224","0.001885000","-36 dBm","","49155  >  7004 [ACK] Seq=272001 Ack=1 Win=131072 Len=1000 TSval=5070 TSecr=5048"
"3046","5.058812","10.1.0.11","10.1.0.3","TCP","1134","0.000488000","-36 dBm","","49155  >  7004 [ACK] Seq=273001 Ack=1 Win=131072 Len=1000 TSval=5070 TSecr=5048"
"3054","5.059420","10.1.0.11","10.1.0.3","TCP","1134","0.000608000","-36 dBm","","49155  >  7004 [ACK] Seq=274001 Ack=1 Win=131072 Len=1000 TSval=5071 TSecr=5048"
"3077","5.061290","10.1.0.3","10.1.0.11","TCP","908","0.001870000","","","7004  >  49155 [ACK] Seq=1 Ack=268001 Win=131072 Len=0 TSval=5066 TSecr=5065"
"3078","5.061290","10.1.0.3","10.1.0.11","TCP","300","0.000000000","","0.005840000,0.002966000,0.002478000","7004  >  49155 [ACK] Seq=1 Ack=274001 Win=131072 Len=0 TSval=5071 TSecr=5070"
"3088","5.062161","10.1.0.11","10.1.0.3","TCP","2224","0.000871000","-36 dBm","","[TCP Previous segment not captured] 49155  >  7004 [ACK] Seq=277001 Ack=1 Win=131072 Len=1000 TSval=5074 TSecr=5071"
"3090","5.062317","10.1.0.11","10.1.0.3","TCP","1134","0.000156000","-36 dBm","","[TCP Out-Of-Order] 49155  >  7004 [ACK] Seq=275001 Ack=1 Win=131072 Len=1000 TSval=5072 TSecr=5048"
"3112","5.065889","10.1.0.11","10.1.0.3","TCP","5452","0.003572000","-36 dBm","","49155  >  7004 [ACK] Seq=282001 Ack=1 Win=131072 Len=1000 TSval=5078 TSecr=5071"
"3129","5.067827","10.1.0.11","10.1.0.3","TCP","2224","0.001938000","-36 dBm","","49155  >  7004 [ACK] Seq=284001 Ack=1 Win=131072 Len=1000 TSval=5079 TSecr=5071"
"3141","5.068900","10.1.0.11","10.1.0.3","TCP","1134","0.001073000","-36 dBm","","49155  >  7004 [ACK] Seq=285001 Ack=1 Win=131072 Len=1000 TSval=5080 TSecr=5071"
"3151","5.069788","10.1.0.11","10.1.0.3","TCP","2224","0.000888000","-36 dBm","","49155  >  7004 [ACK] Seq=287001 Ack=1 Win=131072 Len=1000 TSval=5082 TSecr=5071"
"3167","5.071004","10.1.0.11","10.1.0.3","TCP","1134","0.001216000","-36 dBm","","49155  >  7004 [ACK] Seq=288001 Ack=1 Win=131072 Len=1000 TSval=5082 TSecr=5071"
"3179","5.071916","10.1.0.11","10.1.0.3","TCP","1134","0.000912000","-36 dBm","","49155  >  7004 [ACK] Seq=289001 Ack=1 Win=131072 Len=1000 TSval=5083 TSecr=5071"
"3191","5.072860","10.1.0.11","10.1.0.3","TCP","1134","0.000944000","-36 dBm","","49155  >  7004 [ACK] Seq=290001 Ack=1 Win=131072 Len=1000 TSval=5084 TSecr=5071"
"3201","5.073829","10.1.0.11","10.1.0.3","TCP","2224","0.000969000","-36 dBm","","49155  >  7004 [ACK] Seq=292001 Ack=1 Win=131072 Len=1000 TSval=5086 TSecr=5071"
"3217","5.075046","10.1.0.11","10.1.0.3","TCP","1134","0.001217000","-36 dBm","","49155  >  7004 [ACK] Seq=293001 Ack=1 Win=131072 Len=1000 TSval=5086 TSecr=5071"
"3229","5.075958","10.1.0.11","10.1.0.3","TCP","1134","0.000912000","-36 dBm","","49155  >  7004 [ACK] Seq=294001 Ack=1 Win=131072 Len=1000 TSval=5087 TSecr=5071"
"3241","5.076966","10.1.0.11","10.1.0.3","TCP","2224","0.001008000","-36 dBm","","49155  >  7004 [ACK] Seq=296001 Ack=1 Win=131072 Len=1000 TSval=5089 TSecr=5071"
"3255","5.078094","10.1.0.11","10.1.0.3","TCP","1134","0.001128000","-36 dBm","","49155  >  7004 [ACK] Seq=297001 Ack=1 Win=131072 Len=1000 TSval=5090 TSecr=5071"
"3267","5.079033","10.1.0.11","10.1.0.3","TCP","1134","0.000939000","-36 dBm","","49155  >  7004 [ACK] Seq=298001 Ack=1 Win=131072 Len=1000 TSval=5090 TSecr=5071"
"3279","5.079945","10.1.0.11","10.1.0.3","TCP","1134","0.000912000","-36 dBm","","49155  >  7004 [ACK] Seq=299001 Ack=1 Win=131072 Len=1000 TSval=5091 TSecr=5071"
"3291","5.080921","10.1.0.11","10.1.0.3","TCP","1134","0.000976000","-36 dBm","","49155  >  7004 [ACK] Seq=300001 Ack=1 Win=131072 Len=1000 TSval=5092 TSecr=5071"
"3299","5.081594","10.1.0.11","10.1.0.3","TCP","1134","0.000673000","-36 dBm","","49155  >  7004 [ACK] Seq=301001 Ack=1 Win=131072 Len=1000 TSval=5093 TSecr=5071"
"3307","5.082202","10.1.0.11","10.1.0.3","TCP","1134","0.000608000","-36 dBm","","49155  >  7004 [ACK] Seq=302001 Ack=1 Win=131072 Len=1000 TSval=5094 TSecr=5071"
"3319","5.083114","10.1.0.11","10.1.0.3","TCP","1134","0.000912000","-36 dBm","","49155  >  7004 [ACK] Seq=303001 Ack=1 Win=131072 Len=1000 TSval=5094 TSecr=5071"
"3332","5.084079","10.1.0.3","10.1.0.11","TCP","1212","0.000965000","","0.021762000,0.021918000,0.018190000,0.018190000,0.016252000,0.015179000,0.014291000,0.012163000,0.010250000,0.009033000,0.007113000,0.005985000,0.004134000,0.002485000,0.000965000","7004  >  49155 [ACK] Seq=1 Ack=304001 Win=131072 Len=0 TSval=5095 TSecr=5094"
"3338","5.084672","10.1.0.11","10.1.0.3","TCP","2224","0.000593000","-36 dBm","","49155  >  7004 [ACK] Seq=305001 Ack=1 Win=131072 Len=1000 TSval=5096 TSecr=5071"
"3350","5.085776","10.1.0.11","10.1.0.3","TCP","2224","0.001104000","-36 dBm","","49155  >  7004 [ACK] Seq=307001 Ack=1 Win=131072 Len=1000 TSval=5098 TSecr=5095"
"3362","5.086816","10.1.0.11","10.1.0.3","TCP","1134","0.001040000","-36 dBm","","49155  >  7004 [ACK] Seq=308001 Ack=1 Win=131072 Len=1000 TSval=5098 TSecr=5095"
"3374","5.087729","10.1.0.11","10.1.0.3","TCP","1134","0.000913000","-36 dBm","","49155  >  7004 [ACK] Seq=309001 Ack=1 Win=131072 Len=1000 TSval=5099 TSecr=5095"
"3386","5.088641","10.1.0.11","10.1.0.3","TCP","1134","0.000912000","-36 dBm","","49155  >  7004 [ACK] Seq=310001 Ack=1 Win=131072 Len=1000 TSval=5100 TSecr=5095"
"3398","5.089553","10.1.0.11","10.1.0.3","TCP","1134","0.000912000","-36 dBm","","49155  >  7004 [ACK] Seq=311001 Ack=1 Win=131072 Len=1000 TSval=5101 TSecr=5095"
"3414","5.090960","10.1.0.11","10.1.0.3","TCP","2224","0.001407000","-36 dBm","","49155  >  7004 [ACK] Seq=313001 Ack=1 Win=131072 Len=1000 TSval=5102 TSecr=5095"
"3437","5.094508","10.1.0.11","10.1.0.3","TCP","4376","0.003548000","-36 dBm","","49155  >  7004 [ACK] Seq=317001 Ack=1 Win=131072 Len=1000 TSval=5106 TSecr=5095"
"3449","5.096065","10.1.0.11","10.1.0.3","TCP","2224","0.001557000","-36 dBm","","49155  >  7004 [ACK] Seq=319001 Ack=1 Win=131072 Len=1000 TSval=5107 TSecr=5095"
"3461","5.097169","10.1.0.11","10.1.0.3","TCP","2224","0.001104000","-36 dBm","","49155  >  7004 [ACK] Seq=321001 Ack=1 Win=131072 Len=1000 TSval=5109 TSecr=5095"
"3473","5.098082","10.1.0.11","10.1.0.3","TCP","1134","0.000913000","-36 dBm","","49155  >  7004 [ACK] Seq=322001 Ack=1 Win=131072 Len=1000 TSval=5110 TSecr=5095"
"3485","5.098994","10.1.0.11","10.1.0.3","TCP","1134","0.000912000","-36 dBm","","49155  >  7004 [ACK] Seq=323001 Ack=1 Win=131072 Len=1000 TSval=5110 TSecr=5095"
"3497","5.099906","10.1.0.11","10.1.0.3","TCP","1134","0.000912000","-36 dBm","","49155  >  7004 [ACK] Seq=324001 Ack=1 Win=131072 Len=1000 TSval=5111 TSecr=5095"
"3509","5.100850","10.1.0.11","10.1.0.3","TCP","1134","0.000944000","-36 dBm","","49155  >  7004 [ACK] Seq=325001 Ack=1 Win=131072 Len=1000 TSval=5112 TSecr=5095"
"3516","5.101580","10.1.0.3","10.1.0.11","TCP","908","0.000730000","","0.016908000,0.015804000,0.013851000,0.012027000,0.010620000,0.007072000,0.007072000,0.005515000,0.004411000,0.002586000,0.000730000","7004  >  49155 [ACK] Seq=1 Ack=326001 Win=131072 Len=0 TSval=5113 TSecr=5111"
"3531","5.103127","10.1.0.11","10.1.0.3","TCP","3300","0.001547000","-36 dBm","","49155  >  7004 [ACK] Seq=328001 Ack=1 Win=131072 Len=1000 TSval=5114 TSecr=5113"
"3554","5.106708","10.1.0.11","10.1.0.3","TCP","5452","0.003581000","-36 dBm","","49155  >  7004 [ACK] Seq=333001 Ack=1 Win=131072 Len=1000 TSval=5118 TSecr=5113"
"3567","5.108238","10.1.0.11","10.1.0.3","TCP","2224","0.001530000","-36 dBm","","49155  >  7004 [ACK] Seq=335001 Ack=1 Win=131072 Len=1000 TSval=5120 TSecr=5113"
"3581","5.109334","10.1.0.11","10.1.0.3","TCP","1134","0.001096000","-36 dBm","","49155  >  7004 [ACK] Seq=336001 Ack=1 Win=131072 Len=1000 TSval=5121 TSecr=5113"
"3591","5.110094","10.1.0.11","10.1.0.3","TCP","1134","0.000760000","-36 dBm","","49155  >  7004 [ACK] Seq=337001 Ack=1 Win=131072 Len=1000 TSval=5122 TSecr=5113"
"3601","5.110854","10.1.0.11","10.1.0.3","TCP","1134","0.000760000","-36 dBm","","49155  >  7004 [ACK] Seq=338001 Ack=1 Win=131072 Len=1000 TSval=5122 TSecr=5113"
"3611","5.111614","10.1.0.11","10.1.0.3","TCP","1134","0.000760000","-36 dBm","","49155  >  7004 [ACK] Seq=339001 Ack=1 Win=131072 Len=1000 TSval=5123 TSecr=5113"
"3621","5.112374","10.1.0.11","10.1.0.3","TCP","1134","0.000760000","-36 dBm","","49155  >  7004 [ACK] Seq=340001 Ack=1 Win=131072 Len=1000 TSval=5124 TSecr=5113"
"3631","5.113135","10.1.0.11","10.1.0.3","TCP","1134","0.000761000","-36 dBm","","49155  >  7004 [ACK] Seq=341001 Ack=1 Win=131072 Len=1000 TSval=5125 TSecr=5113"
"3642","5.114351","10.1.0.11","10.1.0.3","TCP","1134","0.001216000","-36 dBm","","49155  >  7004 [ACK] Seq=342001 Ack=1 Win=131072 Len=1000 TSval=5126 TSecr=5113"
"3652","5.115111","10.1.0.11","10.1.0.3","TCP","1134","0.000760000","-36 dBm","","49155  >  7004 [ACK] Seq=343001 Ack=1 Win=131072 Len=1000 TSval=5126 TSecr=5113"
"3662","5.115871","10.1.0.11","10.1.0.3","TCP","1134","0.000760000","-36 dBm","","49155  >  7004 [ACK] Seq=344001 Ack=1 Win=131072 Len=1000 TSval=5127 TSecr=5113"
"3672","5.116631","10.1.0.11","10.1.0.3","TCP","1134","0.000760000","-36 dBm","","49155  >  7004 [ACK] Seq=345001 Ack=1 Win=131072 Len=1000 TSval=5128 TSecr=5113"
"3682","5.117391","10.1.0.11","10.1.0.3","TCP","1134","0.000760000","-36 dBm","","49155  >  7004 [ACK] Seq=346001 Ack=1 Win=131072 Len=1000 TSval=5129 TSecr=5113"
"3692","5.118151","10.1.0.11","10.1.0.3","TCP","1134","0.000760000","-36 dBm","","49155  >  7004 [ACK] Seq=347001 Ack=1 Win=131072 Len=1000 TSval=5130 TSecr=5113"
"3700","5.118760","10.1.0.11","10.1.0.3","TCP","1134","0.000609000","-36 dBm","","49155  >  7004 [ACK] Seq=348001 Ack=1 Win=131072 Len=1000 TSval=5130 TSecr=5113"
"3707","5.119228","10.1.0.3","10.1.0.11","TCP","908","0.000468000","","0.016101000,0.012520000,0.012520000,0.012520000,0.010990000,0.009134000,0.007614000,0.006093000,0.004117000,0.002597000,0.001077000","7004  >  49155 [ACK] Seq=1 Ack=348001 Win=131072 Len=0 TSval=5130 TSecr=5129"
"3717","5.120371","10.1.0.11","10.1.0.3","TCP","2224","0.001143000","-36 dBm","","49155  >  7004 [ACK] Seq=350001 Ack=1 Win=131072 Len=1000 TSval=5132 TSecr=5130"
"3725","5.121043","10.1.0.11","10.1.0.3","TCP","1134","0.000672000","-36 dBm","","49155  >  7004 [ACK] Seq=351001 Ack=1 Win=131072 Len=1000 TSval=5133 TSecr=5130"
"3738","5.122070","10.1.0.11","10.1.0.3","TCP","1134","0.001027000","-36 dBm","","49155  >  7004 [ACK] Seq=352001 Ack=1 Win=131072 Len=1000 TSval=5134 TSecr=5130"
"3746","5.122678","10.1.0.11","10.1.0.3","TCP","1134","0.000608000","-36 dBm","","49155  >  7004 [ACK] Seq=353001 Ack=1 Win=131072 Len=1000 TSval=5134 TSecr=5130"
"3758","5.123596","10.1.0.11","10.1.0.3","TCP","1134","0.000918000","-36 dBm","","49155  >  7004 [ACK] Seq=354001 Ack=1 Win=131072 Len=1000 TSval=5135 TSecr=5130"
"3770","5.124553","10.1.0.11","10.1.0.3","TCP","1134","0.000957000","-36 dBm","","49155  >  7004 [ACK] Seq=355001 Ack=1 Win=131072 Len=1000 TSval=5136 TSecr=5130"
"3789","5.127638","10.1.0.11","10.1.0.3","TCP","4376","0.003085000","-36 dBm","","49155  >  7004 [ACK] Seq=359001 Ack=1 Win=131072 Len=1000 TSval=5139 TSecr=5130"
"3797","5.128342","10.1.0.11","10.1.0.3","TCP","1134","0.000704000","-36 dBm","","49155  >  7004 [ACK] Seq=360001 Ack=1 Win=131072 Len=1000 TSval=5140 TSecr=5130"
"3804","5.128801","10.1.0.3","10.1.0.11","TCP","528","0.000459000","","0.008430000,0.007758000,0.006123000,0.004248000,0.001163000,0.001163000","7004  >  49155 [ACK] Seq=1 Ack=360001 Win=131072 Len=0 TSval=5140 TSecr=5138"
"3827","5.131042","10.1.0.11","10.1.0.3","TCP","3300","0.002241000","-36 dBm","","49155  >  7004 [ACK] Seq=363001 Ack=1 Win=131072 Len=1000 TSval=5142 TSecr=5130"
"3855","5.135910","10.1.0.11","10.1.0.3","TCP","5452","0.004868000","-36 dBm","","49155  >  7004 [ACK] Seq=368001 Ack=1 Win=131072 Len=1000 TSval=5146 TSecr=5130"
"3868","5.137644","10.1.0.11","10.1.0.3","TCP","3300","0.001734000","-36 dBm","","49155  >  7004 [ACK] Seq=371001 Ack=1 Win=131072 Len=1000 TSval=5149 TSecr=5130"
"3880","5.138844","10.1.0.11","10.1.0.3","TCP","2224","0.001200000","-36 dBm","","49155  >  7004 [ACK] Seq=373001 Ack=1 Win=131072 Len=1000 TSval=5150 TSecr=5130"
"3894","5.139909","10.1.0.11","10.1.0.3","TCP","1134","0.001065000","-36 dBm","","49155  >  7004 [ACK] Seq=374001 Ack=1 Win=131072 Len=1000 TSval=5151 TSecr=5130"
"3906","5.140821","10.1.0.11","10.1.0.3","TCP","1134","0.000912000","-36 dBm","","49155  >  7004 [ACK] Seq=375001 Ack=1 Win=131072 Len=1000 TSval=5152 TSecr=5130"
"3927","5.143058","10.1.0.3","10.1.0.11","TCP","528","0.002237000","","","7004  >  49155 [ACK] Seq=1 Ack=360001 Win=131072 Len=0 TSval=5140 TSecr=5138"
"3928","5.143058","10.1.0.3","10.1.0.11","TCP","680","0.000000000","","0.012016000,0.012016000,0.007148000,0.007148000,0.005414000,0.005414000,0.004214000,0.002237000","7004  >  49155 [ACK] Seq=1 Ack=376001 Win=131072 Len=0 TSval=5153 TSecr=5151"
"3934","5.143930","10.1.0.11","10.1.0.3","TCP","4376","0.000872000","-36 dBm","","49155  >  7004 [ACK] Seq=379001 Ack=1 Win=131072 Len=1000 TSval=5155 TSecr=5130"
"3946","5.145274","10.1.0.11","10.1.0.3","TCP","2224","0.001344000","-36 dBm","","49155  >  7004 [ACK] Seq=381001 Ack=1 Win=131072 Len=1000 TSval=5157 TSecr=5130"
"3958","5.146251","10.1.0.11","10.1.0.3","TCP","1134","0.000977000","-36 dBm","","49155  >  7004 [ACK] Seq=382001 Ack=1 Win=131072 Len=1000 TSval=5158 TSecr=5130"
"3970","5.147163","10.1.0.11","10.1.0.3","TCP","1134","0.000912000","-36 dBm","","49155  >  7004 [ACK] Seq=383001 Ack=1 Win=131072 Len=1000 TSval=5158 TSecr=5130"
"3982","5.148075","10.1.0.11","10.1.0.3","TCP","1134","0.000912000","-36 dBm","","49155  >  7004 [ACK] Seq=384001 Ack=1 Win=131072 Len=1000 TSval=5159 TSecr=5130"
"3994","5.149224","10.1.0.11","10.1.0.3","TCP","2224","0.001149000","-36 dBm","","49155  >  7004 [ACK] Seq=386001 Ack=1 Win=131072 Len=1000 TSval=5161 TSecr=5130"
"4006","5.150136","10.1.0.11","10.1.0.3","TCP","1134","0.000912000","-36 dBm","","49155  >  7004 [ACK] Seq=387001 Ack=1 Win=131072 Len=1000 TSval=5162 TSecr=5130"
"4018","5.151048","10.1.0.11","10.1.0.3","TCP","1134","0.000912000","-36 dBm","","49155  >  7004 [ACK] Seq=388001 Ack=1 Win=131072 Len=1000 TSval=5162 TSecr=5130"
"4030","5.151961","10.1.0.11","10.1.0.3","TCP","1134","0.000913000","-36 dBm","","49155  >  7004 [ACK] Seq=389001 Ack=1 Win=131072 Len=1000 TSval=5163 TSecr=5130"
"4042","5.152873","10.1.0.11","10.1.0.3","TCP","1134","0.000912000","-36 dBm","","49155  >  7004 [ACK] Seq=390001 Ack=1 Win=131072 Len=1000 TSval=5164 TSecr=5130"
"4058","5.154321","10.1.0.11","10.1.0.3","TCP","2224","0.001448000","-36 dBm","","49155  >  7004 [ACK] Seq=392001 Ack=1 Win=131072 Len=1000 TSval=5166 TSecr=5130"
"4070","5.155233","10.1.0.11","10.1.0.3","TCP","1134","0.000912000","-36 dBm","","49155  >  7004 [ACK] Seq=393001 Ack=1 Win=131072 Len=1000 TSval=5166 TSecr=5130"
"4082","5.156177","10.1.0.11","10.1.0.3","TCP","2224","0.000944000","-36 dBm","","49155  >  7004 [ACK] Seq=395001 Ack=1 Win=131072 Len=1000 TSval=5168 TSecr=5130"
"4094","5.157249","10.1.0.11","10.1.0.3","TCP","1134","0.001072000","-36 dBm","","49155  >  7004 [ACK] Seq=396001 Ack=1 Win=131072 Len=1000 TSval=5169 TSecr=5130"
"4106","5.158162","10.1.0.11","10.1.0.3","TCP","1134","0.000913000","-36 dBm","","49155  >  7004 [ACK] Seq=397001 Ack=1 Win=131072 Len=1000 TSval=5170 TSecr=5130"
"4118","5.159074","10.1.0.11","10.1.0.3","TCP","1134","0.000912000","-36 dBm","","49155  >  7004 [ACK] Seq=398001 Ack=1 Win=131072 Len=1000 TSval=5170 TSecr=5130"
"4130","5.160013","10.1.0.11","10.1.0.3","TCP","1134","0.000939000","-36 dBm","","49155  >  7004 [ACK] Seq=399001 Ack=1 Win=131072 Len=1000 TSval=5171 TSecr=5130"
"4142","5.160925","10.1.0.11","10.1.0.3","TCP","1134","0.000912000","-36 dBm","","49155  >  7004 [ACK] Seq=400001 Ack=1 Win=131072 Len=1000 TSval=5172 TSecr=5130"
"4154","5.162029","10.1.0.11","10.1.0.3","TCP","2224","0.001104000","-36 dBm","","49155  >  7004 [ACK] Seq=402001 Ack=1 Win=131072 Len=1000 TSval=5174 TSecr=5130"
