"No.","Time","Source","Destination","Protocol","Length","Time delta from previous displayed frame","Signal strength (dBm)","The RTT to ACK the segment was","Info"
"281","1.437807","10.1.0.11","10.1.0.3","TCP","138","0.000000000","","","49155  >  7004 [SYN] Seq=0 Win=65535 Len=0 TSval=1450 TSecr=0 WS=4 SACK_PERM=1"
"282","1.437955","10.1.0.11","10.1.0.3","TCP","138","0.000148000","","","[TCP Out-Of-Order] [TCP Port numbers reused] 49155  >  7004 [SYN] Seq=0 Win=65535 Len=0 TSval=1450 TSecr=0 WS=4 SACK_PERM=1"
"291","1.438733","10.1.0.3","10.1.0.11","TCP","138","0.000778000","-42 dBm","","49153  >  7005 [SYN] Seq=0 Win=65535 Len=0 TSval=1450 TSecr=0 WS=4 SACK_PERM=1"
"294","1.438888","10.1.0.11","10.1.0.3","TCP","138","0.000155000","","0.000155000","7005  >  49153 [SYN, ACK] Seq=0 Ack=1 Win=65535 Len=0 TSval=1450 TSecr=1450 WS=4 SACK_PERM=1"
"297","1.439154","10.1.0.3","10.1.0.11","TCP","134","0.000266000","-42 dBm","0.000266000","49153  >  7005 [ACK] Seq=1 Ack=1 Win=131072 Len=0 TSval=1451 TSecr=1450"
"300","1.439549","10.1.0.3","10.1.0.11","TCP","138","0.000395000","-42 dBm","0.001742000","7004  >  49155 [SYN, ACK] Seq=0 Ack=1 Win=65535 Len=0 TSval=1450 TSecr=1450 WS=4 SACK_PERM=1"
"303","1.439695","10.1.0.11","10.1.0.3","TCP","134","0.000146000","","0.000146000","49155  >  7004 [ACK] Seq=1 Ack=1 Win=131072 Len=0 TSval=1451 TSecr=1450"
"1050","4.841397","10.1.0.11","10.1.0.3","TCP","2224","3.401702000","","","49155  >  7004 [ACK] Seq=1001 Ack=1 Win=131072 Len=1000 TSval=4853 TSecr=1450"
"1070","4.843301","10.1.0.11","10.1.0.3","TCP","2224","0.001904000","","","49155  >  7004 [ACK] Seq=3001 Ack=1 Win=131072 Len=1000 TSval=4854 TSecr=1450"
"1085","4.845209","10.1.0.3","10.1.0.11","TCP","6528","0.001908000","-42 dBm","","49153  >  7005 [ACK] Seq=5001 Ack=1 Win=131072 Len=1000 TSval=4855 TSecr=1450"
"1086","4.845209","10.1.0.3","10.1.0.11","TCP","1134","0.000000000","-42 dBm","","49153  >  7005 [ACK] Seq=6001 Ack=1 Win=131072 Len=1000 TSval=4856 TSecr=1450"
"1097","4.846685","10.1.0.11","10.1.0.3","TCP","4376","0.001476000","","","49155  >  7004 [ACK] Seq=7001 Ack=1 Win=131072 Len=1000 TSval=4858 TSecr=1450"
"1117","4.849182","10.1.0.11","10.1.0.3","TCP","4376","0.002497000","","","49155  >  7004 [ACK] Seq=11001 Ack=1 Win=131072 Len=1000 TSval=4861 TSecr=1450"
"1137","4.851273","10.1.0.11","10.1.0.3","TCP","376","0.002091000","","0.006064000,0.006064000,0.006064000,0.006064000","7005  >  49153 [ACK] Seq=1 Ack=7001 Win=131072 Len=0 TSval=4857 TSecr=4855"
"1195","4.860834","10.1.0.11","10.1.0.3","TCP","3300","0.009561000","","","49155  >  7004 [ACK] Seq=14001 Ack=1 Win=131072 Len=1000 TSval=4863 TSecr=1450"
"1292","4.871961","10.1.0.3","10.1.0.11","TCP","6528","0.011127000","-42 dBm","","49153  >  7005 [ACK] Seq=12001 Ack=1 Win=131072 Len=1000 TSval=4861 TSecr=1450"
"1293","4.871961","10.1.0.3","10.1.0.11","TCP","6528","0.000000000","-42 dBm","","49153  >  7005 [ACK] Seq=18001 Ack=1 Win=131072 Len=1000 TSval=4866 TSecr=4857"
"1294","4.871961","10.1.0.3","10.1.0.11","TCP","2224","0.000000000","-42 dBm","","49153  >  7005 [ACK] Seq=20001 Ack=1 Win=131072 Len=1000 TSval=4867 TSecr=4857"
"1295","4.871961","10.1.0.3","10.1.0.11","TCP","6528","0.000000000","-42 dBm","","49153  >  7005 [ACK] Seq=26001 Ack=1 Win=131072 Len=1000 TSval=4872 TSecr=4857"
"1296","4.871961","10.1.0.3","10.1.0.11","TCP","1134","0.000000000","-42 dBm","","49153  >  7005 [ACK] Seq=27001 Ack=1 Win=131072 Len=1000 TSval=4873 TSecr=4857"
"1385","4.880873","10.1.0.3","10.1.0.11","TCP","680","0.008912000","-42 dBm","0.039476000,0.037572000,0.034188000,0.034188000,0.031691000,0.031691000,0.020039000,0.020039000","7004  >  49155 [ACK] Seq=1 Ack=15001 Win=131072 Len=0 TSval=4873 TSecr=4862"
"1418","4.883318","10.1.0.11","10.1.0.3","TCP","6376","0.002445000","","","49155  >  7004 [ACK] Seq=19501 Ack=1 Win=131072 Len=1500 TSval=4893 TSecr=4855"
"1419","4.883318","10.1.0.11","10.1.0.3","TCP","6376","0.000000000","","","49155  >  7004 [ACK] Seq=25501 Ack=1 Win=131072 Len=1500 TSval=4893 TSecr=4859"
"1420","4.883318","10.1.0.11","10.1.0.3","TCP","6376","0.000000000","","","49155  >  7004 [ACK] Seq=31501 Ack=1 Win=131072 Len=1500 TSval=4893 TSecr=4861"
"1421","4.883318","10.1.0.11","10.1.0.3","TCP","6376","0.000000000","","","49155  >  7004 [ACK] Seq=37501 Ack=1 Win=131072 Len=1500 TSval=4893 TSecr=4873"
"1422","4.883318","10.1.0.11","10.1.0.3","TCP","6376","0.000000000","","","49155  >  7004 [ACK] Seq=43501 Ack=1 Win=131072 Len=1500 TSval=4893 TSecr=4873"
"1470","4.890241","10.1.0.3","10.1.0.11","TCP","832","0.006923000","-42 dBm","0.006923000,0.006923000,0.006923000,0.006923000,0.006923000,0.006923000,0.006923000,0.006923000,0.006923000,0.006923000","7004  >  49155 [ACK] Seq=1 Ack=45001 Win=131072 Len=0 TSval=4896 TSecr=4893"
"1489","4.892100","10.1.0.11","10.1.0.3","TCP","6376","0.001859000","","","49155  >  7004 [ACK] Seq=49501 Ack=1 Win=131072 Len=1500 TSval=4902 TSecr=4895"
"1490","4.892100","10.1.0.11","10.1.0.3","TCP","6376","0.000000000","","","49155  >  7004 [ACK] Seq=55501 Ack=1 Win=131072 Len=1500 TSval=4902 TSecr=4895"
"1491","4.892100","10.1.0.11","10.1.0.3","TCP","7452","0.000000000","","","49155  >  7004 [ACK] Seq=63001 Ack=1 Win=131072 Len=1000 TSval=4902 TSecr=4896"
"1492","4.892100","10.1.0.11","10.1.0.3","TCP","1134","0.000000000","","","49155  >  7004 [ACK] Seq=64001 Ack=1 Win=131072 Len=1000 TSval=4903 TSecr=4896"
"1504","4.894024","10.1.0.11","10.1.0.3","TCP","3300","0.001924000","","","49155  >  7004 [ACK] Seq=67001 Ack=1 Win=131072 Len=1000 TSval=4906 TSecr=4896"
"1516","4.895096","10.1.0.11","10.1.0.3","TCP","1134","0.001072000","","","49155  >  7004 [ACK] Seq=68001 Ack=1 Win=131072 Len=1000 TSval=4906 TSecr=4896"
"1529","4.896135","10.1.0.11","10.1.0.3","TCP","1134","0.001039000","","","49155  >  7004 [ACK] Seq=69001 Ack=1 Win=131072 Len=1000 TSval=4907 TSecr=4896"
"1539","4.896927","10.1.0.11","10.1.0.3","TCP","1134","0.000792000","","","49155  >  7004 [ACK] Seq=70001 Ack=1 Win=131072 Len=1000 TSval=4908 TSecr=4896"
"1549","4.897720","10.1.0.11","10.1.0.3","TCP","1134","0.000793000","","","49155  >  7004 [ACK] Seq=71001 Ack=1 Win=131072 Len=1000 TSval=4909 TSecr=4896"
"1559","4.898512","10.1.0.11","10.1.0.3","TCP","1134","0.000792000","","","49155  >  7004 [ACK] Seq=72001 Ack=1 Win=131072 Len=1000 TSval=4910 TSecr=4896"
"1569","4.899272","10.1.0.11","10.1.0.3","TCP","1134","0.000760000","","","49155  >  7004 [ACK] Seq=73001 Ack=1 Win=131072 Len=1000 TSval=4910 TSecr=4896"
"1581","4.900248","10.1.0.11","10.1.0.3","TCP","1134","0.000976000","","","49155  >  7004 [ACK] Seq=74001 Ack=1 Win=131072 Len=1000 TSval=4911 TSecr=4896"
"1589","4.900888","10.1.0.11","10.1.0.3","TCP","1134","0.000640000","","","49155  >  7004 [ACK] Seq=75001 Ack=1 Win=131072 Len=1000 TSval=4912 TSecr=4896"
"1599","4.901752","10.1.0.11","10.1.0.3","TCP","1134","0.000864000","","","49155  >  7004 [ACK] Seq=76001 Ack=1 Win=131072 Len=1000 TSval=4913 TSecr=4896"
"1609","4.902544","10.1.0.11","10.1.0.3","TCP","1134","0.000792000","","","49155  >  7004 [ACK] Seq=77001 Ack=1 Win=131072 Len=1000 TSval=4914 TSecr=4896"
"1619","4.903336","10.1.0.11","10.1.0.3","TCP","1134","0.000792000","","","49155  >  7004 [ACK] Seq=78001 Ack=1 Win=131072 Len=1000 TSval=4914 TSecr=4896"
"1629","4.904128","10.1.0.11","10.1.0.3","TCP","1134","0.000792000","","","49155  >  7004 [ACK] Seq=79001 Ack=1 Win=131072 Len=1000 TSval=4915 TSecr=4896"
"1639","4.904921","10.1.0.11","10.1.0.3","TCP","1134","0.000793000","","","49155  >  7004 [ACK] Seq=80001 Ack=1 Win=131072 Len=1000 TSval=4916 TSecr=4896"
"1649","4.905713","10.1.0.11","10.1.0.3","TCP","1134","0.000792000","","","49155  >  7004 [ACK] Seq=81001 Ack=1 Win=131072 Len=1000 TSval=4917 TSecr=4896"
"1659","4.906473","10.1.0.11","10.1.0.3","TCP","1134","0.000760000","","","49155  >  7004 [ACK] Seq=82001 Ack=1 Win=131072 Len=1000 TSval=4918 TSecr=4896"
"1672","4.907594","10.1.0.11","10.1.0.3","TCP","2224","0.001121000","","","49155  >  7004 [ACK] Seq=84001 Ack=1 Win=131072 Len=1000 TSval=4919 TSecr=4896"
"1684","4.908602","10.1.0.11","10.1.0.3","TCP","1134","0.001008000","","","49155  >  7004 [ACK] Seq=85001 Ack=1 Win=131072 Len=1000 TSval=4920 TSecr=4896"
"1696","4.909514","10.1.0.11","10.1.0.3","TCP","1134","0.000912000","","","49155  >  7004 [ACK] Seq=86001 Ack=1 Win=131072 Len=1000 TSval=4921 TSecr=4896"
"1708","4.910426","10.1.0.11","10.1.0.3","TCP","1134","0.000912000","","","49155  >  7004 [ACK] Seq=87001 Ack=1 Win=131072 Len=1000 TSval=4922 TSecr=4896"
"1720","4.911370","10.1.0.11","10.1.0.3","TCP","1134","0.000944000","","","49155  >  7004 [ACK] Seq=88001 Ack=1 Win=131072 Len=1000 TSval=4922 TSecr=4896"
"1730","4.912235","10.1.0.11","10.1.0.3","TCP","1134","0.000865000","","","49155  >  7004 [ACK] Seq=89001 Ack=1 Win=131072 Len=1000 TSval=4923 TSecr=4896"
"1731","4.912424","10.1.0.11","10.1.0.3","TCP","1136","0.000189000","","","[TCP Retransmission] 49155  >  7004 [ACK] Seq=89001 Ack=1 Win=131072 Len=1000 TSval=4923 TSecr=4896"
"1732","4.912424","10.1.0.11","10.1.0.3","TCP","1134","0.000000000","","","49155  >  7004 [ACK] Seq=90001 Ack=1 Win=131072 Len=1000 TSval=4924 TSecr=4896"
"1744","4.913500","10.1.0.11","10.1.0.3","TCP","1134","0.001076000","","","49155  >  7004 [ACK] Seq=91001 Ack=1 Win=131072 Len=1000 TSval=4925 TSecr=4896"
"1756","4.914412","10.1.0.11","10.1.0.3","TCP","1134","0.000912000","","","49155  >  7004 [ACK] Seq=92001 Ack=1 Win=131072 Len=1000 TSval=4926 TSecr=4896"
"1768","4.915356","10.1.0.11","10.1.0.3","TCP","1134","0.000944000","","","49155  >  7004 [ACK] Seq=93001 Ack=1 Win=131072 Len=1000 TSval=4926 TSecr=4896"
"1778","4.916148","10.1.0.11","10.1.0.3","TCP","1134","0.000792000","","","49155  >  7004 [ACK] Seq=94001 Ack=1 Win=131072 Len=1000 TSval=4927 TSecr=4896"
"1788","4.916940","10.1.0.11","10.1.0.3","TCP","1134","0.000792000","","","49155  >  7004 [ACK] Seq=95001 Ack=1 Win=131072 Len=1000 TSval=4928 TSecr=4896"
"1800","4.918155","10.1.0.11","10.1.0.3","TCP","2224","0.001215000","","","49155  >  7004 [ACK] Seq=97001 Ack=1 Win=131072 Len=1000 TSval=4930 TSecr=4896"
"1812","4.919259","10.1.0.11","10.1.0.3","TCP","1134","0.001104000","","","49155  >  7004 [ACK] Seq=98001 Ack=1 Win=131072 Len=1000 TSval=4930 TSecr=4896"
"1822","4.920020","10.1.0.11","10.1.0.3","TCP","1134","0.000761000","","","49155  >  7004 [ACK] Seq=99001 Ack=1 Win=131072 Len=1000 TSval=4931 TSecr=4896"
"1834","4.920964","10.1.0.11","10.1.0.3","TCP","1134","0.000944000","","","49155  >  7004 [ACK] Seq=100001 Ack=1 Win=131072 Len=1000 TSval=4932 TSecr=4896"
"1844","4.921756","10.1.0.11","10.1.0.3","TCP","1134","0.000792000","","","49155  >  7004 [ACK] Seq=101001 Ack=1 Win=131072 Len=1000 TSval=4933 TSecr=4896"
"1884","4.924762","10.1.0.11","10.1.0.3","TCP","832","0.003006000","","0.052801000,0.052801000,0.052801000,0.052801000,0.052801000,0.052801000,0.052801000,0.052801000,0.052801000,0.052801000","7005  >  49153 [ACK] Seq=1 Ack=27001 Win=131072 Len=0 TSval=4884 TSecr=4871"
"1904","4.931357","10.1.0.3","10.1.0.11","TCP","6376","0.006595000","-42 dBm","","49153  >  7005 [ACK] Seq=32501 Ack=1 Win=131072 Len=1500 TSval=4937 TSecr=4883"
"1905","4.931357","10.1.0.3","10.1.0.11","TCP","6376","0.000000000","-42 dBm","","49153  >  7005 [ACK] Seq=38501 Ack=1 Win=131072 Len=1500 TSval=4937 TSecr=4883"
"1906","4.931357","10.1.0.3","10.1.0.11","TCP","6376","0.000000000","-42 dBm","","49153  >  7005 [ACK] Seq=44501 Ack=1 Win=131072 Len=1500 TSval=4937 TSecr=4883"
"1907","4.931357","10.1.0.3","10.1.0.11","TCP","6376","0.000000000","-42 dBm","","49153  >  7005 [ACK] Seq=50501 Ack=1 Win=131072 Len=1500 TSval=4937 TSecr=4883"
"1908","4.931357","10.1.0.3","10.1.0.11","TCP","6376","0.000000000","-42 dBm","","49153  >  7005 [ACK] Seq=56501 Ack=1 Win=131072 Len=1500 TSval=4937 TSecr=4884"
"1909","4.931357","10.1.0.3","10.1.0.11","TCP","6376","0.000000000","-42 dBm","","49153  >  7005 [ACK] Seq=62501 Ack=1 Win=131072 Len=1500 TSval=4937 TSecr=4884"
"1910","4.931357","10.1.0.3","10.1.0.11","TCP","4800","0.000000000","-42 dBm","","49153  >  7005 [ACK] Seq=67001 Ack=1 Win=131072 Len=1500 TSval=4937 TSecr=4884"
"2026","4.948397","10.1.0.3","10.1.0.11","TCP","1972","0.017040000","-42 dBm","0.056297000,0.056297000,0.056297000,0.056297000,0.056297000,0.056297000,0.056297000,0.054373000,0.053301000,0.051470000,0.049885000,0.048149000,0.046645000,0.045061000,0.043476000,0.041924000,0.040803000,0.038883000,0.037027000,0.035973000,0.033985000,0.032249000,0.030242000,0.029138000,0.027433000","7004  >  49155 [ACK] Seq=1 Ack=101001 Win=131072 Len=0 TSval=4933 TSecr=4931"
"2053","4.951372","10.1.0.11","10.1.0.3","TCP","6376","0.002975000","","","49155  >  7004 [ACK] Seq=106501 Ack=1 Win=131072 Len=1500 TSval=4960 TSecr=4904"
"2054","4.951372","10.1.0.11","10.1.0.3","TCP","6376","0.000000000","","","49155  >  7004 [ACK] Seq=112501 Ack=1 Win=131072 Len=1500 TSval=4960 TSecr=4904"
"2055","4.951372","10.1.0.11","10.1.0.3","TCP","6376","0.000000000","","","49155  >  7004 [ACK] Seq=118501 Ack=1 Win=131072 Len=1500 TSval=4960 TSecr=4905"
"2056","4.951372","10.1.0.11","10.1.0.3","TCP","6376","0.000000000","","","49155  >  7004 [ACK] Seq=124501 Ack=1 Win=131072 Len=1500 TSval=4960 TSecr=4907"
"2057","4.951372","10.1.0.11","10.1.0.3","TCP","6376","0.000000000","","","49155  >  7004 [ACK] Seq=130501 Ack=1 Win=131072 Len=1500 TSval=4960 TSecr=4912"
"2058","4.951372","10.1.0.11","10.1.0.3","TCP","7528","0.000000000","","","49155  >  7004 [ACK] Seq=138001 Ack=1 Win=131072 Len=1000 TSval=4962 TSecr=4933"
"2099","4.960090","10.1.0.11","10.1.0.3","TCP","6528","0.008718000","","","49155  >  7004 [ACK] Seq=144001 Ack=1 Win=131072 Len=1000 TSval=4967 TSecr=4933"
"2100","4.960090","10.1.0.11","10.1.0.3","TCP","5452","0.000000000","","","49155  >  7004 [ACK] Seq=149001 Ack=1 Win=131072 Len=1000 TSval=4971 TSecr=4933"
"2110","4.961688","10.1.0.11","10.1.0.3","TCP","2224","0.001598000","","","49155  >  7004 [ACK] Seq=151001 Ack=1 Win=131072 Len=1000 TSval=4973 TSecr=4933"
"2118","4.962328","10.1.0.11","10.1.0.3","TCP","1134","0.000640000","","","49155  >  7004 [ACK] Seq=152001 Ack=1 Win=131072 Len=1000 TSval=4974 TSecr=4933"
"2126","4.962936","10.1.0.11","10.1.0.3","TCP","1134","0.000608000","","","49155  >  7004 [ACK] Seq=153001 Ack=1 Win=131072 Len=1000 TSval=4974 TSecr=4933"
"2135","4.963639","10.1.0.11","10.1.0.3","TCP","1134","0.000703000","","","49155  >  7004 [ACK] Seq=154001 Ack=1 Win=131072 Len=1000 TSval=4975 TSecr=4933"
"2153","4.965046","10.1.0.11","10.1.0.3","TCP","1134","0.001407000","","","49155  >  7004 [ACK] Seq=155001 Ack=1 Win=131072 Len=1000 TSval=4976 TSecr=4933"
"2180","4.969406","10.1.0.11","10.1.0.3","TCP","3300","0.004360000","","","49155  >  7004 [ACK] Seq=158001 Ack=1 Win=131072 Len=1000 TSval=4978 TSecr=4933"
"2506","5.001733","10.1.0.3","10.1.0.11","TCP","1516","0.032327000","-42 dBm","0.050361000,0.050361000,0.050361000,0.050361000,0.050361000,0.050361000,0.050361000,0.050361000,0.050361000,0.050361000,0.050361000,0.050361000,0.050361000,0.041643000,0.041643000,0.041643000,0.041643000,0.041643000,0.041643000","7004  >  49155 [ACK] Seq=1 Ack=150001 Win=131072 Len=0 TSval=4972 TSecr=4970"
"2507","5.001733","10.1.0.3","10.1.0.11","TCP","376","0.000000000","-42 dBm","0.040045000,0.038797000,0.036687000,0.032327000","7004  >  49155 [ACK] Seq=1 Ack=158001 Win=131072 Len=0 TSval=4981 TSecr=4977"
"2531","5.003601","10.1.0.11","10.1.0.3","TCP","6376","0.001868000","","","49155  >  7004 [ACK] Seq=163501 Ack=1 Win=131072 Len=1500 TSval=5013 TSecr=4963"
"2532","5.003601","10.1.0.11","10.1.0.3","TCP","6376","0.000000000","","","49155  >  7004 [ACK] Seq=169501 Ack=1 Win=131072 Len=1500 TSval=5013 TSecr=4964"
"2533","5.003601","10.1.0.11","10.1.0.3","TCP","6376","0.000000000","","","49155  >  7004 [ACK] Seq=175501 Ack=1 Win=131072 Len=1500 TSval=5013 TSecr=4964"
"2534","5.003601","10.1.0.11","10.1.0.3","TCP","6376","0.000000000","","","49155  >  7004 [ACK] Seq=181501 Ack=1 Win=131072 Len=1500 TSval=5013 TSecr=4964"
"2535","5.003601","10.1.0.11","10.1.0.3","TCP","6376","0.000000000","","","49155  >  7004 [ACK] Seq=187501 Ack=1 Win=131072 Len=1500 TSval=5013 TSecr=4964"
"2536","5.003601","10.1.0.11","10.1.0.3","TCP","6376","0.000000000","","","49155  >  7004 [ACK] Seq=193501 Ack=1 Win=131072 Len=1500 TSval=5013 TSecr=4964"
"2537","5.003601","10.1.0.11","10.1.0.3","TCP","7452","0.000000000","","","49155  >  7004 [ACK] Seq=201001 Ack=1 Win=131072 Len=1000 TSval=5013 TSecr=4972"
"2538","5.003601","10.1.0.11","10.1.0.3","TCP","3300","0.000000000","","","49155  >  7004 [ACK] Seq=204001 Ack=1 Win=131072 Len=1000 TSval=5015 TSecr=4981"
"2562","5.008830","10.1.0.11","10.1.0.3","TCP","6528","0.005229000","","","49155  >  7004 [ACK] Seq=210001 Ack=1 Win=131072 Len=1000 TSval=5020 TSecr=4981"
"2576","5.010758","10.1.0.11","10.1.0.3","TCP","3300","0.001928000","","","49155  >  7004 [ACK] Seq=213001 Ack=1 Win=131072 Len=1000 TSval=5022 TSecr=4981"
"2592","5.012135","10.1.0.11","10.1.0.3","TCP","1134","0.001377000","","","49155  >  7004 [ACK] Seq=214001 Ack=1 Win=131072 Len=1000 TSval=5023 TSecr=4981"
"2606","5.013295","10.1.0.11","10.1.0.3","TCP","2224","0.001160000","","","49155  >  7004 [ACK] Seq=216001 Ack=1 Win=131072 Len=1000 TSval=5025 TSecr=4981"
"2621","5.014806","10.1.0.11","10.1.0.3","TCP","2224","0.001511000","","","49155  >  7004 [ACK] Seq=218001 Ack=1 Win=131072 Len=1000 TSval=5026 TSecr=4981"
"2683","5.020248","10.1.0.3","10.1.0.11","TCP","1820","0.005442000","-42 dBm","0.016647000,0.016647000,0.016647000,0.016647000,0.016647000,0.016647000,0.016647000,0.016647000,0.016647000,0.016647000,0.016647000,0.016647000,0.016647000,0.016647000,0.016647000,0.016647000,0.011418000,0.011418000,0.011418000,0.009490000,0.009490000,0.006953000,0.005442000","7004  >  49155 [ACK] Seq=1 Ack=218001 Win=131072 Len=0 TSval=5027 TSecr=5025"
"2703","5.021972","10.1.0.11","10.1.0.3","TCP","7452","0.001724000","","","49155  >  7004 [ACK] Seq=225001 Ack=1 Win=131072 Len=1000 TSval=5032 TSecr=5027"
"2704","5.021972","10.1.0.11","10.1.0.3","TCP","2224","0.000000000","","","49155  >  7004 [ACK] Seq=227001 Ack=1 Win=131072 Len=1000 TSval=5034 TSecr=5027"
"2730","5.026677","10.1.0.11","10.1.0.3","TCP","5452","0.004705000","","","49155  >  7004 [ACK] Seq=232001 Ack=1 Win=131072 Len=1000 TSval=5038 TSecr=5027"
"2742","5.028101","10.1.0.11","10.1.0.3","TCP","2224","0.001424000","","","49155  >  7004 [ACK] Seq=234001 Ack=1 Win=131072 Len=1000 TSval=5039 TSecr=5027"
"2752","5.029021","10.1.0.11","10.1.0.3","TCP","1134","0.000920000","","","49155  >  7004 [ACK] Seq=235001 Ack=1 Win=131072 Len=1000 TSval=5040 TSecr=5027"
"2764","5.029998","10.1.0.11","10.1.0.3","TCP","2224","0.000977000","","","49155  >  7004 [ACK] Seq=237001 Ack=1 Win=131072 Len=1000 TSval=5042 TSecr=5027"
"2778","5.031222","10.1.0.11","10.1.0.3","TCP","1134","0.001224000","","","49155  >  7004 [ACK] Seq=238001 Ack=1 Win=131072 Len=1000 TSval=5042 TSecr=5027"
"2797","5.032767","10.1.0.11","10.1.0.3","TCP","2224","0.001545000","","","49155  >  7004 [ACK] Seq=240001 Ack=1 Win=131072 Len=1000 TSval=5044 TSecr=5027"
"2816","5.035027","10.1.0.11","10.1.0.3","TCP","3300","0.002260000","","","49155  >  7004 [ACK] Seq=243001 Ack=1 Win=131072 Len=1000 TSval=5046 TSecr=5027"
"2830","5.036443","10.1.0.11","10.1.0.3","TCP","2224","0.001416000","","","49155  >  7004 [ACK] Seq=245001 Ack=1 Win=131072 Len=1000 TSval=5048 TSecr=5027"
"2845","5.037842","10.1.0.3","10.1.0.11","TCP","1060","0.001399000","-42 dBm","0.015870000,0.015870000,0.015870000,0.015870000,0.011165000,0.011165000,0.009741000,0.008821000,0.007844000,0.005075000,0.002815000,0.002815000,0.001399000","7004  >  49155 [ACK] Seq=1 Ack=246001 Win=131072 Len=0 TSval=5048 TSecr=5047"
"2852","5.038366","10.1.0.11","10.1.0.3","TCP","2224","0.000524000","","","49155  >  7004 [ACK] Seq=247001 Ack=1 Win=131072 Len=1000 TSval=5050 TSecr=5048"
"2866","5.039654","10.1.0.11","10.1.0.3","TCP","2224","0.001288000","","","49155  >  7004 [ACK] Seq=249001 Ack=1 Win=131072 Len=1000 TSval=5051 TSecr=5048"
"2880","5.040878","10.1.0.11","10.1.0.3","TCP","1134","0.001224000","","","49155  >  7004 [ACK] Seq=250001 Ack=1 Win=131072 Len=1000 TSval=5052 TSecr=5048"
"2894","5.042006","10.1.0.11","10.1.0.3","TCP","2224","0.001128000","","","49155  >  7004 [ACK] Seq=252001 Ack=1 Win=131072 Len=1000 TSval=5054 TSecr=5048"
"2908","5.043198","10.1.0.11","10.1.0.3","TCP","1134","0.001192000","","","49155  >  7004 [ACK] Seq=253001 Ack=1 Win=131072 Len=1000 TSval=5054 TSecr=5048"
"2921","5.044196","10.1.0.11","10.1.0.3","TCP","1134","0.000998000","","","49155  >  7004 [ACK] Seq=254001 Ack=1 Win=131072 Len=1000 TSval=5055 TSecr=5048"
"2933","5.045172","10.1.0.11","10.1.0.3","TCP","2224","0.000976000","","","49155  >  7004 [ACK] Seq=256001 Ack=1 Win=131072 Len=1000 TSval=5057 TSecr=5048"
"2947","5.046333","10.1.0.11","10.1.0.3","TCP","1134","0.001161000","","","49155  >  7004 [ACK] Seq=257001 Ack=1 Win=131072 Len=1000 TSval=5058 TSecr=5048"
"2959","5.047245","10.1.0.11","10.1.0.3","TCP","1134","0.000912000","","","49155  >  7004 [ACK] Seq=258001 Ack=1 Win=131072 Len=1000 TSval=5058 TSecr=5048"
"2971","5.048157","10.1.0.11","10.1.0.3","TCP","1134","0.000912000","","","49155  >  7004 [ACK] Seq=259001 Ack=1 Win=131072 Len=1000 TSval=5059 TSecr=5048"
"2986","5.049546","10.1.0.11","10.1.0.3","TCP","2224","0.001389000","","","49155  >  7004 [ACK] Seq=261001 Ack=1 Win=131072 Len=1000 TSval=5061 TSecr=5048"
"3007","5.052670","10.1.0.11","10.1.0.3","TCP","4376","0.003124000","","","49155  >  7004 [ACK] Seq=265001 Ack=1 Win=131072 Len=1000 TSval=5064 TSecr=5048"
"3015","5.053662","10.1.0.11","10.1.0.3","TCP","1134","0.000992000","","","49155  >  7004 [ACK] Seq=266001 Ack=1 Win=131072 Len=1000 TSval=5065 TSecr=5048"
"3023","5.054270","10.1.0.11","10.1.0.3","TCP","1134","0.000608000","","","49155  >  7004 [ACK] Seq=267001 Ack=1 Win=131072 Len=1000 TSval=5066 TSecr=5048"
"3040","5.055638","10.1.0.11","10.1.0.3","TCP","2224","0.001368000","","","49155  >  7004 [ACK] Seq=269001 Ack=1 Win=131072 Len=1000 TSval=5067 TSecr=5048"
"3052","5.056659","10.1.0.11","10.1.0.3","TCP","1134","0.001021000","","","49155  >  7004 [ACK] Seq=270001 Ack=1 Win=131072 Len=1000 TSval=5068 TSecr=5048"
"3066","5.058512","10.1.0.11","10.1.0.3","TCP","2224","0.001853000","","","49155  >  7004 [ACK] Seq=272001 Ack=1 Win=131072 Len=1000 TSval=5070 TSecr=5048"
"3072","5.059032","10.1.0.11","10.1.0.3","TCP","1134","0.000520000","","","49155  >  7004 [ACK] Seq=273001 Ack=1 Win=131072 Len=1000 TSval=5070 TSecr=5048"
"3080","5.059640","10.1.0.11","10.1.0.3","TCP","1134","0.000608000","","","49155  >  7004 [ACK] Seq=274001 Ack=1 Win=131072 Len=1000 TSval=5071 TSecr=5048"
"3096","5.060798","10.1.0.11","10.1.0.3","TCP","1134","0.001158000","","","49155  >  7004 [ACK] Seq=275001 Ack=1 Win=131072 Len=1000 TSval=5072 TSecr=5048"
"3104","5.061694","10.1.0.3","10.1.0.11","TCP","908","0.000896000","-42 dBm","0.023328000,0.022040000,0.019688000,0.018496000,0.016522000,0.015361000,0.013537000,0.012148000,0.009024000,0.009024000,0.007424000","7004  >  49155 [ACK] Seq=1 Ack=268001 Win=131072 Len=0 TSval=5066 TSecr=5065"
"3105","5.061694","10.1.0.3","10.1.0.11","TCP","300","0.000000000","-42 dBm","0.006056000,0.003182000,0.002662000","7004  >  49155 [ACK] Seq=1 Ack=274001 Win=131072 Len=0 TSval=5071 TSecr=5070"
"3115","5.062317","10.1.0.11","10.1.0.3","TCP","1136","0.000623000","","","[TCP Retransmission] 49155  >  7004 [ACK] Seq=275001 Ack=1 Win=131072 Len=1000 TSval=5072 TSecr=5048"
"3116","5.062317","10.1.0.11","10.1.0.3","TCP","2224","0.000000000","","","49155  >  7004 [ACK] Seq=277001 Ack=1 Win=131072 Len=1000 TSval=5074 TSecr=5071"
"3118","5.062537","10.1.0.11","10.1.0.3","TCP","1134","0.000220000","","","[TCP Out-Of-Order] 49155  >  7004 [ACK] Seq=275001 Ack=1 Win=131072 Len=1000 TSval=5072 TSecr=5048"
"3140","5.065965","10.1.0.11","10.1.0.3","TCP","5452","0.003428000","","","49155  >  7004 [ACK] Seq=282001 Ack=1 Win=131072 Len=1000 TSval=5078 TSecr=5071"
"3157","5.068015","10.1.0.11","10.1.0.3","TCP","2224","0.002050000","","","49155  >  7004 [ACK] Seq=284001 Ack=1 Win=131072 Len=1000 TSval=5079 TSecr=5071"
"3169","5.069120","10.1.0.11","10.1.0.3","TCP","1134","0.001105000","","","49155  >  7004 [ACK] Seq=285001 Ack=1 Win=131072 Len=1000 TSval=5080 TSecr=5071"
"3179","5.069976","10.1.0.11","10.1.0.3","TCP","2224","0.000856000","","","49155  >  7004 [ACK] Seq=287001 Ack=1 Win=131072 Len=1000 TSval=5082 TSecr=5071"
"3195","5.071224","10.1.0.11","10.1.0.3","TCP","1134","0.001248000","","","49155  >  7004 [ACK] Seq=288001 Ack=1 Win=131072 Len=1000 TSval=5082 TSecr=5071"
"3207","5.072136","10.1.0.11","10.1.0.3","TCP","1134","0.000912000","","","49155  >  7004 [ACK] Seq=289001 Ack=1 Win=131072 Len=1000 TSval=5083 TSecr=5071"
"3219","5.073080","10.1.0.11","10.1.0.3","TCP","1134","0.000944000","","","49155  >  7004 [ACK] Seq=290001 Ack=1 Win=131072 Len=1000 TSval=5084 TSecr=5071"
"3229","5.074017","10.1.0.11","10.1.0.3","TCP","2224","0.000937000","","","49155  >  7004 [ACK] Seq=292001 Ack=1 Win=131072 Len=1000 TSval=5086 TSecr=5071"
"3245","5.075266","10.1.0.11","10.1.0.3","TCP","1134","0.001249000","","","49155  >  7004 [ACK] Seq=293001 Ack=1 Win=131072 Len=1000 TSval=5086 TSecr=5071"
"3257","5.076178","10.1.0.11","10.1.0.3","TCP","1134","0.000912000","","","49155  >  7004 [ACK] Seq=294001 Ack=1 Win=131072 Len=1000 TSval=5087 TSecr=5071"
"3269","5.077154","10.1.0.11","10.1.0.3","TCP","2224","0.000976000","","","49155  >  7004 [ACK] Seq=296001 Ack=1 Win=131072 Len=1000 TSval=5089 TSecr=5071"
"3283","5.078314","10.1.0.11","10.1.0.3","TCP","1134","0.001160000","","","49155  >  7004 [ACK] Seq=297001 Ack=1 Win=131072 Len=1000 TSval=5090 TSecr=5071"
"3295","5.079253","10.1.0.11","10.1.0.3","TCP","1134","0.000939000","","","49155  >  7004 [ACK] Seq=298001 Ack=1 Win=131072 Len=1000 TSval=5090 TSecr=5071"
"3307","5.080165","10.1.0.11","10.1.0.3","TCP","1134","0.000912000","","","49155  >  7004 [ACK] Seq=299001 Ack=1 Win=131072 Len=1000 TSval=5091 TSecr=5071"
"3319","5.081141","10.1.0.11","10.1.0.3","TCP","1134","0.000976000","","","49155  >  7004 [ACK] Seq=300001 Ack=1 Win=131072 Len=1000 TSval=5092 TSecr=5071"
"3327","5.081814","10.1.0.11","10.1.0.3","TCP","1134","0.000673000","","","49155  >  7004 [ACK] Seq=301001 Ack=1 Win=131072 Len=1000 TSval=5093 TSecr=5071"
"3335","5.082422","10.1.0.11","10.1.0.3","TCP","1134","0.000608000","","","49155  >  7004 [ACK] Seq=302001 Ack=1 Win=131072 Len=1000 TSval=5094 TSecr=5071"
"3347","5.083334","10.1.0.11","10.1.0.3","TCP","1134","0.000912000","","","49155  >  7004 [ACK] Seq=303001 Ack=1 Win=131072 Len=1000 TSval=5094 TSecr=5071"
"3360","5.084483","10.1.0.3","10.1.0.11","TCP","1212","0.001149000","-42 dBm","0.023685000,0.022166000,0.018518000,0.018518000,0.016468000,0.015363000,0.014507000,0.012347000,0.010466000,0.009217000,0.007329000,0.006169000,0.004318000,0.002669000,0.001149000","7004  >  49155 [ACK] Seq=1 Ack=304001 Win=131072 Len=0 TSval=5095 TSecr=5094"
"3366","5.084860","10.1.0.11","10.1.0.3","TCP","2224","0.000377000","","","49155  >  7004 [ACK] Seq=305001 Ack=1 Win=131072 Len=1000 TSval=5096 TSecr=5071"
"3378","5.085964","10.1.0.11","10.1.0.3","TCP","2224","0.001104000","","","49155  >  7004 [ACK] Seq=307001 Ack=1 Win=131072 Len=1000 TSval=5098 TSecr=5095"
"3390","5.087036","10.1.0.11","10.1.0.3","TCP","1134","0.001072000","","","49155  >  7004 [ACK] Seq=308001 Ack=1 Win=131072 Len=1000 TSval=5098 TSecr=5095"
"3402","5.087949","10.1.0.11","10.1.0.3","TCP","1134","0.000913000","","","49155  >  7004 [ACK] Seq=309001 Ack=1 Win=131072 Len=1000 TSval=5099 TSecr=5095"
"3414","5.088861","10.1.0.11","10.1.0.3","TCP","1134","0.000912000","","","49155  >  7004 [ACK] Seq=310001 Ack=1 Win=131072 Len=1000 TSval=5100 TSecr=5095"
"3426","5.089773","10.1.0.11","10.1.0.3","TCP","1134","0.000912000","","","49155  >  7004 [ACK] Seq=311001 Ack=1 Win=131072 Len=1000 TSval=5101 TSecr=5095"
"3442","5.091148","10.1.0.11","10.1.0.3","TCP","2224","0.001375000","","","49155  >  7004 [ACK] Seq=313001 Ack=1 Win=131072 Len=1000 TSval=5102 TSecr=5095"
"3465","5.094632","10.1.0.11","10.1.0.3","TCP","4376","0.003484000","","","49155  >  7004 [ACK] Seq=317001 Ack=1 Win=131072 Len=1000 TSval=5106 TSecr=5095"
"3477","5.096253","10.1.0.11","10.1.0.3","TCP","2224","0.001621000","","","49155  >  7004 [ACK] Seq=319001 Ack=1 Win=131072 Len=1000 TSval=5107 TSecr=5095"
"3489","5.097357","10.1.0.11","10.1.0.3","TCP","2224","0.001104000","","","49155  >  7004 [ACK] Seq=321001 Ack=1 Win=131072 Len=1000 TSval=5109 TSecr=5095"
"3501","5.098302","10.1.0.11","10.1.0.3","TCP","1134","0.000945000","","","49155  >  7004 [ACK] Seq=322001 Ack=1 Win=131072 Len=1000 TSval=5110 TSecr=5095"
"3513","5.099214","10.1.0.11","10.1.0.3","TCP","1134","0.000912000","","","49155  >  7004 [ACK] Seq=323001 Ack=1 Win=131072 Len=1000 TSval=5110 TSecr=5095"
"3525","5.100126","10.1.0.11","10.1.0.3","TCP","1134","0.000912000","","","49155  >  7004 [ACK] Seq=324001 Ack=1 Win=131072 Len=1000 TSval=5111 TSecr=5095"
"3537","5.101070","10.1.0.11","10.1.0.3","TCP","1134","0.000944000","","","49155  >  7004 [ACK] Seq=325001 Ack=1 Win=131072 Len=1000 TSval=5112 TSecr=5095"
"3545","5.101968","10.1.0.3","10.1.0.11","TCP","908","0.000898000","-42 dBm","0.017108000,0.016004000,0.014019000,0.012195000,0.010820000,0.007336000,0.007336000,0.005715000,0.004611000,0.002754000,0.000898000","7004  >  49155 [ACK] Seq=1 Ack=326001 Win=131072 Len=0 TSval=5113 TSecr=5111"
"3560","5.103283","10.1.0.11","10.1.0.3","TCP","3300","0.001315000","","","49155  >  7004 [ACK] Seq=328001 Ack=1 Win=131072 Len=1000 TSval=5114 TSecr=5113"
"3583","5.106784","10.1.0.11","10.1.0.3","TCP","5452","0.003501000","","","49155  >  7004 [ACK] Seq=333001 Ack=1 Win=131072 Len=1000 TSval=5118 TSecr=5113"
"3596","5.108426","10.1.0.11","10.1.0.3","TCP","2224","0.001642000","","","49155  >  7004 [ACK] Seq=335001 Ack=1 Win=131072 Len=1000 TSval=5120 TSecr=5113"
"3610","5.109554","10.1.0.11","10.1.0.3","TCP","1134","0.001128000","","","49155  >  7004 [ACK] Seq=336001 Ack=1 Win=131072 Len=1000 TSval=5121 TSecr=5113"
"3620","5.110314","10.1.0.11","10.1.0.3","TCP","1134","0.000760000","","","49155  >  7004 [ACK] Seq=337001 Ack=1 Win=131072 Len=1000 TSval=5122 TSecr=5113"
"3630","5.111074","10.1.0.11","10.1.0.3","TCP","1134","0.000760000","","","49155  >  7004 [ACK] Seq=338001 Ack=1 Win=131072 Len=1000 TSval=5122 TSecr=5113"
"3640","5.111834","10.1.0.11","10.1.0.3","TCP","1134","0.000760000","","","49155  >  7004 [ACK] Seq=339001 Ack=1 Win=131072 Len=1000 TSval=5123 TSecr=5113"
"3650","5.112594","10.1.0.11","10.1.0.3","TCP","1134","0.000760000","","","49155  >  7004 [ACK] Seq=340001 Ack=1 Win=131072 Len=1000 TSval=5124 TSecr=5113"
"3660","5.113355","10.1.0.11","10.1.0.3","TCP","1134","0.000761000","","","49155  >  7004 [ACK] Seq=341001 Ack=1 Win=131072 Len=1000 TSval=5125 TSecr=5113"
"3671","5.114571","10.1.0.11","10.1.0.3","TCP","1134","0.001216000","","","49155  >  7004 [ACK] Seq=342001 Ack=1 Win=131072 Len=1000 TSval=5126 TSecr=5113"
"3681","5.115331","10.1.0.11","10.1.0.3","TCP","1134","0.000760000","","","49155  >  7004 [ACK] Seq=343001 Ack=1 Win=131072 Len=1000 TSval=5126 TSecr=5113"
"3691","5.116091","10.1.0.11","10.1.0.3","TCP","1134","0.000760000","","","49155  >  7004 [ACK] Seq=344001 Ack=1 Win=131072 Len=1000 TSval=5127 TSecr=5113"
"3701","5.116851","10.1.0.11","10.1.0.3","TCP","1134","0.000760000","","","49155  >  7004 [ACK] Seq=345001 Ack=1 Win=131072 Len=1000 TSval=5128 TSecr=5113"
"3711","5.117611","10.1.0.11","10.1.0.3","TCP","1134","0.000760000","","","49155  >  7004 [ACK] Seq=346001 Ack=1 Win=131072 Len=1000 TSval=5129 TSecr=5113"
"3721","5.118371","10.1.0.11","10.1.0.3","TCP","1134","0.000760000","","","49155  >  7004 [ACK] Seq=347001 Ack=1 Win=131072 Len=1000 TSval=5130 TSecr=5113"
"3729","5.118980","10.1.0.11","10.1.0.3","TCP","1134","0.000609000","","","49155  >  7004 [ACK] Seq=348001 Ack=1 Win=131072 Len=1000 TSval=5130 TSecr=5113"
"3736","5.119616","10.1.0.3","10.1.0.11","TCP","908","0.000636000","-42 dBm","0.016333000,0.012832000,0.012832000,0.012832000,0.011190000,0.009302000,0.007782000,0.006261000,0.004285000,0.002765000,0.001245000","7004  >  49155 [ACK] Seq=1 Ack=348001 Win=131072 Len=0 TSval=5130 TSecr=5129"
"3746","5.120559","10.1.0.11","10.1.0.3","TCP","2224","0.000943000","","","49155  >  7004 [ACK] Seq=350001 Ack=1 Win=131072 Len=1000 TSval=5132 TSecr=5130"
"3754","5.121263","10.1.0.11","10.1.0.3","TCP","1134","0.000704000","","","49155  >  7004 [ACK] Seq=351001 Ack=1 Win=131072 Len=1000 TSval=5133 TSecr=5130"
"3767","5.122290","10.1.0.11","10.1.0.3","TCP","1134","0.001027000","","","49155  >  7004 [ACK] Seq=352001 Ack=1 Win=131072 Len=1000 TSval=5134 TSecr=5130"
"3775","5.122898","10.1.0.11","10.1.0.3","TCP","1134","0.000608000","","","49155  >  7004 [ACK] Seq=353001 Ack=1 Win=131072 Len=1000 TSval=5134 TSecr=5130"
"3787","5.123816","10.1.0.11","10.1.0.3","TCP","1134","0.000918000","","","49155  >  7004 [ACK] Seq=354001 Ack=1 Win=131072 Len=1000 TSval=5135 TSecr=5130"
"3799","5.124773","10.1.0.11","10.1.0.3","TCP","1134","0.000957000","","","49155  >  7004 [ACK] Seq=355001 Ack=1 Win=131072 Len=1000 TSval=5136 TSecr=5130"
"3818","5.127762","10.1.0.11","10.1.0.3","TCP","4376","0.002989000","","","49155  >  7004 [ACK] Seq=359001 Ack=1 Win=131072 Len=1000 TSval=5139 TSecr=5130"
"3826","5.128562","10.1.0.11","10.1.0.3","TCP","1134","0.000800000","","","49155  >  7004 [ACK] Seq=360001 Ack=1 Win=131072 Len=1000 TSval=5140 TSecr=5130"
"3858","5.131198","10.1.0.11","10.1.0.3","TCP","3300","0.002636000","","","49155  >  7004 [ACK] Seq=363001 Ack=1 Win=131072 Len=1000 TSval=5142 TSecr=5130"
"3886","5.135986","10.1.0.11","10.1.0.3","TCP","5452","0.004788000","","","49155  >  7004 [ACK] Seq=368001 Ack=1 Win=131072 Len=1000 TSval=5146 TSecr=5130"
"3899","5.137800","10.1.0.11","10.1.0.3","TCP","3300","0.001814000","","","49155  >  7004 [ACK] Seq=371001 Ack=1 Win=131072 Len=1000 TSval=5149 TSecr=5130"
"3911","5.139032","10.1.0.11","10.1.0.3","TCP","2224","0.001232000","","","49155  >  7004 [ACK] Seq=373001 Ack=1 Win=131072 Len=1000 TSval=5150 TSecr=5130"
"3925","5.140129","10.1.0.11","10.1.0.3","TCP","1134","0.001097000","","","49155  >  7004 [ACK] Seq=374001 Ack=1 Win=131072 Len=1000 TSval=5151 TSecr=5130"
"3937","5.141041","10.1.0.11","10.1.0.3","TCP","1134","0.000912000","","","49155  >  7004 [ACK] Seq=375001 Ack=1 Win=131072 Len=1000 TSval=5152 TSecr=5130"
"3966","5.144054","10.1.0.11","10.1.0.3","TCP","4376","0.003013000","","","49155  >  7004 [ACK] Seq=379001 Ack=1 Win=131072 Len=1000 TSval=5155 TSecr=5130"
"3978","5.145462","10.1.0.11","10.1.0.3","TCP","2224","0.001408000","","","49155  >  7004 [ACK] Seq=381001 Ack=1 Win=131072 Len=1000 TSval=5157 TSecr=5130"
"3990","5.146471","10.1.0.11","10.1.0.3","TCP","1134","0.001009000","","","49155  >  7004 [ACK] Seq=382001 Ack=1 Win=131072 Len=1000 TSval=5158 TSecr=5130"
"4002","5.147383","10.1.0.11","10.1.0.3","TCP","1134","0.000912000","","","49155  >  7004 [ACK] Seq=383001 Ack=1 Win=131072 Len=1000 TSval=5158 TSecr=5130"
"4014","5.148295","10.1.0.11","10.1.0.3","TCP","1134","0.000912000","","","49155  >  7004 [ACK] Seq=384001 Ack=1 Win=131072 Len=1000 TSval=5159 TSecr=5130"
"4026","5.149412","10.1.0.11","10.1.0.3","TCP","2224","0.001117000","","","49155  >  7004 [ACK] Seq=386001 Ack=1 Win=131072 Len=1000 TSval=5161 TSecr=5130"
"4038","5.150356","10.1.0.11","10.1.0.3","TCP","1134","0.000944000","","","49155  >  7004 [ACK] Seq=387001 Ack=1 Win=131072 Len=1000 TSval=5162 TSecr=5130"
"4050","5.151268","10.1.0.11","10.1.0.3","TCP","1134","0.000912000","","","49155  >  7004 [ACK] Seq=388001 Ack=1 Win=131072 Len=1000 TSval=5162 TSecr=5130"
"4062","5.152181","10.1.0.11","10.1.0.3","TCP","1134","0.000913000","","","49155  >  7004 [ACK] Seq=389001 Ack=1 Win=131072 Len=1000 TSval=5163 TSecr=5130"
"4074","5.153093","10.1.0.11","10.1.0.3","TCP","1134","0.000912000","","","49155  >  7004 [ACK] Seq=390001 Ack=1 Win=131072 Len=1000 TSval=5164 TSecr=5130"
"4090","5.154509","10.1.0.11","10.1.0.3","TCP","2224","0.001416000","","","49155  >  7004 [ACK] Seq=392001 Ack=1 Win=131072 Len=1000 TSval=5166 TSecr=5130"
"4102","5.155453","10.1.0.11","10.1.0.3","TCP","1134","0.000944000","","","49155  >  7004 [ACK] Seq=393001 Ack=1 Win=131072 Len=1000 TSval=5166 TSecr=5130"
"4114","5.156365","10.1.0.11","10.1.0.3","TCP","2224","0.000912000","","","49155  >  7004 [ACK] Seq=395001 Ack=1 Win=131072 Len=1000 TSval=5168 TSecr=5130"
"4126","5.157469","10.1.0.11","10.1.0.3","TCP","1134","0.001104000","","","49155  >  7004 [ACK] Seq=396001 Ack=1 Win=131072 Len=1000 TSval=5169 TSecr=5130"
"4138","5.158382","10.1.0.11","10.1.0.3","TCP","1134","0.000913000","","","49155  >  7004 [ACK] Seq=397001 Ack=1 Win=131072 Len=1000 TSval=5170 TSecr=5130"
"4150","5.159294","10.1.0.11","10.1.0.3","TCP","1134","0.000912000","","","49155  >  7004 [ACK] Seq=398001 Ack=1 Win=131072 Len=1000 TSval=5170 TSecr=5130"
"4162","5.160233","10.1.0.11","10.1.0.3","TCP","1134","0.000939000","","","49155  >  7004 [ACK] Seq=399001 Ack=1 Win=131072 Len=1000 TSval=5171 TSecr=5130"
"4174","5.161145","10.1.0.11","10.1.0.3","TCP","1134","0.000912000","","","49155  >  7004 [ACK] Seq=400001 Ack=1 Win=131072 Len=1000 TSval=5172 TSecr=5130"
"4186","5.162217","10.1.0.11","10.1.0.3","TCP","2224","0.001072000","","","49155  >  7004 [ACK] Seq=402001 Ack=1 Win=131072 Len=1000 TSval=5174 TSecr=5130"
"4198","5.163161","10.1.0.11","10.1.0.3","TCP","1134","0.000944000","","","49155  >  7004 [ACK] Seq=403001 Ack=1 Win=131072 Len=1000 TSval=5174 TSecr=5130"
"4210","5.164074","10.1.0.11","10.1.0.3","TCP","1134","0.000913000","","","49155  >  7004 [ACK] Seq=404001 Ack=1 Win=131072 Len=1000 TSval=5175 TSecr=5130"
"4222","5.164986","10.1.0.11","10.1.0.3","TCP","1134","0.000912000","","","49155  >  7004 [ACK] Seq=405001 Ack=1 Win=131072 Len=1000 TSval=5176 TSecr=5130"
"4248","5.167504","10.1.0.11","10.1.0.3","TCP","3300","0.002518000","","","49155  >  7004 [ACK] Seq=408001 Ack=1 Win=131072 Len=1000 TSval=5178 TSecr=5130"
"4270","5.171252","10.1.0.11","10.1.0.3","TCP","5452","0.003748000","","","49155  >  7004 [ACK] Seq=413001 Ack=1 Win=131072 Len=1000 TSval=5182 TSecr=5130"
"4292","5.173158","10.1.0.11","10.1.0.3","TCP","3300","0.001906000","","","49155  >  7004 [ACK] Seq=416001 Ack=1 Win=131072 Len=1000 TSval=5185 TSecr=5130"
"4307","5.174755","10.1.0.11","10.1.0.3","TCP","2224","0.001597000","","","49155  >  7004 [ACK] Seq=418001 Ack=1 Win=131072 Len=1000 TSval=5186 TSecr=5130"
"4321","5.175915","10.1.0.11","10.1.0.3","TCP","1134","0.001160000","","","49155  >  7004 [ACK] Seq=419001 Ack=1 Win=131072 Len=1000 TSval=5187 TSecr=5130"
"4731","5.209472","10.1.0.11","10.1.0.3","TCP","1136","0.033557000","","0.278115000,0.278115000,0.278115000,0.278115000,0.278115000,0.278115000,0.278115000,0.278115000,0.278115000,0.278115000,0.278115000,0.278115000,0.278115000,0.278115000","7005  >  49153 [ACK] Seq=1 Ack=68501 Win=131072 Len=0 TSval=4943 TSecr=4937"
"4861","5.235730","10.1.0.3","10.1.0.11","TCP","6376","0.026258000","-42 dBm","","49153  >  7005 [ACK] Seq=73001 Ack=1 Win=131072 Len=1500 TSval=5221 TSecr=4942"
"4862","5.235730","10.1.0.3","10.1.0.11","TCP","6376","0.000000000","-42 dBm","","49153  >  7005 [ACK] Seq=79001 Ack=1 Win=131072 Len=1500 TSval=5221 TSecr=4942"
"4863","5.235730","10.1.0.3","10.1.0.11","TCP","6376","0.000000000","-42 dBm","","49153  >  7005 [ACK] Seq=85001 Ack=1 Win=131072 Len=1500 TSval=5221 TSecr=4942"
"4864","5.235730","10.1.0.3","10.1.0.11","TCP","6376","0.000000000","-42 dBm","","49153  >  7005 [ACK] Seq=91001 Ack=1 Win=131072 Len=1500 TSval=5221 TSecr=4942"
"4865","5.235730","10.1.0.3","10.1.0.11","TCP","6376","0.000000000","-42 dBm","","49153  >  7005 [ACK] Seq=97001 Ack=1 Win=131072 Len=1500 TSval=5221 TSecr=4942"
"4866","5.235730","10.1.0.3","10.1.0.11","TCP","6376","0.000000000","-42 dBm","","49153  >  7005 [ACK] Seq=103001 Ack=1 Win=131072 Len=1500 TSval=5221 TSecr=4943"
